Frame 1: 64 bytes on wire (512 bits), 64 bytes captured (512 bits) on interface 0
    Interface id: 0 (unknown)
        Interface name: unknown
    Encapsulation type: USB packets with Linux header and padding (115)
    Arrival Time: Jul  1, 2018 15:33:44.861933000 EDT
    [Time shift for this packet: 0.000000000 seconds]
    Epoch Time: 1530473624.861933000 seconds
    [Time delta from previous captured frame: 0.000000000 seconds]
    [Time delta from previous displayed frame: 0.000000000 seconds]
    [Time since reference or first frame: 0.000000000 seconds]
    Frame Number: 1
    Frame Length: 64 bytes (512 bits)
    Capture Length: 64 bytes (512 bits)
    [Frame is marked: False]
    [Frame is ignored: False]
    [Protocols in frame: usb]
USB URB
    [Source: host]
    [Destination: 3.2.0]
    URB id: 0xffff89fb745266c0
    URB type: URB_SUBMIT ('S')
    URB transfer type: URB_CONTROL (0x02)
    Endpoint: 0x80, Direction: IN
        1... .... = Direction: IN (1)
        .... 0000 = Endpoint number: 0
    Device: 2
    URB bus id: 3
    Device setup request: relevant (0)
    Data: not present ('<')
    URB sec: 1530473624
    URB usec: 861933
    URB status: Operation now in progress (-EINPROGRESS) (-115)
    URB length [bytes]: 40
    Data length [bytes]: 0
    [Response in: 2]
    Interval: 0
    Start frame: 0
    Copy of Transfer Flags: 0x00000200
    Number of ISO descriptors: 0
URB setup
    bmRequestType: 0x80
        1... .... = Direction: Device-to-host
        .00. .... = Type: Standard (0x0)
        ...0 0000 = Recipient: Device (0x00)
    bRequest: GET DESCRIPTOR (6)
    Descriptor Index: 0x00
    bDescriptorType: 0x01
    Language Id: no language specified (0x0000)
    wLength: 40

0000  c0 66 52 74 fb 89 ff ff 53 02 80 02 03 00 00 3c   .fRt....S......<
0010  98 2c 39 5b 00 00 00 00 ed 26 0d 00 8d ff ff ff   .,9[.....&......
0020  28 00 00 00 00 00 00 00 80 06 00 01 00 00 28 00   (.............(.
0030  00 00 00 00 00 00 00 00 00 02 00 00 00 00 00 00   ................

Frame 2: 82 bytes on wire (656 bits), 82 bytes captured (656 bits) on interface 0
    Interface id: 0 (unknown)
        Interface name: unknown
    Encapsulation type: USB packets with Linux header and padding (115)
    Arrival Time: Jul  1, 2018 15:33:44.864903000 EDT
    [Time shift for this packet: 0.000000000 seconds]
    Epoch Time: 1530473624.864903000 seconds
    [Time delta from previous captured frame: 0.002970000 seconds]
    [Time delta from previous displayed frame: 0.002970000 seconds]
    [Time since reference or first frame: 0.002970000 seconds]
    Frame Number: 2
    Frame Length: 82 bytes (656 bits)
    Capture Length: 82 bytes (656 bits)
    [Frame is marked: False]
    [Frame is ignored: False]
    [Protocols in frame: usb]
USB URB
    [Source: 3.2.0]
    [Destination: host]
    URB id: 0xffff89fb745266c0
    URB type: URB_COMPLETE ('C')
    URB transfer type: URB_CONTROL (0x02)
    Endpoint: 0x80, Direction: IN
        1... .... = Direction: IN (1)
        .... 0000 = Endpoint number: 0
    Device: 2
    URB bus id: 3
    Device setup request: not relevant ('-')
    Data: present (0)
    URB sec: 1530473624
    URB usec: 864903
    URB status: Success (0)
    URB length [bytes]: 18
    Data length [bytes]: 18
    [Request in: 1]
    [Time from request: 0.002970000 seconds]
    Unused Setup Header
    Interval: 0
    Start frame: 0
    Copy of Transfer Flags: 0x00000200
    Number of ISO descriptors: 0
DEVICE DESCRIPTOR
    bLength: 18
    bDescriptorType: 0x01 (DEVICE)
    bcdUSB: 0x0200
    bDeviceClass: Device (0x00)
    bDeviceSubClass: 0
    bDeviceProtocol: 0 (Use class code info from Interface Descriptors)
    bMaxPacketSize0: 64
    idVendor: Graphtec America, Inc. (0x0b4d)
    idProduct: Unknown (0x112f)
    bcdDevice: 0x0100
    iManufacturer: 0
    iProduct: 0
    iSerialNumber: 1
    bNumConfigurations: 1

0000  c0 66 52 74 fb 89 ff ff 43 02 80 02 03 00 2d 00   .fRt....C.....-.
0010  98 2c 39 5b 00 00 00 00 87 32 0d 00 00 00 00 00   .,9[.....2......
0020  12 00 00 00 12 00 00 00 00 00 00 00 00 00 00 00   ................
0030  00 00 00 00 00 00 00 00 00 02 00 00 00 00 00 00   ................
0040  12 01 00 02 00 00 00 40 4d 0b 2f 11 00 01 00 00   .......@M./.....
0050  01 01                                             ..

Frame 3: 65 bytes on wire (520 bits), 65 bytes captured (520 bits) on interface 0
    Interface id: 0 (unknown)
        Interface name: unknown
    Encapsulation type: USB packets with Linux header and padding (115)
    Arrival Time: Jul  1, 2018 15:33:52.110229000 EDT
    [Time shift for this packet: 0.000000000 seconds]
    Epoch Time: 1530473632.110229000 seconds
    [Time delta from previous captured frame: 7.245326000 seconds]
    [Time delta from previous displayed frame: 7.245326000 seconds]
    [Time since reference or first frame: 7.248296000 seconds]
    Frame Number: 3
    Frame Length: 65 bytes (520 bits)
    Capture Length: 65 bytes (520 bits)
    [Frame is marked: False]
    [Frame is ignored: False]
    [Protocols in frame: usb]
USB URB
    [Source: 3.1.1]
    [Destination: host]
    URB id: 0xffff89fd49658d80
    URB type: URB_COMPLETE ('C')
    URB transfer type: URB_INTERRUPT (0x01)
    Endpoint: 0x81, Direction: IN
        1... .... = Direction: IN (1)
        .... 0001 = Endpoint number: 1
    Device: 1
    URB bus id: 3
    Device setup request: not relevant ('-')
    Data: present (0)
    URB sec: 1530473632
    URB usec: 110229
    URB status: Success (0)
    URB length [bytes]: 1
    Data length [bytes]: 1
    [bInterfaceClass: Unknown (0xffff)]
    Unused Setup Header
    Interval: 2048
    Start frame: 0
    Copy of Transfer Flags: 0x00000200
    Number of ISO descriptors: 0
Leftover Capture Data: 02

0000  80 8d 65 49 fd 89 ff ff 43 01 81 01 03 00 2d 00   ..eI....C.....-.
0010  a0 2c 39 5b 00 00 00 00 95 ae 01 00 00 00 00 00   .,9[............
0020  01 00 00 00 01 00 00 00 00 00 00 00 00 00 00 00   ................
0030  00 08 00 00 00 00 00 00 00 02 00 00 00 00 00 00   ................
0040  02                                                .

Packet comments
    POWER ON

        [Expert Info (Comment/Comment): POWER ON
]
            [POWER ON
]
            [Severity level: Comment]
            [Group: Comment]
Frame 4: 64 bytes on wire (512 bits), 64 bytes captured (512 bits) on interface 0
    Interface id: 0 (unknown)
        Interface name: unknown
    Encapsulation type: USB packets with Linux header and padding (115)
    Arrival Time: Jul  1, 2018 15:33:52.110262000 EDT
    [Time shift for this packet: 0.000000000 seconds]
    Epoch Time: 1530473632.110262000 seconds
    [Time delta from previous captured frame: 0.000033000 seconds]
    [Time delta from previous displayed frame: 0.000033000 seconds]
    [Time since reference or first frame: 7.248329000 seconds]
    Frame Number: 4
    Frame Length: 64 bytes (512 bits)
    Capture Length: 64 bytes (512 bits)
    [Frame is marked: False]
    [Frame is ignored: False]
    [Protocols in frame: usb]
USB URB
    [Source: host]
    [Destination: 3.1.1]
    URB id: 0xffff89fd49658d80
    URB type: URB_SUBMIT ('S')
    URB transfer type: URB_INTERRUPT (0x01)
    Endpoint: 0x81, Direction: IN
        1... .... = Direction: IN (1)
        .... 0001 = Endpoint number: 1
    Device: 1
    URB bus id: 3
    Device setup request: not relevant ('-')
    Data: not present ('<')
    URB sec: 1530473632
    URB usec: 110262
    URB status: Operation now in progress (-EINPROGRESS) (-115)
    URB length [bytes]: 4
    Data length [bytes]: 0
    [Response in: 19]
    [bInterfaceClass: Unknown (0xffff)]
    Unused Setup Header
    Interval: 2048
    Start frame: 0
    Copy of Transfer Flags: 0x00000200
    Number of ISO descriptors: 0

0000  80 8d 65 49 fd 89 ff ff 53 01 81 01 03 00 2d 3c   ..eI....S.....-<
0010  a0 2c 39 5b 00 00 00 00 b6 ae 01 00 8d ff ff ff   .,9[............
0020  04 00 00 00 00 00 00 00 00 00 00 00 00 00 00 00   ................
0030  00 08 00 00 00 00 00 00 00 02 00 00 00 00 00 00   ................

Frame 5: 64 bytes on wire (512 bits), 64 bytes captured (512 bits) on interface 0
    Interface id: 0 (unknown)
        Interface name: unknown
    Encapsulation type: USB packets with Linux header and padding (115)
    Arrival Time: Jul  1, 2018 15:33:52.110298000 EDT
    [Time shift for this packet: 0.000000000 seconds]
    Epoch Time: 1530473632.110298000 seconds
    [Time delta from previous captured frame: 0.000036000 seconds]
    [Time delta from previous displayed frame: 0.000036000 seconds]
    [Time since reference or first frame: 7.248365000 seconds]
    Frame Number: 5
    Frame Length: 64 bytes (512 bits)
    Capture Length: 64 bytes (512 bits)
    [Frame is marked: False]
    [Frame is ignored: False]
    [Protocols in frame: usb:usbhub]
USB URB
    [Source: host]
    [Destination: 3.1.0]
    URB id: 0xffff89fbe8d2e540
    URB type: URB_SUBMIT ('S')
    URB transfer type: URB_CONTROL (0x02)
    Endpoint: 0x80, Direction: IN
        1... .... = Direction: IN (1)
        .... 0000 = Endpoint number: 0
    Device: 1
    URB bus id: 3
    Device setup request: relevant (0)
    Data: not present ('<')
    URB sec: 1530473632
    URB usec: 110298
    URB status: Operation now in progress (-EINPROGRESS) (-115)
    URB length [bytes]: 4
    Data length [bytes]: 0
    [Response in: 6]
    Interval: 0
    Start frame: 0
    Copy of Transfer Flags: 0x00000200
    Number of ISO descriptors: 0
    [bInterfaceClass: Unknown (0xffff)]
URB setup
    bmRequestType: 0xa3
        1... .... = Direction: Device-to-host
        .01. .... = Type: Class (0x1)
        ...0 0011 = Recipient: Other (0x03)
bRequest: GET_STATUS (0x00)
wValue: 0x0000
    (zero): 0
wIndex: 1
    Port: 1
wLength: 4

0000  40 e5 d2 e8 fb 89 ff ff 53 02 80 01 03 00 00 3c   @.......S......<
0010  a0 2c 39 5b 00 00 00 00 da ae 01 00 8d ff ff ff   .,9[............
0020  04 00 00 00 00 00 00 00 a3 00 00 00 01 00 04 00   ................
0030  00 00 00 00 00 00 00 00 00 02 00 00 00 00 00 00   ................

Frame 6: 68 bytes on wire (544 bits), 68 bytes captured (544 bits) on interface 0
    Interface id: 0 (unknown)
        Interface name: unknown
    Encapsulation type: USB packets with Linux header and padding (115)
    Arrival Time: Jul  1, 2018 15:33:52.110319000 EDT
    [Time shift for this packet: 0.000000000 seconds]
    Epoch Time: 1530473632.110319000 seconds
    [Time delta from previous captured frame: 0.000021000 seconds]
    [Time delta from previous displayed frame: 0.000021000 seconds]
    [Time since reference or first frame: 7.248386000 seconds]
    Frame Number: 6
    Frame Length: 68 bytes (544 bits)
    Capture Length: 68 bytes (544 bits)
    [Frame is marked: False]
    [Frame is ignored: False]
    [Protocols in frame: usb:usbhub]
USB URB
    [Source: 3.1.0]
    [Destination: host]
    URB id: 0xffff89fbe8d2e540
    URB type: URB_COMPLETE ('C')
    URB transfer type: URB_CONTROL (0x02)
    Endpoint: 0x80, Direction: IN
        1... .... = Direction: IN (1)
        .... 0000 = Endpoint number: 0
    Device: 1
    URB bus id: 3
    Device setup request: not relevant ('-')
    Data: present (0)
    URB sec: 1530473632
    URB usec: 110319
    URB status: Success (0)
    URB length [bytes]: 4
    Data length [bytes]: 4
    [Request in: 5]
    [Time from request: 0.000021000 seconds]
    Unused Setup Header
    Interval: 0
    Start frame: 0
    Copy of Transfer Flags: 0x00000200
    Number of ISO descriptors: 0
    [bInterfaceClass: Unknown (0xffff)]
Port Status: 0x0100, PORT_POWER
    .... .... .... ...0 = PORT_CONNECTION: False
    .... .... .... ..0. = PORT_ENABLE: False
    .... .... .... .0.. = PORT_SUSPEND: False
    .... .... .... 0... = PORT_OVER_CURRENT: False
    .... .... ...0 .... = PORT_RESET: False
    .... ...1 .... .... = PORT_POWER: True
    .... ..0. .... .... = PORT_LOW_SPEED: False
    .... .0.. .... .... = PORT_HIGH_SPEED: False
    .... 0... .... .... = PORT_TEST: False
    ...0 .... .... .... = PORT_INDICATOR: Default colors
Port Change: 0x0001, C_PORT_CONNECTION
    .... .... .... ...1 = C_PORT_CONNECTION: True
    .... .... .... ..0. = C_PORT_ENABLE: False
    .... .... .... .0.. = C_PORT_SUSPEND: False
    .... .... .... 0... = C_PORT_OVER_CURRENT: False
    .... .... ...0 .... = C_PORT_RESET: False

0000  40 e5 d2 e8 fb 89 ff ff 43 02 80 01 03 00 2d 00   @.......C.....-.
0010  a0 2c 39 5b 00 00 00 00 ef ae 01 00 00 00 00 00   .,9[............
0020  04 00 00 00 04 00 00 00 00 00 00 00 00 00 00 00   ................
0030  00 00 00 00 00 00 00 00 00 02 00 00 00 00 00 00   ................
0040  00 01 01 00                                       ....

Frame 7: 64 bytes on wire (512 bits), 64 bytes captured (512 bits) on interface 0
    Interface id: 0 (unknown)
        Interface name: unknown
    Encapsulation type: USB packets with Linux header and padding (115)
    Arrival Time: Jul  1, 2018 15:33:52.110329000 EDT
    [Time shift for this packet: 0.000000000 seconds]
    Epoch Time: 1530473632.110329000 seconds
    [Time delta from previous captured frame: 0.000010000 seconds]
    [Time delta from previous displayed frame: 0.000010000 seconds]
    [Time since reference or first frame: 7.248396000 seconds]
    Frame Number: 7
    Frame Length: 64 bytes (512 bits)
    Capture Length: 64 bytes (512 bits)
    [Frame is marked: False]
    [Frame is ignored: False]
    [Protocols in frame: usb:usbhub]
USB URB
    [Source: host]
    [Destination: 3.1.0]
    URB id: 0xffff89fbe8d2e540
    URB type: URB_SUBMIT ('S')
    URB transfer type: URB_CONTROL (0x02)
    Endpoint: 0x00, Direction: OUT
        0... .... = Direction: OUT (0)
        .... 0000 = Endpoint number: 0
    Device: 1
    URB bus id: 3
    Device setup request: relevant (0)
    Data: present (0)
    URB sec: 1530473632
    URB usec: 110329
    URB status: Operation now in progress (-EINPROGRESS) (-115)
    URB length [bytes]: 0
    Data length [bytes]: 0
    [Response in: 8]
    Interval: 0
    Start frame: 0
    Copy of Transfer Flags: 0x00000000
    Number of ISO descriptors: 0
    [bInterfaceClass: Unknown (0xffff)]
URB setup
    bmRequestType: 0x23
        0... .... = Direction: Host-to-device
        .01. .... = Type: Class (0x1)
        ...0 0011 = Recipient: Other (0x03)
bRequest: CLEAR_FEATURE (0x01)
wValue: 0x0010
    PortFeatureSelector: C_PORT_CONNECTION (16)
wIndex: 1
    Port: 1
    PortSelector: 0
wLength: 0
    (zero): 0

0000  40 e5 d2 e8 fb 89 ff ff 53 02 00 01 03 00 00 00   @.......S.......
0010  a0 2c 39 5b 00 00 00 00 f9 ae 01 00 8d ff ff ff   .,9[............
0020  00 00 00 00 00 00 00 00 23 01 10 00 01 00 00 00   ........#.......
0030  00 00 00 00 00 00 00 00 00 00 00 00 00 00 00 00   ................

Frame 8: 64 bytes on wire (512 bits), 64 bytes captured (512 bits) on interface 0
    Interface id: 0 (unknown)
        Interface name: unknown
    Encapsulation type: USB packets with Linux header and padding (115)
    Arrival Time: Jul  1, 2018 15:33:52.110340000 EDT
    [Time shift for this packet: 0.000000000 seconds]
    Epoch Time: 1530473632.110340000 seconds
    [Time delta from previous captured frame: 0.000011000 seconds]
    [Time delta from previous displayed frame: 0.000011000 seconds]
    [Time since reference or first frame: 7.248407000 seconds]
    Frame Number: 8
    Frame Length: 64 bytes (512 bits)
    Capture Length: 64 bytes (512 bits)
    [Frame is marked: False]
    [Frame is ignored: False]
    [Protocols in frame: usb]
USB URB
    [Source: 3.1.0]
    [Destination: host]
    URB id: 0xffff89fbe8d2e540
    URB type: URB_COMPLETE ('C')
    URB transfer type: URB_CONTROL (0x02)
    Endpoint: 0x00, Direction: OUT
        0... .... = Direction: OUT (0)
        .... 0000 = Endpoint number: 0
    Device: 1
    URB bus id: 3
    Device setup request: not relevant ('-')
    Data: not present ('>')
    URB sec: 1530473632
    URB usec: 110340
    URB status: Success (0)
    URB length [bytes]: 0
    Data length [bytes]: 0
    [Request in: 7]
    [Time from request: 0.000011000 seconds]
    Unused Setup Header
    Interval: 0
    Start frame: 0
    Copy of Transfer Flags: 0x00000000
    Number of ISO descriptors: 0
    [bInterfaceClass: Unknown (0xffff)]

0000  40 e5 d2 e8 fb 89 ff ff 43 02 00 01 03 00 2d 3e   @.......C.....->
0010  a0 2c 39 5b 00 00 00 00 04 af 01 00 00 00 00 00   .,9[............
0020  00 00 00 00 00 00 00 00 00 00 00 00 00 00 00 00   ................
0030  00 00 00 00 00 00 00 00 00 00 00 00 00 00 00 00   ................

Frame 9: 64 bytes on wire (512 bits), 64 bytes captured (512 bits) on interface 0
    Interface id: 0 (unknown)
        Interface name: unknown
    Encapsulation type: USB packets with Linux header and padding (115)
    Arrival Time: Jul  1, 2018 15:33:52.113486000 EDT
    [Time shift for this packet: 0.000000000 seconds]
    Epoch Time: 1530473632.113486000 seconds
    [Time delta from previous captured frame: 0.003146000 seconds]
    [Time delta from previous displayed frame: 0.003146000 seconds]
    [Time since reference or first frame: 7.251553000 seconds]
    Frame Number: 9
    Frame Length: 64 bytes (512 bits)
    Capture Length: 64 bytes (512 bits)
    [Frame is marked: False]
    [Frame is ignored: False]
    [Protocols in frame: usb:usbhub]
USB URB
    [Source: host]
    [Destination: 3.1.0]
    URB id: 0xffff89fbe8d2e540
    URB type: URB_SUBMIT ('S')
    URB transfer type: URB_CONTROL (0x02)
    Endpoint: 0x80, Direction: IN
        1... .... = Direction: IN (1)
        .... 0000 = Endpoint number: 0
    Device: 1
    URB bus id: 3
    Device setup request: relevant (0)
    Data: not present ('<')
    URB sec: 1530473632
    URB usec: 113486
    URB status: Operation now in progress (-EINPROGRESS) (-115)
    URB length [bytes]: 4
    Data length [bytes]: 0
    [Response in: 10]
    Interval: 0
    Start frame: 0
    Copy of Transfer Flags: 0x00000200
    Number of ISO descriptors: 0
    [bInterfaceClass: Unknown (0xffff)]
URB setup
    bmRequestType: 0xa3
        1... .... = Direction: Device-to-host
        .01. .... = Type: Class (0x1)
        ...0 0011 = Recipient: Other (0x03)
bRequest: GET_STATUS (0x00)
wValue: 0x0000
    (zero): 0
wIndex: 1
    Port: 1
wLength: 4

0000  40 e5 d2 e8 fb 89 ff ff 53 02 80 01 03 00 00 3c   @.......S......<
0010  a0 2c 39 5b 00 00 00 00 4e bb 01 00 8d ff ff ff   .,9[....N.......
0020  04 00 00 00 00 00 00 00 a3 00 00 00 01 00 04 00   ................
0030  00 00 00 00 00 00 00 00 00 02 00 00 00 00 00 00   ................

Frame 10: 68 bytes on wire (544 bits), 68 bytes captured (544 bits) on interface 0
    Interface id: 0 (unknown)
        Interface name: unknown
    Encapsulation type: USB packets with Linux header and padding (115)
    Arrival Time: Jul  1, 2018 15:33:52.113519000 EDT
    [Time shift for this packet: 0.000000000 seconds]
    Epoch Time: 1530473632.113519000 seconds
    [Time delta from previous captured frame: 0.000033000 seconds]
    [Time delta from previous displayed frame: 0.000033000 seconds]
    [Time since reference or first frame: 7.251586000 seconds]
    Frame Number: 10
    Frame Length: 68 bytes (544 bits)
    Capture Length: 68 bytes (544 bits)
    [Frame is marked: False]
    [Frame is ignored: False]
    [Protocols in frame: usb:usbhub]
USB URB
    [Source: 3.1.0]
    [Destination: host]
    URB id: 0xffff89fbe8d2e540
    URB type: URB_COMPLETE ('C')
    URB transfer type: URB_CONTROL (0x02)
    Endpoint: 0x80, Direction: IN
        1... .... = Direction: IN (1)
        .... 0000 = Endpoint number: 0
    Device: 1
    URB bus id: 3
    Device setup request: not relevant ('-')
    Data: present (0)
    URB sec: 1530473632
    URB usec: 113519
    URB status: Success (0)
    URB length [bytes]: 4
    Data length [bytes]: 4
    [Request in: 9]
    [Time from request: 0.000033000 seconds]
    Unused Setup Header
    Interval: 0
    Start frame: 0
    Copy of Transfer Flags: 0x00000200
    Number of ISO descriptors: 0
    [bInterfaceClass: Unknown (0xffff)]
Port Status: 0x0100, PORT_POWER
    .... .... .... ...0 = PORT_CONNECTION: False
    .... .... .... ..0. = PORT_ENABLE: False
    .... .... .... .0.. = PORT_SUSPEND: False
    .... .... .... 0... = PORT_OVER_CURRENT: False
    .... .... ...0 .... = PORT_RESET: False
    .... ...1 .... .... = PORT_POWER: True
    .... ..0. .... .... = PORT_LOW_SPEED: False
    .... .0.. .... .... = PORT_HIGH_SPEED: False
    .... 0... .... .... = PORT_TEST: False
    ...0 .... .... .... = PORT_INDICATOR: Default colors
Port Change: 0x0000
    .... .... .... ...0 = C_PORT_CONNECTION: False
    .... .... .... ..0. = C_PORT_ENABLE: False
    .... .... .... .0.. = C_PORT_SUSPEND: False
    .... .... .... 0... = C_PORT_OVER_CURRENT: False
    .... .... ...0 .... = C_PORT_RESET: False

0000  40 e5 d2 e8 fb 89 ff ff 43 02 80 01 03 00 2d 00   @.......C.....-.
0010  a0 2c 39 5b 00 00 00 00 6f bb 01 00 00 00 00 00   .,9[....o.......
0020  04 00 00 00 04 00 00 00 00 00 00 00 00 00 00 00   ................
0030  00 00 00 00 00 00 00 00 00 02 00 00 00 00 00 00   ................
0040  00 01 00 00                                       ....

Frame 11: 64 bytes on wire (512 bits), 64 bytes captured (512 bits) on interface 0
    Interface id: 0 (unknown)
        Interface name: unknown
    Encapsulation type: USB packets with Linux header and padding (115)
    Arrival Time: Jul  1, 2018 15:33:52.146165000 EDT
    [Time shift for this packet: 0.000000000 seconds]
    Epoch Time: 1530473632.146165000 seconds
    [Time delta from previous captured frame: 0.032646000 seconds]
    [Time delta from previous displayed frame: 0.032646000 seconds]
    [Time since reference or first frame: 7.284232000 seconds]
    Frame Number: 11
    Frame Length: 64 bytes (512 bits)
    Capture Length: 64 bytes (512 bits)
    [Frame is marked: False]
    [Frame is ignored: False]
    [Protocols in frame: usb:usbhub]
USB URB
    [Source: host]
    [Destination: 3.1.0]
    URB id: 0xffff89fbe8d2ea80
    URB type: URB_SUBMIT ('S')
    URB transfer type: URB_CONTROL (0x02)
    Endpoint: 0x80, Direction: IN
        1... .... = Direction: IN (1)
        .... 0000 = Endpoint number: 0
    Device: 1
    URB bus id: 3
    Device setup request: relevant (0)
    Data: not present ('<')
    URB sec: 1530473632
    URB usec: 146165
    URB status: Operation now in progress (-EINPROGRESS) (-115)
    URB length [bytes]: 4
    Data length [bytes]: 0
    [Response in: 12]
    Interval: 0
    Start frame: 0
    Copy of Transfer Flags: 0x00000200
    Number of ISO descriptors: 0
    [bInterfaceClass: Unknown (0xffff)]
URB setup
    bmRequestType: 0xa3
        1... .... = Direction: Device-to-host
        .01. .... = Type: Class (0x1)
        ...0 0011 = Recipient: Other (0x03)
bRequest: GET_STATUS (0x00)
wValue: 0x0000
    (zero): 0
wIndex: 1
    Port: 1
wLength: 4

0000  80 ea d2 e8 fb 89 ff ff 53 02 80 01 03 00 00 3c   ........S......<
0010  a0 2c 39 5b 00 00 00 00 f5 3a 02 00 8d ff ff ff   .,9[.....:......
0020  04 00 00 00 00 00 00 00 a3 00 00 00 01 00 04 00   ................
0030  00 00 00 00 00 00 00 00 00 02 00 00 00 00 00 00   ................

Frame 12: 68 bytes on wire (544 bits), 68 bytes captured (544 bits) on interface 0
    Interface id: 0 (unknown)
        Interface name: unknown
    Encapsulation type: USB packets with Linux header and padding (115)
    Arrival Time: Jul  1, 2018 15:33:52.146182000 EDT
    [Time shift for this packet: 0.000000000 seconds]
    Epoch Time: 1530473632.146182000 seconds
    [Time delta from previous captured frame: 0.000017000 seconds]
    [Time delta from previous displayed frame: 0.000017000 seconds]
    [Time since reference or first frame: 7.284249000 seconds]
    Frame Number: 12
    Frame Length: 68 bytes (544 bits)
    Capture Length: 68 bytes (544 bits)
    [Frame is marked: False]
    [Frame is ignored: False]
    [Protocols in frame: usb:usbhub]
USB URB
    [Source: 3.1.0]
    [Destination: host]
    URB id: 0xffff89fbe8d2ea80
    URB type: URB_COMPLETE ('C')
    URB transfer type: URB_CONTROL (0x02)
    Endpoint: 0x80, Direction: IN
        1... .... = Direction: IN (1)
        .... 0000 = Endpoint number: 0
    Device: 1
    URB bus id: 3
    Device setup request: not relevant ('-')
    Data: present (0)
    URB sec: 1530473632
    URB usec: 146182
    URB status: Success (0)
    URB length [bytes]: 4
    Data length [bytes]: 4
    [Request in: 11]
    [Time from request: 0.000017000 seconds]
    Unused Setup Header
    Interval: 0
    Start frame: 0
    Copy of Transfer Flags: 0x00000200
    Number of ISO descriptors: 0
    [bInterfaceClass: Unknown (0xffff)]
Port Status: 0x0100, PORT_POWER
    .... .... .... ...0 = PORT_CONNECTION: False
    .... .... .... ..0. = PORT_ENABLE: False
    .... .... .... .0.. = PORT_SUSPEND: False
    .... .... .... 0... = PORT_OVER_CURRENT: False
    .... .... ...0 .... = PORT_RESET: False
    .... ...1 .... .... = PORT_POWER: True
    .... ..0. .... .... = PORT_LOW_SPEED: False
    .... .0.. .... .... = PORT_HIGH_SPEED: False
    .... 0... .... .... = PORT_TEST: False
    ...0 .... .... .... = PORT_INDICATOR: Default colors
Port Change: 0x0000
    .... .... .... ...0 = C_PORT_CONNECTION: False
    .... .... .... ..0. = C_PORT_ENABLE: False
    .... .... .... .0.. = C_PORT_SUSPEND: False
    .... .... .... 0... = C_PORT_OVER_CURRENT: False
    .... .... ...0 .... = C_PORT_RESET: False

0000  80 ea d2 e8 fb 89 ff ff 43 02 80 01 03 00 2d 00   ........C.....-.
0010  a0 2c 39 5b 00 00 00 00 06 3b 02 00 00 00 00 00   .,9[.....;......
0020  04 00 00 00 04 00 00 00 00 00 00 00 00 00 00 00   ................
0030  00 00 00 00 00 00 00 00 00 02 00 00 00 00 00 00   ................
0040  00 01 00 00                                       ....

Frame 13: 64 bytes on wire (512 bits), 64 bytes captured (512 bits) on interface 0
    Interface id: 0 (unknown)
        Interface name: unknown
    Encapsulation type: USB packets with Linux header and padding (115)
    Arrival Time: Jul  1, 2018 15:33:52.182267000 EDT
    [Time shift for this packet: 0.000000000 seconds]
    Epoch Time: 1530473632.182267000 seconds
    [Time delta from previous captured frame: 0.036085000 seconds]
    [Time delta from previous displayed frame: 0.036085000 seconds]
    [Time since reference or first frame: 7.320334000 seconds]
    Frame Number: 13
    Frame Length: 64 bytes (512 bits)
    Capture Length: 64 bytes (512 bits)
    [Frame is marked: False]
    [Frame is ignored: False]
    [Protocols in frame: usb:usbhub]
USB URB
    [Source: host]
    [Destination: 3.1.0]
    URB id: 0xffff89fbe8d2ea80
    URB type: URB_SUBMIT ('S')
    URB transfer type: URB_CONTROL (0x02)
    Endpoint: 0x80, Direction: IN
        1... .... = Direction: IN (1)
        .... 0000 = Endpoint number: 0
    Device: 1
    URB bus id: 3
    Device setup request: relevant (0)
    Data: not present ('<')
    URB sec: 1530473632
    URB usec: 182267
    URB status: Operation now in progress (-EINPROGRESS) (-115)
    URB length [bytes]: 4
    Data length [bytes]: 0
    [Response in: 14]
    Interval: 0
    Start frame: 0
    Copy of Transfer Flags: 0x00000200
    Number of ISO descriptors: 0
    [bInterfaceClass: Unknown (0xffff)]
URB setup
    bmRequestType: 0xa3
        1... .... = Direction: Device-to-host
        .01. .... = Type: Class (0x1)
        ...0 0011 = Recipient: Other (0x03)
bRequest: GET_STATUS (0x00)
wValue: 0x0000
    (zero): 0
wIndex: 1
    Port: 1
wLength: 4

0000  80 ea d2 e8 fb 89 ff ff 53 02 80 01 03 00 00 3c   ........S......<
0010  a0 2c 39 5b 00 00 00 00 fb c7 02 00 8d ff ff ff   .,9[............
0020  04 00 00 00 00 00 00 00 a3 00 00 00 01 00 04 00   ................
0030  00 00 00 00 00 00 00 00 00 02 00 00 00 00 00 00   ................

Frame 14: 68 bytes on wire (544 bits), 68 bytes captured (544 bits) on interface 0
    Interface id: 0 (unknown)
        Interface name: unknown
    Encapsulation type: USB packets with Linux header and padding (115)
    Arrival Time: Jul  1, 2018 15:33:52.182296000 EDT
    [Time shift for this packet: 0.000000000 seconds]
    Epoch Time: 1530473632.182296000 seconds
    [Time delta from previous captured frame: 0.000029000 seconds]
    [Time delta from previous displayed frame: 0.000029000 seconds]
    [Time since reference or first frame: 7.320363000 seconds]
    Frame Number: 14
    Frame Length: 68 bytes (544 bits)
    Capture Length: 68 bytes (544 bits)
    [Frame is marked: False]
    [Frame is ignored: False]
    [Protocols in frame: usb:usbhub]
USB URB
    [Source: 3.1.0]
    [Destination: host]
    URB id: 0xffff89fbe8d2ea80
    URB type: URB_COMPLETE ('C')
    URB transfer type: URB_CONTROL (0x02)
    Endpoint: 0x80, Direction: IN
        1... .... = Direction: IN (1)
        .... 0000 = Endpoint number: 0
    Device: 1
    URB bus id: 3
    Device setup request: not relevant ('-')
    Data: present (0)
    URB sec: 1530473632
    URB usec: 182296
    URB status: Success (0)
    URB length [bytes]: 4
    Data length [bytes]: 4
    [Request in: 13]
    [Time from request: 0.000029000 seconds]
    Unused Setup Header
    Interval: 0
    Start frame: 0
    Copy of Transfer Flags: 0x00000200
    Number of ISO descriptors: 0
    [bInterfaceClass: Unknown (0xffff)]
Port Status: 0x0100, PORT_POWER
    .... .... .... ...0 = PORT_CONNECTION: False
    .... .... .... ..0. = PORT_ENABLE: False
    .... .... .... .0.. = PORT_SUSPEND: False
    .... .... .... 0... = PORT_OVER_CURRENT: False
    .... .... ...0 .... = PORT_RESET: False
    .... ...1 .... .... = PORT_POWER: True
    .... ..0. .... .... = PORT_LOW_SPEED: False
    .... .0.. .... .... = PORT_HIGH_SPEED: False
    .... 0... .... .... = PORT_TEST: False
    ...0 .... .... .... = PORT_INDICATOR: Default colors
Port Change: 0x0000
    .... .... .... ...0 = C_PORT_CONNECTION: False
    .... .... .... ..0. = C_PORT_ENABLE: False
    .... .... .... .0.. = C_PORT_SUSPEND: False
    .... .... .... 0... = C_PORT_OVER_CURRENT: False
    .... .... ...0 .... = C_PORT_RESET: False

0000  80 ea d2 e8 fb 89 ff ff 43 02 80 01 03 00 2d 00   ........C.....-.
0010  a0 2c 39 5b 00 00 00 00 18 c8 02 00 00 00 00 00   .,9[............
0020  04 00 00 00 04 00 00 00 00 00 00 00 00 00 00 00   ................
0030  00 00 00 00 00 00 00 00 00 02 00 00 00 00 00 00   ................
0040  00 01 00 00                                       ....

Frame 15: 64 bytes on wire (512 bits), 64 bytes captured (512 bits) on interface 0
    Interface id: 0 (unknown)
        Interface name: unknown
    Encapsulation type: USB packets with Linux header and padding (115)
    Arrival Time: Jul  1, 2018 15:33:52.218294000 EDT
    [Time shift for this packet: 0.000000000 seconds]
    Epoch Time: 1530473632.218294000 seconds
    [Time delta from previous captured frame: 0.035998000 seconds]
    [Time delta from previous displayed frame: 0.035998000 seconds]
    [Time since reference or first frame: 7.356361000 seconds]
    Frame Number: 15
    Frame Length: 64 bytes (512 bits)
    Capture Length: 64 bytes (512 bits)
    [Frame is marked: False]
    [Frame is ignored: False]
    [Protocols in frame: usb:usbhub]
USB URB
    [Source: host]
    [Destination: 3.1.0]
    URB id: 0xffff89fbe8d2ea80
    URB type: URB_SUBMIT ('S')
    URB transfer type: URB_CONTROL (0x02)
    Endpoint: 0x80, Direction: IN
        1... .... = Direction: IN (1)
        .... 0000 = Endpoint number: 0
    Device: 1
    URB bus id: 3
    Device setup request: relevant (0)
    Data: not present ('<')
    URB sec: 1530473632
    URB usec: 218294
    URB status: Operation now in progress (-EINPROGRESS) (-115)
    URB length [bytes]: 4
    Data length [bytes]: 0
    [Response in: 16]
    Interval: 0
    Start frame: 0
    Copy of Transfer Flags: 0x00000200
    Number of ISO descriptors: 0
    [bInterfaceClass: Unknown (0xffff)]
URB setup
    bmRequestType: 0xa3
        1... .... = Direction: Device-to-host
        .01. .... = Type: Class (0x1)
        ...0 0011 = Recipient: Other (0x03)
bRequest: GET_STATUS (0x00)
wValue: 0x0000
    (zero): 0
wIndex: 1
    Port: 1
wLength: 4

0000  80 ea d2 e8 fb 89 ff ff 53 02 80 01 03 00 00 3c   ........S......<
0010  a0 2c 39 5b 00 00 00 00 b6 54 03 00 8d ff ff ff   .,9[.....T......
0020  04 00 00 00 00 00 00 00 a3 00 00 00 01 00 04 00   ................
0030  00 00 00 00 00 00 00 00 00 02 00 00 00 00 00 00   ................

Frame 16: 68 bytes on wire (544 bits), 68 bytes captured (544 bits) on interface 0
    Interface id: 0 (unknown)
        Interface name: unknown
    Encapsulation type: USB packets with Linux header and padding (115)
    Arrival Time: Jul  1, 2018 15:33:52.218332000 EDT
    [Time shift for this packet: 0.000000000 seconds]
    Epoch Time: 1530473632.218332000 seconds
    [Time delta from previous captured frame: 0.000038000 seconds]
    [Time delta from previous displayed frame: 0.000038000 seconds]
    [Time since reference or first frame: 7.356399000 seconds]
    Frame Number: 16
    Frame Length: 68 bytes (544 bits)
    Capture Length: 68 bytes (544 bits)
    [Frame is marked: False]
    [Frame is ignored: False]
    [Protocols in frame: usb:usbhub]
USB URB
    [Source: 3.1.0]
    [Destination: host]
    URB id: 0xffff89fbe8d2ea80
    URB type: URB_COMPLETE ('C')
    URB transfer type: URB_CONTROL (0x02)
    Endpoint: 0x80, Direction: IN
        1... .... = Direction: IN (1)
        .... 0000 = Endpoint number: 0
    Device: 1
    URB bus id: 3
    Device setup request: not relevant ('-')
    Data: present (0)
    URB sec: 1530473632
    URB usec: 218332
    URB status: Success (0)
    URB length [bytes]: 4
    Data length [bytes]: 4
    [Request in: 15]
    [Time from request: 0.000038000 seconds]
    Unused Setup Header
    Interval: 0
    Start frame: 0
    Copy of Transfer Flags: 0x00000200
    Number of ISO descriptors: 0
    [bInterfaceClass: Unknown (0xffff)]
Port Status: 0x0100, PORT_POWER
    .... .... .... ...0 = PORT_CONNECTION: False
    .... .... .... ..0. = PORT_ENABLE: False
    .... .... .... .0.. = PORT_SUSPEND: False
    .... .... .... 0... = PORT_OVER_CURRENT: False
    .... .... ...0 .... = PORT_RESET: False
    .... ...1 .... .... = PORT_POWER: True
    .... ..0. .... .... = PORT_LOW_SPEED: False
    .... .0.. .... .... = PORT_HIGH_SPEED: False
    .... 0... .... .... = PORT_TEST: False
    ...0 .... .... .... = PORT_INDICATOR: Default colors
Port Change: 0x0000
    .... .... .... ...0 = C_PORT_CONNECTION: False
    .... .... .... ..0. = C_PORT_ENABLE: False
    .... .... .... .0.. = C_PORT_SUSPEND: False
    .... .... .... 0... = C_PORT_OVER_CURRENT: False
    .... .... ...0 .... = C_PORT_RESET: False

0000  80 ea d2 e8 fb 89 ff ff 43 02 80 01 03 00 2d 00   ........C.....-.
0010  a0 2c 39 5b 00 00 00 00 dc 54 03 00 00 00 00 00   .,9[.....T......
0020  04 00 00 00 04 00 00 00 00 00 00 00 00 00 00 00   ................
0030  00 00 00 00 00 00 00 00 00 02 00 00 00 00 00 00   ................
0040  00 01 00 00                                       ....

Frame 17: 64 bytes on wire (512 bits), 64 bytes captured (512 bits) on interface 0
    Interface id: 0 (unknown)
        Interface name: unknown
    Encapsulation type: USB packets with Linux header and padding (115)
    Arrival Time: Jul  1, 2018 15:33:52.254282000 EDT
    [Time shift for this packet: 0.000000000 seconds]
    Epoch Time: 1530473632.254282000 seconds
    [Time delta from previous captured frame: 0.035950000 seconds]
    [Time delta from previous displayed frame: 0.035950000 seconds]
    [Time since reference or first frame: 7.392349000 seconds]
    Frame Number: 17
    Frame Length: 64 bytes (512 bits)
    Capture Length: 64 bytes (512 bits)
    [Frame is marked: False]
    [Frame is ignored: False]
    [Protocols in frame: usb:usbhub]
USB URB
    [Source: host]
    [Destination: 3.1.0]
    URB id: 0xffff89fbe8d2ea80
    URB type: URB_SUBMIT ('S')
    URB transfer type: URB_CONTROL (0x02)
    Endpoint: 0x80, Direction: IN
        1... .... = Direction: IN (1)
        .... 0000 = Endpoint number: 0
    Device: 1
    URB bus id: 3
    Device setup request: relevant (0)
    Data: not present ('<')
    URB sec: 1530473632
    URB usec: 254282
    URB status: Operation now in progress (-EINPROGRESS) (-115)
    URB length [bytes]: 4
    Data length [bytes]: 0
    [Response in: 18]
    Interval: 0
    Start frame: 0
    Copy of Transfer Flags: 0x00000200
    Number of ISO descriptors: 0
    [bInterfaceClass: Unknown (0xffff)]
URB setup
    bmRequestType: 0xa3
        1... .... = Direction: Device-to-host
        .01. .... = Type: Class (0x1)
        ...0 0011 = Recipient: Other (0x03)
bRequest: GET_STATUS (0x00)
wValue: 0x0000
    (zero): 0
wIndex: 1
    Port: 1
wLength: 4

0000  80 ea d2 e8 fb 89 ff ff 53 02 80 01 03 00 00 3c   ........S......<
0010  a0 2c 39 5b 00 00 00 00 4a e1 03 00 8d ff ff ff   .,9[....J.......
0020  04 00 00 00 00 00 00 00 a3 00 00 00 01 00 04 00   ................
0030  00 00 00 00 00 00 00 00 00 02 00 00 00 00 00 00   ................

Frame 18: 68 bytes on wire (544 bits), 68 bytes captured (544 bits) on interface 0
    Interface id: 0 (unknown)
        Interface name: unknown
    Encapsulation type: USB packets with Linux header and padding (115)
    Arrival Time: Jul  1, 2018 15:33:52.254324000 EDT
    [Time shift for this packet: 0.000000000 seconds]
    Epoch Time: 1530473632.254324000 seconds
    [Time delta from previous captured frame: 0.000042000 seconds]
    [Time delta from previous displayed frame: 0.000042000 seconds]
    [Time since reference or first frame: 7.392391000 seconds]
    Frame Number: 18
    Frame Length: 68 bytes (544 bits)
    Capture Length: 68 bytes (544 bits)
    [Frame is marked: False]
    [Frame is ignored: False]
    [Protocols in frame: usb:usbhub]
USB URB
    [Source: 3.1.0]
    [Destination: host]
    URB id: 0xffff89fbe8d2ea80
    URB type: URB_COMPLETE ('C')
    URB transfer type: URB_CONTROL (0x02)
    Endpoint: 0x80, Direction: IN
        1... .... = Direction: IN (1)
        .... 0000 = Endpoint number: 0
    Device: 1
    URB bus id: 3
    Device setup request: not relevant ('-')
    Data: present (0)
    URB sec: 1530473632
    URB usec: 254324
    URB status: Success (0)
    URB length [bytes]: 4
    Data length [bytes]: 4
    [Request in: 17]
    [Time from request: 0.000042000 seconds]
    Unused Setup Header
    Interval: 0
    Start frame: 0
    Copy of Transfer Flags: 0x00000200
    Number of ISO descriptors: 0
    [bInterfaceClass: Unknown (0xffff)]
Port Status: 0x0100, PORT_POWER
    .... .... .... ...0 = PORT_CONNECTION: False
    .... .... .... ..0. = PORT_ENABLE: False
    .... .... .... .0.. = PORT_SUSPEND: False
    .... .... .... 0... = PORT_OVER_CURRENT: False
    .... .... ...0 .... = PORT_RESET: False
    .... ...1 .... .... = PORT_POWER: True
    .... ..0. .... .... = PORT_LOW_SPEED: False
    .... .0.. .... .... = PORT_HIGH_SPEED: False
    .... 0... .... .... = PORT_TEST: False
    ...0 .... .... .... = PORT_INDICATOR: Default colors
Port Change: 0x0000
    .... .... .... ...0 = C_PORT_CONNECTION: False
    .... .... .... ..0. = C_PORT_ENABLE: False
    .... .... .... .0.. = C_PORT_SUSPEND: False
    .... .... .... 0... = C_PORT_OVER_CURRENT: False
    .... .... ...0 .... = C_PORT_RESET: False

0000  80 ea d2 e8 fb 89 ff ff 43 02 80 01 03 00 2d 00   ........C.....-.
0010  a0 2c 39 5b 00 00 00 00 74 e1 03 00 00 00 00 00   .,9[....t.......
0020  04 00 00 00 04 00 00 00 00 00 00 00 00 00 00 00   ................
0030  00 00 00 00 00 00 00 00 00 02 00 00 00 00 00 00   ................
0040  00 01 00 00                                       ....

Packet comments
    POWER ON COMPLETE
        [Expert Info (Comment/Comment): POWER ON COMPLETE]
            [POWER ON COMPLETE]
            [Severity level: Comment]
            [Group: Comment]
Frame 19: 64 bytes on wire (512 bits), 64 bytes captured (512 bits) on interface 0
    Interface id: 0 (unknown)
        Interface name: unknown
    Encapsulation type: USB packets with Linux header and padding (115)
    Arrival Time: Jul  1, 2018 15:33:52.254385000 EDT
    [Time shift for this packet: 0.000000000 seconds]
    Epoch Time: 1530473632.254385000 seconds
    [Time delta from previous captured frame: 0.000061000 seconds]
    [Time delta from previous displayed frame: 0.000061000 seconds]
    [Time since reference or first frame: 7.392452000 seconds]
    Frame Number: 19
    Frame Length: 64 bytes (512 bits)
    Capture Length: 64 bytes (512 bits)
    [Frame is marked: False]
    [Frame is ignored: False]
    [Protocols in frame: usb]
USB URB
    [Source: 3.1.1]
    [Destination: host]
    URB id: 0xffff89fd49658d80
    URB type: URB_COMPLETE ('C')
    URB transfer type: URB_INTERRUPT (0x01)
    Endpoint: 0x81, Direction: IN
        1... .... = Direction: IN (1)
        .... 0001 = Endpoint number: 1
    Device: 1
    URB bus id: 3
    Device setup request: not relevant ('-')
    Data: present (0)
    URB sec: 1530473632
    URB usec: 254385
    URB status: No such file or directory (-ENOENT) (-2)
    URB length [bytes]: 0
    Data length [bytes]: 0
    [Request in: 4]
    [Time from request: 0.144123000 seconds]
    [bInterfaceClass: Unknown (0xffff)]
    Unused Setup Header
    Interval: 2048
    Start frame: 0
    Copy of Transfer Flags: 0x00000200
    Number of ISO descriptors: 0

0000  80 8d 65 49 fd 89 ff ff 43 01 81 01 03 00 2d 00   ..eI....C.....-.
0010  a0 2c 39 5b 00 00 00 00 b1 e1 03 00 fe ff ff ff   .,9[............
0020  00 00 00 00 00 00 00 00 00 00 00 00 00 00 00 00   ................
0030  00 08 00 00 00 00 00 00 00 02 00 00 00 00 00 00   ................

Packet comments
    Power On AGAIN?

        [Expert Info (Comment/Comment): Power On AGAIN?
]
            [Power On AGAIN?
]
            [Severity level: Comment]
            [Group: Comment]
Frame 20: 64 bytes on wire (512 bits), 64 bytes captured (512 bits) on interface 0
    Interface id: 0 (unknown)
        Interface name: unknown
    Encapsulation type: USB packets with Linux header and padding (115)
    Arrival Time: Jul  1, 2018 15:36:23.416666000 EDT
    [Time shift for this packet: 0.000000000 seconds]
    Epoch Time: 1530473783.416666000 seconds
    [Time delta from previous captured frame: 151.162281000 seconds]
    [Time delta from previous displayed frame: 151.162281000 seconds]
    [Time since reference or first frame: 158.554733000 seconds]
    Frame Number: 20
    Frame Length: 64 bytes (512 bits)
    Capture Length: 64 bytes (512 bits)
    [Frame is marked: False]
    [Frame is ignored: False]
    [Protocols in frame: usb:usbhub]
USB URB
    [Source: host]
    [Destination: 3.1.0]
    URB id: 0xffff89fbe8d2e600
    URB type: URB_SUBMIT ('S')
    URB transfer type: URB_CONTROL (0x02)
    Endpoint: 0x80, Direction: IN
        1... .... = Direction: IN (1)
        .... 0000 = Endpoint number: 0
    Device: 1
    URB bus id: 3
    Device setup request: relevant (0)
    Data: not present ('<')
    URB sec: 1530473783
    URB usec: 416666
    URB status: Operation now in progress (-EINPROGRESS) (-115)
    URB length [bytes]: 4
    Data length [bytes]: 0
    [Response in: 21]
    Interval: 0
    Start frame: 0
    Copy of Transfer Flags: 0x00000200
    Number of ISO descriptors: 0
    [bInterfaceClass: Unknown (0xffff)]
URB setup
    bmRequestType: 0xa3
        1... .... = Direction: Device-to-host
        .01. .... = Type: Class (0x1)
        ...0 0011 = Recipient: Other (0x03)
bRequest: GET_STATUS (0x00)
wValue: 0x0000
    (zero): 0
wIndex: 1
    Port: 1
wLength: 4

0000  00 e6 d2 e8 fb 89 ff ff 53 02 80 01 03 00 00 3c   ........S......<
0010  37 2d 39 5b 00 00 00 00 9a 5b 06 00 8d ff ff ff   7-9[.....[......
0020  04 00 00 00 00 00 00 00 a3 00 00 00 01 00 04 00   ................
0030  00 00 00 00 00 00 00 00 00 02 00 00 00 00 00 00   ................

Frame 21: 68 bytes on wire (544 bits), 68 bytes captured (544 bits) on interface 0
    Interface id: 0 (unknown)
        Interface name: unknown
    Encapsulation type: USB packets with Linux header and padding (115)
    Arrival Time: Jul  1, 2018 15:36:23.416708000 EDT
    [Time shift for this packet: 0.000000000 seconds]
    Epoch Time: 1530473783.416708000 seconds
    [Time delta from previous captured frame: 0.000042000 seconds]
    [Time delta from previous displayed frame: 0.000042000 seconds]
    [Time since reference or first frame: 158.554775000 seconds]
    Frame Number: 21
    Frame Length: 68 bytes (544 bits)
    Capture Length: 68 bytes (544 bits)
    [Frame is marked: False]
    [Frame is ignored: False]
    [Protocols in frame: usb:usbhub]
USB URB
    [Source: 3.1.0]
    [Destination: host]
    URB id: 0xffff89fbe8d2e600
    URB type: URB_COMPLETE ('C')
    URB transfer type: URB_CONTROL (0x02)
    Endpoint: 0x80, Direction: IN
        1... .... = Direction: IN (1)
        .... 0000 = Endpoint number: 0
    Device: 1
    URB bus id: 3
    Device setup request: not relevant ('-')
    Data: present (0)
    URB sec: 1530473783
    URB usec: 416708
    URB status: Success (0)
    URB length [bytes]: 4
    Data length [bytes]: 4
    [Request in: 20]
    [Time from request: 0.000042000 seconds]
    Unused Setup Header
    Interval: 0
    Start frame: 0
    Copy of Transfer Flags: 0x00000200
    Number of ISO descriptors: 0
    [bInterfaceClass: Unknown (0xffff)]
Port Status: 0x0101, PORT_CONNECTION, PORT_POWER
    .... .... .... ...1 = PORT_CONNECTION: True
    .... .... .... ..0. = PORT_ENABLE: False
    .... .... .... .0.. = PORT_SUSPEND: False
    .... .... .... 0... = PORT_OVER_CURRENT: False
    .... .... ...0 .... = PORT_RESET: False
    .... ...1 .... .... = PORT_POWER: True
    .... ..0. .... .... = PORT_LOW_SPEED: False
    .... .0.. .... .... = PORT_HIGH_SPEED: False
    .... 0... .... .... = PORT_TEST: False
    ...0 .... .... .... = PORT_INDICATOR: Default colors
Port Change: 0x0001, C_PORT_CONNECTION
    .... .... .... ...1 = C_PORT_CONNECTION: True
    .... .... .... ..0. = C_PORT_ENABLE: False
    .... .... .... .0.. = C_PORT_SUSPEND: False
    .... .... .... 0... = C_PORT_OVER_CURRENT: False
    .... .... ...0 .... = C_PORT_RESET: False

0000  00 e6 d2 e8 fb 89 ff ff 43 02 80 01 03 00 2d 00   ........C.....-.
0010  37 2d 39 5b 00 00 00 00 c4 5b 06 00 00 00 00 00   7-9[.....[......
0020  04 00 00 00 04 00 00 00 00 00 00 00 00 00 00 00   ................
0030  00 00 00 00 00 00 00 00 00 02 00 00 00 00 00 00   ................
0040  01 01 01 00                                       ....

Frame 22: 64 bytes on wire (512 bits), 64 bytes captured (512 bits) on interface 0
    Interface id: 0 (unknown)
        Interface name: unknown
    Encapsulation type: USB packets with Linux header and padding (115)
    Arrival Time: Jul  1, 2018 15:36:23.416722000 EDT
    [Time shift for this packet: 0.000000000 seconds]
    Epoch Time: 1530473783.416722000 seconds
    [Time delta from previous captured frame: 0.000014000 seconds]
    [Time delta from previous displayed frame: 0.000014000 seconds]
    [Time since reference or first frame: 158.554789000 seconds]
    Frame Number: 22
    Frame Length: 64 bytes (512 bits)
    Capture Length: 64 bytes (512 bits)
    [Frame is marked: False]
    [Frame is ignored: False]
    [Protocols in frame: usb:usbhub]
USB URB
    [Source: host]
    [Destination: 3.1.0]
    URB id: 0xffff89fbe8d2e600
    URB type: URB_SUBMIT ('S')
    URB transfer type: URB_CONTROL (0x02)
    Endpoint: 0x00, Direction: OUT
        0... .... = Direction: OUT (0)
        .... 0000 = Endpoint number: 0
    Device: 1
    URB bus id: 3
    Device setup request: relevant (0)
    Data: present (0)
    URB sec: 1530473783
    URB usec: 416722
    URB status: Operation now in progress (-EINPROGRESS) (-115)
    URB length [bytes]: 0
    Data length [bytes]: 0
    [Response in: 23]
    Interval: 0
    Start frame: 0
    Copy of Transfer Flags: 0x00000000
    Number of ISO descriptors: 0
    [bInterfaceClass: Unknown (0xffff)]
URB setup
    bmRequestType: 0x23
        0... .... = Direction: Host-to-device
        .01. .... = Type: Class (0x1)
        ...0 0011 = Recipient: Other (0x03)
bRequest: CLEAR_FEATURE (0x01)
wValue: 0x0010
    PortFeatureSelector: C_PORT_CONNECTION (16)
wIndex: 1
    Port: 1
    PortSelector: 0
wLength: 0
    (zero): 0

0000  00 e6 d2 e8 fb 89 ff ff 53 02 00 01 03 00 00 00   ........S.......
0010  37 2d 39 5b 00 00 00 00 d2 5b 06 00 8d ff ff ff   7-9[.....[......
0020  00 00 00 00 00 00 00 00 23 01 10 00 01 00 00 00   ........#.......
0030  00 00 00 00 00 00 00 00 00 00 00 00 00 00 00 00   ................

Frame 23: 64 bytes on wire (512 bits), 64 bytes captured (512 bits) on interface 0
    Interface id: 0 (unknown)
        Interface name: unknown
    Encapsulation type: USB packets with Linux header and padding (115)
    Arrival Time: Jul  1, 2018 15:36:23.416736000 EDT
    [Time shift for this packet: 0.000000000 seconds]
    Epoch Time: 1530473783.416736000 seconds
    [Time delta from previous captured frame: 0.000014000 seconds]
    [Time delta from previous displayed frame: 0.000014000 seconds]
    [Time since reference or first frame: 158.554803000 seconds]
    Frame Number: 23
    Frame Length: 64 bytes (512 bits)
    Capture Length: 64 bytes (512 bits)
    [Frame is marked: False]
    [Frame is ignored: False]
    [Protocols in frame: usb]
USB URB
    [Source: 3.1.0]
    [Destination: host]
    URB id: 0xffff89fbe8d2e600
    URB type: URB_COMPLETE ('C')
    URB transfer type: URB_CONTROL (0x02)
    Endpoint: 0x00, Direction: OUT
        0... .... = Direction: OUT (0)
        .... 0000 = Endpoint number: 0
    Device: 1
    URB bus id: 3
    Device setup request: not relevant ('-')
    Data: not present ('>')
    URB sec: 1530473783
    URB usec: 416736
    URB status: Success (0)
    URB length [bytes]: 0
    Data length [bytes]: 0
    [Request in: 22]
    [Time from request: 0.000014000 seconds]
    Unused Setup Header
    Interval: 0
    Start frame: 0
    Copy of Transfer Flags: 0x00000000
    Number of ISO descriptors: 0
    [bInterfaceClass: Unknown (0xffff)]

0000  00 e6 d2 e8 fb 89 ff ff 43 02 00 01 03 00 2d 3e   ........C.....->
0010  37 2d 39 5b 00 00 00 00 e0 5b 06 00 00 00 00 00   7-9[.....[......
0020  00 00 00 00 00 00 00 00 00 00 00 00 00 00 00 00   ................
0030  00 00 00 00 00 00 00 00 00 00 00 00 00 00 00 00   ................

Frame 24: 64 bytes on wire (512 bits), 64 bytes captured (512 bits) on interface 0
    Interface id: 0 (unknown)
        Interface name: unknown
    Encapsulation type: USB packets with Linux header and padding (115)
    Arrival Time: Jul  1, 2018 15:36:23.416742000 EDT
    [Time shift for this packet: 0.000000000 seconds]
    Epoch Time: 1530473783.416742000 seconds
    [Time delta from previous captured frame: 0.000006000 seconds]
    [Time delta from previous displayed frame: 0.000006000 seconds]
    [Time since reference or first frame: 158.554809000 seconds]
    Frame Number: 24
    Frame Length: 64 bytes (512 bits)
    Capture Length: 64 bytes (512 bits)
    [Frame is marked: False]
    [Frame is ignored: False]
    [Protocols in frame: usb:usbhub]
USB URB
    [Source: host]
    [Destination: 3.1.0]
    URB id: 0xffff89fbe8d2e600
    URB type: URB_SUBMIT ('S')
    URB transfer type: URB_CONTROL (0x02)
    Endpoint: 0x80, Direction: IN
        1... .... = Direction: IN (1)
        .... 0000 = Endpoint number: 0
    Device: 1
    URB bus id: 3
    Device setup request: relevant (0)
    Data: not present ('<')
    URB sec: 1530473783
    URB usec: 416742
    URB status: Operation now in progress (-EINPROGRESS) (-115)
    URB length [bytes]: 4
    Data length [bytes]: 0
    [Response in: 25]
    Interval: 0
    Start frame: 0
    Copy of Transfer Flags: 0x00000200
    Number of ISO descriptors: 0
    [bInterfaceClass: Unknown (0xffff)]
URB setup
    bmRequestType: 0xa3
        1... .... = Direction: Device-to-host
        .01. .... = Type: Class (0x1)
        ...0 0011 = Recipient: Other (0x03)
bRequest: GET_STATUS (0x00)
wValue: 0x0000
    (zero): 0
wIndex: 2
    Port: 2
wLength: 4

0000  00 e6 d2 e8 fb 89 ff ff 53 02 80 01 03 00 00 3c   ........S......<
0010  37 2d 39 5b 00 00 00 00 e6 5b 06 00 8d ff ff ff   7-9[.....[......
0020  04 00 00 00 00 00 00 00 a3 00 00 00 02 00 04 00   ................
0030  00 00 00 00 00 00 00 00 00 02 00 00 00 00 00 00   ................

Frame 25: 68 bytes on wire (544 bits), 68 bytes captured (544 bits) on interface 0
    Interface id: 0 (unknown)
        Interface name: unknown
    Encapsulation type: USB packets with Linux header and padding (115)
    Arrival Time: Jul  1, 2018 15:36:23.416750000 EDT
    [Time shift for this packet: 0.000000000 seconds]
    Epoch Time: 1530473783.416750000 seconds
    [Time delta from previous captured frame: 0.000008000 seconds]
    [Time delta from previous displayed frame: 0.000008000 seconds]
    [Time since reference or first frame: 158.554817000 seconds]
    Frame Number: 25
    Frame Length: 68 bytes (544 bits)
    Capture Length: 68 bytes (544 bits)
    [Frame is marked: False]
    [Frame is ignored: False]
    [Protocols in frame: usb:usbhub]
USB URB
    [Source: 3.1.0]
    [Destination: host]
    URB id: 0xffff89fbe8d2e600
    URB type: URB_COMPLETE ('C')
    URB transfer type: URB_CONTROL (0x02)
    Endpoint: 0x80, Direction: IN
        1... .... = Direction: IN (1)
        .... 0000 = Endpoint number: 0
    Device: 1
    URB bus id: 3
    Device setup request: not relevant ('-')
    Data: present (0)
    URB sec: 1530473783
    URB usec: 416750
    URB status: Success (0)
    URB length [bytes]: 4
    Data length [bytes]: 4
    [Request in: 24]
    [Time from request: 0.000008000 seconds]
    Unused Setup Header
    Interval: 0
    Start frame: 0
    Copy of Transfer Flags: 0x00000200
    Number of ISO descriptors: 0
    [bInterfaceClass: Unknown (0xffff)]
Port Status: 0x0100, PORT_POWER
    .... .... .... ...0 = PORT_CONNECTION: False
    .... .... .... ..0. = PORT_ENABLE: False
    .... .... .... .0.. = PORT_SUSPEND: False
    .... .... .... 0... = PORT_OVER_CURRENT: False
    .... .... ...0 .... = PORT_RESET: False
    .... ...1 .... .... = PORT_POWER: True
    .... ..0. .... .... = PORT_LOW_SPEED: False
    .... .0.. .... .... = PORT_HIGH_SPEED: False
    .... 0... .... .... = PORT_TEST: False
    ...0 .... .... .... = PORT_INDICATOR: Default colors
Port Change: 0x0000
    .... .... .... ...0 = C_PORT_CONNECTION: False
    .... .... .... ..0. = C_PORT_ENABLE: False
    .... .... .... .0.. = C_PORT_SUSPEND: False
    .... .... .... 0... = C_PORT_OVER_CURRENT: False
    .... .... ...0 .... = C_PORT_RESET: False

0000  00 e6 d2 e8 fb 89 ff ff 43 02 80 01 03 00 2d 00   ........C.....-.
0010  37 2d 39 5b 00 00 00 00 ee 5b 06 00 00 00 00 00   7-9[.....[......
0020  04 00 00 00 04 00 00 00 00 00 00 00 00 00 00 00   ................
0030  00 00 00 00 00 00 00 00 00 02 00 00 00 00 00 00   ................
0040  00 01 00 00                                       ....

Frame 26: 64 bytes on wire (512 bits), 64 bytes captured (512 bits) on interface 0
    Interface id: 0 (unknown)
        Interface name: unknown
    Encapsulation type: USB packets with Linux header and padding (115)
    Arrival Time: Jul  1, 2018 15:36:23.522255000 EDT
    [Time shift for this packet: 0.000000000 seconds]
    Epoch Time: 1530473783.522255000 seconds
    [Time delta from previous captured frame: 0.105505000 seconds]
    [Time delta from previous displayed frame: 0.105505000 seconds]
    [Time since reference or first frame: 158.660322000 seconds]
    Frame Number: 26
    Frame Length: 64 bytes (512 bits)
    Capture Length: 64 bytes (512 bits)
    [Frame is marked: False]
    [Frame is ignored: False]
    [Protocols in frame: usb]
USB URB
    [Source: host]
    [Destination: 3.1.1]
    URB id: 0xffff89fd49658d80
    URB type: URB_SUBMIT ('S')
    URB transfer type: URB_INTERRUPT (0x01)
    Endpoint: 0x81, Direction: IN
        1... .... = Direction: IN (1)
        .... 0001 = Endpoint number: 1
    Device: 1
    URB bus id: 3
    Device setup request: not relevant ('-')
    Data: not present ('<')
    URB sec: 1530473783
    URB usec: 522255
    URB status: Operation now in progress (-EINPROGRESS) (-115)
    URB length [bytes]: 4
    Data length [bytes]: 0
    [bInterfaceClass: Unknown (0xffff)]
    Unused Setup Header
    Interval: 2048
    Start frame: 0
    Copy of Transfer Flags: 0x00000200
    Number of ISO descriptors: 0

0000  80 8d 65 49 fd 89 ff ff 53 01 81 01 03 00 2d 3c   ..eI....S.....-<
0010  37 2d 39 5b 00 00 00 00 0f f8 07 00 8d ff ff ff   7-9[............
0020  04 00 00 00 00 00 00 00 00 00 00 00 00 00 00 00   ................
0030  00 08 00 00 00 00 00 00 00 02 00 00 00 00 00 00   ................

Frame 27: 64 bytes on wire (512 bits), 64 bytes captured (512 bits) on interface 0
    Interface id: 0 (unknown)
        Interface name: unknown
    Encapsulation type: USB packets with Linux header and padding (115)
    Arrival Time: Jul  1, 2018 15:36:23.522294000 EDT
    [Time shift for this packet: 0.000000000 seconds]
    Epoch Time: 1530473783.522294000 seconds
    [Time delta from previous captured frame: 0.000039000 seconds]
    [Time delta from previous displayed frame: 0.000039000 seconds]
    [Time since reference or first frame: 158.660361000 seconds]
    Frame Number: 27
    Frame Length: 64 bytes (512 bits)
    Capture Length: 64 bytes (512 bits)
    [Frame is marked: False]
    [Frame is ignored: False]
    [Protocols in frame: usb:usbhub]
USB URB
    [Source: host]
    [Destination: 3.1.0]
    URB id: 0xffff89fbe8d2e600
    URB type: URB_SUBMIT ('S')
    URB transfer type: URB_CONTROL (0x02)
    Endpoint: 0x80, Direction: IN
        1... .... = Direction: IN (1)
        .... 0000 = Endpoint number: 0
    Device: 1
    URB bus id: 3
    Device setup request: relevant (0)
    Data: not present ('<')
    URB sec: 1530473783
    URB usec: 522294
    URB status: Operation now in progress (-EINPROGRESS) (-115)
    URB length [bytes]: 4
    Data length [bytes]: 0
    [Response in: 28]
    Interval: 0
    Start frame: 0
    Copy of Transfer Flags: 0x00000200
    Number of ISO descriptors: 0
    [bInterfaceClass: Unknown (0xffff)]
URB setup
    bmRequestType: 0xa3
        1... .... = Direction: Device-to-host
        .01. .... = Type: Class (0x1)
        ...0 0011 = Recipient: Other (0x03)
bRequest: GET_STATUS (0x00)
wValue: 0x0000
    (zero): 0
wIndex: 1
    Port: 1
wLength: 4

0000  00 e6 d2 e8 fb 89 ff ff 53 02 80 01 03 00 00 3c   ........S......<
0010  37 2d 39 5b 00 00 00 00 36 f8 07 00 8d ff ff ff   7-9[....6.......
0020  04 00 00 00 00 00 00 00 a3 00 00 00 01 00 04 00   ................
0030  00 00 00 00 00 00 00 00 00 02 00 00 00 00 00 00   ................

Frame 28: 68 bytes on wire (544 bits), 68 bytes captured (544 bits) on interface 0
    Interface id: 0 (unknown)
        Interface name: unknown
    Encapsulation type: USB packets with Linux header and padding (115)
    Arrival Time: Jul  1, 2018 15:36:23.522321000 EDT
    [Time shift for this packet: 0.000000000 seconds]
    Epoch Time: 1530473783.522321000 seconds
    [Time delta from previous captured frame: 0.000027000 seconds]
    [Time delta from previous displayed frame: 0.000027000 seconds]
    [Time since reference or first frame: 158.660388000 seconds]
    Frame Number: 28
    Frame Length: 68 bytes (544 bits)
    Capture Length: 68 bytes (544 bits)
    [Frame is marked: False]
    [Frame is ignored: False]
    [Protocols in frame: usb:usbhub]
USB URB
    [Source: 3.1.0]
    [Destination: host]
    URB id: 0xffff89fbe8d2e600
    URB type: URB_COMPLETE ('C')
    URB transfer type: URB_CONTROL (0x02)
    Endpoint: 0x80, Direction: IN
        1... .... = Direction: IN (1)
        .... 0000 = Endpoint number: 0
    Device: 1
    URB bus id: 3
    Device setup request: not relevant ('-')
    Data: present (0)
    URB sec: 1530473783
    URB usec: 522321
    URB status: Success (0)
    URB length [bytes]: 4
    Data length [bytes]: 4
    [Request in: 27]
    [Time from request: 0.000027000 seconds]
    Unused Setup Header
    Interval: 0
    Start frame: 0
    Copy of Transfer Flags: 0x00000200
    Number of ISO descriptors: 0
    [bInterfaceClass: Unknown (0xffff)]
Port Status: 0x0101, PORT_CONNECTION, PORT_POWER
    .... .... .... ...1 = PORT_CONNECTION: True
    .... .... .... ..0. = PORT_ENABLE: False
    .... .... .... .0.. = PORT_SUSPEND: False
    .... .... .... 0... = PORT_OVER_CURRENT: False
    .... .... ...0 .... = PORT_RESET: False
    .... ...1 .... .... = PORT_POWER: True
    .... ..0. .... .... = PORT_LOW_SPEED: False
    .... .0.. .... .... = PORT_HIGH_SPEED: False
    .... 0... .... .... = PORT_TEST: False
    ...0 .... .... .... = PORT_INDICATOR: Default colors
Port Change: 0x0000
    .... .... .... ...0 = C_PORT_CONNECTION: False
    .... .... .... ..0. = C_PORT_ENABLE: False
    .... .... .... .0.. = C_PORT_SUSPEND: False
    .... .... .... 0... = C_PORT_OVER_CURRENT: False
    .... .... ...0 .... = C_PORT_RESET: False

0000  00 e6 d2 e8 fb 89 ff ff 43 02 80 01 03 00 2d 00   ........C.....-.
0010  37 2d 39 5b 00 00 00 00 51 f8 07 00 00 00 00 00   7-9[....Q.......
0020  04 00 00 00 04 00 00 00 00 00 00 00 00 00 00 00   ................
0030  00 00 00 00 00 00 00 00 00 02 00 00 00 00 00 00   ................
0040  01 01 00 00                                       ....

Frame 29: 64 bytes on wire (512 bits), 64 bytes captured (512 bits) on interface 0
    Interface id: 0 (unknown)
        Interface name: unknown
    Encapsulation type: USB packets with Linux header and padding (115)
    Arrival Time: Jul  1, 2018 15:36:23.522562000 EDT
    [Time shift for this packet: 0.000000000 seconds]
    Epoch Time: 1530473783.522562000 seconds
    [Time delta from previous captured frame: 0.000241000 seconds]
    [Time delta from previous displayed frame: 0.000241000 seconds]
    [Time since reference or first frame: 158.660629000 seconds]
    Frame Number: 29
    Frame Length: 64 bytes (512 bits)
    Capture Length: 64 bytes (512 bits)
    [Frame is marked: False]
    [Frame is ignored: False]
    [Protocols in frame: usb:usbhub]
USB URB
    [Source: host]
    [Destination: 3.1.0]
    URB id: 0xffff89fbe8d2e600
    URB type: URB_SUBMIT ('S')
    URB transfer type: URB_CONTROL (0x02)
    Endpoint: 0x00, Direction: OUT
        0... .... = Direction: OUT (0)
        .... 0000 = Endpoint number: 0
    Device: 1
    URB bus id: 3
    Device setup request: relevant (0)
    Data: present (0)
    URB sec: 1530473783
    URB usec: 522562
    URB status: Operation now in progress (-EINPROGRESS) (-115)
    URB length [bytes]: 0
    Data length [bytes]: 0
    [Response in: 30]
    Interval: 0
    Start frame: 0
    Copy of Transfer Flags: 0x00000000
    Number of ISO descriptors: 0
    [bInterfaceClass: Unknown (0xffff)]
URB setup
    bmRequestType: 0x23
        0... .... = Direction: Host-to-device
        .01. .... = Type: Class (0x1)
        ...0 0011 = Recipient: Other (0x03)
bRequest: SET_FEATURE (0x03)
wValue: 0x0004
    PortFeatureSelector: PORT_RESET (4)
wIndex: 1
    Port: 1
    PortSelector: 0
wLength: 0
    (zero): 0

0000  00 e6 d2 e8 fb 89 ff ff 53 02 00 01 03 00 00 00   ........S.......
0010  37 2d 39 5b 00 00 00 00 42 f9 07 00 8d ff ff ff   7-9[....B.......
0020  00 00 00 00 00 00 00 00 23 03 04 00 01 00 00 00   ........#.......
0030  00 00 00 00 00 00 00 00 00 00 00 00 00 00 00 00   ................

Frame 30: 64 bytes on wire (512 bits), 64 bytes captured (512 bits) on interface 0
    Interface id: 0 (unknown)
        Interface name: unknown
    Encapsulation type: USB packets with Linux header and padding (115)
    Arrival Time: Jul  1, 2018 15:36:23.522591000 EDT
    [Time shift for this packet: 0.000000000 seconds]
    Epoch Time: 1530473783.522591000 seconds
    [Time delta from previous captured frame: 0.000029000 seconds]
    [Time delta from previous displayed frame: 0.000029000 seconds]
    [Time since reference or first frame: 158.660658000 seconds]
    Frame Number: 30
    Frame Length: 64 bytes (512 bits)
    Capture Length: 64 bytes (512 bits)
    [Frame is marked: False]
    [Frame is ignored: False]
    [Protocols in frame: usb]
USB URB
    [Source: 3.1.0]
    [Destination: host]
    URB id: 0xffff89fbe8d2e600
    URB type: URB_COMPLETE ('C')
    URB transfer type: URB_CONTROL (0x02)
    Endpoint: 0x00, Direction: OUT
        0... .... = Direction: OUT (0)
        .... 0000 = Endpoint number: 0
    Device: 1
    URB bus id: 3
    Device setup request: not relevant ('-')
    Data: not present ('>')
    URB sec: 1530473783
    URB usec: 522591
    URB status: Success (0)
    URB length [bytes]: 0
    Data length [bytes]: 0
    [Request in: 29]
    [Time from request: 0.000029000 seconds]
    Unused Setup Header
    Interval: 0
    Start frame: 0
    Copy of Transfer Flags: 0x00000000
    Number of ISO descriptors: 0
    [bInterfaceClass: Unknown (0xffff)]

0000  00 e6 d2 e8 fb 89 ff ff 43 02 00 01 03 00 2d 3e   ........C.....->
0010  37 2d 39 5b 00 00 00 00 5f f9 07 00 00 00 00 00   7-9[...._.......
0020  00 00 00 00 00 00 00 00 00 00 00 00 00 00 00 00   ................
0030  00 00 00 00 00 00 00 00 00 00 00 00 00 00 00 00   ................

Frame 31: 64 bytes on wire (512 bits), 64 bytes captured (512 bits) on interface 0
    Interface id: 0 (unknown)
        Interface name: unknown
    Encapsulation type: USB packets with Linux header and padding (115)
    Arrival Time: Jul  1, 2018 15:36:23.590262000 EDT
    [Time shift for this packet: 0.000000000 seconds]
    Epoch Time: 1530473783.590262000 seconds
    [Time delta from previous captured frame: 0.067671000 seconds]
    [Time delta from previous displayed frame: 0.067671000 seconds]
    [Time since reference or first frame: 158.728329000 seconds]
    Frame Number: 31
    Frame Length: 64 bytes (512 bits)
    Capture Length: 64 bytes (512 bits)
    [Frame is marked: False]
    [Frame is ignored: False]
    [Protocols in frame: usb:usbhub]
USB URB
    [Source: host]
    [Destination: 3.1.0]
    URB id: 0xffff89fbe8d2e600
    URB type: URB_SUBMIT ('S')
    URB transfer type: URB_CONTROL (0x02)
    Endpoint: 0x80, Direction: IN
        1... .... = Direction: IN (1)
        .... 0000 = Endpoint number: 0
    Device: 1
    URB bus id: 3
    Device setup request: relevant (0)
    Data: not present ('<')
    URB sec: 1530473783
    URB usec: 590262
    URB status: Operation now in progress (-EINPROGRESS) (-115)
    URB length [bytes]: 4
    Data length [bytes]: 0
    [Response in: 32]
    Interval: 0
    Start frame: 0
    Copy of Transfer Flags: 0x00000200
    Number of ISO descriptors: 0
    [bInterfaceClass: Unknown (0xffff)]
URB setup
    bmRequestType: 0xa3
        1... .... = Direction: Device-to-host
        .01. .... = Type: Class (0x1)
        ...0 0011 = Recipient: Other (0x03)
bRequest: GET_STATUS (0x00)
wValue: 0x0000
    (zero): 0
wIndex: 1
    Port: 1
wLength: 4

0000  00 e6 d2 e8 fb 89 ff ff 53 02 80 01 03 00 00 3c   ........S......<
0010  37 2d 39 5b 00 00 00 00 b6 01 09 00 8d ff ff ff   7-9[............
0020  04 00 00 00 00 00 00 00 a3 00 00 00 01 00 04 00   ................
0030  00 00 00 00 00 00 00 00 00 02 00 00 00 00 00 00   ................

Frame 32: 68 bytes on wire (544 bits), 68 bytes captured (544 bits) on interface 0
    Interface id: 0 (unknown)
        Interface name: unknown
    Encapsulation type: USB packets with Linux header and padding (115)
    Arrival Time: Jul  1, 2018 15:36:23.590301000 EDT
    [Time shift for this packet: 0.000000000 seconds]
    Epoch Time: 1530473783.590301000 seconds
    [Time delta from previous captured frame: 0.000039000 seconds]
    [Time delta from previous displayed frame: 0.000039000 seconds]
    [Time since reference or first frame: 158.728368000 seconds]
    Frame Number: 32
    Frame Length: 68 bytes (544 bits)
    Capture Length: 68 bytes (544 bits)
    [Frame is marked: False]
    [Frame is ignored: False]
    [Protocols in frame: usb:usbhub]
USB URB
    [Source: 3.1.0]
    [Destination: host]
    URB id: 0xffff89fbe8d2e600
    URB type: URB_COMPLETE ('C')
    URB transfer type: URB_CONTROL (0x02)
    Endpoint: 0x80, Direction: IN
        1... .... = Direction: IN (1)
        .... 0000 = Endpoint number: 0
    Device: 1
    URB bus id: 3
    Device setup request: not relevant ('-')
    Data: present (0)
    URB sec: 1530473783
    URB usec: 590301
    URB status: Success (0)
    URB length [bytes]: 4
    Data length [bytes]: 4
    [Request in: 31]
    [Time from request: 0.000039000 seconds]
    Unused Setup Header
    Interval: 0
    Start frame: 0
    Copy of Transfer Flags: 0x00000200
    Number of ISO descriptors: 0
    [bInterfaceClass: Unknown (0xffff)]
Port Status: 0x0103, PORT_CONNECTION, PORT_ENABLE, PORT_POWER
    .... .... .... ...1 = PORT_CONNECTION: True
    .... .... .... ..1. = PORT_ENABLE: True
    .... .... .... .0.. = PORT_SUSPEND: False
    .... .... .... 0... = PORT_OVER_CURRENT: False
    .... .... ...0 .... = PORT_RESET: False
    .... ...1 .... .... = PORT_POWER: True
    .... ..0. .... .... = PORT_LOW_SPEED: False
    .... .0.. .... .... = PORT_HIGH_SPEED: False
    .... 0... .... .... = PORT_TEST: False
    ...0 .... .... .... = PORT_INDICATOR: Default colors
Port Change: 0x0010, C_PORT_RESET
    .... .... .... ...0 = C_PORT_CONNECTION: False
    .... .... .... ..0. = C_PORT_ENABLE: False
    .... .... .... .0.. = C_PORT_SUSPEND: False
    .... .... .... 0... = C_PORT_OVER_CURRENT: False
    .... .... ...1 .... = C_PORT_RESET: True

0000  00 e6 d2 e8 fb 89 ff ff 43 02 80 01 03 00 2d 00   ........C.....-.
0010  37 2d 39 5b 00 00 00 00 dd 01 09 00 00 00 00 00   7-9[............
0020  04 00 00 00 04 00 00 00 00 00 00 00 00 00 00 00   ................
0030  00 00 00 00 00 00 00 00 00 02 00 00 00 00 00 00   ................
0040  03 01 10 00                                       ....

Frame 33: 64 bytes on wire (512 bits), 64 bytes captured (512 bits) on interface 0
    Interface id: 0 (unknown)
        Interface name: unknown
    Encapsulation type: USB packets with Linux header and padding (115)
    Arrival Time: Jul  1, 2018 15:36:23.590315000 EDT
    [Time shift for this packet: 0.000000000 seconds]
    Epoch Time: 1530473783.590315000 seconds
    [Time delta from previous captured frame: 0.000014000 seconds]
    [Time delta from previous displayed frame: 0.000014000 seconds]
    [Time since reference or first frame: 158.728382000 seconds]
    Frame Number: 33
    Frame Length: 64 bytes (512 bits)
    Capture Length: 64 bytes (512 bits)
    [Frame is marked: False]
    [Frame is ignored: False]
    [Protocols in frame: usb:usbhub]
USB URB
    [Source: host]
    [Destination: 3.1.0]
    URB id: 0xffff89fbe8d2e600
    URB type: URB_SUBMIT ('S')
    URB transfer type: URB_CONTROL (0x02)
    Endpoint: 0x00, Direction: OUT
        0... .... = Direction: OUT (0)
        .... 0000 = Endpoint number: 0
    Device: 1
    URB bus id: 3
    Device setup request: relevant (0)
    Data: present (0)
    URB sec: 1530473783
    URB usec: 590315
    URB status: Operation now in progress (-EINPROGRESS) (-115)
    URB length [bytes]: 0
    Data length [bytes]: 0
    [Response in: 34]
    Interval: 0
    Start frame: 0
    Copy of Transfer Flags: 0x00000000
    Number of ISO descriptors: 0
    [bInterfaceClass: Unknown (0xffff)]
URB setup
    bmRequestType: 0x23
        0... .... = Direction: Host-to-device
        .01. .... = Type: Class (0x1)
        ...0 0011 = Recipient: Other (0x03)
bRequest: CLEAR_FEATURE (0x01)
wValue: 0x0014
    PortFeatureSelector: C_PORT_RESET (20)
wIndex: 1
    Port: 1
    PortSelector: 0
wLength: 0
    (zero): 0

0000  00 e6 d2 e8 fb 89 ff ff 53 02 00 01 03 00 00 00   ........S.......
0010  37 2d 39 5b 00 00 00 00 eb 01 09 00 8d ff ff ff   7-9[............
0020  00 00 00 00 00 00 00 00 23 01 14 00 01 00 00 00   ........#.......
0030  00 00 00 00 00 00 00 00 00 00 00 00 00 00 00 00   ................

Frame 34: 64 bytes on wire (512 bits), 64 bytes captured (512 bits) on interface 0
    Interface id: 0 (unknown)
        Interface name: unknown
    Encapsulation type: USB packets with Linux header and padding (115)
    Arrival Time: Jul  1, 2018 15:36:23.590329000 EDT
    [Time shift for this packet: 0.000000000 seconds]
    Epoch Time: 1530473783.590329000 seconds
    [Time delta from previous captured frame: 0.000014000 seconds]
    [Time delta from previous displayed frame: 0.000014000 seconds]
    [Time since reference or first frame: 158.728396000 seconds]
    Frame Number: 34
    Frame Length: 64 bytes (512 bits)
    Capture Length: 64 bytes (512 bits)
    [Frame is marked: False]
    [Frame is ignored: False]
    [Protocols in frame: usb]
USB URB
    [Source: 3.1.0]
    [Destination: host]
    URB id: 0xffff89fbe8d2e600
    URB type: URB_COMPLETE ('C')
    URB transfer type: URB_CONTROL (0x02)
    Endpoint: 0x00, Direction: OUT
        0... .... = Direction: OUT (0)
        .... 0000 = Endpoint number: 0
    Device: 1
    URB bus id: 3
    Device setup request: not relevant ('-')
    Data: not present ('>')
    URB sec: 1530473783
    URB usec: 590329
    URB status: Success (0)
    URB length [bytes]: 0
    Data length [bytes]: 0
    [Request in: 33]
    [Time from request: 0.000014000 seconds]
    Unused Setup Header
    Interval: 0
    Start frame: 0
    Copy of Transfer Flags: 0x00000000
    Number of ISO descriptors: 0
    [bInterfaceClass: Unknown (0xffff)]

0000  00 e6 d2 e8 fb 89 ff ff 43 02 00 01 03 00 2d 3e   ........C.....->
0010  37 2d 39 5b 00 00 00 00 f9 01 09 00 00 00 00 00   7-9[............
0020  00 00 00 00 00 00 00 00 00 00 00 00 00 00 00 00   ................
0030  00 00 00 00 00 00 00 00 00 00 00 00 00 00 00 00   ................

Frame 35: 64 bytes on wire (512 bits), 64 bytes captured (512 bits) on interface 0
    Interface id: 0 (unknown)
        Interface name: unknown
    Encapsulation type: USB packets with Linux header and padding (115)
    Arrival Time: Jul  1, 2018 15:36:23.650500000 EDT
    [Time shift for this packet: 0.000000000 seconds]
    Epoch Time: 1530473783.650500000 seconds
    [Time delta from previous captured frame: 0.060171000 seconds]
    [Time delta from previous displayed frame: 0.060171000 seconds]
    [Time since reference or first frame: 158.788567000 seconds]
    Frame Number: 35
    Frame Length: 64 bytes (512 bits)
    Capture Length: 64 bytes (512 bits)
    [Frame is marked: False]
    [Frame is ignored: False]
    [Protocols in frame: usb]
USB URB
    [Source: host]
    [Destination: 3.0.0]
    URB id: 0xffff89fbe8d2e600
    URB type: URB_SUBMIT ('S')
    URB transfer type: URB_CONTROL (0x02)
    Endpoint: 0x80, Direction: IN
        1... .... = Direction: IN (1)
        .... 0000 = Endpoint number: 0
    Device: 0
    URB bus id: 3
    Device setup request: relevant (0)
    Data: not present ('<')
    URB sec: 1530473783
    URB usec: 650500
    URB status: Operation now in progress (-EINPROGRESS) (-115)
    URB length [bytes]: 64
    Data length [bytes]: 0
    [Response in: 36]
    Interval: 0
    Start frame: 0
    Copy of Transfer Flags: 0x00000200
    Number of ISO descriptors: 0
URB setup
    bmRequestType: 0x80
        1... .... = Direction: Device-to-host
        .00. .... = Type: Standard (0x0)
        ...0 0000 = Recipient: Device (0x00)
    bRequest: GET DESCRIPTOR (6)
    Descriptor Index: 0x00
    bDescriptorType: 0x01
    Language Id: no language specified (0x0000)
    wLength: 64

0000  00 e6 d2 e8 fb 89 ff ff 53 02 80 00 03 00 00 3c   ........S......<
0010  37 2d 39 5b 00 00 00 00 04 ed 09 00 8d ff ff ff   7-9[............
0020  40 00 00 00 00 00 00 00 80 06 00 01 00 00 40 00   @.............@.
0030  00 00 00 00 00 00 00 00 00 02 00 00 00 00 00 00   ................

Frame 36: 82 bytes on wire (656 bits), 82 bytes captured (656 bits) on interface 0
    Interface id: 0 (unknown)
        Interface name: unknown
    Encapsulation type: USB packets with Linux header and padding (115)
    Arrival Time: Jul  1, 2018 15:36:23.652738000 EDT
    [Time shift for this packet: 0.000000000 seconds]
    Epoch Time: 1530473783.652738000 seconds
    [Time delta from previous captured frame: 0.002238000 seconds]
    [Time delta from previous displayed frame: 0.002238000 seconds]
    [Time since reference or first frame: 158.790805000 seconds]
    Frame Number: 36
    Frame Length: 82 bytes (656 bits)
    Capture Length: 82 bytes (656 bits)
    [Frame is marked: False]
    [Frame is ignored: False]
    [Protocols in frame: usb]
USB URB
    [Source: 3.0.0]
    [Destination: host]
    URB id: 0xffff89fbe8d2e600
    URB type: URB_COMPLETE ('C')
    URB transfer type: URB_CONTROL (0x02)
    Endpoint: 0x80, Direction: IN
        1... .... = Direction: IN (1)
        .... 0000 = Endpoint number: 0
    Device: 0
    URB bus id: 3
    Device setup request: not relevant ('-')
    Data: present (0)
    URB sec: 1530473783
    URB usec: 652738
    URB status: Success (0)
    URB length [bytes]: 18
    Data length [bytes]: 18
    [Request in: 35]
    [Time from request: 0.002238000 seconds]
    Unused Setup Header
    Interval: 0
    Start frame: 0
    Copy of Transfer Flags: 0x00000200
    Number of ISO descriptors: 0
DEVICE DESCRIPTOR
    bLength: 18
    bDescriptorType: 0x01 (DEVICE)
    bcdUSB: 0x0200
    bDeviceClass: Device (0x00)
    bDeviceSubClass: 0
    bDeviceProtocol: 0 (Use class code info from Interface Descriptors)
    bMaxPacketSize0: 64
    idVendor: Graphtec America, Inc. (0x0b4d)
    idProduct: Unknown (0x112f)
    bcdDevice: 0x0100
    iManufacturer: 0
    iProduct: 0
    iSerialNumber: 1
    bNumConfigurations: 1

0000  00 e6 d2 e8 fb 89 ff ff 43 02 80 00 03 00 2d 00   ........C.....-.
0010  37 2d 39 5b 00 00 00 00 c2 f5 09 00 00 00 00 00   7-9[............
0020  12 00 00 00 12 00 00 00 00 00 00 00 00 00 00 00   ................
0030  00 00 00 00 00 00 00 00 00 02 00 00 00 00 00 00   ................
0040  12 01 00 02 00 00 00 40 4d 0b 2f 11 00 01 00 00   .......@M./.....
0050  01 01                                             ..

Frame 37: 64 bytes on wire (512 bits), 64 bytes captured (512 bits) on interface 0
    Interface id: 0 (unknown)
        Interface name: unknown
    Encapsulation type: USB packets with Linux header and padding (115)
    Arrival Time: Jul  1, 2018 15:36:23.652778000 EDT
    [Time shift for this packet: 0.000000000 seconds]
    Epoch Time: 1530473783.652778000 seconds
    [Time delta from previous captured frame: 0.000040000 seconds]
    [Time delta from previous displayed frame: 0.000040000 seconds]
    [Time since reference or first frame: 158.790845000 seconds]
    Frame Number: 37
    Frame Length: 64 bytes (512 bits)
    Capture Length: 64 bytes (512 bits)
    [Frame is marked: False]
    [Frame is ignored: False]
    [Protocols in frame: usb:usbhub]
USB URB
    [Source: host]
    [Destination: 3.1.0]
    URB id: 0xffff89fbe8d2e600
    URB type: URB_SUBMIT ('S')
    URB transfer type: URB_CONTROL (0x02)
    Endpoint: 0x00, Direction: OUT
        0... .... = Direction: OUT (0)
        .... 0000 = Endpoint number: 0
    Device: 1
    URB bus id: 3
    Device setup request: relevant (0)
    Data: present (0)
    URB sec: 1530473783
    URB usec: 652778
    URB status: Operation now in progress (-EINPROGRESS) (-115)
    URB length [bytes]: 0
    Data length [bytes]: 0
    [Response in: 38]
    Interval: 0
    Start frame: 0
    Copy of Transfer Flags: 0x00000000
    Number of ISO descriptors: 0
    [bInterfaceClass: Unknown (0xffff)]
URB setup
    bmRequestType: 0x23
        0... .... = Direction: Host-to-device
        .01. .... = Type: Class (0x1)
        ...0 0011 = Recipient: Other (0x03)
bRequest: SET_FEATURE (0x03)
wValue: 0x0004
    PortFeatureSelector: PORT_RESET (4)
wIndex: 1
    Port: 1
    PortSelector: 0
wLength: 0
    (zero): 0

0000  00 e6 d2 e8 fb 89 ff ff 53 02 00 01 03 00 00 00   ........S.......
0010  37 2d 39 5b 00 00 00 00 ea f5 09 00 8d ff ff ff   7-9[............
0020  00 00 00 00 00 00 00 00 23 03 04 00 01 00 00 00   ........#.......
0030  00 00 00 00 00 00 00 00 00 00 00 00 00 00 00 00   ................

Frame 38: 64 bytes on wire (512 bits), 64 bytes captured (512 bits) on interface 0
    Interface id: 0 (unknown)
        Interface name: unknown
    Encapsulation type: USB packets with Linux header and padding (115)
    Arrival Time: Jul  1, 2018 15:36:23.652805000 EDT
    [Time shift for this packet: 0.000000000 seconds]
    Epoch Time: 1530473783.652805000 seconds
    [Time delta from previous captured frame: 0.000027000 seconds]
    [Time delta from previous displayed frame: 0.000027000 seconds]
    [Time since reference or first frame: 158.790872000 seconds]
    Frame Number: 38
    Frame Length: 64 bytes (512 bits)
    Capture Length: 64 bytes (512 bits)
    [Frame is marked: False]
    [Frame is ignored: False]
    [Protocols in frame: usb]
USB URB
    [Source: 3.1.0]
    [Destination: host]
    URB id: 0xffff89fbe8d2e600
    URB type: URB_COMPLETE ('C')
    URB transfer type: URB_CONTROL (0x02)
    Endpoint: 0x00, Direction: OUT
        0... .... = Direction: OUT (0)
        .... 0000 = Endpoint number: 0
    Device: 1
    URB bus id: 3
    Device setup request: not relevant ('-')
    Data: not present ('>')
    URB sec: 1530473783
    URB usec: 652805
    URB status: Success (0)
    URB length [bytes]: 0
    Data length [bytes]: 0
    [Request in: 37]
    [Time from request: 0.000027000 seconds]
    Unused Setup Header
    Interval: 0
    Start frame: 0
    Copy of Transfer Flags: 0x00000000
    Number of ISO descriptors: 0
    [bInterfaceClass: Unknown (0xffff)]

0000  00 e6 d2 e8 fb 89 ff ff 43 02 00 01 03 00 2d 3e   ........C.....->
0010  37 2d 39 5b 00 00 00 00 05 f6 09 00 00 00 00 00   7-9[............
0020  00 00 00 00 00 00 00 00 00 00 00 00 00 00 00 00   ................
0030  00 00 00 00 00 00 00 00 00 00 00 00 00 00 00 00   ................

Frame 39: 64 bytes on wire (512 bits), 64 bytes captured (512 bits) on interface 0
    Interface id: 0 (unknown)
        Interface name: unknown
    Encapsulation type: USB packets with Linux header and padding (115)
    Arrival Time: Jul  1, 2018 15:36:23.718266000 EDT
    [Time shift for this packet: 0.000000000 seconds]
    Epoch Time: 1530473783.718266000 seconds
    [Time delta from previous captured frame: 0.065461000 seconds]
    [Time delta from previous displayed frame: 0.065461000 seconds]
    [Time since reference or first frame: 158.856333000 seconds]
    Frame Number: 39
    Frame Length: 64 bytes (512 bits)
    Capture Length: 64 bytes (512 bits)
    [Frame is marked: False]
    [Frame is ignored: False]
    [Protocols in frame: usb:usbhub]
USB URB
    [Source: host]
    [Destination: 3.1.0]
    URB id: 0xffff89fbe8d2e600
    URB type: URB_SUBMIT ('S')
    URB transfer type: URB_CONTROL (0x02)
    Endpoint: 0x80, Direction: IN
        1... .... = Direction: IN (1)
        .... 0000 = Endpoint number: 0
    Device: 1
    URB bus id: 3
    Device setup request: relevant (0)
    Data: not present ('<')
    URB sec: 1530473783
    URB usec: 718266
    URB status: Operation now in progress (-EINPROGRESS) (-115)
    URB length [bytes]: 4
    Data length [bytes]: 0
    [Response in: 40]
    Interval: 0
    Start frame: 0
    Copy of Transfer Flags: 0x00000200
    Number of ISO descriptors: 0
    [bInterfaceClass: Unknown (0xffff)]
URB setup
    bmRequestType: 0xa3
        1... .... = Direction: Device-to-host
        .01. .... = Type: Class (0x1)
        ...0 0011 = Recipient: Other (0x03)
bRequest: GET_STATUS (0x00)
wValue: 0x0000
    (zero): 0
wIndex: 1
    Port: 1
wLength: 4

0000  00 e6 d2 e8 fb 89 ff ff 53 02 80 01 03 00 00 3c   ........S......<
0010  37 2d 39 5b 00 00 00 00 ba f5 0a 00 8d ff ff ff   7-9[............
0020  04 00 00 00 00 00 00 00 a3 00 00 00 01 00 04 00   ................
0030  00 00 00 00 00 00 00 00 00 02 00 00 00 00 00 00   ................

Frame 40: 68 bytes on wire (544 bits), 68 bytes captured (544 bits) on interface 0
    Interface id: 0 (unknown)
        Interface name: unknown
    Encapsulation type: USB packets with Linux header and padding (115)
    Arrival Time: Jul  1, 2018 15:36:23.718305000 EDT
    [Time shift for this packet: 0.000000000 seconds]
    Epoch Time: 1530473783.718305000 seconds
    [Time delta from previous captured frame: 0.000039000 seconds]
    [Time delta from previous displayed frame: 0.000039000 seconds]
    [Time since reference or first frame: 158.856372000 seconds]
    Frame Number: 40
    Frame Length: 68 bytes (544 bits)
    Capture Length: 68 bytes (544 bits)
    [Frame is marked: False]
    [Frame is ignored: False]
    [Protocols in frame: usb:usbhub]
USB URB
    [Source: 3.1.0]
    [Destination: host]
    URB id: 0xffff89fbe8d2e600
    URB type: URB_COMPLETE ('C')
    URB transfer type: URB_CONTROL (0x02)
    Endpoint: 0x80, Direction: IN
        1... .... = Direction: IN (1)
        .... 0000 = Endpoint number: 0
    Device: 1
    URB bus id: 3
    Device setup request: not relevant ('-')
    Data: present (0)
    URB sec: 1530473783
    URB usec: 718305
    URB status: Success (0)
    URB length [bytes]: 4
    Data length [bytes]: 4
    [Request in: 39]
    [Time from request: 0.000039000 seconds]
    Unused Setup Header
    Interval: 0
    Start frame: 0
    Copy of Transfer Flags: 0x00000200
    Number of ISO descriptors: 0
    [bInterfaceClass: Unknown (0xffff)]
Port Status: 0x0103, PORT_CONNECTION, PORT_ENABLE, PORT_POWER
    .... .... .... ...1 = PORT_CONNECTION: True
    .... .... .... ..1. = PORT_ENABLE: True
    .... .... .... .0.. = PORT_SUSPEND: False
    .... .... .... 0... = PORT_OVER_CURRENT: False
    .... .... ...0 .... = PORT_RESET: False
    .... ...1 .... .... = PORT_POWER: True
    .... ..0. .... .... = PORT_LOW_SPEED: False
    .... .0.. .... .... = PORT_HIGH_SPEED: False
    .... 0... .... .... = PORT_TEST: False
    ...0 .... .... .... = PORT_INDICATOR: Default colors
Port Change: 0x0010, C_PORT_RESET
    .... .... .... ...0 = C_PORT_CONNECTION: False
    .... .... .... ..0. = C_PORT_ENABLE: False
    .... .... .... .0.. = C_PORT_SUSPEND: False
    .... .... .... 0... = C_PORT_OVER_CURRENT: False
    .... .... ...1 .... = C_PORT_RESET: True

0000  00 e6 d2 e8 fb 89 ff ff 43 02 80 01 03 00 2d 00   ........C.....-.
0010  37 2d 39 5b 00 00 00 00 e1 f5 0a 00 00 00 00 00   7-9[............
0020  04 00 00 00 04 00 00 00 00 00 00 00 00 00 00 00   ................
0030  00 00 00 00 00 00 00 00 00 02 00 00 00 00 00 00   ................
0040  03 01 10 00                                       ....

Frame 41: 64 bytes on wire (512 bits), 64 bytes captured (512 bits) on interface 0
    Interface id: 0 (unknown)
        Interface name: unknown
    Encapsulation type: USB packets with Linux header and padding (115)
    Arrival Time: Jul  1, 2018 15:36:23.718319000 EDT
    [Time shift for this packet: 0.000000000 seconds]
    Epoch Time: 1530473783.718319000 seconds
    [Time delta from previous captured frame: 0.000014000 seconds]
    [Time delta from previous displayed frame: 0.000014000 seconds]
    [Time since reference or first frame: 158.856386000 seconds]
    Frame Number: 41
    Frame Length: 64 bytes (512 bits)
    Capture Length: 64 bytes (512 bits)
    [Frame is marked: False]
    [Frame is ignored: False]
    [Protocols in frame: usb:usbhub]
USB URB
    [Source: host]
    [Destination: 3.1.0]
    URB id: 0xffff89fbe8d2e600
    URB type: URB_SUBMIT ('S')
    URB transfer type: URB_CONTROL (0x02)
    Endpoint: 0x00, Direction: OUT
        0... .... = Direction: OUT (0)
        .... 0000 = Endpoint number: 0
    Device: 1
    URB bus id: 3
    Device setup request: relevant (0)
    Data: present (0)
    URB sec: 1530473783
    URB usec: 718319
    URB status: Operation now in progress (-EINPROGRESS) (-115)
    URB length [bytes]: 0
    Data length [bytes]: 0
    [Response in: 42]
    Interval: 0
    Start frame: 0
    Copy of Transfer Flags: 0x00000000
    Number of ISO descriptors: 0
    [bInterfaceClass: Unknown (0xffff)]
URB setup
    bmRequestType: 0x23
        0... .... = Direction: Host-to-device
        .01. .... = Type: Class (0x1)
        ...0 0011 = Recipient: Other (0x03)
bRequest: CLEAR_FEATURE (0x01)
wValue: 0x0014
    PortFeatureSelector: C_PORT_RESET (20)
wIndex: 1
    Port: 1
    PortSelector: 0
wLength: 0
    (zero): 0

0000  00 e6 d2 e8 fb 89 ff ff 53 02 00 01 03 00 00 00   ........S.......
0010  37 2d 39 5b 00 00 00 00 ef f5 0a 00 8d ff ff ff   7-9[............
0020  00 00 00 00 00 00 00 00 23 01 14 00 01 00 00 00   ........#.......
0030  00 00 00 00 00 00 00 00 00 00 00 00 00 00 00 00   ................

Frame 42: 64 bytes on wire (512 bits), 64 bytes captured (512 bits) on interface 0
    Interface id: 0 (unknown)
        Interface name: unknown
    Encapsulation type: USB packets with Linux header and padding (115)
    Arrival Time: Jul  1, 2018 15:36:23.718332000 EDT
    [Time shift for this packet: 0.000000000 seconds]
    Epoch Time: 1530473783.718332000 seconds
    [Time delta from previous captured frame: 0.000013000 seconds]
    [Time delta from previous displayed frame: 0.000013000 seconds]
    [Time since reference or first frame: 158.856399000 seconds]
    Frame Number: 42
    Frame Length: 64 bytes (512 bits)
    Capture Length: 64 bytes (512 bits)
    [Frame is marked: False]
    [Frame is ignored: False]
    [Protocols in frame: usb]
USB URB
    [Source: 3.1.0]
    [Destination: host]
    URB id: 0xffff89fbe8d2e600
    URB type: URB_COMPLETE ('C')
    URB transfer type: URB_CONTROL (0x02)
    Endpoint: 0x00, Direction: OUT
        0... .... = Direction: OUT (0)
        .... 0000 = Endpoint number: 0
    Device: 1
    URB bus id: 3
    Device setup request: not relevant ('-')
    Data: not present ('>')
    URB sec: 1530473783
    URB usec: 718332
    URB status: Success (0)
    URB length [bytes]: 0
    Data length [bytes]: 0
    [Request in: 41]
    [Time from request: 0.000013000 seconds]
    Unused Setup Header
    Interval: 0
    Start frame: 0
    Copy of Transfer Flags: 0x00000000
    Number of ISO descriptors: 0
    [bInterfaceClass: Unknown (0xffff)]

0000  00 e6 d2 e8 fb 89 ff ff 43 02 00 01 03 00 2d 3e   ........C.....->
0010  37 2d 39 5b 00 00 00 00 fc f5 0a 00 00 00 00 00   7-9[............
0020  00 00 00 00 00 00 00 00 00 00 00 00 00 00 00 00   ................
0030  00 00 00 00 00 00 00 00 00 00 00 00 00 00 00 00   ................

Frame 43: 64 bytes on wire (512 bits), 64 bytes captured (512 bits) on interface 0
    Interface id: 0 (unknown)
        Interface name: unknown
    Encapsulation type: USB packets with Linux header and padding (115)
    Arrival Time: Jul  1, 2018 15:36:23.798266000 EDT
    [Time shift for this packet: 0.000000000 seconds]
    Epoch Time: 1530473783.798266000 seconds
    [Time delta from previous captured frame: 0.079934000 seconds]
    [Time delta from previous displayed frame: 0.079934000 seconds]
    [Time since reference or first frame: 158.936333000 seconds]
    Frame Number: 43
    Frame Length: 64 bytes (512 bits)
    Capture Length: 64 bytes (512 bits)
    [Frame is marked: False]
    [Frame is ignored: False]
    [Protocols in frame: usb]
USB URB
    [Source: host]
    [Destination: 3.3.0]
    URB id: 0xffff89fbe8d2e600
    URB type: URB_SUBMIT ('S')
    URB transfer type: URB_CONTROL (0x02)
    Endpoint: 0x80, Direction: IN
        1... .... = Direction: IN (1)
        .... 0000 = Endpoint number: 0
    Device: 3
    URB bus id: 3
    Device setup request: relevant (0)
    Data: not present ('<')
    URB sec: 1530473783
    URB usec: 798266
    URB status: Operation now in progress (-EINPROGRESS) (-115)
    URB length [bytes]: 18
    Data length [bytes]: 0
    [Response in: 44]
    Interval: 0
    Start frame: 0
    Copy of Transfer Flags: 0x00000200
    Number of ISO descriptors: 0
URB setup
    bmRequestType: 0x80
        1... .... = Direction: Device-to-host
        .00. .... = Type: Standard (0x0)
        ...0 0000 = Recipient: Device (0x00)
    bRequest: GET DESCRIPTOR (6)
    Descriptor Index: 0x00
    bDescriptorType: 0x01
    Language Id: no language specified (0x0000)
    wLength: 18

0000  00 e6 d2 e8 fb 89 ff ff 53 02 80 03 03 00 00 3c   ........S......<
0010  37 2d 39 5b 00 00 00 00 3a 2e 0c 00 8d ff ff ff   7-9[....:.......
0020  12 00 00 00 00 00 00 00 80 06 00 01 00 00 12 00   ................
0030  00 00 00 00 00 00 00 00 00 02 00 00 00 00 00 00   ................

Frame 44: 82 bytes on wire (656 bits), 82 bytes captured (656 bits) on interface 0
    Interface id: 0 (unknown)
        Interface name: unknown
    Encapsulation type: USB packets with Linux header and padding (115)
    Arrival Time: Jul  1, 2018 15:36:23.800652000 EDT
    [Time shift for this packet: 0.000000000 seconds]
    Epoch Time: 1530473783.800652000 seconds
    [Time delta from previous captured frame: 0.002386000 seconds]
    [Time delta from previous displayed frame: 0.002386000 seconds]
    [Time since reference or first frame: 158.938719000 seconds]
    Frame Number: 44
    Frame Length: 82 bytes (656 bits)
    Capture Length: 82 bytes (656 bits)
    [Frame is marked: False]
    [Frame is ignored: False]
    [Protocols in frame: usb]
USB URB
    [Source: 3.3.0]
    [Destination: host]
    URB id: 0xffff89fbe8d2e600
    URB type: URB_COMPLETE ('C')
    URB transfer type: URB_CONTROL (0x02)
    Endpoint: 0x80, Direction: IN
        1... .... = Direction: IN (1)
        .... 0000 = Endpoint number: 0
    Device: 3
    URB bus id: 3
    Device setup request: not relevant ('-')
    Data: present (0)
    URB sec: 1530473783
    URB usec: 800652
    URB status: Success (0)
    URB length [bytes]: 18
    Data length [bytes]: 18
    [Request in: 43]
    [Time from request: 0.002386000 seconds]
    Unused Setup Header
    Interval: 0
    Start frame: 0
    Copy of Transfer Flags: 0x00000200
    Number of ISO descriptors: 0
DEVICE DESCRIPTOR
    bLength: 18
    bDescriptorType: 0x01 (DEVICE)
    bcdUSB: 0x0200
    bDeviceClass: Device (0x00)
    bDeviceSubClass: 0
    bDeviceProtocol: 0 (Use class code info from Interface Descriptors)
    bMaxPacketSize0: 64
    idVendor: Graphtec America, Inc. (0x0b4d)
    idProduct: Unknown (0x112f)
    bcdDevice: 0x0100
    iManufacturer: 0
    iProduct: 0
    iSerialNumber: 1
    bNumConfigurations: 1

0000  00 e6 d2 e8 fb 89 ff ff 43 02 80 03 03 00 2d 00   ........C.....-.
0010  37 2d 39 5b 00 00 00 00 8c 37 0c 00 00 00 00 00   7-9[.....7......
0020  12 00 00 00 12 00 00 00 00 00 00 00 00 00 00 00   ................
0030  00 00 00 00 00 00 00 00 00 02 00 00 00 00 00 00   ................
0040  12 01 00 02 00 00 00 40 4d 0b 2f 11 00 01 00 00   .......@M./.....
0050  01 01                                             ..

Frame 45: 64 bytes on wire (512 bits), 64 bytes captured (512 bits) on interface 0
    Interface id: 0 (unknown)
        Interface name: unknown
    Encapsulation type: USB packets with Linux header and padding (115)
    Arrival Time: Jul  1, 2018 15:36:23.800701000 EDT
    [Time shift for this packet: 0.000000000 seconds]
    Epoch Time: 1530473783.800701000 seconds
    [Time delta from previous captured frame: 0.000049000 seconds]
    [Time delta from previous displayed frame: 0.000049000 seconds]
    [Time since reference or first frame: 158.938768000 seconds]
    Frame Number: 45
    Frame Length: 64 bytes (512 bits)
    Capture Length: 64 bytes (512 bits)
    [Frame is marked: False]
    [Frame is ignored: False]
    [Protocols in frame: usb]
USB URB
    [Source: host]
    [Destination: 3.3.0]
    URB id: 0xffff89fbe8d2e600
    URB type: URB_SUBMIT ('S')
    URB transfer type: URB_CONTROL (0x02)
    Endpoint: 0x80, Direction: IN
        1... .... = Direction: IN (1)
        .... 0000 = Endpoint number: 0
    Device: 3
    URB bus id: 3
    Device setup request: relevant (0)
    Data: not present ('<')
    URB sec: 1530473783
    URB usec: 800701
    URB status: Operation now in progress (-EINPROGRESS) (-115)
    URB length [bytes]: 10
    Data length [bytes]: 0
    [Response in: 46]
    Interval: 0
    Start frame: 0
    Copy of Transfer Flags: 0x00000200
    Number of ISO descriptors: 0
URB setup
    bmRequestType: 0x80
        1... .... = Direction: Device-to-host
        .00. .... = Type: Standard (0x0)
        ...0 0000 = Recipient: Device (0x00)
    bRequest: GET DESCRIPTOR (6)
    Descriptor Index: 0x00
    bDescriptorType: 0x06
    Language Id: no language specified (0x0000)
    wLength: 10

0000  00 e6 d2 e8 fb 89 ff ff 53 02 80 03 03 00 00 3c   ........S......<
0010  37 2d 39 5b 00 00 00 00 bd 37 0c 00 8d ff ff ff   7-9[.....7......
0020  0a 00 00 00 00 00 00 00 80 06 00 06 00 00 0a 00   ................
0030  00 00 00 00 00 00 00 00 00 02 00 00 00 00 00 00   ................

Frame 46: 64 bytes on wire (512 bits), 64 bytes captured (512 bits) on interface 0
    Interface id: 0 (unknown)
        Interface name: unknown
    Encapsulation type: USB packets with Linux header and padding (115)
    Arrival Time: Jul  1, 2018 15:36:23.802655000 EDT
    [Time shift for this packet: 0.000000000 seconds]
    Epoch Time: 1530473783.802655000 seconds
    [Time delta from previous captured frame: 0.001954000 seconds]
    [Time delta from previous displayed frame: 0.001954000 seconds]
    [Time since reference or first frame: 158.940722000 seconds]
    Frame Number: 46
    Frame Length: 64 bytes (512 bits)
    Capture Length: 64 bytes (512 bits)
    [Frame is marked: False]
    [Frame is ignored: False]
    [Protocols in frame: usb]
USB URB
    [Source: 3.3.0]
    [Destination: host]
    URB id: 0xffff89fbe8d2e600
    URB type: URB_COMPLETE ('C')
    URB transfer type: URB_CONTROL (0x02)
    Endpoint: 0x80, Direction: IN
        1... .... = Direction: IN (1)
        .... 0000 = Endpoint number: 0
    Device: 3
    URB bus id: 3
    Device setup request: not relevant ('-')
    Data: present (0)
    URB sec: 1530473783
    URB usec: 802655
    URB status: Broken pipe (-EPIPE) (-32)
    URB length [bytes]: 0
    Data length [bytes]: 0
    [Request in: 45]
    [Time from request: 0.001954000 seconds]
    Unused Setup Header
    Interval: 0
    Start frame: 0
    Copy of Transfer Flags: 0x00000200
    Number of ISO descriptors: 0

0000  00 e6 d2 e8 fb 89 ff ff 43 02 80 03 03 00 2d 00   ........C.....-.
0010  37 2d 39 5b 00 00 00 00 5f 3f 0c 00 e0 ff ff ff   7-9[...._?......
0020  00 00 00 00 00 00 00 00 00 00 00 00 00 00 00 00   ................
0030  00 00 00 00 00 00 00 00 00 02 00 00 00 00 00 00   ................

Frame 47: 64 bytes on wire (512 bits), 64 bytes captured (512 bits) on interface 0
    Interface id: 0 (unknown)
        Interface name: unknown
    Encapsulation type: USB packets with Linux header and padding (115)
    Arrival Time: Jul  1, 2018 15:36:23.802695000 EDT
    [Time shift for this packet: 0.000000000 seconds]
    Epoch Time: 1530473783.802695000 seconds
    [Time delta from previous captured frame: 0.000040000 seconds]
    [Time delta from previous displayed frame: 0.000040000 seconds]
    [Time since reference or first frame: 158.940762000 seconds]
    Frame Number: 47
    Frame Length: 64 bytes (512 bits)
    Capture Length: 64 bytes (512 bits)
    [Frame is marked: False]
    [Frame is ignored: False]
    [Protocols in frame: usb]
USB URB
    [Source: host]
    [Destination: 3.3.0]
    URB id: 0xffff89fbe8d2e600
    URB type: URB_SUBMIT ('S')
    URB transfer type: URB_CONTROL (0x02)
    Endpoint: 0x80, Direction: IN
        1... .... = Direction: IN (1)
        .... 0000 = Endpoint number: 0
    Device: 3
    URB bus id: 3
    Device setup request: relevant (0)
    Data: not present ('<')
    URB sec: 1530473783
    URB usec: 802695
    URB status: Operation now in progress (-EINPROGRESS) (-115)
    URB length [bytes]: 10
    Data length [bytes]: 0
    [Response in: 48]
    Interval: 0
    Start frame: 0
    Copy of Transfer Flags: 0x00000200
    Number of ISO descriptors: 0
URB setup
    bmRequestType: 0x80
        1... .... = Direction: Device-to-host
        .00. .... = Type: Standard (0x0)
        ...0 0000 = Recipient: Device (0x00)
    bRequest: GET DESCRIPTOR (6)
    Descriptor Index: 0x00
    bDescriptorType: 0x06
    Language Id: no language specified (0x0000)
    wLength: 10

0000  00 e6 d2 e8 fb 89 ff ff 53 02 80 03 03 00 00 3c   ........S......<
0010  37 2d 39 5b 00 00 00 00 87 3f 0c 00 8d ff ff ff   7-9[.....?......
0020  0a 00 00 00 00 00 00 00 80 06 00 06 00 00 0a 00   ................
0030  00 00 00 00 00 00 00 00 00 02 00 00 00 00 00 00   ................

Frame 48: 64 bytes on wire (512 bits), 64 bytes captured (512 bits) on interface 0
    Interface id: 0 (unknown)
        Interface name: unknown
    Encapsulation type: USB packets with Linux header and padding (115)
    Arrival Time: Jul  1, 2018 15:36:23.804654000 EDT
    [Time shift for this packet: 0.000000000 seconds]
    Epoch Time: 1530473783.804654000 seconds
    [Time delta from previous captured frame: 0.001959000 seconds]
    [Time delta from previous displayed frame: 0.001959000 seconds]
    [Time since reference or first frame: 158.942721000 seconds]
    Frame Number: 48
    Frame Length: 64 bytes (512 bits)
    Capture Length: 64 bytes (512 bits)
    [Frame is marked: False]
    [Frame is ignored: False]
    [Protocols in frame: usb]
USB URB
    [Source: 3.3.0]
    [Destination: host]
    URB id: 0xffff89fbe8d2e600
    URB type: URB_COMPLETE ('C')
    URB transfer type: URB_CONTROL (0x02)
    Endpoint: 0x80, Direction: IN
        1... .... = Direction: IN (1)
        .... 0000 = Endpoint number: 0
    Device: 3
    URB bus id: 3
    Device setup request: not relevant ('-')
    Data: present (0)
    URB sec: 1530473783
    URB usec: 804654
    URB status: Broken pipe (-EPIPE) (-32)
    URB length [bytes]: 0
    Data length [bytes]: 0
    [Request in: 47]
    [Time from request: 0.001959000 seconds]
    Unused Setup Header
    Interval: 0
    Start frame: 0
    Copy of Transfer Flags: 0x00000200
    Number of ISO descriptors: 0

0000  00 e6 d2 e8 fb 89 ff ff 43 02 80 03 03 00 2d 00   ........C.....-.
0010  37 2d 39 5b 00 00 00 00 2e 47 0c 00 e0 ff ff ff   7-9[.....G......
0020  00 00 00 00 00 00 00 00 00 00 00 00 00 00 00 00   ................
0030  00 00 00 00 00 00 00 00 00 02 00 00 00 00 00 00   ................

Frame 49: 64 bytes on wire (512 bits), 64 bytes captured (512 bits) on interface 0
    Interface id: 0 (unknown)
        Interface name: unknown
    Encapsulation type: USB packets with Linux header and padding (115)
    Arrival Time: Jul  1, 2018 15:36:23.804697000 EDT
    [Time shift for this packet: 0.000000000 seconds]
    Epoch Time: 1530473783.804697000 seconds
    [Time delta from previous captured frame: 0.000043000 seconds]
    [Time delta from previous displayed frame: 0.000043000 seconds]
    [Time since reference or first frame: 158.942764000 seconds]
    Frame Number: 49
    Frame Length: 64 bytes (512 bits)
    Capture Length: 64 bytes (512 bits)
    [Frame is marked: False]
    [Frame is ignored: False]
    [Protocols in frame: usb]
USB URB
    [Source: host]
    [Destination: 3.3.0]
    URB id: 0xffff89fbe8d2e600
    URB type: URB_SUBMIT ('S')
    URB transfer type: URB_CONTROL (0x02)
    Endpoint: 0x80, Direction: IN
        1... .... = Direction: IN (1)
        .... 0000 = Endpoint number: 0
    Device: 3
    URB bus id: 3
    Device setup request: relevant (0)
    Data: not present ('<')
    URB sec: 1530473783
    URB usec: 804697
    URB status: Operation now in progress (-EINPROGRESS) (-115)
    URB length [bytes]: 10
    Data length [bytes]: 0
    [Response in: 50]
    Interval: 0
    Start frame: 0
    Copy of Transfer Flags: 0x00000200
    Number of ISO descriptors: 0
URB setup
    bmRequestType: 0x80
        1... .... = Direction: Device-to-host
        .00. .... = Type: Standard (0x0)
        ...0 0000 = Recipient: Device (0x00)
    bRequest: GET DESCRIPTOR (6)
    Descriptor Index: 0x00
    bDescriptorType: 0x06
    Language Id: no language specified (0x0000)
    wLength: 10

0000  00 e6 d2 e8 fb 89 ff ff 53 02 80 03 03 00 00 3c   ........S......<
0010  37 2d 39 5b 00 00 00 00 59 47 0c 00 8d ff ff ff   7-9[....YG......
0020  0a 00 00 00 00 00 00 00 80 06 00 06 00 00 0a 00   ................
0030  00 00 00 00 00 00 00 00 00 02 00 00 00 00 00 00   ................

Frame 50: 64 bytes on wire (512 bits), 64 bytes captured (512 bits) on interface 0
    Interface id: 0 (unknown)
        Interface name: unknown
    Encapsulation type: USB packets with Linux header and padding (115)
    Arrival Time: Jul  1, 2018 15:36:23.806642000 EDT
    [Time shift for this packet: 0.000000000 seconds]
    Epoch Time: 1530473783.806642000 seconds
    [Time delta from previous captured frame: 0.001945000 seconds]
    [Time delta from previous displayed frame: 0.001945000 seconds]
    [Time since reference or first frame: 158.944709000 seconds]
    Frame Number: 50
    Frame Length: 64 bytes (512 bits)
    Capture Length: 64 bytes (512 bits)
    [Frame is marked: False]
    [Frame is ignored: False]
    [Protocols in frame: usb]
USB URB
    [Source: 3.3.0]
    [Destination: host]
    URB id: 0xffff89fbe8d2e600
    URB type: URB_COMPLETE ('C')
    URB transfer type: URB_CONTROL (0x02)
    Endpoint: 0x80, Direction: IN
        1... .... = Direction: IN (1)
        .... 0000 = Endpoint number: 0
    Device: 3
    URB bus id: 3
    Device setup request: not relevant ('-')
    Data: present (0)
    URB sec: 1530473783
    URB usec: 806642
    URB status: Broken pipe (-EPIPE) (-32)
    URB length [bytes]: 0
    Data length [bytes]: 0
    [Request in: 49]
    [Time from request: 0.001945000 seconds]
    Unused Setup Header
    Interval: 0
    Start frame: 0
    Copy of Transfer Flags: 0x00000200
    Number of ISO descriptors: 0

0000  00 e6 d2 e8 fb 89 ff ff 43 02 80 03 03 00 2d 00   ........C.....-.
0010  37 2d 39 5b 00 00 00 00 f2 4e 0c 00 e0 ff ff ff   7-9[.....N......
0020  00 00 00 00 00 00 00 00 00 00 00 00 00 00 00 00   ................
0030  00 00 00 00 00 00 00 00 00 02 00 00 00 00 00 00   ................

Frame 51: 64 bytes on wire (512 bits), 64 bytes captured (512 bits) on interface 0
    Interface id: 0 (unknown)
        Interface name: unknown
    Encapsulation type: USB packets with Linux header and padding (115)
    Arrival Time: Jul  1, 2018 15:36:23.806661000 EDT
    [Time shift for this packet: 0.000000000 seconds]
    Epoch Time: 1530473783.806661000 seconds
    [Time delta from previous captured frame: 0.000019000 seconds]
    [Time delta from previous displayed frame: 0.000019000 seconds]
    [Time since reference or first frame: 158.944728000 seconds]
    Frame Number: 51
    Frame Length: 64 bytes (512 bits)
    Capture Length: 64 bytes (512 bits)
    [Frame is marked: False]
    [Frame is ignored: False]
    [Protocols in frame: usb]
USB URB
    [Source: host]
    [Destination: 3.3.0]
    URB id: 0xffff89fbe8d2e600
    URB type: URB_SUBMIT ('S')
    URB transfer type: URB_CONTROL (0x02)
    Endpoint: 0x80, Direction: IN
        1... .... = Direction: IN (1)
        .... 0000 = Endpoint number: 0
    Device: 3
    URB bus id: 3
    Device setup request: relevant (0)
    Data: not present ('<')
    URB sec: 1530473783
    URB usec: 806661
    URB status: Operation now in progress (-EINPROGRESS) (-115)
    URB length [bytes]: 9
    Data length [bytes]: 0
    [Response in: 52]
    Interval: 0
    Start frame: 0
    Copy of Transfer Flags: 0x00000200
    Number of ISO descriptors: 0
URB setup
    bmRequestType: 0x80
        1... .... = Direction: Device-to-host
        .00. .... = Type: Standard (0x0)
        ...0 0000 = Recipient: Device (0x00)
    bRequest: GET DESCRIPTOR (6)
    Descriptor Index: 0x00
    bDescriptorType: 0x02
    Language Id: no language specified (0x0000)
    wLength: 9

0000  00 e6 d2 e8 fb 89 ff ff 53 02 80 03 03 00 00 3c   ........S......<
0010  37 2d 39 5b 00 00 00 00 05 4f 0c 00 8d ff ff ff   7-9[.....O......
0020  09 00 00 00 00 00 00 00 80 06 00 02 00 00 09 00   ................
0030  00 00 00 00 00 00 00 00 00 02 00 00 00 00 00 00   ................

Frame 52: 73 bytes on wire (584 bits), 73 bytes captured (584 bits) on interface 0
    Interface id: 0 (unknown)
        Interface name: unknown
    Encapsulation type: USB packets with Linux header and padding (115)
    Arrival Time: Jul  1, 2018 15:36:23.809638000 EDT
    [Time shift for this packet: 0.000000000 seconds]
    Epoch Time: 1530473783.809638000 seconds
    [Time delta from previous captured frame: 0.002977000 seconds]
    [Time delta from previous displayed frame: 0.002977000 seconds]
    [Time since reference or first frame: 158.947705000 seconds]
    Frame Number: 52
    Frame Length: 73 bytes (584 bits)
    Capture Length: 73 bytes (584 bits)
    [Frame is marked: False]
    [Frame is ignored: False]
    [Protocols in frame: usb]
USB URB
    [Source: 3.3.0]
    [Destination: host]
    URB id: 0xffff89fbe8d2e600
    URB type: URB_COMPLETE ('C')
    URB transfer type: URB_CONTROL (0x02)
    Endpoint: 0x80, Direction: IN
        1... .... = Direction: IN (1)
        .... 0000 = Endpoint number: 0
    Device: 3
    URB bus id: 3
    Device setup request: not relevant ('-')
    Data: present (0)
    URB sec: 1530473783
    URB usec: 809638
    URB status: Success (0)
    URB length [bytes]: 9
    Data length [bytes]: 9
    [Request in: 51]
    [Time from request: 0.002977000 seconds]
    Unused Setup Header
    Interval: 0
    Start frame: 0
    Copy of Transfer Flags: 0x00000200
    Number of ISO descriptors: 0
CONFIGURATION DESCRIPTOR
    bLength: 9
    bDescriptorType: 0x02 (CONFIGURATION)
    wTotalLength: 32
    bNumInterfaces: 1
    bConfigurationValue: 1
    iConfiguration: 0
    Configuration bmAttributes: 0xc0  SELF-POWERED  NO REMOTE-WAKEUP
        1... .... = Must be 1: Must be 1 for USB 1.1 and higher
        .1.. .... = Self-Powered: This device is SELF-POWERED
        ..0. .... = Remote Wakeup: This device does NOT support remote wakeup
    bMaxPower: 50  (100mA)

0000  00 e6 d2 e8 fb 89 ff ff 43 02 80 03 03 00 2d 00   ........C.....-.
0010  37 2d 39 5b 00 00 00 00 a6 5a 0c 00 00 00 00 00   7-9[.....Z......
0020  09 00 00 00 09 00 00 00 00 00 00 00 00 00 00 00   ................
0030  00 00 00 00 00 00 00 00 00 02 00 00 00 00 00 00   ................
0040  09 02 20 00 01 01 00 c0 32                        .. .....2

Frame 53: 64 bytes on wire (512 bits), 64 bytes captured (512 bits) on interface 0
    Interface id: 0 (unknown)
        Interface name: unknown
    Encapsulation type: USB packets with Linux header and padding (115)
    Arrival Time: Jul  1, 2018 15:36:23.809653000 EDT
    [Time shift for this packet: 0.000000000 seconds]
    Epoch Time: 1530473783.809653000 seconds
    [Time delta from previous captured frame: 0.000015000 seconds]
    [Time delta from previous displayed frame: 0.000015000 seconds]
    [Time since reference or first frame: 158.947720000 seconds]
    Frame Number: 53
    Frame Length: 64 bytes (512 bits)
    Capture Length: 64 bytes (512 bits)
    [Frame is marked: False]
    [Frame is ignored: False]
    [Protocols in frame: usb]
USB URB
    [Source: host]
    [Destination: 3.3.0]
    URB id: 0xffff89fbe8d2e600
    URB type: URB_SUBMIT ('S')
    URB transfer type: URB_CONTROL (0x02)
    Endpoint: 0x80, Direction: IN
        1... .... = Direction: IN (1)
        .... 0000 = Endpoint number: 0
    Device: 3
    URB bus id: 3
    Device setup request: relevant (0)
    Data: not present ('<')
    URB sec: 1530473783
    URB usec: 809653
    URB status: Operation now in progress (-EINPROGRESS) (-115)
    URB length [bytes]: 32
    Data length [bytes]: 0
    [Response in: 54]
    Interval: 0
    Start frame: 0
    Copy of Transfer Flags: 0x00000200
    Number of ISO descriptors: 0
URB setup
    bmRequestType: 0x80
        1... .... = Direction: Device-to-host
        .00. .... = Type: Standard (0x0)
        ...0 0000 = Recipient: Device (0x00)
    bRequest: GET DESCRIPTOR (6)
    Descriptor Index: 0x00
    bDescriptorType: 0x02
    Language Id: no language specified (0x0000)
    wLength: 32

0000  00 e6 d2 e8 fb 89 ff ff 53 02 80 03 03 00 00 3c   ........S......<
0010  37 2d 39 5b 00 00 00 00 b5 5a 0c 00 8d ff ff ff   7-9[.....Z......
0020  20 00 00 00 00 00 00 00 80 06 00 02 00 00 20 00    ............. .
0030  00 00 00 00 00 00 00 00 00 02 00 00 00 00 00 00   ................

Frame 54: 96 bytes on wire (768 bits), 96 bytes captured (768 bits) on interface 0
    Interface id: 0 (unknown)
        Interface name: unknown
    Encapsulation type: USB packets with Linux header and padding (115)
    Arrival Time: Jul  1, 2018 15:36:23.812640000 EDT
    [Time shift for this packet: 0.000000000 seconds]
    Epoch Time: 1530473783.812640000 seconds
    [Time delta from previous captured frame: 0.002987000 seconds]
    [Time delta from previous displayed frame: 0.002987000 seconds]
    [Time since reference or first frame: 158.950707000 seconds]
    Frame Number: 54
    Frame Length: 96 bytes (768 bits)
    Capture Length: 96 bytes (768 bits)
    [Frame is marked: False]
    [Frame is ignored: False]
    [Protocols in frame: usb]
USB URB
    [Source: 3.3.0]
    [Destination: host]
    URB id: 0xffff89fbe8d2e600
    URB type: URB_COMPLETE ('C')
    URB transfer type: URB_CONTROL (0x02)
    Endpoint: 0x80, Direction: IN
        1... .... = Direction: IN (1)
        .... 0000 = Endpoint number: 0
    Device: 3
    URB bus id: 3
    Device setup request: not relevant ('-')
    Data: present (0)
    URB sec: 1530473783
    URB usec: 812640
    URB status: Success (0)
    URB length [bytes]: 32
    Data length [bytes]: 32
    [Request in: 53]
    [Time from request: 0.002987000 seconds]
    Unused Setup Header
    Interval: 0
    Start frame: 0
    Copy of Transfer Flags: 0x00000200
    Number of ISO descriptors: 0
CONFIGURATION DESCRIPTOR
    bLength: 9
    bDescriptorType: 0x02 (CONFIGURATION)
    wTotalLength: 32
    bNumInterfaces: 1
    bConfigurationValue: 1
    iConfiguration: 0
    Configuration bmAttributes: 0xc0  SELF-POWERED  NO REMOTE-WAKEUP
        1... .... = Must be 1: Must be 1 for USB 1.1 and higher
        .1.. .... = Self-Powered: This device is SELF-POWERED
        ..0. .... = Remote Wakeup: This device does NOT support remote wakeup
    bMaxPower: 50  (100mA)
INTERFACE DESCRIPTOR (0.0): class Printer
    bLength: 9
    bDescriptorType: 0x04 (INTERFACE)
    bInterfaceNumber: 0
    bAlternateSetting: 0
    bNumEndpoints: 2
    bInterfaceClass: Printer (0x07)
    bInterfaceSubClass: 0x01
    bInterfaceProtocol: 0x02
    iInterface: 0
ENDPOINT DESCRIPTOR
    bLength: 7
    bDescriptorType: 0x05 (ENDPOINT)
    bEndpointAddress: 0x01  OUT  Endpoint:1
        0... .... = Direction: OUT Endpoint
        .... 0001 = Endpoint Number: 0x1
    bmAttributes: 0x02
        .... ..10 = Transfertype: Bulk-Transfer (0x2)
    wMaxPacketSize: 64
        .... ..00 0100 0000 = Maximum Packet Size: 64
    bInterval: 0
ENDPOINT DESCRIPTOR
    bLength: 7
    bDescriptorType: 0x05 (ENDPOINT)
    bEndpointAddress: 0x82  IN  Endpoint:2
        1... .... = Direction: IN Endpoint
        .... 0010 = Endpoint Number: 0x2
    bmAttributes: 0x02
        .... ..10 = Transfertype: Bulk-Transfer (0x2)
    wMaxPacketSize: 64
        .... ..00 0100 0000 = Maximum Packet Size: 64
    bInterval: 0

0000  00 e6 d2 e8 fb 89 ff ff 43 02 80 03 03 00 2d 00   ........C.....-.
0010  37 2d 39 5b 00 00 00 00 60 66 0c 00 00 00 00 00   7-9[....`f......
0020  20 00 00 00 20 00 00 00 00 00 00 00 00 00 00 00    ... ...........
0030  00 00 00 00 00 00 00 00 00 02 00 00 00 00 00 00   ................
0040  09 02 20 00 01 01 00 c0 32 09 04 00 00 02 07 01   .. .....2.......
0050  02 00 07 05 01 02 40 00 00 07 05 82 02 40 00 00   ......@......@..

Frame 55: 64 bytes on wire (512 bits), 64 bytes captured (512 bits) on interface 0
    Interface id: 0 (unknown)
        Interface name: unknown
    Encapsulation type: USB packets with Linux header and padding (115)
    Arrival Time: Jul  1, 2018 15:36:23.812664000 EDT
    [Time shift for this packet: 0.000000000 seconds]
    Epoch Time: 1530473783.812664000 seconds
    [Time delta from previous captured frame: 0.000024000 seconds]
    [Time delta from previous displayed frame: 0.000024000 seconds]
    [Time since reference or first frame: 158.950731000 seconds]
    Frame Number: 55
    Frame Length: 64 bytes (512 bits)
    Capture Length: 64 bytes (512 bits)
    [Frame is marked: False]
    [Frame is ignored: False]
    [Protocols in frame: usb]
USB URB
    [Source: host]
    [Destination: 3.3.0]
    URB id: 0xffff89fbe8d2ee40
    URB type: URB_SUBMIT ('S')
    URB transfer type: URB_CONTROL (0x02)
    Endpoint: 0x80, Direction: IN
        1... .... = Direction: IN (1)
        .... 0000 = Endpoint number: 0
    Device: 3
    URB bus id: 3
    Device setup request: relevant (0)
    Data: not present ('<')
    URB sec: 1530473783
    URB usec: 812664
    URB status: Operation now in progress (-EINPROGRESS) (-115)
    URB length [bytes]: 255
    Data length [bytes]: 0
    [Response in: 56]
    Interval: 0
    Start frame: 0
    Copy of Transfer Flags: 0x00000200
    Number of ISO descriptors: 0
URB setup
    bmRequestType: 0x80
        1... .... = Direction: Device-to-host
        .00. .... = Type: Standard (0x0)
        ...0 0000 = Recipient: Device (0x00)
    bRequest: GET DESCRIPTOR (6)
    Descriptor Index: 0x00
    bDescriptorType: 0x03
    Language Id: no language specified (0x0000)
    wLength: 255

0000  40 ee d2 e8 fb 89 ff ff 53 02 80 03 03 00 00 3c   @.......S......<
0010  37 2d 39 5b 00 00 00 00 78 66 0c 00 8d ff ff ff   7-9[....xf......
0020  ff 00 00 00 00 00 00 00 80 06 00 03 00 00 ff 00   ................
0030  00 00 00 00 00 00 00 00 00 02 00 00 00 00 00 00   ................

Frame 56: 68 bytes on wire (544 bits), 68 bytes captured (544 bits) on interface 0
    Interface id: 0 (unknown)
        Interface name: unknown
    Encapsulation type: USB packets with Linux header and padding (115)
    Arrival Time: Jul  1, 2018 15:36:23.815648000 EDT
    [Time shift for this packet: 0.000000000 seconds]
    Epoch Time: 1530473783.815648000 seconds
    [Time delta from previous captured frame: 0.002984000 seconds]
    [Time delta from previous displayed frame: 0.002984000 seconds]
    [Time since reference or first frame: 158.953715000 seconds]
    Frame Number: 56
    Frame Length: 68 bytes (544 bits)
    Capture Length: 68 bytes (544 bits)
    [Frame is marked: False]
    [Frame is ignored: False]
    [Protocols in frame: usb]
USB URB
    [Source: 3.3.0]
    [Destination: host]
    URB id: 0xffff89fbe8d2ee40
    URB type: URB_COMPLETE ('C')
    URB transfer type: URB_CONTROL (0x02)
    Endpoint: 0x80, Direction: IN
        1... .... = Direction: IN (1)
        .... 0000 = Endpoint number: 0
    Device: 3
    URB bus id: 3
    Device setup request: not relevant ('-')
    Data: present (0)
    URB sec: 1530473783
    URB usec: 815648
    URB status: Success (0)
    URB length [bytes]: 4
    Data length [bytes]: 4
    [Request in: 55]
    [Time from request: 0.002984000 seconds]
    Unused Setup Header
    Interval: 0
    Start frame: 0
    Copy of Transfer Flags: 0x00000200
    Number of ISO descriptors: 0
STRING DESCRIPTOR
    bLength: 4
    bDescriptorType: 0x03 (STRING)
    wLANGID: English (United States) (0x0409)

0000  40 ee d2 e8 fb 89 ff ff 43 02 80 03 03 00 2d 00   @.......C.....-.
0010  37 2d 39 5b 00 00 00 00 20 72 0c 00 00 00 00 00   7-9[.... r......
0020  04 00 00 00 04 00 00 00 00 00 00 00 00 00 00 00   ................
0030  00 00 00 00 00 00 00 00 00 02 00 00 00 00 00 00   ................
0040  04 03 09 04                                       ....

Frame 57: 64 bytes on wire (512 bits), 64 bytes captured (512 bits) on interface 0
    Interface id: 0 (unknown)
        Interface name: unknown
    Encapsulation type: USB packets with Linux header and padding (115)
    Arrival Time: Jul  1, 2018 15:36:23.815696000 EDT
    [Time shift for this packet: 0.000000000 seconds]
    Epoch Time: 1530473783.815696000 seconds
    [Time delta from previous captured frame: 0.000048000 seconds]
    [Time delta from previous displayed frame: 0.000048000 seconds]
    [Time since reference or first frame: 158.953763000 seconds]
    Frame Number: 57
    Frame Length: 64 bytes (512 bits)
    Capture Length: 64 bytes (512 bits)
    [Frame is marked: False]
    [Frame is ignored: False]
    [Protocols in frame: usb]
USB URB
    [Source: host]
    [Destination: 3.3.0]
    URB id: 0xffff89fbe8d2ee40
    URB type: URB_SUBMIT ('S')
    URB transfer type: URB_CONTROL (0x02)
    Endpoint: 0x80, Direction: IN
        1... .... = Direction: IN (1)
        .... 0000 = Endpoint number: 0
    Device: 3
    URB bus id: 3
    Device setup request: relevant (0)
    Data: not present ('<')
    URB sec: 1530473783
    URB usec: 815696
    URB status: Operation now in progress (-EINPROGRESS) (-115)
    URB length [bytes]: 255
    Data length [bytes]: 0
    [Response in: 58]
    Interval: 0
    Start frame: 0
    Copy of Transfer Flags: 0x00000200
    Number of ISO descriptors: 0
URB setup
    bmRequestType: 0x80
        1... .... = Direction: Device-to-host
        .00. .... = Type: Standard (0x0)
        ...0 0000 = Recipient: Device (0x00)
    bRequest: GET DESCRIPTOR (6)
    Descriptor Index: 0x01
    bDescriptorType: 0x03
    Language Id: English (United States) (0x0409)
    wLength: 255

0000  40 ee d2 e8 fb 89 ff ff 53 02 80 03 03 00 00 3c   @.......S......<
0010  37 2d 39 5b 00 00 00 00 50 72 0c 00 8d ff ff ff   7-9[....Pr......
0020  ff 00 00 00 00 00 00 00 80 06 01 03 09 04 ff 00   ................
0030  00 00 00 00 00 00 00 00 00 02 00 00 00 00 00 00   ................

Frame 58: 80 bytes on wire (640 bits), 80 bytes captured (640 bits) on interface 0
    Interface id: 0 (unknown)
        Interface name: unknown
    Encapsulation type: USB packets with Linux header and padding (115)
    Arrival Time: Jul  1, 2018 15:36:23.818659000 EDT
    [Time shift for this packet: 0.000000000 seconds]
    Epoch Time: 1530473783.818659000 seconds
    [Time delta from previous captured frame: 0.002963000 seconds]
    [Time delta from previous displayed frame: 0.002963000 seconds]
    [Time since reference or first frame: 158.956726000 seconds]
    Frame Number: 58
    Frame Length: 80 bytes (640 bits)
    Capture Length: 80 bytes (640 bits)
    [Frame is marked: False]
    [Frame is ignored: False]
    [Protocols in frame: usb]
USB URB
    [Source: 3.3.0]
    [Destination: host]
    URB id: 0xffff89fbe8d2ee40
    URB type: URB_COMPLETE ('C')
    URB transfer type: URB_CONTROL (0x02)
    Endpoint: 0x80, Direction: IN
        1... .... = Direction: IN (1)
        .... 0000 = Endpoint number: 0
    Device: 3
    URB bus id: 3
    Device setup request: not relevant ('-')
    Data: present (0)
    URB sec: 1530473783
    URB usec: 818659
    URB status: Success (0)
    URB length [bytes]: 16
    Data length [bytes]: 16
    [Request in: 57]
    [Time from request: 0.002963000 seconds]
    Unused Setup Header
    Interval: 0
    Start frame: 0
    Copy of Transfer Flags: 0x00000200
    Number of ISO descriptors: 0
STRING DESCRIPTOR
    bLength: 16
    bDescriptorType: 0x03 (STRING)
    bString: 39390

0000  40 ee d2 e8 fb 89 ff ff 43 02 80 03 03 00 2d 00   @.......C.....-.
0010  37 2d 39 5b 00 00 00 00 e3 7d 0c 00 00 00 00 00   7-9[.....}......
0020  10 00 00 00 10 00 00 00 00 00 00 00 00 00 00 00   ................
0030  00 00 00 00 00 00 00 00 00 02 00 00 00 00 00 00   ................
0040  10 03 33 00 39 00 33 00 39 00 30 00 00 00 00 00   ..3.9.3.9.0.....

Frame 59: 64 bytes on wire (512 bits), 64 bytes captured (512 bits) on interface 0
    Interface id: 0 (unknown)
        Interface name: unknown
    Encapsulation type: USB packets with Linux header and padding (115)
    Arrival Time: Jul  1, 2018 15:36:23.819500000 EDT
    [Time shift for this packet: 0.000000000 seconds]
    Epoch Time: 1530473783.819500000 seconds
    [Time delta from previous captured frame: 0.000841000 seconds]
    [Time delta from previous displayed frame: 0.000841000 seconds]
    [Time since reference or first frame: 158.957567000 seconds]
    Frame Number: 59
    Frame Length: 64 bytes (512 bits)
    Capture Length: 64 bytes (512 bits)
    [Frame is marked: False]
    [Frame is ignored: False]
    [Protocols in frame: usb]
USB URB
    [Source: host]
    [Destination: 3.3.0]
    URB id: 0xffff89fbe8d2e6c0
    URB type: URB_SUBMIT ('S')
    URB transfer type: URB_CONTROL (0x02)
    Endpoint: 0x00, Direction: OUT
        0... .... = Direction: OUT (0)
        .... 0000 = Endpoint number: 0
    Device: 3
    URB bus id: 3
    Device setup request: relevant (0)
    Data: present (0)
    URB sec: 1530473783
    URB usec: 819500
    URB status: Operation now in progress (-EINPROGRESS) (-115)
    URB length [bytes]: 0
    Data length [bytes]: 0
    [Response in: 60]
    Interval: 0
    Start frame: 0
    Copy of Transfer Flags: 0x00000000
    Number of ISO descriptors: 0
URB setup
    bmRequestType: 0x00
        0... .... = Direction: Host-to-device
        .00. .... = Type: Standard (0x0)
        ...0 0000 = Recipient: Device (0x00)
    bRequest: SET CONFIGURATION (9)
    bConfigurationValue: 1
    wIndex: 0 (0x0000)
    wLength: 0

0000  c0 e6 d2 e8 fb 89 ff ff 53 02 00 03 03 00 00 00   ........S.......
0010  37 2d 39 5b 00 00 00 00 2c 81 0c 00 8d ff ff ff   7-9[....,.......
0020  00 00 00 00 00 00 00 00 00 09 01 00 00 00 00 00   ................
0030  00 00 00 00 00 00 00 00 00 00 00 00 00 00 00 00   ................

Frame 60: 64 bytes on wire (512 bits), 64 bytes captured (512 bits) on interface 0
    Interface id: 0 (unknown)
        Interface name: unknown
    Encapsulation type: USB packets with Linux header and padding (115)
    Arrival Time: Jul  1, 2018 15:36:23.820688000 EDT
    [Time shift for this packet: 0.000000000 seconds]
    Epoch Time: 1530473783.820688000 seconds
    [Time delta from previous captured frame: 0.001188000 seconds]
    [Time delta from previous displayed frame: 0.001188000 seconds]
    [Time since reference or first frame: 158.958755000 seconds]
    Frame Number: 60
    Frame Length: 64 bytes (512 bits)
    Capture Length: 64 bytes (512 bits)
    [Frame is marked: False]
    [Frame is ignored: False]
    [Protocols in frame: usb]
USB URB
    [Source: 3.3.0]
    [Destination: host]
    URB id: 0xffff89fbe8d2e6c0
    URB type: URB_COMPLETE ('C')
    URB transfer type: URB_CONTROL (0x02)
    Endpoint: 0x00, Direction: OUT
        0... .... = Direction: OUT (0)
        .... 0000 = Endpoint number: 0
    Device: 3
    URB bus id: 3
    Device setup request: not relevant ('-')
    Data: not present ('>')
    URB sec: 1530473783
    URB usec: 820688
    URB status: Success (0)
    URB length [bytes]: 0
    Data length [bytes]: 0
    [Request in: 59]
    [Time from request: 0.001188000 seconds]
    Unused Setup Header
    Interval: 0
    Start frame: 0
    Copy of Transfer Flags: 0x00000000
    Number of ISO descriptors: 0

0000  c0 e6 d2 e8 fb 89 ff ff 43 02 00 03 03 00 2d 3e   ........C.....->
0010  37 2d 39 5b 00 00 00 00 d0 85 0c 00 00 00 00 00   7-9[............
0020  00 00 00 00 00 00 00 00 00 00 00 00 00 00 00 00   ................
0030  00 00 00 00 00 00 00 00 00 00 00 00 00 00 00 00   ................

Frame 61: 64 bytes on wire (512 bits), 64 bytes captured (512 bits) on interface 0
    Interface id: 0 (unknown)
        Interface name: unknown
    Encapsulation type: USB packets with Linux header and padding (115)
    Arrival Time: Jul  1, 2018 15:36:23.822864000 EDT
    [Time shift for this packet: 0.000000000 seconds]
    Epoch Time: 1530473783.822864000 seconds
    [Time delta from previous captured frame: 0.002176000 seconds]
    [Time delta from previous displayed frame: 0.002176000 seconds]
    [Time since reference or first frame: 158.960931000 seconds]
    Frame Number: 61
    Frame Length: 64 bytes (512 bits)
    Capture Length: 64 bytes (512 bits)
    [Frame is marked: False]
    [Frame is ignored: False]
    [Protocols in frame: usb]
USB URB
    [Source: host]
    [Destination: 3.3.0]
    URB id: 0xffff89fbe8d2e840
    URB type: URB_SUBMIT ('S')
    URB transfer type: URB_CONTROL (0x02)
    Endpoint: 0x00, Direction: OUT
        0... .... = Direction: OUT (0)
        .... 0000 = Endpoint number: 0
    Device: 3
    URB bus id: 3
    Device setup request: relevant (0)
    Data: present (0)
    URB sec: 1530473783
    URB usec: 822864
    URB status: Operation now in progress (-EINPROGRESS) (-115)
    URB length [bytes]: 0
    Data length [bytes]: 0
    [Response in: 62]
    Interval: 0
    Start frame: 0
    Copy of Transfer Flags: 0x00000000
    Number of ISO descriptors: 0
URB setup
    bmRequestType: 0x01
        0... .... = Direction: Host-to-device
        .00. .... = Type: Standard (0x0)
        ...0 0001 = Recipient: Interface (0x01)
    bRequest: SET INTERFACE (11)
    bAlternateSetting: 0
    wInterface: 0
    wLength: 0

0000  40 e8 d2 e8 fb 89 ff ff 53 02 00 03 03 00 00 00   @.......S.......
0010  37 2d 39 5b 00 00 00 00 50 8e 0c 00 8d ff ff ff   7-9[....P.......
0020  00 00 00 00 00 00 00 00 01 0b 00 00 00 00 00 00   ................
0030  00 00 00 00 00 00 00 00 00 00 00 00 00 00 00 00   ................

Frame 62: 64 bytes on wire (512 bits), 64 bytes captured (512 bits) on interface 0
    Interface id: 0 (unknown)
        Interface name: unknown
    Encapsulation type: USB packets with Linux header and padding (115)
    Arrival Time: Jul  1, 2018 15:36:23.824735000 EDT
    [Time shift for this packet: 0.000000000 seconds]
    Epoch Time: 1530473783.824735000 seconds
    [Time delta from previous captured frame: 0.001871000 seconds]
    [Time delta from previous displayed frame: 0.001871000 seconds]
    [Time since reference or first frame: 158.962802000 seconds]
    Frame Number: 62
    Frame Length: 64 bytes (512 bits)
    Capture Length: 64 bytes (512 bits)
    [Frame is marked: False]
    [Frame is ignored: False]
    [Protocols in frame: usb]
USB URB
    [Source: 3.3.0]
    [Destination: host]
    URB id: 0xffff89fbe8d2e840
    URB type: URB_COMPLETE ('C')
    URB transfer type: URB_CONTROL (0x02)
    Endpoint: 0x00, Direction: OUT
        0... .... = Direction: OUT (0)
        .... 0000 = Endpoint number: 0
    Device: 3
    URB bus id: 3
    Device setup request: not relevant ('-')
    Data: not present ('>')
    URB sec: 1530473783
    URB usec: 824735
    URB status: Success (0)
    URB length [bytes]: 0
    Data length [bytes]: 0
    [Request in: 61]
    [Time from request: 0.001871000 seconds]
    Unused Setup Header
    Interval: 0
    Start frame: 0
    Copy of Transfer Flags: 0x00000000
    Number of ISO descriptors: 0

0000  40 e8 d2 e8 fb 89 ff ff 43 02 00 03 03 00 2d 3e   @.......C.....->
0010  37 2d 39 5b 00 00 00 00 9f 95 0c 00 00 00 00 00   7-9[............
0020  00 00 00 00 00 00 00 00 00 00 00 00 00 00 00 00   ................
0030  00 00 00 00 00 00 00 00 00 00 00 00 00 00 00 00   ................

Frame 63: 64 bytes on wire (512 bits), 64 bytes captured (512 bits) on interface 0
    Interface id: 0 (unknown)
        Interface name: unknown
    Encapsulation type: USB packets with Linux header and padding (115)
    Arrival Time: Jul  1, 2018 15:36:23.824870000 EDT
    [Time shift for this packet: 0.000000000 seconds]
    Epoch Time: 1530473783.824870000 seconds
    [Time delta from previous captured frame: 0.000135000 seconds]
    [Time delta from previous displayed frame: 0.000135000 seconds]
    [Time since reference or first frame: 158.962937000 seconds]
    Frame Number: 63
    Frame Length: 64 bytes (512 bits)
    Capture Length: 64 bytes (512 bits)
    [Frame is marked: False]
    [Frame is ignored: False]
    [Protocols in frame: usb]
USB URB
    [Source: host]
    [Destination: 3.3.0]
    URB id: 0xffff89fbe8d2ed80
    URB type: URB_SUBMIT ('S')
    URB transfer type: URB_CONTROL (0x02)
    Endpoint: 0x80, Direction: IN
        1... .... = Direction: IN (1)
        .... 0000 = Endpoint number: 0
    Device: 3
    URB bus id: 3
    Device setup request: relevant (0)
    Data: not present ('<')
    URB sec: 1530473783
    URB usec: 824870
    URB status: Operation now in progress (-EINPROGRESS) (-115)
    URB length [bytes]: 1023
    Data length [bytes]: 0
    [Response in: 64]
    Interval: 0
    Start frame: 0
    Copy of Transfer Flags: 0x00000200
    Number of ISO descriptors: 0
    [bInterfaceClass: Printer (0x07)]
URB setup
    bmRequestType: 0xa1
        1... .... = Direction: Device-to-host
        .01. .... = Type: Class (0x1)
        ...0 0001 = Recipient: Interface (0x01)
    bRequest: 0
    wValue: 0x0000
    wIndex: 0 (0x0000)
    wLength: 1023

0000  80 ed d2 e8 fb 89 ff ff 53 02 80 03 03 00 00 3c   ........S......<
0010  37 2d 39 5b 00 00 00 00 26 96 0c 00 8d ff ff ff   7-9[....&.......
0020  ff 03 00 00 00 00 00 00 a1 00 00 00 00 00 ff 03   ................
0030  00 00 00 00 00 00 00 00 00 02 00 00 00 00 00 00   ................

Packet comments
    Power On Complete, with Inkscape already running.

        [Expert Info (Comment/Comment): Power On Complete, with Inkscape already running.
]
            [Power On Complete, with Inkscape already running.
]
            [Severity level: Comment]
            [Group: Comment]
Frame 64: 149 bytes on wire (1192 bits), 149 bytes captured (1192 bits) on interface 0
    Interface id: 0 (unknown)
        Interface name: unknown
    Encapsulation type: USB packets with Linux header and padding (115)
    Arrival Time: Jul  1, 2018 15:36:23.828641000 EDT
    [Time shift for this packet: 0.000000000 seconds]
    Epoch Time: 1530473783.828641000 seconds
    [Time delta from previous captured frame: 0.003771000 seconds]
    [Time delta from previous displayed frame: 0.003771000 seconds]
    [Time since reference or first frame: 158.966708000 seconds]
    Frame Number: 64
    Frame Length: 149 bytes (1192 bits)
    Capture Length: 149 bytes (1192 bits)
    [Frame is marked: False]
    [Frame is ignored: False]
    [Protocols in frame: usb]
USB URB
    [Source: 3.3.0]
    [Destination: host]
    URB id: 0xffff89fbe8d2ed80
    URB type: URB_COMPLETE ('C')
    URB transfer type: URB_CONTROL (0x02)
    Endpoint: 0x80, Direction: IN
        1... .... = Direction: IN (1)
        .... 0000 = Endpoint number: 0
    Device: 3
    URB bus id: 3
    Device setup request: not relevant ('-')
    Data: present (0)
    URB sec: 1530473783
    URB usec: 828641
    URB status: Success (0)
    URB length [bytes]: 85
    Data length [bytes]: 85
    [Request in: 63]
    [Time from request: 0.003771000 seconds]
    Unused Setup Header
    Interval: 0
    Start frame: 0
    Copy of Transfer Flags: 0x00000200
    Number of ISO descriptors: 0
    [bInterfaceClass: Printer (0x07)]
CONTROL response data: 00554d414e5546414354555245523a53696c686f75657474...

0000  80 ed d2 e8 fb 89 ff ff 43 02 80 03 03 00 2d 00   ........C.....-.
0010  37 2d 39 5b 00 00 00 00 e1 a4 0c 00 00 00 00 00   7-9[............
0020  55 00 00 00 55 00 00 00 00 00 00 00 00 00 00 00   U...U...........
0030  00 00 00 00 00 00 00 00 00 02 00 00 00 00 00 00   ................
0040  00 55 4d 41 4e 55 46 41 43 54 55 52 45 52 3a 53   .UMANUFACTURER:S
0050  69 6c 68 6f 75 65 74 74 65 3b 4d 4f 44 45 4c 3a   ilhouette;MODEL:
0060  43 41 4d 45 4f 20 33 3b 43 4c 41 53 53 3a 50 52   CAMEO 3;CLASS:PR
0070  49 4e 54 45 52 3b 44 45 53 43 52 49 50 54 49 4f   INTER;DESCRIPTIO
0080  4e 3a 53 69 6c 68 6f 75 65 74 74 65 20 43 41 4d   N:Silhouette CAM
0090  45 4f 20 33 3b                                    EO 3;

Packet comments
    Beginning of Export
        [Expert Info (Comment/Comment): Beginning of Export]
            [Beginning of Export]
            [Severity level: Comment]
            [Group: Comment]
Frame 65: 64 bytes on wire (512 bits), 64 bytes captured (512 bits) on interface 0
    Interface id: 0 (unknown)
        Interface name: unknown
    Encapsulation type: USB packets with Linux header and padding (115)
    Arrival Time: Jul  1, 2018 15:38:02.989552000 EDT
    [Time shift for this packet: 0.000000000 seconds]
    Epoch Time: 1530473882.989552000 seconds
    [Time delta from previous captured frame: 99.160911000 seconds]
    [Time delta from previous displayed frame: 99.160911000 seconds]
    [Time since reference or first frame: 258.127619000 seconds]
    Frame Number: 65
    Frame Length: 64 bytes (512 bits)
    Capture Length: 64 bytes (512 bits)
    [Frame is marked: False]
    [Frame is ignored: False]
    [Protocols in frame: usb]
USB URB
    [Source: host]
    [Destination: 3.3.0]
    URB id: 0xffff89fd46f3bcc0
    URB type: URB_SUBMIT ('S')
    URB transfer type: URB_CONTROL (0x02)
    Endpoint: 0x00, Direction: OUT
        0... .... = Direction: OUT (0)
        .... 0000 = Endpoint number: 0
    Device: 3
    URB bus id: 3
    Device setup request: relevant (0)
    Data: present (0)
    URB sec: 1530473882
    URB usec: 989552
    URB status: Operation now in progress (-EINPROGRESS) (-115)
    URB length [bytes]: 0
    Data length [bytes]: 0
    [Response in: 66]
    Interval: 0
    Start frame: 0
    Copy of Transfer Flags: 0x00000000
    Number of ISO descriptors: 0
URB setup
    bmRequestType: 0x00
        0... .... = Direction: Host-to-device
        .00. .... = Type: Standard (0x0)
        ...0 0000 = Recipient: Device (0x00)
    bRequest: SET CONFIGURATION (9)
    bConfigurationValue: 1
    wIndex: 0 (0x0000)
    wLength: 0

0000  c0 bc f3 46 fd 89 ff ff 53 02 00 03 03 00 00 00   ...F....S.......
0010  9a 2d 39 5b 00 00 00 00 70 19 0f 00 8d ff ff ff   .-9[....p.......
0020  00 00 00 00 00 00 00 00 00 09 01 00 00 00 00 00   ................
0030  00 00 00 00 00 00 00 00 00 00 00 00 00 00 00 00   ................

Frame 66: 64 bytes on wire (512 bits), 64 bytes captured (512 bits) on interface 0
    Interface id: 0 (unknown)
        Interface name: unknown
    Encapsulation type: USB packets with Linux header and padding (115)
    Arrival Time: Jul  1, 2018 15:38:02.990980000 EDT
    [Time shift for this packet: 0.000000000 seconds]
    Epoch Time: 1530473882.990980000 seconds
    [Time delta from previous captured frame: 0.001428000 seconds]
    [Time delta from previous displayed frame: 0.001428000 seconds]
    [Time since reference or first frame: 258.129047000 seconds]
    Frame Number: 66
    Frame Length: 64 bytes (512 bits)
    Capture Length: 64 bytes (512 bits)
    [Frame is marked: False]
    [Frame is ignored: False]
    [Protocols in frame: usb]
USB URB
    [Source: 3.3.0]
    [Destination: host]
    URB id: 0xffff89fd46f3bcc0
    URB type: URB_COMPLETE ('C')
    URB transfer type: URB_CONTROL (0x02)
    Endpoint: 0x00, Direction: OUT
        0... .... = Direction: OUT (0)
        .... 0000 = Endpoint number: 0
    Device: 3
    URB bus id: 3
    Device setup request: not relevant ('-')
    Data: not present ('>')
    URB sec: 1530473882
    URB usec: 990980
    URB status: Success (0)
    URB length [bytes]: 0
    Data length [bytes]: 0
    [Request in: 65]
    [Time from request: 0.001428000 seconds]
    Unused Setup Header
    Interval: 0
    Start frame: 0
    Copy of Transfer Flags: 0x00000000
    Number of ISO descriptors: 0

0000  c0 bc f3 46 fd 89 ff ff 43 02 00 03 03 00 2d 3e   ...F....C.....->
0010  9a 2d 39 5b 00 00 00 00 04 1f 0f 00 00 00 00 00   .-9[............
0020  00 00 00 00 00 00 00 00 00 00 00 00 00 00 00 00   ................
0030  00 00 00 00 00 00 00 00 00 00 00 00 00 00 00 00   ................

Frame 67: 64 bytes on wire (512 bits), 64 bytes captured (512 bits) on interface 0
    Interface id: 0 (unknown)
        Interface name: unknown
    Encapsulation type: USB packets with Linux header and padding (115)
    Arrival Time: Jul  1, 2018 15:38:02.993155000 EDT
    [Time shift for this packet: 0.000000000 seconds]
    Epoch Time: 1530473882.993155000 seconds
    [Time delta from previous captured frame: 0.002175000 seconds]
    [Time delta from previous displayed frame: 0.002175000 seconds]
    [Time since reference or first frame: 258.131222000 seconds]
    Frame Number: 67
    Frame Length: 64 bytes (512 bits)
    Capture Length: 64 bytes (512 bits)
    [Frame is marked: False]
    [Frame is ignored: False]
    [Protocols in frame: usb]
USB URB
    [Source: host]
    [Destination: 3.3.0]
    URB id: 0xffff89fbe8d2ea80
    URB type: URB_SUBMIT ('S')
    URB transfer type: URB_CONTROL (0x02)
    Endpoint: 0x00, Direction: OUT
        0... .... = Direction: OUT (0)
        .... 0000 = Endpoint number: 0
    Device: 3
    URB bus id: 3
    Device setup request: relevant (0)
    Data: present (0)
    URB sec: 1530473882
    URB usec: 993155
    URB status: Operation now in progress (-EINPROGRESS) (-115)
    URB length [bytes]: 0
    Data length [bytes]: 0
    [Response in: 68]
    Interval: 0
    Start frame: 0
    Copy of Transfer Flags: 0x00000000
    Number of ISO descriptors: 0
URB setup
    bmRequestType: 0x01
        0... .... = Direction: Host-to-device
        .00. .... = Type: Standard (0x0)
        ...0 0001 = Recipient: Interface (0x01)
    bRequest: SET INTERFACE (11)
    bAlternateSetting: 0
    wInterface: 0
    wLength: 0

0000  80 ea d2 e8 fb 89 ff ff 53 02 00 03 03 00 00 00   ........S.......
0010  9a 2d 39 5b 00 00 00 00 83 27 0f 00 8d ff ff ff   .-9[.....'......
0020  00 00 00 00 00 00 00 00 01 0b 00 00 00 00 00 00   ................
0030  00 00 00 00 00 00 00 00 00 00 00 00 00 00 00 00   ................

Frame 68: 64 bytes on wire (512 bits), 64 bytes captured (512 bits) on interface 0
    Interface id: 0 (unknown)
        Interface name: unknown
    Encapsulation type: USB packets with Linux header and padding (115)
    Arrival Time: Jul  1, 2018 15:38:02.995027000 EDT
    [Time shift for this packet: 0.000000000 seconds]
    Epoch Time: 1530473882.995027000 seconds
    [Time delta from previous captured frame: 0.001872000 seconds]
    [Time delta from previous displayed frame: 0.001872000 seconds]
    [Time since reference or first frame: 258.133094000 seconds]
    Frame Number: 68
    Frame Length: 64 bytes (512 bits)
    Capture Length: 64 bytes (512 bits)
    [Frame is marked: False]
    [Frame is ignored: False]
    [Protocols in frame: usb]
USB URB
    [Source: 3.3.0]
    [Destination: host]
    URB id: 0xffff89fbe8d2ea80
    URB type: URB_COMPLETE ('C')
    URB transfer type: URB_CONTROL (0x02)
    Endpoint: 0x00, Direction: OUT
        0... .... = Direction: OUT (0)
        .... 0000 = Endpoint number: 0
    Device: 3
    URB bus id: 3
    Device setup request: not relevant ('-')
    Data: not present ('>')
    URB sec: 1530473882
    URB usec: 995027
    URB status: Success (0)
    URB length [bytes]: 0
    Data length [bytes]: 0
    [Request in: 67]
    [Time from request: 0.001872000 seconds]
    Unused Setup Header
    Interval: 0
    Start frame: 0
    Copy of Transfer Flags: 0x00000000
    Number of ISO descriptors: 0

0000  80 ea d2 e8 fb 89 ff ff 43 02 00 03 03 00 2d 3e   ........C.....->
0010  9a 2d 39 5b 00 00 00 00 d3 2e 0f 00 00 00 00 00   .-9[............
0020  00 00 00 00 00 00 00 00 00 00 00 00 00 00 00 00   ................
0030  00 00 00 00 00 00 00 00 00 00 00 00 00 00 00 00   ................

Frame 69: 64 bytes on wire (512 bits), 64 bytes captured (512 bits) on interface 0
    Interface id: 0 (unknown)
        Interface name: unknown
    Encapsulation type: USB packets with Linux header and padding (115)
    Arrival Time: Jul  1, 2018 15:38:02.995687000 EDT
    [Time shift for this packet: 0.000000000 seconds]
    Epoch Time: 1530473882.995687000 seconds
    [Time delta from previous captured frame: 0.000660000 seconds]
    [Time delta from previous displayed frame: 0.000660000 seconds]
    [Time since reference or first frame: 258.133754000 seconds]
    Frame Number: 69
    Frame Length: 64 bytes (512 bits)
    Capture Length: 64 bytes (512 bits)
    [Frame is marked: False]
    [Frame is ignored: False]
    [Protocols in frame: usb]
USB URB
    [Source: host]
    [Destination: 3.3.2]
    URB id: 0xffff89fbe8d2ea80
    URB type: URB_SUBMIT ('S')
    URB transfer type: URB_BULK (0x03)
    Endpoint: 0x82, Direction: IN
        1... .... = Direction: IN (1)
        .... 0010 = Endpoint number: 2
    Device: 3
    URB bus id: 3
    Device setup request: not relevant ('-')
    Data: not present ('<')
    URB sec: 1530473882
    URB usec: 995687
    URB status: Operation now in progress (-EINPROGRESS) (-115)
    URB length [bytes]: 64
    Data length [bytes]: 0
    [Response in: 70]
    [bInterfaceClass: Printer (0x07)]
    Unused Setup Header
    Interval: 0
    Start frame: 0
    Copy of Transfer Flags: 0x00000200
    Number of ISO descriptors: 0

0000  80 ea d2 e8 fb 89 ff ff 53 03 82 03 03 00 2d 3c   ........S.....-<
0010  9a 2d 39 5b 00 00 00 00 67 31 0f 00 8d ff ff ff   .-9[....g1......
0020  40 00 00 00 00 00 00 00 00 00 00 00 00 00 00 00   @...............
0030  00 00 00 00 00 00 00 00 00 02 00 00 00 00 00 00   ................

Frame 70: 64 bytes on wire (512 bits), 64 bytes captured (512 bits) on interface 0
    Interface id: 0 (unknown)
        Interface name: unknown
    Encapsulation type: USB packets with Linux header and padding (115)
    Arrival Time: Jul  1, 2018 15:38:03.006017000 EDT
    [Time shift for this packet: 0.000000000 seconds]
    Epoch Time: 1530473883.006017000 seconds
    [Time delta from previous captured frame: 0.010330000 seconds]
    [Time delta from previous displayed frame: 0.010330000 seconds]
    [Time since reference or first frame: 258.144084000 seconds]
    Frame Number: 70
    Frame Length: 64 bytes (512 bits)
    Capture Length: 64 bytes (512 bits)
    [Frame is marked: False]
    [Frame is ignored: False]
    [Protocols in frame: usb]
USB URB
    [Source: 3.3.2]
    [Destination: host]
    URB id: 0xffff89fbe8d2ea80
    URB type: URB_COMPLETE ('C')
    URB transfer type: URB_BULK (0x03)
    Endpoint: 0x82, Direction: IN
        1... .... = Direction: IN (1)
        .... 0010 = Endpoint number: 2
    Device: 3
    URB bus id: 3
    Device setup request: not relevant ('-')
    Data: present (0)
    URB sec: 1530473883
    URB usec: 6017
    URB status: No such file or directory (-ENOENT) (-2)
    URB length [bytes]: 0
    Data length [bytes]: 0
    [Request in: 69]
    [Time from request: 0.010330000 seconds]
    [bInterfaceClass: Printer (0x07)]
    Unused Setup Header
    Interval: 0
    Start frame: 0
    Copy of Transfer Flags: 0x00000200
    Number of ISO descriptors: 0

0000  80 ea d2 e8 fb 89 ff ff 43 03 82 03 03 00 2d 00   ........C.....-.
0010  9b 2d 39 5b 00 00 00 00 81 17 00 00 fe ff ff ff   .-9[............
0020  00 00 00 00 00 00 00 00 00 00 00 00 00 00 00 00   ................
0030  00 00 00 00 00 00 00 00 00 02 00 00 00 00 00 00   ................

Frame 71: 66 bytes on wire (528 bits), 66 bytes captured (528 bits) on interface 0
    Interface id: 0 (unknown)
        Interface name: unknown
    Encapsulation type: USB packets with Linux header and padding (115)
    Arrival Time: Jul  1, 2018 15:38:03.006643000 EDT
    [Time shift for this packet: 0.000000000 seconds]
    Epoch Time: 1530473883.006643000 seconds
    [Time delta from previous captured frame: 0.000626000 seconds]
    [Time delta from previous displayed frame: 0.000626000 seconds]
    [Time since reference or first frame: 258.144710000 seconds]
    Frame Number: 71
    Frame Length: 66 bytes (528 bits)
    Capture Length: 66 bytes (528 bits)
    [Frame is marked: False]
    [Frame is ignored: False]
    [Protocols in frame: usb]
USB URB
    [Source: host]
    [Destination: 3.3.1]
    URB id: 0xffff89fbe8d2ea80
    URB type: URB_SUBMIT ('S')
    URB transfer type: URB_BULK (0x03)
    Endpoint: 0x01, Direction: OUT
        0... .... = Direction: OUT (0)
        .... 0001 = Endpoint number: 1
    Device: 3
    URB bus id: 3
    Device setup request: not relevant ('-')
    Data: present (0)
    URB sec: 1530473883
    URB usec: 6643
    URB status: Operation now in progress (-EINPROGRESS) (-115)
    URB length [bytes]: 2
    Data length [bytes]: 2
    [Response in: 72]
    [bInterfaceClass: Printer (0x07)]
    Unused Setup Header
    Interval: 0
    Start frame: 0
    Copy of Transfer Flags: 0x00000000
    Number of ISO descriptors: 0
Leftover Capture Data: 1b05

0000  80 ea d2 e8 fb 89 ff ff 53 03 01 03 03 00 2d 00   ........S.....-.
0010  9b 2d 39 5b 00 00 00 00 f3 19 00 00 8d ff ff ff   .-9[............
0020  02 00 00 00 02 00 00 00 00 00 00 00 00 00 00 00   ................
0030  00 00 00 00 00 00 00 00 00 00 00 00 00 00 00 00   ................
0040  1b 05                                             ..

Frame 72: 64 bytes on wire (512 bits), 64 bytes captured (512 bits) on interface 0
    Interface id: 0 (unknown)
        Interface name: unknown
    Encapsulation type: USB packets with Linux header and padding (115)
    Arrival Time: Jul  1, 2018 15:38:03.006686000 EDT
    [Time shift for this packet: 0.000000000 seconds]
    Epoch Time: 1530473883.006686000 seconds
    [Time delta from previous captured frame: 0.000043000 seconds]
    [Time delta from previous displayed frame: 0.000043000 seconds]
    [Time since reference or first frame: 258.144753000 seconds]
    Frame Number: 72
    Frame Length: 64 bytes (512 bits)
    Capture Length: 64 bytes (512 bits)
    [Frame is marked: False]
    [Frame is ignored: False]
    [Protocols in frame: usb]
USB URB
    [Source: 3.3.1]
    [Destination: host]
    URB id: 0xffff89fbe8d2ea80
    URB type: URB_COMPLETE ('C')
    URB transfer type: URB_BULK (0x03)
    Endpoint: 0x01, Direction: OUT
        0... .... = Direction: OUT (0)
        .... 0001 = Endpoint number: 1
    Device: 3
    URB bus id: 3
    Device setup request: not relevant ('-')
    Data: not present ('>')
    URB sec: 1530473883
    URB usec: 6686
    URB status: Success (0)
    URB length [bytes]: 2
    Data length [bytes]: 0
    [Request in: 71]
    [Time from request: 0.000043000 seconds]
    [bInterfaceClass: Printer (0x07)]
    Unused Setup Header
    Interval: 0
    Start frame: 0
    Copy of Transfer Flags: 0x00000000
    Number of ISO descriptors: 0

0000  80 ea d2 e8 fb 89 ff ff 43 03 01 03 03 00 2d 3e   ........C.....->
0010  9b 2d 39 5b 00 00 00 00 1e 1a 00 00 00 00 00 00   .-9[............
0020  02 00 00 00 00 00 00 00 00 00 00 00 00 00 00 00   ................
0030  00 00 00 00 00 00 00 00 00 00 00 00 00 00 00 00   ................

Frame 73: 64 bytes on wire (512 bits), 64 bytes captured (512 bits) on interface 0
    Interface id: 0 (unknown)
        Interface name: unknown
    Encapsulation type: USB packets with Linux header and padding (115)
    Arrival Time: Jul  1, 2018 15:38:03.006796000 EDT
    [Time shift for this packet: 0.000000000 seconds]
    Epoch Time: 1530473883.006796000 seconds
    [Time delta from previous captured frame: 0.000110000 seconds]
    [Time delta from previous displayed frame: 0.000110000 seconds]
    [Time since reference or first frame: 258.144863000 seconds]
    Frame Number: 73
    Frame Length: 64 bytes (512 bits)
    Capture Length: 64 bytes (512 bits)
    [Frame is marked: False]
    [Frame is ignored: False]
    [Protocols in frame: usb]
USB URB
    [Source: host]
    [Destination: 3.3.2]
    URB id: 0xffff89fbe8d2ea80
    URB type: URB_SUBMIT ('S')
    URB transfer type: URB_BULK (0x03)
    Endpoint: 0x82, Direction: IN
        1... .... = Direction: IN (1)
        .... 0010 = Endpoint number: 2
    Device: 3
    URB bus id: 3
    Device setup request: not relevant ('-')
    Data: not present ('<')
    URB sec: 1530473883
    URB usec: 6796
    URB status: Operation now in progress (-EINPROGRESS) (-115)
    URB length [bytes]: 64
    Data length [bytes]: 0
    [Response in: 74]
    [bInterfaceClass: Printer (0x07)]
    Unused Setup Header
    Interval: 0
    Start frame: 0
    Copy of Transfer Flags: 0x00000200
    Number of ISO descriptors: 0

0000  80 ea d2 e8 fb 89 ff ff 53 03 82 03 03 00 2d 3c   ........S.....-<
0010  9b 2d 39 5b 00 00 00 00 8c 1a 00 00 8d ff ff ff   .-9[............
0020  40 00 00 00 00 00 00 00 00 00 00 00 00 00 00 00   @...............
0030  00 00 00 00 00 00 00 00 00 02 00 00 00 00 00 00   ................

Frame 74: 66 bytes on wire (528 bits), 66 bytes captured (528 bits) on interface 0
    Interface id: 0 (unknown)
        Interface name: unknown
    Encapsulation type: USB packets with Linux header and padding (115)
    Arrival Time: Jul  1, 2018 15:38:03.118788000 EDT
    [Time shift for this packet: 0.000000000 seconds]
    Epoch Time: 1530473883.118788000 seconds
    [Time delta from previous captured frame: 0.111992000 seconds]
    [Time delta from previous displayed frame: 0.111992000 seconds]
    [Time since reference or first frame: 258.256855000 seconds]
    Frame Number: 74
    Frame Length: 66 bytes (528 bits)
    Capture Length: 66 bytes (528 bits)
    [Frame is marked: False]
    [Frame is ignored: False]
    [Protocols in frame: usb]
USB URB
    [Source: 3.3.2]
    [Destination: host]
    URB id: 0xffff89fbe8d2ea80
    URB type: URB_COMPLETE ('C')
    URB transfer type: URB_BULK (0x03)
    Endpoint: 0x82, Direction: IN
        1... .... = Direction: IN (1)
        .... 0010 = Endpoint number: 2
    Device: 3
    URB bus id: 3
    Device setup request: not relevant ('-')
    Data: present (0)
    URB sec: 1530473883
    URB usec: 118788
    URB status: Success (0)
    URB length [bytes]: 2
    Data length [bytes]: 2
    [Request in: 73]
    [Time from request: 0.111992000 seconds]
    [bInterfaceClass: Printer (0x07)]
    Unused Setup Header
    Interval: 0
    Start frame: 0
    Copy of Transfer Flags: 0x00000200
    Number of ISO descriptors: 0
Leftover Capture Data: 3003

0000  80 ea d2 e8 fb 89 ff ff 43 03 82 03 03 00 2d 00   ........C.....-.
0010  9b 2d 39 5b 00 00 00 00 04 d0 01 00 00 00 00 00   .-9[............
0020  02 00 00 00 02 00 00 00 00 00 00 00 00 00 00 00   ................
0030  00 00 00 00 00 00 00 00 00 02 00 00 00 00 00 00   ................
0040  30 03                                             0.

Frame 75: 64 bytes on wire (512 bits), 64 bytes captured (512 bits) on interface 0
    Interface id: 0 (unknown)
        Interface name: unknown
    Encapsulation type: USB packets with Linux header and padding (115)
    Arrival Time: Jul  1, 2018 15:38:03.119195000 EDT
    [Time shift for this packet: 0.000000000 seconds]
    Epoch Time: 1530473883.119195000 seconds
    [Time delta from previous captured frame: 0.000407000 seconds]
    [Time delta from previous displayed frame: 0.000407000 seconds]
    [Time since reference or first frame: 258.257262000 seconds]
    Frame Number: 75
    Frame Length: 64 bytes (512 bits)
    Capture Length: 64 bytes (512 bits)
    [Frame is marked: False]
    [Frame is ignored: False]
    [Protocols in frame: usb]
USB URB
    [Source: host]
    [Destination: 3.3.2]
    URB id: 0xffff89fbe8d2ea80
    URB type: URB_SUBMIT ('S')
    URB transfer type: URB_BULK (0x03)
    Endpoint: 0x82, Direction: IN
        1... .... = Direction: IN (1)
        .... 0010 = Endpoint number: 2
    Device: 3
    URB bus id: 3
    Device setup request: not relevant ('-')
    Data: not present ('<')
    URB sec: 1530473883
    URB usec: 119195
    URB status: Operation now in progress (-EINPROGRESS) (-115)
    URB length [bytes]: 64
    Data length [bytes]: 0
    [Response in: 76]
    [bInterfaceClass: Printer (0x07)]
    Unused Setup Header
    Interval: 0
    Start frame: 0
    Copy of Transfer Flags: 0x00000200
    Number of ISO descriptors: 0

0000  80 ea d2 e8 fb 89 ff ff 53 03 82 03 03 00 2d 3c   ........S.....-<
0010  9b 2d 39 5b 00 00 00 00 9b d1 01 00 8d ff ff ff   .-9[............
0020  40 00 00 00 00 00 00 00 00 00 00 00 00 00 00 00   @...............
0030  00 00 00 00 00 00 00 00 00 02 00 00 00 00 00 00   ................

Frame 76: 64 bytes on wire (512 bits), 64 bytes captured (512 bits) on interface 0
    Interface id: 0 (unknown)
        Interface name: unknown
    Encapsulation type: USB packets with Linux header and padding (115)
    Arrival Time: Jul  1, 2018 15:38:03.130009000 EDT
    [Time shift for this packet: 0.000000000 seconds]
    Epoch Time: 1530473883.130009000 seconds
    [Time delta from previous captured frame: 0.010814000 seconds]
    [Time delta from previous displayed frame: 0.010814000 seconds]
    [Time since reference or first frame: 258.268076000 seconds]
    Frame Number: 76
    Frame Length: 64 bytes (512 bits)
    Capture Length: 64 bytes (512 bits)
    [Frame is marked: False]
    [Frame is ignored: False]
    [Protocols in frame: usb]
USB URB
    [Source: 3.3.2]
    [Destination: host]
    URB id: 0xffff89fbe8d2ea80
    URB type: URB_COMPLETE ('C')
    URB transfer type: URB_BULK (0x03)
    Endpoint: 0x82, Direction: IN
        1... .... = Direction: IN (1)
        .... 0010 = Endpoint number: 2
    Device: 3
    URB bus id: 3
    Device setup request: not relevant ('-')
    Data: present (0)
    URB sec: 1530473883
    URB usec: 130009
    URB status: No such file or directory (-ENOENT) (-2)
    URB length [bytes]: 0
    Data length [bytes]: 0
    [Request in: 75]
    [Time from request: 0.010814000 seconds]
    [bInterfaceClass: Printer (0x07)]
    Unused Setup Header
    Interval: 0
    Start frame: 0
    Copy of Transfer Flags: 0x00000200
    Number of ISO descriptors: 0

0000  80 ea d2 e8 fb 89 ff ff 43 03 82 03 03 00 2d 00   ........C.....-.
0010  9b 2d 39 5b 00 00 00 00 d9 fb 01 00 fe ff ff ff   .-9[............
0020  00 00 00 00 00 00 00 00 00 00 00 00 00 00 00 00   ................
0030  00 00 00 00 00 00 00 00 00 02 00 00 00 00 00 00   ................

Frame 77: 67 bytes on wire (536 bits), 67 bytes captured (536 bits) on interface 0
    Interface id: 0 (unknown)
        Interface name: unknown
    Encapsulation type: USB packets with Linux header and padding (115)
    Arrival Time: Jul  1, 2018 15:38:03.130302000 EDT
    [Time shift for this packet: 0.000000000 seconds]
    Epoch Time: 1530473883.130302000 seconds
    [Time delta from previous captured frame: 0.000293000 seconds]
    [Time delta from previous displayed frame: 0.000293000 seconds]
    [Time since reference or first frame: 258.268369000 seconds]
    Frame Number: 77
    Frame Length: 67 bytes (536 bits)
    Capture Length: 67 bytes (536 bits)
    [Frame is marked: False]
    [Frame is ignored: False]
    [Protocols in frame: usb]
USB URB
    [Source: host]
    [Destination: 3.3.1]
    URB id: 0xffff89fbe8d2ea80
    URB type: URB_SUBMIT ('S')
    URB transfer type: URB_BULK (0x03)
    Endpoint: 0x01, Direction: OUT
        0... .... = Direction: OUT (0)
        .... 0001 = Endpoint number: 1
    Device: 3
    URB bus id: 3
    Device setup request: not relevant ('-')
    Data: present (0)
    URB sec: 1530473883
    URB usec: 130302
    URB status: Operation now in progress (-EINPROGRESS) (-115)
    URB length [bytes]: 3
    Data length [bytes]: 3
    [Response in: 78]
    [bInterfaceClass: Printer (0x07)]
    Unused Setup Header
    Interval: 0
    Start frame: 0
    Copy of Transfer Flags: 0x00000000
    Number of ISO descriptors: 0
Leftover Capture Data: 464703

0000  80 ea d2 e8 fb 89 ff ff 53 03 01 03 03 00 2d 00   ........S.....-.
0010  9b 2d 39 5b 00 00 00 00 fe fc 01 00 8d ff ff ff   .-9[............
0020  03 00 00 00 03 00 00 00 00 00 00 00 00 00 00 00   ................
0030  00 00 00 00 00 00 00 00 00 00 00 00 00 00 00 00   ................
0040  46 47 03                                          FG.

Frame 78: 64 bytes on wire (512 bits), 64 bytes captured (512 bits) on interface 0
    Interface id: 0 (unknown)
        Interface name: unknown
    Encapsulation type: USB packets with Linux header and padding (115)
    Arrival Time: Jul  1, 2018 15:38:03.130347000 EDT
    [Time shift for this packet: 0.000000000 seconds]
    Epoch Time: 1530473883.130347000 seconds
    [Time delta from previous captured frame: 0.000045000 seconds]
    [Time delta from previous displayed frame: 0.000045000 seconds]
    [Time since reference or first frame: 258.268414000 seconds]
    Frame Number: 78
    Frame Length: 64 bytes (512 bits)
    Capture Length: 64 bytes (512 bits)
    [Frame is marked: False]
    [Frame is ignored: False]
    [Protocols in frame: usb]
USB URB
    [Source: 3.3.1]
    [Destination: host]
    URB id: 0xffff89fbe8d2ea80
    URB type: URB_COMPLETE ('C')
    URB transfer type: URB_BULK (0x03)
    Endpoint: 0x01, Direction: OUT
        0... .... = Direction: OUT (0)
        .... 0001 = Endpoint number: 1
    Device: 3
    URB bus id: 3
    Device setup request: not relevant ('-')
    Data: not present ('>')
    URB sec: 1530473883
    URB usec: 130347
    URB status: Success (0)
    URB length [bytes]: 3
    Data length [bytes]: 0
    [Request in: 77]
    [Time from request: 0.000045000 seconds]
    [bInterfaceClass: Printer (0x07)]
    Unused Setup Header
    Interval: 0
    Start frame: 0
    Copy of Transfer Flags: 0x00000000
    Number of ISO descriptors: 0

0000  80 ea d2 e8 fb 89 ff ff 43 03 01 03 03 00 2d 3e   ........C.....->
0010  9b 2d 39 5b 00 00 00 00 2b fd 01 00 00 00 00 00   .-9[....+.......
0020  03 00 00 00 00 00 00 00 00 00 00 00 00 00 00 00   ................
0030  00 00 00 00 00 00 00 00 00 00 00 00 00 00 00 00   ................

Frame 79: 64 bytes on wire (512 bits), 64 bytes captured (512 bits) on interface 0
    Interface id: 0 (unknown)
        Interface name: unknown
    Encapsulation type: USB packets with Linux header and padding (115)
    Arrival Time: Jul  1, 2018 15:38:03.130517000 EDT
    [Time shift for this packet: 0.000000000 seconds]
    Epoch Time: 1530473883.130517000 seconds
    [Time delta from previous captured frame: 0.000170000 seconds]
    [Time delta from previous displayed frame: 0.000170000 seconds]
    [Time since reference or first frame: 258.268584000 seconds]
    Frame Number: 79
    Frame Length: 64 bytes (512 bits)
    Capture Length: 64 bytes (512 bits)
    [Frame is marked: False]
    [Frame is ignored: False]
    [Protocols in frame: usb]
USB URB
    [Source: host]
    [Destination: 3.3.2]
    URB id: 0xffff89fbe8d2ea80
    URB type: URB_SUBMIT ('S')
    URB transfer type: URB_BULK (0x03)
    Endpoint: 0x82, Direction: IN
        1... .... = Direction: IN (1)
        .... 0010 = Endpoint number: 2
    Device: 3
    URB bus id: 3
    Device setup request: not relevant ('-')
    Data: not present ('<')
    URB sec: 1530473883
    URB usec: 130517
    URB status: Operation now in progress (-EINPROGRESS) (-115)
    URB length [bytes]: 64
    Data length [bytes]: 0
    [Response in: 80]
    [bInterfaceClass: Printer (0x07)]
    Unused Setup Header
    Interval: 0
    Start frame: 0
    Copy of Transfer Flags: 0x00000200
    Number of ISO descriptors: 0

0000  80 ea d2 e8 fb 89 ff ff 53 03 82 03 03 00 2d 3c   ........S.....-<
0010  9b 2d 39 5b 00 00 00 00 d5 fd 01 00 8d ff ff ff   .-9[............
0020  40 00 00 00 00 00 00 00 00 00 00 00 00 00 00 00   @...............
0030  00 00 00 00 00 00 00 00 00 02 00 00 00 00 00 00   ................

Frame 80: 82 bytes on wire (656 bits), 82 bytes captured (656 bits) on interface 0
    Interface id: 0 (unknown)
        Interface name: unknown
    Encapsulation type: USB packets with Linux header and padding (115)
    Arrival Time: Jul  1, 2018 15:38:03.282862000 EDT
    [Time shift for this packet: 0.000000000 seconds]
    Epoch Time: 1530473883.282862000 seconds
    [Time delta from previous captured frame: 0.152345000 seconds]
    [Time delta from previous displayed frame: 0.152345000 seconds]
    [Time since reference or first frame: 258.420929000 seconds]
    Frame Number: 80
    Frame Length: 82 bytes (656 bits)
    Capture Length: 82 bytes (656 bits)
    [Frame is marked: False]
    [Frame is ignored: False]
    [Protocols in frame: usb]
USB URB
    [Source: 3.3.2]
    [Destination: host]
    URB id: 0xffff89fbe8d2ea80
    URB type: URB_COMPLETE ('C')
    URB transfer type: URB_BULK (0x03)
    Endpoint: 0x82, Direction: IN
        1... .... = Direction: IN (1)
        .... 0010 = Endpoint number: 2
    Device: 3
    URB bus id: 3
    Device setup request: not relevant ('-')
    Data: present (0)
    URB sec: 1530473883
    URB usec: 282862
    URB status: Success (0)
    URB length [bytes]: 18
    Data length [bytes]: 18
    [Request in: 79]
    [Time from request: 0.152345000 seconds]
    [bInterfaceClass: Printer (0x07)]
    Unused Setup Header
    Interval: 0
    Start frame: 0
    Copy of Transfer Flags: 0x00000200
    Number of ISO descriptors: 0
Leftover Capture Data: 43414d454f20332056312e35302020202003

0000  80 ea d2 e8 fb 89 ff ff 43 03 82 03 03 00 2d 00   ........C.....-.
0010  9b 2d 39 5b 00 00 00 00 ee 50 04 00 00 00 00 00   .-9[.....P......
0020  12 00 00 00 12 00 00 00 00 00 00 00 00 00 00 00   ................
0030  00 00 00 00 00 00 00 00 00 02 00 00 00 00 00 00   ................
0040  43 41 4d 45 4f 20 33 20 56 31 2e 35 30 20 20 20   CAMEO 3 V1.50   
0050  20 03                                              .

Frame 81: 64 bytes on wire (512 bits), 64 bytes captured (512 bits) on interface 0
    Interface id: 0 (unknown)
        Interface name: unknown
    Encapsulation type: USB packets with Linux header and padding (115)
    Arrival Time: Jul  1, 2018 15:38:03.287745000 EDT
    [Time shift for this packet: 0.000000000 seconds]
    Epoch Time: 1530473883.287745000 seconds
    [Time delta from previous captured frame: 0.004883000 seconds]
    [Time delta from previous displayed frame: 0.004883000 seconds]
    [Time since reference or first frame: 258.425812000 seconds]
    Frame Number: 81
    Frame Length: 64 bytes (512 bits)
    Capture Length: 64 bytes (512 bits)
    [Frame is marked: False]
    [Frame is ignored: False]
    [Protocols in frame: usb]
USB URB
    [Source: host]
    [Destination: 3.3.2]
    URB id: 0xffff89fb745269c0
    URB type: URB_SUBMIT ('S')
    URB transfer type: URB_BULK (0x03)
    Endpoint: 0x82, Direction: IN
        1... .... = Direction: IN (1)
        .... 0010 = Endpoint number: 2
    Device: 3
    URB bus id: 3
    Device setup request: not relevant ('-')
    Data: not present ('<')
    URB sec: 1530473883
    URB usec: 287745
    URB status: Operation now in progress (-EINPROGRESS) (-115)
    URB length [bytes]: 64
    Data length [bytes]: 0
    [Response in: 82]
    [bInterfaceClass: Printer (0x07)]
    Unused Setup Header
    Interval: 0
    Start frame: 0
    Copy of Transfer Flags: 0x00000200
    Number of ISO descriptors: 0

0000  c0 69 52 74 fb 89 ff ff 53 03 82 03 03 00 2d 3c   .iRt....S.....-<
0010  9b 2d 39 5b 00 00 00 00 01 64 04 00 8d ff ff ff   .-9[.....d......
0020  40 00 00 00 00 00 00 00 00 00 00 00 00 00 00 00   @...............
0030  00 00 00 00 00 00 00 00 00 02 00 00 00 00 00 00   ................

Frame 82: 64 bytes on wire (512 bits), 64 bytes captured (512 bits) on interface 0
    Interface id: 0 (unknown)
        Interface name: unknown
    Encapsulation type: USB packets with Linux header and padding (115)
    Arrival Time: Jul  1, 2018 15:38:03.298066000 EDT
    [Time shift for this packet: 0.000000000 seconds]
    Epoch Time: 1530473883.298066000 seconds
    [Time delta from previous captured frame: 0.010321000 seconds]
    [Time delta from previous displayed frame: 0.010321000 seconds]
    [Time since reference or first frame: 258.436133000 seconds]
    Frame Number: 82
    Frame Length: 64 bytes (512 bits)
    Capture Length: 64 bytes (512 bits)
    [Frame is marked: False]
    [Frame is ignored: False]
    [Protocols in frame: usb]
USB URB
    [Source: 3.3.2]
    [Destination: host]
    URB id: 0xffff89fb745269c0
    URB type: URB_COMPLETE ('C')
    URB transfer type: URB_BULK (0x03)
    Endpoint: 0x82, Direction: IN
        1... .... = Direction: IN (1)
        .... 0010 = Endpoint number: 2
    Device: 3
    URB bus id: 3
    Device setup request: not relevant ('-')
    Data: present (0)
    URB sec: 1530473883
    URB usec: 298066
    URB status: No such file or directory (-ENOENT) (-2)
    URB length [bytes]: 0
    Data length [bytes]: 0
    [Request in: 81]
    [Time from request: 0.010321000 seconds]
    [bInterfaceClass: Printer (0x07)]
    Unused Setup Header
    Interval: 0
    Start frame: 0
    Copy of Transfer Flags: 0x00000200
    Number of ISO descriptors: 0

0000  c0 69 52 74 fb 89 ff ff 43 03 82 03 03 00 2d 00   .iRt....C.....-.
0010  9b 2d 39 5b 00 00 00 00 52 8c 04 00 fe ff ff ff   .-9[....R.......
0020  00 00 00 00 00 00 00 00 00 00 00 00 00 00 00 00   ................
0030  00 00 00 00 00 00 00 00 00 02 00 00 00 00 00 00   ................

Frame 83: 66 bytes on wire (528 bits), 66 bytes captured (528 bits) on interface 0
    Interface id: 0 (unknown)
        Interface name: unknown
    Encapsulation type: USB packets with Linux header and padding (115)
    Arrival Time: Jul  1, 2018 15:38:03.298496000 EDT
    [Time shift for this packet: 0.000000000 seconds]
    Epoch Time: 1530473883.298496000 seconds
    [Time delta from previous captured frame: 0.000430000 seconds]
    [Time delta from previous displayed frame: 0.000430000 seconds]
    [Time since reference or first frame: 258.436563000 seconds]
    Frame Number: 83
    Frame Length: 66 bytes (528 bits)
    Capture Length: 66 bytes (528 bits)
    [Frame is marked: False]
    [Frame is ignored: False]
    [Protocols in frame: usb]
USB URB
    [Source: host]
    [Destination: 3.3.1]
    URB id: 0xffff89fb745269c0
    URB type: URB_SUBMIT ('S')
    URB transfer type: URB_BULK (0x03)
    Endpoint: 0x01, Direction: OUT
        0... .... = Direction: OUT (0)
        .... 0001 = Endpoint number: 1
    Device: 3
    URB bus id: 3
    Device setup request: not relevant ('-')
    Data: present (0)
    URB sec: 1530473883
    URB usec: 298496
    URB status: Operation now in progress (-EINPROGRESS) (-115)
    URB length [bytes]: 2
    Data length [bytes]: 2
    [Response in: 84]
    [bInterfaceClass: Printer (0x07)]
    Unused Setup Header
    Interval: 0
    Start frame: 0
    Copy of Transfer Flags: 0x00000000
    Number of ISO descriptors: 0
Leftover Capture Data: 1b04

0000  c0 69 52 74 fb 89 ff ff 53 03 01 03 03 00 2d 00   .iRt....S.....-.
0010  9b 2d 39 5b 00 00 00 00 00 8e 04 00 8d ff ff ff   .-9[............
0020  02 00 00 00 02 00 00 00 00 00 00 00 00 00 00 00   ................
0030  00 00 00 00 00 00 00 00 00 00 00 00 00 00 00 00   ................
0040  1b 04                                             ..

Frame 84: 64 bytes on wire (512 bits), 64 bytes captured (512 bits) on interface 0
    Interface id: 0 (unknown)
        Interface name: unknown
    Encapsulation type: USB packets with Linux header and padding (115)
    Arrival Time: Jul  1, 2018 15:38:03.298539000 EDT
    [Time shift for this packet: 0.000000000 seconds]
    Epoch Time: 1530473883.298539000 seconds
    [Time delta from previous captured frame: 0.000043000 seconds]
    [Time delta from previous displayed frame: 0.000043000 seconds]
    [Time since reference or first frame: 258.436606000 seconds]
    Frame Number: 84
    Frame Length: 64 bytes (512 bits)
    Capture Length: 64 bytes (512 bits)
    [Frame is marked: False]
    [Frame is ignored: False]
    [Protocols in frame: usb]
USB URB
    [Source: 3.3.1]
    [Destination: host]
    URB id: 0xffff89fb745269c0
    URB type: URB_COMPLETE ('C')
    URB transfer type: URB_BULK (0x03)
    Endpoint: 0x01, Direction: OUT
        0... .... = Direction: OUT (0)
        .... 0001 = Endpoint number: 1
    Device: 3
    URB bus id: 3
    Device setup request: not relevant ('-')
    Data: not present ('>')
    URB sec: 1530473883
    URB usec: 298539
    URB status: Success (0)
    URB length [bytes]: 2
    Data length [bytes]: 0
    [Request in: 83]
    [Time from request: 0.000043000 seconds]
    [bInterfaceClass: Printer (0x07)]
    Unused Setup Header
    Interval: 0
    Start frame: 0
    Copy of Transfer Flags: 0x00000000
    Number of ISO descriptors: 0

0000  c0 69 52 74 fb 89 ff ff 43 03 01 03 03 00 2d 3e   .iRt....C.....->
0010  9b 2d 39 5b 00 00 00 00 2b 8e 04 00 00 00 00 00   .-9[....+.......
0020  02 00 00 00 00 00 00 00 00 00 00 00 00 00 00 00   ................
0030  00 00 00 00 00 00 00 00 00 00 00 00 00 00 00 00   ................

Frame 85: 64 bytes on wire (512 bits), 64 bytes captured (512 bits) on interface 0
    Interface id: 0 (unknown)
        Interface name: unknown
    Encapsulation type: USB packets with Linux header and padding (115)
    Arrival Time: Jul  1, 2018 15:38:03.298680000 EDT
    [Time shift for this packet: 0.000000000 seconds]
    Epoch Time: 1530473883.298680000 seconds
    [Time delta from previous captured frame: 0.000141000 seconds]
    [Time delta from previous displayed frame: 0.000141000 seconds]
    [Time since reference or first frame: 258.436747000 seconds]
    Frame Number: 85
    Frame Length: 64 bytes (512 bits)
    Capture Length: 64 bytes (512 bits)
    [Frame is marked: False]
    [Frame is ignored: False]
    [Protocols in frame: usb]
USB URB
    [Source: host]
    [Destination: 3.3.2]
    URB id: 0xffff89fb745269c0
    URB type: URB_SUBMIT ('S')
    URB transfer type: URB_BULK (0x03)
    Endpoint: 0x82, Direction: IN
        1... .... = Direction: IN (1)
        .... 0010 = Endpoint number: 2
    Device: 3
    URB bus id: 3
    Device setup request: not relevant ('-')
    Data: not present ('<')
    URB sec: 1530473883
    URB usec: 298680
    URB status: Operation now in progress (-EINPROGRESS) (-115)
    URB length [bytes]: 64
    Data length [bytes]: 0
    [Response in: 86]
    [bInterfaceClass: Printer (0x07)]
    Unused Setup Header
    Interval: 0
    Start frame: 0
    Copy of Transfer Flags: 0x00000200
    Number of ISO descriptors: 0

0000  c0 69 52 74 fb 89 ff ff 53 03 82 03 03 00 2d 3c   .iRt....S.....-<
0010  9b 2d 39 5b 00 00 00 00 b8 8e 04 00 8d ff ff ff   .-9[............
0020  40 00 00 00 00 00 00 00 00 00 00 00 00 00 00 00   @...............
0030  00 00 00 00 00 00 00 00 00 02 00 00 00 00 00 00   ................

Frame 86: 64 bytes on wire (512 bits), 64 bytes captured (512 bits) on interface 0
    Interface id: 0 (unknown)
        Interface name: unknown
    Encapsulation type: USB packets with Linux header and padding (115)
    Arrival Time: Jul  1, 2018 15:38:03.309081000 EDT
    [Time shift for this packet: 0.000000000 seconds]
    Epoch Time: 1530473883.309081000 seconds
    [Time delta from previous captured frame: 0.010401000 seconds]
    [Time delta from previous displayed frame: 0.010401000 seconds]
    [Time since reference or first frame: 258.447148000 seconds]
    Frame Number: 86
    Frame Length: 64 bytes (512 bits)
    Capture Length: 64 bytes (512 bits)
    [Frame is marked: False]
    [Frame is ignored: False]
    [Protocols in frame: usb]
USB URB
    [Source: 3.3.2]
    [Destination: host]
    URB id: 0xffff89fb745269c0
    URB type: URB_COMPLETE ('C')
    URB transfer type: URB_BULK (0x03)
    Endpoint: 0x82, Direction: IN
        1... .... = Direction: IN (1)
        .... 0010 = Endpoint number: 2
    Device: 3
    URB bus id: 3
    Device setup request: not relevant ('-')
    Data: present (0)
    URB sec: 1530473883
    URB usec: 309081
    URB status: No such file or directory (-ENOENT) (-2)
    URB length [bytes]: 0
    Data length [bytes]: 0
    [Request in: 85]
    [Time from request: 0.010401000 seconds]
    [bInterfaceClass: Printer (0x07)]
    Unused Setup Header
    Interval: 0
    Start frame: 0
    Copy of Transfer Flags: 0x00000200
    Number of ISO descriptors: 0

0000  c0 69 52 74 fb 89 ff ff 43 03 82 03 03 00 2d 00   .iRt....C.....-.
0010  9b 2d 39 5b 00 00 00 00 59 b7 04 00 fe ff ff ff   .-9[....Y.......
0020  00 00 00 00 00 00 00 00 00 00 00 00 00 00 00 00   ................
0030  00 00 00 00 00 00 00 00 00 02 00 00 00 00 00 00   ................

Frame 87: 67 bytes on wire (536 bits), 67 bytes captured (536 bits) on interface 0
    Interface id: 0 (unknown)
        Interface name: unknown
    Encapsulation type: USB packets with Linux header and padding (115)
    Arrival Time: Jul  1, 2018 15:38:03.309553000 EDT
    [Time shift for this packet: 0.000000000 seconds]
    Epoch Time: 1530473883.309553000 seconds
    [Time delta from previous captured frame: 0.000472000 seconds]
    [Time delta from previous displayed frame: 0.000472000 seconds]
    [Time since reference or first frame: 258.447620000 seconds]
    Frame Number: 87
    Frame Length: 67 bytes (536 bits)
    Capture Length: 67 bytes (536 bits)
    [Frame is marked: False]
    [Frame is ignored: False]
    [Protocols in frame: usb]
USB URB
    [Source: host]
    [Destination: 3.3.1]
    URB id: 0xffff89fb745269c0
    URB type: URB_SUBMIT ('S')
    URB transfer type: URB_BULK (0x03)
    Endpoint: 0x01, Direction: OUT
        0... .... = Direction: OUT (0)
        .... 0001 = Endpoint number: 1
    Device: 3
    URB bus id: 3
    Device setup request: not relevant ('-')
    Data: present (0)
    URB sec: 1530473883
    URB usec: 309553
    URB status: Operation now in progress (-EINPROGRESS) (-115)
    URB length [bytes]: 3
    Data length [bytes]: 3
    [Response in: 88]
    [bInterfaceClass: Printer (0x07)]
    Unused Setup Header
    Interval: 0
    Start frame: 0
    Copy of Transfer Flags: 0x00000000
    Number of ISO descriptors: 0
Leftover Capture Data: 464703

0000  c0 69 52 74 fb 89 ff ff 53 03 01 03 03 00 2d 00   .iRt....S.....-.
0010  9b 2d 39 5b 00 00 00 00 31 b9 04 00 8d ff ff ff   .-9[....1.......
0020  03 00 00 00 03 00 00 00 00 00 00 00 00 00 00 00   ................
0030  00 00 00 00 00 00 00 00 00 00 00 00 00 00 00 00   ................
0040  46 47 03                                          FG.

Frame 88: 64 bytes on wire (512 bits), 64 bytes captured (512 bits) on interface 0
    Interface id: 0 (unknown)
        Interface name: unknown
    Encapsulation type: USB packets with Linux header and padding (115)
    Arrival Time: Jul  1, 2018 15:38:03.364894000 EDT
    [Time shift for this packet: 0.000000000 seconds]
    Epoch Time: 1530473883.364894000 seconds
    [Time delta from previous captured frame: 0.055341000 seconds]
    [Time delta from previous displayed frame: 0.055341000 seconds]
    [Time since reference or first frame: 258.502961000 seconds]
    Frame Number: 88
    Frame Length: 64 bytes (512 bits)
    Capture Length: 64 bytes (512 bits)
    [Frame is marked: False]
    [Frame is ignored: False]
    [Protocols in frame: usb]
USB URB
    [Source: 3.3.1]
    [Destination: host]
    URB id: 0xffff89fb745269c0
    URB type: URB_COMPLETE ('C')
    URB transfer type: URB_BULK (0x03)
    Endpoint: 0x01, Direction: OUT
        0... .... = Direction: OUT (0)
        .... 0001 = Endpoint number: 1
    Device: 3
    URB bus id: 3
    Device setup request: not relevant ('-')
    Data: not present ('>')
    URB sec: 1530473883
    URB usec: 364894
    URB status: Success (0)
    URB length [bytes]: 3
    Data length [bytes]: 0
    [Request in: 87]
    [Time from request: 0.055341000 seconds]
    [bInterfaceClass: Printer (0x07)]
    Unused Setup Header
    Interval: 0
    Start frame: 0
    Copy of Transfer Flags: 0x00000000
    Number of ISO descriptors: 0

0000  c0 69 52 74 fb 89 ff ff 43 03 01 03 03 00 2d 3e   .iRt....C.....->
0010  9b 2d 39 5b 00 00 00 00 5e 91 05 00 00 00 00 00   .-9[....^.......
0020  03 00 00 00 00 00 00 00 00 00 00 00 00 00 00 00   ................
0030  00 00 00 00 00 00 00 00 00 00 00 00 00 00 00 00   ................

Frame 89: 64 bytes on wire (512 bits), 64 bytes captured (512 bits) on interface 0
    Interface id: 0 (unknown)
        Interface name: unknown
    Encapsulation type: USB packets with Linux header and padding (115)
    Arrival Time: Jul  1, 2018 15:38:03.365385000 EDT
    [Time shift for this packet: 0.000000000 seconds]
    Epoch Time: 1530473883.365385000 seconds
    [Time delta from previous captured frame: 0.000491000 seconds]
    [Time delta from previous displayed frame: 0.000491000 seconds]
    [Time since reference or first frame: 258.503452000 seconds]
    Frame Number: 89
    Frame Length: 64 bytes (512 bits)
    Capture Length: 64 bytes (512 bits)
    [Frame is marked: False]
    [Frame is ignored: False]
    [Protocols in frame: usb]
USB URB
    [Source: host]
    [Destination: 3.3.2]
    URB id: 0xffff89fb745269c0
    URB type: URB_SUBMIT ('S')
    URB transfer type: URB_BULK (0x03)
    Endpoint: 0x82, Direction: IN
        1... .... = Direction: IN (1)
        .... 0010 = Endpoint number: 2
    Device: 3
    URB bus id: 3
    Device setup request: not relevant ('-')
    Data: not present ('<')
    URB sec: 1530473883
    URB usec: 365385
    URB status: Operation now in progress (-EINPROGRESS) (-115)
    URB length [bytes]: 64
    Data length [bytes]: 0
    [Response in: 90]
    [bInterfaceClass: Printer (0x07)]
    Unused Setup Header
    Interval: 0
    Start frame: 0
    Copy of Transfer Flags: 0x00000200
    Number of ISO descriptors: 0

0000  c0 69 52 74 fb 89 ff ff 53 03 82 03 03 00 2d 3c   .iRt....S.....-<
0010  9b 2d 39 5b 00 00 00 00 49 93 05 00 8d ff ff ff   .-9[....I.......
0020  40 00 00 00 00 00 00 00 00 00 00 00 00 00 00 00   @...............
0030  00 00 00 00 00 00 00 00 00 02 00 00 00 00 00 00   ................

Frame 90: 82 bytes on wire (656 bits), 82 bytes captured (656 bits) on interface 0
    Interface id: 0 (unknown)
        Interface name: unknown
    Encapsulation type: USB packets with Linux header and padding (115)
    Arrival Time: Jul  1, 2018 15:38:03.528887000 EDT
    [Time shift for this packet: 0.000000000 seconds]
    Epoch Time: 1530473883.528887000 seconds
    [Time delta from previous captured frame: 0.163502000 seconds]
    [Time delta from previous displayed frame: 0.163502000 seconds]
    [Time since reference or first frame: 258.666954000 seconds]
    Frame Number: 90
    Frame Length: 82 bytes (656 bits)
    Capture Length: 82 bytes (656 bits)
    [Frame is marked: False]
    [Frame is ignored: False]
    [Protocols in frame: usb]
USB URB
    [Source: 3.3.2]
    [Destination: host]
    URB id: 0xffff89fb745269c0
    URB type: URB_COMPLETE ('C')
    URB transfer type: URB_BULK (0x03)
    Endpoint: 0x82, Direction: IN
        1... .... = Direction: IN (1)
        .... 0010 = Endpoint number: 2
    Device: 3
    URB bus id: 3
    Device setup request: not relevant ('-')
    Data: present (0)
    URB sec: 1530473883
    URB usec: 528887
    URB status: Success (0)
    URB length [bytes]: 18
    Data length [bytes]: 18
    [Request in: 89]
    [Time from request: 0.163502000 seconds]
    [bInterfaceClass: Printer (0x07)]
    Unused Setup Header
    Interval: 0
    Start frame: 0
    Copy of Transfer Flags: 0x00000200
    Number of ISO descriptors: 0
Leftover Capture Data: 43414d454f20332056312e35302020202003

0000  c0 69 52 74 fb 89 ff ff 43 03 82 03 03 00 2d 00   .iRt....C.....-.
0010  9b 2d 39 5b 00 00 00 00 f7 11 08 00 00 00 00 00   .-9[............
0020  12 00 00 00 12 00 00 00 00 00 00 00 00 00 00 00   ................
0030  00 00 00 00 00 00 00 00 00 02 00 00 00 00 00 00   ................
0040  43 41 4d 45 4f 20 33 20 56 31 2e 35 30 20 20 20   CAMEO 3 V1.50   
0050  20 03                                              .

Frame 91: 64 bytes on wire (512 bits), 64 bytes captured (512 bits) on interface 0
    Interface id: 0 (unknown)
        Interface name: unknown
    Encapsulation type: USB packets with Linux header and padding (115)
    Arrival Time: Jul  1, 2018 15:38:03.529507000 EDT
    [Time shift for this packet: 0.000000000 seconds]
    Epoch Time: 1530473883.529507000 seconds
    [Time delta from previous captured frame: 0.000620000 seconds]
    [Time delta from previous displayed frame: 0.000620000 seconds]
    [Time since reference or first frame: 258.667574000 seconds]
    Frame Number: 91
    Frame Length: 64 bytes (512 bits)
    Capture Length: 64 bytes (512 bits)
    [Frame is marked: False]
    [Frame is ignored: False]
    [Protocols in frame: usb]
USB URB
    [Source: host]
    [Destination: 3.3.2]
    URB id: 0xffff89fb745269c0
    URB type: URB_SUBMIT ('S')
    URB transfer type: URB_BULK (0x03)
    Endpoint: 0x82, Direction: IN
        1... .... = Direction: IN (1)
        .... 0010 = Endpoint number: 2
    Device: 3
    URB bus id: 3
    Device setup request: not relevant ('-')
    Data: not present ('<')
    URB sec: 1530473883
    URB usec: 529507
    URB status: Operation now in progress (-EINPROGRESS) (-115)
    URB length [bytes]: 64
    Data length [bytes]: 0
    [Response in: 92]
    [bInterfaceClass: Printer (0x07)]
    Unused Setup Header
    Interval: 0
    Start frame: 0
    Copy of Transfer Flags: 0x00000200
    Number of ISO descriptors: 0

0000  c0 69 52 74 fb 89 ff ff 53 03 82 03 03 00 2d 3c   .iRt....S.....-<
0010  9b 2d 39 5b 00 00 00 00 63 14 08 00 8d ff ff ff   .-9[....c.......
0020  40 00 00 00 00 00 00 00 00 00 00 00 00 00 00 00   @...............
0030  00 00 00 00 00 00 00 00 00 02 00 00 00 00 00 00   ................

Frame 92: 64 bytes on wire (512 bits), 64 bytes captured (512 bits) on interface 0
    Interface id: 0 (unknown)
        Interface name: unknown
    Encapsulation type: USB packets with Linux header and padding (115)
    Arrival Time: Jul  1, 2018 15:38:03.540058000 EDT
    [Time shift for this packet: 0.000000000 seconds]
    Epoch Time: 1530473883.540058000 seconds
    [Time delta from previous captured frame: 0.010551000 seconds]
    [Time delta from previous displayed frame: 0.010551000 seconds]
    [Time since reference or first frame: 258.678125000 seconds]
    Frame Number: 92
    Frame Length: 64 bytes (512 bits)
    Capture Length: 64 bytes (512 bits)
    [Frame is marked: False]
    [Frame is ignored: False]
    [Protocols in frame: usb]
USB URB
    [Source: 3.3.2]
    [Destination: host]
    URB id: 0xffff89fb745269c0
    URB type: URB_COMPLETE ('C')
    URB transfer type: URB_BULK (0x03)
    Endpoint: 0x82, Direction: IN
        1... .... = Direction: IN (1)
        .... 0010 = Endpoint number: 2
    Device: 3
    URB bus id: 3
    Device setup request: not relevant ('-')
    Data: present (0)
    URB sec: 1530473883
    URB usec: 540058
    URB status: No such file or directory (-ENOENT) (-2)
    URB length [bytes]: 0
    Data length [bytes]: 0
    [Request in: 91]
    [Time from request: 0.010551000 seconds]
    [bInterfaceClass: Printer (0x07)]
    Unused Setup Header
    Interval: 0
    Start frame: 0
    Copy of Transfer Flags: 0x00000200
    Number of ISO descriptors: 0

0000  c0 69 52 74 fb 89 ff ff 43 03 82 03 03 00 2d 00   .iRt....C.....-.
0010  9b 2d 39 5b 00 00 00 00 9a 3d 08 00 fe ff ff ff   .-9[.....=......
0020  00 00 00 00 00 00 00 00 00 00 00 00 00 00 00 00   ................
0030  00 00 00 00 00 00 00 00 00 02 00 00 00 00 00 00   ................

Frame 93: 70 bytes on wire (560 bits), 70 bytes captured (560 bits) on interface 0
    Interface id: 0 (unknown)
        Interface name: unknown
    Encapsulation type: USB packets with Linux header and padding (115)
    Arrival Time: Jul  1, 2018 15:38:03.540535000 EDT
    [Time shift for this packet: 0.000000000 seconds]
    Epoch Time: 1530473883.540535000 seconds
    [Time delta from previous captured frame: 0.000477000 seconds]
    [Time delta from previous displayed frame: 0.000477000 seconds]
    [Time since reference or first frame: 258.678602000 seconds]
    Frame Number: 93
    Frame Length: 70 bytes (560 bits)
    Capture Length: 70 bytes (560 bits)
    [Frame is marked: False]
    [Frame is ignored: False]
    [Protocols in frame: usb]
USB URB
    [Source: host]
    [Destination: 3.3.1]
    URB id: 0xffff89fb745269c0
    URB type: URB_SUBMIT ('S')
    URB transfer type: URB_BULK (0x03)
    Endpoint: 0x01, Direction: OUT
        0... .... = Direction: OUT (0)
        .... 0001 = Endpoint number: 1
    Device: 3
    URB bus id: 3
    Device setup request: not relevant ('-')
    Data: present (0)
    URB sec: 1530473883
    URB usec: 540535
    URB status: Operation now in progress (-EINPROGRESS) (-115)
    URB length [bytes]: 6
    Data length [bytes]: 6
    [Response in: 94]
    [bInterfaceClass: Printer (0x07)]
    Unused Setup Header
    Interval: 0
    Start frame: 0
    Copy of Transfer Flags: 0x00000000
    Number of ISO descriptors: 0
Leftover Capture Data: 465731313303

0000  c0 69 52 74 fb 89 ff ff 53 03 01 03 03 00 2d 00   .iRt....S.....-.
0010  9b 2d 39 5b 00 00 00 00 77 3f 08 00 8d ff ff ff   .-9[....w?......
0020  06 00 00 00 06 00 00 00 00 00 00 00 00 00 00 00   ................
0030  00 00 00 00 00 00 00 00 00 00 00 00 00 00 00 00   ................
0040  46 57 31 31 33 03                                 FW113.

Frame 94: 64 bytes on wire (512 bits), 64 bytes captured (512 bits) on interface 0
    Interface id: 0 (unknown)
        Interface name: unknown
    Encapsulation type: USB packets with Linux header and padding (115)
    Arrival Time: Jul  1, 2018 15:38:03.540586000 EDT
    [Time shift for this packet: 0.000000000 seconds]
    Epoch Time: 1530473883.540586000 seconds
    [Time delta from previous captured frame: 0.000051000 seconds]
    [Time delta from previous displayed frame: 0.000051000 seconds]
    [Time since reference or first frame: 258.678653000 seconds]
    Frame Number: 94
    Frame Length: 64 bytes (512 bits)
    Capture Length: 64 bytes (512 bits)
    [Frame is marked: False]
    [Frame is ignored: False]
    [Protocols in frame: usb]
USB URB
    [Source: 3.3.1]
    [Destination: host]
    URB id: 0xffff89fb745269c0
    URB type: URB_COMPLETE ('C')
    URB transfer type: URB_BULK (0x03)
    Endpoint: 0x01, Direction: OUT
        0... .... = Direction: OUT (0)
        .... 0001 = Endpoint number: 1
    Device: 3
    URB bus id: 3
    Device setup request: not relevant ('-')
    Data: not present ('>')
    URB sec: 1530473883
    URB usec: 540586
    URB status: Success (0)
    URB length [bytes]: 6
    Data length [bytes]: 0
    [Request in: 93]
    [Time from request: 0.000051000 seconds]
    [bInterfaceClass: Printer (0x07)]
    Unused Setup Header
    Interval: 0
    Start frame: 0
    Copy of Transfer Flags: 0x00000000
    Number of ISO descriptors: 0

0000  c0 69 52 74 fb 89 ff ff 43 03 01 03 03 00 2d 3e   .iRt....C.....->
0010  9b 2d 39 5b 00 00 00 00 aa 3f 08 00 00 00 00 00   .-9[.....?......
0020  06 00 00 00 00 00 00 00 00 00 00 00 00 00 00 00   ................
0030  00 00 00 00 00 00 00 00 00 00 00 00 00 00 00 00   ................

Frame 95: 64 bytes on wire (512 bits), 64 bytes captured (512 bits) on interface 0
    Interface id: 0 (unknown)
        Interface name: unknown
    Encapsulation type: USB packets with Linux header and padding (115)
    Arrival Time: Jul  1, 2018 15:38:03.540878000 EDT
    [Time shift for this packet: 0.000000000 seconds]
    Epoch Time: 1530473883.540878000 seconds
    [Time delta from previous captured frame: 0.000292000 seconds]
    [Time delta from previous displayed frame: 0.000292000 seconds]
    [Time since reference or first frame: 258.678945000 seconds]
    Frame Number: 95
    Frame Length: 64 bytes (512 bits)
    Capture Length: 64 bytes (512 bits)
    [Frame is marked: False]
    [Frame is ignored: False]
    [Protocols in frame: usb]
USB URB
    [Source: host]
    [Destination: 3.3.2]
    URB id: 0xffff89fb745269c0
    URB type: URB_SUBMIT ('S')
    URB transfer type: URB_BULK (0x03)
    Endpoint: 0x82, Direction: IN
        1... .... = Direction: IN (1)
        .... 0010 = Endpoint number: 2
    Device: 3
    URB bus id: 3
    Device setup request: not relevant ('-')
    Data: not present ('<')
    URB sec: 1530473883
    URB usec: 540878
    URB status: Operation now in progress (-EINPROGRESS) (-115)
    URB length [bytes]: 64
    Data length [bytes]: 0
    [Response in: 96]
    [bInterfaceClass: Printer (0x07)]
    Unused Setup Header
    Interval: 0
    Start frame: 0
    Copy of Transfer Flags: 0x00000200
    Number of ISO descriptors: 0

0000  c0 69 52 74 fb 89 ff ff 53 03 82 03 03 00 2d 3c   .iRt....S.....-<
0010  9b 2d 39 5b 00 00 00 00 ce 40 08 00 8d ff ff ff   .-9[.....@......
0020  40 00 00 00 00 00 00 00 00 00 00 00 00 00 00 00   @...............
0030  00 00 00 00 00 00 00 00 00 02 00 00 00 00 00 00   ................

Frame 96: 64 bytes on wire (512 bits), 64 bytes captured (512 bits) on interface 0
    Interface id: 0 (unknown)
        Interface name: unknown
    Encapsulation type: USB packets with Linux header and padding (115)
    Arrival Time: Jul  1, 2018 15:38:03.551015000 EDT
    [Time shift for this packet: 0.000000000 seconds]
    Epoch Time: 1530473883.551015000 seconds
    [Time delta from previous captured frame: 0.010137000 seconds]
    [Time delta from previous displayed frame: 0.010137000 seconds]
    [Time since reference or first frame: 258.689082000 seconds]
    Frame Number: 96
    Frame Length: 64 bytes (512 bits)
    Capture Length: 64 bytes (512 bits)
    [Frame is marked: False]
    [Frame is ignored: False]
    [Protocols in frame: usb]
USB URB
    [Source: 3.3.2]
    [Destination: host]
    URB id: 0xffff89fb745269c0
    URB type: URB_COMPLETE ('C')
    URB transfer type: URB_BULK (0x03)
    Endpoint: 0x82, Direction: IN
        1... .... = Direction: IN (1)
        .... 0010 = Endpoint number: 2
    Device: 3
    URB bus id: 3
    Device setup request: not relevant ('-')
    Data: present (0)
    URB sec: 1530473883
    URB usec: 551015
    URB status: No such file or directory (-ENOENT) (-2)
    URB length [bytes]: 0
    Data length [bytes]: 0
    [Request in: 95]
    [Time from request: 0.010137000 seconds]
    [bInterfaceClass: Printer (0x07)]
    Unused Setup Header
    Interval: 0
    Start frame: 0
    Copy of Transfer Flags: 0x00000200
    Number of ISO descriptors: 0

0000  c0 69 52 74 fb 89 ff ff 43 03 82 03 03 00 2d 00   .iRt....C.....-.
0010  9b 2d 39 5b 00 00 00 00 67 68 08 00 fe ff ff ff   .-9[....gh......
0020  00 00 00 00 00 00 00 00 00 00 00 00 00 00 00 00   ................
0030  00 00 00 00 00 00 00 00 00 02 00 00 00 00 00 00   ................

Frame 97: 68 bytes on wire (544 bits), 68 bytes captured (544 bits) on interface 0
    Interface id: 0 (unknown)
        Interface name: unknown
    Encapsulation type: USB packets with Linux header and padding (115)
    Arrival Time: Jul  1, 2018 15:38:03.551400000 EDT
    [Time shift for this packet: 0.000000000 seconds]
    Epoch Time: 1530473883.551400000 seconds
    [Time delta from previous captured frame: 0.000385000 seconds]
    [Time delta from previous displayed frame: 0.000385000 seconds]
    [Time since reference or first frame: 258.689467000 seconds]
    Frame Number: 97
    Frame Length: 68 bytes (544 bits)
    Capture Length: 68 bytes (544 bits)
    [Frame is marked: False]
    [Frame is ignored: False]
    [Protocols in frame: usb]
USB URB
    [Source: host]
    [Destination: 3.3.1]
    URB id: 0xffff89fc655e23c0
    URB type: URB_SUBMIT ('S')
    URB transfer type: URB_BULK (0x03)
    Endpoint: 0x01, Direction: OUT
        0... .... = Direction: OUT (0)
        .... 0001 = Endpoint number: 1
    Device: 3
    URB bus id: 3
    Device setup request: not relevant ('-')
    Data: present (0)
    URB sec: 1530473883
    URB usec: 551400
    URB status: Operation now in progress (-EINPROGRESS) (-115)
    URB length [bytes]: 4
    Data length [bytes]: 4
    [Response in: 98]
    [bInterfaceClass: Printer (0x07)]
    Unused Setup Header
    Interval: 0
    Start frame: 0
    Copy of Transfer Flags: 0x00000000
    Number of ISO descriptors: 0
Leftover Capture Data: 21313003

0000  c0 23 5e 65 fc 89 ff ff 53 03 01 03 03 00 2d 00   .#^e....S.....-.
0010  9b 2d 39 5b 00 00 00 00 e8 69 08 00 8d ff ff ff   .-9[.....i......
0020  04 00 00 00 04 00 00 00 00 00 00 00 00 00 00 00   ................
0030  00 00 00 00 00 00 00 00 00 00 00 00 00 00 00 00   ................
0040  21 31 30 03                                       !10.

Frame 98: 64 bytes on wire (512 bits), 64 bytes captured (512 bits) on interface 0
    Interface id: 0 (unknown)
        Interface name: unknown
    Encapsulation type: USB packets with Linux header and padding (115)
    Arrival Time: Jul  1, 2018 15:38:03.610900000 EDT
    [Time shift for this packet: 0.000000000 seconds]
    Epoch Time: 1530473883.610900000 seconds
    [Time delta from previous captured frame: 0.059500000 seconds]
    [Time delta from previous displayed frame: 0.059500000 seconds]
    [Time since reference or first frame: 258.748967000 seconds]
    Frame Number: 98
    Frame Length: 64 bytes (512 bits)
    Capture Length: 64 bytes (512 bits)
    [Frame is marked: False]
    [Frame is ignored: False]
    [Protocols in frame: usb]
USB URB
    [Source: 3.3.1]
    [Destination: host]
    URB id: 0xffff89fc655e23c0
    URB type: URB_COMPLETE ('C')
    URB transfer type: URB_BULK (0x03)
    Endpoint: 0x01, Direction: OUT
        0... .... = Direction: OUT (0)
        .... 0001 = Endpoint number: 1
    Device: 3
    URB bus id: 3
    Device setup request: not relevant ('-')
    Data: not present ('>')
    URB sec: 1530473883
    URB usec: 610900
    URB status: Success (0)
    URB length [bytes]: 4
    Data length [bytes]: 0
    [Request in: 97]
    [Time from request: 0.059500000 seconds]
    [bInterfaceClass: Printer (0x07)]
    Unused Setup Header
    Interval: 0
    Start frame: 0
    Copy of Transfer Flags: 0x00000000
    Number of ISO descriptors: 0

0000  c0 23 5e 65 fc 89 ff ff 43 03 01 03 03 00 2d 3e   .#^e....C.....->
0010  9b 2d 39 5b 00 00 00 00 54 52 09 00 00 00 00 00   .-9[....TR......
0020  04 00 00 00 00 00 00 00 00 00 00 00 00 00 00 00   ................
0030  00 00 00 00 00 00 00 00 00 00 00 00 00 00 00 00   ................

Frame 99: 64 bytes on wire (512 bits), 64 bytes captured (512 bits) on interface 0
    Interface id: 0 (unknown)
        Interface name: unknown
    Encapsulation type: USB packets with Linux header and padding (115)
    Arrival Time: Jul  1, 2018 15:38:03.611413000 EDT
    [Time shift for this packet: 0.000000000 seconds]
    Epoch Time: 1530473883.611413000 seconds
    [Time delta from previous captured frame: 0.000513000 seconds]
    [Time delta from previous displayed frame: 0.000513000 seconds]
    [Time since reference or first frame: 258.749480000 seconds]
    Frame Number: 99
    Frame Length: 64 bytes (512 bits)
    Capture Length: 64 bytes (512 bits)
    [Frame is marked: False]
    [Frame is ignored: False]
    [Protocols in frame: usb]
USB URB
    [Source: host]
    [Destination: 3.3.2]
    URB id: 0xffff89fbe8d2e300
    URB type: URB_SUBMIT ('S')
    URB transfer type: URB_BULK (0x03)
    Endpoint: 0x82, Direction: IN
        1... .... = Direction: IN (1)
        .... 0010 = Endpoint number: 2
    Device: 3
    URB bus id: 3
    Device setup request: not relevant ('-')
    Data: not present ('<')
    URB sec: 1530473883
    URB usec: 611413
    URB status: Operation now in progress (-EINPROGRESS) (-115)
    URB length [bytes]: 64
    Data length [bytes]: 0
    [Response in: 100]
    [bInterfaceClass: Printer (0x07)]
    Unused Setup Header
    Interval: 0
    Start frame: 0
    Copy of Transfer Flags: 0x00000200
    Number of ISO descriptors: 0

0000  00 e3 d2 e8 fb 89 ff ff 53 03 82 03 03 00 2d 3c   ........S.....-<
0010  9b 2d 39 5b 00 00 00 00 55 54 09 00 8d ff ff ff   .-9[....UT......
0020  40 00 00 00 00 00 00 00 00 00 00 00 00 00 00 00   @...............
0030  00 00 00 00 00 00 00 00 00 02 00 00 00 00 00 00   ................

Frame 100: 64 bytes on wire (512 bits), 64 bytes captured (512 bits) on interface 0
    Interface id: 0 (unknown)
        Interface name: unknown
    Encapsulation type: USB packets with Linux header and padding (115)
    Arrival Time: Jul  1, 2018 15:38:03.622107000 EDT
    [Time shift for this packet: 0.000000000 seconds]
    Epoch Time: 1530473883.622107000 seconds
    [Time delta from previous captured frame: 0.010694000 seconds]
    [Time delta from previous displayed frame: 0.010694000 seconds]
    [Time since reference or first frame: 258.760174000 seconds]
    Frame Number: 100
    Frame Length: 64 bytes (512 bits)
    Capture Length: 64 bytes (512 bits)
    [Frame is marked: False]
    [Frame is ignored: False]
    [Protocols in frame: usb]
USB URB
    [Source: 3.3.2]
    [Destination: host]
    URB id: 0xffff89fbe8d2e300
    URB type: URB_COMPLETE ('C')
    URB transfer type: URB_BULK (0x03)
    Endpoint: 0x82, Direction: IN
        1... .... = Direction: IN (1)
        .... 0010 = Endpoint number: 2
    Device: 3
    URB bus id: 3
    Device setup request: not relevant ('-')
    Data: present (0)
    URB sec: 1530473883
    URB usec: 622107
    URB status: No such file or directory (-ENOENT) (-2)
    URB length [bytes]: 0
    Data length [bytes]: 0
    [Request in: 99]
    [Time from request: 0.010694000 seconds]
    [bInterfaceClass: Printer (0x07)]
    Unused Setup Header
    Interval: 0
    Start frame: 0
    Copy of Transfer Flags: 0x00000200
    Number of ISO descriptors: 0

0000  00 e3 d2 e8 fb 89 ff ff 43 03 82 03 03 00 2d 00   ........C.....-.
0010  9b 2d 39 5b 00 00 00 00 1b 7e 09 00 fe ff ff ff   .-9[.....~......
0020  00 00 00 00 00 00 00 00 00 00 00 00 00 00 00 00   ................
0030  00 00 00 00 00 00 00 00 00 02 00 00 00 00 00 00   ................

Frame 101: 69 bytes on wire (552 bits), 69 bytes captured (552 bits) on interface 0
    Interface id: 0 (unknown)
        Interface name: unknown
    Encapsulation type: USB packets with Linux header and padding (115)
    Arrival Time: Jul  1, 2018 15:38:03.622643000 EDT
    [Time shift for this packet: 0.000000000 seconds]
    Epoch Time: 1530473883.622643000 seconds
    [Time delta from previous captured frame: 0.000536000 seconds]
    [Time delta from previous displayed frame: 0.000536000 seconds]
    [Time since reference or first frame: 258.760710000 seconds]
    Frame Number: 101
    Frame Length: 69 bytes (552 bits)
    Capture Length: 69 bytes (552 bits)
    [Frame is marked: False]
    [Frame is ignored: False]
    [Protocols in frame: usb]
USB URB
    [Source: host]
    [Destination: 3.3.1]
    URB id: 0xffff89fbe8d2e300
    URB type: URB_SUBMIT ('S')
    URB transfer type: URB_BULK (0x03)
    Endpoint: 0x01, Direction: OUT
        0... .... = Direction: OUT (0)
        .... 0001 = Endpoint number: 1
    Device: 3
    URB bus id: 3
    Device setup request: not relevant ('-')
    Data: present (0)
    URB sec: 1530473883
    URB usec: 622643
    URB status: Operation now in progress (-EINPROGRESS) (-115)
    URB length [bytes]: 5
    Data length [bytes]: 5
    [Response in: 102]
    [bInterfaceClass: Printer (0x07)]
    Unused Setup Header
    Interval: 0
    Start frame: 0
    Copy of Transfer Flags: 0x00000000
    Number of ISO descriptors: 0
Leftover Capture Data: 4658333003

0000  00 e3 d2 e8 fb 89 ff ff 53 03 01 03 03 00 2d 00   ........S.....-.
0010  9b 2d 39 5b 00 00 00 00 33 80 09 00 8d ff ff ff   .-9[....3.......
0020  05 00 00 00 05 00 00 00 00 00 00 00 00 00 00 00   ................
0030  00 00 00 00 00 00 00 00 00 00 00 00 00 00 00 00   ................
0040  46 58 33 30 03                                    FX30.

Frame 102: 64 bytes on wire (512 bits), 64 bytes captured (512 bits) on interface 0
    Interface id: 0 (unknown)
        Interface name: unknown
    Encapsulation type: USB packets with Linux header and padding (115)
    Arrival Time: Jul  1, 2018 15:38:03.692917000 EDT
    [Time shift for this packet: 0.000000000 seconds]
    Epoch Time: 1530473883.692917000 seconds
    [Time delta from previous captured frame: 0.070274000 seconds]
    [Time delta from previous displayed frame: 0.070274000 seconds]
    [Time since reference or first frame: 258.830984000 seconds]
    Frame Number: 102
    Frame Length: 64 bytes (512 bits)
    Capture Length: 64 bytes (512 bits)
    [Frame is marked: False]
    [Frame is ignored: False]
    [Protocols in frame: usb]
USB URB
    [Source: 3.3.1]
    [Destination: host]
    URB id: 0xffff89fbe8d2e300
    URB type: URB_COMPLETE ('C')
    URB transfer type: URB_BULK (0x03)
    Endpoint: 0x01, Direction: OUT
        0... .... = Direction: OUT (0)
        .... 0001 = Endpoint number: 1
    Device: 3
    URB bus id: 3
    Device setup request: not relevant ('-')
    Data: not present ('>')
    URB sec: 1530473883
    URB usec: 692917
    URB status: Success (0)
    URB length [bytes]: 5
    Data length [bytes]: 0
    [Request in: 101]
    [Time from request: 0.070274000 seconds]
    [bInterfaceClass: Printer (0x07)]
    Unused Setup Header
    Interval: 0
    Start frame: 0
    Copy of Transfer Flags: 0x00000000
    Number of ISO descriptors: 0

0000  00 e3 d2 e8 fb 89 ff ff 43 03 01 03 03 00 2d 3e   ........C.....->
0010  9b 2d 39 5b 00 00 00 00 b5 92 0a 00 00 00 00 00   .-9[............
0020  05 00 00 00 00 00 00 00 00 00 00 00 00 00 00 00   ................
0030  00 00 00 00 00 00 00 00 00 00 00 00 00 00 00 00   ................

Frame 103: 64 bytes on wire (512 bits), 64 bytes captured (512 bits) on interface 0
    Interface id: 0 (unknown)
        Interface name: unknown
    Encapsulation type: USB packets with Linux header and padding (115)
    Arrival Time: Jul  1, 2018 15:38:03.693436000 EDT
    [Time shift for this packet: 0.000000000 seconds]
    Epoch Time: 1530473883.693436000 seconds
    [Time delta from previous captured frame: 0.000519000 seconds]
    [Time delta from previous displayed frame: 0.000519000 seconds]
    [Time since reference or first frame: 258.831503000 seconds]
    Frame Number: 103
    Frame Length: 64 bytes (512 bits)
    Capture Length: 64 bytes (512 bits)
    [Frame is marked: False]
    [Frame is ignored: False]
    [Protocols in frame: usb]
USB URB
    [Source: host]
    [Destination: 3.3.2]
    URB id: 0xffff89fbe8d2e300
    URB type: URB_SUBMIT ('S')
    URB transfer type: URB_BULK (0x03)
    Endpoint: 0x82, Direction: IN
        1... .... = Direction: IN (1)
        .... 0010 = Endpoint number: 2
    Device: 3
    URB bus id: 3
    Device setup request: not relevant ('-')
    Data: not present ('<')
    URB sec: 1530473883
    URB usec: 693436
    URB status: Operation now in progress (-EINPROGRESS) (-115)
    URB length [bytes]: 64
    Data length [bytes]: 0
    [Response in: 104]
    [bInterfaceClass: Printer (0x07)]
    Unused Setup Header
    Interval: 0
    Start frame: 0
    Copy of Transfer Flags: 0x00000200
    Number of ISO descriptors: 0

0000  00 e3 d2 e8 fb 89 ff ff 53 03 82 03 03 00 2d 3c   ........S.....-<
0010  9b 2d 39 5b 00 00 00 00 bc 94 0a 00 8d ff ff ff   .-9[............
0020  40 00 00 00 00 00 00 00 00 00 00 00 00 00 00 00   @...............
0030  00 00 00 00 00 00 00 00 00 02 00 00 00 00 00 00   ................

Frame 104: 64 bytes on wire (512 bits), 64 bytes captured (512 bits) on interface 0
    Interface id: 0 (unknown)
        Interface name: unknown
    Encapsulation type: USB packets with Linux header and padding (115)
    Arrival Time: Jul  1, 2018 15:38:03.704113000 EDT
    [Time shift for this packet: 0.000000000 seconds]
    Epoch Time: 1530473883.704113000 seconds
    [Time delta from previous captured frame: 0.010677000 seconds]
    [Time delta from previous displayed frame: 0.010677000 seconds]
    [Time since reference or first frame: 258.842180000 seconds]
    Frame Number: 104
    Frame Length: 64 bytes (512 bits)
    Capture Length: 64 bytes (512 bits)
    [Frame is marked: False]
    [Frame is ignored: False]
    [Protocols in frame: usb]
USB URB
    [Source: 3.3.2]
    [Destination: host]
    URB id: 0xffff89fbe8d2e300
    URB type: URB_COMPLETE ('C')
    URB transfer type: URB_BULK (0x03)
    Endpoint: 0x82, Direction: IN
        1... .... = Direction: IN (1)
        .... 0010 = Endpoint number: 2
    Device: 3
    URB bus id: 3
    Device setup request: not relevant ('-')
    Data: present (0)
    URB sec: 1530473883
    URB usec: 704113
    URB status: No such file or directory (-ENOENT) (-2)
    URB length [bytes]: 0
    Data length [bytes]: 0
    [Request in: 103]
    [Time from request: 0.010677000 seconds]
    [bInterfaceClass: Printer (0x07)]
    Unused Setup Header
    Interval: 0
    Start frame: 0
    Copy of Transfer Flags: 0x00000200
    Number of ISO descriptors: 0

0000  00 e3 d2 e8 fb 89 ff ff 43 03 82 03 03 00 2d 00   ........C.....-.
0010  9b 2d 39 5b 00 00 00 00 71 be 0a 00 fe ff ff ff   .-9[....q.......
0020  00 00 00 00 00 00 00 00 00 00 00 00 00 00 00 00   ................
0030  00 00 00 00 00 00 00 00 00 02 00 00 00 00 00 00   ................

Frame 105: 69 bytes on wire (552 bits), 69 bytes captured (552 bits) on interface 0
    Interface id: 0 (unknown)
        Interface name: unknown
    Encapsulation type: USB packets with Linux header and padding (115)
    Arrival Time: Jul  1, 2018 15:38:03.704641000 EDT
    [Time shift for this packet: 0.000000000 seconds]
    Epoch Time: 1530473883.704641000 seconds
    [Time delta from previous captured frame: 0.000528000 seconds]
    [Time delta from previous displayed frame: 0.000528000 seconds]
    [Time since reference or first frame: 258.842708000 seconds]
    Frame Number: 105
    Frame Length: 69 bytes (552 bits)
    Capture Length: 69 bytes (552 bits)
    [Frame is marked: False]
    [Frame is ignored: False]
    [Protocols in frame: usb]
USB URB
    [Source: host]
    [Destination: 3.3.1]
    URB id: 0xffff89fbe8d2e300
    URB type: URB_SUBMIT ('S')
    URB transfer type: URB_BULK (0x03)
    Endpoint: 0x01, Direction: OUT
        0... .... = Direction: OUT (0)
        .... 0001 = Endpoint number: 1
    Device: 3
    URB bus id: 3
    Device setup request: not relevant ('-')
    Data: present (0)
    URB sec: 1530473883
    URB usec: 704641
    URB status: Operation now in progress (-EINPROGRESS) (-115)
    URB length [bytes]: 5
    Data length [bytes]: 5
    [Response in: 106]
    [bInterfaceClass: Printer (0x07)]
    Unused Setup Header
    Interval: 0
    Start frame: 0
    Copy of Transfer Flags: 0x00000000
    Number of ISO descriptors: 0
Leftover Capture Data: 4643313703

0000  00 e3 d2 e8 fb 89 ff ff 53 03 01 03 03 00 2d 00   ........S.....-.
0010  9b 2d 39 5b 00 00 00 00 81 c0 0a 00 8d ff ff ff   .-9[............
0020  05 00 00 00 05 00 00 00 00 00 00 00 00 00 00 00   ................
0030  00 00 00 00 00 00 00 00 00 00 00 00 00 00 00 00   ................
0040  46 43 31 37 03                                    FC17.

Frame 106: 64 bytes on wire (512 bits), 64 bytes captured (512 bits) on interface 0
    Interface id: 0 (unknown)
        Interface name: unknown
    Encapsulation type: USB packets with Linux header and padding (115)
    Arrival Time: Jul  1, 2018 15:38:03.774909000 EDT
    [Time shift for this packet: 0.000000000 seconds]
    Epoch Time: 1530473883.774909000 seconds
    [Time delta from previous captured frame: 0.070268000 seconds]
    [Time delta from previous displayed frame: 0.070268000 seconds]
    [Time since reference or first frame: 258.912976000 seconds]
    Frame Number: 106
    Frame Length: 64 bytes (512 bits)
    Capture Length: 64 bytes (512 bits)
    [Frame is marked: False]
    [Frame is ignored: False]
    [Protocols in frame: usb]
USB URB
    [Source: 3.3.1]
    [Destination: host]
    URB id: 0xffff89fbe8d2e300
    URB type: URB_COMPLETE ('C')
    URB transfer type: URB_BULK (0x03)
    Endpoint: 0x01, Direction: OUT
        0... .... = Direction: OUT (0)
        .... 0001 = Endpoint number: 1
    Device: 3
    URB bus id: 3
    Device setup request: not relevant ('-')
    Data: not present ('>')
    URB sec: 1530473883
    URB usec: 774909
    URB status: Success (0)
    URB length [bytes]: 5
    Data length [bytes]: 0
    [Request in: 105]
    [Time from request: 0.070268000 seconds]
    [bInterfaceClass: Printer (0x07)]
    Unused Setup Header
    Interval: 0
    Start frame: 0
    Copy of Transfer Flags: 0x00000000
    Number of ISO descriptors: 0

0000  00 e3 d2 e8 fb 89 ff ff 43 03 01 03 03 00 2d 3e   ........C.....->
0010  9b 2d 39 5b 00 00 00 00 fd d2 0b 00 00 00 00 00   .-9[............
0020  05 00 00 00 00 00 00 00 00 00 00 00 00 00 00 00   ................
0030  00 00 00 00 00 00 00 00 00 00 00 00 00 00 00 00   ................

Frame 107: 64 bytes on wire (512 bits), 64 bytes captured (512 bits) on interface 0
    Interface id: 0 (unknown)
        Interface name: unknown
    Encapsulation type: USB packets with Linux header and padding (115)
    Arrival Time: Jul  1, 2018 15:38:03.775389000 EDT
    [Time shift for this packet: 0.000000000 seconds]
    Epoch Time: 1530473883.775389000 seconds
    [Time delta from previous captured frame: 0.000480000 seconds]
    [Time delta from previous displayed frame: 0.000480000 seconds]
    [Time since reference or first frame: 258.913456000 seconds]
    Frame Number: 107
    Frame Length: 64 bytes (512 bits)
    Capture Length: 64 bytes (512 bits)
    [Frame is marked: False]
    [Frame is ignored: False]
    [Protocols in frame: usb]
USB URB
    [Source: host]
    [Destination: 3.3.2]
    URB id: 0xffff89fbe8d2e300
    URB type: URB_SUBMIT ('S')
    URB transfer type: URB_BULK (0x03)
    Endpoint: 0x82, Direction: IN
        1... .... = Direction: IN (1)
        .... 0010 = Endpoint number: 2
    Device: 3
    URB bus id: 3
    Device setup request: not relevant ('-')
    Data: not present ('<')
    URB sec: 1530473883
    URB usec: 775389
    URB status: Operation now in progress (-EINPROGRESS) (-115)
    URB length [bytes]: 64
    Data length [bytes]: 0
    [Response in: 108]
    [bInterfaceClass: Printer (0x07)]
    Unused Setup Header
    Interval: 0
    Start frame: 0
    Copy of Transfer Flags: 0x00000200
    Number of ISO descriptors: 0

0000  00 e3 d2 e8 fb 89 ff ff 53 03 82 03 03 00 2d 3c   ........S.....-<
0010  9b 2d 39 5b 00 00 00 00 dd d4 0b 00 8d ff ff ff   .-9[............
0020  40 00 00 00 00 00 00 00 00 00 00 00 00 00 00 00   @...............
0030  00 00 00 00 00 00 00 00 00 02 00 00 00 00 00 00   ................

Frame 108: 64 bytes on wire (512 bits), 64 bytes captured (512 bits) on interface 0
    Interface id: 0 (unknown)
        Interface name: unknown
    Encapsulation type: USB packets with Linux header and padding (115)
    Arrival Time: Jul  1, 2018 15:38:03.786109000 EDT
    [Time shift for this packet: 0.000000000 seconds]
    Epoch Time: 1530473883.786109000 seconds
    [Time delta from previous captured frame: 0.010720000 seconds]
    [Time delta from previous displayed frame: 0.010720000 seconds]
    [Time since reference or first frame: 258.924176000 seconds]
    Frame Number: 108
    Frame Length: 64 bytes (512 bits)
    Capture Length: 64 bytes (512 bits)
    [Frame is marked: False]
    [Frame is ignored: False]
    [Protocols in frame: usb]
USB URB
    [Source: 3.3.2]
    [Destination: host]
    URB id: 0xffff89fbe8d2e300
    URB type: URB_COMPLETE ('C')
    URB transfer type: URB_BULK (0x03)
    Endpoint: 0x82, Direction: IN
        1... .... = Direction: IN (1)
        .... 0010 = Endpoint number: 2
    Device: 3
    URB bus id: 3
    Device setup request: not relevant ('-')
    Data: present (0)
    URB sec: 1530473883
    URB usec: 786109
    URB status: No such file or directory (-ENOENT) (-2)
    URB length [bytes]: 0
    Data length [bytes]: 0
    [Request in: 107]
    [Time from request: 0.010720000 seconds]
    [bInterfaceClass: Printer (0x07)]
    Unused Setup Header
    Interval: 0
    Start frame: 0
    Copy of Transfer Flags: 0x00000200
    Number of ISO descriptors: 0

0000  00 e3 d2 e8 fb 89 ff ff 43 03 82 03 03 00 2d 00   ........C.....-.
0010  9b 2d 39 5b 00 00 00 00 bd fe 0b 00 fe ff ff ff   .-9[............
0020  00 00 00 00 00 00 00 00 00 00 00 00 00 00 00 00   ................
0030  00 00 00 00 00 00 00 00 00 02 00 00 00 00 00 00   ................

Frame 109: 68 bytes on wire (544 bits), 68 bytes captured (544 bits) on interface 0
    Interface id: 0 (unknown)
        Interface name: unknown
    Encapsulation type: USB packets with Linux header and padding (115)
    Arrival Time: Jul  1, 2018 15:38:03.786658000 EDT
    [Time shift for this packet: 0.000000000 seconds]
    Epoch Time: 1530473883.786658000 seconds
    [Time delta from previous captured frame: 0.000549000 seconds]
    [Time delta from previous displayed frame: 0.000549000 seconds]
    [Time since reference or first frame: 258.924725000 seconds]
    Frame Number: 109
    Frame Length: 68 bytes (544 bits)
    Capture Length: 68 bytes (544 bits)
    [Frame is marked: False]
    [Frame is ignored: False]
    [Protocols in frame: usb]
USB URB
    [Source: host]
    [Destination: 3.3.1]
    URB id: 0xffff89fbe8d2e300
    URB type: URB_SUBMIT ('S')
    URB transfer type: URB_BULK (0x03)
    Endpoint: 0x01, Direction: OUT
        0... .... = Direction: OUT (0)
        .... 0001 = Endpoint number: 1
    Device: 3
    URB bus id: 3
    Device setup request: not relevant ('-')
    Data: present (0)
    URB sec: 1530473883
    URB usec: 786658
    URB status: Operation now in progress (-EINPROGRESS) (-115)
    URB length [bytes]: 4
    Data length [bytes]: 4
    [Response in: 110]
    [bInterfaceClass: Printer (0x07)]
    Unused Setup Header
    Interval: 0
    Start frame: 0
    Copy of Transfer Flags: 0x00000000
    Number of ISO descriptors: 0
Leftover Capture Data: 46593003

0000  00 e3 d2 e8 fb 89 ff ff 53 03 01 03 03 00 2d 00   ........S.....-.
0010  9b 2d 39 5b 00 00 00 00 e2 00 0c 00 8d ff ff ff   .-9[............
0020  04 00 00 00 04 00 00 00 00 00 00 00 00 00 00 00   ................
0030  00 00 00 00 00 00 00 00 00 00 00 00 00 00 00 00   ................
0040  46 59 30 03                                       FY0.

Frame 110: 64 bytes on wire (512 bits), 64 bytes captured (512 bits) on interface 0
    Interface id: 0 (unknown)
        Interface name: unknown
    Encapsulation type: USB packets with Linux header and padding (115)
    Arrival Time: Jul  1, 2018 15:38:03.856858000 EDT
    [Time shift for this packet: 0.000000000 seconds]
    Epoch Time: 1530473883.856858000 seconds
    [Time delta from previous captured frame: 0.070200000 seconds]
    [Time delta from previous displayed frame: 0.070200000 seconds]
    [Time since reference or first frame: 258.994925000 seconds]
    Frame Number: 110
    Frame Length: 64 bytes (512 bits)
    Capture Length: 64 bytes (512 bits)
    [Frame is marked: False]
    [Frame is ignored: False]
    [Protocols in frame: usb]
USB URB
    [Source: 3.3.1]
    [Destination: host]
    URB id: 0xffff89fbe8d2e300
    URB type: URB_COMPLETE ('C')
    URB transfer type: URB_BULK (0x03)
    Endpoint: 0x01, Direction: OUT
        0... .... = Direction: OUT (0)
        .... 0001 = Endpoint number: 1
    Device: 3
    URB bus id: 3
    Device setup request: not relevant ('-')
    Data: not present ('>')
    URB sec: 1530473883
    URB usec: 856858
    URB status: Success (0)
    URB length [bytes]: 4
    Data length [bytes]: 0
    [Request in: 109]
    [Time from request: 0.070200000 seconds]
    [bInterfaceClass: Printer (0x07)]
    Unused Setup Header
    Interval: 0
    Start frame: 0
    Copy of Transfer Flags: 0x00000000
    Number of ISO descriptors: 0

0000  00 e3 d2 e8 fb 89 ff ff 43 03 01 03 03 00 2d 3e   ........C.....->
0010  9b 2d 39 5b 00 00 00 00 1a 13 0d 00 00 00 00 00   .-9[............
0020  04 00 00 00 00 00 00 00 00 00 00 00 00 00 00 00   ................
0030  00 00 00 00 00 00 00 00 00 00 00 00 00 00 00 00   ................

Frame 111: 64 bytes on wire (512 bits), 64 bytes captured (512 bits) on interface 0
    Interface id: 0 (unknown)
        Interface name: unknown
    Encapsulation type: USB packets with Linux header and padding (115)
    Arrival Time: Jul  1, 2018 15:38:03.857313000 EDT
    [Time shift for this packet: 0.000000000 seconds]
    Epoch Time: 1530473883.857313000 seconds
    [Time delta from previous captured frame: 0.000455000 seconds]
    [Time delta from previous displayed frame: 0.000455000 seconds]
    [Time since reference or first frame: 258.995380000 seconds]
    Frame Number: 111
    Frame Length: 64 bytes (512 bits)
    Capture Length: 64 bytes (512 bits)
    [Frame is marked: False]
    [Frame is ignored: False]
    [Protocols in frame: usb]
USB URB
    [Source: host]
    [Destination: 3.3.2]
    URB id: 0xffff89fbe8d2e300
    URB type: URB_SUBMIT ('S')
    URB transfer type: URB_BULK (0x03)
    Endpoint: 0x82, Direction: IN
        1... .... = Direction: IN (1)
        .... 0010 = Endpoint number: 2
    Device: 3
    URB bus id: 3
    Device setup request: not relevant ('-')
    Data: not present ('<')
    URB sec: 1530473883
    URB usec: 857313
    URB status: Operation now in progress (-EINPROGRESS) (-115)
    URB length [bytes]: 64
    Data length [bytes]: 0
    [Response in: 112]
    [bInterfaceClass: Printer (0x07)]
    Unused Setup Header
    Interval: 0
    Start frame: 0
    Copy of Transfer Flags: 0x00000200
    Number of ISO descriptors: 0

0000  00 e3 d2 e8 fb 89 ff ff 53 03 82 03 03 00 2d 3c   ........S.....-<
0010  9b 2d 39 5b 00 00 00 00 e1 14 0d 00 8d ff ff ff   .-9[............
0020  40 00 00 00 00 00 00 00 00 00 00 00 00 00 00 00   @...............
0030  00 00 00 00 00 00 00 00 00 02 00 00 00 00 00 00   ................

Frame 112: 64 bytes on wire (512 bits), 64 bytes captured (512 bits) on interface 0
    Interface id: 0 (unknown)
        Interface name: unknown
    Encapsulation type: USB packets with Linux header and padding (115)
    Arrival Time: Jul  1, 2018 15:38:03.868109000 EDT
    [Time shift for this packet: 0.000000000 seconds]
    Epoch Time: 1530473883.868109000 seconds
    [Time delta from previous captured frame: 0.010796000 seconds]
    [Time delta from previous displayed frame: 0.010796000 seconds]
    [Time since reference or first frame: 259.006176000 seconds]
    Frame Number: 112
    Frame Length: 64 bytes (512 bits)
    Capture Length: 64 bytes (512 bits)
    [Frame is marked: False]
    [Frame is ignored: False]
    [Protocols in frame: usb]
USB URB
    [Source: 3.3.2]
    [Destination: host]
    URB id: 0xffff89fbe8d2e300
    URB type: URB_COMPLETE ('C')
    URB transfer type: URB_BULK (0x03)
    Endpoint: 0x82, Direction: IN
        1... .... = Direction: IN (1)
        .... 0010 = Endpoint number: 2
    Device: 3
    URB bus id: 3
    Device setup request: not relevant ('-')
    Data: present (0)
    URB sec: 1530473883
    URB usec: 868109
    URB status: No such file or directory (-ENOENT) (-2)
    URB length [bytes]: 0
    Data length [bytes]: 0
    [Request in: 111]
    [Time from request: 0.010796000 seconds]
    [bInterfaceClass: Printer (0x07)]
    Unused Setup Header
    Interval: 0
    Start frame: 0
    Copy of Transfer Flags: 0x00000200
    Number of ISO descriptors: 0

0000  00 e3 d2 e8 fb 89 ff ff 43 03 82 03 03 00 2d 00   ........C.....-.
0010  9b 2d 39 5b 00 00 00 00 0d 3f 0d 00 fe ff ff ff   .-9[.....?......
0020  00 00 00 00 00 00 00 00 00 00 00 00 00 00 00 00   ................
0030  00 00 00 00 00 00 00 00 00 02 00 00 00 00 00 00   ................

Frame 113: 75 bytes on wire (600 bits), 75 bytes captured (600 bits) on interface 0
    Interface id: 0 (unknown)
        Interface name: unknown
    Encapsulation type: USB packets with Linux header and padding (115)
    Arrival Time: Jul  1, 2018 15:38:03.868620000 EDT
    [Time shift for this packet: 0.000000000 seconds]
    Epoch Time: 1530473883.868620000 seconds
    [Time delta from previous captured frame: 0.000511000 seconds]
    [Time delta from previous displayed frame: 0.000511000 seconds]
    [Time since reference or first frame: 259.006687000 seconds]
    Frame Number: 113
    Frame Length: 75 bytes (600 bits)
    Capture Length: 75 bytes (600 bits)
    [Frame is marked: False]
    [Frame is ignored: False]
    [Protocols in frame: usb]
USB URB
    [Source: host]
    [Destination: 3.3.1]
    URB id: 0xffff89fbe8d2e300
    URB type: URB_SUBMIT ('S')
    URB transfer type: URB_BULK (0x03)
    Endpoint: 0x01, Direction: OUT
        0... .... = Direction: OUT (0)
        .... 0001 = Endpoint number: 1
    Device: 3
    URB bus id: 3
    Device setup request: not relevant ('-')
    Data: present (0)
    URB sec: 1530473883
    URB usec: 868620
    URB status: Operation now in progress (-EINPROGRESS) (-115)
    URB length [bytes]: 11
    Data length [bytes]: 11
    [Response in: 114]
    [bInterfaceClass: Printer (0x07)]
    Unused Setup Header
    Interval: 0
    Start frame: 0
    Copy of Transfer Flags: 0x00000000
    Number of ISO descriptors: 0
Leftover Capture Data: 464e3003544235302c3003

0000  00 e3 d2 e8 fb 89 ff ff 53 03 01 03 03 00 2d 00   ........S.....-.
0010  9b 2d 39 5b 00 00 00 00 0c 41 0d 00 8d ff ff ff   .-9[.....A......
0020  0b 00 00 00 0b 00 00 00 00 00 00 00 00 00 00 00   ................
0030  00 00 00 00 00 00 00 00 00 00 00 00 00 00 00 00   ................
0040  46 4e 30 03 54 42 35 30 2c 30 03                  FN0.TB50,0.

Frame 114: 64 bytes on wire (512 bits), 64 bytes captured (512 bits) on interface 0
    Interface id: 0 (unknown)
        Interface name: unknown
    Encapsulation type: USB packets with Linux header and padding (115)
    Arrival Time: Jul  1, 2018 15:38:03.938901000 EDT
    [Time shift for this packet: 0.000000000 seconds]
    Epoch Time: 1530473883.938901000 seconds
    [Time delta from previous captured frame: 0.070281000 seconds]
    [Time delta from previous displayed frame: 0.070281000 seconds]
    [Time since reference or first frame: 259.076968000 seconds]
    Frame Number: 114
    Frame Length: 64 bytes (512 bits)
    Capture Length: 64 bytes (512 bits)
    [Frame is marked: False]
    [Frame is ignored: False]
    [Protocols in frame: usb]
USB URB
    [Source: 3.3.1]
    [Destination: host]
    URB id: 0xffff89fbe8d2e300
    URB type: URB_COMPLETE ('C')
    URB transfer type: URB_BULK (0x03)
    Endpoint: 0x01, Direction: OUT
        0... .... = Direction: OUT (0)
        .... 0001 = Endpoint number: 1
    Device: 3
    URB bus id: 3
    Device setup request: not relevant ('-')
    Data: not present ('>')
    URB sec: 1530473883
    URB usec: 938901
    URB status: Success (0)
    URB length [bytes]: 11
    Data length [bytes]: 0
    [Request in: 113]
    [Time from request: 0.070281000 seconds]
    [bInterfaceClass: Printer (0x07)]
    Unused Setup Header
    Interval: 0
    Start frame: 0
    Copy of Transfer Flags: 0x00000000
    Number of ISO descriptors: 0

0000  00 e3 d2 e8 fb 89 ff ff 43 03 01 03 03 00 2d 3e   ........C.....->
0010  9b 2d 39 5b 00 00 00 00 95 53 0e 00 00 00 00 00   .-9[.....S......
0020  0b 00 00 00 00 00 00 00 00 00 00 00 00 00 00 00   ................
0030  00 00 00 00 00 00 00 00 00 00 00 00 00 00 00 00   ................

Frame 115: 64 bytes on wire (512 bits), 64 bytes captured (512 bits) on interface 0
    Interface id: 0 (unknown)
        Interface name: unknown
    Encapsulation type: USB packets with Linux header and padding (115)
    Arrival Time: Jul  1, 2018 15:38:03.939354000 EDT
    [Time shift for this packet: 0.000000000 seconds]
    Epoch Time: 1530473883.939354000 seconds
    [Time delta from previous captured frame: 0.000453000 seconds]
    [Time delta from previous displayed frame: 0.000453000 seconds]
    [Time since reference or first frame: 259.077421000 seconds]
    Frame Number: 115
    Frame Length: 64 bytes (512 bits)
    Capture Length: 64 bytes (512 bits)
    [Frame is marked: False]
    [Frame is ignored: False]
    [Protocols in frame: usb]
USB URB
    [Source: host]
    [Destination: 3.3.2]
    URB id: 0xffff89fbe8d2e300
    URB type: URB_SUBMIT ('S')
    URB transfer type: URB_BULK (0x03)
    Endpoint: 0x82, Direction: IN
        1... .... = Direction: IN (1)
        .... 0010 = Endpoint number: 2
    Device: 3
    URB bus id: 3
    Device setup request: not relevant ('-')
    Data: not present ('<')
    URB sec: 1530473883
    URB usec: 939354
    URB status: Operation now in progress (-EINPROGRESS) (-115)
    URB length [bytes]: 64
    Data length [bytes]: 0
    [Response in: 116]
    [bInterfaceClass: Printer (0x07)]
    Unused Setup Header
    Interval: 0
    Start frame: 0
    Copy of Transfer Flags: 0x00000200
    Number of ISO descriptors: 0

0000  00 e3 d2 e8 fb 89 ff ff 53 03 82 03 03 00 2d 3c   ........S.....-<
0010  9b 2d 39 5b 00 00 00 00 5a 55 0e 00 8d ff ff ff   .-9[....ZU......
0020  40 00 00 00 00 00 00 00 00 00 00 00 00 00 00 00   @...............
0030  00 00 00 00 00 00 00 00 00 02 00 00 00 00 00 00   ................

Frame 116: 64 bytes on wire (512 bits), 64 bytes captured (512 bits) on interface 0
    Interface id: 0 (unknown)
        Interface name: unknown
    Encapsulation type: USB packets with Linux header and padding (115)
    Arrival Time: Jul  1, 2018 15:38:03.950109000 EDT
    [Time shift for this packet: 0.000000000 seconds]
    Epoch Time: 1530473883.950109000 seconds
    [Time delta from previous captured frame: 0.010755000 seconds]
    [Time delta from previous displayed frame: 0.010755000 seconds]
    [Time since reference or first frame: 259.088176000 seconds]
    Frame Number: 116
    Frame Length: 64 bytes (512 bits)
    Capture Length: 64 bytes (512 bits)
    [Frame is marked: False]
    [Frame is ignored: False]
    [Protocols in frame: usb]
USB URB
    [Source: 3.3.2]
    [Destination: host]
    URB id: 0xffff89fbe8d2e300
    URB type: URB_COMPLETE ('C')
    URB transfer type: URB_BULK (0x03)
    Endpoint: 0x82, Direction: IN
        1... .... = Direction: IN (1)
        .... 0010 = Endpoint number: 2
    Device: 3
    URB bus id: 3
    Device setup request: not relevant ('-')
    Data: present (0)
    URB sec: 1530473883
    URB usec: 950109
    URB status: No such file or directory (-ENOENT) (-2)
    URB length [bytes]: 0
    Data length [bytes]: 0
    [Request in: 115]
    [Time from request: 0.010755000 seconds]
    [bInterfaceClass: Printer (0x07)]
    Unused Setup Header
    Interval: 0
    Start frame: 0
    Copy of Transfer Flags: 0x00000200
    Number of ISO descriptors: 0

0000  00 e3 d2 e8 fb 89 ff ff 43 03 82 03 03 00 2d 00   ........C.....-.
0010  9b 2d 39 5b 00 00 00 00 5d 7f 0e 00 fe ff ff ff   .-9[....].......
0020  00 00 00 00 00 00 00 00 00 00 00 00 00 00 00 00   ................
0030  00 00 00 00 00 00 00 00 00 02 00 00 00 00 00 00   ................

Frame 117: 70 bytes on wire (560 bits), 70 bytes captured (560 bits) on interface 0
    Interface id: 0 (unknown)
        Interface name: unknown
    Encapsulation type: USB packets with Linux header and padding (115)
    Arrival Time: Jul  1, 2018 15:38:03.950648000 EDT
    [Time shift for this packet: 0.000000000 seconds]
    Epoch Time: 1530473883.950648000 seconds
    [Time delta from previous captured frame: 0.000539000 seconds]
    [Time delta from previous displayed frame: 0.000539000 seconds]
    [Time since reference or first frame: 259.088715000 seconds]
    Frame Number: 117
    Frame Length: 70 bytes (560 bits)
    Capture Length: 70 bytes (560 bits)
    [Frame is marked: False]
    [Frame is ignored: False]
    [Protocols in frame: usb]
USB URB
    [Source: host]
    [Destination: 3.3.1]
    URB id: 0xffff89fbe8d2e300
    URB type: URB_SUBMIT ('S')
    URB transfer type: URB_BULK (0x03)
    Endpoint: 0x01, Direction: OUT
        0... .... = Direction: OUT (0)
        .... 0001 = Endpoint number: 1
    Device: 3
    URB bus id: 3
    Device setup request: not relevant ('-')
    Data: present (0)
    URB sec: 1530473883
    URB usec: 950648
    URB status: Operation now in progress (-EINPROGRESS) (-115)
    URB length [bytes]: 6
    Data length [bytes]: 6
    [Response in: 118]
    [bInterfaceClass: Printer (0x07)]
    Unused Setup Header
    Interval: 0
    Start frame: 0
    Copy of Transfer Flags: 0x00000000
    Number of ISO descriptors: 0
Leftover Capture Data: 4645302c3003

0000  00 e3 d2 e8 fb 89 ff ff 53 03 01 03 03 00 2d 00   ........S.....-.
0010  9b 2d 39 5b 00 00 00 00 78 81 0e 00 8d ff ff ff   .-9[....x.......
0020  06 00 00 00 06 00 00 00 00 00 00 00 00 00 00 00   ................
0030  00 00 00 00 00 00 00 00 00 00 00 00 00 00 00 00   ................
0040  46 45 30 2c 30 03                                 FE0,0.

Frame 118: 64 bytes on wire (512 bits), 64 bytes captured (512 bits) on interface 0
    Interface id: 0 (unknown)
        Interface name: unknown
    Encapsulation type: USB packets with Linux header and padding (115)
    Arrival Time: Jul  1, 2018 15:38:04.020892000 EDT
    [Time shift for this packet: 0.000000000 seconds]
    Epoch Time: 1530473884.020892000 seconds
    [Time delta from previous captured frame: 0.070244000 seconds]
    [Time delta from previous displayed frame: 0.070244000 seconds]
    [Time since reference or first frame: 259.158959000 seconds]
    Frame Number: 118
    Frame Length: 64 bytes (512 bits)
    Capture Length: 64 bytes (512 bits)
    [Frame is marked: False]
    [Frame is ignored: False]
    [Protocols in frame: usb]
USB URB
    [Source: 3.3.1]
    [Destination: host]
    URB id: 0xffff89fbe8d2e300
    URB type: URB_COMPLETE ('C')
    URB transfer type: URB_BULK (0x03)
    Endpoint: 0x01, Direction: OUT
        0... .... = Direction: OUT (0)
        .... 0001 = Endpoint number: 1
    Device: 3
    URB bus id: 3
    Device setup request: not relevant ('-')
    Data: not present ('>')
    URB sec: 1530473884
    URB usec: 20892
    URB status: Success (0)
    URB length [bytes]: 6
    Data length [bytes]: 0
    [Request in: 117]
    [Time from request: 0.070244000 seconds]
    [bInterfaceClass: Printer (0x07)]
    Unused Setup Header
    Interval: 0
    Start frame: 0
    Copy of Transfer Flags: 0x00000000
    Number of ISO descriptors: 0

0000  00 e3 d2 e8 fb 89 ff ff 43 03 01 03 03 00 2d 3e   ........C.....->
0010  9c 2d 39 5b 00 00 00 00 9c 51 00 00 00 00 00 00   .-9[.....Q......
0020  06 00 00 00 00 00 00 00 00 00 00 00 00 00 00 00   ................
0030  00 00 00 00 00 00 00 00 00 00 00 00 00 00 00 00   ................

Frame 119: 64 bytes on wire (512 bits), 64 bytes captured (512 bits) on interface 0
    Interface id: 0 (unknown)
        Interface name: unknown
    Encapsulation type: USB packets with Linux header and padding (115)
    Arrival Time: Jul  1, 2018 15:38:04.021477000 EDT
    [Time shift for this packet: 0.000000000 seconds]
    Epoch Time: 1530473884.021477000 seconds
    [Time delta from previous captured frame: 0.000585000 seconds]
    [Time delta from previous displayed frame: 0.000585000 seconds]
    [Time since reference or first frame: 259.159544000 seconds]
    Frame Number: 119
    Frame Length: 64 bytes (512 bits)
    Capture Length: 64 bytes (512 bits)
    [Frame is marked: False]
    [Frame is ignored: False]
    [Protocols in frame: usb]
USB URB
    [Source: host]
    [Destination: 3.3.2]
    URB id: 0xffff89fbe8d2e300
    URB type: URB_SUBMIT ('S')
    URB transfer type: URB_BULK (0x03)
    Endpoint: 0x82, Direction: IN
        1... .... = Direction: IN (1)
        .... 0010 = Endpoint number: 2
    Device: 3
    URB bus id: 3
    Device setup request: not relevant ('-')
    Data: not present ('<')
    URB sec: 1530473884
    URB usec: 21477
    URB status: Operation now in progress (-EINPROGRESS) (-115)
    URB length [bytes]: 64
    Data length [bytes]: 0
    [Response in: 120]
    [bInterfaceClass: Printer (0x07)]
    Unused Setup Header
    Interval: 0
    Start frame: 0
    Copy of Transfer Flags: 0x00000200
    Number of ISO descriptors: 0

0000  00 e3 d2 e8 fb 89 ff ff 53 03 82 03 03 00 2d 3c   ........S.....-<
0010  9c 2d 39 5b 00 00 00 00 e5 53 00 00 8d ff ff ff   .-9[.....S......
0020  40 00 00 00 00 00 00 00 00 00 00 00 00 00 00 00   @...............
0030  00 00 00 00 00 00 00 00 00 02 00 00 00 00 00 00   ................

Frame 120: 64 bytes on wire (512 bits), 64 bytes captured (512 bits) on interface 0
    Interface id: 0 (unknown)
        Interface name: unknown
    Encapsulation type: USB packets with Linux header and padding (115)
    Arrival Time: Jul  1, 2018 15:38:04.032109000 EDT
    [Time shift for this packet: 0.000000000 seconds]
    Epoch Time: 1530473884.032109000 seconds
    [Time delta from previous captured frame: 0.010632000 seconds]
    [Time delta from previous displayed frame: 0.010632000 seconds]
    [Time since reference or first frame: 259.170176000 seconds]
    Frame Number: 120
    Frame Length: 64 bytes (512 bits)
    Capture Length: 64 bytes (512 bits)
    [Frame is marked: False]
    [Frame is ignored: False]
    [Protocols in frame: usb]
USB URB
    [Source: 3.3.2]
    [Destination: host]
    URB id: 0xffff89fbe8d2e300
    URB type: URB_COMPLETE ('C')
    URB transfer type: URB_BULK (0x03)
    Endpoint: 0x82, Direction: IN
        1... .... = Direction: IN (1)
        .... 0010 = Endpoint number: 2
    Device: 3
    URB bus id: 3
    Device setup request: not relevant ('-')
    Data: present (0)
    URB sec: 1530473884
    URB usec: 32109
    URB status: No such file or directory (-ENOENT) (-2)
    URB length [bytes]: 0
    Data length [bytes]: 0
    [Request in: 119]
    [Time from request: 0.010632000 seconds]
    [bInterfaceClass: Printer (0x07)]
    Unused Setup Header
    Interval: 0
    Start frame: 0
    Copy of Transfer Flags: 0x00000200
    Number of ISO descriptors: 0

0000  00 e3 d2 e8 fb 89 ff ff 43 03 82 03 03 00 2d 00   ........C.....-.
0010  9c 2d 39 5b 00 00 00 00 6d 7d 00 00 fe ff ff ff   .-9[....m}......
0020  00 00 00 00 00 00 00 00 00 00 00 00 00 00 00 00   ................
0030  00 00 00 00 00 00 00 00 00 02 00 00 00 00 00 00   ................

Frame 121: 97 bytes on wire (776 bits), 97 bytes captured (776 bits) on interface 0
    Interface id: 0 (unknown)
        Interface name: unknown
    Encapsulation type: USB packets with Linux header and padding (115)
    Arrival Time: Jul  1, 2018 15:38:04.032711000 EDT
    [Time shift for this packet: 0.000000000 seconds]
    Epoch Time: 1530473884.032711000 seconds
    [Time delta from previous captured frame: 0.000602000 seconds]
    [Time delta from previous displayed frame: 0.000602000 seconds]
    [Time since reference or first frame: 259.170778000 seconds]
    Frame Number: 121
    Frame Length: 97 bytes (776 bits)
    Capture Length: 97 bytes (776 bits)
    [Frame is marked: False]
    [Frame is ignored: False]
    [Protocols in frame: usb]
USB URB
    [Source: host]
    [Destination: 3.3.1]
    URB id: 0xffff89fbe8d2e300
    URB type: URB_SUBMIT ('S')
    URB transfer type: URB_BULK (0x03)
    Endpoint: 0x01, Direction: OUT
        0... .... = Direction: OUT (0)
        .... 0001 = Endpoint number: 1
    Device: 3
    URB bus id: 3
    Device setup request: not relevant ('-')
    Data: present (0)
    URB sec: 1530473884
    URB usec: 32711
    URB status: Operation now in progress (-EINPROGRESS) (-115)
    URB length [bytes]: 33
    Data length [bytes]: 33
    [Response in: 122]
    [bInterfaceClass: Printer (0x07)]
    Unused Setup Header
    Interval: 0
    Start frame: 0
    Copy of Transfer Flags: 0x00000000
    Number of ISO descriptors: 0
Leftover Capture Data: 5c302c30035a353538382c36303830034c30034645302c30...

0000  00 e3 d2 e8 fb 89 ff ff 53 03 01 03 03 00 2d 00   ........S.....-.
0010  9c 2d 39 5b 00 00 00 00 c7 7f 00 00 8d ff ff ff   .-9[............
0020  21 00 00 00 21 00 00 00 00 00 00 00 00 00 00 00   !...!...........
0030  00 00 00 00 00 00 00 00 00 00 00 00 00 00 00 00   ................
0040  5c 30 2c 30 03 5a 35 35 38 38 2c 36 30 38 30 03   \0,0.Z5588,6080.
0050  4c 30 03 46 45 30 2c 30 03 46 46 30 2c 30 2c 30   L0.FE0,0.FF0,0,0
0060  03                                                .

Frame 122: 64 bytes on wire (512 bits), 64 bytes captured (512 bits) on interface 0
    Interface id: 0 (unknown)
        Interface name: unknown
    Encapsulation type: USB packets with Linux header and padding (115)
    Arrival Time: Jul  1, 2018 15:38:04.103120000 EDT
    [Time shift for this packet: 0.000000000 seconds]
    Epoch Time: 1530473884.103120000 seconds
    [Time delta from previous captured frame: 0.070409000 seconds]
    [Time delta from previous displayed frame: 0.070409000 seconds]
    [Time since reference or first frame: 259.241187000 seconds]
    Frame Number: 122
    Frame Length: 64 bytes (512 bits)
    Capture Length: 64 bytes (512 bits)
    [Frame is marked: False]
    [Frame is ignored: False]
    [Protocols in frame: usb]
USB URB
    [Source: 3.3.1]
    [Destination: host]
    URB id: 0xffff89fbe8d2e300
    URB type: URB_COMPLETE ('C')
    URB transfer type: URB_BULK (0x03)
    Endpoint: 0x01, Direction: OUT
        0... .... = Direction: OUT (0)
        .... 0001 = Endpoint number: 1
    Device: 3
    URB bus id: 3
    Device setup request: not relevant ('-')
    Data: not present ('>')
    URB sec: 1530473884
    URB usec: 103120
    URB status: Success (0)
    URB length [bytes]: 33
    Data length [bytes]: 0
    [Request in: 121]
    [Time from request: 0.070409000 seconds]
    [bInterfaceClass: Printer (0x07)]
    Unused Setup Header
    Interval: 0
    Start frame: 0
    Copy of Transfer Flags: 0x00000000
    Number of ISO descriptors: 0

0000  00 e3 d2 e8 fb 89 ff ff 43 03 01 03 03 00 2d 3e   ........C.....->
0010  9c 2d 39 5b 00 00 00 00 d0 92 01 00 00 00 00 00   .-9[............
0020  21 00 00 00 00 00 00 00 00 00 00 00 00 00 00 00   !...............
0030  00 00 00 00 00 00 00 00 00 00 00 00 00 00 00 00   ................

Frame 123: 64 bytes on wire (512 bits), 64 bytes captured (512 bits) on interface 0
    Interface id: 0 (unknown)
        Interface name: unknown
    Encapsulation type: USB packets with Linux header and padding (115)
    Arrival Time: Jul  1, 2018 15:38:04.103756000 EDT
    [Time shift for this packet: 0.000000000 seconds]
    Epoch Time: 1530473884.103756000 seconds
    [Time delta from previous captured frame: 0.000636000 seconds]
    [Time delta from previous displayed frame: 0.000636000 seconds]
    [Time since reference or first frame: 259.241823000 seconds]
    Frame Number: 123
    Frame Length: 64 bytes (512 bits)
    Capture Length: 64 bytes (512 bits)
    [Frame is marked: False]
    [Frame is ignored: False]
    [Protocols in frame: usb]
USB URB
    [Source: host]
    [Destination: 3.3.2]
    URB id: 0xffff89fbe8d2e300
    URB type: URB_SUBMIT ('S')
    URB transfer type: URB_BULK (0x03)
    Endpoint: 0x82, Direction: IN
        1... .... = Direction: IN (1)
        .... 0010 = Endpoint number: 2
    Device: 3
    URB bus id: 3
    Device setup request: not relevant ('-')
    Data: not present ('<')
    URB sec: 1530473884
    URB usec: 103756
    URB status: Operation now in progress (-EINPROGRESS) (-115)
    URB length [bytes]: 64
    Data length [bytes]: 0
    [Response in: 124]
    [bInterfaceClass: Printer (0x07)]
    Unused Setup Header
    Interval: 0
    Start frame: 0
    Copy of Transfer Flags: 0x00000200
    Number of ISO descriptors: 0

0000  00 e3 d2 e8 fb 89 ff ff 53 03 82 03 03 00 2d 3c   ........S.....-<
0010  9c 2d 39 5b 00 00 00 00 4c 95 01 00 8d ff ff ff   .-9[....L.......
0020  40 00 00 00 00 00 00 00 00 00 00 00 00 00 00 00   @...............
0030  00 00 00 00 00 00 00 00 00 02 00 00 00 00 00 00   ................

Frame 124: 64 bytes on wire (512 bits), 64 bytes captured (512 bits) on interface 0
    Interface id: 0 (unknown)
        Interface name: unknown
    Encapsulation type: USB packets with Linux header and padding (115)
    Arrival Time: Jul  1, 2018 15:38:04.114068000 EDT
    [Time shift for this packet: 0.000000000 seconds]
    Epoch Time: 1530473884.114068000 seconds
    [Time delta from previous captured frame: 0.010312000 seconds]
    [Time delta from previous displayed frame: 0.010312000 seconds]
    [Time since reference or first frame: 259.252135000 seconds]
    Frame Number: 124
    Frame Length: 64 bytes (512 bits)
    Capture Length: 64 bytes (512 bits)
    [Frame is marked: False]
    [Frame is ignored: False]
    [Protocols in frame: usb]
USB URB
    [Source: 3.3.2]
    [Destination: host]
    URB id: 0xffff89fbe8d2e300
    URB type: URB_COMPLETE ('C')
    URB transfer type: URB_BULK (0x03)
    Endpoint: 0x82, Direction: IN
        1... .... = Direction: IN (1)
        .... 0010 = Endpoint number: 2
    Device: 3
    URB bus id: 3
    Device setup request: not relevant ('-')
    Data: present (0)
    URB sec: 1530473884
    URB usec: 114068
    URB status: No such file or directory (-ENOENT) (-2)
    URB length [bytes]: 0
    Data length [bytes]: 0
    [Request in: 123]
    [Time from request: 0.010312000 seconds]
    [bInterfaceClass: Printer (0x07)]
    Unused Setup Header
    Interval: 0
    Start frame: 0
    Copy of Transfer Flags: 0x00000200
    Number of ISO descriptors: 0

0000  00 e3 d2 e8 fb 89 ff ff 43 03 82 03 03 00 2d 00   ........C.....-.
0010  9c 2d 39 5b 00 00 00 00 94 bd 01 00 fe ff ff ff   .-9[............
0020  00 00 00 00 00 00 00 00 00 00 00 00 00 00 00 00   ................
0030  00 00 00 00 00 00 00 00 00 02 00 00 00 00 00 00   ................

Frame 125: 122 bytes on wire (976 bits), 122 bytes captured (976 bits) on interface 0
    Interface id: 0 (unknown)
        Interface name: unknown
    Encapsulation type: USB packets with Linux header and padding (115)
    Arrival Time: Jul  1, 2018 15:38:04.114655000 EDT
    [Time shift for this packet: 0.000000000 seconds]
    Epoch Time: 1530473884.114655000 seconds
    [Time delta from previous captured frame: 0.000587000 seconds]
    [Time delta from previous displayed frame: 0.000587000 seconds]
    [Time since reference or first frame: 259.252722000 seconds]
    Frame Number: 125
    Frame Length: 122 bytes (976 bits)
    Capture Length: 122 bytes (976 bits)
    [Frame is marked: False]
    [Frame is ignored: False]
    [Protocols in frame: usb]
USB URB
    [Source: host]
    [Destination: 3.3.1]
    URB id: 0xffff89fbe8d2e300
    URB type: URB_SUBMIT ('S')
    URB transfer type: URB_BULK (0x03)
    Endpoint: 0x01, Direction: OUT
        0... .... = Direction: OUT (0)
        .... 0001 = Endpoint number: 1
    Device: 3
    URB bus id: 3
    Device setup request: not relevant ('-')
    Data: present (0)
    URB sec: 1530473884
    URB usec: 114655
    URB status: Operation now in progress (-EINPROGRESS) (-115)
    URB length [bytes]: 58
    Data length [bytes]: 58
    [Response in: 126]
    [bInterfaceClass: Printer (0x07)]
    Unused Setup Header
    Interval: 0
    Start frame: 0
    Copy of Transfer Flags: 0x00000000
    Number of ISO descriptors: 0
Leftover Capture Data: 4d3831382c36303803443831382c31313136034431333236...

0000  00 e3 d2 e8 fb 89 ff ff 53 03 01 03 03 00 2d 00   ........S.....-.
0010  9c 2d 39 5b 00 00 00 00 df bf 01 00 8d ff ff ff   .-9[............
0020  3a 00 00 00 3a 00 00 00 00 00 00 00 00 00 00 00   :...:...........
0030  00 00 00 00 00 00 00 00 00 00 00 00 00 00 00 00   ................
0040  4d 38 31 38 2c 36 30 38 03 44 38 31 38 2c 31 31   M818,608.D818,11
0050  31 36 03 44 31 33 32 36 2c 31 31 31 36 03 44 31   16.D1326,1116.D1
0060  33 32 36 2c 36 30 38 03 44 38 31 38 2c 36 30 38   326,608.D818,608
0070  03 44 38 31 38 2c 36 31 38 03                     .D818,618.

Frame 126: 64 bytes on wire (512 bits), 64 bytes captured (512 bits) on interface 0
    Interface id: 0 (unknown)
        Interface name: unknown
    Encapsulation type: USB packets with Linux header and padding (115)
    Arrival Time: Jul  1, 2018 15:38:04.185274000 EDT
    [Time shift for this packet: 0.000000000 seconds]
    Epoch Time: 1530473884.185274000 seconds
    [Time delta from previous captured frame: 0.070619000 seconds]
    [Time delta from previous displayed frame: 0.070619000 seconds]
    [Time since reference or first frame: 259.323341000 seconds]
    Frame Number: 126
    Frame Length: 64 bytes (512 bits)
    Capture Length: 64 bytes (512 bits)
    [Frame is marked: False]
    [Frame is ignored: False]
    [Protocols in frame: usb]
USB URB
    [Source: 3.3.1]
    [Destination: host]
    URB id: 0xffff89fbe8d2e300
    URB type: URB_COMPLETE ('C')
    URB transfer type: URB_BULK (0x03)
    Endpoint: 0x01, Direction: OUT
        0... .... = Direction: OUT (0)
        .... 0001 = Endpoint number: 1
    Device: 3
    URB bus id: 3
    Device setup request: not relevant ('-')
    Data: not present ('>')
    URB sec: 1530473884
    URB usec: 185274
    URB status: Success (0)
    URB length [bytes]: 58
    Data length [bytes]: 0
    [Request in: 125]
    [Time from request: 0.070619000 seconds]
    [bInterfaceClass: Printer (0x07)]
    Unused Setup Header
    Interval: 0
    Start frame: 0
    Copy of Transfer Flags: 0x00000000
    Number of ISO descriptors: 0

0000  00 e3 d2 e8 fb 89 ff ff 43 03 01 03 03 00 2d 3e   ........C.....->
0010  9c 2d 39 5b 00 00 00 00 ba d3 02 00 00 00 00 00   .-9[............
0020  3a 00 00 00 00 00 00 00 00 00 00 00 00 00 00 00   :...............
0030  00 00 00 00 00 00 00 00 00 00 00 00 00 00 00 00   ................

Frame 127: 64 bytes on wire (512 bits), 64 bytes captured (512 bits) on interface 0
    Interface id: 0 (unknown)
        Interface name: unknown
    Encapsulation type: USB packets with Linux header and padding (115)
    Arrival Time: Jul  1, 2018 15:38:04.185733000 EDT
    [Time shift for this packet: 0.000000000 seconds]
    Epoch Time: 1530473884.185733000 seconds
    [Time delta from previous captured frame: 0.000459000 seconds]
    [Time delta from previous displayed frame: 0.000459000 seconds]
    [Time since reference or first frame: 259.323800000 seconds]
    Frame Number: 127
    Frame Length: 64 bytes (512 bits)
    Capture Length: 64 bytes (512 bits)
    [Frame is marked: False]
    [Frame is ignored: False]
    [Protocols in frame: usb]
USB URB
    [Source: host]
    [Destination: 3.3.2]
    URB id: 0xffff89fbe8d2e300
    URB type: URB_SUBMIT ('S')
    URB transfer type: URB_BULK (0x03)
    Endpoint: 0x82, Direction: IN
        1... .... = Direction: IN (1)
        .... 0010 = Endpoint number: 2
    Device: 3
    URB bus id: 3
    Device setup request: not relevant ('-')
    Data: not present ('<')
    URB sec: 1530473884
    URB usec: 185733
    URB status: Operation now in progress (-EINPROGRESS) (-115)
    URB length [bytes]: 64
    Data length [bytes]: 0
    [Response in: 128]
    [bInterfaceClass: Printer (0x07)]
    Unused Setup Header
    Interval: 0
    Start frame: 0
    Copy of Transfer Flags: 0x00000200
    Number of ISO descriptors: 0

0000  00 e3 d2 e8 fb 89 ff ff 53 03 82 03 03 00 2d 3c   ........S.....-<
0010  9c 2d 39 5b 00 00 00 00 85 d5 02 00 8d ff ff ff   .-9[............
0020  40 00 00 00 00 00 00 00 00 00 00 00 00 00 00 00   @...............
0030  00 00 00 00 00 00 00 00 00 02 00 00 00 00 00 00   ................

Frame 128: 64 bytes on wire (512 bits), 64 bytes captured (512 bits) on interface 0
    Interface id: 0 (unknown)
        Interface name: unknown
    Encapsulation type: USB packets with Linux header and padding (115)
    Arrival Time: Jul  1, 2018 15:38:04.196068000 EDT
    [Time shift for this packet: 0.000000000 seconds]
    Epoch Time: 1530473884.196068000 seconds
    [Time delta from previous captured frame: 0.010335000 seconds]
    [Time delta from previous displayed frame: 0.010335000 seconds]
    [Time since reference or first frame: 259.334135000 seconds]
    Frame Number: 128
    Frame Length: 64 bytes (512 bits)
    Capture Length: 64 bytes (512 bits)
    [Frame is marked: False]
    [Frame is ignored: False]
    [Protocols in frame: usb]
USB URB
    [Source: 3.3.2]
    [Destination: host]
    URB id: 0xffff89fbe8d2e300
    URB type: URB_COMPLETE ('C')
    URB transfer type: URB_BULK (0x03)
    Endpoint: 0x82, Direction: IN
        1... .... = Direction: IN (1)
        .... 0010 = Endpoint number: 2
    Device: 3
    URB bus id: 3
    Device setup request: not relevant ('-')
    Data: present (0)
    URB sec: 1530473884
    URB usec: 196068
    URB status: No such file or directory (-ENOENT) (-2)
    URB length [bytes]: 0
    Data length [bytes]: 0
    [Request in: 127]
    [Time from request: 0.010335000 seconds]
    [bInterfaceClass: Printer (0x07)]
    Unused Setup Header
    Interval: 0
    Start frame: 0
    Copy of Transfer Flags: 0x00000200
    Number of ISO descriptors: 0

0000  00 e3 d2 e8 fb 89 ff ff 43 03 82 03 03 00 2d 00   ........C.....-.
0010  9c 2d 39 5b 00 00 00 00 e4 fd 02 00 fe ff ff ff   .-9[............
0020  00 00 00 00 00 00 00 00 00 00 00 00 00 00 00 00   ................
0030  00 00 00 00 00 00 00 00 00 02 00 00 00 00 00 00   ................

Frame 129: 66 bytes on wire (528 bits), 66 bytes captured (528 bits) on interface 0
    Interface id: 0 (unknown)
        Interface name: unknown
    Encapsulation type: USB packets with Linux header and padding (115)
    Arrival Time: Jul  1, 2018 15:38:04.196586000 EDT
    [Time shift for this packet: 0.000000000 seconds]
    Epoch Time: 1530473884.196586000 seconds
    [Time delta from previous captured frame: 0.000518000 seconds]
    [Time delta from previous displayed frame: 0.000518000 seconds]
    [Time since reference or first frame: 259.334653000 seconds]
    Frame Number: 129
    Frame Length: 66 bytes (528 bits)
    Capture Length: 66 bytes (528 bits)
    [Frame is marked: False]
    [Frame is ignored: False]
    [Protocols in frame: usb]
USB URB
    [Source: host]
    [Destination: 3.3.1]
    URB id: 0xffff89fbe8d2e300
    URB type: URB_SUBMIT ('S')
    URB transfer type: URB_BULK (0x03)
    Endpoint: 0x01, Direction: OUT
        0... .... = Direction: OUT (0)
        .... 0001 = Endpoint number: 1
    Device: 3
    URB bus id: 3
    Device setup request: not relevant ('-')
    Data: present (0)
    URB sec: 1530473884
    URB usec: 196586
    URB status: Operation now in progress (-EINPROGRESS) (-115)
    URB length [bytes]: 2
    Data length [bytes]: 2
    [Response in: 130]
    [bInterfaceClass: Printer (0x07)]
    Unused Setup Header
    Interval: 0
    Start frame: 0
    Copy of Transfer Flags: 0x00000000
    Number of ISO descriptors: 0
Leftover Capture Data: 1b05

0000  00 e3 d2 e8 fb 89 ff ff 53 03 01 03 03 00 2d 00   ........S.....-.
0010  9c 2d 39 5b 00 00 00 00 ea ff 02 00 8d ff ff ff   .-9[............
0020  02 00 00 00 02 00 00 00 00 00 00 00 00 00 00 00   ................
0030  00 00 00 00 00 00 00 00 00 00 00 00 00 00 00 00   ................
0040  1b 05                                             ..

Frame 130: 64 bytes on wire (512 bits), 64 bytes captured (512 bits) on interface 0
    Interface id: 0 (unknown)
        Interface name: unknown
    Encapsulation type: USB packets with Linux header and padding (115)
    Arrival Time: Jul  1, 2018 15:38:04.267335000 EDT
    [Time shift for this packet: 0.000000000 seconds]
    Epoch Time: 1530473884.267335000 seconds
    [Time delta from previous captured frame: 0.070749000 seconds]
    [Time delta from previous displayed frame: 0.070749000 seconds]
    [Time since reference or first frame: 259.405402000 seconds]
    Frame Number: 130
    Frame Length: 64 bytes (512 bits)
    Capture Length: 64 bytes (512 bits)
    [Frame is marked: False]
    [Frame is ignored: False]
    [Protocols in frame: usb]
USB URB
    [Source: 3.3.1]
    [Destination: host]
    URB id: 0xffff89fbe8d2e300
    URB type: URB_COMPLETE ('C')
    URB transfer type: URB_BULK (0x03)
    Endpoint: 0x01, Direction: OUT
        0... .... = Direction: OUT (0)
        .... 0001 = Endpoint number: 1
    Device: 3
    URB bus id: 3
    Device setup request: not relevant ('-')
    Data: not present ('>')
    URB sec: 1530473884
    URB usec: 267335
    URB status: Success (0)
    URB length [bytes]: 2
    Data length [bytes]: 0
    [Request in: 129]
    [Time from request: 0.070749000 seconds]
    [bInterfaceClass: Printer (0x07)]
    Unused Setup Header
    Interval: 0
    Start frame: 0
    Copy of Transfer Flags: 0x00000000
    Number of ISO descriptors: 0

0000  00 e3 d2 e8 fb 89 ff ff 43 03 01 03 03 00 2d 3e   ........C.....->
0010  9c 2d 39 5b 00 00 00 00 47 14 04 00 00 00 00 00   .-9[....G.......
0020  02 00 00 00 00 00 00 00 00 00 00 00 00 00 00 00   ................
0030  00 00 00 00 00 00 00 00 00 00 00 00 00 00 00 00   ................

Frame 131: 64 bytes on wire (512 bits), 64 bytes captured (512 bits) on interface 0
    Interface id: 0 (unknown)
        Interface name: unknown
    Encapsulation type: USB packets with Linux header and padding (115)
    Arrival Time: Jul  1, 2018 15:38:04.267791000 EDT
    [Time shift for this packet: 0.000000000 seconds]
    Epoch Time: 1530473884.267791000 seconds
    [Time delta from previous captured frame: 0.000456000 seconds]
    [Time delta from previous displayed frame: 0.000456000 seconds]
    [Time since reference or first frame: 259.405858000 seconds]
    Frame Number: 131
    Frame Length: 64 bytes (512 bits)
    Capture Length: 64 bytes (512 bits)
    [Frame is marked: False]
    [Frame is ignored: False]
    [Protocols in frame: usb]
USB URB
    [Source: host]
    [Destination: 3.3.2]
    URB id: 0xffff89fbe8d2e300
    URB type: URB_SUBMIT ('S')
    URB transfer type: URB_BULK (0x03)
    Endpoint: 0x82, Direction: IN
        1... .... = Direction: IN (1)
        .... 0010 = Endpoint number: 2
    Device: 3
    URB bus id: 3
    Device setup request: not relevant ('-')
    Data: not present ('<')
    URB sec: 1530473884
    URB usec: 267791
    URB status: Operation now in progress (-EINPROGRESS) (-115)
    URB length [bytes]: 64
    Data length [bytes]: 0
    [Response in: 132]
    [bInterfaceClass: Printer (0x07)]
    Unused Setup Header
    Interval: 0
    Start frame: 0
    Copy of Transfer Flags: 0x00000200
    Number of ISO descriptors: 0

0000  00 e3 d2 e8 fb 89 ff ff 53 03 82 03 03 00 2d 3c   ........S.....-<
0010  9c 2d 39 5b 00 00 00 00 0f 16 04 00 8d ff ff ff   .-9[............
0020  40 00 00 00 00 00 00 00 00 00 00 00 00 00 00 00   @...............
0030  00 00 00 00 00 00 00 00 00 02 00 00 00 00 00 00   ................

Frame 132: 66 bytes on wire (528 bits), 66 bytes captured (528 bits) on interface 0
    Interface id: 0 (unknown)
        Interface name: unknown
    Encapsulation type: USB packets with Linux header and padding (115)
    Arrival Time: Jul  1, 2018 15:38:04.430936000 EDT
    [Time shift for this packet: 0.000000000 seconds]
    Epoch Time: 1530473884.430936000 seconds
    [Time delta from previous captured frame: 0.163145000 seconds]
    [Time delta from previous displayed frame: 0.163145000 seconds]
    [Time since reference or first frame: 259.569003000 seconds]
    Frame Number: 132
    Frame Length: 66 bytes (528 bits)
    Capture Length: 66 bytes (528 bits)
    [Frame is marked: False]
    [Frame is ignored: False]
    [Protocols in frame: usb]
USB URB
    [Source: 3.3.2]
    [Destination: host]
    URB id: 0xffff89fbe8d2e300
    URB type: URB_COMPLETE ('C')
    URB transfer type: URB_BULK (0x03)
    Endpoint: 0x82, Direction: IN
        1... .... = Direction: IN (1)
        .... 0010 = Endpoint number: 2
    Device: 3
    URB bus id: 3
    Device setup request: not relevant ('-')
    Data: present (0)
    URB sec: 1530473884
    URB usec: 430936
    URB status: Success (0)
    URB length [bytes]: 2
    Data length [bytes]: 2
    [Request in: 131]
    [Time from request: 0.163145000 seconds]
    [bInterfaceClass: Printer (0x07)]
    Unused Setup Header
    Interval: 0
    Start frame: 0
    Copy of Transfer Flags: 0x00000200
    Number of ISO descriptors: 0
Leftover Capture Data: 3103

0000  00 e3 d2 e8 fb 89 ff ff 43 03 82 03 03 00 2d 00   ........C.....-.
0010  9c 2d 39 5b 00 00 00 00 58 93 06 00 00 00 00 00   .-9[....X.......
0020  02 00 00 00 02 00 00 00 00 00 00 00 00 00 00 00   ................
0030  00 00 00 00 00 00 00 00 00 02 00 00 00 00 00 00   ................
0040  31 03                                             1.

Frame 133: 64 bytes on wire (512 bits), 64 bytes captured (512 bits) on interface 0
    Interface id: 0 (unknown)
        Interface name: unknown
    Encapsulation type: USB packets with Linux header and padding (115)
    Arrival Time: Jul  1, 2018 15:38:04.481649000 EDT
    [Time shift for this packet: 0.000000000 seconds]
    Epoch Time: 1530473884.481649000 seconds
    [Time delta from previous captured frame: 0.050713000 seconds]
    [Time delta from previous displayed frame: 0.050713000 seconds]
    [Time since reference or first frame: 259.619716000 seconds]
    Frame Number: 133
    Frame Length: 64 bytes (512 bits)
    Capture Length: 64 bytes (512 bits)
    [Frame is marked: False]
    [Frame is ignored: False]
    [Protocols in frame: usb]
USB URB
    [Source: host]
    [Destination: 3.3.2]
    URB id: 0xffff89fbe8d2e300
    URB type: URB_SUBMIT ('S')
    URB transfer type: URB_BULK (0x03)
    Endpoint: 0x82, Direction: IN
        1... .... = Direction: IN (1)
        .... 0010 = Endpoint number: 2
    Device: 3
    URB bus id: 3
    Device setup request: not relevant ('-')
    Data: not present ('<')
    URB sec: 1530473884
    URB usec: 481649
    URB status: Operation now in progress (-EINPROGRESS) (-115)
    URB length [bytes]: 64
    Data length [bytes]: 0
    [Response in: 134]
    [bInterfaceClass: Printer (0x07)]
    Unused Setup Header
    Interval: 0
    Start frame: 0
    Copy of Transfer Flags: 0x00000200
    Number of ISO descriptors: 0

0000  00 e3 d2 e8 fb 89 ff ff 53 03 82 03 03 00 2d 3c   ........S.....-<
0010  9c 2d 39 5b 00 00 00 00 71 59 07 00 8d ff ff ff   .-9[....qY......
0020  40 00 00 00 00 00 00 00 00 00 00 00 00 00 00 00   @...............
0030  00 00 00 00 00 00 00 00 00 02 00 00 00 00 00 00   ................

Frame 134: 64 bytes on wire (512 bits), 64 bytes captured (512 bits) on interface 0
    Interface id: 0 (unknown)
        Interface name: unknown
    Encapsulation type: USB packets with Linux header and padding (115)
    Arrival Time: Jul  1, 2018 15:38:04.492111000 EDT
    [Time shift for this packet: 0.000000000 seconds]
    Epoch Time: 1530473884.492111000 seconds
    [Time delta from previous captured frame: 0.010462000 seconds]
    [Time delta from previous displayed frame: 0.010462000 seconds]
    [Time since reference or first frame: 259.630178000 seconds]
    Frame Number: 134
    Frame Length: 64 bytes (512 bits)
    Capture Length: 64 bytes (512 bits)
    [Frame is marked: False]
    [Frame is ignored: False]
    [Protocols in frame: usb]
USB URB
    [Source: 3.3.2]
    [Destination: host]
    URB id: 0xffff89fbe8d2e300
    URB type: URB_COMPLETE ('C')
    URB transfer type: URB_BULK (0x03)
    Endpoint: 0x82, Direction: IN
        1... .... = Direction: IN (1)
        .... 0010 = Endpoint number: 2
    Device: 3
    URB bus id: 3
    Device setup request: not relevant ('-')
    Data: present (0)
    URB sec: 1530473884
    URB usec: 492111
    URB status: No such file or directory (-ENOENT) (-2)
    URB length [bytes]: 0
    Data length [bytes]: 0
    [Request in: 133]
    [Time from request: 0.010462000 seconds]
    [bInterfaceClass: Printer (0x07)]
    Unused Setup Header
    Interval: 0
    Start frame: 0
    Copy of Transfer Flags: 0x00000200
    Number of ISO descriptors: 0

0000  00 e3 d2 e8 fb 89 ff ff 43 03 82 03 03 00 2d 00   ........C.....-.
0010  9c 2d 39 5b 00 00 00 00 4f 82 07 00 fe ff ff ff   .-9[....O.......
0020  00 00 00 00 00 00 00 00 00 00 00 00 00 00 00 00   ................
0030  00 00 00 00 00 00 00 00 00 02 00 00 00 00 00 00   ................

Frame 135: 66 bytes on wire (528 bits), 66 bytes captured (528 bits) on interface 0
    Interface id: 0 (unknown)
        Interface name: unknown
    Encapsulation type: USB packets with Linux header and padding (115)
    Arrival Time: Jul  1, 2018 15:38:04.492649000 EDT
    [Time shift for this packet: 0.000000000 seconds]
    Epoch Time: 1530473884.492649000 seconds
    [Time delta from previous captured frame: 0.000538000 seconds]
    [Time delta from previous displayed frame: 0.000538000 seconds]
    [Time since reference or first frame: 259.630716000 seconds]
    Frame Number: 135
    Frame Length: 66 bytes (528 bits)
    Capture Length: 66 bytes (528 bits)
    [Frame is marked: False]
    [Frame is ignored: False]
    [Protocols in frame: usb]
USB URB
    [Source: host]
    [Destination: 3.3.1]
    URB id: 0xffff89fbe8d2e300
    URB type: URB_SUBMIT ('S')
    URB transfer type: URB_BULK (0x03)
    Endpoint: 0x01, Direction: OUT
        0... .... = Direction: OUT (0)
        .... 0001 = Endpoint number: 1
    Device: 3
    URB bus id: 3
    Device setup request: not relevant ('-')
    Data: present (0)
    URB sec: 1530473884
    URB usec: 492649
    URB status: Operation now in progress (-EINPROGRESS) (-115)
    URB length [bytes]: 2
    Data length [bytes]: 2
    [Response in: 136]
    [bInterfaceClass: Printer (0x07)]
    Unused Setup Header
    Interval: 0
    Start frame: 0
    Copy of Transfer Flags: 0x00000000
    Number of ISO descriptors: 0
Leftover Capture Data: 1b05

0000  00 e3 d2 e8 fb 89 ff ff 53 03 01 03 03 00 2d 00   ........S.....-.
0010  9c 2d 39 5b 00 00 00 00 69 84 07 00 8d ff ff ff   .-9[....i.......
0020  02 00 00 00 02 00 00 00 00 00 00 00 00 00 00 00   ................
0030  00 00 00 00 00 00 00 00 00 00 00 00 00 00 00 00   ................
0040  1b 05                                             ..

Frame 136: 64 bytes on wire (512 bits), 64 bytes captured (512 bits) on interface 0
    Interface id: 0 (unknown)
        Interface name: unknown
    Encapsulation type: USB packets with Linux header and padding (115)
    Arrival Time: Jul  1, 2018 15:38:04.492698000 EDT
    [Time shift for this packet: 0.000000000 seconds]
    Epoch Time: 1530473884.492698000 seconds
    [Time delta from previous captured frame: 0.000049000 seconds]
    [Time delta from previous displayed frame: 0.000049000 seconds]
    [Time since reference or first frame: 259.630765000 seconds]
    Frame Number: 136
    Frame Length: 64 bytes (512 bits)
    Capture Length: 64 bytes (512 bits)
    [Frame is marked: False]
    [Frame is ignored: False]
    [Protocols in frame: usb]
USB URB
    [Source: 3.3.1]
    [Destination: host]
    URB id: 0xffff89fbe8d2e300
    URB type: URB_COMPLETE ('C')
    URB transfer type: URB_BULK (0x03)
    Endpoint: 0x01, Direction: OUT
        0... .... = Direction: OUT (0)
        .... 0001 = Endpoint number: 1
    Device: 3
    URB bus id: 3
    Device setup request: not relevant ('-')
    Data: not present ('>')
    URB sec: 1530473884
    URB usec: 492698
    URB status: Success (0)
    URB length [bytes]: 2
    Data length [bytes]: 0
    [Request in: 135]
    [Time from request: 0.000049000 seconds]
    [bInterfaceClass: Printer (0x07)]
    Unused Setup Header
    Interval: 0
    Start frame: 0
    Copy of Transfer Flags: 0x00000000
    Number of ISO descriptors: 0

0000  00 e3 d2 e8 fb 89 ff ff 43 03 01 03 03 00 2d 3e   ........C.....->
0010  9c 2d 39 5b 00 00 00 00 9a 84 07 00 00 00 00 00   .-9[............
0020  02 00 00 00 00 00 00 00 00 00 00 00 00 00 00 00   ................
0030  00 00 00 00 00 00 00 00 00 00 00 00 00 00 00 00   ................

Frame 137: 64 bytes on wire (512 bits), 64 bytes captured (512 bits) on interface 0
    Interface id: 0 (unknown)
        Interface name: unknown
    Encapsulation type: USB packets with Linux header and padding (115)
    Arrival Time: Jul  1, 2018 15:38:04.492890000 EDT
    [Time shift for this packet: 0.000000000 seconds]
    Epoch Time: 1530473884.492890000 seconds
    [Time delta from previous captured frame: 0.000192000 seconds]
    [Time delta from previous displayed frame: 0.000192000 seconds]
    [Time since reference or first frame: 259.630957000 seconds]
    Frame Number: 137
    Frame Length: 64 bytes (512 bits)
    Capture Length: 64 bytes (512 bits)
    [Frame is marked: False]
    [Frame is ignored: False]
    [Protocols in frame: usb]
USB URB
    [Source: host]
    [Destination: 3.3.2]
    URB id: 0xffff89fbe8d2e300
    URB type: URB_SUBMIT ('S')
    URB transfer type: URB_BULK (0x03)
    Endpoint: 0x82, Direction: IN
        1... .... = Direction: IN (1)
        .... 0010 = Endpoint number: 2
    Device: 3
    URB bus id: 3
    Device setup request: not relevant ('-')
    Data: not present ('<')
    URB sec: 1530473884
    URB usec: 492890
    URB status: Operation now in progress (-EINPROGRESS) (-115)
    URB length [bytes]: 64
    Data length [bytes]: 0
    [Response in: 138]
    [bInterfaceClass: Printer (0x07)]
    Unused Setup Header
    Interval: 0
    Start frame: 0
    Copy of Transfer Flags: 0x00000200
    Number of ISO descriptors: 0

0000  00 e3 d2 e8 fb 89 ff ff 53 03 82 03 03 00 2d 3c   ........S.....-<
0010  9c 2d 39 5b 00 00 00 00 5a 85 07 00 8d ff ff ff   .-9[....Z.......
0020  40 00 00 00 00 00 00 00 00 00 00 00 00 00 00 00   @...............
0030  00 00 00 00 00 00 00 00 00 02 00 00 00 00 00 00   ................

Frame 138: 66 bytes on wire (528 bits), 66 bytes captured (528 bits) on interface 0
    Interface id: 0 (unknown)
        Interface name: unknown
    Encapsulation type: USB packets with Linux header and padding (115)
    Arrival Time: Jul  1, 2018 15:38:04.594932000 EDT
    [Time shift for this packet: 0.000000000 seconds]
    Epoch Time: 1530473884.594932000 seconds
    [Time delta from previous captured frame: 0.102042000 seconds]
    [Time delta from previous displayed frame: 0.102042000 seconds]
    [Time since reference or first frame: 259.732999000 seconds]
    Frame Number: 138
    Frame Length: 66 bytes (528 bits)
    Capture Length: 66 bytes (528 bits)
    [Frame is marked: False]
    [Frame is ignored: False]
    [Protocols in frame: usb]
USB URB
    [Source: 3.3.2]
    [Destination: host]
    URB id: 0xffff89fbe8d2e300
    URB type: URB_COMPLETE ('C')
    URB transfer type: URB_BULK (0x03)
    Endpoint: 0x82, Direction: IN
        1... .... = Direction: IN (1)
        .... 0010 = Endpoint number: 2
    Device: 3
    URB bus id: 3
    Device setup request: not relevant ('-')
    Data: present (0)
    URB sec: 1530473884
    URB usec: 594932
    URB status: Success (0)
    URB length [bytes]: 2
    Data length [bytes]: 2
    [Request in: 137]
    [Time from request: 0.102042000 seconds]
    [bInterfaceClass: Printer (0x07)]
    Unused Setup Header
    Interval: 0
    Start frame: 0
    Copy of Transfer Flags: 0x00000200
    Number of ISO descriptors: 0
Leftover Capture Data: 3103

0000  00 e3 d2 e8 fb 89 ff ff 43 03 82 03 03 00 2d 00   ........C.....-.
0010  9c 2d 39 5b 00 00 00 00 f4 13 09 00 00 00 00 00   .-9[............
0020  02 00 00 00 02 00 00 00 00 00 00 00 00 00 00 00   ................
0030  00 00 00 00 00 00 00 00 00 02 00 00 00 00 00 00   ................
0040  31 03                                             1.

Frame 139: 64 bytes on wire (512 bits), 64 bytes captured (512 bits) on interface 0
    Interface id: 0 (unknown)
        Interface name: unknown
    Encapsulation type: USB packets with Linux header and padding (115)
    Arrival Time: Jul  1, 2018 15:38:04.645511000 EDT
    [Time shift for this packet: 0.000000000 seconds]
    Epoch Time: 1530473884.645511000 seconds
    [Time delta from previous captured frame: 0.050579000 seconds]
    [Time delta from previous displayed frame: 0.050579000 seconds]
    [Time since reference or first frame: 259.783578000 seconds]
    Frame Number: 139
    Frame Length: 64 bytes (512 bits)
    Capture Length: 64 bytes (512 bits)
    [Frame is marked: False]
    [Frame is ignored: False]
    [Protocols in frame: usb]
USB URB
    [Source: host]
    [Destination: 3.3.2]
    URB id: 0xffff89fbe8d2e300
    URB type: URB_SUBMIT ('S')
    URB transfer type: URB_BULK (0x03)
    Endpoint: 0x82, Direction: IN
        1... .... = Direction: IN (1)
        .... 0010 = Endpoint number: 2
    Device: 3
    URB bus id: 3
    Device setup request: not relevant ('-')
    Data: not present ('<')
    URB sec: 1530473884
    URB usec: 645511
    URB status: Operation now in progress (-EINPROGRESS) (-115)
    URB length [bytes]: 64
    Data length [bytes]: 0
    [Response in: 140]
    [bInterfaceClass: Printer (0x07)]
    Unused Setup Header
    Interval: 0
    Start frame: 0
    Copy of Transfer Flags: 0x00000200
    Number of ISO descriptors: 0

0000  00 e3 d2 e8 fb 89 ff ff 53 03 82 03 03 00 2d 3c   ........S.....-<
0010  9c 2d 39 5b 00 00 00 00 87 d9 09 00 8d ff ff ff   .-9[............
0020  40 00 00 00 00 00 00 00 00 00 00 00 00 00 00 00   @...............
0030  00 00 00 00 00 00 00 00 00 02 00 00 00 00 00 00   ................

Frame 140: 64 bytes on wire (512 bits), 64 bytes captured (512 bits) on interface 0
    Interface id: 0 (unknown)
        Interface name: unknown
    Encapsulation type: USB packets with Linux header and padding (115)
    Arrival Time: Jul  1, 2018 15:38:04.656108000 EDT
    [Time shift for this packet: 0.000000000 seconds]
    Epoch Time: 1530473884.656108000 seconds
    [Time delta from previous captured frame: 0.010597000 seconds]
    [Time delta from previous displayed frame: 0.010597000 seconds]
    [Time since reference or first frame: 259.794175000 seconds]
    Frame Number: 140
    Frame Length: 64 bytes (512 bits)
    Capture Length: 64 bytes (512 bits)
    [Frame is marked: False]
    [Frame is ignored: False]
    [Protocols in frame: usb]
USB URB
    [Source: 3.3.2]
    [Destination: host]
    URB id: 0xffff89fbe8d2e300
    URB type: URB_COMPLETE ('C')
    URB transfer type: URB_BULK (0x03)
    Endpoint: 0x82, Direction: IN
        1... .... = Direction: IN (1)
        .... 0010 = Endpoint number: 2
    Device: 3
    URB bus id: 3
    Device setup request: not relevant ('-')
    Data: present (0)
    URB sec: 1530473884
    URB usec: 656108
    URB status: No such file or directory (-ENOENT) (-2)
    URB length [bytes]: 0
    Data length [bytes]: 0
    [Request in: 139]
    [Time from request: 0.010597000 seconds]
    [bInterfaceClass: Printer (0x07)]
    Unused Setup Header
    Interval: 0
    Start frame: 0
    Copy of Transfer Flags: 0x00000200
    Number of ISO descriptors: 0

0000  00 e3 d2 e8 fb 89 ff ff 43 03 82 03 03 00 2d 00   ........C.....-.
0010  9c 2d 39 5b 00 00 00 00 ec 02 0a 00 fe ff ff ff   .-9[............
0020  00 00 00 00 00 00 00 00 00 00 00 00 00 00 00 00   ................
0030  00 00 00 00 00 00 00 00 00 02 00 00 00 00 00 00   ................

Frame 141: 66 bytes on wire (528 bits), 66 bytes captured (528 bits) on interface 0
    Interface id: 0 (unknown)
        Interface name: unknown
    Encapsulation type: USB packets with Linux header and padding (115)
    Arrival Time: Jul  1, 2018 15:38:04.656412000 EDT
    [Time shift for this packet: 0.000000000 seconds]
    Epoch Time: 1530473884.656412000 seconds
    [Time delta from previous captured frame: 0.000304000 seconds]
    [Time delta from previous displayed frame: 0.000304000 seconds]
    [Time since reference or first frame: 259.794479000 seconds]
    Frame Number: 141
    Frame Length: 66 bytes (528 bits)
    Capture Length: 66 bytes (528 bits)
    [Frame is marked: False]
    [Frame is ignored: False]
    [Protocols in frame: usb]
USB URB
    [Source: host]
    [Destination: 3.3.1]
    URB id: 0xffff89fbe8d2e300
    URB type: URB_SUBMIT ('S')
    URB transfer type: URB_BULK (0x03)
    Endpoint: 0x01, Direction: OUT
        0... .... = Direction: OUT (0)
        .... 0001 = Endpoint number: 1
    Device: 3
    URB bus id: 3
    Device setup request: not relevant ('-')
    Data: present (0)
    URB sec: 1530473884
    URB usec: 656412
    URB status: Operation now in progress (-EINPROGRESS) (-115)
    URB length [bytes]: 2
    Data length [bytes]: 2
    [Response in: 142]
    [bInterfaceClass: Printer (0x07)]
    Unused Setup Header
    Interval: 0
    Start frame: 0
    Copy of Transfer Flags: 0x00000000
    Number of ISO descriptors: 0
Leftover Capture Data: 1b05

0000  00 e3 d2 e8 fb 89 ff ff 53 03 01 03 03 00 2d 00   ........S.....-.
0010  9c 2d 39 5b 00 00 00 00 1c 04 0a 00 8d ff ff ff   .-9[............
0020  02 00 00 00 02 00 00 00 00 00 00 00 00 00 00 00   ................
0030  00 00 00 00 00 00 00 00 00 00 00 00 00 00 00 00   ................
0040  1b 05                                             ..

Frame 142: 64 bytes on wire (512 bits), 64 bytes captured (512 bits) on interface 0
    Interface id: 0 (unknown)
        Interface name: unknown
    Encapsulation type: USB packets with Linux header and padding (115)
    Arrival Time: Jul  1, 2018 15:38:04.656458000 EDT
    [Time shift for this packet: 0.000000000 seconds]
    Epoch Time: 1530473884.656458000 seconds
    [Time delta from previous captured frame: 0.000046000 seconds]
    [Time delta from previous displayed frame: 0.000046000 seconds]
    [Time since reference or first frame: 259.794525000 seconds]
    Frame Number: 142
    Frame Length: 64 bytes (512 bits)
    Capture Length: 64 bytes (512 bits)
    [Frame is marked: False]
    [Frame is ignored: False]
    [Protocols in frame: usb]
USB URB
    [Source: 3.3.1]
    [Destination: host]
    URB id: 0xffff89fbe8d2e300
    URB type: URB_COMPLETE ('C')
    URB transfer type: URB_BULK (0x03)
    Endpoint: 0x01, Direction: OUT
        0... .... = Direction: OUT (0)
        .... 0001 = Endpoint number: 1
    Device: 3
    URB bus id: 3
    Device setup request: not relevant ('-')
    Data: not present ('>')
    URB sec: 1530473884
    URB usec: 656458
    URB status: Success (0)
    URB length [bytes]: 2
    Data length [bytes]: 0
    [Request in: 141]
    [Time from request: 0.000046000 seconds]
    [bInterfaceClass: Printer (0x07)]
    Unused Setup Header
    Interval: 0
    Start frame: 0
    Copy of Transfer Flags: 0x00000000
    Number of ISO descriptors: 0

0000  00 e3 d2 e8 fb 89 ff ff 43 03 01 03 03 00 2d 3e   ........C.....->
0010  9c 2d 39 5b 00 00 00 00 4a 04 0a 00 00 00 00 00   .-9[....J.......
0020  02 00 00 00 00 00 00 00 00 00 00 00 00 00 00 00   ................
0030  00 00 00 00 00 00 00 00 00 00 00 00 00 00 00 00   ................

Frame 143: 64 bytes on wire (512 bits), 64 bytes captured (512 bits) on interface 0
    Interface id: 0 (unknown)
        Interface name: unknown
    Encapsulation type: USB packets with Linux header and padding (115)
    Arrival Time: Jul  1, 2018 15:38:04.656561000 EDT
    [Time shift for this packet: 0.000000000 seconds]
    Epoch Time: 1530473884.656561000 seconds
    [Time delta from previous captured frame: 0.000103000 seconds]
    [Time delta from previous displayed frame: 0.000103000 seconds]
    [Time since reference or first frame: 259.794628000 seconds]
    Frame Number: 143
    Frame Length: 64 bytes (512 bits)
    Capture Length: 64 bytes (512 bits)
    [Frame is marked: False]
    [Frame is ignored: False]
    [Protocols in frame: usb]
USB URB
    [Source: host]
    [Destination: 3.3.2]
    URB id: 0xffff89fbe8d2e300
    URB type: URB_SUBMIT ('S')
    URB transfer type: URB_BULK (0x03)
    Endpoint: 0x82, Direction: IN
        1... .... = Direction: IN (1)
        .... 0010 = Endpoint number: 2
    Device: 3
    URB bus id: 3
    Device setup request: not relevant ('-')
    Data: not present ('<')
    URB sec: 1530473884
    URB usec: 656561
    URB status: Operation now in progress (-EINPROGRESS) (-115)
    URB length [bytes]: 64
    Data length [bytes]: 0
    [Response in: 144]
    [bInterfaceClass: Printer (0x07)]
    Unused Setup Header
    Interval: 0
    Start frame: 0
    Copy of Transfer Flags: 0x00000200
    Number of ISO descriptors: 0

0000  00 e3 d2 e8 fb 89 ff ff 53 03 82 03 03 00 2d 3c   ........S.....-<
0010  9c 2d 39 5b 00 00 00 00 b1 04 0a 00 8d ff ff ff   .-9[............
0020  40 00 00 00 00 00 00 00 00 00 00 00 00 00 00 00   @...............
0030  00 00 00 00 00 00 00 00 00 02 00 00 00 00 00 00   ................

Frame 144: 66 bytes on wire (528 bits), 66 bytes captured (528 bits) on interface 0
    Interface id: 0 (unknown)
        Interface name: unknown
    Encapsulation type: USB packets with Linux header and padding (115)
    Arrival Time: Jul  1, 2018 15:38:04.758825000 EDT
    [Time shift for this packet: 0.000000000 seconds]
    Epoch Time: 1530473884.758825000 seconds
    [Time delta from previous captured frame: 0.102264000 seconds]
    [Time delta from previous displayed frame: 0.102264000 seconds]
    [Time since reference or first frame: 259.896892000 seconds]
    Frame Number: 144
    Frame Length: 66 bytes (528 bits)
    Capture Length: 66 bytes (528 bits)
    [Frame is marked: False]
    [Frame is ignored: False]
    [Protocols in frame: usb]
USB URB
    [Source: 3.3.2]
    [Destination: host]
    URB id: 0xffff89fbe8d2e300
    URB type: URB_COMPLETE ('C')
    URB transfer type: URB_BULK (0x03)
    Endpoint: 0x82, Direction: IN
        1... .... = Direction: IN (1)
        .... 0010 = Endpoint number: 2
    Device: 3
    URB bus id: 3
    Device setup request: not relevant ('-')
    Data: present (0)
    URB sec: 1530473884
    URB usec: 758825
    URB status: Success (0)
    URB length [bytes]: 2
    Data length [bytes]: 2
    [Request in: 143]
    [Time from request: 0.102264000 seconds]
    [bInterfaceClass: Printer (0x07)]
    Unused Setup Header
    Interval: 0
    Start frame: 0
    Copy of Transfer Flags: 0x00000200
    Number of ISO descriptors: 0
Leftover Capture Data: 3103

0000  00 e3 d2 e8 fb 89 ff ff 43 03 82 03 03 00 2d 00   ........C.....-.
0010  9c 2d 39 5b 00 00 00 00 29 94 0b 00 00 00 00 00   .-9[....).......
0020  02 00 00 00 02 00 00 00 00 00 00 00 00 00 00 00   ................
0030  00 00 00 00 00 00 00 00 00 02 00 00 00 00 00 00   ................
0040  31 03                                             1.

Frame 145: 64 bytes on wire (512 bits), 64 bytes captured (512 bits) on interface 0
    Interface id: 0 (unknown)
        Interface name: unknown
    Encapsulation type: USB packets with Linux header and padding (115)
    Arrival Time: Jul  1, 2018 15:38:04.809513000 EDT
    [Time shift for this packet: 0.000000000 seconds]
    Epoch Time: 1530473884.809513000 seconds
    [Time delta from previous captured frame: 0.050688000 seconds]
    [Time delta from previous displayed frame: 0.050688000 seconds]
    [Time since reference or first frame: 259.947580000 seconds]
    Frame Number: 145
    Frame Length: 64 bytes (512 bits)
    Capture Length: 64 bytes (512 bits)
    [Frame is marked: False]
    [Frame is ignored: False]
    [Protocols in frame: usb]
USB URB
    [Source: host]
    [Destination: 3.3.2]
    URB id: 0xffff89fbe8d2e300
    URB type: URB_SUBMIT ('S')
    URB transfer type: URB_BULK (0x03)
    Endpoint: 0x82, Direction: IN
        1... .... = Direction: IN (1)
        .... 0010 = Endpoint number: 2
    Device: 3
    URB bus id: 3
    Device setup request: not relevant ('-')
    Data: not present ('<')
    URB sec: 1530473884
    URB usec: 809513
    URB status: Operation now in progress (-EINPROGRESS) (-115)
    URB length [bytes]: 64
    Data length [bytes]: 0
    [Response in: 146]
    [bInterfaceClass: Printer (0x07)]
    Unused Setup Header
    Interval: 0
    Start frame: 0
    Copy of Transfer Flags: 0x00000200
    Number of ISO descriptors: 0

0000  00 e3 d2 e8 fb 89 ff ff 53 03 82 03 03 00 2d 3c   ........S.....-<
0010  9c 2d 39 5b 00 00 00 00 29 5a 0c 00 8d ff ff ff   .-9[....)Z......
0020  40 00 00 00 00 00 00 00 00 00 00 00 00 00 00 00   @...............
0030  00 00 00 00 00 00 00 00 00 02 00 00 00 00 00 00   ................

Frame 146: 64 bytes on wire (512 bits), 64 bytes captured (512 bits) on interface 0
    Interface id: 0 (unknown)
        Interface name: unknown
    Encapsulation type: USB packets with Linux header and padding (115)
    Arrival Time: Jul  1, 2018 15:38:04.820112000 EDT
    [Time shift for this packet: 0.000000000 seconds]
    Epoch Time: 1530473884.820112000 seconds
    [Time delta from previous captured frame: 0.010599000 seconds]
    [Time delta from previous displayed frame: 0.010599000 seconds]
    [Time since reference or first frame: 259.958179000 seconds]
    Frame Number: 146
    Frame Length: 64 bytes (512 bits)
    Capture Length: 64 bytes (512 bits)
    [Frame is marked: False]
    [Frame is ignored: False]
    [Protocols in frame: usb]
USB URB
    [Source: 3.3.2]
    [Destination: host]
    URB id: 0xffff89fbe8d2e300
    URB type: URB_COMPLETE ('C')
    URB transfer type: URB_BULK (0x03)
    Endpoint: 0x82, Direction: IN
        1... .... = Direction: IN (1)
        .... 0010 = Endpoint number: 2
    Device: 3
    URB bus id: 3
    Device setup request: not relevant ('-')
    Data: present (0)
    URB sec: 1530473884
    URB usec: 820112
    URB status: No such file or directory (-ENOENT) (-2)
    URB length [bytes]: 0
    Data length [bytes]: 0
    [Request in: 145]
    [Time from request: 0.010599000 seconds]
    [bInterfaceClass: Printer (0x07)]
    Unused Setup Header
    Interval: 0
    Start frame: 0
    Copy of Transfer Flags: 0x00000200
    Number of ISO descriptors: 0

0000  00 e3 d2 e8 fb 89 ff ff 43 03 82 03 03 00 2d 00   ........C.....-.
0010  9c 2d 39 5b 00 00 00 00 90 83 0c 00 fe ff ff ff   .-9[............
0020  00 00 00 00 00 00 00 00 00 00 00 00 00 00 00 00   ................
0030  00 00 00 00 00 00 00 00 00 02 00 00 00 00 00 00   ................

Frame 147: 66 bytes on wire (528 bits), 66 bytes captured (528 bits) on interface 0
    Interface id: 0 (unknown)
        Interface name: unknown
    Encapsulation type: USB packets with Linux header and padding (115)
    Arrival Time: Jul  1, 2018 15:38:04.820665000 EDT
    [Time shift for this packet: 0.000000000 seconds]
    Epoch Time: 1530473884.820665000 seconds
    [Time delta from previous captured frame: 0.000553000 seconds]
    [Time delta from previous displayed frame: 0.000553000 seconds]
    [Time since reference or first frame: 259.958732000 seconds]
    Frame Number: 147
    Frame Length: 66 bytes (528 bits)
    Capture Length: 66 bytes (528 bits)
    [Frame is marked: False]
    [Frame is ignored: False]
    [Protocols in frame: usb]
USB URB
    [Source: host]
    [Destination: 3.3.1]
    URB id: 0xffff89fbe8d2e300
    URB type: URB_SUBMIT ('S')
    URB transfer type: URB_BULK (0x03)
    Endpoint: 0x01, Direction: OUT
        0... .... = Direction: OUT (0)
        .... 0001 = Endpoint number: 1
    Device: 3
    URB bus id: 3
    Device setup request: not relevant ('-')
    Data: present (0)
    URB sec: 1530473884
    URB usec: 820665
    URB status: Operation now in progress (-EINPROGRESS) (-115)
    URB length [bytes]: 2
    Data length [bytes]: 2
    [Response in: 148]
    [bInterfaceClass: Printer (0x07)]
    Unused Setup Header
    Interval: 0
    Start frame: 0
    Copy of Transfer Flags: 0x00000000
    Number of ISO descriptors: 0
Leftover Capture Data: 1b05

0000  00 e3 d2 e8 fb 89 ff ff 53 03 01 03 03 00 2d 00   ........S.....-.
0010  9c 2d 39 5b 00 00 00 00 b9 85 0c 00 8d ff ff ff   .-9[............
0020  02 00 00 00 02 00 00 00 00 00 00 00 00 00 00 00   ................
0030  00 00 00 00 00 00 00 00 00 00 00 00 00 00 00 00   ................
0040  1b 05                                             ..

Frame 148: 64 bytes on wire (512 bits), 64 bytes captured (512 bits) on interface 0
    Interface id: 0 (unknown)
        Interface name: unknown
    Encapsulation type: USB packets with Linux header and padding (115)
    Arrival Time: Jul  1, 2018 15:38:04.820714000 EDT
    [Time shift for this packet: 0.000000000 seconds]
    Epoch Time: 1530473884.820714000 seconds
    [Time delta from previous captured frame: 0.000049000 seconds]
    [Time delta from previous displayed frame: 0.000049000 seconds]
    [Time since reference or first frame: 259.958781000 seconds]
    Frame Number: 148
    Frame Length: 64 bytes (512 bits)
    Capture Length: 64 bytes (512 bits)
    [Frame is marked: False]
    [Frame is ignored: False]
    [Protocols in frame: usb]
USB URB
    [Source: 3.3.1]
    [Destination: host]
    URB id: 0xffff89fbe8d2e300
    URB type: URB_COMPLETE ('C')
    URB transfer type: URB_BULK (0x03)
    Endpoint: 0x01, Direction: OUT
        0... .... = Direction: OUT (0)
        .... 0001 = Endpoint number: 1
    Device: 3
    URB bus id: 3
    Device setup request: not relevant ('-')
    Data: not present ('>')
    URB sec: 1530473884
    URB usec: 820714
    URB status: Success (0)
    URB length [bytes]: 2
    Data length [bytes]: 0
    [Request in: 147]
    [Time from request: 0.000049000 seconds]
    [bInterfaceClass: Printer (0x07)]
    Unused Setup Header
    Interval: 0
    Start frame: 0
    Copy of Transfer Flags: 0x00000000
    Number of ISO descriptors: 0

0000  00 e3 d2 e8 fb 89 ff ff 43 03 01 03 03 00 2d 3e   ........C.....->
0010  9c 2d 39 5b 00 00 00 00 ea 85 0c 00 00 00 00 00   .-9[............
0020  02 00 00 00 00 00 00 00 00 00 00 00 00 00 00 00   ................
0030  00 00 00 00 00 00 00 00 00 00 00 00 00 00 00 00   ................

Frame 149: 64 bytes on wire (512 bits), 64 bytes captured (512 bits) on interface 0
    Interface id: 0 (unknown)
        Interface name: unknown
    Encapsulation type: USB packets with Linux header and padding (115)
    Arrival Time: Jul  1, 2018 15:38:04.820930000 EDT
    [Time shift for this packet: 0.000000000 seconds]
    Epoch Time: 1530473884.820930000 seconds
    [Time delta from previous captured frame: 0.000216000 seconds]
    [Time delta from previous displayed frame: 0.000216000 seconds]
    [Time since reference or first frame: 259.958997000 seconds]
    Frame Number: 149
    Frame Length: 64 bytes (512 bits)
    Capture Length: 64 bytes (512 bits)
    [Frame is marked: False]
    [Frame is ignored: False]
    [Protocols in frame: usb]
USB URB
    [Source: host]
    [Destination: 3.3.2]
    URB id: 0xffff89fbe8d2e300
    URB type: URB_SUBMIT ('S')
    URB transfer type: URB_BULK (0x03)
    Endpoint: 0x82, Direction: IN
        1... .... = Direction: IN (1)
        .... 0010 = Endpoint number: 2
    Device: 3
    URB bus id: 3
    Device setup request: not relevant ('-')
    Data: not present ('<')
    URB sec: 1530473884
    URB usec: 820930
    URB status: Operation now in progress (-EINPROGRESS) (-115)
    URB length [bytes]: 64
    Data length [bytes]: 0
    [Response in: 150]
    [bInterfaceClass: Printer (0x07)]
    Unused Setup Header
    Interval: 0
    Start frame: 0
    Copy of Transfer Flags: 0x00000200
    Number of ISO descriptors: 0

0000  00 e3 d2 e8 fb 89 ff ff 53 03 82 03 03 00 2d 3c   ........S.....-<
0010  9c 2d 39 5b 00 00 00 00 c2 86 0c 00 8d ff ff ff   .-9[............
0020  40 00 00 00 00 00 00 00 00 00 00 00 00 00 00 00   @...............
0030  00 00 00 00 00 00 00 00 00 02 00 00 00 00 00 00   ................

Frame 150: 66 bytes on wire (528 bits), 66 bytes captured (528 bits) on interface 0
    Interface id: 0 (unknown)
        Interface name: unknown
    Encapsulation type: USB packets with Linux header and padding (115)
    Arrival Time: Jul  1, 2018 15:38:04.922925000 EDT
    [Time shift for this packet: 0.000000000 seconds]
    Epoch Time: 1530473884.922925000 seconds
    [Time delta from previous captured frame: 0.101995000 seconds]
    [Time delta from previous displayed frame: 0.101995000 seconds]
    [Time since reference or first frame: 260.060992000 seconds]
    Frame Number: 150
    Frame Length: 66 bytes (528 bits)
    Capture Length: 66 bytes (528 bits)
    [Frame is marked: False]
    [Frame is ignored: False]
    [Protocols in frame: usb]
USB URB
    [Source: 3.3.2]
    [Destination: host]
    URB id: 0xffff89fbe8d2e300
    URB type: URB_COMPLETE ('C')
    URB transfer type: URB_BULK (0x03)
    Endpoint: 0x82, Direction: IN
        1... .... = Direction: IN (1)
        .... 0010 = Endpoint number: 2
    Device: 3
    URB bus id: 3
    Device setup request: not relevant ('-')
    Data: present (0)
    URB sec: 1530473884
    URB usec: 922925
    URB status: Success (0)
    URB length [bytes]: 2
    Data length [bytes]: 2
    [Request in: 149]
    [Time from request: 0.101995000 seconds]
    [bInterfaceClass: Printer (0x07)]
    Unused Setup Header
    Interval: 0
    Start frame: 0
    Copy of Transfer Flags: 0x00000200
    Number of ISO descriptors: 0
Leftover Capture Data: 3103

0000  00 e3 d2 e8 fb 89 ff ff 43 03 82 03 03 00 2d 00   ........C.....-.
0010  9c 2d 39 5b 00 00 00 00 2d 15 0e 00 00 00 00 00   .-9[....-.......
0020  02 00 00 00 02 00 00 00 00 00 00 00 00 00 00 00   ................
0030  00 00 00 00 00 00 00 00 00 02 00 00 00 00 00 00   ................
0040  31 03                                             1.

Frame 151: 64 bytes on wire (512 bits), 64 bytes captured (512 bits) on interface 0
    Interface id: 0 (unknown)
        Interface name: unknown
    Encapsulation type: USB packets with Linux header and padding (115)
    Arrival Time: Jul  1, 2018 15:38:04.973611000 EDT
    [Time shift for this packet: 0.000000000 seconds]
    Epoch Time: 1530473884.973611000 seconds
    [Time delta from previous captured frame: 0.050686000 seconds]
    [Time delta from previous displayed frame: 0.050686000 seconds]
    [Time since reference or first frame: 260.111678000 seconds]
    Frame Number: 151
    Frame Length: 64 bytes (512 bits)
    Capture Length: 64 bytes (512 bits)
    [Frame is marked: False]
    [Frame is ignored: False]
    [Protocols in frame: usb]
USB URB
    [Source: host]
    [Destination: 3.3.2]
    URB id: 0xffff89fbe8d2e300
    URB type: URB_SUBMIT ('S')
    URB transfer type: URB_BULK (0x03)
    Endpoint: 0x82, Direction: IN
        1... .... = Direction: IN (1)
        .... 0010 = Endpoint number: 2
    Device: 3
    URB bus id: 3
    Device setup request: not relevant ('-')
    Data: not present ('<')
    URB sec: 1530473884
    URB usec: 973611
    URB status: Operation now in progress (-EINPROGRESS) (-115)
    URB length [bytes]: 64
    Data length [bytes]: 0
    [Response in: 152]
    [bInterfaceClass: Printer (0x07)]
    Unused Setup Header
    Interval: 0
    Start frame: 0
    Copy of Transfer Flags: 0x00000200
    Number of ISO descriptors: 0

0000  00 e3 d2 e8 fb 89 ff ff 53 03 82 03 03 00 2d 3c   ........S.....-<
0010  9c 2d 39 5b 00 00 00 00 2b db 0e 00 8d ff ff ff   .-9[....+.......
0020  40 00 00 00 00 00 00 00 00 00 00 00 00 00 00 00   @...............
0030  00 00 00 00 00 00 00 00 00 02 00 00 00 00 00 00   ................

Frame 152: 64 bytes on wire (512 bits), 64 bytes captured (512 bits) on interface 0
    Interface id: 0 (unknown)
        Interface name: unknown
    Encapsulation type: USB packets with Linux header and padding (115)
    Arrival Time: Jul  1, 2018 15:38:04.984070000 EDT
    [Time shift for this packet: 0.000000000 seconds]
    Epoch Time: 1530473884.984070000 seconds
    [Time delta from previous captured frame: 0.010459000 seconds]
    [Time delta from previous displayed frame: 0.010459000 seconds]
    [Time since reference or first frame: 260.122137000 seconds]
    Frame Number: 152
    Frame Length: 64 bytes (512 bits)
    Capture Length: 64 bytes (512 bits)
    [Frame is marked: False]
    [Frame is ignored: False]
    [Protocols in frame: usb]
USB URB
    [Source: 3.3.2]
    [Destination: host]
    URB id: 0xffff89fbe8d2e300
    URB type: URB_COMPLETE ('C')
    URB transfer type: URB_BULK (0x03)
    Endpoint: 0x82, Direction: IN
        1... .... = Direction: IN (1)
        .... 0010 = Endpoint number: 2
    Device: 3
    URB bus id: 3
    Device setup request: not relevant ('-')
    Data: present (0)
    URB sec: 1530473884
    URB usec: 984070
    URB status: No such file or directory (-ENOENT) (-2)
    URB length [bytes]: 0
    Data length [bytes]: 0
    [Request in: 151]
    [Time from request: 0.010459000 seconds]
    [bInterfaceClass: Printer (0x07)]
    Unused Setup Header
    Interval: 0
    Start frame: 0
    Copy of Transfer Flags: 0x00000200
    Number of ISO descriptors: 0

0000  00 e3 d2 e8 fb 89 ff ff 43 03 82 03 03 00 2d 00   ........C.....-.
0010  9c 2d 39 5b 00 00 00 00 06 04 0f 00 fe ff ff ff   .-9[............
0020  00 00 00 00 00 00 00 00 00 00 00 00 00 00 00 00   ................
0030  00 00 00 00 00 00 00 00 00 02 00 00 00 00 00 00   ................

Frame 153: 66 bytes on wire (528 bits), 66 bytes captured (528 bits) on interface 0
    Interface id: 0 (unknown)
        Interface name: unknown
    Encapsulation type: USB packets with Linux header and padding (115)
    Arrival Time: Jul  1, 2018 15:38:04.984562000 EDT
    [Time shift for this packet: 0.000000000 seconds]
    Epoch Time: 1530473884.984562000 seconds
    [Time delta from previous captured frame: 0.000492000 seconds]
    [Time delta from previous displayed frame: 0.000492000 seconds]
    [Time since reference or first frame: 260.122629000 seconds]
    Frame Number: 153
    Frame Length: 66 bytes (528 bits)
    Capture Length: 66 bytes (528 bits)
    [Frame is marked: False]
    [Frame is ignored: False]
    [Protocols in frame: usb]
USB URB
    [Source: host]
    [Destination: 3.3.1]
    URB id: 0xffff89fbe8d2e300
    URB type: URB_SUBMIT ('S')
    URB transfer type: URB_BULK (0x03)
    Endpoint: 0x01, Direction: OUT
        0... .... = Direction: OUT (0)
        .... 0001 = Endpoint number: 1
    Device: 3
    URB bus id: 3
    Device setup request: not relevant ('-')
    Data: present (0)
    URB sec: 1530473884
    URB usec: 984562
    URB status: Operation now in progress (-EINPROGRESS) (-115)
    URB length [bytes]: 2
    Data length [bytes]: 2
    [Response in: 154]
    [bInterfaceClass: Printer (0x07)]
    Unused Setup Header
    Interval: 0
    Start frame: 0
    Copy of Transfer Flags: 0x00000000
    Number of ISO descriptors: 0
Leftover Capture Data: 1b05

0000  00 e3 d2 e8 fb 89 ff ff 53 03 01 03 03 00 2d 00   ........S.....-.
0010  9c 2d 39 5b 00 00 00 00 f2 05 0f 00 8d ff ff ff   .-9[............
0020  02 00 00 00 02 00 00 00 00 00 00 00 00 00 00 00   ................
0030  00 00 00 00 00 00 00 00 00 00 00 00 00 00 00 00   ................
0040  1b 05                                             ..

Frame 154: 64 bytes on wire (512 bits), 64 bytes captured (512 bits) on interface 0
    Interface id: 0 (unknown)
        Interface name: unknown
    Encapsulation type: USB packets with Linux header and padding (115)
    Arrival Time: Jul  1, 2018 15:38:04.984613000 EDT
    [Time shift for this packet: 0.000000000 seconds]
    Epoch Time: 1530473884.984613000 seconds
    [Time delta from previous captured frame: 0.000051000 seconds]
    [Time delta from previous displayed frame: 0.000051000 seconds]
    [Time since reference or first frame: 260.122680000 seconds]
    Frame Number: 154
    Frame Length: 64 bytes (512 bits)
    Capture Length: 64 bytes (512 bits)
    [Frame is marked: False]
    [Frame is ignored: False]
    [Protocols in frame: usb]
USB URB
    [Source: 3.3.1]
    [Destination: host]
    URB id: 0xffff89fbe8d2e300
    URB type: URB_COMPLETE ('C')
    URB transfer type: URB_BULK (0x03)
    Endpoint: 0x01, Direction: OUT
        0... .... = Direction: OUT (0)
        .... 0001 = Endpoint number: 1
    Device: 3
    URB bus id: 3
    Device setup request: not relevant ('-')
    Data: not present ('>')
    URB sec: 1530473884
    URB usec: 984613
    URB status: Success (0)
    URB length [bytes]: 2
    Data length [bytes]: 0
    [Request in: 153]
    [Time from request: 0.000051000 seconds]
    [bInterfaceClass: Printer (0x07)]
    Unused Setup Header
    Interval: 0
    Start frame: 0
    Copy of Transfer Flags: 0x00000000
    Number of ISO descriptors: 0

0000  00 e3 d2 e8 fb 89 ff ff 43 03 01 03 03 00 2d 3e   ........C.....->
0010  9c 2d 39 5b 00 00 00 00 25 06 0f 00 00 00 00 00   .-9[....%.......
0020  02 00 00 00 00 00 00 00 00 00 00 00 00 00 00 00   ................
0030  00 00 00 00 00 00 00 00 00 00 00 00 00 00 00 00   ................

Frame 155: 64 bytes on wire (512 bits), 64 bytes captured (512 bits) on interface 0
    Interface id: 0 (unknown)
        Interface name: unknown
    Encapsulation type: USB packets with Linux header and padding (115)
    Arrival Time: Jul  1, 2018 15:38:04.984803000 EDT
    [Time shift for this packet: 0.000000000 seconds]
    Epoch Time: 1530473884.984803000 seconds
    [Time delta from previous captured frame: 0.000190000 seconds]
    [Time delta from previous displayed frame: 0.000190000 seconds]
    [Time since reference or first frame: 260.122870000 seconds]
    Frame Number: 155
    Frame Length: 64 bytes (512 bits)
    Capture Length: 64 bytes (512 bits)
    [Frame is marked: False]
    [Frame is ignored: False]
    [Protocols in frame: usb]
USB URB
    [Source: host]
    [Destination: 3.3.2]
    URB id: 0xffff89fbe8d2e300
    URB type: URB_SUBMIT ('S')
    URB transfer type: URB_BULK (0x03)
    Endpoint: 0x82, Direction: IN
        1... .... = Direction: IN (1)
        .... 0010 = Endpoint number: 2
    Device: 3
    URB bus id: 3
    Device setup request: not relevant ('-')
    Data: not present ('<')
    URB sec: 1530473884
    URB usec: 984803
    URB status: Operation now in progress (-EINPROGRESS) (-115)
    URB length [bytes]: 64
    Data length [bytes]: 0
    [Response in: 156]
    [bInterfaceClass: Printer (0x07)]
    Unused Setup Header
    Interval: 0
    Start frame: 0
    Copy of Transfer Flags: 0x00000200
    Number of ISO descriptors: 0

0000  00 e3 d2 e8 fb 89 ff ff 53 03 82 03 03 00 2d 3c   ........S.....-<
0010  9c 2d 39 5b 00 00 00 00 e3 06 0f 00 8d ff ff ff   .-9[............
0020  40 00 00 00 00 00 00 00 00 00 00 00 00 00 00 00   @...............
0030  00 00 00 00 00 00 00 00 00 02 00 00 00 00 00 00   ................

Frame 156: 66 bytes on wire (528 bits), 66 bytes captured (528 bits) on interface 0
    Interface id: 0 (unknown)
        Interface name: unknown
    Encapsulation type: USB packets with Linux header and padding (115)
    Arrival Time: Jul  1, 2018 15:38:05.086945000 EDT
    [Time shift for this packet: 0.000000000 seconds]
    Epoch Time: 1530473885.086945000 seconds
    [Time delta from previous captured frame: 0.102142000 seconds]
    [Time delta from previous displayed frame: 0.102142000 seconds]
    [Time since reference or first frame: 260.225012000 seconds]
    Frame Number: 156
    Frame Length: 66 bytes (528 bits)
    Capture Length: 66 bytes (528 bits)
    [Frame is marked: False]
    [Frame is ignored: False]
    [Protocols in frame: usb]
USB URB
    [Source: 3.3.2]
    [Destination: host]
    URB id: 0xffff89fbe8d2e300
    URB type: URB_COMPLETE ('C')
    URB transfer type: URB_BULK (0x03)
    Endpoint: 0x82, Direction: IN
        1... .... = Direction: IN (1)
        .... 0010 = Endpoint number: 2
    Device: 3
    URB bus id: 3
    Device setup request: not relevant ('-')
    Data: present (0)
    URB sec: 1530473885
    URB usec: 86945
    URB status: Success (0)
    URB length [bytes]: 2
    Data length [bytes]: 2
    [Request in: 155]
    [Time from request: 0.102142000 seconds]
    [bInterfaceClass: Printer (0x07)]
    Unused Setup Header
    Interval: 0
    Start frame: 0
    Copy of Transfer Flags: 0x00000200
    Number of ISO descriptors: 0
Leftover Capture Data: 3103

0000  00 e3 d2 e8 fb 89 ff ff 43 03 82 03 03 00 2d 00   ........C.....-.
0010  9d 2d 39 5b 00 00 00 00 a1 53 01 00 00 00 00 00   .-9[.....S......
0020  02 00 00 00 02 00 00 00 00 00 00 00 00 00 00 00   ................
0030  00 00 00 00 00 00 00 00 00 02 00 00 00 00 00 00   ................
0040  31 03                                             1.

Frame 157: 64 bytes on wire (512 bits), 64 bytes captured (512 bits) on interface 0
    Interface id: 0 (unknown)
        Interface name: unknown
    Encapsulation type: USB packets with Linux header and padding (115)
    Arrival Time: Jul  1, 2018 15:38:05.137456000 EDT
    [Time shift for this packet: 0.000000000 seconds]
    Epoch Time: 1530473885.137456000 seconds
    [Time delta from previous captured frame: 0.050511000 seconds]
    [Time delta from previous displayed frame: 0.050511000 seconds]
    [Time since reference or first frame: 260.275523000 seconds]
    Frame Number: 157
    Frame Length: 64 bytes (512 bits)
    Capture Length: 64 bytes (512 bits)
    [Frame is marked: False]
    [Frame is ignored: False]
    [Protocols in frame: usb]
USB URB
    [Source: host]
    [Destination: 3.3.2]
    URB id: 0xffff89fbe8d2e300
    URB type: URB_SUBMIT ('S')
    URB transfer type: URB_BULK (0x03)
    Endpoint: 0x82, Direction: IN
        1... .... = Direction: IN (1)
        .... 0010 = Endpoint number: 2
    Device: 3
    URB bus id: 3
    Device setup request: not relevant ('-')
    Data: not present ('<')
    URB sec: 1530473885
    URB usec: 137456
    URB status: Operation now in progress (-EINPROGRESS) (-115)
    URB length [bytes]: 64
    Data length [bytes]: 0
    [Response in: 158]
    [bInterfaceClass: Printer (0x07)]
    Unused Setup Header
    Interval: 0
    Start frame: 0
    Copy of Transfer Flags: 0x00000200
    Number of ISO descriptors: 0

0000  00 e3 d2 e8 fb 89 ff ff 53 03 82 03 03 00 2d 3c   ........S.....-<
0010  9d 2d 39 5b 00 00 00 00 f0 18 02 00 8d ff ff ff   .-9[............
0020  40 00 00 00 00 00 00 00 00 00 00 00 00 00 00 00   @...............
0030  00 00 00 00 00 00 00 00 00 02 00 00 00 00 00 00   ................

Frame 158: 64 bytes on wire (512 bits), 64 bytes captured (512 bits) on interface 0
    Interface id: 0 (unknown)
        Interface name: unknown
    Encapsulation type: USB packets with Linux header and padding (115)
    Arrival Time: Jul  1, 2018 15:38:05.148014000 EDT
    [Time shift for this packet: 0.000000000 seconds]
    Epoch Time: 1530473885.148014000 seconds
    [Time delta from previous captured frame: 0.010558000 seconds]
    [Time delta from previous displayed frame: 0.010558000 seconds]
    [Time since reference or first frame: 260.286081000 seconds]
    Frame Number: 158
    Frame Length: 64 bytes (512 bits)
    Capture Length: 64 bytes (512 bits)
    [Frame is marked: False]
    [Frame is ignored: False]
    [Protocols in frame: usb]
USB URB
    [Source: 3.3.2]
    [Destination: host]
    URB id: 0xffff89fbe8d2e300
    URB type: URB_COMPLETE ('C')
    URB transfer type: URB_BULK (0x03)
    Endpoint: 0x82, Direction: IN
        1... .... = Direction: IN (1)
        .... 0010 = Endpoint number: 2
    Device: 3
    URB bus id: 3
    Device setup request: not relevant ('-')
    Data: present (0)
    URB sec: 1530473885
    URB usec: 148014
    URB status: No such file or directory (-ENOENT) (-2)
    URB length [bytes]: 0
    Data length [bytes]: 0
    [Request in: 157]
    [Time from request: 0.010558000 seconds]
    [bInterfaceClass: Printer (0x07)]
    Unused Setup Header
    Interval: 0
    Start frame: 0
    Copy of Transfer Flags: 0x00000200
    Number of ISO descriptors: 0

0000  00 e3 d2 e8 fb 89 ff ff 43 03 82 03 03 00 2d 00   ........C.....-.
0010  9d 2d 39 5b 00 00 00 00 2e 42 02 00 fe ff ff ff   .-9[.....B......
0020  00 00 00 00 00 00 00 00 00 00 00 00 00 00 00 00   ................
0030  00 00 00 00 00 00 00 00 00 02 00 00 00 00 00 00   ................

Frame 159: 66 bytes on wire (528 bits), 66 bytes captured (528 bits) on interface 0
    Interface id: 0 (unknown)
        Interface name: unknown
    Encapsulation type: USB packets with Linux header and padding (115)
    Arrival Time: Jul  1, 2018 15:38:05.148252000 EDT
    [Time shift for this packet: 0.000000000 seconds]
    Epoch Time: 1530473885.148252000 seconds
    [Time delta from previous captured frame: 0.000238000 seconds]
    [Time delta from previous displayed frame: 0.000238000 seconds]
    [Time since reference or first frame: 260.286319000 seconds]
    Frame Number: 159
    Frame Length: 66 bytes (528 bits)
    Capture Length: 66 bytes (528 bits)
    [Frame is marked: False]
    [Frame is ignored: False]
    [Protocols in frame: usb]
USB URB
    [Source: host]
    [Destination: 3.3.1]
    URB id: 0xffff89fc655e20c0
    URB type: URB_SUBMIT ('S')
    URB transfer type: URB_BULK (0x03)
    Endpoint: 0x01, Direction: OUT
        0... .... = Direction: OUT (0)
        .... 0001 = Endpoint number: 1
    Device: 3
    URB bus id: 3
    Device setup request: not relevant ('-')
    Data: present (0)
    URB sec: 1530473885
    URB usec: 148252
    URB status: Operation now in progress (-EINPROGRESS) (-115)
    URB length [bytes]: 2
    Data length [bytes]: 2
    [Response in: 160]
    [bInterfaceClass: Printer (0x07)]
    Unused Setup Header
    Interval: 0
    Start frame: 0
    Copy of Transfer Flags: 0x00000000
    Number of ISO descriptors: 0
Leftover Capture Data: 1b05

0000  c0 20 5e 65 fc 89 ff ff 53 03 01 03 03 00 2d 00   . ^e....S.....-.
0010  9d 2d 39 5b 00 00 00 00 1c 43 02 00 8d ff ff ff   .-9[.....C......
0020  02 00 00 00 02 00 00 00 00 00 00 00 00 00 00 00   ................
0030  00 00 00 00 00 00 00 00 00 00 00 00 00 00 00 00   ................
0040  1b 05                                             ..

Frame 160: 64 bytes on wire (512 bits), 64 bytes captured (512 bits) on interface 0
    Interface id: 0 (unknown)
        Interface name: unknown
    Encapsulation type: USB packets with Linux header and padding (115)
    Arrival Time: Jul  1, 2018 15:38:05.148288000 EDT
    [Time shift for this packet: 0.000000000 seconds]
    Epoch Time: 1530473885.148288000 seconds
    [Time delta from previous captured frame: 0.000036000 seconds]
    [Time delta from previous displayed frame: 0.000036000 seconds]
    [Time since reference or first frame: 260.286355000 seconds]
    Frame Number: 160
    Frame Length: 64 bytes (512 bits)
    Capture Length: 64 bytes (512 bits)
    [Frame is marked: False]
    [Frame is ignored: False]
    [Protocols in frame: usb]
USB URB
    [Source: 3.3.1]
    [Destination: host]
    URB id: 0xffff89fc655e20c0
    URB type: URB_COMPLETE ('C')
    URB transfer type: URB_BULK (0x03)
    Endpoint: 0x01, Direction: OUT
        0... .... = Direction: OUT (0)
        .... 0001 = Endpoint number: 1
    Device: 3
    URB bus id: 3
    Device setup request: not relevant ('-')
    Data: not present ('>')
    URB sec: 1530473885
    URB usec: 148288
    URB status: Success (0)
    URB length [bytes]: 2
    Data length [bytes]: 0
    [Request in: 159]
    [Time from request: 0.000036000 seconds]
    [bInterfaceClass: Printer (0x07)]
    Unused Setup Header
    Interval: 0
    Start frame: 0
    Copy of Transfer Flags: 0x00000000
    Number of ISO descriptors: 0

0000  c0 20 5e 65 fc 89 ff ff 43 03 01 03 03 00 2d 3e   . ^e....C.....->
0010  9d 2d 39 5b 00 00 00 00 40 43 02 00 00 00 00 00   .-9[....@C......
0020  02 00 00 00 00 00 00 00 00 00 00 00 00 00 00 00   ................
0030  00 00 00 00 00 00 00 00 00 00 00 00 00 00 00 00   ................

Frame 161: 64 bytes on wire (512 bits), 64 bytes captured (512 bits) on interface 0
    Interface id: 0 (unknown)
        Interface name: unknown
    Encapsulation type: USB packets with Linux header and padding (115)
    Arrival Time: Jul  1, 2018 15:38:05.148449000 EDT
    [Time shift for this packet: 0.000000000 seconds]
    Epoch Time: 1530473885.148449000 seconds
    [Time delta from previous captured frame: 0.000161000 seconds]
    [Time delta from previous displayed frame: 0.000161000 seconds]
    [Time since reference or first frame: 260.286516000 seconds]
    Frame Number: 161
    Frame Length: 64 bytes (512 bits)
    Capture Length: 64 bytes (512 bits)
    [Frame is marked: False]
    [Frame is ignored: False]
    [Protocols in frame: usb]
USB URB
    [Source: host]
    [Destination: 3.3.2]
    URB id: 0xffff89fc655e20c0
    URB type: URB_SUBMIT ('S')
    URB transfer type: URB_BULK (0x03)
    Endpoint: 0x82, Direction: IN
        1... .... = Direction: IN (1)
        .... 0010 = Endpoint number: 2
    Device: 3
    URB bus id: 3
    Device setup request: not relevant ('-')
    Data: not present ('<')
    URB sec: 1530473885
    URB usec: 148449
    URB status: Operation now in progress (-EINPROGRESS) (-115)
    URB length [bytes]: 64
    Data length [bytes]: 0
    [Response in: 162]
    [bInterfaceClass: Printer (0x07)]
    Unused Setup Header
    Interval: 0
    Start frame: 0
    Copy of Transfer Flags: 0x00000200
    Number of ISO descriptors: 0

0000  c0 20 5e 65 fc 89 ff ff 53 03 82 03 03 00 2d 3c   . ^e....S.....-<
0010  9d 2d 39 5b 00 00 00 00 e1 43 02 00 8d ff ff ff   .-9[.....C......
0020  40 00 00 00 00 00 00 00 00 00 00 00 00 00 00 00   @...............
0030  00 00 00 00 00 00 00 00 00 02 00 00 00 00 00 00   ................

Frame 162: 66 bytes on wire (528 bits), 66 bytes captured (528 bits) on interface 0
    Interface id: 0 (unknown)
        Interface name: unknown
    Encapsulation type: USB packets with Linux header and padding (115)
    Arrival Time: Jul  1, 2018 15:38:05.250862000 EDT
    [Time shift for this packet: 0.000000000 seconds]
    Epoch Time: 1530473885.250862000 seconds
    [Time delta from previous captured frame: 0.102413000 seconds]
    [Time delta from previous displayed frame: 0.102413000 seconds]
    [Time since reference or first frame: 260.388929000 seconds]
    Frame Number: 162
    Frame Length: 66 bytes (528 bits)
    Capture Length: 66 bytes (528 bits)
    [Frame is marked: False]
    [Frame is ignored: False]
    [Protocols in frame: usb]
USB URB
    [Source: 3.3.2]
    [Destination: host]
    URB id: 0xffff89fc655e20c0
    URB type: URB_COMPLETE ('C')
    URB transfer type: URB_BULK (0x03)
    Endpoint: 0x82, Direction: IN
        1... .... = Direction: IN (1)
        .... 0010 = Endpoint number: 2
    Device: 3
    URB bus id: 3
    Device setup request: not relevant ('-')
    Data: present (0)
    URB sec: 1530473885
    URB usec: 250862
    URB status: Success (0)
    URB length [bytes]: 2
    Data length [bytes]: 2
    [Request in: 161]
    [Time from request: 0.102413000 seconds]
    [bInterfaceClass: Printer (0x07)]
    Unused Setup Header
    Interval: 0
    Start frame: 0
    Copy of Transfer Flags: 0x00000200
    Number of ISO descriptors: 0
Leftover Capture Data: 3103

0000  c0 20 5e 65 fc 89 ff ff 43 03 82 03 03 00 2d 00   . ^e....C.....-.
0010  9d 2d 39 5b 00 00 00 00 ee d3 03 00 00 00 00 00   .-9[............
0020  02 00 00 00 02 00 00 00 00 00 00 00 00 00 00 00   ................
0030  00 00 00 00 00 00 00 00 00 02 00 00 00 00 00 00   ................
0040  31 03                                             1.

Frame 163: 64 bytes on wire (512 bits), 64 bytes captured (512 bits) on interface 0
    Interface id: 0 (unknown)
        Interface name: unknown
    Encapsulation type: USB packets with Linux header and padding (115)
    Arrival Time: Jul  1, 2018 15:38:05.301356000 EDT
    [Time shift for this packet: 0.000000000 seconds]
    Epoch Time: 1530473885.301356000 seconds
    [Time delta from previous captured frame: 0.050494000 seconds]
    [Time delta from previous displayed frame: 0.050494000 seconds]
    [Time since reference or first frame: 260.439423000 seconds]
    Frame Number: 163
    Frame Length: 64 bytes (512 bits)
    Capture Length: 64 bytes (512 bits)
    [Frame is marked: False]
    [Frame is ignored: False]
    [Protocols in frame: usb]
USB URB
    [Source: host]
    [Destination: 3.3.2]
    URB id: 0xffff89fbe8d2ec00
    URB type: URB_SUBMIT ('S')
    URB transfer type: URB_BULK (0x03)
    Endpoint: 0x82, Direction: IN
        1... .... = Direction: IN (1)
        .... 0010 = Endpoint number: 2
    Device: 3
    URB bus id: 3
    Device setup request: not relevant ('-')
    Data: not present ('<')
    URB sec: 1530473885
    URB usec: 301356
    URB status: Operation now in progress (-EINPROGRESS) (-115)
    URB length [bytes]: 64
    Data length [bytes]: 0
    [Response in: 164]
    [bInterfaceClass: Printer (0x07)]
    Unused Setup Header
    Interval: 0
    Start frame: 0
    Copy of Transfer Flags: 0x00000200
    Number of ISO descriptors: 0

0000  00 ec d2 e8 fb 89 ff ff 53 03 82 03 03 00 2d 3c   ........S.....-<
0010  9d 2d 39 5b 00 00 00 00 2c 99 04 00 8d ff ff ff   .-9[....,.......
0020  40 00 00 00 00 00 00 00 00 00 00 00 00 00 00 00   @...............
0030  00 00 00 00 00 00 00 00 00 02 00 00 00 00 00 00   ................

Frame 164: 64 bytes on wire (512 bits), 64 bytes captured (512 bits) on interface 0
    Interface id: 0 (unknown)
        Interface name: unknown
    Encapsulation type: USB packets with Linux header and padding (115)
    Arrival Time: Jul  1, 2018 15:38:05.312080000 EDT
    [Time shift for this packet: 0.000000000 seconds]
    Epoch Time: 1530473885.312080000 seconds
    [Time delta from previous captured frame: 0.010724000 seconds]
    [Time delta from previous displayed frame: 0.010724000 seconds]
    [Time since reference or first frame: 260.450147000 seconds]
    Frame Number: 164
    Frame Length: 64 bytes (512 bits)
    Capture Length: 64 bytes (512 bits)
    [Frame is marked: False]
    [Frame is ignored: False]
    [Protocols in frame: usb]
USB URB
    [Source: 3.3.2]
    [Destination: host]
    URB id: 0xffff89fbe8d2ec00
    URB type: URB_COMPLETE ('C')
    URB transfer type: URB_BULK (0x03)
    Endpoint: 0x82, Direction: IN
        1... .... = Direction: IN (1)
        .... 0010 = Endpoint number: 2
    Device: 3
    URB bus id: 3
    Device setup request: not relevant ('-')
    Data: present (0)
    URB sec: 1530473885
    URB usec: 312080
    URB status: No such file or directory (-ENOENT) (-2)
    URB length [bytes]: 0
    Data length [bytes]: 0
    [Request in: 163]
    [Time from request: 0.010724000 seconds]
    [bInterfaceClass: Printer (0x07)]
    Unused Setup Header
    Interval: 0
    Start frame: 0
    Copy of Transfer Flags: 0x00000200
    Number of ISO descriptors: 0

0000  00 ec d2 e8 fb 89 ff ff 43 03 82 03 03 00 2d 00   ........C.....-.
0010  9d 2d 39 5b 00 00 00 00 10 c3 04 00 fe ff ff ff   .-9[............
0020  00 00 00 00 00 00 00 00 00 00 00 00 00 00 00 00   ................
0030  00 00 00 00 00 00 00 00 00 02 00 00 00 00 00 00   ................

Frame 165: 66 bytes on wire (528 bits), 66 bytes captured (528 bits) on interface 0
    Interface id: 0 (unknown)
        Interface name: unknown
    Encapsulation type: USB packets with Linux header and padding (115)
    Arrival Time: Jul  1, 2018 15:38:05.312534000 EDT
    [Time shift for this packet: 0.000000000 seconds]
    Epoch Time: 1530473885.312534000 seconds
    [Time delta from previous captured frame: 0.000454000 seconds]
    [Time delta from previous displayed frame: 0.000454000 seconds]
    [Time since reference or first frame: 260.450601000 seconds]
    Frame Number: 165
    Frame Length: 66 bytes (528 bits)
    Capture Length: 66 bytes (528 bits)
    [Frame is marked: False]
    [Frame is ignored: False]
    [Protocols in frame: usb]
USB URB
    [Source: host]
    [Destination: 3.3.1]
    URB id: 0xffff89fbe8d2ec00
    URB type: URB_SUBMIT ('S')
    URB transfer type: URB_BULK (0x03)
    Endpoint: 0x01, Direction: OUT
        0... .... = Direction: OUT (0)
        .... 0001 = Endpoint number: 1
    Device: 3
    URB bus id: 3
    Device setup request: not relevant ('-')
    Data: present (0)
    URB sec: 1530473885
    URB usec: 312534
    URB status: Operation now in progress (-EINPROGRESS) (-115)
    URB length [bytes]: 2
    Data length [bytes]: 2
    [Response in: 166]
    [bInterfaceClass: Printer (0x07)]
    Unused Setup Header
    Interval: 0
    Start frame: 0
    Copy of Transfer Flags: 0x00000000
    Number of ISO descriptors: 0
Leftover Capture Data: 1b05

0000  00 ec d2 e8 fb 89 ff ff 53 03 01 03 03 00 2d 00   ........S.....-.
0010  9d 2d 39 5b 00 00 00 00 d6 c4 04 00 8d ff ff ff   .-9[............
0020  02 00 00 00 02 00 00 00 00 00 00 00 00 00 00 00   ................
0030  00 00 00 00 00 00 00 00 00 00 00 00 00 00 00 00   ................
0040  1b 05                                             ..

Frame 166: 64 bytes on wire (512 bits), 64 bytes captured (512 bits) on interface 0
    Interface id: 0 (unknown)
        Interface name: unknown
    Encapsulation type: USB packets with Linux header and padding (115)
    Arrival Time: Jul  1, 2018 15:38:05.312580000 EDT
    [Time shift for this packet: 0.000000000 seconds]
    Epoch Time: 1530473885.312580000 seconds
    [Time delta from previous captured frame: 0.000046000 seconds]
    [Time delta from previous displayed frame: 0.000046000 seconds]
    [Time since reference or first frame: 260.450647000 seconds]
    Frame Number: 166
    Frame Length: 64 bytes (512 bits)
    Capture Length: 64 bytes (512 bits)
    [Frame is marked: False]
    [Frame is ignored: False]
    [Protocols in frame: usb]
USB URB
    [Source: 3.3.1]
    [Destination: host]
    URB id: 0xffff89fbe8d2ec00
    URB type: URB_COMPLETE ('C')
    URB transfer type: URB_BULK (0x03)
    Endpoint: 0x01, Direction: OUT
        0... .... = Direction: OUT (0)
        .... 0001 = Endpoint number: 1
    Device: 3
    URB bus id: 3
    Device setup request: not relevant ('-')
    Data: not present ('>')
    URB sec: 1530473885
    URB usec: 312580
    URB status: Success (0)
    URB length [bytes]: 2
    Data length [bytes]: 0
    [Request in: 165]
    [Time from request: 0.000046000 seconds]
    [bInterfaceClass: Printer (0x07)]
    Unused Setup Header
    Interval: 0
    Start frame: 0
    Copy of Transfer Flags: 0x00000000
    Number of ISO descriptors: 0

0000  00 ec d2 e8 fb 89 ff ff 43 03 01 03 03 00 2d 3e   ........C.....->
0010  9d 2d 39 5b 00 00 00 00 04 c5 04 00 00 00 00 00   .-9[............
0020  02 00 00 00 00 00 00 00 00 00 00 00 00 00 00 00   ................
0030  00 00 00 00 00 00 00 00 00 00 00 00 00 00 00 00   ................

Frame 167: 64 bytes on wire (512 bits), 64 bytes captured (512 bits) on interface 0
    Interface id: 0 (unknown)
        Interface name: unknown
    Encapsulation type: USB packets with Linux header and padding (115)
    Arrival Time: Jul  1, 2018 15:38:05.312762000 EDT
    [Time shift for this packet: 0.000000000 seconds]
    Epoch Time: 1530473885.312762000 seconds
    [Time delta from previous captured frame: 0.000182000 seconds]
    [Time delta from previous displayed frame: 0.000182000 seconds]
    [Time since reference or first frame: 260.450829000 seconds]
    Frame Number: 167
    Frame Length: 64 bytes (512 bits)
    Capture Length: 64 bytes (512 bits)
    [Frame is marked: False]
    [Frame is ignored: False]
    [Protocols in frame: usb]
USB URB
    [Source: host]
    [Destination: 3.3.2]
    URB id: 0xffff89fbe8d2ec00
    URB type: URB_SUBMIT ('S')
    URB transfer type: URB_BULK (0x03)
    Endpoint: 0x82, Direction: IN
        1... .... = Direction: IN (1)
        .... 0010 = Endpoint number: 2
    Device: 3
    URB bus id: 3
    Device setup request: not relevant ('-')
    Data: not present ('<')
    URB sec: 1530473885
    URB usec: 312762
    URB status: Operation now in progress (-EINPROGRESS) (-115)
    URB length [bytes]: 64
    Data length [bytes]: 0
    [Response in: 168]
    [bInterfaceClass: Printer (0x07)]
    Unused Setup Header
    Interval: 0
    Start frame: 0
    Copy of Transfer Flags: 0x00000200
    Number of ISO descriptors: 0

0000  00 ec d2 e8 fb 89 ff ff 53 03 82 03 03 00 2d 3c   ........S.....-<
0010  9d 2d 39 5b 00 00 00 00 ba c5 04 00 8d ff ff ff   .-9[............
0020  40 00 00 00 00 00 00 00 00 00 00 00 00 00 00 00   @...............
0030  00 00 00 00 00 00 00 00 00 02 00 00 00 00 00 00   ................

Frame 168: 66 bytes on wire (528 bits), 66 bytes captured (528 bits) on interface 0
    Interface id: 0 (unknown)
        Interface name: unknown
    Encapsulation type: USB packets with Linux header and padding (115)
    Arrival Time: Jul  1, 2018 15:38:05.414930000 EDT
    [Time shift for this packet: 0.000000000 seconds]
    Epoch Time: 1530473885.414930000 seconds
    [Time delta from previous captured frame: 0.102168000 seconds]
    [Time delta from previous displayed frame: 0.102168000 seconds]
    [Time since reference or first frame: 260.552997000 seconds]
    Frame Number: 168
    Frame Length: 66 bytes (528 bits)
    Capture Length: 66 bytes (528 bits)
    [Frame is marked: False]
    [Frame is ignored: False]
    [Protocols in frame: usb]
USB URB
    [Source: 3.3.2]
    [Destination: host]
    URB id: 0xffff89fbe8d2ec00
    URB type: URB_COMPLETE ('C')
    URB transfer type: URB_BULK (0x03)
    Endpoint: 0x82, Direction: IN
        1... .... = Direction: IN (1)
        .... 0010 = Endpoint number: 2
    Device: 3
    URB bus id: 3
    Device setup request: not relevant ('-')
    Data: present (0)
    URB sec: 1530473885
    URB usec: 414930
    URB status: Success (0)
    URB length [bytes]: 2
    Data length [bytes]: 2
    [Request in: 167]
    [Time from request: 0.102168000 seconds]
    [bInterfaceClass: Printer (0x07)]
    Unused Setup Header
    Interval: 0
    Start frame: 0
    Copy of Transfer Flags: 0x00000200
    Number of ISO descriptors: 0
Leftover Capture Data: 3103

0000  00 ec d2 e8 fb 89 ff ff 43 03 82 03 03 00 2d 00   ........C.....-.
0010  9d 2d 39 5b 00 00 00 00 d2 54 06 00 00 00 00 00   .-9[.....T......
0020  02 00 00 00 02 00 00 00 00 00 00 00 00 00 00 00   ................
0030  00 00 00 00 00 00 00 00 00 02 00 00 00 00 00 00   ................
0040  31 03                                             1.

Frame 169: 64 bytes on wire (512 bits), 64 bytes captured (512 bits) on interface 0
    Interface id: 0 (unknown)
        Interface name: unknown
    Encapsulation type: USB packets with Linux header and padding (115)
    Arrival Time: Jul  1, 2018 15:38:05.465644000 EDT
    [Time shift for this packet: 0.000000000 seconds]
    Epoch Time: 1530473885.465644000 seconds
    [Time delta from previous captured frame: 0.050714000 seconds]
    [Time delta from previous displayed frame: 0.050714000 seconds]
    [Time since reference or first frame: 260.603711000 seconds]
    Frame Number: 169
    Frame Length: 64 bytes (512 bits)
    Capture Length: 64 bytes (512 bits)
    [Frame is marked: False]
    [Frame is ignored: False]
    [Protocols in frame: usb]
USB URB
    [Source: host]
    [Destination: 3.3.2]
    URB id: 0xffff89fbe8d2ec00
    URB type: URB_SUBMIT ('S')
    URB transfer type: URB_BULK (0x03)
    Endpoint: 0x82, Direction: IN
        1... .... = Direction: IN (1)
        .... 0010 = Endpoint number: 2
    Device: 3
    URB bus id: 3
    Device setup request: not relevant ('-')
    Data: not present ('<')
    URB sec: 1530473885
    URB usec: 465644
    URB status: Operation now in progress (-EINPROGRESS) (-115)
    URB length [bytes]: 64
    Data length [bytes]: 0
    [Response in: 170]
    [bInterfaceClass: Printer (0x07)]
    Unused Setup Header
    Interval: 0
    Start frame: 0
    Copy of Transfer Flags: 0x00000200
    Number of ISO descriptors: 0

0000  00 ec d2 e8 fb 89 ff ff 53 03 82 03 03 00 2d 3c   ........S.....-<
0010  9d 2d 39 5b 00 00 00 00 ec 1a 07 00 8d ff ff ff   .-9[............
0020  40 00 00 00 00 00 00 00 00 00 00 00 00 00 00 00   @...............
0030  00 00 00 00 00 00 00 00 00 02 00 00 00 00 00 00   ................

Frame 170: 64 bytes on wire (512 bits), 64 bytes captured (512 bits) on interface 0
    Interface id: 0 (unknown)
        Interface name: unknown
    Encapsulation type: USB packets with Linux header and padding (115)
    Arrival Time: Jul  1, 2018 15:38:05.476066000 EDT
    [Time shift for this packet: 0.000000000 seconds]
    Epoch Time: 1530473885.476066000 seconds
    [Time delta from previous captured frame: 0.010422000 seconds]
    [Time delta from previous displayed frame: 0.010422000 seconds]
    [Time since reference or first frame: 260.614133000 seconds]
    Frame Number: 170
    Frame Length: 64 bytes (512 bits)
    Capture Length: 64 bytes (512 bits)
    [Frame is marked: False]
    [Frame is ignored: False]
    [Protocols in frame: usb]
USB URB
    [Source: 3.3.2]
    [Destination: host]
    URB id: 0xffff89fbe8d2ec00
    URB type: URB_COMPLETE ('C')
    URB transfer type: URB_BULK (0x03)
    Endpoint: 0x82, Direction: IN
        1... .... = Direction: IN (1)
        .... 0010 = Endpoint number: 2
    Device: 3
    URB bus id: 3
    Device setup request: not relevant ('-')
    Data: present (0)
    URB sec: 1530473885
    URB usec: 476066
    URB status: No such file or directory (-ENOENT) (-2)
    URB length [bytes]: 0
    Data length [bytes]: 0
    [Request in: 169]
    [Time from request: 0.010422000 seconds]
    [bInterfaceClass: Printer (0x07)]
    Unused Setup Header
    Interval: 0
    Start frame: 0
    Copy of Transfer Flags: 0x00000200
    Number of ISO descriptors: 0

0000  00 ec d2 e8 fb 89 ff ff 43 03 82 03 03 00 2d 00   ........C.....-.
0010  9d 2d 39 5b 00 00 00 00 a2 43 07 00 fe ff ff ff   .-9[.....C......
0020  00 00 00 00 00 00 00 00 00 00 00 00 00 00 00 00   ................
0030  00 00 00 00 00 00 00 00 00 02 00 00 00 00 00 00   ................

Frame 171: 66 bytes on wire (528 bits), 66 bytes captured (528 bits) on interface 0
    Interface id: 0 (unknown)
        Interface name: unknown
    Encapsulation type: USB packets with Linux header and padding (115)
    Arrival Time: Jul  1, 2018 15:38:05.476587000 EDT
    [Time shift for this packet: 0.000000000 seconds]
    Epoch Time: 1530473885.476587000 seconds
    [Time delta from previous captured frame: 0.000521000 seconds]
    [Time delta from previous displayed frame: 0.000521000 seconds]
    [Time since reference or first frame: 260.614654000 seconds]
    Frame Number: 171
    Frame Length: 66 bytes (528 bits)
    Capture Length: 66 bytes (528 bits)
    [Frame is marked: False]
    [Frame is ignored: False]
    [Protocols in frame: usb]
USB URB
    [Source: host]
    [Destination: 3.3.1]
    URB id: 0xffff89fbe8d2ec00
    URB type: URB_SUBMIT ('S')
    URB transfer type: URB_BULK (0x03)
    Endpoint: 0x01, Direction: OUT
        0... .... = Direction: OUT (0)
        .... 0001 = Endpoint number: 1
    Device: 3
    URB bus id: 3
    Device setup request: not relevant ('-')
    Data: present (0)
    URB sec: 1530473885
    URB usec: 476587
    URB status: Operation now in progress (-EINPROGRESS) (-115)
    URB length [bytes]: 2
    Data length [bytes]: 2
    [Response in: 172]
    [bInterfaceClass: Printer (0x07)]
    Unused Setup Header
    Interval: 0
    Start frame: 0
    Copy of Transfer Flags: 0x00000000
    Number of ISO descriptors: 0
Leftover Capture Data: 1b05

0000  00 ec d2 e8 fb 89 ff ff 53 03 01 03 03 00 2d 00   ........S.....-.
0010  9d 2d 39 5b 00 00 00 00 ab 45 07 00 8d ff ff ff   .-9[.....E......
0020  02 00 00 00 02 00 00 00 00 00 00 00 00 00 00 00   ................
0030  00 00 00 00 00 00 00 00 00 00 00 00 00 00 00 00   ................
0040  1b 05                                             ..

Frame 172: 64 bytes on wire (512 bits), 64 bytes captured (512 bits) on interface 0
    Interface id: 0 (unknown)
        Interface name: unknown
    Encapsulation type: USB packets with Linux header and padding (115)
    Arrival Time: Jul  1, 2018 15:38:05.476639000 EDT
    [Time shift for this packet: 0.000000000 seconds]
    Epoch Time: 1530473885.476639000 seconds
    [Time delta from previous captured frame: 0.000052000 seconds]
    [Time delta from previous displayed frame: 0.000052000 seconds]
    [Time since reference or first frame: 260.614706000 seconds]
    Frame Number: 172
    Frame Length: 64 bytes (512 bits)
    Capture Length: 64 bytes (512 bits)
    [Frame is marked: False]
    [Frame is ignored: False]
    [Protocols in frame: usb]
USB URB
    [Source: 3.3.1]
    [Destination: host]
    URB id: 0xffff89fbe8d2ec00
    URB type: URB_COMPLETE ('C')
    URB transfer type: URB_BULK (0x03)
    Endpoint: 0x01, Direction: OUT
        0... .... = Direction: OUT (0)
        .... 0001 = Endpoint number: 1
    Device: 3
    URB bus id: 3
    Device setup request: not relevant ('-')
    Data: not present ('>')
    URB sec: 1530473885
    URB usec: 476639
    URB status: Success (0)
    URB length [bytes]: 2
    Data length [bytes]: 0
    [Request in: 171]
    [Time from request: 0.000052000 seconds]
    [bInterfaceClass: Printer (0x07)]
    Unused Setup Header
    Interval: 0
    Start frame: 0
    Copy of Transfer Flags: 0x00000000
    Number of ISO descriptors: 0

0000  00 ec d2 e8 fb 89 ff ff 43 03 01 03 03 00 2d 3e   ........C.....->
0010  9d 2d 39 5b 00 00 00 00 df 45 07 00 00 00 00 00   .-9[.....E......
0020  02 00 00 00 00 00 00 00 00 00 00 00 00 00 00 00   ................
0030  00 00 00 00 00 00 00 00 00 00 00 00 00 00 00 00   ................

Frame 173: 64 bytes on wire (512 bits), 64 bytes captured (512 bits) on interface 0
    Interface id: 0 (unknown)
        Interface name: unknown
    Encapsulation type: USB packets with Linux header and padding (115)
    Arrival Time: Jul  1, 2018 15:38:05.476855000 EDT
    [Time shift for this packet: 0.000000000 seconds]
    Epoch Time: 1530473885.476855000 seconds
    [Time delta from previous captured frame: 0.000216000 seconds]
    [Time delta from previous displayed frame: 0.000216000 seconds]
    [Time since reference or first frame: 260.614922000 seconds]
    Frame Number: 173
    Frame Length: 64 bytes (512 bits)
    Capture Length: 64 bytes (512 bits)
    [Frame is marked: False]
    [Frame is ignored: False]
    [Protocols in frame: usb]
USB URB
    [Source: host]
    [Destination: 3.3.2]
    URB id: 0xffff89fbe8d2ec00
    URB type: URB_SUBMIT ('S')
    URB transfer type: URB_BULK (0x03)
    Endpoint: 0x82, Direction: IN
        1... .... = Direction: IN (1)
        .... 0010 = Endpoint number: 2
    Device: 3
    URB bus id: 3
    Device setup request: not relevant ('-')
    Data: not present ('<')
    URB sec: 1530473885
    URB usec: 476855
    URB status: Operation now in progress (-EINPROGRESS) (-115)
    URB length [bytes]: 64
    Data length [bytes]: 0
    [Response in: 174]
    [bInterfaceClass: Printer (0x07)]
    Unused Setup Header
    Interval: 0
    Start frame: 0
    Copy of Transfer Flags: 0x00000200
    Number of ISO descriptors: 0

0000  00 ec d2 e8 fb 89 ff ff 53 03 82 03 03 00 2d 3c   ........S.....-<
0010  9d 2d 39 5b 00 00 00 00 b7 46 07 00 8d ff ff ff   .-9[.....F......
0020  40 00 00 00 00 00 00 00 00 00 00 00 00 00 00 00   @...............
0030  00 00 00 00 00 00 00 00 00 02 00 00 00 00 00 00   ................

Frame 174: 66 bytes on wire (528 bits), 66 bytes captured (528 bits) on interface 0
    Interface id: 0 (unknown)
        Interface name: unknown
    Encapsulation type: USB packets with Linux header and padding (115)
    Arrival Time: Jul  1, 2018 15:38:05.578859000 EDT
    [Time shift for this packet: 0.000000000 seconds]
    Epoch Time: 1530473885.578859000 seconds
    [Time delta from previous captured frame: 0.102004000 seconds]
    [Time delta from previous displayed frame: 0.102004000 seconds]
    [Time since reference or first frame: 260.716926000 seconds]
    Frame Number: 174
    Frame Length: 66 bytes (528 bits)
    Capture Length: 66 bytes (528 bits)
    [Frame is marked: False]
    [Frame is ignored: False]
    [Protocols in frame: usb]
USB URB
    [Source: 3.3.2]
    [Destination: host]
    URB id: 0xffff89fbe8d2ec00
    URB type: URB_COMPLETE ('C')
    URB transfer type: URB_BULK (0x03)
    Endpoint: 0x82, Direction: IN
        1... .... = Direction: IN (1)
        .... 0010 = Endpoint number: 2
    Device: 3
    URB bus id: 3
    Device setup request: not relevant ('-')
    Data: present (0)
    URB sec: 1530473885
    URB usec: 578859
    URB status: Success (0)
    URB length [bytes]: 2
    Data length [bytes]: 2
    [Request in: 173]
    [Time from request: 0.102004000 seconds]
    [bInterfaceClass: Printer (0x07)]
    Unused Setup Header
    Interval: 0
    Start frame: 0
    Copy of Transfer Flags: 0x00000200
    Number of ISO descriptors: 0
Leftover Capture Data: 3103

0000  00 ec d2 e8 fb 89 ff ff 43 03 82 03 03 00 2d 00   ........C.....-.
0010  9d 2d 39 5b 00 00 00 00 2b d5 08 00 00 00 00 00   .-9[....+.......
0020  02 00 00 00 02 00 00 00 00 00 00 00 00 00 00 00   ................
0030  00 00 00 00 00 00 00 00 00 02 00 00 00 00 00 00   ................
0040  31 03                                             1.

Frame 175: 64 bytes on wire (512 bits), 64 bytes captured (512 bits) on interface 0
    Interface id: 0 (unknown)
        Interface name: unknown
    Encapsulation type: USB packets with Linux header and padding (115)
    Arrival Time: Jul  1, 2018 15:38:05.629510000 EDT
    [Time shift for this packet: 0.000000000 seconds]
    Epoch Time: 1530473885.629510000 seconds
    [Time delta from previous captured frame: 0.050651000 seconds]
    [Time delta from previous displayed frame: 0.050651000 seconds]
    [Time since reference or first frame: 260.767577000 seconds]
    Frame Number: 175
    Frame Length: 64 bytes (512 bits)
    Capture Length: 64 bytes (512 bits)
    [Frame is marked: False]
    [Frame is ignored: False]
    [Protocols in frame: usb]
USB URB
    [Source: host]
    [Destination: 3.3.2]
    URB id: 0xffff89fbe8d2ec00
    URB type: URB_SUBMIT ('S')
    URB transfer type: URB_BULK (0x03)
    Endpoint: 0x82, Direction: IN
        1... .... = Direction: IN (1)
        .... 0010 = Endpoint number: 2
    Device: 3
    URB bus id: 3
    Device setup request: not relevant ('-')
    Data: not present ('<')
    URB sec: 1530473885
    URB usec: 629510
    URB status: Operation now in progress (-EINPROGRESS) (-115)
    URB length [bytes]: 64
    Data length [bytes]: 0
    [Response in: 176]
    [bInterfaceClass: Printer (0x07)]
    Unused Setup Header
    Interval: 0
    Start frame: 0
    Copy of Transfer Flags: 0x00000200
    Number of ISO descriptors: 0

0000  00 ec d2 e8 fb 89 ff ff 53 03 82 03 03 00 2d 3c   ........S.....-<
0010  9d 2d 39 5b 00 00 00 00 06 9b 09 00 8d ff ff ff   .-9[............
0020  40 00 00 00 00 00 00 00 00 00 00 00 00 00 00 00   @...............
0030  00 00 00 00 00 00 00 00 00 02 00 00 00 00 00 00   ................

Frame 176: 64 bytes on wire (512 bits), 64 bytes captured (512 bits) on interface 0
    Interface id: 0 (unknown)
        Interface name: unknown
    Encapsulation type: USB packets with Linux header and padding (115)
    Arrival Time: Jul  1, 2018 15:38:05.640115000 EDT
    [Time shift for this packet: 0.000000000 seconds]
    Epoch Time: 1530473885.640115000 seconds
    [Time delta from previous captured frame: 0.010605000 seconds]
    [Time delta from previous displayed frame: 0.010605000 seconds]
    [Time since reference or first frame: 260.778182000 seconds]
    Frame Number: 176
    Frame Length: 64 bytes (512 bits)
    Capture Length: 64 bytes (512 bits)
    [Frame is marked: False]
    [Frame is ignored: False]
    [Protocols in frame: usb]
USB URB
    [Source: 3.3.2]
    [Destination: host]
    URB id: 0xffff89fbe8d2ec00
    URB type: URB_COMPLETE ('C')
    URB transfer type: URB_BULK (0x03)
    Endpoint: 0x82, Direction: IN
        1... .... = Direction: IN (1)
        .... 0010 = Endpoint number: 2
    Device: 3
    URB bus id: 3
    Device setup request: not relevant ('-')
    Data: present (0)
    URB sec: 1530473885
    URB usec: 640115
    URB status: No such file or directory (-ENOENT) (-2)
    URB length [bytes]: 0
    Data length [bytes]: 0
    [Request in: 175]
    [Time from request: 0.010605000 seconds]
    [bInterfaceClass: Printer (0x07)]
    Unused Setup Header
    Interval: 0
    Start frame: 0
    Copy of Transfer Flags: 0x00000200
    Number of ISO descriptors: 0

0000  00 ec d2 e8 fb 89 ff ff 43 03 82 03 03 00 2d 00   ........C.....-.
0010  9d 2d 39 5b 00 00 00 00 73 c4 09 00 fe ff ff ff   .-9[....s.......
0020  00 00 00 00 00 00 00 00 00 00 00 00 00 00 00 00   ................
0030  00 00 00 00 00 00 00 00 00 02 00 00 00 00 00 00   ................

Frame 177: 66 bytes on wire (528 bits), 66 bytes captured (528 bits) on interface 0
    Interface id: 0 (unknown)
        Interface name: unknown
    Encapsulation type: USB packets with Linux header and padding (115)
    Arrival Time: Jul  1, 2018 15:38:05.640676000 EDT
    [Time shift for this packet: 0.000000000 seconds]
    Epoch Time: 1530473885.640676000 seconds
    [Time delta from previous captured frame: 0.000561000 seconds]
    [Time delta from previous displayed frame: 0.000561000 seconds]
    [Time since reference or first frame: 260.778743000 seconds]
    Frame Number: 177
    Frame Length: 66 bytes (528 bits)
    Capture Length: 66 bytes (528 bits)
    [Frame is marked: False]
    [Frame is ignored: False]
    [Protocols in frame: usb]
USB URB
    [Source: host]
    [Destination: 3.3.1]
    URB id: 0xffff89fbe8d2ec00
    URB type: URB_SUBMIT ('S')
    URB transfer type: URB_BULK (0x03)
    Endpoint: 0x01, Direction: OUT
        0... .... = Direction: OUT (0)
        .... 0001 = Endpoint number: 1
    Device: 3
    URB bus id: 3
    Device setup request: not relevant ('-')
    Data: present (0)
    URB sec: 1530473885
    URB usec: 640676
    URB status: Operation now in progress (-EINPROGRESS) (-115)
    URB length [bytes]: 2
    Data length [bytes]: 2
    [Response in: 178]
    [bInterfaceClass: Printer (0x07)]
    Unused Setup Header
    Interval: 0
    Start frame: 0
    Copy of Transfer Flags: 0x00000000
    Number of ISO descriptors: 0
Leftover Capture Data: 1b05

0000  00 ec d2 e8 fb 89 ff ff 53 03 01 03 03 00 2d 00   ........S.....-.
0010  9d 2d 39 5b 00 00 00 00 a4 c6 09 00 8d ff ff ff   .-9[............
0020  02 00 00 00 02 00 00 00 00 00 00 00 00 00 00 00   ................
0030  00 00 00 00 00 00 00 00 00 00 00 00 00 00 00 00   ................
0040  1b 05                                             ..

Frame 178: 64 bytes on wire (512 bits), 64 bytes captured (512 bits) on interface 0
    Interface id: 0 (unknown)
        Interface name: unknown
    Encapsulation type: USB packets with Linux header and padding (115)
    Arrival Time: Jul  1, 2018 15:38:05.640734000 EDT
    [Time shift for this packet: 0.000000000 seconds]
    Epoch Time: 1530473885.640734000 seconds
    [Time delta from previous captured frame: 0.000058000 seconds]
    [Time delta from previous displayed frame: 0.000058000 seconds]
    [Time since reference or first frame: 260.778801000 seconds]
    Frame Number: 178
    Frame Length: 64 bytes (512 bits)
    Capture Length: 64 bytes (512 bits)
    [Frame is marked: False]
    [Frame is ignored: False]
    [Protocols in frame: usb]
USB URB
    [Source: 3.3.1]
    [Destination: host]
    URB id: 0xffff89fbe8d2ec00
    URB type: URB_COMPLETE ('C')
    URB transfer type: URB_BULK (0x03)
    Endpoint: 0x01, Direction: OUT
        0... .... = Direction: OUT (0)
        .... 0001 = Endpoint number: 1
    Device: 3
    URB bus id: 3
    Device setup request: not relevant ('-')
    Data: not present ('>')
    URB sec: 1530473885
    URB usec: 640734
    URB status: Success (0)
    URB length [bytes]: 2
    Data length [bytes]: 0
    [Request in: 177]
    [Time from request: 0.000058000 seconds]
    [bInterfaceClass: Printer (0x07)]
    Unused Setup Header
    Interval: 0
    Start frame: 0
    Copy of Transfer Flags: 0x00000000
    Number of ISO descriptors: 0

0000  00 ec d2 e8 fb 89 ff ff 43 03 01 03 03 00 2d 3e   ........C.....->
0010  9d 2d 39 5b 00 00 00 00 de c6 09 00 00 00 00 00   .-9[............
0020  02 00 00 00 00 00 00 00 00 00 00 00 00 00 00 00   ................
0030  00 00 00 00 00 00 00 00 00 00 00 00 00 00 00 00   ................

Frame 179: 64 bytes on wire (512 bits), 64 bytes captured (512 bits) on interface 0
    Interface id: 0 (unknown)
        Interface name: unknown
    Encapsulation type: USB packets with Linux header and padding (115)
    Arrival Time: Jul  1, 2018 15:38:05.641039000 EDT
    [Time shift for this packet: 0.000000000 seconds]
    Epoch Time: 1530473885.641039000 seconds
    [Time delta from previous captured frame: 0.000305000 seconds]
    [Time delta from previous displayed frame: 0.000305000 seconds]
    [Time since reference or first frame: 260.779106000 seconds]
    Frame Number: 179
    Frame Length: 64 bytes (512 bits)
    Capture Length: 64 bytes (512 bits)
    [Frame is marked: False]
    [Frame is ignored: False]
    [Protocols in frame: usb]
USB URB
    [Source: host]
    [Destination: 3.3.2]
    URB id: 0xffff89fbe8d2ec00
    URB type: URB_SUBMIT ('S')
    URB transfer type: URB_BULK (0x03)
    Endpoint: 0x82, Direction: IN
        1... .... = Direction: IN (1)
        .... 0010 = Endpoint number: 2
    Device: 3
    URB bus id: 3
    Device setup request: not relevant ('-')
    Data: not present ('<')
    URB sec: 1530473885
    URB usec: 641039
    URB status: Operation now in progress (-EINPROGRESS) (-115)
    URB length [bytes]: 64
    Data length [bytes]: 0
    [Response in: 180]
    [bInterfaceClass: Printer (0x07)]
    Unused Setup Header
    Interval: 0
    Start frame: 0
    Copy of Transfer Flags: 0x00000200
    Number of ISO descriptors: 0

0000  00 ec d2 e8 fb 89 ff ff 53 03 82 03 03 00 2d 3c   ........S.....-<
0010  9d 2d 39 5b 00 00 00 00 0f c8 09 00 8d ff ff ff   .-9[............
0020  40 00 00 00 00 00 00 00 00 00 00 00 00 00 00 00   @...............
0030  00 00 00 00 00 00 00 00 00 02 00 00 00 00 00 00   ................

Frame 180: 66 bytes on wire (528 bits), 66 bytes captured (528 bits) on interface 0
    Interface id: 0 (unknown)
        Interface name: unknown
    Encapsulation type: USB packets with Linux header and padding (115)
    Arrival Time: Jul  1, 2018 15:38:05.742859000 EDT
    [Time shift for this packet: 0.000000000 seconds]
    Epoch Time: 1530473885.742859000 seconds
    [Time delta from previous captured frame: 0.101820000 seconds]
    [Time delta from previous displayed frame: 0.101820000 seconds]
    [Time since reference or first frame: 260.880926000 seconds]
    Frame Number: 180
    Frame Length: 66 bytes (528 bits)
    Capture Length: 66 bytes (528 bits)
    [Frame is marked: False]
    [Frame is ignored: False]
    [Protocols in frame: usb]
USB URB
    [Source: 3.3.2]
    [Destination: host]
    URB id: 0xffff89fbe8d2ec00
    URB type: URB_COMPLETE ('C')
    URB transfer type: URB_BULK (0x03)
    Endpoint: 0x82, Direction: IN
        1... .... = Direction: IN (1)
        .... 0010 = Endpoint number: 2
    Device: 3
    URB bus id: 3
    Device setup request: not relevant ('-')
    Data: present (0)
    URB sec: 1530473885
    URB usec: 742859
    URB status: Success (0)
    URB length [bytes]: 2
    Data length [bytes]: 2
    [Request in: 179]
    [Time from request: 0.101820000 seconds]
    [bInterfaceClass: Printer (0x07)]
    Unused Setup Header
    Interval: 0
    Start frame: 0
    Copy of Transfer Flags: 0x00000200
    Number of ISO descriptors: 0
Leftover Capture Data: 3103

0000  00 ec d2 e8 fb 89 ff ff 43 03 82 03 03 00 2d 00   ........C.....-.
0010  9d 2d 39 5b 00 00 00 00 cb 55 0b 00 00 00 00 00   .-9[.....U......
0020  02 00 00 00 02 00 00 00 00 00 00 00 00 00 00 00   ................
0030  00 00 00 00 00 00 00 00 00 02 00 00 00 00 00 00   ................
0040  31 03                                             1.

Frame 181: 64 bytes on wire (512 bits), 64 bytes captured (512 bits) on interface 0
    Interface id: 0 (unknown)
        Interface name: unknown
    Encapsulation type: USB packets with Linux header and padding (115)
    Arrival Time: Jul  1, 2018 15:38:05.793491000 EDT
    [Time shift for this packet: 0.000000000 seconds]
    Epoch Time: 1530473885.793491000 seconds
    [Time delta from previous captured frame: 0.050632000 seconds]
    [Time delta from previous displayed frame: 0.050632000 seconds]
    [Time since reference or first frame: 260.931558000 seconds]
    Frame Number: 181
    Frame Length: 64 bytes (512 bits)
    Capture Length: 64 bytes (512 bits)
    [Frame is marked: False]
    [Frame is ignored: False]
    [Protocols in frame: usb]
USB URB
    [Source: host]
    [Destination: 3.3.2]
    URB id: 0xffff89fb74526540
    URB type: URB_SUBMIT ('S')
    URB transfer type: URB_BULK (0x03)
    Endpoint: 0x82, Direction: IN
        1... .... = Direction: IN (1)
        .... 0010 = Endpoint number: 2
    Device: 3
    URB bus id: 3
    Device setup request: not relevant ('-')
    Data: not present ('<')
    URB sec: 1530473885
    URB usec: 793491
    URB status: Operation now in progress (-EINPROGRESS) (-115)
    URB length [bytes]: 64
    Data length [bytes]: 0
    [Response in: 182]
    [bInterfaceClass: Printer (0x07)]
    Unused Setup Header
    Interval: 0
    Start frame: 0
    Copy of Transfer Flags: 0x00000200
    Number of ISO descriptors: 0

0000  40 65 52 74 fb 89 ff ff 53 03 82 03 03 00 2d 3c   @eRt....S.....-<
0010  9d 2d 39 5b 00 00 00 00 93 1b 0c 00 8d ff ff ff   .-9[............
0020  40 00 00 00 00 00 00 00 00 00 00 00 00 00 00 00   @...............
0030  00 00 00 00 00 00 00 00 00 02 00 00 00 00 00 00   ................

Frame 182: 64 bytes on wire (512 bits), 64 bytes captured (512 bits) on interface 0
    Interface id: 0 (unknown)
        Interface name: unknown
    Encapsulation type: USB packets with Linux header and padding (115)
    Arrival Time: Jul  1, 2018 15:38:05.804112000 EDT
    [Time shift for this packet: 0.000000000 seconds]
    Epoch Time: 1530473885.804112000 seconds
    [Time delta from previous captured frame: 0.010621000 seconds]
    [Time delta from previous displayed frame: 0.010621000 seconds]
    [Time since reference or first frame: 260.942179000 seconds]
    Frame Number: 182
    Frame Length: 64 bytes (512 bits)
    Capture Length: 64 bytes (512 bits)
    [Frame is marked: False]
    [Frame is ignored: False]
    [Protocols in frame: usb]
USB URB
    [Source: 3.3.2]
    [Destination: host]
    URB id: 0xffff89fb74526540
    URB type: URB_COMPLETE ('C')
    URB transfer type: URB_BULK (0x03)
    Endpoint: 0x82, Direction: IN
        1... .... = Direction: IN (1)
        .... 0010 = Endpoint number: 2
    Device: 3
    URB bus id: 3
    Device setup request: not relevant ('-')
    Data: present (0)
    URB sec: 1530473885
    URB usec: 804112
    URB status: No such file or directory (-ENOENT) (-2)
    URB length [bytes]: 0
    Data length [bytes]: 0
    [Request in: 181]
    [Time from request: 0.010621000 seconds]
    [bInterfaceClass: Printer (0x07)]
    Unused Setup Header
    Interval: 0
    Start frame: 0
    Copy of Transfer Flags: 0x00000200
    Number of ISO descriptors: 0

0000  40 65 52 74 fb 89 ff ff 43 03 82 03 03 00 2d 00   @eRt....C.....-.
0010  9d 2d 39 5b 00 00 00 00 10 45 0c 00 fe ff ff ff   .-9[.....E......
0020  00 00 00 00 00 00 00 00 00 00 00 00 00 00 00 00   ................
0030  00 00 00 00 00 00 00 00 00 02 00 00 00 00 00 00   ................

Frame 183: 66 bytes on wire (528 bits), 66 bytes captured (528 bits) on interface 0
    Interface id: 0 (unknown)
        Interface name: unknown
    Encapsulation type: USB packets with Linux header and padding (115)
    Arrival Time: Jul  1, 2018 15:38:05.804670000 EDT
    [Time shift for this packet: 0.000000000 seconds]
    Epoch Time: 1530473885.804670000 seconds
    [Time delta from previous captured frame: 0.000558000 seconds]
    [Time delta from previous displayed frame: 0.000558000 seconds]
    [Time since reference or first frame: 260.942737000 seconds]
    Frame Number: 183
    Frame Length: 66 bytes (528 bits)
    Capture Length: 66 bytes (528 bits)
    [Frame is marked: False]
    [Frame is ignored: False]
    [Protocols in frame: usb]
USB URB
    [Source: host]
    [Destination: 3.3.1]
    URB id: 0xffff89fb74526540
    URB type: URB_SUBMIT ('S')
    URB transfer type: URB_BULK (0x03)
    Endpoint: 0x01, Direction: OUT
        0... .... = Direction: OUT (0)
        .... 0001 = Endpoint number: 1
    Device: 3
    URB bus id: 3
    Device setup request: not relevant ('-')
    Data: present (0)
    URB sec: 1530473885
    URB usec: 804670
    URB status: Operation now in progress (-EINPROGRESS) (-115)
    URB length [bytes]: 2
    Data length [bytes]: 2
    [Response in: 184]
    [bInterfaceClass: Printer (0x07)]
    Unused Setup Header
    Interval: 0
    Start frame: 0
    Copy of Transfer Flags: 0x00000000
    Number of ISO descriptors: 0
Leftover Capture Data: 1b05

0000  40 65 52 74 fb 89 ff ff 53 03 01 03 03 00 2d 00   @eRt....S.....-.
0010  9d 2d 39 5b 00 00 00 00 3e 47 0c 00 8d ff ff ff   .-9[....>G......
0020  02 00 00 00 02 00 00 00 00 00 00 00 00 00 00 00   ................
0030  00 00 00 00 00 00 00 00 00 00 00 00 00 00 00 00   ................
0040  1b 05                                             ..

Frame 184: 64 bytes on wire (512 bits), 64 bytes captured (512 bits) on interface 0
    Interface id: 0 (unknown)
        Interface name: unknown
    Encapsulation type: USB packets with Linux header and padding (115)
    Arrival Time: Jul  1, 2018 15:38:05.804728000 EDT
    [Time shift for this packet: 0.000000000 seconds]
    Epoch Time: 1530473885.804728000 seconds
    [Time delta from previous captured frame: 0.000058000 seconds]
    [Time delta from previous displayed frame: 0.000058000 seconds]
    [Time since reference or first frame: 260.942795000 seconds]
    Frame Number: 184
    Frame Length: 64 bytes (512 bits)
    Capture Length: 64 bytes (512 bits)
    [Frame is marked: False]
    [Frame is ignored: False]
    [Protocols in frame: usb]
USB URB
    [Source: 3.3.1]
    [Destination: host]
    URB id: 0xffff89fb74526540
    URB type: URB_COMPLETE ('C')
    URB transfer type: URB_BULK (0x03)
    Endpoint: 0x01, Direction: OUT
        0... .... = Direction: OUT (0)
        .... 0001 = Endpoint number: 1
    Device: 3
    URB bus id: 3
    Device setup request: not relevant ('-')
    Data: not present ('>')
    URB sec: 1530473885
    URB usec: 804728
    URB status: Success (0)
    URB length [bytes]: 2
    Data length [bytes]: 0
    [Request in: 183]
    [Time from request: 0.000058000 seconds]
    [bInterfaceClass: Printer (0x07)]
    Unused Setup Header
    Interval: 0
    Start frame: 0
    Copy of Transfer Flags: 0x00000000
    Number of ISO descriptors: 0

0000  40 65 52 74 fb 89 ff ff 43 03 01 03 03 00 2d 3e   @eRt....C.....->
0010  9d 2d 39 5b 00 00 00 00 78 47 0c 00 00 00 00 00   .-9[....xG......
0020  02 00 00 00 00 00 00 00 00 00 00 00 00 00 00 00   ................
0030  00 00 00 00 00 00 00 00 00 00 00 00 00 00 00 00   ................

Frame 185: 64 bytes on wire (512 bits), 64 bytes captured (512 bits) on interface 0
    Interface id: 0 (unknown)
        Interface name: unknown
    Encapsulation type: USB packets with Linux header and padding (115)
    Arrival Time: Jul  1, 2018 15:38:05.804941000 EDT
    [Time shift for this packet: 0.000000000 seconds]
    Epoch Time: 1530473885.804941000 seconds
    [Time delta from previous captured frame: 0.000213000 seconds]
    [Time delta from previous displayed frame: 0.000213000 seconds]
    [Time since reference or first frame: 260.943008000 seconds]
    Frame Number: 185
    Frame Length: 64 bytes (512 bits)
    Capture Length: 64 bytes (512 bits)
    [Frame is marked: False]
    [Frame is ignored: False]
    [Protocols in frame: usb]
USB URB
    [Source: host]
    [Destination: 3.3.2]
    URB id: 0xffff89fb74526540
    URB type: URB_SUBMIT ('S')
    URB transfer type: URB_BULK (0x03)
    Endpoint: 0x82, Direction: IN
        1... .... = Direction: IN (1)
        .... 0010 = Endpoint number: 2
    Device: 3
    URB bus id: 3
    Device setup request: not relevant ('-')
    Data: not present ('<')
    URB sec: 1530473885
    URB usec: 804941
    URB status: Operation now in progress (-EINPROGRESS) (-115)
    URB length [bytes]: 64
    Data length [bytes]: 0
    [Response in: 186]
    [bInterfaceClass: Printer (0x07)]
    Unused Setup Header
    Interval: 0
    Start frame: 0
    Copy of Transfer Flags: 0x00000200
    Number of ISO descriptors: 0

0000  40 65 52 74 fb 89 ff ff 53 03 82 03 03 00 2d 3c   @eRt....S.....-<
0010  9d 2d 39 5b 00 00 00 00 4d 48 0c 00 8d ff ff ff   .-9[....MH......
0020  40 00 00 00 00 00 00 00 00 00 00 00 00 00 00 00   @...............
0030  00 00 00 00 00 00 00 00 00 02 00 00 00 00 00 00   ................

Frame 186: 66 bytes on wire (528 bits), 66 bytes captured (528 bits) on interface 0
    Interface id: 0 (unknown)
        Interface name: unknown
    Encapsulation type: USB packets with Linux header and padding (115)
    Arrival Time: Jul  1, 2018 15:38:05.906983000 EDT
    [Time shift for this packet: 0.000000000 seconds]
    Epoch Time: 1530473885.906983000 seconds
    [Time delta from previous captured frame: 0.102042000 seconds]
    [Time delta from previous displayed frame: 0.102042000 seconds]
    [Time since reference or first frame: 261.045050000 seconds]
    Frame Number: 186
    Frame Length: 66 bytes (528 bits)
    Capture Length: 66 bytes (528 bits)
    [Frame is marked: False]
    [Frame is ignored: False]
    [Protocols in frame: usb]
USB URB
    [Source: 3.3.2]
    [Destination: host]
    URB id: 0xffff89fb74526540
    URB type: URB_COMPLETE ('C')
    URB transfer type: URB_BULK (0x03)
    Endpoint: 0x82, Direction: IN
        1... .... = Direction: IN (1)
        .... 0010 = Endpoint number: 2
    Device: 3
    URB bus id: 3
    Device setup request: not relevant ('-')
    Data: present (0)
    URB sec: 1530473885
    URB usec: 906983
    URB status: Success (0)
    URB length [bytes]: 2
    Data length [bytes]: 2
    [Request in: 185]
    [Time from request: 0.102042000 seconds]
    [bInterfaceClass: Printer (0x07)]
    Unused Setup Header
    Interval: 0
    Start frame: 0
    Copy of Transfer Flags: 0x00000200
    Number of ISO descriptors: 0
Leftover Capture Data: 3103

0000  40 65 52 74 fb 89 ff ff 43 03 82 03 03 00 2d 00   @eRt....C.....-.
0010  9d 2d 39 5b 00 00 00 00 e7 d6 0d 00 00 00 00 00   .-9[............
0020  02 00 00 00 02 00 00 00 00 00 00 00 00 00 00 00   ................
0030  00 00 00 00 00 00 00 00 00 02 00 00 00 00 00 00   ................
0040  31 03                                             1.

Frame 187: 64 bytes on wire (512 bits), 64 bytes captured (512 bits) on interface 0
    Interface id: 0 (unknown)
        Interface name: unknown
    Encapsulation type: USB packets with Linux header and padding (115)
    Arrival Time: Jul  1, 2018 15:38:05.957725000 EDT
    [Time shift for this packet: 0.000000000 seconds]
    Epoch Time: 1530473885.957725000 seconds
    [Time delta from previous captured frame: 0.050742000 seconds]
    [Time delta from previous displayed frame: 0.050742000 seconds]
    [Time since reference or first frame: 261.095792000 seconds]
    Frame Number: 187
    Frame Length: 64 bytes (512 bits)
    Capture Length: 64 bytes (512 bits)
    [Frame is marked: False]
    [Frame is ignored: False]
    [Protocols in frame: usb]
USB URB
    [Source: host]
    [Destination: 3.3.2]
    URB id: 0xffff89fb74526540
    URB type: URB_SUBMIT ('S')
    URB transfer type: URB_BULK (0x03)
    Endpoint: 0x82, Direction: IN
        1... .... = Direction: IN (1)
        .... 0010 = Endpoint number: 2
    Device: 3
    URB bus id: 3
    Device setup request: not relevant ('-')
    Data: not present ('<')
    URB sec: 1530473885
    URB usec: 957725
    URB status: Operation now in progress (-EINPROGRESS) (-115)
    URB length [bytes]: 64
    Data length [bytes]: 0
    [Response in: 188]
    [bInterfaceClass: Printer (0x07)]
    Unused Setup Header
    Interval: 0
    Start frame: 0
    Copy of Transfer Flags: 0x00000200
    Number of ISO descriptors: 0

0000  40 65 52 74 fb 89 ff ff 53 03 82 03 03 00 2d 3c   @eRt....S.....-<
0010  9d 2d 39 5b 00 00 00 00 1d 9d 0e 00 8d ff ff ff   .-9[............
0020  40 00 00 00 00 00 00 00 00 00 00 00 00 00 00 00   @...............
0030  00 00 00 00 00 00 00 00 00 02 00 00 00 00 00 00   ................

Frame 188: 64 bytes on wire (512 bits), 64 bytes captured (512 bits) on interface 0
    Interface id: 0 (unknown)
        Interface name: unknown
    Encapsulation type: USB packets with Linux header and padding (115)
    Arrival Time: Jul  1, 2018 15:38:05.968068000 EDT
    [Time shift for this packet: 0.000000000 seconds]
    Epoch Time: 1530473885.968068000 seconds
    [Time delta from previous captured frame: 0.010343000 seconds]
    [Time delta from previous displayed frame: 0.010343000 seconds]
    [Time since reference or first frame: 261.106135000 seconds]
    Frame Number: 188
    Frame Length: 64 bytes (512 bits)
    Capture Length: 64 bytes (512 bits)
    [Frame is marked: False]
    [Frame is ignored: False]
    [Protocols in frame: usb]
USB URB
    [Source: 3.3.2]
    [Destination: host]
    URB id: 0xffff89fb74526540
    URB type: URB_COMPLETE ('C')
    URB transfer type: URB_BULK (0x03)
    Endpoint: 0x82, Direction: IN
        1... .... = Direction: IN (1)
        .... 0010 = Endpoint number: 2
    Device: 3
    URB bus id: 3
    Device setup request: not relevant ('-')
    Data: present (0)
    URB sec: 1530473885
    URB usec: 968068
    URB status: No such file or directory (-ENOENT) (-2)
    URB length [bytes]: 0
    Data length [bytes]: 0
    [Request in: 187]
    [Time from request: 0.010343000 seconds]
    [bInterfaceClass: Printer (0x07)]
    Unused Setup Header
    Interval: 0
    Start frame: 0
    Copy of Transfer Flags: 0x00000200
    Number of ISO descriptors: 0

0000  40 65 52 74 fb 89 ff ff 43 03 82 03 03 00 2d 00   @eRt....C.....-.
0010  9d 2d 39 5b 00 00 00 00 84 c5 0e 00 fe ff ff ff   .-9[............
0020  00 00 00 00 00 00 00 00 00 00 00 00 00 00 00 00   ................
0030  00 00 00 00 00 00 00 00 00 02 00 00 00 00 00 00   ................

Frame 189: 66 bytes on wire (528 bits), 66 bytes captured (528 bits) on interface 0
    Interface id: 0 (unknown)
        Interface name: unknown
    Encapsulation type: USB packets with Linux header and padding (115)
    Arrival Time: Jul  1, 2018 15:38:05.968616000 EDT
    [Time shift for this packet: 0.000000000 seconds]
    Epoch Time: 1530473885.968616000 seconds
    [Time delta from previous captured frame: 0.000548000 seconds]
    [Time delta from previous displayed frame: 0.000548000 seconds]
    [Time since reference or first frame: 261.106683000 seconds]
    Frame Number: 189
    Frame Length: 66 bytes (528 bits)
    Capture Length: 66 bytes (528 bits)
    [Frame is marked: False]
    [Frame is ignored: False]
    [Protocols in frame: usb]
USB URB
    [Source: host]
    [Destination: 3.3.1]
    URB id: 0xffff89fb74526540
    URB type: URB_SUBMIT ('S')
    URB transfer type: URB_BULK (0x03)
    Endpoint: 0x01, Direction: OUT
        0... .... = Direction: OUT (0)
        .... 0001 = Endpoint number: 1
    Device: 3
    URB bus id: 3
    Device setup request: not relevant ('-')
    Data: present (0)
    URB sec: 1530473885
    URB usec: 968616
    URB status: Operation now in progress (-EINPROGRESS) (-115)
    URB length [bytes]: 2
    Data length [bytes]: 2
    [Response in: 190]
    [bInterfaceClass: Printer (0x07)]
    Unused Setup Header
    Interval: 0
    Start frame: 0
    Copy of Transfer Flags: 0x00000000
    Number of ISO descriptors: 0
Leftover Capture Data: 1b05

0000  40 65 52 74 fb 89 ff ff 53 03 01 03 03 00 2d 00   @eRt....S.....-.
0010  9d 2d 39 5b 00 00 00 00 a8 c7 0e 00 8d ff ff ff   .-9[............
0020  02 00 00 00 02 00 00 00 00 00 00 00 00 00 00 00   ................
0030  00 00 00 00 00 00 00 00 00 00 00 00 00 00 00 00   ................
0040  1b 05                                             ..

Frame 190: 64 bytes on wire (512 bits), 64 bytes captured (512 bits) on interface 0
    Interface id: 0 (unknown)
        Interface name: unknown
    Encapsulation type: USB packets with Linux header and padding (115)
    Arrival Time: Jul  1, 2018 15:38:05.968672000 EDT
    [Time shift for this packet: 0.000000000 seconds]
    Epoch Time: 1530473885.968672000 seconds
    [Time delta from previous captured frame: 0.000056000 seconds]
    [Time delta from previous displayed frame: 0.000056000 seconds]
    [Time since reference or first frame: 261.106739000 seconds]
    Frame Number: 190
    Frame Length: 64 bytes (512 bits)
    Capture Length: 64 bytes (512 bits)
    [Frame is marked: False]
    [Frame is ignored: False]
    [Protocols in frame: usb]
USB URB
    [Source: 3.3.1]
    [Destination: host]
    URB id: 0xffff89fb74526540
    URB type: URB_COMPLETE ('C')
    URB transfer type: URB_BULK (0x03)
    Endpoint: 0x01, Direction: OUT
        0... .... = Direction: OUT (0)
        .... 0001 = Endpoint number: 1
    Device: 3
    URB bus id: 3
    Device setup request: not relevant ('-')
    Data: not present ('>')
    URB sec: 1530473885
    URB usec: 968672
    URB status: Success (0)
    URB length [bytes]: 2
    Data length [bytes]: 0
    [Request in: 189]
    [Time from request: 0.000056000 seconds]
    [bInterfaceClass: Printer (0x07)]
    Unused Setup Header
    Interval: 0
    Start frame: 0
    Copy of Transfer Flags: 0x00000000
    Number of ISO descriptors: 0

0000  40 65 52 74 fb 89 ff ff 43 03 01 03 03 00 2d 3e   @eRt....C.....->
0010  9d 2d 39 5b 00 00 00 00 e0 c7 0e 00 00 00 00 00   .-9[............
0020  02 00 00 00 00 00 00 00 00 00 00 00 00 00 00 00   ................
0030  00 00 00 00 00 00 00 00 00 00 00 00 00 00 00 00   ................

Frame 191: 64 bytes on wire (512 bits), 64 bytes captured (512 bits) on interface 0
    Interface id: 0 (unknown)
        Interface name: unknown
    Encapsulation type: USB packets with Linux header and padding (115)
    Arrival Time: Jul  1, 2018 15:38:05.968889000 EDT
    [Time shift for this packet: 0.000000000 seconds]
    Epoch Time: 1530473885.968889000 seconds
    [Time delta from previous captured frame: 0.000217000 seconds]
    [Time delta from previous displayed frame: 0.000217000 seconds]
    [Time since reference or first frame: 261.106956000 seconds]
    Frame Number: 191
    Frame Length: 64 bytes (512 bits)
    Capture Length: 64 bytes (512 bits)
    [Frame is marked: False]
    [Frame is ignored: False]
    [Protocols in frame: usb]
USB URB
    [Source: host]
    [Destination: 3.3.2]
    URB id: 0xffff89fb74526540
    URB type: URB_SUBMIT ('S')
    URB transfer type: URB_BULK (0x03)
    Endpoint: 0x82, Direction: IN
        1... .... = Direction: IN (1)
        .... 0010 = Endpoint number: 2
    Device: 3
    URB bus id: 3
    Device setup request: not relevant ('-')
    Data: not present ('<')
    URB sec: 1530473885
    URB usec: 968889
    URB status: Operation now in progress (-EINPROGRESS) (-115)
    URB length [bytes]: 64
    Data length [bytes]: 0
    [Response in: 192]
    [bInterfaceClass: Printer (0x07)]
    Unused Setup Header
    Interval: 0
    Start frame: 0
    Copy of Transfer Flags: 0x00000200
    Number of ISO descriptors: 0

0000  40 65 52 74 fb 89 ff ff 53 03 82 03 03 00 2d 3c   @eRt....S.....-<
0010  9d 2d 39 5b 00 00 00 00 b9 c8 0e 00 8d ff ff ff   .-9[............
0020  40 00 00 00 00 00 00 00 00 00 00 00 00 00 00 00   @...............
0030  00 00 00 00 00 00 00 00 00 02 00 00 00 00 00 00   ................

Frame 192: 66 bytes on wire (528 bits), 66 bytes captured (528 bits) on interface 0
    Interface id: 0 (unknown)
        Interface name: unknown
    Encapsulation type: USB packets with Linux header and padding (115)
    Arrival Time: Jul  1, 2018 15:38:06.070967000 EDT
    [Time shift for this packet: 0.000000000 seconds]
    Epoch Time: 1530473886.070967000 seconds
    [Time delta from previous captured frame: 0.102078000 seconds]
    [Time delta from previous displayed frame: 0.102078000 seconds]
    [Time since reference or first frame: 261.209034000 seconds]
    Frame Number: 192
    Frame Length: 66 bytes (528 bits)
    Capture Length: 66 bytes (528 bits)
    [Frame is marked: False]
    [Frame is ignored: False]
    [Protocols in frame: usb]
USB URB
    [Source: 3.3.2]
    [Destination: host]
    URB id: 0xffff89fb74526540
    URB type: URB_COMPLETE ('C')
    URB transfer type: URB_BULK (0x03)
    Endpoint: 0x82, Direction: IN
        1... .... = Direction: IN (1)
        .... 0010 = Endpoint number: 2
    Device: 3
    URB bus id: 3
    Device setup request: not relevant ('-')
    Data: present (0)
    URB sec: 1530473886
    URB usec: 70967
    URB status: Success (0)
    URB length [bytes]: 2
    Data length [bytes]: 2
    [Request in: 191]
    [Time from request: 0.102078000 seconds]
    [bInterfaceClass: Printer (0x07)]
    Unused Setup Header
    Interval: 0
    Start frame: 0
    Copy of Transfer Flags: 0x00000200
    Number of ISO descriptors: 0
Leftover Capture Data: 3103

0000  40 65 52 74 fb 89 ff ff 43 03 82 03 03 00 2d 00   @eRt....C.....-.
0010  9e 2d 39 5b 00 00 00 00 37 15 01 00 00 00 00 00   .-9[....7.......
0020  02 00 00 00 02 00 00 00 00 00 00 00 00 00 00 00   ................
0030  00 00 00 00 00 00 00 00 00 02 00 00 00 00 00 00   ................
0040  31 03                                             1.

Frame 193: 64 bytes on wire (512 bits), 64 bytes captured (512 bits) on interface 0
    Interface id: 0 (unknown)
        Interface name: unknown
    Encapsulation type: USB packets with Linux header and padding (115)
    Arrival Time: Jul  1, 2018 15:38:06.121707000 EDT
    [Time shift for this packet: 0.000000000 seconds]
    Epoch Time: 1530473886.121707000 seconds
    [Time delta from previous captured frame: 0.050740000 seconds]
    [Time delta from previous displayed frame: 0.050740000 seconds]
    [Time since reference or first frame: 261.259774000 seconds]
    Frame Number: 193
    Frame Length: 64 bytes (512 bits)
    Capture Length: 64 bytes (512 bits)
    [Frame is marked: False]
    [Frame is ignored: False]
    [Protocols in frame: usb]
USB URB
    [Source: host]
    [Destination: 3.3.2]
    URB id: 0xffff89fb74526540
    URB type: URB_SUBMIT ('S')
    URB transfer type: URB_BULK (0x03)
    Endpoint: 0x82, Direction: IN
        1... .... = Direction: IN (1)
        .... 0010 = Endpoint number: 2
    Device: 3
    URB bus id: 3
    Device setup request: not relevant ('-')
    Data: not present ('<')
    URB sec: 1530473886
    URB usec: 121707
    URB status: Operation now in progress (-EINPROGRESS) (-115)
    URB length [bytes]: 64
    Data length [bytes]: 0
    [Response in: 194]
    [bInterfaceClass: Printer (0x07)]
    Unused Setup Header
    Interval: 0
    Start frame: 0
    Copy of Transfer Flags: 0x00000200
    Number of ISO descriptors: 0

0000  40 65 52 74 fb 89 ff ff 53 03 82 03 03 00 2d 3c   @eRt....S.....-<
0010  9e 2d 39 5b 00 00 00 00 6b db 01 00 8d ff ff ff   .-9[....k.......
0020  40 00 00 00 00 00 00 00 00 00 00 00 00 00 00 00   @...............
0030  00 00 00 00 00 00 00 00 00 02 00 00 00 00 00 00   ................

Frame 194: 64 bytes on wire (512 bits), 64 bytes captured (512 bits) on interface 0
    Interface id: 0 (unknown)
        Interface name: unknown
    Encapsulation type: USB packets with Linux header and padding (115)
    Arrival Time: Jul  1, 2018 15:38:06.132078000 EDT
    [Time shift for this packet: 0.000000000 seconds]
    Epoch Time: 1530473886.132078000 seconds
    [Time delta from previous captured frame: 0.010371000 seconds]
    [Time delta from previous displayed frame: 0.010371000 seconds]
    [Time since reference or first frame: 261.270145000 seconds]
    Frame Number: 194
    Frame Length: 64 bytes (512 bits)
    Capture Length: 64 bytes (512 bits)
    [Frame is marked: False]
    [Frame is ignored: False]
    [Protocols in frame: usb]
USB URB
    [Source: 3.3.2]
    [Destination: host]
    URB id: 0xffff89fb74526540
    URB type: URB_COMPLETE ('C')
    URB transfer type: URB_BULK (0x03)
    Endpoint: 0x82, Direction: IN
        1... .... = Direction: IN (1)
        .... 0010 = Endpoint number: 2
    Device: 3
    URB bus id: 3
    Device setup request: not relevant ('-')
    Data: present (0)
    URB sec: 1530473886
    URB usec: 132078
    URB status: No such file or directory (-ENOENT) (-2)
    URB length [bytes]: 0
    Data length [bytes]: 0
    [Request in: 193]
    [Time from request: 0.010371000 seconds]
    [bInterfaceClass: Printer (0x07)]
    Unused Setup Header
    Interval: 0
    Start frame: 0
    Copy of Transfer Flags: 0x00000200
    Number of ISO descriptors: 0

0000  40 65 52 74 fb 89 ff ff 43 03 82 03 03 00 2d 00   @eRt....C.....-.
0010  9e 2d 39 5b 00 00 00 00 ee 03 02 00 fe ff ff ff   .-9[............
0020  00 00 00 00 00 00 00 00 00 00 00 00 00 00 00 00   ................
0030  00 00 00 00 00 00 00 00 00 02 00 00 00 00 00 00   ................

Frame 195: 66 bytes on wire (528 bits), 66 bytes captured (528 bits) on interface 0
    Interface id: 0 (unknown)
        Interface name: unknown
    Encapsulation type: USB packets with Linux header and padding (115)
    Arrival Time: Jul  1, 2018 15:38:06.132627000 EDT
    [Time shift for this packet: 0.000000000 seconds]
    Epoch Time: 1530473886.132627000 seconds
    [Time delta from previous captured frame: 0.000549000 seconds]
    [Time delta from previous displayed frame: 0.000549000 seconds]
    [Time since reference or first frame: 261.270694000 seconds]
    Frame Number: 195
    Frame Length: 66 bytes (528 bits)
    Capture Length: 66 bytes (528 bits)
    [Frame is marked: False]
    [Frame is ignored: False]
    [Protocols in frame: usb]
USB URB
    [Source: host]
    [Destination: 3.3.1]
    URB id: 0xffff89fb74526540
    URB type: URB_SUBMIT ('S')
    URB transfer type: URB_BULK (0x03)
    Endpoint: 0x01, Direction: OUT
        0... .... = Direction: OUT (0)
        .... 0001 = Endpoint number: 1
    Device: 3
    URB bus id: 3
    Device setup request: not relevant ('-')
    Data: present (0)
    URB sec: 1530473886
    URB usec: 132627
    URB status: Operation now in progress (-EINPROGRESS) (-115)
    URB length [bytes]: 2
    Data length [bytes]: 2
    [Response in: 196]
    [bInterfaceClass: Printer (0x07)]
    Unused Setup Header
    Interval: 0
    Start frame: 0
    Copy of Transfer Flags: 0x00000000
    Number of ISO descriptors: 0
Leftover Capture Data: 1b05

0000  40 65 52 74 fb 89 ff ff 53 03 01 03 03 00 2d 00   @eRt....S.....-.
0010  9e 2d 39 5b 00 00 00 00 13 06 02 00 8d ff ff ff   .-9[............
0020  02 00 00 00 02 00 00 00 00 00 00 00 00 00 00 00   ................
0030  00 00 00 00 00 00 00 00 00 00 00 00 00 00 00 00   ................
0040  1b 05                                             ..

Frame 196: 64 bytes on wire (512 bits), 64 bytes captured (512 bits) on interface 0
    Interface id: 0 (unknown)
        Interface name: unknown
    Encapsulation type: USB packets with Linux header and padding (115)
    Arrival Time: Jul  1, 2018 15:38:06.132685000 EDT
    [Time shift for this packet: 0.000000000 seconds]
    Epoch Time: 1530473886.132685000 seconds
    [Time delta from previous captured frame: 0.000058000 seconds]
    [Time delta from previous displayed frame: 0.000058000 seconds]
    [Time since reference or first frame: 261.270752000 seconds]
    Frame Number: 196
    Frame Length: 64 bytes (512 bits)
    Capture Length: 64 bytes (512 bits)
    [Frame is marked: False]
    [Frame is ignored: False]
    [Protocols in frame: usb]
USB URB
    [Source: 3.3.1]
    [Destination: host]
    URB id: 0xffff89fb74526540
    URB type: URB_COMPLETE ('C')
    URB transfer type: URB_BULK (0x03)
    Endpoint: 0x01, Direction: OUT
        0... .... = Direction: OUT (0)
        .... 0001 = Endpoint number: 1
    Device: 3
    URB bus id: 3
    Device setup request: not relevant ('-')
    Data: not present ('>')
    URB sec: 1530473886
    URB usec: 132685
    URB status: Success (0)
    URB length [bytes]: 2
    Data length [bytes]: 0
    [Request in: 195]
    [Time from request: 0.000058000 seconds]
    [bInterfaceClass: Printer (0x07)]
    Unused Setup Header
    Interval: 0
    Start frame: 0
    Copy of Transfer Flags: 0x00000000
    Number of ISO descriptors: 0

0000  40 65 52 74 fb 89 ff ff 43 03 01 03 03 00 2d 3e   @eRt....C.....->
0010  9e 2d 39 5b 00 00 00 00 4d 06 02 00 00 00 00 00   .-9[....M.......
0020  02 00 00 00 00 00 00 00 00 00 00 00 00 00 00 00   ................
0030  00 00 00 00 00 00 00 00 00 00 00 00 00 00 00 00   ................

Frame 197: 64 bytes on wire (512 bits), 64 bytes captured (512 bits) on interface 0
    Interface id: 0 (unknown)
        Interface name: unknown
    Encapsulation type: USB packets with Linux header and padding (115)
    Arrival Time: Jul  1, 2018 15:38:06.132903000 EDT
    [Time shift for this packet: 0.000000000 seconds]
    Epoch Time: 1530473886.132903000 seconds
    [Time delta from previous captured frame: 0.000218000 seconds]
    [Time delta from previous displayed frame: 0.000218000 seconds]
    [Time since reference or first frame: 261.270970000 seconds]
    Frame Number: 197
    Frame Length: 64 bytes (512 bits)
    Capture Length: 64 bytes (512 bits)
    [Frame is marked: False]
    [Frame is ignored: False]
    [Protocols in frame: usb]
USB URB
    [Source: host]
    [Destination: 3.3.2]
    URB id: 0xffff89fb74526540
    URB type: URB_SUBMIT ('S')
    URB transfer type: URB_BULK (0x03)
    Endpoint: 0x82, Direction: IN
        1... .... = Direction: IN (1)
        .... 0010 = Endpoint number: 2
    Device: 3
    URB bus id: 3
    Device setup request: not relevant ('-')
    Data: not present ('<')
    URB sec: 1530473886
    URB usec: 132903
    URB status: Operation now in progress (-EINPROGRESS) (-115)
    URB length [bytes]: 64
    Data length [bytes]: 0
    [Response in: 198]
    [bInterfaceClass: Printer (0x07)]
    Unused Setup Header
    Interval: 0
    Start frame: 0
    Copy of Transfer Flags: 0x00000200
    Number of ISO descriptors: 0

0000  40 65 52 74 fb 89 ff ff 53 03 82 03 03 00 2d 3c   @eRt....S.....-<
0010  9e 2d 39 5b 00 00 00 00 27 07 02 00 8d ff ff ff   .-9[....'.......
0020  40 00 00 00 00 00 00 00 00 00 00 00 00 00 00 00   @...............
0030  00 00 00 00 00 00 00 00 00 02 00 00 00 00 00 00   ................

Frame 198: 66 bytes on wire (528 bits), 66 bytes captured (528 bits) on interface 0
    Interface id: 0 (unknown)
        Interface name: unknown
    Encapsulation type: USB packets with Linux header and padding (115)
    Arrival Time: Jul  1, 2018 15:38:06.234933000 EDT
    [Time shift for this packet: 0.000000000 seconds]
    Epoch Time: 1530473886.234933000 seconds
    [Time delta from previous captured frame: 0.102030000 seconds]
    [Time delta from previous displayed frame: 0.102030000 seconds]
    [Time since reference or first frame: 261.373000000 seconds]
    Frame Number: 198
    Frame Length: 66 bytes (528 bits)
    Capture Length: 66 bytes (528 bits)
    [Frame is marked: False]
    [Frame is ignored: False]
    [Protocols in frame: usb]
USB URB
    [Source: 3.3.2]
    [Destination: host]
    URB id: 0xffff89fb74526540
    URB type: URB_COMPLETE ('C')
    URB transfer type: URB_BULK (0x03)
    Endpoint: 0x82, Direction: IN
        1... .... = Direction: IN (1)
        .... 0010 = Endpoint number: 2
    Device: 3
    URB bus id: 3
    Device setup request: not relevant ('-')
    Data: present (0)
    URB sec: 1530473886
    URB usec: 234933
    URB status: Success (0)
    URB length [bytes]: 2
    Data length [bytes]: 2
    [Request in: 197]
    [Time from request: 0.102030000 seconds]
    [bInterfaceClass: Printer (0x07)]
    Unused Setup Header
    Interval: 0
    Start frame: 0
    Copy of Transfer Flags: 0x00000200
    Number of ISO descriptors: 0
Leftover Capture Data: 3103

0000  40 65 52 74 fb 89 ff ff 43 03 82 03 03 00 2d 00   @eRt....C.....-.
0010  9e 2d 39 5b 00 00 00 00 b5 95 03 00 00 00 00 00   .-9[............
0020  02 00 00 00 02 00 00 00 00 00 00 00 00 00 00 00   ................
0030  00 00 00 00 00 00 00 00 00 02 00 00 00 00 00 00   ................
0040  31 03                                             1.

Frame 199: 64 bytes on wire (512 bits), 64 bytes captured (512 bits) on interface 0
    Interface id: 0 (unknown)
        Interface name: unknown
    Encapsulation type: USB packets with Linux header and padding (115)
    Arrival Time: Jul  1, 2018 15:38:06.285700000 EDT
    [Time shift for this packet: 0.000000000 seconds]
    Epoch Time: 1530473886.285700000 seconds
    [Time delta from previous captured frame: 0.050767000 seconds]
    [Time delta from previous displayed frame: 0.050767000 seconds]
    [Time since reference or first frame: 261.423767000 seconds]
    Frame Number: 199
    Frame Length: 64 bytes (512 bits)
    Capture Length: 64 bytes (512 bits)
    [Frame is marked: False]
    [Frame is ignored: False]
    [Protocols in frame: usb]
USB URB
    [Source: host]
    [Destination: 3.3.2]
    URB id: 0xffff89fb74526540
    URB type: URB_SUBMIT ('S')
    URB transfer type: URB_BULK (0x03)
    Endpoint: 0x82, Direction: IN
        1... .... = Direction: IN (1)
        .... 0010 = Endpoint number: 2
    Device: 3
    URB bus id: 3
    Device setup request: not relevant ('-')
    Data: not present ('<')
    URB sec: 1530473886
    URB usec: 285700
    URB status: Operation now in progress (-EINPROGRESS) (-115)
    URB length [bytes]: 64
    Data length [bytes]: 0
    [Response in: 200]
    [bInterfaceClass: Printer (0x07)]
    Unused Setup Header
    Interval: 0
    Start frame: 0
    Copy of Transfer Flags: 0x00000200
    Number of ISO descriptors: 0

0000  40 65 52 74 fb 89 ff ff 53 03 82 03 03 00 2d 3c   @eRt....S.....-<
0010  9e 2d 39 5b 00 00 00 00 04 5c 04 00 8d ff ff ff   .-9[.....\......
0020  40 00 00 00 00 00 00 00 00 00 00 00 00 00 00 00   @...............
0030  00 00 00 00 00 00 00 00 00 02 00 00 00 00 00 00   ................

Frame 200: 64 bytes on wire (512 bits), 64 bytes captured (512 bits) on interface 0
    Interface id: 0 (unknown)
        Interface name: unknown
    Encapsulation type: USB packets with Linux header and padding (115)
    Arrival Time: Jul  1, 2018 15:38:06.296078000 EDT
    [Time shift for this packet: 0.000000000 seconds]
    Epoch Time: 1530473886.296078000 seconds
    [Time delta from previous captured frame: 0.010378000 seconds]
    [Time delta from previous displayed frame: 0.010378000 seconds]
    [Time since reference or first frame: 261.434145000 seconds]
    Frame Number: 200
    Frame Length: 64 bytes (512 bits)
    Capture Length: 64 bytes (512 bits)
    [Frame is marked: False]
    [Frame is ignored: False]
    [Protocols in frame: usb]
USB URB
    [Source: 3.3.2]
    [Destination: host]
    URB id: 0xffff89fb74526540
    URB type: URB_COMPLETE ('C')
    URB transfer type: URB_BULK (0x03)
    Endpoint: 0x82, Direction: IN
        1... .... = Direction: IN (1)
        .... 0010 = Endpoint number: 2
    Device: 3
    URB bus id: 3
    Device setup request: not relevant ('-')
    Data: present (0)
    URB sec: 1530473886
    URB usec: 296078
    URB status: No such file or directory (-ENOENT) (-2)
    URB length [bytes]: 0
    Data length [bytes]: 0
    [Request in: 199]
    [Time from request: 0.010378000 seconds]
    [bInterfaceClass: Printer (0x07)]
    Unused Setup Header
    Interval: 0
    Start frame: 0
    Copy of Transfer Flags: 0x00000200
    Number of ISO descriptors: 0

0000  40 65 52 74 fb 89 ff ff 43 03 82 03 03 00 2d 00   @eRt....C.....-.
0010  9e 2d 39 5b 00 00 00 00 8e 84 04 00 fe ff ff ff   .-9[............
0020  00 00 00 00 00 00 00 00 00 00 00 00 00 00 00 00   ................
0030  00 00 00 00 00 00 00 00 00 02 00 00 00 00 00 00   ................

Frame 201: 66 bytes on wire (528 bits), 66 bytes captured (528 bits) on interface 0
    Interface id: 0 (unknown)
        Interface name: unknown
    Encapsulation type: USB packets with Linux header and padding (115)
    Arrival Time: Jul  1, 2018 15:38:06.296583000 EDT
    [Time shift for this packet: 0.000000000 seconds]
    Epoch Time: 1530473886.296583000 seconds
    [Time delta from previous captured frame: 0.000505000 seconds]
    [Time delta from previous displayed frame: 0.000505000 seconds]
    [Time since reference or first frame: 261.434650000 seconds]
    Frame Number: 201
    Frame Length: 66 bytes (528 bits)
    Capture Length: 66 bytes (528 bits)
    [Frame is marked: False]
    [Frame is ignored: False]
    [Protocols in frame: usb]
USB URB
    [Source: host]
    [Destination: 3.3.1]
    URB id: 0xffff89fb74526540
    URB type: URB_SUBMIT ('S')
    URB transfer type: URB_BULK (0x03)
    Endpoint: 0x01, Direction: OUT
        0... .... = Direction: OUT (0)
        .... 0001 = Endpoint number: 1
    Device: 3
    URB bus id: 3
    Device setup request: not relevant ('-')
    Data: present (0)
    URB sec: 1530473886
    URB usec: 296583
    URB status: Operation now in progress (-EINPROGRESS) (-115)
    URB length [bytes]: 2
    Data length [bytes]: 2
    [Response in: 202]
    [bInterfaceClass: Printer (0x07)]
    Unused Setup Header
    Interval: 0
    Start frame: 0
    Copy of Transfer Flags: 0x00000000
    Number of ISO descriptors: 0
Leftover Capture Data: 1b05

0000  40 65 52 74 fb 89 ff ff 53 03 01 03 03 00 2d 00   @eRt....S.....-.
0010  9e 2d 39 5b 00 00 00 00 87 86 04 00 8d ff ff ff   .-9[............
0020  02 00 00 00 02 00 00 00 00 00 00 00 00 00 00 00   ................
0030  00 00 00 00 00 00 00 00 00 00 00 00 00 00 00 00   ................
0040  1b 05                                             ..

Frame 202: 64 bytes on wire (512 bits), 64 bytes captured (512 bits) on interface 0
    Interface id: 0 (unknown)
        Interface name: unknown
    Encapsulation type: USB packets with Linux header and padding (115)
    Arrival Time: Jul  1, 2018 15:38:06.296643000 EDT
    [Time shift for this packet: 0.000000000 seconds]
    Epoch Time: 1530473886.296643000 seconds
    [Time delta from previous captured frame: 0.000060000 seconds]
    [Time delta from previous displayed frame: 0.000060000 seconds]
    [Time since reference or first frame: 261.434710000 seconds]
    Frame Number: 202
    Frame Length: 64 bytes (512 bits)
    Capture Length: 64 bytes (512 bits)
    [Frame is marked: False]
    [Frame is ignored: False]
    [Protocols in frame: usb]
USB URB
    [Source: 3.3.1]
    [Destination: host]
    URB id: 0xffff89fb74526540
    URB type: URB_COMPLETE ('C')
    URB transfer type: URB_BULK (0x03)
    Endpoint: 0x01, Direction: OUT
        0... .... = Direction: OUT (0)
        .... 0001 = Endpoint number: 1
    Device: 3
    URB bus id: 3
    Device setup request: not relevant ('-')
    Data: not present ('>')
    URB sec: 1530473886
    URB usec: 296643
    URB status: Success (0)
    URB length [bytes]: 2
    Data length [bytes]: 0
    [Request in: 201]
    [Time from request: 0.000060000 seconds]
    [bInterfaceClass: Printer (0x07)]
    Unused Setup Header
    Interval: 0
    Start frame: 0
    Copy of Transfer Flags: 0x00000000
    Number of ISO descriptors: 0

0000  40 65 52 74 fb 89 ff ff 43 03 01 03 03 00 2d 3e   @eRt....C.....->
0010  9e 2d 39 5b 00 00 00 00 c3 86 04 00 00 00 00 00   .-9[............
0020  02 00 00 00 00 00 00 00 00 00 00 00 00 00 00 00   ................
0030  00 00 00 00 00 00 00 00 00 00 00 00 00 00 00 00   ................

Frame 203: 64 bytes on wire (512 bits), 64 bytes captured (512 bits) on interface 0
    Interface id: 0 (unknown)
        Interface name: unknown
    Encapsulation type: USB packets with Linux header and padding (115)
    Arrival Time: Jul  1, 2018 15:38:06.296857000 EDT
    [Time shift for this packet: 0.000000000 seconds]
    Epoch Time: 1530473886.296857000 seconds
    [Time delta from previous captured frame: 0.000214000 seconds]
    [Time delta from previous displayed frame: 0.000214000 seconds]
    [Time since reference or first frame: 261.434924000 seconds]
    Frame Number: 203
    Frame Length: 64 bytes (512 bits)
    Capture Length: 64 bytes (512 bits)
    [Frame is marked: False]
    [Frame is ignored: False]
    [Protocols in frame: usb]
USB URB
    [Source: host]
    [Destination: 3.3.2]
    URB id: 0xffff89fb74526540
    URB type: URB_SUBMIT ('S')
    URB transfer type: URB_BULK (0x03)
    Endpoint: 0x82, Direction: IN
        1... .... = Direction: IN (1)
        .... 0010 = Endpoint number: 2
    Device: 3
    URB bus id: 3
    Device setup request: not relevant ('-')
    Data: not present ('<')
    URB sec: 1530473886
    URB usec: 296857
    URB status: Operation now in progress (-EINPROGRESS) (-115)
    URB length [bytes]: 64
    Data length [bytes]: 0
    [Response in: 204]
    [bInterfaceClass: Printer (0x07)]
    Unused Setup Header
    Interval: 0
    Start frame: 0
    Copy of Transfer Flags: 0x00000200
    Number of ISO descriptors: 0

0000  40 65 52 74 fb 89 ff ff 53 03 82 03 03 00 2d 3c   @eRt....S.....-<
0010  9e 2d 39 5b 00 00 00 00 99 87 04 00 8d ff ff ff   .-9[............
0020  40 00 00 00 00 00 00 00 00 00 00 00 00 00 00 00   @...............
0030  00 00 00 00 00 00 00 00 00 02 00 00 00 00 00 00   ................

Frame 204: 66 bytes on wire (528 bits), 66 bytes captured (528 bits) on interface 0
    Interface id: 0 (unknown)
        Interface name: unknown
    Encapsulation type: USB packets with Linux header and padding (115)
    Arrival Time: Jul  1, 2018 15:38:06.398858000 EDT
    [Time shift for this packet: 0.000000000 seconds]
    Epoch Time: 1530473886.398858000 seconds
    [Time delta from previous captured frame: 0.102001000 seconds]
    [Time delta from previous displayed frame: 0.102001000 seconds]
    [Time since reference or first frame: 261.536925000 seconds]
    Frame Number: 204
    Frame Length: 66 bytes (528 bits)
    Capture Length: 66 bytes (528 bits)
    [Frame is marked: False]
    [Frame is ignored: False]
    [Protocols in frame: usb]
USB URB
    [Source: 3.3.2]
    [Destination: host]
    URB id: 0xffff89fb74526540
    URB type: URB_COMPLETE ('C')
    URB transfer type: URB_BULK (0x03)
    Endpoint: 0x82, Direction: IN
        1... .... = Direction: IN (1)
        .... 0010 = Endpoint number: 2
    Device: 3
    URB bus id: 3
    Device setup request: not relevant ('-')
    Data: present (0)
    URB sec: 1530473886
    URB usec: 398858
    URB status: Success (0)
    URB length [bytes]: 2
    Data length [bytes]: 2
    [Request in: 203]
    [Time from request: 0.102001000 seconds]
    [bInterfaceClass: Printer (0x07)]
    Unused Setup Header
    Interval: 0
    Start frame: 0
    Copy of Transfer Flags: 0x00000200
    Number of ISO descriptors: 0
Leftover Capture Data: 3103

0000  40 65 52 74 fb 89 ff ff 43 03 82 03 03 00 2d 00   @eRt....C.....-.
0010  9e 2d 39 5b 00 00 00 00 0a 16 06 00 00 00 00 00   .-9[............
0020  02 00 00 00 02 00 00 00 00 00 00 00 00 00 00 00   ................
0030  00 00 00 00 00 00 00 00 00 02 00 00 00 00 00 00   ................
0040  31 03                                             1.

Frame 205: 64 bytes on wire (512 bits), 64 bytes captured (512 bits) on interface 0
    Interface id: 0 (unknown)
        Interface name: unknown
    Encapsulation type: USB packets with Linux header and padding (115)
    Arrival Time: Jul  1, 2018 15:38:06.449584000 EDT
    [Time shift for this packet: 0.000000000 seconds]
    Epoch Time: 1530473886.449584000 seconds
    [Time delta from previous captured frame: 0.050726000 seconds]
    [Time delta from previous displayed frame: 0.050726000 seconds]
    [Time since reference or first frame: 261.587651000 seconds]
    Frame Number: 205
    Frame Length: 64 bytes (512 bits)
    Capture Length: 64 bytes (512 bits)
    [Frame is marked: False]
    [Frame is ignored: False]
    [Protocols in frame: usb]
USB URB
    [Source: host]
    [Destination: 3.3.2]
    URB id: 0xffff89fb74526540
    URB type: URB_SUBMIT ('S')
    URB transfer type: URB_BULK (0x03)
    Endpoint: 0x82, Direction: IN
        1... .... = Direction: IN (1)
        .... 0010 = Endpoint number: 2
    Device: 3
    URB bus id: 3
    Device setup request: not relevant ('-')
    Data: not present ('<')
    URB sec: 1530473886
    URB usec: 449584
    URB status: Operation now in progress (-EINPROGRESS) (-115)
    URB length [bytes]: 64
    Data length [bytes]: 0
    [Response in: 206]
    [bInterfaceClass: Printer (0x07)]
    Unused Setup Header
    Interval: 0
    Start frame: 0
    Copy of Transfer Flags: 0x00000200
    Number of ISO descriptors: 0

0000  40 65 52 74 fb 89 ff ff 53 03 82 03 03 00 2d 3c   @eRt....S.....-<
0010  9e 2d 39 5b 00 00 00 00 30 dc 06 00 8d ff ff ff   .-9[....0.......
0020  40 00 00 00 00 00 00 00 00 00 00 00 00 00 00 00   @...............
0030  00 00 00 00 00 00 00 00 00 02 00 00 00 00 00 00   ................

Frame 206: 64 bytes on wire (512 bits), 64 bytes captured (512 bits) on interface 0
    Interface id: 0 (unknown)
        Interface name: unknown
    Encapsulation type: USB packets with Linux header and padding (115)
    Arrival Time: Jul  1, 2018 15:38:06.460053000 EDT
    [Time shift for this packet: 0.000000000 seconds]
    Epoch Time: 1530473886.460053000 seconds
    [Time delta from previous captured frame: 0.010469000 seconds]
    [Time delta from previous displayed frame: 0.010469000 seconds]
    [Time since reference or first frame: 261.598120000 seconds]
    Frame Number: 206
    Frame Length: 64 bytes (512 bits)
    Capture Length: 64 bytes (512 bits)
    [Frame is marked: False]
    [Frame is ignored: False]
    [Protocols in frame: usb]
USB URB
    [Source: 3.3.2]
    [Destination: host]
    URB id: 0xffff89fb74526540
    URB type: URB_COMPLETE ('C')
    URB transfer type: URB_BULK (0x03)
    Endpoint: 0x82, Direction: IN
        1... .... = Direction: IN (1)
        .... 0010 = Endpoint number: 2
    Device: 3
    URB bus id: 3
    Device setup request: not relevant ('-')
    Data: present (0)
    URB sec: 1530473886
    URB usec: 460053
    URB status: No such file or directory (-ENOENT) (-2)
    URB length [bytes]: 0
    Data length [bytes]: 0
    [Request in: 205]
    [Time from request: 0.010469000 seconds]
    [bInterfaceClass: Printer (0x07)]
    Unused Setup Header
    Interval: 0
    Start frame: 0
    Copy of Transfer Flags: 0x00000200
    Number of ISO descriptors: 0

0000  40 65 52 74 fb 89 ff ff 43 03 82 03 03 00 2d 00   @eRt....C.....-.
0010  9e 2d 39 5b 00 00 00 00 15 05 07 00 fe ff ff ff   .-9[............
0020  00 00 00 00 00 00 00 00 00 00 00 00 00 00 00 00   ................
0030  00 00 00 00 00 00 00 00 00 02 00 00 00 00 00 00   ................

Frame 207: 66 bytes on wire (528 bits), 66 bytes captured (528 bits) on interface 0
    Interface id: 0 (unknown)
        Interface name: unknown
    Encapsulation type: USB packets with Linux header and padding (115)
    Arrival Time: Jul  1, 2018 15:38:06.460632000 EDT
    [Time shift for this packet: 0.000000000 seconds]
    Epoch Time: 1530473886.460632000 seconds
    [Time delta from previous captured frame: 0.000579000 seconds]
    [Time delta from previous displayed frame: 0.000579000 seconds]
    [Time since reference or first frame: 261.598699000 seconds]
    Frame Number: 207
    Frame Length: 66 bytes (528 bits)
    Capture Length: 66 bytes (528 bits)
    [Frame is marked: False]
    [Frame is ignored: False]
    [Protocols in frame: usb]
USB URB
    [Source: host]
    [Destination: 3.3.1]
    URB id: 0xffff89fc655e2600
    URB type: URB_SUBMIT ('S')
    URB transfer type: URB_BULK (0x03)
    Endpoint: 0x01, Direction: OUT
        0... .... = Direction: OUT (0)
        .... 0001 = Endpoint number: 1
    Device: 3
    URB bus id: 3
    Device setup request: not relevant ('-')
    Data: present (0)
    URB sec: 1530473886
    URB usec: 460632
    URB status: Operation now in progress (-EINPROGRESS) (-115)
    URB length [bytes]: 2
    Data length [bytes]: 2
    [Response in: 208]
    [bInterfaceClass: Printer (0x07)]
    Unused Setup Header
    Interval: 0
    Start frame: 0
    Copy of Transfer Flags: 0x00000000
    Number of ISO descriptors: 0
Leftover Capture Data: 1b05

0000  00 26 5e 65 fc 89 ff ff 53 03 01 03 03 00 2d 00   .&^e....S.....-.
0010  9e 2d 39 5b 00 00 00 00 58 07 07 00 8d ff ff ff   .-9[....X.......
0020  02 00 00 00 02 00 00 00 00 00 00 00 00 00 00 00   ................
0030  00 00 00 00 00 00 00 00 00 00 00 00 00 00 00 00   ................
0040  1b 05                                             ..

Frame 208: 64 bytes on wire (512 bits), 64 bytes captured (512 bits) on interface 0
    Interface id: 0 (unknown)
        Interface name: unknown
    Encapsulation type: USB packets with Linux header and padding (115)
    Arrival Time: Jul  1, 2018 15:38:06.460702000 EDT
    [Time shift for this packet: 0.000000000 seconds]
    Epoch Time: 1530473886.460702000 seconds
    [Time delta from previous captured frame: 0.000070000 seconds]
    [Time delta from previous displayed frame: 0.000070000 seconds]
    [Time since reference or first frame: 261.598769000 seconds]
    Frame Number: 208
    Frame Length: 64 bytes (512 bits)
    Capture Length: 64 bytes (512 bits)
    [Frame is marked: False]
    [Frame is ignored: False]
    [Protocols in frame: usb]
USB URB
    [Source: 3.3.1]
    [Destination: host]
    URB id: 0xffff89fc655e2600
    URB type: URB_COMPLETE ('C')
    URB transfer type: URB_BULK (0x03)
    Endpoint: 0x01, Direction: OUT
        0... .... = Direction: OUT (0)
        .... 0001 = Endpoint number: 1
    Device: 3
    URB bus id: 3
    Device setup request: not relevant ('-')
    Data: not present ('>')
    URB sec: 1530473886
    URB usec: 460702
    URB status: Success (0)
    URB length [bytes]: 2
    Data length [bytes]: 0
    [Request in: 207]
    [Time from request: 0.000070000 seconds]
    [bInterfaceClass: Printer (0x07)]
    Unused Setup Header
    Interval: 0
    Start frame: 0
    Copy of Transfer Flags: 0x00000000
    Number of ISO descriptors: 0

0000  00 26 5e 65 fc 89 ff ff 43 03 01 03 03 00 2d 3e   .&^e....C.....->
0010  9e 2d 39 5b 00 00 00 00 9e 07 07 00 00 00 00 00   .-9[............
0020  02 00 00 00 00 00 00 00 00 00 00 00 00 00 00 00   ................
0030  00 00 00 00 00 00 00 00 00 00 00 00 00 00 00 00   ................

Frame 209: 64 bytes on wire (512 bits), 64 bytes captured (512 bits) on interface 0
    Interface id: 0 (unknown)
        Interface name: unknown
    Encapsulation type: USB packets with Linux header and padding (115)
    Arrival Time: Jul  1, 2018 15:38:06.461034000 EDT
    [Time shift for this packet: 0.000000000 seconds]
    Epoch Time: 1530473886.461034000 seconds
    [Time delta from previous captured frame: 0.000332000 seconds]
    [Time delta from previous displayed frame: 0.000332000 seconds]
    [Time since reference or first frame: 261.599101000 seconds]
    Frame Number: 209
    Frame Length: 64 bytes (512 bits)
    Capture Length: 64 bytes (512 bits)
    [Frame is marked: False]
    [Frame is ignored: False]
    [Protocols in frame: usb]
USB URB
    [Source: host]
    [Destination: 3.3.2]
    URB id: 0xffff89fc655e2600
    URB type: URB_SUBMIT ('S')
    URB transfer type: URB_BULK (0x03)
    Endpoint: 0x82, Direction: IN
        1... .... = Direction: IN (1)
        .... 0010 = Endpoint number: 2
    Device: 3
    URB bus id: 3
    Device setup request: not relevant ('-')
    Data: not present ('<')
    URB sec: 1530473886
    URB usec: 461034
    URB status: Operation now in progress (-EINPROGRESS) (-115)
    URB length [bytes]: 64
    Data length [bytes]: 0
    [Response in: 210]
    [bInterfaceClass: Printer (0x07)]
    Unused Setup Header
    Interval: 0
    Start frame: 0
    Copy of Transfer Flags: 0x00000200
    Number of ISO descriptors: 0

0000  00 26 5e 65 fc 89 ff ff 53 03 82 03 03 00 2d 3c   .&^e....S.....-<
0010  9e 2d 39 5b 00 00 00 00 ea 08 07 00 8d ff ff ff   .-9[............
0020  40 00 00 00 00 00 00 00 00 00 00 00 00 00 00 00   @...............
0030  00 00 00 00 00 00 00 00 00 02 00 00 00 00 00 00   ................

Frame 210: 66 bytes on wire (528 bits), 66 bytes captured (528 bits) on interface 0
    Interface id: 0 (unknown)
        Interface name: unknown
    Encapsulation type: USB packets with Linux header and padding (115)
    Arrival Time: Jul  1, 2018 15:38:06.562976000 EDT
    [Time shift for this packet: 0.000000000 seconds]
    Epoch Time: 1530473886.562976000 seconds
    [Time delta from previous captured frame: 0.101942000 seconds]
    [Time delta from previous displayed frame: 0.101942000 seconds]
    [Time since reference or first frame: 261.701043000 seconds]
    Frame Number: 210
    Frame Length: 66 bytes (528 bits)
    Capture Length: 66 bytes (528 bits)
    [Frame is marked: False]
    [Frame is ignored: False]
    [Protocols in frame: usb]
USB URB
    [Source: 3.3.2]
    [Destination: host]
    URB id: 0xffff89fc655e2600
    URB type: URB_COMPLETE ('C')
    URB transfer type: URB_BULK (0x03)
    Endpoint: 0x82, Direction: IN
        1... .... = Direction: IN (1)
        .... 0010 = Endpoint number: 2
    Device: 3
    URB bus id: 3
    Device setup request: not relevant ('-')
    Data: present (0)
    URB sec: 1530473886
    URB usec: 562976
    URB status: Success (0)
    URB length [bytes]: 2
    Data length [bytes]: 2
    [Request in: 209]
    [Time from request: 0.101942000 seconds]
    [bInterfaceClass: Printer (0x07)]
    Unused Setup Header
    Interval: 0
    Start frame: 0
    Copy of Transfer Flags: 0x00000200
    Number of ISO descriptors: 0
Leftover Capture Data: 3103

0000  00 26 5e 65 fc 89 ff ff 43 03 82 03 03 00 2d 00   .&^e....C.....-.
0010  9e 2d 39 5b 00 00 00 00 20 97 08 00 00 00 00 00   .-9[.... .......
0020  02 00 00 00 02 00 00 00 00 00 00 00 00 00 00 00   ................
0030  00 00 00 00 00 00 00 00 00 02 00 00 00 00 00 00   ................
0040  31 03                                             1.

Frame 211: 64 bytes on wire (512 bits), 64 bytes captured (512 bits) on interface 0
    Interface id: 0 (unknown)
        Interface name: unknown
    Encapsulation type: USB packets with Linux header and padding (115)
    Arrival Time: Jul  1, 2018 15:38:06.613706000 EDT
    [Time shift for this packet: 0.000000000 seconds]
    Epoch Time: 1530473886.613706000 seconds
    [Time delta from previous captured frame: 0.050730000 seconds]
    [Time delta from previous displayed frame: 0.050730000 seconds]
    [Time since reference or first frame: 261.751773000 seconds]
    Frame Number: 211
    Frame Length: 64 bytes (512 bits)
    Capture Length: 64 bytes (512 bits)
    [Frame is marked: False]
    [Frame is ignored: False]
    [Protocols in frame: usb]
USB URB
    [Source: host]
    [Destination: 3.3.2]
    URB id: 0xffff89fc655e2600
    URB type: URB_SUBMIT ('S')
    URB transfer type: URB_BULK (0x03)
    Endpoint: 0x82, Direction: IN
        1... .... = Direction: IN (1)
        .... 0010 = Endpoint number: 2
    Device: 3
    URB bus id: 3
    Device setup request: not relevant ('-')
    Data: not present ('<')
    URB sec: 1530473886
    URB usec: 613706
    URB status: Operation now in progress (-EINPROGRESS) (-115)
    URB length [bytes]: 64
    Data length [bytes]: 0
    [Response in: 212]
    [bInterfaceClass: Printer (0x07)]
    Unused Setup Header
    Interval: 0
    Start frame: 0
    Copy of Transfer Flags: 0x00000200
    Number of ISO descriptors: 0

0000  00 26 5e 65 fc 89 ff ff 53 03 82 03 03 00 2d 3c   .&^e....S.....-<
0010  9e 2d 39 5b 00 00 00 00 4a 5d 09 00 8d ff ff ff   .-9[....J]......
0020  40 00 00 00 00 00 00 00 00 00 00 00 00 00 00 00   @...............
0030  00 00 00 00 00 00 00 00 00 02 00 00 00 00 00 00   ................

Frame 212: 64 bytes on wire (512 bits), 64 bytes captured (512 bits) on interface 0
    Interface id: 0 (unknown)
        Interface name: unknown
    Encapsulation type: USB packets with Linux header and padding (115)
    Arrival Time: Jul  1, 2018 15:38:06.624032000 EDT
    [Time shift for this packet: 0.000000000 seconds]
    Epoch Time: 1530473886.624032000 seconds
    [Time delta from previous captured frame: 0.010326000 seconds]
    [Time delta from previous displayed frame: 0.010326000 seconds]
    [Time since reference or first frame: 261.762099000 seconds]
    Frame Number: 212
    Frame Length: 64 bytes (512 bits)
    Capture Length: 64 bytes (512 bits)
    [Frame is marked: False]
    [Frame is ignored: False]
    [Protocols in frame: usb]
USB URB
    [Source: 3.3.2]
    [Destination: host]
    URB id: 0xffff89fc655e2600
    URB type: URB_COMPLETE ('C')
    URB transfer type: URB_BULK (0x03)
    Endpoint: 0x82, Direction: IN
        1... .... = Direction: IN (1)
        .... 0010 = Endpoint number: 2
    Device: 3
    URB bus id: 3
    Device setup request: not relevant ('-')
    Data: present (0)
    URB sec: 1530473886
    URB usec: 624032
    URB status: No such file or directory (-ENOENT) (-2)
    URB length [bytes]: 0
    Data length [bytes]: 0
    [Request in: 211]
    [Time from request: 0.010326000 seconds]
    [bInterfaceClass: Printer (0x07)]
    Unused Setup Header
    Interval: 0
    Start frame: 0
    Copy of Transfer Flags: 0x00000200
    Number of ISO descriptors: 0

0000  00 26 5e 65 fc 89 ff ff 43 03 82 03 03 00 2d 00   .&^e....C.....-.
0010  9e 2d 39 5b 00 00 00 00 a0 85 09 00 fe ff ff ff   .-9[............
0020  00 00 00 00 00 00 00 00 00 00 00 00 00 00 00 00   ................
0030  00 00 00 00 00 00 00 00 00 02 00 00 00 00 00 00   ................

Frame 213: 66 bytes on wire (528 bits), 66 bytes captured (528 bits) on interface 0
    Interface id: 0 (unknown)
        Interface name: unknown
    Encapsulation type: USB packets with Linux header and padding (115)
    Arrival Time: Jul  1, 2018 15:38:06.624540000 EDT
    [Time shift for this packet: 0.000000000 seconds]
    Epoch Time: 1530473886.624540000 seconds
    [Time delta from previous captured frame: 0.000508000 seconds]
    [Time delta from previous displayed frame: 0.000508000 seconds]
    [Time since reference or first frame: 261.762607000 seconds]
    Frame Number: 213
    Frame Length: 66 bytes (528 bits)
    Capture Length: 66 bytes (528 bits)
    [Frame is marked: False]
    [Frame is ignored: False]
    [Protocols in frame: usb]
USB URB
    [Source: host]
    [Destination: 3.3.1]
    URB id: 0xffff89fb8d23a240
    URB type: URB_SUBMIT ('S')
    URB transfer type: URB_BULK (0x03)
    Endpoint: 0x01, Direction: OUT
        0... .... = Direction: OUT (0)
        .... 0001 = Endpoint number: 1
    Device: 3
    URB bus id: 3
    Device setup request: not relevant ('-')
    Data: present (0)
    URB sec: 1530473886
    URB usec: 624540
    URB status: Operation now in progress (-EINPROGRESS) (-115)
    URB length [bytes]: 2
    Data length [bytes]: 2
    [Response in: 214]
    [bInterfaceClass: Printer (0x07)]
    Unused Setup Header
    Interval: 0
    Start frame: 0
    Copy of Transfer Flags: 0x00000000
    Number of ISO descriptors: 0
Leftover Capture Data: 1b05

0000  40 a2 23 8d fb 89 ff ff 53 03 01 03 03 00 2d 00   @.#.....S.....-.
0010  9e 2d 39 5b 00 00 00 00 9c 87 09 00 8d ff ff ff   .-9[............
0020  02 00 00 00 02 00 00 00 00 00 00 00 00 00 00 00   ................
0030  00 00 00 00 00 00 00 00 00 00 00 00 00 00 00 00   ................
0040  1b 05                                             ..

Frame 214: 64 bytes on wire (512 bits), 64 bytes captured (512 bits) on interface 0
    Interface id: 0 (unknown)
        Interface name: unknown
    Encapsulation type: USB packets with Linux header and padding (115)
    Arrival Time: Jul  1, 2018 15:38:06.624637000 EDT
    [Time shift for this packet: 0.000000000 seconds]
    Epoch Time: 1530473886.624637000 seconds
    [Time delta from previous captured frame: 0.000097000 seconds]
    [Time delta from previous displayed frame: 0.000097000 seconds]
    [Time since reference or first frame: 261.762704000 seconds]
    Frame Number: 214
    Frame Length: 64 bytes (512 bits)
    Capture Length: 64 bytes (512 bits)
    [Frame is marked: False]
    [Frame is ignored: False]
    [Protocols in frame: usb]
USB URB
    [Source: 3.3.1]
    [Destination: host]
    URB id: 0xffff89fb8d23a240
    URB type: URB_COMPLETE ('C')
    URB transfer type: URB_BULK (0x03)
    Endpoint: 0x01, Direction: OUT
        0... .... = Direction: OUT (0)
        .... 0001 = Endpoint number: 1
    Device: 3
    URB bus id: 3
    Device setup request: not relevant ('-')
    Data: not present ('>')
    URB sec: 1530473886
    URB usec: 624637
    URB status: Success (0)
    URB length [bytes]: 2
    Data length [bytes]: 0
    [Request in: 213]
    [Time from request: 0.000097000 seconds]
    [bInterfaceClass: Printer (0x07)]
    Unused Setup Header
    Interval: 0
    Start frame: 0
    Copy of Transfer Flags: 0x00000000
    Number of ISO descriptors: 0

0000  40 a2 23 8d fb 89 ff ff 43 03 01 03 03 00 2d 3e   @.#.....C.....->
0010  9e 2d 39 5b 00 00 00 00 fd 87 09 00 00 00 00 00   .-9[............
0020  02 00 00 00 00 00 00 00 00 00 00 00 00 00 00 00   ................
0030  00 00 00 00 00 00 00 00 00 00 00 00 00 00 00 00   ................

Frame 215: 64 bytes on wire (512 bits), 64 bytes captured (512 bits) on interface 0
    Interface id: 0 (unknown)
        Interface name: unknown
    Encapsulation type: USB packets with Linux header and padding (115)
    Arrival Time: Jul  1, 2018 15:38:06.624973000 EDT
    [Time shift for this packet: 0.000000000 seconds]
    Epoch Time: 1530473886.624973000 seconds
    [Time delta from previous captured frame: 0.000336000 seconds]
    [Time delta from previous displayed frame: 0.000336000 seconds]
    [Time since reference or first frame: 261.763040000 seconds]
    Frame Number: 215
    Frame Length: 64 bytes (512 bits)
    Capture Length: 64 bytes (512 bits)
    [Frame is marked: False]
    [Frame is ignored: False]
    [Protocols in frame: usb]
USB URB
    [Source: host]
    [Destination: 3.3.2]
    URB id: 0xffff89fb8d23a240
    URB type: URB_SUBMIT ('S')
    URB transfer type: URB_BULK (0x03)
    Endpoint: 0x82, Direction: IN
        1... .... = Direction: IN (1)
        .... 0010 = Endpoint number: 2
    Device: 3
    URB bus id: 3
    Device setup request: not relevant ('-')
    Data: not present ('<')
    URB sec: 1530473886
    URB usec: 624973
    URB status: Operation now in progress (-EINPROGRESS) (-115)
    URB length [bytes]: 64
    Data length [bytes]: 0
    [Response in: 216]
    [bInterfaceClass: Printer (0x07)]
    Unused Setup Header
    Interval: 0
    Start frame: 0
    Copy of Transfer Flags: 0x00000200
    Number of ISO descriptors: 0

0000  40 a2 23 8d fb 89 ff ff 53 03 82 03 03 00 2d 3c   @.#.....S.....-<
0010  9e 2d 39 5b 00 00 00 00 4d 89 09 00 8d ff ff ff   .-9[....M.......
0020  40 00 00 00 00 00 00 00 00 00 00 00 00 00 00 00   @...............
0030  00 00 00 00 00 00 00 00 00 02 00 00 00 00 00 00   ................

Frame 216: 66 bytes on wire (528 bits), 66 bytes captured (528 bits) on interface 0
    Interface id: 0 (unknown)
        Interface name: unknown
    Encapsulation type: USB packets with Linux header and padding (115)
    Arrival Time: Jul  1, 2018 15:38:06.726820000 EDT
    [Time shift for this packet: 0.000000000 seconds]
    Epoch Time: 1530473886.726820000 seconds
    [Time delta from previous captured frame: 0.101847000 seconds]
    [Time delta from previous displayed frame: 0.101847000 seconds]
    [Time since reference or first frame: 261.864887000 seconds]
    Frame Number: 216
    Frame Length: 66 bytes (528 bits)
    Capture Length: 66 bytes (528 bits)
    [Frame is marked: False]
    [Frame is ignored: False]
    [Protocols in frame: usb]
USB URB
    [Source: 3.3.2]
    [Destination: host]
    URB id: 0xffff89fb8d23a240
    URB type: URB_COMPLETE ('C')
    URB transfer type: URB_BULK (0x03)
    Endpoint: 0x82, Direction: IN
        1... .... = Direction: IN (1)
        .... 0010 = Endpoint number: 2
    Device: 3
    URB bus id: 3
    Device setup request: not relevant ('-')
    Data: present (0)
    URB sec: 1530473886
    URB usec: 726820
    URB status: Success (0)
    URB length [bytes]: 2
    Data length [bytes]: 2
    [Request in: 215]
    [Time from request: 0.101847000 seconds]
    [bInterfaceClass: Printer (0x07)]
    Unused Setup Header
    Interval: 0
    Start frame: 0
    Copy of Transfer Flags: 0x00000200
    Number of ISO descriptors: 0
Leftover Capture Data: 3103

0000  40 a2 23 8d fb 89 ff ff 43 03 82 03 03 00 2d 00   @.#.....C.....-.
0010  9e 2d 39 5b 00 00 00 00 24 17 0b 00 00 00 00 00   .-9[....$.......
0020  02 00 00 00 02 00 00 00 00 00 00 00 00 00 00 00   ................
0030  00 00 00 00 00 00 00 00 00 02 00 00 00 00 00 00   ................
0040  31 03                                             1.

Frame 217: 64 bytes on wire (512 bits), 64 bytes captured (512 bits) on interface 0
    Interface id: 0 (unknown)
        Interface name: unknown
    Encapsulation type: USB packets with Linux header and padding (115)
    Arrival Time: Jul  1, 2018 15:38:06.777495000 EDT
    [Time shift for this packet: 0.000000000 seconds]
    Epoch Time: 1530473886.777495000 seconds
    [Time delta from previous captured frame: 0.050675000 seconds]
    [Time delta from previous displayed frame: 0.050675000 seconds]
    [Time since reference or first frame: 261.915562000 seconds]
    Frame Number: 217
    Frame Length: 64 bytes (512 bits)
    Capture Length: 64 bytes (512 bits)
    [Frame is marked: False]
    [Frame is ignored: False]
    [Protocols in frame: usb]
USB URB
    [Source: host]
    [Destination: 3.3.2]
    URB id: 0xffff89fb8d23a240
    URB type: URB_SUBMIT ('S')
    URB transfer type: URB_BULK (0x03)
    Endpoint: 0x82, Direction: IN
        1... .... = Direction: IN (1)
        .... 0010 = Endpoint number: 2
    Device: 3
    URB bus id: 3
    Device setup request: not relevant ('-')
    Data: not present ('<')
    URB sec: 1530473886
    URB usec: 777495
    URB status: Operation now in progress (-EINPROGRESS) (-115)
    URB length [bytes]: 64
    Data length [bytes]: 0
    [Response in: 218]
    [bInterfaceClass: Printer (0x07)]
    Unused Setup Header
    Interval: 0
    Start frame: 0
    Copy of Transfer Flags: 0x00000200
    Number of ISO descriptors: 0

0000  40 a2 23 8d fb 89 ff ff 53 03 82 03 03 00 2d 3c   @.#.....S.....-<
0010  9e 2d 39 5b 00 00 00 00 17 dd 0b 00 8d ff ff ff   .-9[............
0020  40 00 00 00 00 00 00 00 00 00 00 00 00 00 00 00   @...............
0030  00 00 00 00 00 00 00 00 00 02 00 00 00 00 00 00   ................

Frame 218: 64 bytes on wire (512 bits), 64 bytes captured (512 bits) on interface 0
    Interface id: 0 (unknown)
        Interface name: unknown
    Encapsulation type: USB packets with Linux header and padding (115)
    Arrival Time: Jul  1, 2018 15:38:06.788069000 EDT
    [Time shift for this packet: 0.000000000 seconds]
    Epoch Time: 1530473886.788069000 seconds
    [Time delta from previous captured frame: 0.010574000 seconds]
    [Time delta from previous displayed frame: 0.010574000 seconds]
    [Time since reference or first frame: 261.926136000 seconds]
    Frame Number: 218
    Frame Length: 64 bytes (512 bits)
    Capture Length: 64 bytes (512 bits)
    [Frame is marked: False]
    [Frame is ignored: False]
    [Protocols in frame: usb]
USB URB
    [Source: 3.3.2]
    [Destination: host]
    URB id: 0xffff89fb8d23a240
    URB type: URB_COMPLETE ('C')
    URB transfer type: URB_BULK (0x03)
    Endpoint: 0x82, Direction: IN
        1... .... = Direction: IN (1)
        .... 0010 = Endpoint number: 2
    Device: 3
    URB bus id: 3
    Device setup request: not relevant ('-')
    Data: present (0)
    URB sec: 1530473886
    URB usec: 788069
    URB status: No such file or directory (-ENOENT) (-2)
    URB length [bytes]: 0
    Data length [bytes]: 0
    [Request in: 217]
    [Time from request: 0.010574000 seconds]
    [bInterfaceClass: Printer (0x07)]
    Unused Setup Header
    Interval: 0
    Start frame: 0
    Copy of Transfer Flags: 0x00000200
    Number of ISO descriptors: 0

0000  40 a2 23 8d fb 89 ff ff 43 03 82 03 03 00 2d 00   @.#.....C.....-.
0010  9e 2d 39 5b 00 00 00 00 65 06 0c 00 fe ff ff ff   .-9[....e.......
0020  00 00 00 00 00 00 00 00 00 00 00 00 00 00 00 00   ................
0030  00 00 00 00 00 00 00 00 00 02 00 00 00 00 00 00   ................

Frame 219: 66 bytes on wire (528 bits), 66 bytes captured (528 bits) on interface 0
    Interface id: 0 (unknown)
        Interface name: unknown
    Encapsulation type: USB packets with Linux header and padding (115)
    Arrival Time: Jul  1, 2018 15:38:06.788537000 EDT
    [Time shift for this packet: 0.000000000 seconds]
    Epoch Time: 1530473886.788537000 seconds
    [Time delta from previous captured frame: 0.000468000 seconds]
    [Time delta from previous displayed frame: 0.000468000 seconds]
    [Time since reference or first frame: 261.926604000 seconds]
    Frame Number: 219
    Frame Length: 66 bytes (528 bits)
    Capture Length: 66 bytes (528 bits)
    [Frame is marked: False]
    [Frame is ignored: False]
    [Protocols in frame: usb]
USB URB
    [Source: host]
    [Destination: 3.3.1]
    URB id: 0xffff89fbe8d2e3c0
    URB type: URB_SUBMIT ('S')
    URB transfer type: URB_BULK (0x03)
    Endpoint: 0x01, Direction: OUT
        0... .... = Direction: OUT (0)
        .... 0001 = Endpoint number: 1
    Device: 3
    URB bus id: 3
    Device setup request: not relevant ('-')
    Data: present (0)
    URB sec: 1530473886
    URB usec: 788537
    URB status: Operation now in progress (-EINPROGRESS) (-115)
    URB length [bytes]: 2
    Data length [bytes]: 2
    [Response in: 220]
    [bInterfaceClass: Printer (0x07)]
    Unused Setup Header
    Interval: 0
    Start frame: 0
    Copy of Transfer Flags: 0x00000000
    Number of ISO descriptors: 0
Leftover Capture Data: 1b05

0000  c0 e3 d2 e8 fb 89 ff ff 53 03 01 03 03 00 2d 00   ........S.....-.
0010  9e 2d 39 5b 00 00 00 00 39 08 0c 00 8d ff ff ff   .-9[....9.......
0020  02 00 00 00 02 00 00 00 00 00 00 00 00 00 00 00   ................
0030  00 00 00 00 00 00 00 00 00 00 00 00 00 00 00 00   ................
0040  1b 05                                             ..

Frame 220: 64 bytes on wire (512 bits), 64 bytes captured (512 bits) on interface 0
    Interface id: 0 (unknown)
        Interface name: unknown
    Encapsulation type: USB packets with Linux header and padding (115)
    Arrival Time: Jul  1, 2018 15:38:06.788596000 EDT
    [Time shift for this packet: 0.000000000 seconds]
    Epoch Time: 1530473886.788596000 seconds
    [Time delta from previous captured frame: 0.000059000 seconds]
    [Time delta from previous displayed frame: 0.000059000 seconds]
    [Time since reference or first frame: 261.926663000 seconds]
    Frame Number: 220
    Frame Length: 64 bytes (512 bits)
    Capture Length: 64 bytes (512 bits)
    [Frame is marked: False]
    [Frame is ignored: False]
    [Protocols in frame: usb]
USB URB
    [Source: 3.3.1]
    [Destination: host]
    URB id: 0xffff89fbe8d2e3c0
    URB type: URB_COMPLETE ('C')
    URB transfer type: URB_BULK (0x03)
    Endpoint: 0x01, Direction: OUT
        0... .... = Direction: OUT (0)
        .... 0001 = Endpoint number: 1
    Device: 3
    URB bus id: 3
    Device setup request: not relevant ('-')
    Data: not present ('>')
    URB sec: 1530473886
    URB usec: 788596
    URB status: Success (0)
    URB length [bytes]: 2
    Data length [bytes]: 0
    [Request in: 219]
    [Time from request: 0.000059000 seconds]
    [bInterfaceClass: Printer (0x07)]
    Unused Setup Header
    Interval: 0
    Start frame: 0
    Copy of Transfer Flags: 0x00000000
    Number of ISO descriptors: 0

0000  c0 e3 d2 e8 fb 89 ff ff 43 03 01 03 03 00 2d 3e   ........C.....->
0010  9e 2d 39 5b 00 00 00 00 74 08 0c 00 00 00 00 00   .-9[....t.......
0020  02 00 00 00 00 00 00 00 00 00 00 00 00 00 00 00   ................
0030  00 00 00 00 00 00 00 00 00 00 00 00 00 00 00 00   ................

Frame 221: 64 bytes on wire (512 bits), 64 bytes captured (512 bits) on interface 0
    Interface id: 0 (unknown)
        Interface name: unknown
    Encapsulation type: USB packets with Linux header and padding (115)
    Arrival Time: Jul  1, 2018 15:38:06.788800000 EDT
    [Time shift for this packet: 0.000000000 seconds]
    Epoch Time: 1530473886.788800000 seconds
    [Time delta from previous captured frame: 0.000204000 seconds]
    [Time delta from previous displayed frame: 0.000204000 seconds]
    [Time since reference or first frame: 261.926867000 seconds]
    Frame Number: 221
    Frame Length: 64 bytes (512 bits)
    Capture Length: 64 bytes (512 bits)
    [Frame is marked: False]
    [Frame is ignored: False]
    [Protocols in frame: usb]
USB URB
    [Source: host]
    [Destination: 3.3.2]
    URB id: 0xffff89fbe8d2e3c0
    URB type: URB_SUBMIT ('S')
    URB transfer type: URB_BULK (0x03)
    Endpoint: 0x82, Direction: IN
        1... .... = Direction: IN (1)
        .... 0010 = Endpoint number: 2
    Device: 3
    URB bus id: 3
    Device setup request: not relevant ('-')
    Data: not present ('<')
    URB sec: 1530473886
    URB usec: 788800
    URB status: Operation now in progress (-EINPROGRESS) (-115)
    URB length [bytes]: 64
    Data length [bytes]: 0
    [Response in: 222]
    [bInterfaceClass: Printer (0x07)]
    Unused Setup Header
    Interval: 0
    Start frame: 0
    Copy of Transfer Flags: 0x00000200
    Number of ISO descriptors: 0

0000  c0 e3 d2 e8 fb 89 ff ff 53 03 82 03 03 00 2d 3c   ........S.....-<
0010  9e 2d 39 5b 00 00 00 00 40 09 0c 00 8d ff ff ff   .-9[....@.......
0020  40 00 00 00 00 00 00 00 00 00 00 00 00 00 00 00   @...............
0030  00 00 00 00 00 00 00 00 00 02 00 00 00 00 00 00   ................

Frame 222: 66 bytes on wire (528 bits), 66 bytes captured (528 bits) on interface 0
    Interface id: 0 (unknown)
        Interface name: unknown
    Encapsulation type: USB packets with Linux header and padding (115)
    Arrival Time: Jul  1, 2018 15:38:06.890946000 EDT
    [Time shift for this packet: 0.000000000 seconds]
    Epoch Time: 1530473886.890946000 seconds
    [Time delta from previous captured frame: 0.102146000 seconds]
    [Time delta from previous displayed frame: 0.102146000 seconds]
    [Time since reference or first frame: 262.029013000 seconds]
    Frame Number: 222
    Frame Length: 66 bytes (528 bits)
    Capture Length: 66 bytes (528 bits)
    [Frame is marked: False]
    [Frame is ignored: False]
    [Protocols in frame: usb]
USB URB
    [Source: 3.3.2]
    [Destination: host]
    URB id: 0xffff89fbe8d2e3c0
    URB type: URB_COMPLETE ('C')
    URB transfer type: URB_BULK (0x03)
    Endpoint: 0x82, Direction: IN
        1... .... = Direction: IN (1)
        .... 0010 = Endpoint number: 2
    Device: 3
    URB bus id: 3
    Device setup request: not relevant ('-')
    Data: present (0)
    URB sec: 1530473886
    URB usec: 890946
    URB status: Success (0)
    URB length [bytes]: 2
    Data length [bytes]: 2
    [Request in: 221]
    [Time from request: 0.102146000 seconds]
    [bInterfaceClass: Printer (0x07)]
    Unused Setup Header
    Interval: 0
    Start frame: 0
    Copy of Transfer Flags: 0x00000200
    Number of ISO descriptors: 0
Leftover Capture Data: 3103

0000  c0 e3 d2 e8 fb 89 ff ff 43 03 82 03 03 00 2d 00   ........C.....-.
0010  9e 2d 39 5b 00 00 00 00 42 98 0d 00 00 00 00 00   .-9[....B.......
0020  02 00 00 00 02 00 00 00 00 00 00 00 00 00 00 00   ................
0030  00 00 00 00 00 00 00 00 00 02 00 00 00 00 00 00   ................
0040  31 03                                             1.

Frame 223: 64 bytes on wire (512 bits), 64 bytes captured (512 bits) on interface 0
    Interface id: 0 (unknown)
        Interface name: unknown
    Encapsulation type: USB packets with Linux header and padding (115)
    Arrival Time: Jul  1, 2018 15:38:06.941642000 EDT
    [Time shift for this packet: 0.000000000 seconds]
    Epoch Time: 1530473886.941642000 seconds
    [Time delta from previous captured frame: 0.050696000 seconds]
    [Time delta from previous displayed frame: 0.050696000 seconds]
    [Time since reference or first frame: 262.079709000 seconds]
    Frame Number: 223
    Frame Length: 64 bytes (512 bits)
    Capture Length: 64 bytes (512 bits)
    [Frame is marked: False]
    [Frame is ignored: False]
    [Protocols in frame: usb]
USB URB
    [Source: host]
    [Destination: 3.3.2]
    URB id: 0xffff89fbe8d2e3c0
    URB type: URB_SUBMIT ('S')
    URB transfer type: URB_BULK (0x03)
    Endpoint: 0x82, Direction: IN
        1... .... = Direction: IN (1)
        .... 0010 = Endpoint number: 2
    Device: 3
    URB bus id: 3
    Device setup request: not relevant ('-')
    Data: not present ('<')
    URB sec: 1530473886
    URB usec: 941642
    URB status: Operation now in progress (-EINPROGRESS) (-115)
    URB length [bytes]: 64
    Data length [bytes]: 0
    [Response in: 224]
    [bInterfaceClass: Printer (0x07)]
    Unused Setup Header
    Interval: 0
    Start frame: 0
    Copy of Transfer Flags: 0x00000200
    Number of ISO descriptors: 0

0000  c0 e3 d2 e8 fb 89 ff ff 53 03 82 03 03 00 2d 3c   ........S.....-<
0010  9e 2d 39 5b 00 00 00 00 4a 5e 0e 00 8d ff ff ff   .-9[....J^......
0020  40 00 00 00 00 00 00 00 00 00 00 00 00 00 00 00   @...............
0030  00 00 00 00 00 00 00 00 00 02 00 00 00 00 00 00   ................

Frame 224: 64 bytes on wire (512 bits), 64 bytes captured (512 bits) on interface 0
    Interface id: 0 (unknown)
        Interface name: unknown
    Encapsulation type: USB packets with Linux header and padding (115)
    Arrival Time: Jul  1, 2018 15:38:06.952080000 EDT
    [Time shift for this packet: 0.000000000 seconds]
    Epoch Time: 1530473886.952080000 seconds
    [Time delta from previous captured frame: 0.010438000 seconds]
    [Time delta from previous displayed frame: 0.010438000 seconds]
    [Time since reference or first frame: 262.090147000 seconds]
    Frame Number: 224
    Frame Length: 64 bytes (512 bits)
    Capture Length: 64 bytes (512 bits)
    [Frame is marked: False]
    [Frame is ignored: False]
    [Protocols in frame: usb]
USB URB
    [Source: 3.3.2]
    [Destination: host]
    URB id: 0xffff89fbe8d2e3c0
    URB type: URB_COMPLETE ('C')
    URB transfer type: URB_BULK (0x03)
    Endpoint: 0x82, Direction: IN
        1... .... = Direction: IN (1)
        .... 0010 = Endpoint number: 2
    Device: 3
    URB bus id: 3
    Device setup request: not relevant ('-')
    Data: present (0)
    URB sec: 1530473886
    URB usec: 952080
    URB status: No such file or directory (-ENOENT) (-2)
    URB length [bytes]: 0
    Data length [bytes]: 0
    [Request in: 223]
    [Time from request: 0.010438000 seconds]
    [bInterfaceClass: Printer (0x07)]
    Unused Setup Header
    Interval: 0
    Start frame: 0
    Copy of Transfer Flags: 0x00000200
    Number of ISO descriptors: 0

0000  c0 e3 d2 e8 fb 89 ff ff 43 03 82 03 03 00 2d 00   ........C.....-.
0010  9e 2d 39 5b 00 00 00 00 10 87 0e 00 fe ff ff ff   .-9[............
0020  00 00 00 00 00 00 00 00 00 00 00 00 00 00 00 00   ................
0030  00 00 00 00 00 00 00 00 00 02 00 00 00 00 00 00   ................

Frame 225: 66 bytes on wire (528 bits), 66 bytes captured (528 bits) on interface 0
    Interface id: 0 (unknown)
        Interface name: unknown
    Encapsulation type: USB packets with Linux header and padding (115)
    Arrival Time: Jul  1, 2018 15:38:06.952597000 EDT
    [Time shift for this packet: 0.000000000 seconds]
    Epoch Time: 1530473886.952597000 seconds
    [Time delta from previous captured frame: 0.000517000 seconds]
    [Time delta from previous displayed frame: 0.000517000 seconds]
    [Time since reference or first frame: 262.090664000 seconds]
    Frame Number: 225
    Frame Length: 66 bytes (528 bits)
    Capture Length: 66 bytes (528 bits)
    [Frame is marked: False]
    [Frame is ignored: False]
    [Protocols in frame: usb]
USB URB
    [Source: host]
    [Destination: 3.3.1]
    URB id: 0xffff89fbe8d2e3c0
    URB type: URB_SUBMIT ('S')
    URB transfer type: URB_BULK (0x03)
    Endpoint: 0x01, Direction: OUT
        0... .... = Direction: OUT (0)
        .... 0001 = Endpoint number: 1
    Device: 3
    URB bus id: 3
    Device setup request: not relevant ('-')
    Data: present (0)
    URB sec: 1530473886
    URB usec: 952597
    URB status: Operation now in progress (-EINPROGRESS) (-115)
    URB length [bytes]: 2
    Data length [bytes]: 2
    [Response in: 226]
    [bInterfaceClass: Printer (0x07)]
    Unused Setup Header
    Interval: 0
    Start frame: 0
    Copy of Transfer Flags: 0x00000000
    Number of ISO descriptors: 0
Leftover Capture Data: 1b05

0000  c0 e3 d2 e8 fb 89 ff ff 53 03 01 03 03 00 2d 00   ........S.....-.
0010  9e 2d 39 5b 00 00 00 00 15 89 0e 00 8d ff ff ff   .-9[............
0020  02 00 00 00 02 00 00 00 00 00 00 00 00 00 00 00   ................
0030  00 00 00 00 00 00 00 00 00 00 00 00 00 00 00 00   ................
0040  1b 05                                             ..

Frame 226: 64 bytes on wire (512 bits), 64 bytes captured (512 bits) on interface 0
    Interface id: 0 (unknown)
        Interface name: unknown
    Encapsulation type: USB packets with Linux header and padding (115)
    Arrival Time: Jul  1, 2018 15:38:06.952646000 EDT
    [Time shift for this packet: 0.000000000 seconds]
    Epoch Time: 1530473886.952646000 seconds
    [Time delta from previous captured frame: 0.000049000 seconds]
    [Time delta from previous displayed frame: 0.000049000 seconds]
    [Time since reference or first frame: 262.090713000 seconds]
    Frame Number: 226
    Frame Length: 64 bytes (512 bits)
    Capture Length: 64 bytes (512 bits)
    [Frame is marked: False]
    [Frame is ignored: False]
    [Protocols in frame: usb]
USB URB
    [Source: 3.3.1]
    [Destination: host]
    URB id: 0xffff89fbe8d2e3c0
    URB type: URB_COMPLETE ('C')
    URB transfer type: URB_BULK (0x03)
    Endpoint: 0x01, Direction: OUT
        0... .... = Direction: OUT (0)
        .... 0001 = Endpoint number: 1
    Device: 3
    URB bus id: 3
    Device setup request: not relevant ('-')
    Data: not present ('>')
    URB sec: 1530473886
    URB usec: 952646
    URB status: Success (0)
    URB length [bytes]: 2
    Data length [bytes]: 0
    [Request in: 225]
    [Time from request: 0.000049000 seconds]
    [bInterfaceClass: Printer (0x07)]
    Unused Setup Header
    Interval: 0
    Start frame: 0
    Copy of Transfer Flags: 0x00000000
    Number of ISO descriptors: 0

0000  c0 e3 d2 e8 fb 89 ff ff 43 03 01 03 03 00 2d 3e   ........C.....->
0010  9e 2d 39 5b 00 00 00 00 46 89 0e 00 00 00 00 00   .-9[....F.......
0020  02 00 00 00 00 00 00 00 00 00 00 00 00 00 00 00   ................
0030  00 00 00 00 00 00 00 00 00 00 00 00 00 00 00 00   ................

Frame 227: 64 bytes on wire (512 bits), 64 bytes captured (512 bits) on interface 0
    Interface id: 0 (unknown)
        Interface name: unknown
    Encapsulation type: USB packets with Linux header and padding (115)
    Arrival Time: Jul  1, 2018 15:38:06.952835000 EDT
    [Time shift for this packet: 0.000000000 seconds]
    Epoch Time: 1530473886.952835000 seconds
    [Time delta from previous captured frame: 0.000189000 seconds]
    [Time delta from previous displayed frame: 0.000189000 seconds]
    [Time since reference or first frame: 262.090902000 seconds]
    Frame Number: 227
    Frame Length: 64 bytes (512 bits)
    Capture Length: 64 bytes (512 bits)
    [Frame is marked: False]
    [Frame is ignored: False]
    [Protocols in frame: usb]
USB URB
    [Source: host]
    [Destination: 3.3.2]
    URB id: 0xffff89fbe8d2e3c0
    URB type: URB_SUBMIT ('S')
    URB transfer type: URB_BULK (0x03)
    Endpoint: 0x82, Direction: IN
        1... .... = Direction: IN (1)
        .... 0010 = Endpoint number: 2
    Device: 3
    URB bus id: 3
    Device setup request: not relevant ('-')
    Data: not present ('<')
    URB sec: 1530473886
    URB usec: 952835
    URB status: Operation now in progress (-EINPROGRESS) (-115)
    URB length [bytes]: 64
    Data length [bytes]: 0
    [Response in: 228]
    [bInterfaceClass: Printer (0x07)]
    Unused Setup Header
    Interval: 0
    Start frame: 0
    Copy of Transfer Flags: 0x00000200
    Number of ISO descriptors: 0

0000  c0 e3 d2 e8 fb 89 ff ff 53 03 82 03 03 00 2d 3c   ........S.....-<
0010  9e 2d 39 5b 00 00 00 00 03 8a 0e 00 8d ff ff ff   .-9[............
0020  40 00 00 00 00 00 00 00 00 00 00 00 00 00 00 00   @...............
0030  00 00 00 00 00 00 00 00 00 02 00 00 00 00 00 00   ................

Frame 228: 66 bytes on wire (528 bits), 66 bytes captured (528 bits) on interface 0
    Interface id: 0 (unknown)
        Interface name: unknown
    Encapsulation type: USB packets with Linux header and padding (115)
    Arrival Time: Jul  1, 2018 15:38:07.054911000 EDT
    [Time shift for this packet: 0.000000000 seconds]
    Epoch Time: 1530473887.054911000 seconds
    [Time delta from previous captured frame: 0.102076000 seconds]
    [Time delta from previous displayed frame: 0.102076000 seconds]
    [Time since reference or first frame: 262.192978000 seconds]
    Frame Number: 228
    Frame Length: 66 bytes (528 bits)
    Capture Length: 66 bytes (528 bits)
    [Frame is marked: False]
    [Frame is ignored: False]
    [Protocols in frame: usb]
USB URB
    [Source: 3.3.2]
    [Destination: host]
    URB id: 0xffff89fbe8d2e3c0
    URB type: URB_COMPLETE ('C')
    URB transfer type: URB_BULK (0x03)
    Endpoint: 0x82, Direction: IN
        1... .... = Direction: IN (1)
        .... 0010 = Endpoint number: 2
    Device: 3
    URB bus id: 3
    Device setup request: not relevant ('-')
    Data: present (0)
    URB sec: 1530473887
    URB usec: 54911
    URB status: Success (0)
    URB length [bytes]: 2
    Data length [bytes]: 2
    [Request in: 227]
    [Time from request: 0.102076000 seconds]
    [bInterfaceClass: Printer (0x07)]
    Unused Setup Header
    Interval: 0
    Start frame: 0
    Copy of Transfer Flags: 0x00000200
    Number of ISO descriptors: 0
Leftover Capture Data: 3103

0000  c0 e3 d2 e8 fb 89 ff ff 43 03 82 03 03 00 2d 00   ........C.....-.
0010  9f 2d 39 5b 00 00 00 00 7f d6 00 00 00 00 00 00   .-9[............
0020  02 00 00 00 02 00 00 00 00 00 00 00 00 00 00 00   ................
0030  00 00 00 00 00 00 00 00 00 02 00 00 00 00 00 00   ................
0040  31 03                                             1.

Frame 229: 64 bytes on wire (512 bits), 64 bytes captured (512 bits) on interface 0
    Interface id: 0 (unknown)
        Interface name: unknown
    Encapsulation type: USB packets with Linux header and padding (115)
    Arrival Time: Jul  1, 2018 15:38:07.105605000 EDT
    [Time shift for this packet: 0.000000000 seconds]
    Epoch Time: 1530473887.105605000 seconds
    [Time delta from previous captured frame: 0.050694000 seconds]
    [Time delta from previous displayed frame: 0.050694000 seconds]
    [Time since reference or first frame: 262.243672000 seconds]
    Frame Number: 229
    Frame Length: 64 bytes (512 bits)
    Capture Length: 64 bytes (512 bits)
    [Frame is marked: False]
    [Frame is ignored: False]
    [Protocols in frame: usb]
USB URB
    [Source: host]
    [Destination: 3.3.2]
    URB id: 0xffff89fbe8d2e3c0
    URB type: URB_SUBMIT ('S')
    URB transfer type: URB_BULK (0x03)
    Endpoint: 0x82, Direction: IN
        1... .... = Direction: IN (1)
        .... 0010 = Endpoint number: 2
    Device: 3
    URB bus id: 3
    Device setup request: not relevant ('-')
    Data: not present ('<')
    URB sec: 1530473887
    URB usec: 105605
    URB status: Operation now in progress (-EINPROGRESS) (-115)
    URB length [bytes]: 64
    Data length [bytes]: 0
    [Response in: 230]
    [bInterfaceClass: Printer (0x07)]
    Unused Setup Header
    Interval: 0
    Start frame: 0
    Copy of Transfer Flags: 0x00000200
    Number of ISO descriptors: 0

0000  c0 e3 d2 e8 fb 89 ff ff 53 03 82 03 03 00 2d 3c   ........S.....-<
0010  9f 2d 39 5b 00 00 00 00 85 9c 01 00 8d ff ff ff   .-9[............
0020  40 00 00 00 00 00 00 00 00 00 00 00 00 00 00 00   @...............
0030  00 00 00 00 00 00 00 00 00 02 00 00 00 00 00 00   ................

Frame 230: 64 bytes on wire (512 bits), 64 bytes captured (512 bits) on interface 0
    Interface id: 0 (unknown)
        Interface name: unknown
    Encapsulation type: USB packets with Linux header and padding (115)
    Arrival Time: Jul  1, 2018 15:38:07.116119000 EDT
    [Time shift for this packet: 0.000000000 seconds]
    Epoch Time: 1530473887.116119000 seconds
    [Time delta from previous captured frame: 0.010514000 seconds]
    [Time delta from previous displayed frame: 0.010514000 seconds]
    [Time since reference or first frame: 262.254186000 seconds]
    Frame Number: 230
    Frame Length: 64 bytes (512 bits)
    Capture Length: 64 bytes (512 bits)
    [Frame is marked: False]
    [Frame is ignored: False]
    [Protocols in frame: usb]
USB URB
    [Source: 3.3.2]
    [Destination: host]
    URB id: 0xffff89fbe8d2e3c0
    URB type: URB_COMPLETE ('C')
    URB transfer type: URB_BULK (0x03)
    Endpoint: 0x82, Direction: IN
        1... .... = Direction: IN (1)
        .... 0010 = Endpoint number: 2
    Device: 3
    URB bus id: 3
    Device setup request: not relevant ('-')
    Data: present (0)
    URB sec: 1530473887
    URB usec: 116119
    URB status: No such file or directory (-ENOENT) (-2)
    URB length [bytes]: 0
    Data length [bytes]: 0
    [Request in: 229]
    [Time from request: 0.010514000 seconds]
    [bInterfaceClass: Printer (0x07)]
    Unused Setup Header
    Interval: 0
    Start frame: 0
    Copy of Transfer Flags: 0x00000200
    Number of ISO descriptors: 0

0000  c0 e3 d2 e8 fb 89 ff ff 43 03 82 03 03 00 2d 00   ........C.....-.
0010  9f 2d 39 5b 00 00 00 00 97 c5 01 00 fe ff ff ff   .-9[............
0020  00 00 00 00 00 00 00 00 00 00 00 00 00 00 00 00   ................
0030  00 00 00 00 00 00 00 00 00 02 00 00 00 00 00 00   ................

Frame 231: 66 bytes on wire (528 bits), 66 bytes captured (528 bits) on interface 0
    Interface id: 0 (unknown)
        Interface name: unknown
    Encapsulation type: USB packets with Linux header and padding (115)
    Arrival Time: Jul  1, 2018 15:38:07.116653000 EDT
    [Time shift for this packet: 0.000000000 seconds]
    Epoch Time: 1530473887.116653000 seconds
    [Time delta from previous captured frame: 0.000534000 seconds]
    [Time delta from previous displayed frame: 0.000534000 seconds]
    [Time since reference or first frame: 262.254720000 seconds]
    Frame Number: 231
    Frame Length: 66 bytes (528 bits)
    Capture Length: 66 bytes (528 bits)
    [Frame is marked: False]
    [Frame is ignored: False]
    [Protocols in frame: usb]
USB URB
    [Source: host]
    [Destination: 3.3.1]
    URB id: 0xffff89fbe8d2e3c0
    URB type: URB_SUBMIT ('S')
    URB transfer type: URB_BULK (0x03)
    Endpoint: 0x01, Direction: OUT
        0... .... = Direction: OUT (0)
        .... 0001 = Endpoint number: 1
    Device: 3
    URB bus id: 3
    Device setup request: not relevant ('-')
    Data: present (0)
    URB sec: 1530473887
    URB usec: 116653
    URB status: Operation now in progress (-EINPROGRESS) (-115)
    URB length [bytes]: 2
    Data length [bytes]: 2
    [Response in: 232]
    [bInterfaceClass: Printer (0x07)]
    Unused Setup Header
    Interval: 0
    Start frame: 0
    Copy of Transfer Flags: 0x00000000
    Number of ISO descriptors: 0
Leftover Capture Data: 1b05

0000  c0 e3 d2 e8 fb 89 ff ff 53 03 01 03 03 00 2d 00   ........S.....-.
0010  9f 2d 39 5b 00 00 00 00 ad c7 01 00 8d ff ff ff   .-9[............
0020  02 00 00 00 02 00 00 00 00 00 00 00 00 00 00 00   ................
0030  00 00 00 00 00 00 00 00 00 00 00 00 00 00 00 00   ................
0040  1b 05                                             ..

Frame 232: 64 bytes on wire (512 bits), 64 bytes captured (512 bits) on interface 0
    Interface id: 0 (unknown)
        Interface name: unknown
    Encapsulation type: USB packets with Linux header and padding (115)
    Arrival Time: Jul  1, 2018 15:38:07.116703000 EDT
    [Time shift for this packet: 0.000000000 seconds]
    Epoch Time: 1530473887.116703000 seconds
    [Time delta from previous captured frame: 0.000050000 seconds]
    [Time delta from previous displayed frame: 0.000050000 seconds]
    [Time since reference or first frame: 262.254770000 seconds]
    Frame Number: 232
    Frame Length: 64 bytes (512 bits)
    Capture Length: 64 bytes (512 bits)
    [Frame is marked: False]
    [Frame is ignored: False]
    [Protocols in frame: usb]
USB URB
    [Source: 3.3.1]
    [Destination: host]
    URB id: 0xffff89fbe8d2e3c0
    URB type: URB_COMPLETE ('C')
    URB transfer type: URB_BULK (0x03)
    Endpoint: 0x01, Direction: OUT
        0... .... = Direction: OUT (0)
        .... 0001 = Endpoint number: 1
    Device: 3
    URB bus id: 3
    Device setup request: not relevant ('-')
    Data: not present ('>')
    URB sec: 1530473887
    URB usec: 116703
    URB status: Success (0)
    URB length [bytes]: 2
    Data length [bytes]: 0
    [Request in: 231]
    [Time from request: 0.000050000 seconds]
    [bInterfaceClass: Printer (0x07)]
    Unused Setup Header
    Interval: 0
    Start frame: 0
    Copy of Transfer Flags: 0x00000000
    Number of ISO descriptors: 0

0000  c0 e3 d2 e8 fb 89 ff ff 43 03 01 03 03 00 2d 3e   ........C.....->
0010  9f 2d 39 5b 00 00 00 00 df c7 01 00 00 00 00 00   .-9[............
0020  02 00 00 00 00 00 00 00 00 00 00 00 00 00 00 00   ................
0030  00 00 00 00 00 00 00 00 00 00 00 00 00 00 00 00   ................

Frame 233: 64 bytes on wire (512 bits), 64 bytes captured (512 bits) on interface 0
    Interface id: 0 (unknown)
        Interface name: unknown
    Encapsulation type: USB packets with Linux header and padding (115)
    Arrival Time: Jul  1, 2018 15:38:07.116893000 EDT
    [Time shift for this packet: 0.000000000 seconds]
    Epoch Time: 1530473887.116893000 seconds
    [Time delta from previous captured frame: 0.000190000 seconds]
    [Time delta from previous displayed frame: 0.000190000 seconds]
    [Time since reference or first frame: 262.254960000 seconds]
    Frame Number: 233
    Frame Length: 64 bytes (512 bits)
    Capture Length: 64 bytes (512 bits)
    [Frame is marked: False]
    [Frame is ignored: False]
    [Protocols in frame: usb]
USB URB
    [Source: host]
    [Destination: 3.3.2]
    URB id: 0xffff89fbe8d2e3c0
    URB type: URB_SUBMIT ('S')
    URB transfer type: URB_BULK (0x03)
    Endpoint: 0x82, Direction: IN
        1... .... = Direction: IN (1)
        .... 0010 = Endpoint number: 2
    Device: 3
    URB bus id: 3
    Device setup request: not relevant ('-')
    Data: not present ('<')
    URB sec: 1530473887
    URB usec: 116893
    URB status: Operation now in progress (-EINPROGRESS) (-115)
    URB length [bytes]: 64
    Data length [bytes]: 0
    [Response in: 234]
    [bInterfaceClass: Printer (0x07)]
    Unused Setup Header
    Interval: 0
    Start frame: 0
    Copy of Transfer Flags: 0x00000200
    Number of ISO descriptors: 0

0000  c0 e3 d2 e8 fb 89 ff ff 53 03 82 03 03 00 2d 3c   ........S.....-<
0010  9f 2d 39 5b 00 00 00 00 9d c8 01 00 8d ff ff ff   .-9[............
0020  40 00 00 00 00 00 00 00 00 00 00 00 00 00 00 00   @...............
0030  00 00 00 00 00 00 00 00 00 02 00 00 00 00 00 00   ................

Frame 234: 66 bytes on wire (528 bits), 66 bytes captured (528 bits) on interface 0
    Interface id: 0 (unknown)
        Interface name: unknown
    Encapsulation type: USB packets with Linux header and padding (115)
    Arrival Time: Jul  1, 2018 15:38:07.218958000 EDT
    [Time shift for this packet: 0.000000000 seconds]
    Epoch Time: 1530473887.218958000 seconds
    [Time delta from previous captured frame: 0.102065000 seconds]
    [Time delta from previous displayed frame: 0.102065000 seconds]
    [Time since reference or first frame: 262.357025000 seconds]
    Frame Number: 234
    Frame Length: 66 bytes (528 bits)
    Capture Length: 66 bytes (528 bits)
    [Frame is marked: False]
    [Frame is ignored: False]
    [Protocols in frame: usb]
USB URB
    [Source: 3.3.2]
    [Destination: host]
    URB id: 0xffff89fbe8d2e3c0
    URB type: URB_COMPLETE ('C')
    URB transfer type: URB_BULK (0x03)
    Endpoint: 0x82, Direction: IN
        1... .... = Direction: IN (1)
        .... 0010 = Endpoint number: 2
    Device: 3
    URB bus id: 3
    Device setup request: not relevant ('-')
    Data: present (0)
    URB sec: 1530473887
    URB usec: 218958
    URB status: Success (0)
    URB length [bytes]: 2
    Data length [bytes]: 2
    [Request in: 233]
    [Time from request: 0.102065000 seconds]
    [bInterfaceClass: Printer (0x07)]
    Unused Setup Header
    Interval: 0
    Start frame: 0
    Copy of Transfer Flags: 0x00000200
    Number of ISO descriptors: 0
Leftover Capture Data: 3103

0000  c0 e3 d2 e8 fb 89 ff ff 43 03 82 03 03 00 2d 00   ........C.....-.
0010  9f 2d 39 5b 00 00 00 00 4e 57 03 00 00 00 00 00   .-9[....NW......
0020  02 00 00 00 02 00 00 00 00 00 00 00 00 00 00 00   ................
0030  00 00 00 00 00 00 00 00 00 02 00 00 00 00 00 00   ................
0040  31 03                                             1.

Frame 235: 64 bytes on wire (512 bits), 64 bytes captured (512 bits) on interface 0
    Interface id: 0 (unknown)
        Interface name: unknown
    Encapsulation type: USB packets with Linux header and padding (115)
    Arrival Time: Jul  1, 2018 15:38:07.269673000 EDT
    [Time shift for this packet: 0.000000000 seconds]
    Epoch Time: 1530473887.269673000 seconds
    [Time delta from previous captured frame: 0.050715000 seconds]
    [Time delta from previous displayed frame: 0.050715000 seconds]
    [Time since reference or first frame: 262.407740000 seconds]
    Frame Number: 235
    Frame Length: 64 bytes (512 bits)
    Capture Length: 64 bytes (512 bits)
    [Frame is marked: False]
    [Frame is ignored: False]
    [Protocols in frame: usb]
USB URB
    [Source: host]
    [Destination: 3.3.2]
    URB id: 0xffff89fbe8d2e3c0
    URB type: URB_SUBMIT ('S')
    URB transfer type: URB_BULK (0x03)
    Endpoint: 0x82, Direction: IN
        1... .... = Direction: IN (1)
        .... 0010 = Endpoint number: 2
    Device: 3
    URB bus id: 3
    Device setup request: not relevant ('-')
    Data: not present ('<')
    URB sec: 1530473887
    URB usec: 269673
    URB status: Operation now in progress (-EINPROGRESS) (-115)
    URB length [bytes]: 64
    Data length [bytes]: 0
    [Response in: 236]
    [bInterfaceClass: Printer (0x07)]
    Unused Setup Header
    Interval: 0
    Start frame: 0
    Copy of Transfer Flags: 0x00000200
    Number of ISO descriptors: 0

0000  c0 e3 d2 e8 fb 89 ff ff 53 03 82 03 03 00 2d 3c   ........S.....-<
0010  9f 2d 39 5b 00 00 00 00 69 1d 04 00 8d ff ff ff   .-9[....i.......
0020  40 00 00 00 00 00 00 00 00 00 00 00 00 00 00 00   @...............
0030  00 00 00 00 00 00 00 00 00 02 00 00 00 00 00 00   ................

Frame 236: 64 bytes on wire (512 bits), 64 bytes captured (512 bits) on interface 0
    Interface id: 0 (unknown)
        Interface name: unknown
    Encapsulation type: USB packets with Linux header and padding (115)
    Arrival Time: Jul  1, 2018 15:38:07.280081000 EDT
    [Time shift for this packet: 0.000000000 seconds]
    Epoch Time: 1530473887.280081000 seconds
    [Time delta from previous captured frame: 0.010408000 seconds]
    [Time delta from previous displayed frame: 0.010408000 seconds]
    [Time since reference or first frame: 262.418148000 seconds]
    Frame Number: 236
    Frame Length: 64 bytes (512 bits)
    Capture Length: 64 bytes (512 bits)
    [Frame is marked: False]
    [Frame is ignored: False]
    [Protocols in frame: usb]
USB URB
    [Source: 3.3.2]
    [Destination: host]
    URB id: 0xffff89fbe8d2e3c0
    URB type: URB_COMPLETE ('C')
    URB transfer type: URB_BULK (0x03)
    Endpoint: 0x82, Direction: IN
        1... .... = Direction: IN (1)
        .... 0010 = Endpoint number: 2
    Device: 3
    URB bus id: 3
    Device setup request: not relevant ('-')
    Data: present (0)
    URB sec: 1530473887
    URB usec: 280081
    URB status: No such file or directory (-ENOENT) (-2)
    URB length [bytes]: 0
    Data length [bytes]: 0
    [Request in: 235]
    [Time from request: 0.010408000 seconds]
    [bInterfaceClass: Printer (0x07)]
    Unused Setup Header
    Interval: 0
    Start frame: 0
    Copy of Transfer Flags: 0x00000200
    Number of ISO descriptors: 0

0000  c0 e3 d2 e8 fb 89 ff ff 43 03 82 03 03 00 2d 00   ........C.....-.
0010  9f 2d 39 5b 00 00 00 00 11 46 04 00 fe ff ff ff   .-9[.....F......
0020  00 00 00 00 00 00 00 00 00 00 00 00 00 00 00 00   ................
0030  00 00 00 00 00 00 00 00 00 02 00 00 00 00 00 00   ................

Frame 237: 66 bytes on wire (528 bits), 66 bytes captured (528 bits) on interface 0
    Interface id: 0 (unknown)
        Interface name: unknown
    Encapsulation type: USB packets with Linux header and padding (115)
    Arrival Time: Jul  1, 2018 15:38:07.280662000 EDT
    [Time shift for this packet: 0.000000000 seconds]
    Epoch Time: 1530473887.280662000 seconds
    [Time delta from previous captured frame: 0.000581000 seconds]
    [Time delta from previous displayed frame: 0.000581000 seconds]
    [Time since reference or first frame: 262.418729000 seconds]
    Frame Number: 237
    Frame Length: 66 bytes (528 bits)
    Capture Length: 66 bytes (528 bits)
    [Frame is marked: False]
    [Frame is ignored: False]
    [Protocols in frame: usb]
USB URB
    [Source: host]
    [Destination: 3.3.1]
    URB id: 0xffff89fbe8d2e3c0
    URB type: URB_SUBMIT ('S')
    URB transfer type: URB_BULK (0x03)
    Endpoint: 0x01, Direction: OUT
        0... .... = Direction: OUT (0)
        .... 0001 = Endpoint number: 1
    Device: 3
    URB bus id: 3
    Device setup request: not relevant ('-')
    Data: present (0)
    URB sec: 1530473887
    URB usec: 280662
    URB status: Operation now in progress (-EINPROGRESS) (-115)
    URB length [bytes]: 2
    Data length [bytes]: 2
    [Response in: 238]
    [bInterfaceClass: Printer (0x07)]
    Unused Setup Header
    Interval: 0
    Start frame: 0
    Copy of Transfer Flags: 0x00000000
    Number of ISO descriptors: 0
Leftover Capture Data: 1b05

0000  c0 e3 d2 e8 fb 89 ff ff 53 03 01 03 03 00 2d 00   ........S.....-.
0010  9f 2d 39 5b 00 00 00 00 56 48 04 00 8d ff ff ff   .-9[....VH......
0020  02 00 00 00 02 00 00 00 00 00 00 00 00 00 00 00   ................
0030  00 00 00 00 00 00 00 00 00 00 00 00 00 00 00 00   ................
0040  1b 05                                             ..

Frame 238: 64 bytes on wire (512 bits), 64 bytes captured (512 bits) on interface 0
    Interface id: 0 (unknown)
        Interface name: unknown
    Encapsulation type: USB packets with Linux header and padding (115)
    Arrival Time: Jul  1, 2018 15:38:07.280720000 EDT
    [Time shift for this packet: 0.000000000 seconds]
    Epoch Time: 1530473887.280720000 seconds
    [Time delta from previous captured frame: 0.000058000 seconds]
    [Time delta from previous displayed frame: 0.000058000 seconds]
    [Time since reference or first frame: 262.418787000 seconds]
    Frame Number: 238
    Frame Length: 64 bytes (512 bits)
    Capture Length: 64 bytes (512 bits)
    [Frame is marked: False]
    [Frame is ignored: False]
    [Protocols in frame: usb]
USB URB
    [Source: 3.3.1]
    [Destination: host]
    URB id: 0xffff89fbe8d2e3c0
    URB type: URB_COMPLETE ('C')
    URB transfer type: URB_BULK (0x03)
    Endpoint: 0x01, Direction: OUT
        0... .... = Direction: OUT (0)
        .... 0001 = Endpoint number: 1
    Device: 3
    URB bus id: 3
    Device setup request: not relevant ('-')
    Data: not present ('>')
    URB sec: 1530473887
    URB usec: 280720
    URB status: Success (0)
    URB length [bytes]: 2
    Data length [bytes]: 0
    [Request in: 237]
    [Time from request: 0.000058000 seconds]
    [bInterfaceClass: Printer (0x07)]
    Unused Setup Header
    Interval: 0
    Start frame: 0
    Copy of Transfer Flags: 0x00000000
    Number of ISO descriptors: 0

0000  c0 e3 d2 e8 fb 89 ff ff 43 03 01 03 03 00 2d 3e   ........C.....->
0010  9f 2d 39 5b 00 00 00 00 90 48 04 00 00 00 00 00   .-9[.....H......
0020  02 00 00 00 00 00 00 00 00 00 00 00 00 00 00 00   ................
0030  00 00 00 00 00 00 00 00 00 00 00 00 00 00 00 00   ................

Frame 239: 64 bytes on wire (512 bits), 64 bytes captured (512 bits) on interface 0
    Interface id: 0 (unknown)
        Interface name: unknown
    Encapsulation type: USB packets with Linux header and padding (115)
    Arrival Time: Jul  1, 2018 15:38:07.281010000 EDT
    [Time shift for this packet: 0.000000000 seconds]
    Epoch Time: 1530473887.281010000 seconds
    [Time delta from previous captured frame: 0.000290000 seconds]
    [Time delta from previous displayed frame: 0.000290000 seconds]
    [Time since reference or first frame: 262.419077000 seconds]
    Frame Number: 239
    Frame Length: 64 bytes (512 bits)
    Capture Length: 64 bytes (512 bits)
    [Frame is marked: False]
    [Frame is ignored: False]
    [Protocols in frame: usb]
USB URB
    [Source: host]
    [Destination: 3.3.2]
    URB id: 0xffff89fbe8d2e3c0
    URB type: URB_SUBMIT ('S')
    URB transfer type: URB_BULK (0x03)
    Endpoint: 0x82, Direction: IN
        1... .... = Direction: IN (1)
        .... 0010 = Endpoint number: 2
    Device: 3
    URB bus id: 3
    Device setup request: not relevant ('-')
    Data: not present ('<')
    URB sec: 1530473887
    URB usec: 281010
    URB status: Operation now in progress (-EINPROGRESS) (-115)
    URB length [bytes]: 64
    Data length [bytes]: 0
    [Response in: 240]
    [bInterfaceClass: Printer (0x07)]
    Unused Setup Header
    Interval: 0
    Start frame: 0
    Copy of Transfer Flags: 0x00000200
    Number of ISO descriptors: 0

0000  c0 e3 d2 e8 fb 89 ff ff 53 03 82 03 03 00 2d 3c   ........S.....-<
0010  9f 2d 39 5b 00 00 00 00 b2 49 04 00 8d ff ff ff   .-9[.....I......
0020  40 00 00 00 00 00 00 00 00 00 00 00 00 00 00 00   @...............
0030  00 00 00 00 00 00 00 00 00 02 00 00 00 00 00 00   ................

Frame 240: 66 bytes on wire (528 bits), 66 bytes captured (528 bits) on interface 0
    Interface id: 0 (unknown)
        Interface name: unknown
    Encapsulation type: USB packets with Linux header and padding (115)
    Arrival Time: Jul  1, 2018 15:38:07.382905000 EDT
    [Time shift for this packet: 0.000000000 seconds]
    Epoch Time: 1530473887.382905000 seconds
    [Time delta from previous captured frame: 0.101895000 seconds]
    [Time delta from previous displayed frame: 0.101895000 seconds]
    [Time since reference or first frame: 262.520972000 seconds]
    Frame Number: 240
    Frame Length: 66 bytes (528 bits)
    Capture Length: 66 bytes (528 bits)
    [Frame is marked: False]
    [Frame is ignored: False]
    [Protocols in frame: usb]
USB URB
    [Source: 3.3.2]
    [Destination: host]
    URB id: 0xffff89fbe8d2e3c0
    URB type: URB_COMPLETE ('C')
    URB transfer type: URB_BULK (0x03)
    Endpoint: 0x82, Direction: IN
        1... .... = Direction: IN (1)
        .... 0010 = Endpoint number: 2
    Device: 3
    URB bus id: 3
    Device setup request: not relevant ('-')
    Data: present (0)
    URB sec: 1530473887
    URB usec: 382905
    URB status: Success (0)
    URB length [bytes]: 2
    Data length [bytes]: 2
    [Request in: 239]
    [Time from request: 0.101895000 seconds]
    [bInterfaceClass: Printer (0x07)]
    Unused Setup Header
    Interval: 0
    Start frame: 0
    Copy of Transfer Flags: 0x00000200
    Number of ISO descriptors: 0
Leftover Capture Data: 3003

0000  c0 e3 d2 e8 fb 89 ff ff 43 03 82 03 03 00 2d 00   ........C.....-.
0010  9f 2d 39 5b 00 00 00 00 b9 d7 05 00 00 00 00 00   .-9[............
0020  02 00 00 00 02 00 00 00 00 00 00 00 00 00 00 00   ................
0030  00 00 00 00 00 00 00 00 00 02 00 00 00 00 00 00   ................
0040  30 03                                             0.

Frame 241: 64 bytes on wire (512 bits), 64 bytes captured (512 bits) on interface 0
    Interface id: 0 (unknown)
        Interface name: unknown
    Encapsulation type: USB packets with Linux header and padding (115)
    Arrival Time: Jul  1, 2018 15:38:07.383378000 EDT
    [Time shift for this packet: 0.000000000 seconds]
    Epoch Time: 1530473887.383378000 seconds
    [Time delta from previous captured frame: 0.000473000 seconds]
    [Time delta from previous displayed frame: 0.000473000 seconds]
    [Time since reference or first frame: 262.521445000 seconds]
    Frame Number: 241
    Frame Length: 64 bytes (512 bits)
    Capture Length: 64 bytes (512 bits)
    [Frame is marked: False]
    [Frame is ignored: False]
    [Protocols in frame: usb]
USB URB
    [Source: host]
    [Destination: 3.3.2]
    URB id: 0xffff89fbe8d2e3c0
    URB type: URB_SUBMIT ('S')
    URB transfer type: URB_BULK (0x03)
    Endpoint: 0x82, Direction: IN
        1... .... = Direction: IN (1)
        .... 0010 = Endpoint number: 2
    Device: 3
    URB bus id: 3
    Device setup request: not relevant ('-')
    Data: not present ('<')
    URB sec: 1530473887
    URB usec: 383378
    URB status: Operation now in progress (-EINPROGRESS) (-115)
    URB length [bytes]: 64
    Data length [bytes]: 0
    [Response in: 242]
    [bInterfaceClass: Printer (0x07)]
    Unused Setup Header
    Interval: 0
    Start frame: 0
    Copy of Transfer Flags: 0x00000200
    Number of ISO descriptors: 0

0000  c0 e3 d2 e8 fb 89 ff ff 53 03 82 03 03 00 2d 3c   ........S.....-<
0010  9f 2d 39 5b 00 00 00 00 92 d9 05 00 8d ff ff ff   .-9[............
0020  40 00 00 00 00 00 00 00 00 00 00 00 00 00 00 00   @...............
0030  00 00 00 00 00 00 00 00 00 02 00 00 00 00 00 00   ................

Frame 242: 64 bytes on wire (512 bits), 64 bytes captured (512 bits) on interface 0
    Interface id: 0 (unknown)
        Interface name: unknown
    Encapsulation type: USB packets with Linux header and padding (115)
    Arrival Time: Jul  1, 2018 15:38:07.394121000 EDT
    [Time shift for this packet: 0.000000000 seconds]
    Epoch Time: 1530473887.394121000 seconds
    [Time delta from previous captured frame: 0.010743000 seconds]
    [Time delta from previous displayed frame: 0.010743000 seconds]
    [Time since reference or first frame: 262.532188000 seconds]
    Frame Number: 242
    Frame Length: 64 bytes (512 bits)
    Capture Length: 64 bytes (512 bits)
    [Frame is marked: False]
    [Frame is ignored: False]
    [Protocols in frame: usb]
USB URB
    [Source: 3.3.2]
    [Destination: host]
    URB id: 0xffff89fbe8d2e3c0
    URB type: URB_COMPLETE ('C')
    URB transfer type: URB_BULK (0x03)
    Endpoint: 0x82, Direction: IN
        1... .... = Direction: IN (1)
        .... 0010 = Endpoint number: 2
    Device: 3
    URB bus id: 3
    Device setup request: not relevant ('-')
    Data: present (0)
    URB sec: 1530473887
    URB usec: 394121
    URB status: No such file or directory (-ENOENT) (-2)
    URB length [bytes]: 0
    Data length [bytes]: 0
    [Request in: 241]
    [Time from request: 0.010743000 seconds]
    [bInterfaceClass: Printer (0x07)]
    Unused Setup Header
    Interval: 0
    Start frame: 0
    Copy of Transfer Flags: 0x00000200
    Number of ISO descriptors: 0

0000  c0 e3 d2 e8 fb 89 ff ff 43 03 82 03 03 00 2d 00   ........C.....-.
0010  9f 2d 39 5b 00 00 00 00 89 03 06 00 fe ff ff ff   .-9[............
0020  00 00 00 00 00 00 00 00 00 00 00 00 00 00 00 00   ................
0030  00 00 00 00 00 00 00 00 00 02 00 00 00 00 00 00   ................

Frame 243: 66 bytes on wire (528 bits), 66 bytes captured (528 bits) on interface 0
    Interface id: 0 (unknown)
        Interface name: unknown
    Encapsulation type: USB packets with Linux header and padding (115)
    Arrival Time: Jul  1, 2018 15:38:07.394680000 EDT
    [Time shift for this packet: 0.000000000 seconds]
    Epoch Time: 1530473887.394680000 seconds
    [Time delta from previous captured frame: 0.000559000 seconds]
    [Time delta from previous displayed frame: 0.000559000 seconds]
    [Time since reference or first frame: 262.532747000 seconds]
    Frame Number: 243
    Frame Length: 66 bytes (528 bits)
    Capture Length: 66 bytes (528 bits)
    [Frame is marked: False]
    [Frame is ignored: False]
    [Protocols in frame: usb]
USB URB
    [Source: host]
    [Destination: 3.3.1]
    URB id: 0xffff89fbe8d2e3c0
    URB type: URB_SUBMIT ('S')
    URB transfer type: URB_BULK (0x03)
    Endpoint: 0x01, Direction: OUT
        0... .... = Direction: OUT (0)
        .... 0001 = Endpoint number: 1
    Device: 3
    URB bus id: 3
    Device setup request: not relevant ('-')
    Data: present (0)
    URB sec: 1530473887
    URB usec: 394680
    URB status: Operation now in progress (-EINPROGRESS) (-115)
    URB length [bytes]: 2
    Data length [bytes]: 2
    [Response in: 244]
    [bInterfaceClass: Printer (0x07)]
    Unused Setup Header
    Interval: 0
    Start frame: 0
    Copy of Transfer Flags: 0x00000000
    Number of ISO descriptors: 0
Leftover Capture Data: 4803

0000  c0 e3 d2 e8 fb 89 ff ff 53 03 01 03 03 00 2d 00   ........S.....-.
0010  9f 2d 39 5b 00 00 00 00 b8 05 06 00 8d ff ff ff   .-9[............
0020  02 00 00 00 02 00 00 00 00 00 00 00 00 00 00 00   ................
0030  00 00 00 00 00 00 00 00 00 00 00 00 00 00 00 00   ................
0040  48 03                                             H.

Frame 244: 64 bytes on wire (512 bits), 64 bytes captured (512 bits) on interface 0
    Interface id: 0 (unknown)
        Interface name: unknown
    Encapsulation type: USB packets with Linux header and padding (115)
    Arrival Time: Jul  1, 2018 15:38:07.394728000 EDT
    [Time shift for this packet: 0.000000000 seconds]
    Epoch Time: 1530473887.394728000 seconds
    [Time delta from previous captured frame: 0.000048000 seconds]
    [Time delta from previous displayed frame: 0.000048000 seconds]
    [Time since reference or first frame: 262.532795000 seconds]
    Frame Number: 244
    Frame Length: 64 bytes (512 bits)
    Capture Length: 64 bytes (512 bits)
    [Frame is marked: False]
    [Frame is ignored: False]
    [Protocols in frame: usb]
USB URB
    [Source: 3.3.1]
    [Destination: host]
    URB id: 0xffff89fbe8d2e3c0
    URB type: URB_COMPLETE ('C')
    URB transfer type: URB_BULK (0x03)
    Endpoint: 0x01, Direction: OUT
        0... .... = Direction: OUT (0)
        .... 0001 = Endpoint number: 1
    Device: 3
    URB bus id: 3
    Device setup request: not relevant ('-')
    Data: not present ('>')
    URB sec: 1530473887
    URB usec: 394728
    URB status: Success (0)
    URB length [bytes]: 2
    Data length [bytes]: 0
    [Request in: 243]
    [Time from request: 0.000048000 seconds]
    [bInterfaceClass: Printer (0x07)]
    Unused Setup Header
    Interval: 0
    Start frame: 0
    Copy of Transfer Flags: 0x00000000
    Number of ISO descriptors: 0

0000  c0 e3 d2 e8 fb 89 ff ff 43 03 01 03 03 00 2d 3e   ........C.....->
0010  9f 2d 39 5b 00 00 00 00 e8 05 06 00 00 00 00 00   .-9[............
0020  02 00 00 00 00 00 00 00 00 00 00 00 00 00 00 00   ................
0030  00 00 00 00 00 00 00 00 00 00 00 00 00 00 00 00   ................

Frame 245: 64 bytes on wire (512 bits), 64 bytes captured (512 bits) on interface 0
    Interface id: 0 (unknown)
        Interface name: unknown
    Encapsulation type: USB packets with Linux header and padding (115)
    Arrival Time: Jul  1, 2018 15:38:07.395065000 EDT
    [Time shift for this packet: 0.000000000 seconds]
    Epoch Time: 1530473887.395065000 seconds
    [Time delta from previous captured frame: 0.000337000 seconds]
    [Time delta from previous displayed frame: 0.000337000 seconds]
    [Time since reference or first frame: 262.533132000 seconds]
    Frame Number: 245
    Frame Length: 64 bytes (512 bits)
    Capture Length: 64 bytes (512 bits)
    [Frame is marked: False]
    [Frame is ignored: False]
    [Protocols in frame: usb]
USB URB
    [Source: host]
    [Destination: 3.3.2]
    URB id: 0xffff89fbe8d2e3c0
    URB type: URB_SUBMIT ('S')
    URB transfer type: URB_BULK (0x03)
    Endpoint: 0x82, Direction: IN
        1... .... = Direction: IN (1)
        .... 0010 = Endpoint number: 2
    Device: 3
    URB bus id: 3
    Device setup request: not relevant ('-')
    Data: not present ('<')
    URB sec: 1530473887
    URB usec: 395065
    URB status: Operation now in progress (-EINPROGRESS) (-115)
    URB length [bytes]: 64
    Data length [bytes]: 0
    [Response in: 246]
    [bInterfaceClass: Printer (0x07)]
    Unused Setup Header
    Interval: 0
    Start frame: 0
    Copy of Transfer Flags: 0x00000200
    Number of ISO descriptors: 0

0000  c0 e3 d2 e8 fb 89 ff ff 53 03 82 03 03 00 2d 3c   ........S.....-<
0010  9f 2d 39 5b 00 00 00 00 39 07 06 00 8d ff ff ff   .-9[....9.......
0020  40 00 00 00 00 00 00 00 00 00 00 00 00 00 00 00   @...............
0030  00 00 00 00 00 00 00 00 00 02 00 00 00 00 00 00   ................

Frame 246: 64 bytes on wire (512 bits), 64 bytes captured (512 bits) on interface 0
    Interface id: 0 (unknown)
        Interface name: unknown
    Encapsulation type: USB packets with Linux header and padding (115)
    Arrival Time: Jul  1, 2018 15:38:07.406121000 EDT
    [Time shift for this packet: 0.000000000 seconds]
    Epoch Time: 1530473887.406121000 seconds
    [Time delta from previous captured frame: 0.011056000 seconds]
    [Time delta from previous displayed frame: 0.011056000 seconds]
    [Time since reference or first frame: 262.544188000 seconds]
    Frame Number: 246
    Frame Length: 64 bytes (512 bits)
    Capture Length: 64 bytes (512 bits)
    [Frame is marked: False]
    [Frame is ignored: False]
    [Protocols in frame: usb]
USB URB
    [Source: 3.3.2]
    [Destination: host]
    URB id: 0xffff89fbe8d2e3c0
    URB type: URB_COMPLETE ('C')
    URB transfer type: URB_BULK (0x03)
    Endpoint: 0x82, Direction: IN
        1... .... = Direction: IN (1)
        .... 0010 = Endpoint number: 2
    Device: 3
    URB bus id: 3
    Device setup request: not relevant ('-')
    Data: present (0)
    URB sec: 1530473887
    URB usec: 406121
    URB status: No such file or directory (-ENOENT) (-2)
    URB length [bytes]: 0
    Data length [bytes]: 0
    [Request in: 245]
    [Time from request: 0.011056000 seconds]
    [bInterfaceClass: Printer (0x07)]
    Unused Setup Header
    Interval: 0
    Start frame: 0
    Copy of Transfer Flags: 0x00000200
    Number of ISO descriptors: 0

0000  c0 e3 d2 e8 fb 89 ff ff 43 03 82 03 03 00 2d 00   ........C.....-.
0010  9f 2d 39 5b 00 00 00 00 69 32 06 00 fe ff ff ff   .-9[....i2......
0020  00 00 00 00 00 00 00 00 00 00 00 00 00 00 00 00   ................
0030  00 00 00 00 00 00 00 00 00 02 00 00 00 00 00 00   ................

Frame 247: 66 bytes on wire (528 bits), 66 bytes captured (528 bits) on interface 0
    Interface id: 0 (unknown)
        Interface name: unknown
    Encapsulation type: USB packets with Linux header and padding (115)
    Arrival Time: Jul  1, 2018 15:38:07.406720000 EDT
    [Time shift for this packet: 0.000000000 seconds]
    Epoch Time: 1530473887.406720000 seconds
    [Time delta from previous captured frame: 0.000599000 seconds]
    [Time delta from previous displayed frame: 0.000599000 seconds]
    [Time since reference or first frame: 262.544787000 seconds]
    Frame Number: 247
    Frame Length: 66 bytes (528 bits)
    Capture Length: 66 bytes (528 bits)
    [Frame is marked: False]
    [Frame is ignored: False]
    [Protocols in frame: usb]
USB URB
    [Source: host]
    [Destination: 3.3.1]
    URB id: 0xffff89fbe8d2e3c0
    URB type: URB_SUBMIT ('S')
    URB transfer type: URB_BULK (0x03)
    Endpoint: 0x01, Direction: OUT
        0... .... = Direction: OUT (0)
        .... 0001 = Endpoint number: 1
    Device: 3
    URB bus id: 3
    Device setup request: not relevant ('-')
    Data: present (0)
    URB sec: 1530473887
    URB usec: 406720
    URB status: Operation now in progress (-EINPROGRESS) (-115)
    URB length [bytes]: 2
    Data length [bytes]: 2
    [Response in: 248]
    [bInterfaceClass: Printer (0x07)]
    Unused Setup Header
    Interval: 0
    Start frame: 0
    Copy of Transfer Flags: 0x00000000
    Number of ISO descriptors: 0
Leftover Capture Data: 1b05

0000  c0 e3 d2 e8 fb 89 ff ff 53 03 01 03 03 00 2d 00   ........S.....-.
0010  9f 2d 39 5b 00 00 00 00 c0 34 06 00 8d ff ff ff   .-9[.....4......
0020  02 00 00 00 02 00 00 00 00 00 00 00 00 00 00 00   ................
0030  00 00 00 00 00 00 00 00 00 00 00 00 00 00 00 00   ................
0040  1b 05                                             ..

Frame 248: 64 bytes on wire (512 bits), 64 bytes captured (512 bits) on interface 0
    Interface id: 0 (unknown)
        Interface name: unknown
    Encapsulation type: USB packets with Linux header and padding (115)
    Arrival Time: Jul  1, 2018 15:38:07.464971000 EDT
    [Time shift for this packet: 0.000000000 seconds]
    Epoch Time: 1530473887.464971000 seconds
    [Time delta from previous captured frame: 0.058251000 seconds]
    [Time delta from previous displayed frame: 0.058251000 seconds]
    [Time since reference or first frame: 262.603038000 seconds]
    Frame Number: 248
    Frame Length: 64 bytes (512 bits)
    Capture Length: 64 bytes (512 bits)
    [Frame is marked: False]
    [Frame is ignored: False]
    [Protocols in frame: usb]
USB URB
    [Source: 3.3.1]
    [Destination: host]
    URB id: 0xffff89fbe8d2e3c0
    URB type: URB_COMPLETE ('C')
    URB transfer type: URB_BULK (0x03)
    Endpoint: 0x01, Direction: OUT
        0... .... = Direction: OUT (0)
        .... 0001 = Endpoint number: 1
    Device: 3
    URB bus id: 3
    Device setup request: not relevant ('-')
    Data: not present ('>')
    URB sec: 1530473887
    URB usec: 464971
    URB status: Success (0)
    URB length [bytes]: 2
    Data length [bytes]: 0
    [Request in: 247]
    [Time from request: 0.058251000 seconds]
    [bInterfaceClass: Printer (0x07)]
    Unused Setup Header
    Interval: 0
    Start frame: 0
    Copy of Transfer Flags: 0x00000000
    Number of ISO descriptors: 0

0000  c0 e3 d2 e8 fb 89 ff ff 43 03 01 03 03 00 2d 3e   ........C.....->
0010  9f 2d 39 5b 00 00 00 00 4b 18 07 00 00 00 00 00   .-9[....K.......
0020  02 00 00 00 00 00 00 00 00 00 00 00 00 00 00 00   ................
0030  00 00 00 00 00 00 00 00 00 00 00 00 00 00 00 00   ................

Frame 249: 64 bytes on wire (512 bits), 64 bytes captured (512 bits) on interface 0
    Interface id: 0 (unknown)
        Interface name: unknown
    Encapsulation type: USB packets with Linux header and padding (115)
    Arrival Time: Jul  1, 2018 15:38:07.465408000 EDT
    [Time shift for this packet: 0.000000000 seconds]
    Epoch Time: 1530473887.465408000 seconds
    [Time delta from previous captured frame: 0.000437000 seconds]
    [Time delta from previous displayed frame: 0.000437000 seconds]
    [Time since reference or first frame: 262.603475000 seconds]
    Frame Number: 249
    Frame Length: 64 bytes (512 bits)
    Capture Length: 64 bytes (512 bits)
    [Frame is marked: False]
    [Frame is ignored: False]
    [Protocols in frame: usb]
USB URB
    [Source: host]
    [Destination: 3.3.2]
    URB id: 0xffff89fbe8d2e3c0
    URB type: URB_SUBMIT ('S')
    URB transfer type: URB_BULK (0x03)
    Endpoint: 0x82, Direction: IN
        1... .... = Direction: IN (1)
        .... 0010 = Endpoint number: 2
    Device: 3
    URB bus id: 3
    Device setup request: not relevant ('-')
    Data: not present ('<')
    URB sec: 1530473887
    URB usec: 465408
    URB status: Operation now in progress (-EINPROGRESS) (-115)
    URB length [bytes]: 64
    Data length [bytes]: 0
    [Response in: 250]
    [bInterfaceClass: Printer (0x07)]
    Unused Setup Header
    Interval: 0
    Start frame: 0
    Copy of Transfer Flags: 0x00000200
    Number of ISO descriptors: 0

0000  c0 e3 d2 e8 fb 89 ff ff 53 03 82 03 03 00 2d 3c   ........S.....-<
0010  9f 2d 39 5b 00 00 00 00 00 1a 07 00 8d ff ff ff   .-9[............
0020  40 00 00 00 00 00 00 00 00 00 00 00 00 00 00 00   @...............
0030  00 00 00 00 00 00 00 00 00 02 00 00 00 00 00 00   ................

Packet comments
    Finished
        [Expert Info (Comment/Comment): Finished]
            [Finished]
            [Severity level: Comment]
            [Group: Comment]
Frame 250: 66 bytes on wire (528 bits), 66 bytes captured (528 bits) on interface 0
    Interface id: 0 (unknown)
        Interface name: unknown
    Encapsulation type: USB packets with Linux header and padding (115)
    Arrival Time: Jul  1, 2018 15:38:07.628929000 EDT
    [Time shift for this packet: 0.000000000 seconds]
    Epoch Time: 1530473887.628929000 seconds
    [Time delta from previous captured frame: 0.163521000 seconds]
    [Time delta from previous displayed frame: 0.163521000 seconds]
    [Time since reference or first frame: 262.766996000 seconds]
    Frame Number: 250
    Frame Length: 66 bytes (528 bits)
    Capture Length: 66 bytes (528 bits)
    [Frame is marked: False]
    [Frame is ignored: False]
    [Protocols in frame: usb]
USB URB
    [Source: 3.3.2]
    [Destination: host]
    URB id: 0xffff89fbe8d2e3c0
    URB type: URB_COMPLETE ('C')
    URB transfer type: URB_BULK (0x03)
    Endpoint: 0x82, Direction: IN
        1... .... = Direction: IN (1)
        .... 0010 = Endpoint number: 2
    Device: 3
    URB bus id: 3
    Device setup request: not relevant ('-')
    Data: present (0)
    URB sec: 1530473887
    URB usec: 628929
    URB status: Success (0)
    URB length [bytes]: 2
    Data length [bytes]: 2
    [Request in: 249]
    [Time from request: 0.163521000 seconds]
    [bInterfaceClass: Printer (0x07)]
    Unused Setup Header
    Interval: 0
    Start frame: 0
    Copy of Transfer Flags: 0x00000200
    Number of ISO descriptors: 0
Leftover Capture Data: 3103

0000  c0 e3 d2 e8 fb 89 ff ff 43 03 82 03 03 00 2d 00   ........C.....-.
0010  9f 2d 39 5b 00 00 00 00 c1 98 09 00 00 00 00 00   .-9[............
0020  02 00 00 00 02 00 00 00 00 00 00 00 00 00 00 00   ................
0030  00 00 00 00 00 00 00 00 00 02 00 00 00 00 00 00   ................
0040  31 03                                             1.

