Frame 1: 82 bytes on wire (656 bits), 82 bytes captured (656 bits) on interface 0
    Interface id: 0 (unknown)
        Interface name: unknown
    Encapsulation type: USB packets with Linux header and padding (115)
    Arrival Time: Jul  1, 2018 21:53:49.522251000 EDT
    [Time shift for this packet: 0.000000000 seconds]
    Epoch Time: 1530496429.522251000 seconds
    [Time delta from previous captured frame: 0.000000000 seconds]
    [Time delta from previous displayed frame: 0.000000000 seconds]
    [Time since reference or first frame: 0.000000000 seconds]
    Frame Number: 1
    Frame Length: 82 bytes (656 bits)
    Capture Length: 82 bytes (656 bits)
    [Frame is marked: False]
    [Frame is ignored: False]
    [Protocols in frame: usb]
USB URB
    [Source: 3.3.0]
    [Destination: host]
    URB id: 0xffff89fc92459300
    URB type: URB_COMPLETE ('C')
    URB transfer type: URB_CONTROL (0x02)
    Endpoint: 0x80, Direction: IN
        1... .... = Direction: IN (1)
        .... 0000 = Endpoint number: 0
    Device: 3
    URB bus id: 3
    Device setup request: not relevant ('-')
    Data: present (0)
    URB sec: 1530496429
    URB usec: 522251
    URB status: Success (0)
    URB length [bytes]: 18
    Data length [bytes]: 18
    Unused Setup Header
    Interval: 0
    Start frame: 0
    Copy of Transfer Flags: 0x00000200
    Number of ISO descriptors: 0
CONTROL response data: 12010002000000404d0b2f11000100000101

0000  00 93 45 92 fc 89 ff ff 43 02 80 03 03 00 2d 00   ..E.....C.....-.
0010  ad 85 39 5b 00 00 00 00 0b f8 07 00 00 00 00 00   ..9[............
0020  12 00 00 00 12 00 00 00 00 00 00 00 00 00 00 00   ................
0030  00 00 00 00 00 00 00 00 00 02 00 00 00 00 00 00   ................
0040  12 01 00 02 00 00 00 40 4d 0b 2f 11 00 01 00 00   .......@M./.....
0050  01 01                                             ..

Frame 2: 82 bytes on wire (656 bits), 82 bytes captured (656 bits) on interface 0
    Interface id: 0 (unknown)
        Interface name: unknown
    Encapsulation type: USB packets with Linux header and padding (115)
    Arrival Time: Jul  1, 2018 21:54:06.651296000 EDT
    [Time shift for this packet: 0.000000000 seconds]
    Epoch Time: 1530496446.651296000 seconds
    [Time delta from previous captured frame: 17.129045000 seconds]
    [Time delta from previous displayed frame: 17.129045000 seconds]
    [Time since reference or first frame: 17.129045000 seconds]
    Frame Number: 2
    Frame Length: 82 bytes (656 bits)
    Capture Length: 82 bytes (656 bits)
    [Frame is marked: False]
    [Frame is ignored: False]
    [Protocols in frame: usb]
USB URB
    [Source: 3.3.0]
    [Destination: host]
    URB id: 0xffff89fc924593c0
    URB type: URB_COMPLETE ('C')
    URB transfer type: URB_CONTROL (0x02)
    Endpoint: 0x80, Direction: IN
        1... .... = Direction: IN (1)
        .... 0000 = Endpoint number: 0
    Device: 3
    URB bus id: 3
    Device setup request: not relevant ('-')
    Data: present (0)
    URB sec: 1530496446
    URB usec: 651296
    URB status: Success (0)
    URB length [bytes]: 18
    Data length [bytes]: 18
    Unused Setup Header
    Interval: 0
    Start frame: 0
    Copy of Transfer Flags: 0x00000200
    Number of ISO descriptors: 0
CONTROL response data: 12010002000000404d0b2f11000100000101

0000  c0 93 45 92 fc 89 ff ff 43 02 80 03 03 00 2d 00   ..E.....C.....-.
0010  be 85 39 5b 00 00 00 00 20 f0 09 00 00 00 00 00   ..9[.... .......
0020  12 00 00 00 12 00 00 00 00 00 00 00 00 00 00 00   ................
0030  00 00 00 00 00 00 00 00 00 02 00 00 00 00 00 00   ................
0040  12 01 00 02 00 00 00 40 4d 0b 2f 11 00 01 00 00   .......@M./.....
0050  01 01                                             ..

Frame 3: 82 bytes on wire (656 bits), 82 bytes captured (656 bits) on interface 0
    Interface id: 0 (unknown)
        Interface name: unknown
    Encapsulation type: USB packets with Linux header and padding (115)
    Arrival Time: Jul  1, 2018 21:54:06.701350000 EDT
    [Time shift for this packet: 0.000000000 seconds]
    Epoch Time: 1530496446.701350000 seconds
    [Time delta from previous captured frame: 0.050054000 seconds]
    [Time delta from previous displayed frame: 0.050054000 seconds]
    [Time since reference or first frame: 17.179099000 seconds]
    Frame Number: 3
    Frame Length: 82 bytes (656 bits)
    Capture Length: 82 bytes (656 bits)
    [Frame is marked: False]
    [Frame is ignored: False]
    [Protocols in frame: usb]
USB URB
    [Source: 3.3.0]
    [Destination: host]
    URB id: 0xffff89fd4f8a4180
    URB type: URB_COMPLETE ('C')
    URB transfer type: URB_CONTROL (0x02)
    Endpoint: 0x80, Direction: IN
        1... .... = Direction: IN (1)
        .... 0000 = Endpoint number: 0
    Device: 3
    URB bus id: 3
    Device setup request: not relevant ('-')
    Data: present (0)
    URB sec: 1530496446
    URB usec: 701350
    URB status: Success (0)
    URB length [bytes]: 18
    Data length [bytes]: 18
    Unused Setup Header
    Interval: 0
    Start frame: 0
    Copy of Transfer Flags: 0x00000200
    Number of ISO descriptors: 0
CONTROL response data: 12010002000000404d0b2f11000100000101

0000  80 41 8a 4f fd 89 ff ff 43 02 80 03 03 00 2d 00   .A.O....C.....-.
0010  be 85 39 5b 00 00 00 00 a6 b3 0a 00 00 00 00 00   ..9[............
0020  12 00 00 00 12 00 00 00 00 00 00 00 00 00 00 00   ................
0030  00 00 00 00 00 00 00 00 00 02 00 00 00 00 00 00   ................
0040  12 01 00 02 00 00 00 40 4d 0b 2f 11 00 01 00 00   .......@M./.....
0050  01 01                                             ..

Frame 4: 96 bytes on wire (768 bits), 96 bytes captured (768 bits) on interface 0
    Interface id: 0 (unknown)
        Interface name: unknown
    Encapsulation type: USB packets with Linux header and padding (115)
    Arrival Time: Jul  1, 2018 21:54:06.707306000 EDT
    [Time shift for this packet: 0.000000000 seconds]
    Epoch Time: 1530496446.707306000 seconds
    [Time delta from previous captured frame: 0.005956000 seconds]
    [Time delta from previous displayed frame: 0.005956000 seconds]
    [Time since reference or first frame: 17.185055000 seconds]
    Frame Number: 4
    Frame Length: 96 bytes (768 bits)
    Capture Length: 96 bytes (768 bits)
    [Frame is marked: False]
    [Frame is ignored: False]
    [Protocols in frame: usb]
USB URB
    [Source: 3.3.0]
    [Destination: host]
    URB id: 0xffff89fd4f8a4180
    URB type: URB_COMPLETE ('C')
    URB transfer type: URB_CONTROL (0x02)
    Endpoint: 0x80, Direction: IN
        1... .... = Direction: IN (1)
        .... 0000 = Endpoint number: 0
    Device: 3
    URB bus id: 3
    Device setup request: not relevant ('-')
    Data: present (0)
    URB sec: 1530496446
    URB usec: 707306
    URB status: Success (0)
    URB length [bytes]: 32
    Data length [bytes]: 32
    Unused Setup Header
    Interval: 0
    Start frame: 0
    Copy of Transfer Flags: 0x00000200
    Number of ISO descriptors: 0
CONTROL response data: 09022000010100c032090400000207010200070501024000...

0000  80 41 8a 4f fd 89 ff ff 43 02 80 03 03 00 2d 00   .A.O....C.....-.
0010  be 85 39 5b 00 00 00 00 ea ca 0a 00 00 00 00 00   ..9[............
0020  20 00 00 00 20 00 00 00 00 00 00 00 00 00 00 00    ... ...........
0030  00 00 00 00 00 00 00 00 00 02 00 00 00 00 00 00   ................
0040  09 02 20 00 01 01 00 c0 32 09 04 00 00 02 07 01   .. .....2.......
0050  02 00 07 05 01 02 40 00 00 07 05 82 02 40 00 00   ......@......@..

Frame 5: 80 bytes on wire (640 bits), 80 bytes captured (640 bits) on interface 0
    Interface id: 0 (unknown)
        Interface name: unknown
    Encapsulation type: USB packets with Linux header and padding (115)
    Arrival Time: Jul  1, 2018 21:54:06.713320000 EDT
    [Time shift for this packet: 0.000000000 seconds]
    Epoch Time: 1530496446.713320000 seconds
    [Time delta from previous captured frame: 0.006014000 seconds]
    [Time delta from previous displayed frame: 0.006014000 seconds]
    [Time since reference or first frame: 17.191069000 seconds]
    Frame Number: 5
    Frame Length: 80 bytes (640 bits)
    Capture Length: 80 bytes (640 bits)
    [Frame is marked: False]
    [Frame is ignored: False]
    [Protocols in frame: usb]
USB URB
    [Source: 3.3.0]
    [Destination: host]
    URB id: 0xffff89fd4f8a4180
    URB type: URB_COMPLETE ('C')
    URB transfer type: URB_CONTROL (0x02)
    Endpoint: 0x80, Direction: IN
        1... .... = Direction: IN (1)
        .... 0000 = Endpoint number: 0
    Device: 3
    URB bus id: 3
    Device setup request: not relevant ('-')
    Data: present (0)
    URB sec: 1530496446
    URB usec: 713320
    URB status: Success (0)
    URB length [bytes]: 16
    Data length [bytes]: 16
    Unused Setup Header
    Interval: 0
    Start frame: 0
    Copy of Transfer Flags: 0x00000200
    Number of ISO descriptors: 0
CONTROL response data: 10033300390033003900300000000000

0000  80 41 8a 4f fd 89 ff ff 43 02 80 03 03 00 2d 00   .A.O....C.....-.
0010  be 85 39 5b 00 00 00 00 68 e2 0a 00 00 00 00 00   ..9[....h.......
0020  10 00 00 00 10 00 00 00 00 00 00 00 00 00 00 00   ................
0030  00 00 00 00 00 00 00 00 00 02 00 00 00 00 00 00   ................
0040  10 03 33 00 39 00 33 00 39 00 30 00 00 00 00 00   ..3.9.3.9.0.....

Frame 6: 64 bytes on wire (512 bits), 64 bytes captured (512 bits) on interface 0
    Interface id: 0 (unknown)
        Interface name: unknown
    Encapsulation type: USB packets with Linux header and padding (115)
    Arrival Time: Jul  1, 2018 21:54:06.717363000 EDT
    [Time shift for this packet: 0.000000000 seconds]
    Epoch Time: 1530496446.717363000 seconds
    [Time delta from previous captured frame: 0.004043000 seconds]
    [Time delta from previous displayed frame: 0.004043000 seconds]
    [Time since reference or first frame: 17.195112000 seconds]
    Frame Number: 6
    Frame Length: 64 bytes (512 bits)
    Capture Length: 64 bytes (512 bits)
    [Frame is marked: False]
    [Frame is ignored: False]
    [Protocols in frame: usb]
USB URB
    [Source: 3.3.0]
    [Destination: host]
    URB id: 0xffff89fd4f8a4180
    URB type: URB_COMPLETE ('C')
    URB transfer type: URB_CONTROL (0x02)
    Endpoint: 0x80, Direction: IN
        1... .... = Direction: IN (1)
        .... 0000 = Endpoint number: 0
    Device: 3
    URB bus id: 3
    Device setup request: not relevant ('-')
    Data: present (0)
    URB sec: 1530496446
    URB usec: 717363
    URB status: Broken pipe (-EPIPE) (-32)
    URB length [bytes]: 0
    Data length [bytes]: 0
    Unused Setup Header
    Interval: 0
    Start frame: 0
    Copy of Transfer Flags: 0x00000200
    Number of ISO descriptors: 0

0000  80 41 8a 4f fd 89 ff ff 43 02 80 03 03 00 2d 00   .A.O....C.....-.
0010  be 85 39 5b 00 00 00 00 33 f2 0a 00 e0 ff ff ff   ..9[....3.......
0020  00 00 00 00 00 00 00 00 00 00 00 00 00 00 00 00   ................
0030  00 00 00 00 00 00 00 00 00 02 00 00 00 00 00 00   ................

Frame 7: 96 bytes on wire (768 bits), 96 bytes captured (768 bits) on interface 0
    Interface id: 0 (unknown)
        Interface name: unknown
    Encapsulation type: USB packets with Linux header and padding (115)
    Arrival Time: Jul  1, 2018 21:54:06.936348000 EDT
    [Time shift for this packet: 0.000000000 seconds]
    Epoch Time: 1530496446.936348000 seconds
    [Time delta from previous captured frame: 0.218985000 seconds]
    [Time delta from previous displayed frame: 0.218985000 seconds]
    [Time since reference or first frame: 17.414097000 seconds]
    Frame Number: 7
    Frame Length: 96 bytes (768 bits)
    Capture Length: 96 bytes (768 bits)
    [Frame is marked: False]
    [Frame is ignored: False]
    [Protocols in frame: usb]
USB URB
    [Source: 3.3.0]
    [Destination: host]
    URB id: 0xffff89fd08dbb0c0
    URB type: URB_COMPLETE ('C')
    URB transfer type: URB_CONTROL (0x02)
    Endpoint: 0x80, Direction: IN
        1... .... = Direction: IN (1)
        .... 0000 = Endpoint number: 0
    Device: 3
    URB bus id: 3
    Device setup request: not relevant ('-')
    Data: present (0)
    URB sec: 1530496446
    URB usec: 936348
    URB status: Success (0)
    URB length [bytes]: 32
    Data length [bytes]: 32
    Unused Setup Header
    Interval: 0
    Start frame: 0
    Copy of Transfer Flags: 0x00000200
    Number of ISO descriptors: 0
CONTROL response data: 09022000010100c032090400000207010200070501024000...

0000  c0 b0 db 08 fd 89 ff ff 43 02 80 03 03 00 2d 00   ........C.....-.
0010  be 85 39 5b 00 00 00 00 9c 49 0e 00 00 00 00 00   ..9[.....I......
0020  20 00 00 00 20 00 00 00 00 00 00 00 00 00 00 00    ... ...........
0030  00 00 00 00 00 00 00 00 00 02 00 00 00 00 00 00   ................
0040  09 02 20 00 01 01 00 c0 32 09 04 00 00 02 07 01   .. .....2.......
0050  02 00 07 05 01 02 40 00 00 07 05 82 02 40 00 00   ......@......@..

Frame 8: 82 bytes on wire (656 bits), 82 bytes captured (656 bits) on interface 0
    Interface id: 0 (unknown)
        Interface name: unknown
    Encapsulation type: USB packets with Linux header and padding (115)
    Arrival Time: Jul  1, 2018 21:54:06.943310000 EDT
    [Time shift for this packet: 0.000000000 seconds]
    Epoch Time: 1530496446.943310000 seconds
    [Time delta from previous captured frame: 0.006962000 seconds]
    [Time delta from previous displayed frame: 0.006962000 seconds]
    [Time since reference or first frame: 17.421059000 seconds]
    Frame Number: 8
    Frame Length: 82 bytes (656 bits)
    Capture Length: 82 bytes (656 bits)
    [Frame is marked: False]
    [Frame is ignored: False]
    [Protocols in frame: usb]
USB URB
    [Source: 3.3.0]
    [Destination: host]
    URB id: 0xffff89fc92459480
    URB type: URB_COMPLETE ('C')
    URB transfer type: URB_CONTROL (0x02)
    Endpoint: 0x80, Direction: IN
        1... .... = Direction: IN (1)
        .... 0000 = Endpoint number: 0
    Device: 3
    URB bus id: 3
    Device setup request: not relevant ('-')
    Data: present (0)
    URB sec: 1530496446
    URB usec: 943310
    URB status: Success (0)
    URB length [bytes]: 18
    Data length [bytes]: 18
    Unused Setup Header
    Interval: 0
    Start frame: 0
    Copy of Transfer Flags: 0x00000200
    Number of ISO descriptors: 0
CONTROL response data: 12010002000000404d0b2f11000100000101

0000  80 94 45 92 fc 89 ff ff 43 02 80 03 03 00 2d 00   ..E.....C.....-.
0010  be 85 39 5b 00 00 00 00 ce 64 0e 00 00 00 00 00   ..9[.....d......
0020  12 00 00 00 12 00 00 00 00 00 00 00 00 00 00 00   ................
0030  00 00 00 00 00 00 00 00 00 02 00 00 00 00 00 00   ................
0040  12 01 00 02 00 00 00 40 4d 0b 2f 11 00 01 00 00   .......@M./.....
0050  01 01                                             ..

Packet comments
    The stuff above here cannot be valid, the device isn't even powered on!
        [Expert Info (Comment/Comment): The stuff above here cannot be valid, the device isn't even powered on!]
            [The stuff above here cannot be valid, the device isn't even powered on!]
            [Severity level: Comment]
            [Group: Comment]
Frame 9: 149 bytes on wire (1192 bits), 149 bytes captured (1192 bits) on interface 0
    Interface id: 0 (unknown)
        Interface name: unknown
    Encapsulation type: USB packets with Linux header and padding (115)
    Arrival Time: Jul  1, 2018 21:54:06.950314000 EDT
    [Time shift for this packet: 0.000000000 seconds]
    Epoch Time: 1530496446.950314000 seconds
    [Time delta from previous captured frame: 0.007004000 seconds]
    [Time delta from previous displayed frame: 0.007004000 seconds]
    [Time since reference or first frame: 17.428063000 seconds]
    Frame Number: 9
    Frame Length: 149 bytes (1192 bits)
    Capture Length: 149 bytes (1192 bits)
    [Frame is marked: False]
    [Frame is ignored: False]
    [Protocols in frame: usb]
USB URB
    [Source: 3.3.0]
    [Destination: host]
    URB id: 0xffff89fd08dbbc00
    URB type: URB_COMPLETE ('C')
    URB transfer type: URB_CONTROL (0x02)
    Endpoint: 0x80, Direction: IN
        1... .... = Direction: IN (1)
        .... 0000 = Endpoint number: 0
    Device: 3
    URB bus id: 3
    Device setup request: not relevant ('-')
    Data: present (0)
    URB sec: 1530496446
    URB usec: 950314
    URB status: Success (0)
    URB length [bytes]: 85
    Data length [bytes]: 85
    Unused Setup Header
    Interval: 0
    Start frame: 0
    Copy of Transfer Flags: 0x00000200
    Number of ISO descriptors: 0
CONTROL response data: 00554d414e5546414354555245523a53696c686f75657474...

0000  00 bc db 08 fd 89 ff ff 43 02 80 03 03 00 2d 00   ........C.....-.
0010  be 85 39 5b 00 00 00 00 2a 80 0e 00 00 00 00 00   ..9[....*.......
0020  55 00 00 00 55 00 00 00 00 00 00 00 00 00 00 00   U...U...........
0030  00 00 00 00 00 00 00 00 00 02 00 00 00 00 00 00   ................
0040  00 55 4d 41 4e 55 46 41 43 54 55 52 45 52 3a 53   .UMANUFACTURER:S
0050  69 6c 68 6f 75 65 74 74 65 3b 4d 4f 44 45 4c 3a   ilhouette;MODEL:
0060  43 41 4d 45 4f 20 33 3b 43 4c 41 53 53 3a 50 52   CAMEO 3;CLASS:PR
0070  49 4e 54 45 52 3b 44 45 53 43 52 49 50 54 49 4f   INTER;DESCRIPTIO
0080  4e 3a 53 69 6c 68 6f 75 65 74 74 65 20 43 41 4d   N:Silhouette CAM
0090  45 4f 20 33 3b                                    EO 3;

Frame 10: 66 bytes on wire (528 bits), 66 bytes captured (528 bits) on interface 0
    Interface id: 0 (unknown)
        Interface name: unknown
    Encapsulation type: USB packets with Linux header and padding (115)
    Arrival Time: Jul  1, 2018 21:55:31.162133000 EDT
    [Time shift for this packet: 0.000000000 seconds]
    Epoch Time: 1530496531.162133000 seconds
    [Time delta from previous captured frame: 84.211819000 seconds]
    [Time delta from previous displayed frame: 84.211819000 seconds]
    [Time since reference or first frame: 101.639882000 seconds]
    Frame Number: 10
    Frame Length: 66 bytes (528 bits)
    Capture Length: 66 bytes (528 bits)
    [Frame is marked: False]
    [Frame is ignored: False]
    [Protocols in frame: usb]
USB URB
    [Source: host]
    [Destination: 3.3.1]
    URB id: 0xffff89fc92459780
    URB type: URB_SUBMIT ('S')
    URB transfer type: URB_BULK (0x03)
    Endpoint: 0x01, Direction: OUT
        0... .... = Direction: OUT (0)
        .... 0001 = Endpoint number: 1
    Device: 3
    URB bus id: 3
    Device setup request: not relevant ('-')
    Data: present (0)
    URB sec: 1530496531
    URB usec: 162133
    URB status: Operation now in progress (-EINPROGRESS) (-115)
    URB length [bytes]: 2
    Data length [bytes]: 2
    [bInterfaceClass: Unknown (0xffff)]
    Unused Setup Header
    Interval: 0
    Start frame: 0
    Copy of Transfer Flags: 0x00000000
    Number of ISO descriptors: 0
Leftover Capture Data: 1b05

0000  80 97 45 92 fc 89 ff ff 53 03 01 03 03 00 2d 00   ..E.....S.....-.
0010  13 86 39 5b 00 00 00 00 55 79 02 00 8d ff ff ff   ..9[....Uy......
0020  02 00 00 00 02 00 00 00 00 00 00 00 00 00 00 00   ................
0030  00 00 00 00 00 00 00 00 00 00 00 00 00 00 00 00   ................
0040  1b 05                                             ..

Frame 11: 66 bytes on wire (528 bits), 66 bytes captured (528 bits) on interface 0
    Interface id: 0 (unknown)
        Interface name: unknown
    Encapsulation type: USB packets with Linux header and padding (115)
    Arrival Time: Jul  1, 2018 21:55:31.313515000 EDT
    [Time shift for this packet: 0.000000000 seconds]
    Epoch Time: 1530496531.313515000 seconds
    [Time delta from previous captured frame: 0.151382000 seconds]
    [Time delta from previous displayed frame: 0.151382000 seconds]
    [Time since reference or first frame: 101.791264000 seconds]
    Frame Number: 11
    Frame Length: 66 bytes (528 bits)
    Capture Length: 66 bytes (528 bits)
    [Frame is marked: False]
    [Frame is ignored: False]
    [Protocols in frame: usb]
USB URB
    [Source: 3.3.2]
    [Destination: host]
    URB id: 0xffff89fc9248cb40
    URB type: URB_COMPLETE ('C')
    URB transfer type: URB_BULK (0x03)
    Endpoint: 0x82, Direction: IN
        1... .... = Direction: IN (1)
        .... 0010 = Endpoint number: 2
    Device: 3
    URB bus id: 3
    Device setup request: not relevant ('-')
    Data: present (0)
    URB sec: 1530496531
    URB usec: 313515
    URB status: Remote I/O error (-EREMOTEIO) (-121)
    URB length [bytes]: 2
    Data length [bytes]: 2
    [bInterfaceClass: Unknown (0xffff)]
    Unused Setup Header
    Interval: 0
    Start frame: 0
    Copy of Transfer Flags: 0x00000201
    Number of ISO descriptors: 0
Leftover Capture Data: 3003

0000  40 cb 48 92 fc 89 ff ff 43 03 82 03 03 00 2d 00   @.H.....C.....-.
0010  13 86 39 5b 00 00 00 00 ab c8 04 00 87 ff ff ff   ..9[............
0020  02 00 00 00 02 00 00 00 00 00 00 00 00 00 00 00   ................
0030  00 00 00 00 00 00 00 00 01 02 00 00 00 00 00 00   ................
0040  30 03                                             0.

Frame 12: 67 bytes on wire (536 bits), 67 bytes captured (536 bits) on interface 0
    Interface id: 0 (unknown)
        Interface name: unknown
    Encapsulation type: USB packets with Linux header and padding (115)
    Arrival Time: Jul  1, 2018 21:55:32.744212000 EDT
    [Time shift for this packet: 0.000000000 seconds]
    Epoch Time: 1530496532.744212000 seconds
    [Time delta from previous captured frame: 1.430697000 seconds]
    [Time delta from previous displayed frame: 1.430697000 seconds]
    [Time since reference or first frame: 103.221961000 seconds]
    Frame Number: 12
    Frame Length: 67 bytes (536 bits)
    Capture Length: 67 bytes (536 bits)
    [Frame is marked: False]
    [Frame is ignored: False]
    [Protocols in frame: usb]
USB URB
    [Source: host]
    [Destination: 3.3.1]
    URB id: 0xffff89fc41ab89c0
    URB type: URB_SUBMIT ('S')
    URB transfer type: URB_BULK (0x03)
    Endpoint: 0x01, Direction: OUT
        0... .... = Direction: OUT (0)
        .... 0001 = Endpoint number: 1
    Device: 3
    URB bus id: 3
    Device setup request: not relevant ('-')
    Data: present (0)
    URB sec: 1530496532
    URB usec: 744212
    URB status: Operation now in progress (-EINPROGRESS) (-115)
    URB length [bytes]: 3
    Data length [bytes]: 3
    [bInterfaceClass: Unknown (0xffff)]
    Unused Setup Header
    Interval: 0
    Start frame: 0
    Copy of Transfer Flags: 0x00000000
    Number of ISO descriptors: 0
Leftover Capture Data: 464703

0000  c0 89 ab 41 fc 89 ff ff 53 03 01 03 03 00 2d 00   ...A....S.....-.
0010  14 86 39 5b 00 00 00 00 14 5b 0b 00 8d ff ff ff   ..9[.....[......
0020  03 00 00 00 03 00 00 00 00 00 00 00 00 00 00 00   ................
0030  00 00 00 00 00 00 00 00 00 00 00 00 00 00 00 00   ................
0040  46 47 03                                          FG.

Frame 13: 82 bytes on wire (656 bits), 82 bytes captured (656 bits) on interface 0
    Interface id: 0 (unknown)
        Interface name: unknown
    Encapsulation type: USB packets with Linux header and padding (115)
    Arrival Time: Jul  1, 2018 21:55:32.871537000 EDT
    [Time shift for this packet: 0.000000000 seconds]
    Epoch Time: 1530496532.871537000 seconds
    [Time delta from previous captured frame: 0.127325000 seconds]
    [Time delta from previous displayed frame: 0.127325000 seconds]
    [Time since reference or first frame: 103.349286000 seconds]
    Frame Number: 13
    Frame Length: 82 bytes (656 bits)
    Capture Length: 82 bytes (656 bits)
    [Frame is marked: False]
    [Frame is ignored: False]
    [Protocols in frame: usb]
USB URB
    [Source: 3.3.2]
    [Destination: host]
    URB id: 0xffff89fc41ab8000
    URB type: URB_COMPLETE ('C')
    URB transfer type: URB_BULK (0x03)
    Endpoint: 0x82, Direction: IN
        1... .... = Direction: IN (1)
        .... 0010 = Endpoint number: 2
    Device: 3
    URB bus id: 3
    Device setup request: not relevant ('-')
    Data: present (0)
    URB sec: 1530496532
    URB usec: 871537
    URB status: Remote I/O error (-EREMOTEIO) (-121)
    URB length [bytes]: 18
    Data length [bytes]: 18
    [bInterfaceClass: Unknown (0xffff)]
    Unused Setup Header
    Interval: 0
    Start frame: 0
    Copy of Transfer Flags: 0x00000201
    Number of ISO descriptors: 0
Leftover Capture Data: 43414d454f20332056312e35302020202003

0000  00 80 ab 41 fc 89 ff ff 43 03 82 03 03 00 2d 00   ...A....C.....-.
0010  14 86 39 5b 00 00 00 00 71 4c 0d 00 87 ff ff ff   ..9[....qL......
0020  12 00 00 00 12 00 00 00 00 00 00 00 00 00 00 00   ................
0030  00 00 00 00 00 00 00 00 01 02 00 00 00 00 00 00   ................
0040  43 41 4d 45 4f 20 33 20 56 31 2e 35 30 20 20 20   CAMEO 3 V1.50   
0050  20 03                                              .

Frame 14: 66 bytes on wire (528 bits), 66 bytes captured (528 bits) on interface 0
    Interface id: 0 (unknown)
        Interface name: unknown
    Encapsulation type: USB packets with Linux header and padding (115)
    Arrival Time: Jul  1, 2018 21:55:33.400268000 EDT
    [Time shift for this packet: 0.000000000 seconds]
    Epoch Time: 1530496533.400268000 seconds
    [Time delta from previous captured frame: 0.528731000 seconds]
    [Time delta from previous displayed frame: 0.528731000 seconds]
    [Time since reference or first frame: 103.878017000 seconds]
    Frame Number: 14
    Frame Length: 66 bytes (528 bits)
    Capture Length: 66 bytes (528 bits)
    [Frame is marked: False]
    [Frame is ignored: False]
    [Protocols in frame: usb]
USB URB
    [Source: host]
    [Destination: 3.3.1]
    URB id: 0xffff89fc41ab83c0
    URB type: URB_SUBMIT ('S')
    URB transfer type: URB_BULK (0x03)
    Endpoint: 0x01, Direction: OUT
        0... .... = Direction: OUT (0)
        .... 0001 = Endpoint number: 1
    Device: 3
    URB bus id: 3
    Device setup request: not relevant ('-')
    Data: present (0)
    URB sec: 1530496533
    URB usec: 400268
    URB status: Operation now in progress (-EINPROGRESS) (-115)
    URB length [bytes]: 2
    Data length [bytes]: 2
    [bInterfaceClass: Unknown (0xffff)]
    Unused Setup Header
    Interval: 0
    Start frame: 0
    Copy of Transfer Flags: 0x00000000
    Number of ISO descriptors: 0
Leftover Capture Data: 1b05

0000  c0 83 ab 41 fc 89 ff ff 53 03 01 03 03 00 2d 00   ...A....S.....-.
0010  15 86 39 5b 00 00 00 00 8c 1b 06 00 8d ff ff ff   ..9[............
0020  02 00 00 00 02 00 00 00 00 00 00 00 00 00 00 00   ................
0030  00 00 00 00 00 00 00 00 00 00 00 00 00 00 00 00   ................
0040  1b 05                                             ..

Frame 15: 66 bytes on wire (528 bits), 66 bytes captured (528 bits) on interface 0
    Interface id: 0 (unknown)
        Interface name: unknown
    Encapsulation type: USB packets with Linux header and padding (115)
    Arrival Time: Jul  1, 2018 21:55:33.654597000 EDT
    [Time shift for this packet: 0.000000000 seconds]
    Epoch Time: 1530496533.654597000 seconds
    [Time delta from previous captured frame: 0.254329000 seconds]
    [Time delta from previous displayed frame: 0.254329000 seconds]
    [Time since reference or first frame: 104.132346000 seconds]
    Frame Number: 15
    Frame Length: 66 bytes (528 bits)
    Capture Length: 66 bytes (528 bits)
    [Frame is marked: False]
    [Frame is ignored: False]
    [Protocols in frame: usb]
USB URB
    [Source: 3.3.2]
    [Destination: host]
    URB id: 0xffff89fc41ab8c00
    URB type: URB_COMPLETE ('C')
    URB transfer type: URB_BULK (0x03)
    Endpoint: 0x82, Direction: IN
        1... .... = Direction: IN (1)
        .... 0010 = Endpoint number: 2
    Device: 3
    URB bus id: 3
    Device setup request: not relevant ('-')
    Data: present (0)
    URB sec: 1530496533
    URB usec: 654597
    URB status: Remote I/O error (-EREMOTEIO) (-121)
    URB length [bytes]: 2
    Data length [bytes]: 2
    [bInterfaceClass: Unknown (0xffff)]
    Unused Setup Header
    Interval: 0
    Start frame: 0
    Copy of Transfer Flags: 0x00000201
    Number of ISO descriptors: 0
Leftover Capture Data: 3003

0000  00 8c ab 41 fc 89 ff ff 43 03 82 03 03 00 2d 00   ...A....C.....-.
0010  15 86 39 5b 00 00 00 00 05 fd 09 00 87 ff ff ff   ..9[............
0020  02 00 00 00 02 00 00 00 00 00 00 00 00 00 00 00   ................
0030  00 00 00 00 00 00 00 00 01 02 00 00 00 00 00 00   ................
0040  30 03                                             0.

Frame 16: 67 bytes on wire (536 bits), 67 bytes captured (536 bits) on interface 0
    Interface id: 0 (unknown)
        Interface name: unknown
    Encapsulation type: USB packets with Linux header and padding (115)
    Arrival Time: Jul  1, 2018 21:55:33.788278000 EDT
    [Time shift for this packet: 0.000000000 seconds]
    Epoch Time: 1530496533.788278000 seconds
    [Time delta from previous captured frame: 0.133681000 seconds]
    [Time delta from previous displayed frame: 0.133681000 seconds]
    [Time since reference or first frame: 104.266027000 seconds]
    Frame Number: 16
    Frame Length: 67 bytes (536 bits)
    Capture Length: 67 bytes (536 bits)
    [Frame is marked: False]
    [Frame is ignored: False]
    [Protocols in frame: usb]
USB URB
    [Source: host]
    [Destination: 3.3.1]
    URB id: 0xffff89fc41ab8a80
    URB type: URB_SUBMIT ('S')
    URB transfer type: URB_BULK (0x03)
    Endpoint: 0x01, Direction: OUT
        0... .... = Direction: OUT (0)
        .... 0001 = Endpoint number: 1
    Device: 3
    URB bus id: 3
    Device setup request: not relevant ('-')
    Data: present (0)
    URB sec: 1530496533
    URB usec: 788278
    URB status: Operation now in progress (-EINPROGRESS) (-115)
    URB length [bytes]: 3
    Data length [bytes]: 3
    [bInterfaceClass: Unknown (0xffff)]
    Unused Setup Header
    Interval: 0
    Start frame: 0
    Copy of Transfer Flags: 0x00000000
    Number of ISO descriptors: 0
Leftover Capture Data: 464703

0000  80 8a ab 41 fc 89 ff ff 53 03 01 03 03 00 2d 00   ...A....S.....-.
0010  15 86 39 5b 00 00 00 00 36 07 0c 00 8d ff ff ff   ..9[....6.......
0020  03 00 00 00 03 00 00 00 00 00 00 00 00 00 00 00   ................
0030  00 00 00 00 00 00 00 00 00 00 00 00 00 00 00 00   ................
0040  46 47 03                                          FG.

Frame 17: 82 bytes on wire (656 bits), 82 bytes captured (656 bits) on interface 0
    Interface id: 0 (unknown)
        Interface name: unknown
    Encapsulation type: USB packets with Linux header and padding (115)
    Arrival Time: Jul  1, 2018 21:55:33.942244000 EDT
    [Time shift for this packet: 0.000000000 seconds]
    Epoch Time: 1530496533.942244000 seconds
    [Time delta from previous captured frame: 0.153966000 seconds]
    [Time delta from previous displayed frame: 0.153966000 seconds]
    [Time since reference or first frame: 104.419993000 seconds]
    Frame Number: 17
    Frame Length: 82 bytes (656 bits)
    Capture Length: 82 bytes (656 bits)
    [Frame is marked: False]
    [Frame is ignored: False]
    [Protocols in frame: usb]
USB URB
    [Source: 3.3.2]
    [Destination: host]
    URB id: 0xffff89fc9248cd80
    URB type: URB_COMPLETE ('C')
    URB transfer type: URB_BULK (0x03)
    Endpoint: 0x82, Direction: IN
        1... .... = Direction: IN (1)
        .... 0010 = Endpoint number: 2
    Device: 3
    URB bus id: 3
    Device setup request: not relevant ('-')
    Data: present (0)
    URB sec: 1530496533
    URB usec: 942244
    URB status: Remote I/O error (-EREMOTEIO) (-121)
    URB length [bytes]: 18
    Data length [bytes]: 18
    [bInterfaceClass: Unknown (0xffff)]
    Unused Setup Header
    Interval: 0
    Start frame: 0
    Copy of Transfer Flags: 0x00000201
    Number of ISO descriptors: 0
Leftover Capture Data: 43414d454f20332056312e35302020202003

0000  80 cd 48 92 fc 89 ff ff 43 03 82 03 03 00 2d 00   ..H.....C.....-.
0010  15 86 39 5b 00 00 00 00 a4 60 0e 00 87 ff ff ff   ..9[.....`......
0020  12 00 00 00 12 00 00 00 00 00 00 00 00 00 00 00   ................
0030  00 00 00 00 00 00 00 00 01 02 00 00 00 00 00 00   ................
0040  43 41 4d 45 4f 20 33 20 56 31 2e 35 30 20 20 20   CAMEO 3 V1.50   
0050  20 03                                              .

Frame 18: 66 bytes on wire (528 bits), 66 bytes captured (528 bits) on interface 0
    Interface id: 0 (unknown)
        Interface name: unknown
    Encapsulation type: USB packets with Linux header and padding (115)
    Arrival Time: Jul  1, 2018 21:55:34.098211000 EDT
    [Time shift for this packet: 0.000000000 seconds]
    Epoch Time: 1530496534.098211000 seconds
    [Time delta from previous captured frame: 0.155967000 seconds]
    [Time delta from previous displayed frame: 0.155967000 seconds]
    [Time since reference or first frame: 104.575960000 seconds]
    Frame Number: 18
    Frame Length: 66 bytes (528 bits)
    Capture Length: 66 bytes (528 bits)
    [Frame is marked: False]
    [Frame is ignored: False]
    [Protocols in frame: usb]
USB URB
    [Source: host]
    [Destination: 3.3.1]
    URB id: 0xffff89fc92459780
    URB type: URB_SUBMIT ('S')
    URB transfer type: URB_BULK (0x03)
    Endpoint: 0x01, Direction: OUT
        0... .... = Direction: OUT (0)
        .... 0001 = Endpoint number: 1
    Device: 3
    URB bus id: 3
    Device setup request: not relevant ('-')
    Data: present (0)
    URB sec: 1530496534
    URB usec: 98211
    URB status: Operation now in progress (-EINPROGRESS) (-115)
    URB length [bytes]: 2
    Data length [bytes]: 2
    [bInterfaceClass: Unknown (0xffff)]
    Unused Setup Header
    Interval: 0
    Start frame: 0
    Copy of Transfer Flags: 0x00000000
    Number of ISO descriptors: 0
Leftover Capture Data: 1b05

0000  80 97 45 92 fc 89 ff ff 53 03 01 03 03 00 2d 00   ..E.....S.....-.
0010  16 86 39 5b 00 00 00 00 a3 7f 01 00 8d ff ff ff   ..9[............
0020  02 00 00 00 02 00 00 00 00 00 00 00 00 00 00 00   ................
0030  00 00 00 00 00 00 00 00 00 00 00 00 00 00 00 00   ................
0040  1b 05                                             ..

Frame 19: 66 bytes on wire (528 bits), 66 bytes captured (528 bits) on interface 0
    Interface id: 0 (unknown)
        Interface name: unknown
    Encapsulation type: USB packets with Linux header and padding (115)
    Arrival Time: Jul  1, 2018 21:55:34.252047000 EDT
    [Time shift for this packet: 0.000000000 seconds]
    Epoch Time: 1530496534.252047000 seconds
    [Time delta from previous captured frame: 0.153836000 seconds]
    [Time delta from previous displayed frame: 0.153836000 seconds]
    [Time since reference or first frame: 104.729796000 seconds]
    Frame Number: 19
    Frame Length: 66 bytes (528 bits)
    Capture Length: 66 bytes (528 bits)
    [Frame is marked: False]
    [Frame is ignored: False]
    [Protocols in frame: usb]
USB URB
    [Source: 3.3.2]
    [Destination: host]
    URB id: 0xffff89fc924596c0
    URB type: URB_COMPLETE ('C')
    URB transfer type: URB_BULK (0x03)
    Endpoint: 0x82, Direction: IN
        1... .... = Direction: IN (1)
        .... 0010 = Endpoint number: 2
    Device: 3
    URB bus id: 3
    Device setup request: not relevant ('-')
    Data: present (0)
    URB sec: 1530496534
    URB usec: 252047
    URB status: Remote I/O error (-EREMOTEIO) (-121)
    URB length [bytes]: 2
    Data length [bytes]: 2
    [bInterfaceClass: Unknown (0xffff)]
    Unused Setup Header
    Interval: 0
    Start frame: 0
    Copy of Transfer Flags: 0x00000201
    Number of ISO descriptors: 0
Leftover Capture Data: 3003

0000  c0 96 45 92 fc 89 ff ff 43 03 82 03 03 00 2d 00   ..E.....C.....-.
0010  16 86 39 5b 00 00 00 00 8f d8 03 00 87 ff ff ff   ..9[............
0020  02 00 00 00 02 00 00 00 00 00 00 00 00 00 00 00   ................
0030  00 00 00 00 00 00 00 00 01 02 00 00 00 00 00 00   ................
0040  30 03                                             0.

Frame 20: 66 bytes on wire (528 bits), 66 bytes captured (528 bits) on interface 0
    Interface id: 0 (unknown)
        Interface name: unknown
    Encapsulation type: USB packets with Linux header and padding (115)
    Arrival Time: Jul  1, 2018 21:55:34.405713000 EDT
    [Time shift for this packet: 0.000000000 seconds]
    Epoch Time: 1530496534.405713000 seconds
    [Time delta from previous captured frame: 0.153666000 seconds]
    [Time delta from previous displayed frame: 0.153666000 seconds]
    [Time since reference or first frame: 104.883462000 seconds]
    Frame Number: 20
    Frame Length: 66 bytes (528 bits)
    Capture Length: 66 bytes (528 bits)
    [Frame is marked: False]
    [Frame is ignored: False]
    [Protocols in frame: usb]
USB URB
    [Source: host]
    [Destination: 3.3.1]
    URB id: 0xffff89fc92459300
    URB type: URB_SUBMIT ('S')
    URB transfer type: URB_BULK (0x03)
    Endpoint: 0x01, Direction: OUT
        0... .... = Direction: OUT (0)
        .... 0001 = Endpoint number: 1
    Device: 3
    URB bus id: 3
    Device setup request: not relevant ('-')
    Data: present (0)
    URB sec: 1530496534
    URB usec: 405713
    URB status: Operation now in progress (-EINPROGRESS) (-115)
    URB length [bytes]: 2
    Data length [bytes]: 2
    [bInterfaceClass: Unknown (0xffff)]
    Unused Setup Header
    Interval: 0
    Start frame: 0
    Copy of Transfer Flags: 0x00000000
    Number of ISO descriptors: 0
Leftover Capture Data: 1b05

0000  00 93 45 92 fc 89 ff ff 53 03 01 03 03 00 2d 00   ..E.....S.....-.
0010  16 86 39 5b 00 00 00 00 d1 30 06 00 8d ff ff ff   ..9[.....0......
0020  02 00 00 00 02 00 00 00 00 00 00 00 00 00 00 00   ................
0030  00 00 00 00 00 00 00 00 00 00 00 00 00 00 00 00   ................
0040  1b 05                                             ..

Frame 21: 66 bytes on wire (528 bits), 66 bytes captured (528 bits) on interface 0
    Interface id: 0 (unknown)
        Interface name: unknown
    Encapsulation type: USB packets with Linux header and padding (115)
    Arrival Time: Jul  1, 2018 21:55:34.511660000 EDT
    [Time shift for this packet: 0.000000000 seconds]
    Epoch Time: 1530496534.511660000 seconds
    [Time delta from previous captured frame: 0.105947000 seconds]
    [Time delta from previous displayed frame: 0.105947000 seconds]
    [Time since reference or first frame: 104.989409000 seconds]
    Frame Number: 21
    Frame Length: 66 bytes (528 bits)
    Capture Length: 66 bytes (528 bits)
    [Frame is marked: False]
    [Frame is ignored: False]
    [Protocols in frame: usb]
USB URB
    [Source: 3.3.2]
    [Destination: host]
    URB id: 0xffff89fc92459b40
    URB type: URB_COMPLETE ('C')
    URB transfer type: URB_BULK (0x03)
    Endpoint: 0x82, Direction: IN
        1... .... = Direction: IN (1)
        .... 0010 = Endpoint number: 2
    Device: 3
    URB bus id: 3
    Device setup request: not relevant ('-')
    Data: present (0)
    URB sec: 1530496534
    URB usec: 511660
    URB status: Remote I/O error (-EREMOTEIO) (-121)
    URB length [bytes]: 2
    Data length [bytes]: 2
    [bInterfaceClass: Unknown (0xffff)]
    Unused Setup Header
    Interval: 0
    Start frame: 0
    Copy of Transfer Flags: 0x00000201
    Number of ISO descriptors: 0
Leftover Capture Data: 3003

0000  40 9b 45 92 fc 89 ff ff 43 03 82 03 03 00 2d 00   @.E.....C.....-.
0010  16 86 39 5b 00 00 00 00 ac ce 07 00 87 ff ff ff   ..9[............
0020  02 00 00 00 02 00 00 00 00 00 00 00 00 00 00 00   ................
0030  00 00 00 00 00 00 00 00 01 02 00 00 00 00 00 00   ................
0040  30 03                                             0.

Frame 22: 66 bytes on wire (528 bits), 66 bytes captured (528 bits) on interface 0
    Interface id: 0 (unknown)
        Interface name: unknown
    Encapsulation type: USB packets with Linux header and padding (115)
    Arrival Time: Jul  1, 2018 21:55:34.921932000 EDT
    [Time shift for this packet: 0.000000000 seconds]
    Epoch Time: 1530496534.921932000 seconds
    [Time delta from previous captured frame: 0.410272000 seconds]
    [Time delta from previous displayed frame: 0.410272000 seconds]
    [Time since reference or first frame: 105.399681000 seconds]
    Frame Number: 22
    Frame Length: 66 bytes (528 bits)
    Capture Length: 66 bytes (528 bits)
    [Frame is marked: False]
    [Frame is ignored: False]
    [Protocols in frame: usb]
USB URB
    [Source: host]
    [Destination: 3.3.1]
    URB id: 0xffff89fc92459c00
    URB type: URB_SUBMIT ('S')
    URB transfer type: URB_BULK (0x03)
    Endpoint: 0x01, Direction: OUT
        0... .... = Direction: OUT (0)
        .... 0001 = Endpoint number: 1
    Device: 3
    URB bus id: 3
    Device setup request: not relevant ('-')
    Data: present (0)
    URB sec: 1530496534
    URB usec: 921932
    URB status: Operation now in progress (-EINPROGRESS) (-115)
    URB length [bytes]: 2
    Data length [bytes]: 2
    [bInterfaceClass: Unknown (0xffff)]
    Unused Setup Header
    Interval: 0
    Start frame: 0
    Copy of Transfer Flags: 0x00000000
    Number of ISO descriptors: 0
Leftover Capture Data: 5b03

0000  00 9c 45 92 fc 89 ff ff 53 03 01 03 03 00 2d 00   ..E.....S.....-.
0010  16 86 39 5b 00 00 00 00 4c 11 0e 00 8d ff ff ff   ..9[....L.......
0020  02 00 00 00 02 00 00 00 00 00 00 00 00 00 00 00   ................
0030  00 00 00 00 00 00 00 00 00 00 00 00 00 00 00 00   ................
0040  5b 03                                             [.

Frame 23: 78 bytes on wire (624 bits), 78 bytes captured (624 bits) on interface 0
    Interface id: 0 (unknown)
        Interface name: unknown
    Encapsulation type: USB packets with Linux header and padding (115)
    Arrival Time: Jul  1, 2018 21:55:35.085531000 EDT
    [Time shift for this packet: 0.000000000 seconds]
    Epoch Time: 1530496535.085531000 seconds
    [Time delta from previous captured frame: 0.163599000 seconds]
    [Time delta from previous displayed frame: 0.163599000 seconds]
    [Time since reference or first frame: 105.563280000 seconds]
    Frame Number: 23
    Frame Length: 78 bytes (624 bits)
    Capture Length: 78 bytes (624 bits)
    [Frame is marked: False]
    [Frame is ignored: False]
    [Protocols in frame: usb]
USB URB
    [Source: 3.3.2]
    [Destination: host]
    URB id: 0xffff89fc92459600
    URB type: URB_COMPLETE ('C')
    URB transfer type: URB_BULK (0x03)
    Endpoint: 0x82, Direction: IN
        1... .... = Direction: IN (1)
        .... 0010 = Endpoint number: 2
    Device: 3
    URB bus id: 3
    Device setup request: not relevant ('-')
    Data: present (0)
    URB sec: 1530496535
    URB usec: 85531
    URB status: Remote I/O error (-EREMOTEIO) (-121)
    URB length [bytes]: 14
    Data length [bytes]: 14
    [bInterfaceClass: Unknown (0xffff)]
    Unused Setup Header
    Interval: 0
    Start frame: 0
    Copy of Transfer Flags: 0x00000201
    Number of ISO descriptors: 0
Leftover Capture Data: 2020202020302c20202020203003

0000  00 96 45 92 fc 89 ff ff 43 03 82 03 03 00 2d 00   ..E.....C.....-.
0010  17 86 39 5b 00 00 00 00 1b 4e 01 00 87 ff ff ff   ..9[.....N......
0020  0e 00 00 00 0e 00 00 00 00 00 00 00 00 00 00 00   ................
0030  00 00 00 00 00 00 00 00 01 02 00 00 00 00 00 00   ................
0040  20 20 20 20 20 30 2c 20 20 20 20 20 30 03              0,     0.

Frame 24: 66 bytes on wire (528 bits), 66 bytes captured (528 bits) on interface 0
    Interface id: 0 (unknown)
        Interface name: unknown
    Encapsulation type: USB packets with Linux header and padding (115)
    Arrival Time: Jul  1, 2018 21:55:35.216138000 EDT
    [Time shift for this packet: 0.000000000 seconds]
    Epoch Time: 1530496535.216138000 seconds
    [Time delta from previous captured frame: 0.130607000 seconds]
    [Time delta from previous displayed frame: 0.130607000 seconds]
    [Time since reference or first frame: 105.693887000 seconds]
    Frame Number: 24
    Frame Length: 66 bytes (528 bits)
    Capture Length: 66 bytes (528 bits)
    [Frame is marked: False]
    [Frame is ignored: False]
    [Protocols in frame: usb]
USB URB
    [Source: host]
    [Destination: 3.3.1]
    URB id: 0xffff89fc41ab8780
    URB type: URB_SUBMIT ('S')
    URB transfer type: URB_BULK (0x03)
    Endpoint: 0x01, Direction: OUT
        0... .... = Direction: OUT (0)
        .... 0001 = Endpoint number: 1
    Device: 3
    URB bus id: 3
    Device setup request: not relevant ('-')
    Data: present (0)
    URB sec: 1530496535
    URB usec: 216138
    URB status: Operation now in progress (-EINPROGRESS) (-115)
    URB length [bytes]: 2
    Data length [bytes]: 2
    [bInterfaceClass: Unknown (0xffff)]
    Unused Setup Header
    Interval: 0
    Start frame: 0
    Copy of Transfer Flags: 0x00000000
    Number of ISO descriptors: 0
Leftover Capture Data: 5503

0000  80 87 ab 41 fc 89 ff ff 53 03 01 03 03 00 2d 00   ...A....S.....-.
0010  17 86 39 5b 00 00 00 00 4a 4c 03 00 8d ff ff ff   ..9[....JL......
0020  02 00 00 00 02 00 00 00 00 00 00 00 00 00 00 00   ................
0030  00 00 00 00 00 00 00 00 00 00 00 00 00 00 00 00   ................
0040  55 03                                             U.

Frame 25: 78 bytes on wire (624 bits), 78 bytes captured (624 bits) on interface 0
    Interface id: 0 (unknown)
        Interface name: unknown
    Encapsulation type: USB packets with Linux header and padding (115)
    Arrival Time: Jul  1, 2018 21:55:35.390261000 EDT
    [Time shift for this packet: 0.000000000 seconds]
    Epoch Time: 1530496535.390261000 seconds
    [Time delta from previous captured frame: 0.174123000 seconds]
    [Time delta from previous displayed frame: 0.174123000 seconds]
    [Time since reference or first frame: 105.868010000 seconds]
    Frame Number: 25
    Frame Length: 78 bytes (624 bits)
    Capture Length: 78 bytes (624 bits)
    [Frame is marked: False]
    [Frame is ignored: False]
    [Protocols in frame: usb]
USB URB
    [Source: 3.3.2]
    [Destination: host]
    URB id: 0xffff89fc924593c0
    URB type: URB_COMPLETE ('C')
    URB transfer type: URB_BULK (0x03)
    Endpoint: 0x82, Direction: IN
        1... .... = Direction: IN (1)
        .... 0010 = Endpoint number: 2
    Device: 3
    URB bus id: 3
    Device setup request: not relevant ('-')
    Data: present (0)
    URB sec: 1530496535
    URB usec: 390261
    URB status: Remote I/O error (-EREMOTEIO) (-121)
    URB length [bytes]: 14
    Data length [bytes]: 14
    [bInterfaceClass: Unknown (0xffff)]
    Unused Setup Header
    Interval: 0
    Start frame: 0
    Copy of Transfer Flags: 0x00000201
    Number of ISO descriptors: 0
Leftover Capture Data: 2020353538382c20203630383003

0000  c0 93 45 92 fc 89 ff ff 43 03 82 03 03 00 2d 00   ..E.....C.....-.
0010  17 86 39 5b 00 00 00 00 75 f4 05 00 87 ff ff ff   ..9[....u.......
0020  0e 00 00 00 0e 00 00 00 00 00 00 00 00 00 00 00   ................
0030  00 00 00 00 00 00 00 00 01 02 00 00 00 00 00 00   ................
0040  20 20 35 35 38 38 2c 20 20 36 30 38 30 03           5588,  6080.

Frame 26: 68 bytes on wire (544 bits), 68 bytes captured (544 bits) on interface 0
    Interface id: 0 (unknown)
        Interface name: unknown
    Encapsulation type: USB packets with Linux header and padding (115)
    Arrival Time: Jul  1, 2018 21:55:35.427484000 EDT
    [Time shift for this packet: 0.000000000 seconds]
    Epoch Time: 1530496535.427484000 seconds
    [Time delta from previous captured frame: 0.037223000 seconds]
    [Time delta from previous displayed frame: 0.037223000 seconds]
    [Time since reference or first frame: 105.905233000 seconds]
    Frame Number: 26
    Frame Length: 68 bytes (544 bits)
    Capture Length: 68 bytes (544 bits)
    [Frame is marked: False]
    [Frame is ignored: False]
    [Protocols in frame: usb]
USB URB
    [Source: host]
    [Destination: 3.3.1]
    URB id: 0xffff89fd08dbb000
    URB type: URB_SUBMIT ('S')
    URB transfer type: URB_BULK (0x03)
    Endpoint: 0x01, Direction: OUT
        0... .... = Direction: OUT (0)
        .... 0001 = Endpoint number: 1
    Device: 3
    URB bus id: 3
    Device setup request: not relevant ('-')
    Data: present (0)
    URB sec: 1530496535
    URB usec: 427484
    URB status: Operation now in progress (-EINPROGRESS) (-115)
    URB length [bytes]: 4
    Data length [bytes]: 4
    [bInterfaceClass: Unknown (0xffff)]
    Unused Setup Header
    Interval: 0
    Start frame: 0
    Copy of Transfer Flags: 0x00000000
    Number of ISO descriptors: 0
Leftover Capture Data: 46513003

0000  00 b0 db 08 fd 89 ff ff 53 03 01 03 03 00 2d 00   ........S.....-.
0010  17 86 39 5b 00 00 00 00 dc 85 06 00 8d ff ff ff   ..9[............
0020  04 00 00 00 04 00 00 00 00 00 00 00 00 00 00 00   ................
0030  00 00 00 00 00 00 00 00 00 00 00 00 00 00 00 00   ................
0040  46 51 30 03                                       FQ0.

Frame 27: 70 bytes on wire (560 bits), 70 bytes captured (560 bits) on interface 0
    Interface id: 0 (unknown)
        Interface name: unknown
    Encapsulation type: USB packets with Linux header and padding (115)
    Arrival Time: Jul  1, 2018 21:55:35.577545000 EDT
    [Time shift for this packet: 0.000000000 seconds]
    Epoch Time: 1530496535.577545000 seconds
    [Time delta from previous captured frame: 0.150061000 seconds]
    [Time delta from previous displayed frame: 0.150061000 seconds]
    [Time since reference or first frame: 106.055294000 seconds]
    Frame Number: 27
    Frame Length: 70 bytes (560 bits)
    Capture Length: 70 bytes (560 bits)
    [Frame is marked: False]
    [Frame is ignored: False]
    [Protocols in frame: usb]
USB URB
    [Source: 3.3.2]
    [Destination: host]
    URB id: 0xffff89fc41ab8540
    URB type: URB_COMPLETE ('C')
    URB transfer type: URB_BULK (0x03)
    Endpoint: 0x82, Direction: IN
        1... .... = Direction: IN (1)
        .... 0010 = Endpoint number: 2
    Device: 3
    URB bus id: 3
    Device setup request: not relevant ('-')
    Data: present (0)
    URB sec: 1530496535
    URB usec: 577545
    URB status: Remote I/O error (-EREMOTEIO) (-121)
    URB length [bytes]: 6
    Data length [bytes]: 6
    [bInterfaceClass: Unknown (0xffff)]
    Unused Setup Header
    Interval: 0
    Start frame: 0
    Copy of Transfer Flags: 0x00000201
    Number of ISO descriptors: 0
Leftover Capture Data: 202020313003

0000  40 85 ab 41 fc 89 ff ff 43 03 82 03 03 00 2d 00   @..A....C.....-.
0010  17 86 39 5b 00 00 00 00 09 d0 08 00 87 ff ff ff   ..9[............
0020  06 00 00 00 06 00 00 00 00 00 00 00 00 00 00 00   ................
0030  00 00 00 00 00 00 00 00 01 02 00 00 00 00 00 00   ................
0040  20 20 20 31 30 03                                    10.

Frame 28: 68 bytes on wire (544 bits), 68 bytes captured (544 bits) on interface 0
    Interface id: 0 (unknown)
        Interface name: unknown
    Encapsulation type: USB packets with Linux header and padding (115)
    Arrival Time: Jul  1, 2018 21:55:35.671452000 EDT
    [Time shift for this packet: 0.000000000 seconds]
    Epoch Time: 1530496535.671452000 seconds
    [Time delta from previous captured frame: 0.093907000 seconds]
    [Time delta from previous displayed frame: 0.093907000 seconds]
    [Time since reference or first frame: 106.149201000 seconds]
    Frame Number: 28
    Frame Length: 68 bytes (544 bits)
    Capture Length: 68 bytes (544 bits)
    [Frame is marked: False]
    [Frame is ignored: False]
    [Protocols in frame: usb]
USB URB
    [Source: host]
    [Destination: 3.3.1]
    URB id: 0xffff89fc41ab8300
    URB type: URB_SUBMIT ('S')
    URB transfer type: URB_BULK (0x03)
    Endpoint: 0x01, Direction: OUT
        0... .... = Direction: OUT (0)
        .... 0001 = Endpoint number: 1
    Device: 3
    URB bus id: 3
    Device setup request: not relevant ('-')
    Data: present (0)
    URB sec: 1530496535
    URB usec: 671452
    URB status: Operation now in progress (-EINPROGRESS) (-115)
    URB length [bytes]: 4
    Data length [bytes]: 4
    [bInterfaceClass: Unknown (0xffff)]
    Unused Setup Header
    Interval: 0
    Start frame: 0
    Copy of Transfer Flags: 0x00000000
    Number of ISO descriptors: 0
Leftover Capture Data: 46513203

0000  00 83 ab 41 fc 89 ff ff 53 03 01 03 03 00 2d 00   ...A....S.....-.
0010  17 86 39 5b 00 00 00 00 dc 3e 0a 00 8d ff ff ff   ..9[.....>......
0020  04 00 00 00 04 00 00 00 00 00 00 00 00 00 00 00   ................
0030  00 00 00 00 00 00 00 00 00 00 00 00 00 00 00 00   ................
0040  46 51 32 03                                       FQ2.

Frame 29: 70 bytes on wire (560 bits), 70 bytes captured (560 bits) on interface 0
    Interface id: 0 (unknown)
        Interface name: unknown
    Encapsulation type: USB packets with Linux header and padding (115)
    Arrival Time: Jul  1, 2018 21:55:35.823529000 EDT
    [Time shift for this packet: 0.000000000 seconds]
    Epoch Time: 1530496535.823529000 seconds
    [Time delta from previous captured frame: 0.152077000 seconds]
    [Time delta from previous displayed frame: 0.152077000 seconds]
    [Time since reference or first frame: 106.301278000 seconds]
    Frame Number: 29
    Frame Length: 70 bytes (560 bits)
    Capture Length: 70 bytes (560 bits)
    [Frame is marked: False]
    [Frame is ignored: False]
    [Protocols in frame: usb]
USB URB
    [Source: 3.3.2]
    [Destination: host]
    URB id: 0xffff89fc924593c0
    URB type: URB_COMPLETE ('C')
    URB transfer type: URB_BULK (0x03)
    Endpoint: 0x82, Direction: IN
        1... .... = Direction: IN (1)
        .... 0010 = Endpoint number: 2
    Device: 3
    URB bus id: 3
    Device setup request: not relevant ('-')
    Data: present (0)
    URB sec: 1530496535
    URB usec: 823529
    URB status: Remote I/O error (-EREMOTEIO) (-121)
    URB length [bytes]: 6
    Data length [bytes]: 6
    [bInterfaceClass: Unknown (0xffff)]
    Unused Setup Header
    Interval: 0
    Start frame: 0
    Copy of Transfer Flags: 0x00000201
    Number of ISO descriptors: 0
Leftover Capture Data: 202020313703

0000  c0 93 45 92 fc 89 ff ff 43 03 82 03 03 00 2d 00   ..E.....C.....-.
0010  17 86 39 5b 00 00 00 00 e9 90 0c 00 87 ff ff ff   ..9[............
0020  06 00 00 00 06 00 00 00 00 00 00 00 00 00 00 00   ................
0030  00 00 00 00 00 00 00 00 01 02 00 00 00 00 00 00   ................
0040  20 20 20 31 37 03                                    17.

Frame 30: 69 bytes on wire (552 bits), 69 bytes captured (552 bits) on interface 0
    Interface id: 0 (unknown)
        Interface name: unknown
    Encapsulation type: USB packets with Linux header and padding (115)
    Arrival Time: Jul  1, 2018 21:55:36.003065000 EDT
    [Time shift for this packet: 0.000000000 seconds]
    Epoch Time: 1530496536.003065000 seconds
    [Time delta from previous captured frame: 0.179536000 seconds]
    [Time delta from previous displayed frame: 0.179536000 seconds]
    [Time since reference or first frame: 106.480814000 seconds]
    Frame Number: 30
    Frame Length: 69 bytes (552 bits)
    Capture Length: 69 bytes (552 bits)
    [Frame is marked: False]
    [Frame is ignored: False]
    [Protocols in frame: usb]
USB URB
    [Source: host]
    [Destination: 3.3.1]
    URB id: 0xffff89fd08dbbf00
    URB type: URB_SUBMIT ('S')
    URB transfer type: URB_BULK (0x03)
    Endpoint: 0x01, Direction: OUT
        0... .... = Direction: OUT (0)
        .... 0001 = Endpoint number: 1
    Device: 3
    URB bus id: 3
    Device setup request: not relevant ('-')
    Data: present (0)
    URB sec: 1530496536
    URB usec: 3065
    URB status: Operation now in progress (-EINPROGRESS) (-115)
    URB length [bytes]: 5
    Data length [bytes]: 5
    [bInterfaceClass: Unknown (0xffff)]
    Unused Setup Header
    Interval: 0
    Start frame: 0
    Copy of Transfer Flags: 0x00000000
    Number of ISO descriptors: 0
Leftover Capture Data: 5442373103

0000  00 bf db 08 fd 89 ff ff 53 03 01 03 03 00 2d 00   ........S.....-.
0010  18 86 39 5b 00 00 00 00 f9 0b 00 00 8d ff ff ff   ..9[............
0020  05 00 00 00 05 00 00 00 00 00 00 00 00 00 00 00   ................
0030  00 00 00 00 00 00 00 00 00 00 00 00 00 00 00 00   ................
0040  54 42 37 31 03                                    TB71.

Frame 31: 76 bytes on wire (608 bits), 76 bytes captured (608 bits) on interface 0
    Interface id: 0 (unknown)
        Interface name: unknown
    Encapsulation type: USB packets with Linux header and padding (115)
    Arrival Time: Jul  1, 2018 21:55:36.161560000 EDT
    [Time shift for this packet: 0.000000000 seconds]
    Epoch Time: 1530496536.161560000 seconds
    [Time delta from previous captured frame: 0.158495000 seconds]
    [Time delta from previous displayed frame: 0.158495000 seconds]
    [Time since reference or first frame: 106.639309000 seconds]
    Frame Number: 31
    Frame Length: 76 bytes (608 bits)
    Capture Length: 76 bytes (608 bits)
    [Frame is marked: False]
    [Frame is ignored: False]
    [Protocols in frame: usb]
USB URB
    [Source: 3.3.2]
    [Destination: host]
    URB id: 0xffff89fc41ab8840
    URB type: URB_COMPLETE ('C')
    URB transfer type: URB_BULK (0x03)
    Endpoint: 0x82, Direction: IN
        1... .... = Direction: IN (1)
        .... 0010 = Endpoint number: 2
    Device: 3
    URB bus id: 3
    Device setup request: not relevant ('-')
    Data: present (0)
    URB sec: 1530496536
    URB usec: 161560
    URB status: Remote I/O error (-EREMOTEIO) (-121)
    URB length [bytes]: 12
    Data length [bytes]: 12
    [bInterfaceClass: Unknown (0xffff)]
    Unused Setup Header
    Interval: 0
    Start frame: 0
    Copy of Transfer Flags: 0x00000201
    Number of ISO descriptors: 0
Leftover Capture Data: 20202020302c202020203003

0000  40 88 ab 41 fc 89 ff ff 43 03 82 03 03 00 2d 00   @..A....C.....-.
0010  18 86 39 5b 00 00 00 00 18 77 02 00 87 ff ff ff   ..9[.....w......
0020  0c 00 00 00 0c 00 00 00 00 00 00 00 00 00 00 00   ................
0030  00 00 00 00 00 00 00 00 01 02 00 00 00 00 00 00   ................
0040  20 20 20 20 30 2c 20 20 20 20 30 03                   0,    0.

Frame 32: 67 bytes on wire (536 bits), 67 bytes captured (536 bits) on interface 0
    Interface id: 0 (unknown)
        Interface name: unknown
    Encapsulation type: USB packets with Linux header and padding (115)
    Arrival Time: Jul  1, 2018 21:55:36.295971000 EDT
    [Time shift for this packet: 0.000000000 seconds]
    Epoch Time: 1530496536.295971000 seconds
    [Time delta from previous captured frame: 0.134411000 seconds]
    [Time delta from previous displayed frame: 0.134411000 seconds]
    [Time since reference or first frame: 106.773720000 seconds]
    Frame Number: 32
    Frame Length: 67 bytes (536 bits)
    Capture Length: 67 bytes (536 bits)
    [Frame is marked: False]
    [Frame is ignored: False]
    [Protocols in frame: usb]
USB URB
    [Source: host]
    [Destination: 3.3.1]
    URB id: 0xffff89fd08dbbcc0
    URB type: URB_SUBMIT ('S')
    URB transfer type: URB_BULK (0x03)
    Endpoint: 0x01, Direction: OUT
        0... .... = Direction: OUT (0)
        .... 0001 = Endpoint number: 1
    Device: 3
    URB bus id: 3
    Device setup request: not relevant ('-')
    Data: present (0)
    URB sec: 1530496536
    URB usec: 295971
    URB status: Operation now in progress (-EINPROGRESS) (-115)
    URB length [bytes]: 3
    Data length [bytes]: 3
    [bInterfaceClass: Unknown (0xffff)]
    Unused Setup Header
    Interval: 0
    Start frame: 0
    Copy of Transfer Flags: 0x00000000
    Number of ISO descriptors: 0
Leftover Capture Data: 464103

0000  c0 bc db 08 fd 89 ff ff 53 03 01 03 03 00 2d 00   ........S.....-.
0010  18 86 39 5b 00 00 00 00 23 84 04 00 8d ff ff ff   ..9[....#.......
0020  03 00 00 00 03 00 00 00 00 00 00 00 00 00 00 00   ................
0030  00 00 00 00 00 00 00 00 00 00 00 00 00 00 00 00   ................
0040  46 41 03                                          FA.

Frame 33: 76 bytes on wire (608 bits), 76 bytes captured (608 bits) on interface 0
    Interface id: 0 (unknown)
        Interface name: unknown
    Encapsulation type: USB packets with Linux header and padding (115)
    Arrival Time: Jul  1, 2018 21:55:36.397629000 EDT
    [Time shift for this packet: 0.000000000 seconds]
    Epoch Time: 1530496536.397629000 seconds
    [Time delta from previous captured frame: 0.101658000 seconds]
    [Time delta from previous displayed frame: 0.101658000 seconds]
    [Time since reference or first frame: 106.875378000 seconds]
    Frame Number: 33
    Frame Length: 76 bytes (608 bits)
    Capture Length: 76 bytes (608 bits)
    [Frame is marked: False]
    [Frame is ignored: False]
    [Protocols in frame: usb]
USB URB
    [Source: 3.3.2]
    [Destination: host]
    URB id: 0xffff89fd08dbb9c0
    URB type: URB_COMPLETE ('C')
    URB transfer type: URB_BULK (0x03)
    Endpoint: 0x82, Direction: IN
        1... .... = Direction: IN (1)
        .... 0010 = Endpoint number: 2
    Device: 3
    URB bus id: 3
    Device setup request: not relevant ('-')
    Data: present (0)
    URB sec: 1530496536
    URB usec: 397629
    URB status: Remote I/O error (-EREMOTEIO) (-121)
    URB length [bytes]: 12
    Data length [bytes]: 12
    [bInterfaceClass: Unknown (0xffff)]
    Unused Setup Header
    Interval: 0
    Start frame: 0
    Copy of Transfer Flags: 0x00000201
    Number of ISO descriptors: 0
Leftover Capture Data: 20202020302c202020203003

0000  c0 b9 db 08 fd 89 ff ff 43 03 82 03 03 00 2d 00   ........C.....-.
0010  18 86 39 5b 00 00 00 00 3d 11 06 00 87 ff ff ff   ..9[....=.......
0020  0c 00 00 00 0c 00 00 00 00 00 00 00 00 00 00 00   ................
0030  00 00 00 00 00 00 00 00 01 02 00 00 00 00 00 00   ................
0040  20 20 20 20 30 2c 20 20 20 20 30 03                   0,    0.

Frame 34: 66 bytes on wire (528 bits), 66 bytes captured (528 bits) on interface 0
    Interface id: 0 (unknown)
        Interface name: unknown
    Encapsulation type: USB packets with Linux header and padding (115)
    Arrival Time: Jul  1, 2018 21:55:36.550703000 EDT
    [Time shift for this packet: 0.000000000 seconds]
    Epoch Time: 1530496536.550703000 seconds
    [Time delta from previous captured frame: 0.153074000 seconds]
    [Time delta from previous displayed frame: 0.153074000 seconds]
    [Time since reference or first frame: 107.028452000 seconds]
    Frame Number: 34
    Frame Length: 66 bytes (528 bits)
    Capture Length: 66 bytes (528 bits)
    [Frame is marked: False]
    [Frame is ignored: False]
    [Protocols in frame: usb]
USB URB
    [Source: host]
    [Destination: 3.3.1]
    URB id: 0xffff89fc41ab8180
    URB type: URB_SUBMIT ('S')
    URB transfer type: URB_BULK (0x03)
    Endpoint: 0x01, Direction: OUT
        0... .... = Direction: OUT (0)
        .... 0001 = Endpoint number: 1
    Device: 3
    URB bus id: 3
    Device setup request: not relevant ('-')
    Data: present (0)
    URB sec: 1530496536
    URB usec: 550703
    URB status: Operation now in progress (-EINPROGRESS) (-115)
    URB length [bytes]: 2
    Data length [bytes]: 2
    [bInterfaceClass: Unknown (0xffff)]
    Unused Setup Header
    Interval: 0
    Start frame: 0
    Copy of Transfer Flags: 0x00000000
    Number of ISO descriptors: 0
Leftover Capture Data: 1b05

0000  80 81 ab 41 fc 89 ff ff 53 03 01 03 03 00 2d 00   ...A....S.....-.
0010  18 86 39 5b 00 00 00 00 2f 67 08 00 8d ff ff ff   ..9[..../g......
0020  02 00 00 00 02 00 00 00 00 00 00 00 00 00 00 00   ................
0030  00 00 00 00 00 00 00 00 00 00 00 00 00 00 00 00   ................
0040  1b 05                                             ..

Frame 35: 66 bytes on wire (528 bits), 66 bytes captured (528 bits) on interface 0
    Interface id: 0 (unknown)
        Interface name: unknown
    Encapsulation type: USB packets with Linux header and padding (115)
    Arrival Time: Jul  1, 2018 21:55:36.643547000 EDT
    [Time shift for this packet: 0.000000000 seconds]
    Epoch Time: 1530496536.643547000 seconds
    [Time delta from previous captured frame: 0.092844000 seconds]
    [Time delta from previous displayed frame: 0.092844000 seconds]
    [Time since reference or first frame: 107.121296000 seconds]
    Frame Number: 35
    Frame Length: 66 bytes (528 bits)
    Capture Length: 66 bytes (528 bits)
    [Frame is marked: False]
    [Frame is ignored: False]
    [Protocols in frame: usb]
USB URB
    [Source: 3.3.2]
    [Destination: host]
    URB id: 0xffff89fc41ab8d80
    URB type: URB_COMPLETE ('C')
    URB transfer type: URB_BULK (0x03)
    Endpoint: 0x82, Direction: IN
        1... .... = Direction: IN (1)
        .... 0010 = Endpoint number: 2
    Device: 3
    URB bus id: 3
    Device setup request: not relevant ('-')
    Data: present (0)
    URB sec: 1530496536
    URB usec: 643547
    URB status: Remote I/O error (-EREMOTEIO) (-121)
    URB length [bytes]: 2
    Data length [bytes]: 2
    [bInterfaceClass: Unknown (0xffff)]
    Unused Setup Header
    Interval: 0
    Start frame: 0
    Copy of Transfer Flags: 0x00000201
    Number of ISO descriptors: 0
Leftover Capture Data: 3003

0000  80 8d ab 41 fc 89 ff ff 43 03 82 03 03 00 2d 00   ...A....C.....-.
0010  18 86 39 5b 00 00 00 00 db d1 09 00 87 ff ff ff   ..9[............
0020  02 00 00 00 02 00 00 00 00 00 00 00 00 00 00 00   ................
0030  00 00 00 00 00 00 00 00 01 02 00 00 00 00 00 00   ................
0040  30 03                                             0.

Frame 36: 66 bytes on wire (528 bits), 66 bytes captured (528 bits) on interface 0
    Interface id: 0 (unknown)
        Interface name: unknown
    Encapsulation type: USB packets with Linux header and padding (115)
    Arrival Time: Jul  1, 2018 21:59:57.047569000 EDT
    [Time shift for this packet: 0.000000000 seconds]
    Epoch Time: 1530496797.047569000 seconds
    [Time delta from previous captured frame: 260.404022000 seconds]
    [Time delta from previous displayed frame: 260.404022000 seconds]
    [Time since reference or first frame: 367.525318000 seconds]
    Frame Number: 36
    Frame Length: 66 bytes (528 bits)
    Capture Length: 66 bytes (528 bits)
    [Frame is marked: False]
    [Frame is ignored: False]
    [Protocols in frame: usb]
USB URB
    [Source: host]
    [Destination: 3.3.1]
    URB id: 0xffff89fd46e3fb40
    URB type: URB_SUBMIT ('S')
    URB transfer type: URB_BULK (0x03)
    Endpoint: 0x01, Direction: OUT
        0... .... = Direction: OUT (0)
        .... 0001 = Endpoint number: 1
    Device: 3
    URB bus id: 3
    Device setup request: not relevant ('-')
    Data: present (0)
    URB sec: 1530496797
    URB usec: 47569
    URB status: Operation now in progress (-EINPROGRESS) (-115)
    URB length [bytes]: 2
    Data length [bytes]: 2
    [bInterfaceClass: Unknown (0xffff)]
    Unused Setup Header
    Interval: 0
    Start frame: 0
    Copy of Transfer Flags: 0x00000000
    Number of ISO descriptors: 0
Leftover Capture Data: 1b05

0000  40 fb e3 46 fd 89 ff ff 53 03 01 03 03 00 2d 00   @..F....S.....-.
0010  1d 87 39 5b 00 00 00 00 d1 b9 00 00 8d ff ff ff   ..9[............
0020  02 00 00 00 02 00 00 00 00 00 00 00 00 00 00 00   ................
0030  00 00 00 00 00 00 00 00 00 00 00 00 00 00 00 00   ................
0040  1b 05                                             ..

Frame 37: 66 bytes on wire (528 bits), 66 bytes captured (528 bits) on interface 0
    Interface id: 0 (unknown)
        Interface name: unknown
    Encapsulation type: USB packets with Linux header and padding (115)
    Arrival Time: Jul  1, 2018 21:59:57.157186000 EDT
    [Time shift for this packet: 0.000000000 seconds]
    Epoch Time: 1530496797.157186000 seconds
    [Time delta from previous captured frame: 0.109617000 seconds]
    [Time delta from previous displayed frame: 0.109617000 seconds]
    [Time since reference or first frame: 367.634935000 seconds]
    Frame Number: 37
    Frame Length: 66 bytes (528 bits)
    Capture Length: 66 bytes (528 bits)
    [Frame is marked: False]
    [Frame is ignored: False]
    [Protocols in frame: usb]
USB URB
    [Source: 3.3.2]
    [Destination: host]
    URB id: 0xffff89fd46e3fd80
    URB type: URB_COMPLETE ('C')
    URB transfer type: URB_BULK (0x03)
    Endpoint: 0x82, Direction: IN
        1... .... = Direction: IN (1)
        .... 0010 = Endpoint number: 2
    Device: 3
    URB bus id: 3
    Device setup request: not relevant ('-')
    Data: present (0)
    URB sec: 1530496797
    URB usec: 157186
    URB status: Remote I/O error (-EREMOTEIO) (-121)
    URB length [bytes]: 2
    Data length [bytes]: 2
    [bInterfaceClass: Unknown (0xffff)]
    Unused Setup Header
    Interval: 0
    Start frame: 0
    Copy of Transfer Flags: 0x00000201
    Number of ISO descriptors: 0
Leftover Capture Data: 3003

0000  80 fd e3 46 fd 89 ff ff 43 03 82 03 03 00 2d 00   ...F....C.....-.
0010  1d 87 39 5b 00 00 00 00 02 66 02 00 87 ff ff ff   ..9[.....f......
0020  02 00 00 00 02 00 00 00 00 00 00 00 00 00 00 00   ................
0030  00 00 00 00 00 00 00 00 01 02 00 00 00 00 00 00   ................
0040  30 03                                             0.

Frame 38: 100 bytes on wire (800 bits), 100 bytes captured (800 bits) on interface 0
    Interface id: 0 (unknown)
        Interface name: unknown
    Encapsulation type: USB packets with Linux header and padding (115)
    Arrival Time: Jul  1, 2018 21:59:57.756965000 EDT
    [Time shift for this packet: 0.000000000 seconds]
    Epoch Time: 1530496797.756965000 seconds
    [Time delta from previous captured frame: 0.599779000 seconds]
    [Time delta from previous displayed frame: 0.599779000 seconds]
    [Time since reference or first frame: 368.234714000 seconds]
    Frame Number: 38
    Frame Length: 100 bytes (800 bits)
    Capture Length: 100 bytes (800 bits)
    [Frame is marked: False]
    [Frame is ignored: False]
    [Protocols in frame: usb]
USB URB
    [Source: host]
    [Destination: 3.3.1]
    URB id: 0xffff89fd46e3fd80
    URB type: URB_SUBMIT ('S')
    URB transfer type: URB_BULK (0x03)
    Endpoint: 0x01, Direction: OUT
        0... .... = Direction: OUT (0)
        .... 0001 = Endpoint number: 1
    Device: 3
    URB bus id: 3
    Device setup request: not relevant ('-')
    Data: present (0)
    URB sec: 1530496797
    URB usec: 756965
    URB status: Operation now in progress (-EINPROGRESS) (-115)
    URB length [bytes]: 36
    Data length [bytes]: 36
    [bInterfaceClass: Unknown (0xffff)]
    Unused Setup Header
    Interval: 0
    Start frame: 0
    Copy of Transfer Flags: 0x00000000
    Number of ISO descriptors: 0
Leftover Capture Data: 54473103464e3003544235302c30035c33302c3330035a35...

0000  80 fd e3 46 fd 89 ff ff 53 03 01 03 03 00 2d 00   ...F....S.....-.
0010  1d 87 39 5b 00 00 00 00 e5 8c 0b 00 8d ff ff ff   ..9[............
0020  24 00 00 00 24 00 00 00 00 00 00 00 00 00 00 00   $...$...........
0030  00 00 00 00 00 00 00 00 00 00 00 00 00 00 00 00   ................
0040  54 47 31 03 46 4e 30 03 54 42 35 30 2c 30 03 5c   TG1.FN0.TB50,0.\
0050  33 30 2c 33 30 03 5a 35 35 35 38 2c 34 32 38 38   30,30.Z5558,4288
0060  03 4a 31 03                                       .J1.

Frame 39: 66 bytes on wire (528 bits), 66 bytes captured (528 bits) on interface 0
    Interface id: 0 (unknown)
        Interface name: unknown
    Encapsulation type: USB packets with Linux header and padding (115)
    Arrival Time: Jul  1, 2018 21:59:58.774145000 EDT
    [Time shift for this packet: 0.000000000 seconds]
    Epoch Time: 1530496798.774145000 seconds
    [Time delta from previous captured frame: 1.017180000 seconds]
    [Time delta from previous displayed frame: 1.017180000 seconds]
    [Time since reference or first frame: 369.251894000 seconds]
    Frame Number: 39
    Frame Length: 66 bytes (528 bits)
    Capture Length: 66 bytes (528 bits)
    [Frame is marked: False]
    [Frame is ignored: False]
    [Protocols in frame: usb]
USB URB
    [Source: host]
    [Destination: 3.3.1]
    URB id: 0xffff89fc41ab8480
    URB type: URB_SUBMIT ('S')
    URB transfer type: URB_BULK (0x03)
    Endpoint: 0x01, Direction: OUT
        0... .... = Direction: OUT (0)
        .... 0001 = Endpoint number: 1
    Device: 3
    URB bus id: 3
    Device setup request: not relevant ('-')
    Data: present (0)
    URB sec: 1530496798
    URB usec: 774145
    URB status: Operation now in progress (-EINPROGRESS) (-115)
    URB length [bytes]: 2
    Data length [bytes]: 2
    [bInterfaceClass: Unknown (0xffff)]
    Unused Setup Header
    Interval: 0
    Start frame: 0
    Copy of Transfer Flags: 0x00000000
    Number of ISO descriptors: 0
Leftover Capture Data: 1b05

0000  80 84 ab 41 fc 89 ff ff 53 03 01 03 03 00 2d 00   ...A....S.....-.
0010  1e 87 39 5b 00 00 00 00 01 d0 0b 00 8d ff ff ff   ..9[............
0020  02 00 00 00 02 00 00 00 00 00 00 00 00 00 00 00   ................
0030  00 00 00 00 00 00 00 00 00 00 00 00 00 00 00 00   ................
0040  1b 05                                             ..

Frame 40: 66 bytes on wire (528 bits), 66 bytes captured (528 bits) on interface 0
    Interface id: 0 (unknown)
        Interface name: unknown
    Encapsulation type: USB packets with Linux header and padding (115)
    Arrival Time: Jul  1, 2018 21:59:58.879224000 EDT
    [Time shift for this packet: 0.000000000 seconds]
    Epoch Time: 1530496798.879224000 seconds
    [Time delta from previous captured frame: 0.105079000 seconds]
    [Time delta from previous displayed frame: 0.105079000 seconds]
    [Time since reference or first frame: 369.356973000 seconds]
    Frame Number: 40
    Frame Length: 66 bytes (528 bits)
    Capture Length: 66 bytes (528 bits)
    [Frame is marked: False]
    [Frame is ignored: False]
    [Protocols in frame: usb]
USB URB
    [Source: 3.3.2]
    [Destination: host]
    URB id: 0xffff89fd4d50dcc0
    URB type: URB_COMPLETE ('C')
    URB transfer type: URB_BULK (0x03)
    Endpoint: 0x82, Direction: IN
        1... .... = Direction: IN (1)
        .... 0010 = Endpoint number: 2
    Device: 3
    URB bus id: 3
    Device setup request: not relevant ('-')
    Data: present (0)
    URB sec: 1530496798
    URB usec: 879224
    URB status: Remote I/O error (-EREMOTEIO) (-121)
    URB length [bytes]: 2
    Data length [bytes]: 2
    [bInterfaceClass: Unknown (0xffff)]
    Unused Setup Header
    Interval: 0
    Start frame: 0
    Copy of Transfer Flags: 0x00000201
    Number of ISO descriptors: 0
Leftover Capture Data: 3003

0000  c0 dc 50 4d fd 89 ff ff 43 03 82 03 03 00 2d 00   ..PM....C.....-.
0010  1e 87 39 5b 00 00 00 00 78 6a 0d 00 87 ff ff ff   ..9[....xj......
0020  02 00 00 00 02 00 00 00 00 00 00 00 00 00 00 00   ................
0030  00 00 00 00 00 00 00 00 01 02 00 00 00 00 00 00   ................
0040  30 03                                             0.

Frame 41: 85 bytes on wire (680 bits), 85 bytes captured (680 bits) on interface 0
    Interface id: 0 (unknown)
        Interface name: unknown
    Encapsulation type: USB packets with Linux header and padding (115)
    Arrival Time: Jul  1, 2018 21:59:59.148979000 EDT
    [Time shift for this packet: 0.000000000 seconds]
    Epoch Time: 1530496799.148979000 seconds
    [Time delta from previous captured frame: 0.269755000 seconds]
    [Time delta from previous displayed frame: 0.269755000 seconds]
    [Time since reference or first frame: 369.626728000 seconds]
    Frame Number: 41
    Frame Length: 85 bytes (680 bits)
    Capture Length: 85 bytes (680 bits)
    [Frame is marked: False]
    [Frame is ignored: False]
    [Protocols in frame: usb]
USB URB
    [Source: host]
    [Destination: 3.3.1]
    URB id: 0xffff89fd46e3fd80
    URB type: URB_SUBMIT ('S')
    URB transfer type: URB_BULK (0x03)
    Endpoint: 0x01, Direction: OUT
        0... .... = Direction: OUT (0)
        .... 0001 = Endpoint number: 1
    Device: 3
    URB bus id: 3
    Device setup request: not relevant ('-')
    Data: present (0)
    URB sec: 1530496799
    URB usec: 148979
    URB status: Operation now in progress (-EINPROGRESS) (-115)
    URB length [bytes]: 21
    Data length [bytes]: 21
    [bInterfaceClass: Unknown (0xffff)]
    Unused Setup Header
    Interval: 0
    Start frame: 0
    Copy of Transfer Flags: 0x00000000
    Number of ISO descriptors: 0
Leftover Capture Data: 2131302c3103465831382c31034643302c312c3103

0000  80 fd e3 46 fd 89 ff ff 53 03 01 03 03 00 2d 00   ...F....S.....-.
0010  1f 87 39 5b 00 00 00 00 f3 45 02 00 8d ff ff ff   ..9[.....E......
0020  15 00 00 00 15 00 00 00 00 00 00 00 00 00 00 00   ................
0030  00 00 00 00 00 00 00 00 00 00 00 00 00 00 00 00   ................
0040  21 31 30 2c 31 03 46 58 31 38 2c 31 03 46 43 30   !10,1.FX18,1.FC0
0050  2c 31 2c 31 03                                    ,1,1.

Frame 42: 78 bytes on wire (624 bits), 78 bytes captured (624 bits) on interface 0
    Interface id: 0 (unknown)
        Interface name: unknown
    Encapsulation type: USB packets with Linux header and padding (115)
    Arrival Time: Jul  1, 2018 21:59:59.262824000 EDT
    [Time shift for this packet: 0.000000000 seconds]
    Epoch Time: 1530496799.262824000 seconds
    [Time delta from previous captured frame: 0.113845000 seconds]
    [Time delta from previous displayed frame: 0.113845000 seconds]
    [Time since reference or first frame: 369.740573000 seconds]
    Frame Number: 42
    Frame Length: 78 bytes (624 bits)
    Capture Length: 78 bytes (624 bits)
    [Frame is marked: False]
    [Frame is ignored: False]
    [Protocols in frame: usb]
USB URB
    [Source: host]
    [Destination: 3.3.1]
    URB id: 0xffff89fc41ab8cc0
    URB type: URB_SUBMIT ('S')
    URB transfer type: URB_BULK (0x03)
    Endpoint: 0x01, Direction: OUT
        0... .... = Direction: OUT (0)
        .... 0001 = Endpoint number: 1
    Device: 3
    URB bus id: 3
    Device setup request: not relevant ('-')
    Data: present (0)
    URB sec: 1530496799
    URB usec: 262824
    URB status: Operation now in progress (-EINPROGRESS) (-115)
    URB length [bytes]: 14
    Data length [bytes]: 14
    [bInterfaceClass: Unknown (0xffff)]
    Unused Setup Header
    Interval: 0
    Start frame: 0
    Copy of Transfer Flags: 0x00000000
    Number of ISO descriptors: 0
Leftover Capture Data: 4645302c31034646302c302c3103

0000  c0 8c ab 41 fc 89 ff ff 53 03 01 03 03 00 2d 00   ...A....S.....-.
0010  1f 87 39 5b 00 00 00 00 a8 02 04 00 8d ff ff ff   ..9[............
0020  0e 00 00 00 0e 00 00 00 00 00 00 00 00 00 00 00   ................
0030  00 00 00 00 00 00 00 00 00 00 00 00 00 00 00 00   ................
0040  46 45 30 2c 31 03 46 46 30 2c 30 2c 31 03         FE0,1.FF0,0,1.

Frame 43: 66 bytes on wire (528 bits), 66 bytes captured (528 bits) on interface 0
    Interface id: 0 (unknown)
        Interface name: unknown
    Encapsulation type: USB packets with Linux header and padding (115)
    Arrival Time: Jul  1, 2018 21:59:59.457292000 EDT
    [Time shift for this packet: 0.000000000 seconds]
    Epoch Time: 1530496799.457292000 seconds
    [Time delta from previous captured frame: 0.194468000 seconds]
    [Time delta from previous displayed frame: 0.194468000 seconds]
    [Time since reference or first frame: 369.935041000 seconds]
    Frame Number: 43
    Frame Length: 66 bytes (528 bits)
    Capture Length: 66 bytes (528 bits)
    [Frame is marked: False]
    [Frame is ignored: False]
    [Protocols in frame: usb]
USB URB
    [Source: host]
    [Destination: 3.3.1]
    URB id: 0xffff89fd4d50de40
    URB type: URB_SUBMIT ('S')
    URB transfer type: URB_BULK (0x03)
    Endpoint: 0x01, Direction: OUT
        0... .... = Direction: OUT (0)
        .... 0001 = Endpoint number: 1
    Device: 3
    URB bus id: 3
    Device setup request: not relevant ('-')
    Data: present (0)
    URB sec: 1530496799
    URB usec: 457292
    URB status: Operation now in progress (-EINPROGRESS) (-115)
    URB length [bytes]: 2
    Data length [bytes]: 2
    [bInterfaceClass: Unknown (0xffff)]
    Unused Setup Header
    Interval: 0
    Start frame: 0
    Copy of Transfer Flags: 0x00000000
    Number of ISO descriptors: 0
Leftover Capture Data: 1b05

0000  40 de 50 4d fd 89 ff ff 53 03 01 03 03 00 2d 00   @.PM....S.....-.
0010  1f 87 39 5b 00 00 00 00 4c fa 06 00 8d ff ff ff   ..9[....L.......
0020  02 00 00 00 02 00 00 00 00 00 00 00 00 00 00 00   ................
0030  00 00 00 00 00 00 00 00 00 00 00 00 00 00 00 00   ................
0040  1b 05                                             ..

Frame 44: 66 bytes on wire (528 bits), 66 bytes captured (528 bits) on interface 0
    Interface id: 0 (unknown)
        Interface name: unknown
    Encapsulation type: USB packets with Linux header and padding (115)
    Arrival Time: Jul  1, 2018 21:59:59.617228000 EDT
    [Time shift for this packet: 0.000000000 seconds]
    Epoch Time: 1530496799.617228000 seconds
    [Time delta from previous captured frame: 0.159936000 seconds]
    [Time delta from previous displayed frame: 0.159936000 seconds]
    [Time since reference or first frame: 370.094977000 seconds]
    Frame Number: 44
    Frame Length: 66 bytes (528 bits)
    Capture Length: 66 bytes (528 bits)
    [Frame is marked: False]
    [Frame is ignored: False]
    [Protocols in frame: usb]
USB URB
    [Source: 3.3.2]
    [Destination: host]
    URB id: 0xffff89fd46e3f600
    URB type: URB_COMPLETE ('C')
    URB transfer type: URB_BULK (0x03)
    Endpoint: 0x82, Direction: IN
        1... .... = Direction: IN (1)
        .... 0010 = Endpoint number: 2
    Device: 3
    URB bus id: 3
    Device setup request: not relevant ('-')
    Data: present (0)
    URB sec: 1530496799
    URB usec: 617228
    URB status: Remote I/O error (-EREMOTEIO) (-121)
    URB length [bytes]: 2
    Data length [bytes]: 2
    [bInterfaceClass: Unknown (0xffff)]
    Unused Setup Header
    Interval: 0
    Start frame: 0
    Copy of Transfer Flags: 0x00000201
    Number of ISO descriptors: 0
Leftover Capture Data: 3003

0000  00 f6 e3 46 fd 89 ff ff 43 03 82 03 03 00 2d 00   ...F....C.....-.
0010  1f 87 39 5b 00 00 00 00 0c 6b 09 00 87 ff ff ff   ..9[.....k......
0020  02 00 00 00 02 00 00 00 00 00 00 00 00 00 00 00   ................
0030  00 00 00 00 00 00 00 00 01 02 00 00 00 00 00 00   ................
0040  30 03                                             0.

Frame 45: 66 bytes on wire (528 bits), 66 bytes captured (528 bits) on interface 0
    Interface id: 0 (unknown)
        Interface name: unknown
    Encapsulation type: USB packets with Linux header and padding (115)
    Arrival Time: Jul  1, 2018 21:59:59.671563000 EDT
    [Time shift for this packet: 0.000000000 seconds]
    Epoch Time: 1530496799.671563000 seconds
    [Time delta from previous captured frame: 0.054335000 seconds]
    [Time delta from previous displayed frame: 0.054335000 seconds]
    [Time since reference or first frame: 370.149312000 seconds]
    Frame Number: 45
    Frame Length: 66 bytes (528 bits)
    Capture Length: 66 bytes (528 bits)
    [Frame is marked: False]
    [Frame is ignored: False]
    [Protocols in frame: usb]
USB URB
    [Source: host]
    [Destination: 3.3.1]
    URB id: 0xffff89fd46e3fd80
    URB type: URB_SUBMIT ('S')
    URB transfer type: URB_BULK (0x03)
    Endpoint: 0x01, Direction: OUT
        0... .... = Direction: OUT (0)
        .... 0001 = Endpoint number: 1
    Device: 3
    URB bus id: 3
    Device setup request: not relevant ('-')
    Data: present (0)
    URB sec: 1530496799
    URB usec: 671563
    URB status: Operation now in progress (-EINPROGRESS) (-115)
    URB length [bytes]: 2
    Data length [bytes]: 2
    [bInterfaceClass: Unknown (0xffff)]
    Unused Setup Header
    Interval: 0
    Start frame: 0
    Copy of Transfer Flags: 0x00000000
    Number of ISO descriptors: 0
Leftover Capture Data: 1b05

0000  80 fd e3 46 fd 89 ff ff 53 03 01 03 03 00 2d 00   ...F....S.....-.
0010  1f 87 39 5b 00 00 00 00 4b 3f 0a 00 8d ff ff ff   ..9[....K?......
0020  02 00 00 00 02 00 00 00 00 00 00 00 00 00 00 00   ................
0030  00 00 00 00 00 00 00 00 00 00 00 00 00 00 00 00   ................
0040  1b 05                                             ..

Frame 46: 66 bytes on wire (528 bits), 66 bytes captured (528 bits) on interface 0
    Interface id: 0 (unknown)
        Interface name: unknown
    Encapsulation type: USB packets with Linux header and padding (115)
    Arrival Time: Jul  1, 2018 21:59:59.986111000 EDT
    [Time shift for this packet: 0.000000000 seconds]
    Epoch Time: 1530496799.986111000 seconds
    [Time delta from previous captured frame: 0.314548000 seconds]
    [Time delta from previous displayed frame: 0.314548000 seconds]
    [Time since reference or first frame: 370.463860000 seconds]
    Frame Number: 46
    Frame Length: 66 bytes (528 bits)
    Capture Length: 66 bytes (528 bits)
    [Frame is marked: False]
    [Frame is ignored: False]
    [Protocols in frame: usb]
USB URB
    [Source: 3.3.2]
    [Destination: host]
    URB id: 0xffff89fd46e3fd80
    URB type: URB_COMPLETE ('C')
    URB transfer type: URB_BULK (0x03)
    Endpoint: 0x82, Direction: IN
        1... .... = Direction: IN (1)
        .... 0010 = Endpoint number: 2
    Device: 3
    URB bus id: 3
    Device setup request: not relevant ('-')
    Data: present (0)
    URB sec: 1530496799
    URB usec: 986111
    URB status: Remote I/O error (-EREMOTEIO) (-121)
    URB length [bytes]: 2
    Data length [bytes]: 2
    [bInterfaceClass: Unknown (0xffff)]
    Unused Setup Header
    Interval: 0
    Start frame: 0
    Copy of Transfer Flags: 0x00000201
    Number of ISO descriptors: 0
Leftover Capture Data: 3003

0000  80 fd e3 46 fd 89 ff ff 43 03 82 03 03 00 2d 00   ...F....C.....-.
0010  1f 87 39 5b 00 00 00 00 ff 0b 0f 00 87 ff ff ff   ..9[............
0020  02 00 00 00 02 00 00 00 00 00 00 00 00 00 00 00   ................
0030  00 00 00 00 00 00 00 00 01 02 00 00 00 00 00 00   ................
0040  30 03                                             0.

Frame 47: 73 bytes on wire (584 bits), 73 bytes captured (584 bits) on interface 0
    Interface id: 0 (unknown)
        Interface name: unknown
    Encapsulation type: USB packets with Linux header and padding (115)
    Arrival Time: Jul  1, 2018 22:00:00.160007000 EDT
    [Time shift for this packet: 0.000000000 seconds]
    Epoch Time: 1530496800.160007000 seconds
    [Time delta from previous captured frame: 0.173896000 seconds]
    [Time delta from previous displayed frame: 0.173896000 seconds]
    [Time since reference or first frame: 370.637756000 seconds]
    Frame Number: 47
    Frame Length: 73 bytes (584 bits)
    Capture Length: 73 bytes (584 bits)
    [Frame is marked: False]
    [Frame is ignored: False]
    [Protocols in frame: usb]
USB URB
    [Source: host]
    [Destination: 3.3.1]
    URB id: 0xffff89fc41ab8000
    URB type: URB_SUBMIT ('S')
    URB transfer type: URB_BULK (0x03)
    Endpoint: 0x01, Direction: OUT
        0... .... = Direction: OUT (0)
        .... 0001 = Endpoint number: 1
    Device: 3
    URB bus id: 3
    Device setup request: not relevant ('-')
    Data: present (0)
    URB sec: 1530496800
    URB usec: 160007
    URB status: Operation now in progress (-EINPROGRESS) (-115)
    URB length [bytes]: 9
    Data length [bytes]: 9
    [bInterfaceClass: Unknown (0xffff)]
    Unused Setup Header
    Interval: 0
    Start frame: 0
    Copy of Transfer Flags: 0x00000000
    Number of ISO descriptors: 0
Leftover Capture Data: 4d3235342c32353403

0000  00 80 ab 41 fc 89 ff ff 53 03 01 03 03 00 2d 00   ...A....S.....-.
0010  20 87 39 5b 00 00 00 00 07 71 02 00 8d ff ff ff    .9[.....q......
0020  09 00 00 00 09 00 00 00 00 00 00 00 00 00 00 00   ................
0030  00 00 00 00 00 00 00 00 00 00 00 00 00 00 00 00   ................
0040  4d 32 35 34 2c 32 35 34 03                        M254,254.

Frame 48: 74 bytes on wire (592 bits), 74 bytes captured (592 bits) on interface 0
    Interface id: 0 (unknown)
        Interface name: unknown
    Encapsulation type: USB packets with Linux header and padding (115)
    Arrival Time: Jul  1, 2018 22:00:00.371471000 EDT
    [Time shift for this packet: 0.000000000 seconds]
    Epoch Time: 1530496800.371471000 seconds
    [Time delta from previous captured frame: 0.211464000 seconds]
    [Time delta from previous displayed frame: 0.211464000 seconds]
    [Time since reference or first frame: 370.849220000 seconds]
    Frame Number: 48
    Frame Length: 74 bytes (592 bits)
    Capture Length: 74 bytes (592 bits)
    [Frame is marked: False]
    [Frame is ignored: False]
    [Protocols in frame: usb]
USB URB
    [Source: host]
    [Destination: 3.3.1]
    URB id: 0xffff89fd4d50dd80
    URB type: URB_SUBMIT ('S')
    URB transfer type: URB_BULK (0x03)
    Endpoint: 0x01, Direction: OUT
        0... .... = Direction: OUT (0)
        .... 0001 = Endpoint number: 1
    Device: 3
    URB bus id: 3
    Device setup request: not relevant ('-')
    Data: present (0)
    URB sec: 1530496800
    URB usec: 371471
    URB status: Operation now in progress (-EINPROGRESS) (-115)
    URB length [bytes]: 10
    Data length [bytes]: 10
    [bInterfaceClass: Unknown (0xffff)]
    Unused Setup Header
    Interval: 0
    Start frame: 0
    Copy of Transfer Flags: 0x00000000
    Number of ISO descriptors: 0
Leftover Capture Data: 424532e821903c3bab03

0000  80 dd 50 4d fd 89 ff ff 53 03 01 03 03 00 2d 00   ..PM....S.....-.
0010  20 87 39 5b 00 00 00 00 0f ab 05 00 8d ff ff ff    .9[............
0020  0a 00 00 00 0a 00 00 00 00 00 00 00 00 00 00 00   ................
0030  00 00 00 00 00 00 00 00 00 00 00 00 00 00 00 00   ................
0040  42 45 32 e8 21 90 3c 3b ab 03                     BE2.!.<;..

Frame 49: 70 bytes on wire (560 bits), 70 bytes captured (560 bits) on interface 0
    Interface id: 0 (unknown)
        Interface name: unknown
    Encapsulation type: USB packets with Linux header and padding (115)
    Arrival Time: Jul  1, 2018 22:00:00.525470000 EDT
    [Time shift for this packet: 0.000000000 seconds]
    Epoch Time: 1530496800.525470000 seconds
    [Time delta from previous captured frame: 0.153999000 seconds]
    [Time delta from previous displayed frame: 0.153999000 seconds]
    [Time since reference or first frame: 371.003219000 seconds]
    Frame Number: 49
    Frame Length: 70 bytes (560 bits)
    Capture Length: 70 bytes (560 bits)
    [Frame is marked: False]
    [Frame is ignored: False]
    [Protocols in frame: usb]
USB URB
    [Source: host]
    [Destination: 3.3.1]
    URB id: 0xffff89fd4d50dd80
    URB type: URB_SUBMIT ('S')
    URB transfer type: URB_BULK (0x03)
    Endpoint: 0x01, Direction: OUT
        0... .... = Direction: OUT (0)
        .... 0001 = Endpoint number: 1
    Device: 3
    URB bus id: 3
    Device setup request: not relevant ('-')
    Data: present (0)
    URB sec: 1530496800
    URB usec: 525470
    URB status: Operation now in progress (-EINPROGRESS) (-115)
    URB length [bytes]: 6
    Data length [bytes]: 6
    [bInterfaceClass: Unknown (0xffff)]
    Unused Setup Header
    Interval: 0
    Start frame: 0
    Copy of Transfer Flags: 0x00000000
    Number of ISO descriptors: 0
Leftover Capture Data: 424531909003

0000  80 dd 50 4d fd 89 ff ff 53 03 01 03 03 00 2d 00   ..PM....S.....-.
0010  20 87 39 5b 00 00 00 00 9e 04 08 00 8d ff ff ff    .9[............
0020  06 00 00 00 06 00 00 00 00 00 00 00 00 00 00 00   ................
0030  00 00 00 00 00 00 00 00 00 00 00 00 00 00 00 00   ................
0040  42 45 31 90 90 03                                 BE1...

Frame 50: 83 bytes on wire (664 bits), 83 bytes captured (664 bits) on interface 0
    Interface id: 0 (unknown)
        Interface name: unknown
    Encapsulation type: USB packets with Linux header and padding (115)
    Arrival Time: Jul  1, 2018 22:00:00.699939000 EDT
    [Time shift for this packet: 0.000000000 seconds]
    Epoch Time: 1530496800.699939000 seconds
    [Time delta from previous captured frame: 0.174469000 seconds]
    [Time delta from previous displayed frame: 0.174469000 seconds]
    [Time since reference or first frame: 371.177688000 seconds]
    Frame Number: 50
    Frame Length: 83 bytes (664 bits)
    Capture Length: 83 bytes (664 bits)
    [Frame is marked: False]
    [Frame is ignored: False]
    [Protocols in frame: usb]
USB URB
    [Source: host]
    [Destination: 3.3.1]
    URB id: 0xffff89fd4d50dd80
    URB type: URB_SUBMIT ('S')
    URB transfer type: URB_BULK (0x03)
    Endpoint: 0x01, Direction: OUT
        0... .... = Direction: OUT (0)
        .... 0001 = Endpoint number: 1
    Device: 3
    URB bus id: 3
    Device setup request: not relevant ('-')
    Data: present (0)
    URB sec: 1530496800
    URB usec: 699939
    URB status: Operation now in progress (-EINPROGRESS) (-115)
    URB length [bytes]: 19
    Data length [bytes]: 19
    [bInterfaceClass: Unknown (0xffff)]
    Unused Setup Header
    Interval: 0
    Start frame: 0
    Copy of Transfer Flags: 0x00000000
    Number of ISO descriptors: 0
Leftover Capture Data: 424532d6247b92dd89a844a19acca0b24a8903

0000  80 dd 50 4d fd 89 ff ff 53 03 01 03 03 00 2d 00   ..PM....S.....-.
0010  20 87 39 5b 00 00 00 00 23 ae 0a 00 8d ff ff ff    .9[....#.......
0020  13 00 00 00 13 00 00 00 00 00 00 00 00 00 00 00   ................
0030  00 00 00 00 00 00 00 00 00 00 00 00 00 00 00 00   ................
0040  42 45 32 d6 24 7b 92 dd 89 a8 44 a1 9a cc a0 b2   BE2.${....D.....
0050  4a 89 03                                          J..

Frame 51: 74 bytes on wire (592 bits), 74 bytes captured (592 bits) on interface 0
    Interface id: 0 (unknown)
        Interface name: unknown
    Encapsulation type: USB packets with Linux header and padding (115)
    Arrival Time: Jul  1, 2018 22:00:00.874056000 EDT
    [Time shift for this packet: 0.000000000 seconds]
    Epoch Time: 1530496800.874056000 seconds
    [Time delta from previous captured frame: 0.174117000 seconds]
    [Time delta from previous displayed frame: 0.174117000 seconds]
    [Time since reference or first frame: 371.351805000 seconds]
    Frame Number: 51
    Frame Length: 74 bytes (592 bits)
    Capture Length: 74 bytes (592 bits)
    [Frame is marked: False]
    [Frame is ignored: False]
    [Protocols in frame: usb]
USB URB
    [Source: host]
    [Destination: 3.3.1]
    URB id: 0xffff89fc41ab83c0
    URB type: URB_SUBMIT ('S')
    URB transfer type: URB_BULK (0x03)
    Endpoint: 0x01, Direction: OUT
        0... .... = Direction: OUT (0)
        .... 0001 = Endpoint number: 1
    Device: 3
    URB bus id: 3
    Device setup request: not relevant ('-')
    Data: present (0)
    URB sec: 1530496800
    URB usec: 874056
    URB status: Operation now in progress (-EINPROGRESS) (-115)
    URB length [bytes]: 10
    Data length [bytes]: 10
    [bInterfaceClass: Unknown (0xffff)]
    Unused Setup Header
    Interval: 0
    Start frame: 0
    Copy of Transfer Flags: 0x00000000
    Number of ISO descriptors: 0
Leftover Capture Data: 4245319090909090f603

0000  c0 83 ab 41 fc 89 ff ff 53 03 01 03 03 00 2d 00   ...A....S.....-.
0010  20 87 39 5b 00 00 00 00 48 56 0d 00 8d ff ff ff    .9[....HV......
0020  0a 00 00 00 0a 00 00 00 00 00 00 00 00 00 00 00   ................
0030  00 00 00 00 00 00 00 00 00 00 00 00 00 00 00 00   ................
0040  42 45 31 90 90 90 90 90 f6 03                     BE1.......

Frame 52: 74 bytes on wire (592 bits), 74 bytes captured (592 bits) on interface 0
    Interface id: 0 (unknown)
        Interface name: unknown
    Encapsulation type: USB packets with Linux header and padding (115)
    Arrival Time: Jul  1, 2018 22:00:01.027966000 EDT
    [Time shift for this packet: 0.000000000 seconds]
    Epoch Time: 1530496801.027966000 seconds
    [Time delta from previous captured frame: 0.153910000 seconds]
    [Time delta from previous displayed frame: 0.153910000 seconds]
    [Time since reference or first frame: 371.505715000 seconds]
    Frame Number: 52
    Frame Length: 74 bytes (592 bits)
    Capture Length: 74 bytes (592 bits)
    [Frame is marked: False]
    [Frame is ignored: False]
    [Protocols in frame: usb]
USB URB
    [Source: host]
    [Destination: 3.3.1]
    URB id: 0xffff89fc41ab8c00
    URB type: URB_SUBMIT ('S')
    URB transfer type: URB_BULK (0x03)
    Endpoint: 0x01, Direction: OUT
        0... .... = Direction: OUT (0)
        .... 0001 = Endpoint number: 1
    Device: 3
    URB bus id: 3
    Device setup request: not relevant ('-')
    Data: present (0)
    URB sec: 1530496801
    URB usec: 27966
    URB status: Operation now in progress (-EINPROGRESS) (-115)
    URB length [bytes]: 10
    Data length [bytes]: 10
    [bInterfaceClass: Unknown (0xffff)]
    Unused Setup Header
    Interval: 0
    Start frame: 0
    Copy of Transfer Flags: 0x00000000
    Number of ISO descriptors: 0
Leftover Capture Data: 42453270fd8f84558303

0000  00 8c ab 41 fc 89 ff ff 53 03 01 03 03 00 2d 00   ...A....S.....-.
0010  21 87 39 5b 00 00 00 00 3e 6d 00 00 8d ff ff ff   !.9[....>m......
0020  0a 00 00 00 0a 00 00 00 00 00 00 00 00 00 00 00   ................
0030  00 00 00 00 00 00 00 00 00 00 00 00 00 00 00 00   ................
0040  42 45 32 70 fd 8f 84 55 83 03                     BE2p...U..

Frame 53: 310 bytes on wire (2480 bits), 310 bytes captured (2480 bits) on interface 0
    Interface id: 0 (unknown)
        Interface name: unknown
    Encapsulation type: USB packets with Linux header and padding (115)
    Arrival Time: Jul  1, 2018 22:00:01.182004000 EDT
    [Time shift for this packet: 0.000000000 seconds]
    Epoch Time: 1530496801.182004000 seconds
    [Time delta from previous captured frame: 0.154038000 seconds]
    [Time delta from previous displayed frame: 0.154038000 seconds]
    [Time since reference or first frame: 371.659753000 seconds]
    Frame Number: 53
    Frame Length: 310 bytes (2480 bits)
    Capture Length: 310 bytes (2480 bits)
    [Frame is marked: False]
    [Frame is ignored: False]
    [Protocols in frame: usb]
USB URB
    [Source: host]
    [Destination: 3.3.1]
    URB id: 0xffff89fc41ab89c0
    URB type: URB_SUBMIT ('S')
    URB transfer type: URB_BULK (0x03)
    Endpoint: 0x01, Direction: OUT
        0... .... = Direction: OUT (0)
        .... 0001 = Endpoint number: 1
    Device: 3
    URB bus id: 3
    Device setup request: not relevant ('-')
    Data: present (0)
    URB sec: 1530496801
    URB usec: 182004
    URB status: Operation now in progress (-EINPROGRESS) (-115)
    URB length [bytes]: 246
    Data length [bytes]: 246
    [bInterfaceClass: Unknown (0xffff)]
    Unused Setup Header
    Interval: 0
    Start frame: 0
    Copy of Transfer Flags: 0x00000000
    Number of ISO descriptors: 0
Leftover Capture Data: 4245319890939c949c959c959b969b969b969a979a989a98...

0000  c0 89 ab 41 fc 89 ff ff 53 03 01 03 03 00 2d 00   ...A....S.....-.
0010  21 87 39 5b 00 00 00 00 f4 c6 02 00 8d ff ff ff   !.9[............
0020  f6 00 00 00 f6 00 00 00 00 00 00 00 00 00 00 00   ................
0030  00 00 00 00 00 00 00 00 00 00 00 00 00 00 00 00   ................
0040  42 45 31 98 90 93 9c 94 9c 95 9c 95 9b 96 9b 96   BE1.............
0050  9b 96 9a 97 9a 98 9a 98 99 98 99 99 98 99 98 9a   ................
0060  98 9a 97 9a 96 9b 96 9b 96 9b 95 9c 95 9c 94 9c   ................
0070  93 9c 93 9c 92 9d 92 9d 91 9d 90 9d 90 9d 8f 9d   ................
0080  8e 9c 8e 9c 8d 9c 8d 9c 8c 9c 8b 9b 8b 9b 8a 9b   ................
0090  8a 9a 8a 9a 89 9a 88 99 88 99 88 98 87 98 87 98   ................
00a0  86 97 86 96 86 96 85 96 85 95 85 95 84 94 84 93   ................
00b0  84 93 84 92 84 92 83 91 83 90 83 90 83 8f 83 8e   ................
00c0  83 8e 84 8d 84 8d 84 8c 84 8b 84 8b 85 8a 85 8a   ................
00d0  85 8a 86 89 86 88 86 88 87 88 87 87 88 87 88 86   ................
00e0  88 86 89 86 8a 85 8a 85 8a 85 8b 84 8b 84 8c 84   ................
00f0  8d 84 8d 84 8e 83 8e 83 8f 83 90 83 90 83 91 83   ................
0100  92 84 92 84 93 84 93 84 94 84 95 85 95 85 96 85   ................
0110  96 86 96 86 97 86 98 87 98 87 98 88 99 88 99 88   ................
0120  9a 89 9a 8a 9a 8a 9b 8a 9b 8b 9b 8b 9c 8c 9c 8d   ................
0130  9c 8d 9c 8e 9c 03                                 ......

Frame 54: 88 bytes on wire (704 bits), 88 bytes captured (704 bits) on interface 0
    Interface id: 0 (unknown)
        Interface name: unknown
    Encapsulation type: USB packets with Linux header and padding (115)
    Arrival Time: Jul  1, 2018 22:00:01.536850000 EDT
    [Time shift for this packet: 0.000000000 seconds]
    Epoch Time: 1530496801.536850000 seconds
    [Time delta from previous captured frame: 0.354846000 seconds]
    [Time delta from previous displayed frame: 0.354846000 seconds]
    [Time since reference or first frame: 372.014599000 seconds]
    Frame Number: 54
    Frame Length: 88 bytes (704 bits)
    Capture Length: 88 bytes (704 bits)
    [Frame is marked: False]
    [Frame is ignored: False]
    [Protocols in frame: usb]
USB URB
    [Source: host]
    [Destination: 3.3.1]
    URB id: 0xffff89fd4d50dd80
    URB type: URB_SUBMIT ('S')
    URB transfer type: URB_BULK (0x03)
    Endpoint: 0x01, Direction: OUT
        0... .... = Direction: OUT (0)
        .... 0001 = Endpoint number: 1
    Device: 3
    URB bus id: 3
    Device setup request: not relevant ('-')
    Data: present (0)
    URB sec: 1530496801
    URB usec: 536850
    URB status: Operation now in progress (-EINPROGRESS) (-115)
    URB length [bytes]: 24
    Data length [bytes]: 24
    [bInterfaceClass: Unknown (0xffff)]
    Unused Setup Header
    Interval: 0
    Start frame: 0
    Copy of Transfer Flags: 0x00000000
    Number of ISO descriptors: 0
Leftover Capture Data: 4245318e9d8f9d909d909d919d929d929c939c9090889003

0000  80 dd 50 4d fd 89 ff ff 53 03 01 03 03 00 2d 00   ..PM....S.....-.
0010  21 87 39 5b 00 00 00 00 12 31 08 00 8d ff ff ff   !.9[.....1......
0020  18 00 00 00 18 00 00 00 00 00 00 00 00 00 00 00   ................
0030  00 00 00 00 00 00 00 00 00 00 00 00 00 00 00 00   ................
0040  42 45 31 8e 9d 8f 9d 90 9d 90 9d 91 9d 92 9d 92   BE1.............
0050  9c 93 9c 90 90 88 90 03                           ........

Frame 55: 71 bytes on wire (568 bits), 71 bytes captured (568 bits) on interface 0
    Interface id: 0 (unknown)
        Interface name: unknown
    Encapsulation type: USB packets with Linux header and padding (115)
    Arrival Time: Jul  1, 2018 22:00:01.690838000 EDT
    [Time shift for this packet: 0.000000000 seconds]
    Epoch Time: 1530496801.690838000 seconds
    [Time delta from previous captured frame: 0.153988000 seconds]
    [Time delta from previous displayed frame: 0.153988000 seconds]
    [Time since reference or first frame: 372.168587000 seconds]
    Frame Number: 55
    Frame Length: 71 bytes (568 bits)
    Capture Length: 71 bytes (568 bits)
    [Frame is marked: False]
    [Frame is ignored: False]
    [Protocols in frame: usb]
USB URB
    [Source: host]
    [Destination: 3.3.1]
    URB id: 0xffff89fd46e3fd80
    URB type: URB_SUBMIT ('S')
    URB transfer type: URB_BULK (0x03)
    Endpoint: 0x01, Direction: OUT
        0... .... = Direction: OUT (0)
        .... 0001 = Endpoint number: 1
    Device: 3
    URB bus id: 3
    Device setup request: not relevant ('-')
    Data: present (0)
    URB sec: 1530496801
    URB usec: 690838
    URB status: Operation now in progress (-EINPROGRESS) (-115)
    URB length [bytes]: 7
    Data length [bytes]: 7
    [bInterfaceClass: Unknown (0xffff)]
    Unused Setup Header
    Interval: 0
    Start frame: 0
    Copy of Transfer Flags: 0x00000000
    Number of ISO descriptors: 0
Leftover Capture Data: 424532f4d77a03

0000  80 fd e3 46 fd 89 ff ff 53 03 01 03 03 00 2d 00   ...F....S.....-.
0010  21 87 39 5b 00 00 00 00 96 8a 0a 00 8d ff ff ff   !.9[............
0020  07 00 00 00 07 00 00 00 00 00 00 00 00 00 00 00   ................
0030  00 00 00 00 00 00 00 00 00 00 00 00 00 00 00 00   ................
0040  42 45 32 f4 d7 7a 03                              BE2..z.

Frame 56: 70 bytes on wire (560 bits), 70 bytes captured (560 bits) on interface 0
    Interface id: 0 (unknown)
        Interface name: unknown
    Encapsulation type: USB packets with Linux header and padding (115)
    Arrival Time: Jul  1, 2018 22:00:01.905102000 EDT
    [Time shift for this packet: 0.000000000 seconds]
    Epoch Time: 1530496801.905102000 seconds
    [Time delta from previous captured frame: 0.214264000 seconds]
    [Time delta from previous displayed frame: 0.214264000 seconds]
    [Time since reference or first frame: 372.382851000 seconds]
    Frame Number: 56
    Frame Length: 70 bytes (560 bits)
    Capture Length: 70 bytes (560 bits)
    [Frame is marked: False]
    [Frame is ignored: False]
    [Protocols in frame: usb]
USB URB
    [Source: host]
    [Destination: 3.3.1]
    URB id: 0xffff89fd46e3fd80
    URB type: URB_SUBMIT ('S')
    URB transfer type: URB_BULK (0x03)
    Endpoint: 0x01, Direction: OUT
        0... .... = Direction: OUT (0)
        .... 0001 = Endpoint number: 1
    Device: 3
    URB bus id: 3
    Device setup request: not relevant ('-')
    Data: present (0)
    URB sec: 1530496801
    URB usec: 905102
    URB status: Operation now in progress (-EINPROGRESS) (-115)
    URB length [bytes]: 6
    Data length [bytes]: 6
    [bInterfaceClass: Unknown (0xffff)]
    Unused Setup Header
    Interval: 0
    Start frame: 0
    Copy of Transfer Flags: 0x00000000
    Number of ISO descriptors: 0
Leftover Capture Data: 424531909003

0000  80 fd e3 46 fd 89 ff ff 53 03 01 03 03 00 2d 00   ...F....S.....-.
0010  21 87 39 5b 00 00 00 00 8e cf 0d 00 8d ff ff ff   !.9[............
0020  06 00 00 00 06 00 00 00 00 00 00 00 00 00 00 00   ................
0030  00 00 00 00 00 00 00 00 00 00 00 00 00 00 00 00   ................
0040  42 45 31 90 90 03                                 BE1...

Frame 57: 66 bytes on wire (528 bits), 66 bytes captured (528 bits) on interface 0
    Interface id: 0 (unknown)
        Interface name: unknown
    Encapsulation type: USB packets with Linux header and padding (115)
    Arrival Time: Jul  1, 2018 22:00:02.018909000 EDT
    [Time shift for this packet: 0.000000000 seconds]
    Epoch Time: 1530496802.018909000 seconds
    [Time delta from previous captured frame: 0.113807000 seconds]
    [Time delta from previous displayed frame: 0.113807000 seconds]
    [Time since reference or first frame: 372.496658000 seconds]
    Frame Number: 57
    Frame Length: 66 bytes (528 bits)
    Capture Length: 66 bytes (528 bits)
    [Frame is marked: False]
    [Frame is ignored: False]
    [Protocols in frame: usb]
USB URB
    [Source: host]
    [Destination: 3.3.1]
    URB id: 0xffff89fd46e3fd80
    URB type: URB_SUBMIT ('S')
    URB transfer type: URB_BULK (0x03)
    Endpoint: 0x01, Direction: OUT
        0... .... = Direction: OUT (0)
        .... 0001 = Endpoint number: 1
    Device: 3
    URB bus id: 3
    Device setup request: not relevant ('-')
    Data: present (0)
    URB sec: 1530496802
    URB usec: 18909
    URB status: Operation now in progress (-EINPROGRESS) (-115)
    URB length [bytes]: 2
    Data length [bytes]: 2
    [bInterfaceClass: Unknown (0xffff)]
    Unused Setup Header
    Interval: 0
    Start frame: 0
    Copy of Transfer Flags: 0x00000000
    Number of ISO descriptors: 0
Leftover Capture Data: 1b05

0000  80 fd e3 46 fd 89 ff ff 53 03 01 03 03 00 2d 00   ...F....S.....-.
0010  22 87 39 5b 00 00 00 00 dd 49 00 00 8d ff ff ff   ".9[.....I......
0020  02 00 00 00 02 00 00 00 00 00 00 00 00 00 00 00   ................
0030  00 00 00 00 00 00 00 00 00 00 00 00 00 00 00 00   ................
0040  1b 05                                             ..

Frame 58: 66 bytes on wire (528 bits), 66 bytes captured (528 bits) on interface 0
    Interface id: 0 (unknown)
        Interface name: unknown
    Encapsulation type: USB packets with Linux header and padding (115)
    Arrival Time: Jul  1, 2018 22:00:02.159246000 EDT
    [Time shift for this packet: 0.000000000 seconds]
    Epoch Time: 1530496802.159246000 seconds
    [Time delta from previous captured frame: 0.140337000 seconds]
    [Time delta from previous displayed frame: 0.140337000 seconds]
    [Time since reference or first frame: 372.636995000 seconds]
    Frame Number: 58
    Frame Length: 66 bytes (528 bits)
    Capture Length: 66 bytes (528 bits)
    [Frame is marked: False]
    [Frame is ignored: False]
    [Protocols in frame: usb]
USB URB
    [Source: 3.3.2]
    [Destination: host]
    URB id: 0xffff89fc41ab8540
    URB type: URB_COMPLETE ('C')
    URB transfer type: URB_BULK (0x03)
    Endpoint: 0x82, Direction: IN
        1... .... = Direction: IN (1)
        .... 0010 = Endpoint number: 2
    Device: 3
    URB bus id: 3
    Device setup request: not relevant ('-')
    Data: present (0)
    URB sec: 1530496802
    URB usec: 159246
    URB status: Remote I/O error (-EREMOTEIO) (-121)
    URB length [bytes]: 2
    Data length [bytes]: 2
    [bInterfaceClass: Unknown (0xffff)]
    Unused Setup Header
    Interval: 0
    Start frame: 0
    Copy of Transfer Flags: 0x00000201
    Number of ISO descriptors: 0
Leftover Capture Data: 3103

0000  40 85 ab 41 fc 89 ff ff 43 03 82 03 03 00 2d 00   @..A....C.....-.
0010  22 87 39 5b 00 00 00 00 0e 6e 02 00 87 ff ff ff   ".9[.....n......
0020  02 00 00 00 02 00 00 00 00 00 00 00 00 00 00 00   ................
0030  00 00 00 00 00 00 00 00 01 02 00 00 00 00 00 00   ................
0040  31 03                                             1.

Frame 59: 66 bytes on wire (528 bits), 66 bytes captured (528 bits) on interface 0
    Interface id: 0 (unknown)
        Interface name: unknown
    Encapsulation type: USB packets with Linux header and padding (115)
    Arrival Time: Jul  1, 2018 22:00:02.173015000 EDT
    [Time shift for this packet: 0.000000000 seconds]
    Epoch Time: 1530496802.173015000 seconds
    [Time delta from previous captured frame: 0.013769000 seconds]
    [Time delta from previous displayed frame: 0.013769000 seconds]
    [Time since reference or first frame: 372.650764000 seconds]
    Frame Number: 59
    Frame Length: 66 bytes (528 bits)
    Capture Length: 66 bytes (528 bits)
    [Frame is marked: False]
    [Frame is ignored: False]
    [Protocols in frame: usb]
USB URB
    [Source: host]
    [Destination: 3.3.1]
    URB id: 0xffff89fd46e3fd80
    URB type: URB_SUBMIT ('S')
    URB transfer type: URB_BULK (0x03)
    Endpoint: 0x01, Direction: OUT
        0... .... = Direction: OUT (0)
        .... 0001 = Endpoint number: 1
    Device: 3
    URB bus id: 3
    Device setup request: not relevant ('-')
    Data: present (0)
    URB sec: 1530496802
    URB usec: 173015
    URB status: Operation now in progress (-EINPROGRESS) (-115)
    URB length [bytes]: 2
    Data length [bytes]: 2
    [bInterfaceClass: Unknown (0xffff)]
    Unused Setup Header
    Interval: 0
    Start frame: 0
    Copy of Transfer Flags: 0x00000000
    Number of ISO descriptors: 0
Leftover Capture Data: 1b05

0000  80 fd e3 46 fd 89 ff ff 53 03 01 03 03 00 2d 00   ...F....S.....-.
0010  22 87 39 5b 00 00 00 00 d7 a3 02 00 8d ff ff ff   ".9[............
0020  02 00 00 00 02 00 00 00 00 00 00 00 00 00 00 00   ................
0030  00 00 00 00 00 00 00 00 00 00 00 00 00 00 00 00   ................
0040  1b 05                                             ..

Frame 60: 66 bytes on wire (528 bits), 66 bytes captured (528 bits) on interface 0
    Interface id: 0 (unknown)
        Interface name: unknown
    Encapsulation type: USB packets with Linux header and padding (115)
    Arrival Time: Jul  1, 2018 22:00:02.527893000 EDT
    [Time shift for this packet: 0.000000000 seconds]
    Epoch Time: 1530496802.527893000 seconds
    [Time delta from previous captured frame: 0.354878000 seconds]
    [Time delta from previous displayed frame: 0.354878000 seconds]
    [Time since reference or first frame: 373.005642000 seconds]
    Frame Number: 60
    Frame Length: 66 bytes (528 bits)
    Capture Length: 66 bytes (528 bits)
    [Frame is marked: False]
    [Frame is ignored: False]
    [Protocols in frame: usb]
USB URB
    [Source: 3.3.2]
    [Destination: host]
    URB id: 0xffff89fd46e3fd80
    URB type: URB_COMPLETE ('C')
    URB transfer type: URB_BULK (0x03)
    Endpoint: 0x82, Direction: IN
        1... .... = Direction: IN (1)
        .... 0010 = Endpoint number: 2
    Device: 3
    URB bus id: 3
    Device setup request: not relevant ('-')
    Data: present (0)
    URB sec: 1530496802
    URB usec: 527893
    URB status: Remote I/O error (-EREMOTEIO) (-121)
    URB length [bytes]: 2
    Data length [bytes]: 2
    [bInterfaceClass: Unknown (0xffff)]
    Unused Setup Header
    Interval: 0
    Start frame: 0
    Copy of Transfer Flags: 0x00000201
    Number of ISO descriptors: 0
Leftover Capture Data: 3103

0000  80 fd e3 46 fd 89 ff ff 43 03 82 03 03 00 2d 00   ...F....C.....-.
0010  22 87 39 5b 00 00 00 00 15 0e 08 00 87 ff ff ff   ".9[............
0020  02 00 00 00 02 00 00 00 00 00 00 00 00 00 00 00   ................
0030  00 00 00 00 00 00 00 00 01 02 00 00 00 00 00 00   ................
0040  31 03                                             1.

Frame 61: 66 bytes on wire (528 bits), 66 bytes captured (528 bits) on interface 0
    Interface id: 0 (unknown)
        Interface name: unknown
    Encapsulation type: USB packets with Linux header and padding (115)
    Arrival Time: Jul  1, 2018 22:00:02.782214000 EDT
    [Time shift for this packet: 0.000000000 seconds]
    Epoch Time: 1530496802.782214000 seconds
    [Time delta from previous captured frame: 0.254321000 seconds]
    [Time delta from previous displayed frame: 0.254321000 seconds]
    [Time since reference or first frame: 373.259963000 seconds]
    Frame Number: 61
    Frame Length: 66 bytes (528 bits)
    Capture Length: 66 bytes (528 bits)
    [Frame is marked: False]
    [Frame is ignored: False]
    [Protocols in frame: usb]
USB URB
    [Source: host]
    [Destination: 3.3.1]
    URB id: 0xffff89fc41ab8f00
    URB type: URB_SUBMIT ('S')
    URB transfer type: URB_BULK (0x03)
    Endpoint: 0x01, Direction: OUT
        0... .... = Direction: OUT (0)
        .... 0001 = Endpoint number: 1
    Device: 3
    URB bus id: 3
    Device setup request: not relevant ('-')
    Data: present (0)
    URB sec: 1530496802
    URB usec: 782214
    URB status: Operation now in progress (-EINPROGRESS) (-115)
    URB length [bytes]: 2
    Data length [bytes]: 2
    [bInterfaceClass: Unknown (0xffff)]
    Unused Setup Header
    Interval: 0
    Start frame: 0
    Copy of Transfer Flags: 0x00000000
    Number of ISO descriptors: 0
Leftover Capture Data: 1b05

0000  00 8f ab 41 fc 89 ff ff 53 03 01 03 03 00 2d 00   ...A....S.....-.
0010  22 87 39 5b 00 00 00 00 86 ef 0b 00 8d ff ff ff   ".9[............
0020  02 00 00 00 02 00 00 00 00 00 00 00 00 00 00 00   ................
0030  00 00 00 00 00 00 00 00 00 00 00 00 00 00 00 00   ................
0040  1b 05                                             ..

Frame 62: 66 bytes on wire (528 bits), 66 bytes captured (528 bits) on interface 0
    Interface id: 0 (unknown)
        Interface name: unknown
    Encapsulation type: USB packets with Linux header and padding (115)
    Arrival Time: Jul  1, 2018 22:00:02.897224000 EDT
    [Time shift for this packet: 0.000000000 seconds]
    Epoch Time: 1530496802.897224000 seconds
    [Time delta from previous captured frame: 0.115010000 seconds]
    [Time delta from previous displayed frame: 0.115010000 seconds]
    [Time since reference or first frame: 373.374973000 seconds]
    Frame Number: 62
    Frame Length: 66 bytes (528 bits)
    Capture Length: 66 bytes (528 bits)
    [Frame is marked: False]
    [Frame is ignored: False]
    [Protocols in frame: usb]
USB URB
    [Source: 3.3.2]
    [Destination: host]
    URB id: 0xffff89fc41ab8840
    URB type: URB_COMPLETE ('C')
    URB transfer type: URB_BULK (0x03)
    Endpoint: 0x82, Direction: IN
        1... .... = Direction: IN (1)
        .... 0010 = Endpoint number: 2
    Device: 3
    URB bus id: 3
    Device setup request: not relevant ('-')
    Data: present (0)
    URB sec: 1530496802
    URB usec: 897224
    URB status: Remote I/O error (-EREMOTEIO) (-121)
    URB length [bytes]: 2
    Data length [bytes]: 2
    [bInterfaceClass: Unknown (0xffff)]
    Unused Setup Header
    Interval: 0
    Start frame: 0
    Copy of Transfer Flags: 0x00000201
    Number of ISO descriptors: 0
Leftover Capture Data: 3103

0000  40 88 ab 41 fc 89 ff ff 43 03 82 03 03 00 2d 00   @..A....C.....-.
0010  22 87 39 5b 00 00 00 00 c8 b0 0d 00 87 ff ff ff   ".9[............
0020  02 00 00 00 02 00 00 00 00 00 00 00 00 00 00 00   ................
0030  00 00 00 00 00 00 00 00 01 02 00 00 00 00 00 00   ................
0040  31 03                                             1.

Frame 63: 66 bytes on wire (528 bits), 66 bytes captured (528 bits) on interface 0
    Interface id: 0 (unknown)
        Interface name: unknown
    Encapsulation type: USB packets with Linux header and padding (115)
    Arrival Time: Jul  1, 2018 22:00:03.311234000 EDT
    [Time shift for this packet: 0.000000000 seconds]
    Epoch Time: 1530496803.311234000 seconds
    [Time delta from previous captured frame: 0.414010000 seconds]
    [Time delta from previous displayed frame: 0.414010000 seconds]
    [Time since reference or first frame: 373.788983000 seconds]
    Frame Number: 63
    Frame Length: 66 bytes (528 bits)
    Capture Length: 66 bytes (528 bits)
    [Frame is marked: False]
    [Frame is ignored: False]
    [Protocols in frame: usb]
USB URB
    [Source: host]
    [Destination: 3.3.1]
    URB id: 0xffff89fc41ab8f00
    URB type: URB_SUBMIT ('S')
    URB transfer type: URB_BULK (0x03)
    Endpoint: 0x01, Direction: OUT
        0... .... = Direction: OUT (0)
        .... 0001 = Endpoint number: 1
    Device: 3
    URB bus id: 3
    Device setup request: not relevant ('-')
    Data: present (0)
    URB sec: 1530496803
    URB usec: 311234
    URB status: Operation now in progress (-EINPROGRESS) (-115)
    URB length [bytes]: 2
    Data length [bytes]: 2
    [bInterfaceClass: Unknown (0xffff)]
    Unused Setup Header
    Interval: 0
    Start frame: 0
    Copy of Transfer Flags: 0x00000000
    Number of ISO descriptors: 0
Leftover Capture Data: 1b05

0000  00 8f ab 41 fc 89 ff ff 53 03 01 03 03 00 2d 00   ...A....S.....-.
0010  23 87 39 5b 00 00 00 00 c2 bf 04 00 8d ff ff ff   #.9[............
0020  02 00 00 00 02 00 00 00 00 00 00 00 00 00 00 00   ................
0030  00 00 00 00 00 00 00 00 00 00 00 00 00 00 00 00   ................
0040  1b 05                                             ..

Frame 64: 66 bytes on wire (528 bits), 66 bytes captured (528 bits) on interface 0
    Interface id: 0 (unknown)
        Interface name: unknown
    Encapsulation type: USB packets with Linux header and padding (115)
    Arrival Time: Jul  1, 2018 22:00:03.471224000 EDT
    [Time shift for this packet: 0.000000000 seconds]
    Epoch Time: 1530496803.471224000 seconds
    [Time delta from previous captured frame: 0.159990000 seconds]
    [Time delta from previous displayed frame: 0.159990000 seconds]
    [Time since reference or first frame: 373.948973000 seconds]
    Frame Number: 64
    Frame Length: 66 bytes (528 bits)
    Capture Length: 66 bytes (528 bits)
    [Frame is marked: False]
    [Frame is ignored: False]
    [Protocols in frame: usb]
USB URB
    [Source: 3.3.2]
    [Destination: host]
    URB id: 0xffff89fd46e3fd80
    URB type: URB_COMPLETE ('C')
    URB transfer type: URB_BULK (0x03)
    Endpoint: 0x82, Direction: IN
        1... .... = Direction: IN (1)
        .... 0010 = Endpoint number: 2
    Device: 3
    URB bus id: 3
    Device setup request: not relevant ('-')
    Data: present (0)
    URB sec: 1530496803
    URB usec: 471224
    URB status: Remote I/O error (-EREMOTEIO) (-121)
    URB length [bytes]: 2
    Data length [bytes]: 2
    [bInterfaceClass: Unknown (0xffff)]
    Unused Setup Header
    Interval: 0
    Start frame: 0
    Copy of Transfer Flags: 0x00000201
    Number of ISO descriptors: 0
Leftover Capture Data: 3103

0000  80 fd e3 46 fd 89 ff ff 43 03 82 03 03 00 2d 00   ...F....C.....-.
0010  23 87 39 5b 00 00 00 00 b8 30 07 00 87 ff ff ff   #.9[.....0......
0020  02 00 00 00 02 00 00 00 00 00 00 00 00 00 00 00   ................
0030  00 00 00 00 00 00 00 00 01 02 00 00 00 00 00 00   ................
0040  31 03                                             1.

Frame 65: 66 bytes on wire (528 bits), 66 bytes captured (528 bits) on interface 0
    Interface id: 0 (unknown)
        Interface name: unknown
    Encapsulation type: USB packets with Linux header and padding (115)
    Arrival Time: Jul  1, 2018 22:00:03.739665000 EDT
    [Time shift for this packet: 0.000000000 seconds]
    Epoch Time: 1530496803.739665000 seconds
    [Time delta from previous captured frame: 0.268441000 seconds]
    [Time delta from previous displayed frame: 0.268441000 seconds]
    [Time since reference or first frame: 374.217414000 seconds]
    Frame Number: 65
    Frame Length: 66 bytes (528 bits)
    Capture Length: 66 bytes (528 bits)
    [Frame is marked: False]
    [Frame is ignored: False]
    [Protocols in frame: usb]
USB URB
    [Source: host]
    [Destination: 3.3.1]
    URB id: 0xffff89fd46e3f900
    URB type: URB_SUBMIT ('S')
    URB transfer type: URB_BULK (0x03)
    Endpoint: 0x01, Direction: OUT
        0... .... = Direction: OUT (0)
        .... 0001 = Endpoint number: 1
    Device: 3
    URB bus id: 3
    Device setup request: not relevant ('-')
    Data: present (0)
    URB sec: 1530496803
    URB usec: 739665
    URB status: Operation now in progress (-EINPROGRESS) (-115)
    URB length [bytes]: 2
    Data length [bytes]: 2
    [bInterfaceClass: Unknown (0xffff)]
    Unused Setup Header
    Interval: 0
    Start frame: 0
    Copy of Transfer Flags: 0x00000000
    Number of ISO descriptors: 0
Leftover Capture Data: 1b05

0000  00 f9 e3 46 fd 89 ff ff 53 03 01 03 03 00 2d 00   ...F....S.....-.
0010  23 87 39 5b 00 00 00 00 51 49 0b 00 8d ff ff ff   #.9[....QI......
0020  02 00 00 00 02 00 00 00 00 00 00 00 00 00 00 00   ................
0030  00 00 00 00 00 00 00 00 00 00 00 00 00 00 00 00   ................
0040  1b 05                                             ..

Frame 66: 66 bytes on wire (528 bits), 66 bytes captured (528 bits) on interface 0
    Interface id: 0 (unknown)
        Interface name: unknown
    Encapsulation type: USB packets with Linux header and padding (115)
    Arrival Time: Jul  1, 2018 22:00:03.881256000 EDT
    [Time shift for this packet: 0.000000000 seconds]
    Epoch Time: 1530496803.881256000 seconds
    [Time delta from previous captured frame: 0.141591000 seconds]
    [Time delta from previous displayed frame: 0.141591000 seconds]
    [Time since reference or first frame: 374.359005000 seconds]
    Frame Number: 66
    Frame Length: 66 bytes (528 bits)
    Capture Length: 66 bytes (528 bits)
    [Frame is marked: False]
    [Frame is ignored: False]
    [Protocols in frame: usb]
USB URB
    [Source: 3.3.2]
    [Destination: host]
    URB id: 0xffff89fd46e3fd80
    URB type: URB_COMPLETE ('C')
    URB transfer type: URB_BULK (0x03)
    Endpoint: 0x82, Direction: IN
        1... .... = Direction: IN (1)
        .... 0010 = Endpoint number: 2
    Device: 3
    URB bus id: 3
    Device setup request: not relevant ('-')
    Data: present (0)
    URB sec: 1530496803
    URB usec: 881256
    URB status: Remote I/O error (-EREMOTEIO) (-121)
    URB length [bytes]: 2
    Data length [bytes]: 2
    [bInterfaceClass: Unknown (0xffff)]
    Unused Setup Header
    Interval: 0
    Start frame: 0
    Copy of Transfer Flags: 0x00000201
    Number of ISO descriptors: 0
Leftover Capture Data: 3103

0000  80 fd e3 46 fd 89 ff ff 43 03 82 03 03 00 2d 00   ...F....C.....-.
0010  23 87 39 5b 00 00 00 00 68 72 0d 00 87 ff ff ff   #.9[....hr......
0020  02 00 00 00 02 00 00 00 00 00 00 00 00 00 00 00   ................
0030  00 00 00 00 00 00 00 00 01 02 00 00 00 00 00 00   ................
0040  31 03                                             1.

Frame 67: 66 bytes on wire (528 bits), 66 bytes captured (528 bits) on interface 0
    Interface id: 0 (unknown)
        Interface name: unknown
    Encapsulation type: USB packets with Linux header and padding (115)
    Arrival Time: Jul  1, 2018 22:00:04.268630000 EDT
    [Time shift for this packet: 0.000000000 seconds]
    Epoch Time: 1530496804.268630000 seconds
    [Time delta from previous captured frame: 0.387374000 seconds]
    [Time delta from previous displayed frame: 0.387374000 seconds]
    [Time since reference or first frame: 374.746379000 seconds]
    Frame Number: 67
    Frame Length: 66 bytes (528 bits)
    Capture Length: 66 bytes (528 bits)
    [Frame is marked: False]
    [Frame is ignored: False]
    [Protocols in frame: usb]
USB URB
    [Source: host]
    [Destination: 3.3.1]
    URB id: 0xffff89fd46e3fd80
    URB type: URB_SUBMIT ('S')
    URB transfer type: URB_BULK (0x03)
    Endpoint: 0x01, Direction: OUT
        0... .... = Direction: OUT (0)
        .... 0001 = Endpoint number: 1
    Device: 3
    URB bus id: 3
    Device setup request: not relevant ('-')
    Data: present (0)
    URB sec: 1530496804
    URB usec: 268630
    URB status: Operation now in progress (-EINPROGRESS) (-115)
    URB length [bytes]: 2
    Data length [bytes]: 2
    [bInterfaceClass: Unknown (0xffff)]
    Unused Setup Header
    Interval: 0
    Start frame: 0
    Copy of Transfer Flags: 0x00000000
    Number of ISO descriptors: 0
Leftover Capture Data: 1b05

0000  80 fd e3 46 fd 89 ff ff 53 03 01 03 03 00 2d 00   ...F....S.....-.
0010  24 87 39 5b 00 00 00 00 56 19 04 00 8d ff ff ff   $.9[....V.......
0020  02 00 00 00 02 00 00 00 00 00 00 00 00 00 00 00   ................
0030  00 00 00 00 00 00 00 00 00 00 00 00 00 00 00 00   ................
0040  1b 05                                             ..

Frame 68: 66 bytes on wire (528 bits), 66 bytes captured (528 bits) on interface 0
    Interface id: 0 (unknown)
        Interface name: unknown
    Encapsulation type: USB packets with Linux header and padding (115)
    Arrival Time: Jul  1, 2018 22:00:04.373247000 EDT
    [Time shift for this packet: 0.000000000 seconds]
    Epoch Time: 1530496804.373247000 seconds
    [Time delta from previous captured frame: 0.104617000 seconds]
    [Time delta from previous displayed frame: 0.104617000 seconds]
    [Time since reference or first frame: 374.850996000 seconds]
    Frame Number: 68
    Frame Length: 66 bytes (528 bits)
    Capture Length: 66 bytes (528 bits)
    [Frame is marked: False]
    [Frame is ignored: False]
    [Protocols in frame: usb]
USB URB
    [Source: 3.3.2]
    [Destination: host]
    URB id: 0xffff89fc41ab8e40
    URB type: URB_COMPLETE ('C')
    URB transfer type: URB_BULK (0x03)
    Endpoint: 0x82, Direction: IN
        1... .... = Direction: IN (1)
        .... 0010 = Endpoint number: 2
    Device: 3
    URB bus id: 3
    Device setup request: not relevant ('-')
    Data: present (0)
    URB sec: 1530496804
    URB usec: 373247
    URB status: Remote I/O error (-EREMOTEIO) (-121)
    URB length [bytes]: 2
    Data length [bytes]: 2
    [bInterfaceClass: Unknown (0xffff)]
    Unused Setup Header
    Interval: 0
    Start frame: 0
    Copy of Transfer Flags: 0x00000201
    Number of ISO descriptors: 0
Leftover Capture Data: 3103

0000  40 8e ab 41 fc 89 ff ff 43 03 82 03 03 00 2d 00   @..A....C.....-.
0010  24 87 39 5b 00 00 00 00 ff b1 05 00 87 ff ff ff   $.9[............
0020  02 00 00 00 02 00 00 00 00 00 00 00 00 00 00 00   ................
0030  00 00 00 00 00 00 00 00 01 02 00 00 00 00 00 00   ................
0040  31 03                                             1.

Frame 69: 66 bytes on wire (528 bits), 66 bytes captured (528 bits) on interface 0
    Interface id: 0 (unknown)
        Interface name: unknown
    Encapsulation type: USB packets with Linux header and padding (115)
    Arrival Time: Jul  1, 2018 22:00:04.777626000 EDT
    [Time shift for this packet: 0.000000000 seconds]
    Epoch Time: 1530496804.777626000 seconds
    [Time delta from previous captured frame: 0.404379000 seconds]
    [Time delta from previous displayed frame: 0.404379000 seconds]
    [Time since reference or first frame: 375.255375000 seconds]
    Frame Number: 69
    Frame Length: 66 bytes (528 bits)
    Capture Length: 66 bytes (528 bits)
    [Frame is marked: False]
    [Frame is ignored: False]
    [Protocols in frame: usb]
USB URB
    [Source: host]
    [Destination: 3.3.1]
    URB id: 0xffff89fd4d50de40
    URB type: URB_SUBMIT ('S')
    URB transfer type: URB_BULK (0x03)
    Endpoint: 0x01, Direction: OUT
        0... .... = Direction: OUT (0)
        .... 0001 = Endpoint number: 1
    Device: 3
    URB bus id: 3
    Device setup request: not relevant ('-')
    Data: present (0)
    URB sec: 1530496804
    URB usec: 777626
    URB status: Operation now in progress (-EINPROGRESS) (-115)
    URB length [bytes]: 2
    Data length [bytes]: 2
    [bInterfaceClass: Unknown (0xffff)]
    Unused Setup Header
    Interval: 0
    Start frame: 0
    Copy of Transfer Flags: 0x00000000
    Number of ISO descriptors: 0
Leftover Capture Data: 1b05

0000  40 de 50 4d fd 89 ff ff 53 03 01 03 03 00 2d 00   @.PM....S.....-.
0010  24 87 39 5b 00 00 00 00 9a dd 0b 00 8d ff ff ff   $.9[............
0020  02 00 00 00 02 00 00 00 00 00 00 00 00 00 00 00   ................
0030  00 00 00 00 00 00 00 00 00 00 00 00 00 00 00 00   ................
0040  1b 05                                             ..

Frame 70: 66 bytes on wire (528 bits), 66 bytes captured (528 bits) on interface 0
    Interface id: 0 (unknown)
        Interface name: unknown
    Encapsulation type: USB packets with Linux header and padding (115)
    Arrival Time: Jul  1, 2018 22:00:04.865242000 EDT
    [Time shift for this packet: 0.000000000 seconds]
    Epoch Time: 1530496804.865242000 seconds
    [Time delta from previous captured frame: 0.087616000 seconds]
    [Time delta from previous displayed frame: 0.087616000 seconds]
    [Time since reference or first frame: 375.342991000 seconds]
    Frame Number: 70
    Frame Length: 66 bytes (528 bits)
    Capture Length: 66 bytes (528 bits)
    [Frame is marked: False]
    [Frame is ignored: False]
    [Protocols in frame: usb]
USB URB
    [Source: 3.3.2]
    [Destination: host]
    URB id: 0xffff89fd46e3fd80
    URB type: URB_COMPLETE ('C')
    URB transfer type: URB_BULK (0x03)
    Endpoint: 0x82, Direction: IN
        1... .... = Direction: IN (1)
        .... 0010 = Endpoint number: 2
    Device: 3
    URB bus id: 3
    Device setup request: not relevant ('-')
    Data: present (0)
    URB sec: 1530496804
    URB usec: 865242
    URB status: Remote I/O error (-EREMOTEIO) (-121)
    URB length [bytes]: 2
    Data length [bytes]: 2
    [bInterfaceClass: Unknown (0xffff)]
    Unused Setup Header
    Interval: 0
    Start frame: 0
    Copy of Transfer Flags: 0x00000201
    Number of ISO descriptors: 0
Leftover Capture Data: 3103

0000  80 fd e3 46 fd 89 ff ff 43 03 82 03 03 00 2d 00   ...F....C.....-.
0010  24 87 39 5b 00 00 00 00 da 33 0d 00 87 ff ff ff   $.9[.....3......
0020  02 00 00 00 02 00 00 00 00 00 00 00 00 00 00 00   ................
0030  00 00 00 00 00 00 00 00 01 02 00 00 00 00 00 00   ................
0040  31 03                                             1.

Frame 71: 66 bytes on wire (528 bits), 66 bytes captured (528 bits) on interface 0
    Interface id: 0 (unknown)
        Interface name: unknown
    Encapsulation type: USB packets with Linux header and padding (115)
    Arrival Time: Jul  1, 2018 22:00:05.386988000 EDT
    [Time shift for this packet: 0.000000000 seconds]
    Epoch Time: 1530496805.386988000 seconds
    [Time delta from previous captured frame: 0.521746000 seconds]
    [Time delta from previous displayed frame: 0.521746000 seconds]
    [Time since reference or first frame: 375.864737000 seconds]
    Frame Number: 71
    Frame Length: 66 bytes (528 bits)
    Capture Length: 66 bytes (528 bits)
    [Frame is marked: False]
    [Frame is ignored: False]
    [Protocols in frame: usb]
USB URB
    [Source: host]
    [Destination: 3.3.1]
    URB id: 0xffff89fd4d50de40
    URB type: URB_SUBMIT ('S')
    URB transfer type: URB_BULK (0x03)
    Endpoint: 0x01, Direction: OUT
        0... .... = Direction: OUT (0)
        .... 0001 = Endpoint number: 1
    Device: 3
    URB bus id: 3
    Device setup request: not relevant ('-')
    Data: present (0)
    URB sec: 1530496805
    URB usec: 386988
    URB status: Operation now in progress (-EINPROGRESS) (-115)
    URB length [bytes]: 2
    Data length [bytes]: 2
    [bInterfaceClass: Unknown (0xffff)]
    Unused Setup Header
    Interval: 0
    Start frame: 0
    Copy of Transfer Flags: 0x00000000
    Number of ISO descriptors: 0
Leftover Capture Data: 1b05

0000  40 de 50 4d fd 89 ff ff 53 03 01 03 03 00 2d 00   @.PM....S.....-.
0010  25 87 39 5b 00 00 00 00 ac e7 05 00 8d ff ff ff   %.9[............
0020  02 00 00 00 02 00 00 00 00 00 00 00 00 00 00 00   ................
0030  00 00 00 00 00 00 00 00 00 00 00 00 00 00 00 00   ................
0040  1b 05                                             ..

Frame 72: 66 bytes on wire (528 bits), 66 bytes captured (528 bits) on interface 0
    Interface id: 0 (unknown)
        Interface name: unknown
    Encapsulation type: USB packets with Linux header and padding (115)
    Arrival Time: Jul  1, 2018 22:00:05.521195000 EDT
    [Time shift for this packet: 0.000000000 seconds]
    Epoch Time: 1530496805.521195000 seconds
    [Time delta from previous captured frame: 0.134207000 seconds]
    [Time delta from previous displayed frame: 0.134207000 seconds]
    [Time since reference or first frame: 375.998944000 seconds]
    Frame Number: 72
    Frame Length: 66 bytes (528 bits)
    Capture Length: 66 bytes (528 bits)
    [Frame is marked: False]
    [Frame is ignored: False]
    [Protocols in frame: usb]
USB URB
    [Source: 3.3.2]
    [Destination: host]
    URB id: 0xffff89fd46e3f900
    URB type: URB_COMPLETE ('C')
    URB transfer type: URB_BULK (0x03)
    Endpoint: 0x82, Direction: IN
        1... .... = Direction: IN (1)
        .... 0010 = Endpoint number: 2
    Device: 3
    URB bus id: 3
    Device setup request: not relevant ('-')
    Data: present (0)
    URB sec: 1530496805
    URB usec: 521195
    URB status: Remote I/O error (-EREMOTEIO) (-121)
    URB length [bytes]: 2
    Data length [bytes]: 2
    [bInterfaceClass: Unknown (0xffff)]
    Unused Setup Header
    Interval: 0
    Start frame: 0
    Copy of Transfer Flags: 0x00000201
    Number of ISO descriptors: 0
Leftover Capture Data: 3003

0000  00 f9 e3 46 fd 89 ff ff 43 03 82 03 03 00 2d 00   ...F....C.....-.
0010  25 87 39 5b 00 00 00 00 eb f3 07 00 87 ff ff ff   %.9[............
0020  02 00 00 00 02 00 00 00 00 00 00 00 00 00 00 00   ................
0030  00 00 00 00 00 00 00 00 01 02 00 00 00 00 00 00   ................
0040  30 03                                             0.

Frame 73: 66 bytes on wire (528 bits), 66 bytes captured (528 bits) on interface 0
    Interface id: 0 (unknown)
        Interface name: unknown
    Encapsulation type: USB packets with Linux header and padding (115)
    Arrival Time: Jul  1, 2018 22:00:05.862298000 EDT
    [Time shift for this packet: 0.000000000 seconds]
    Epoch Time: 1530496805.862298000 seconds
    [Time delta from previous captured frame: 0.341103000 seconds]
    [Time delta from previous displayed frame: 0.341103000 seconds]
    [Time since reference or first frame: 376.340047000 seconds]
    Frame Number: 73
    Frame Length: 66 bytes (528 bits)
    Capture Length: 66 bytes (528 bits)
    [Frame is marked: False]
    [Frame is ignored: False]
    [Protocols in frame: usb]
USB URB
    [Source: host]
    [Destination: 3.3.1]
    URB id: 0xffff89fc41ab8780
    URB type: URB_SUBMIT ('S')
    URB transfer type: URB_BULK (0x03)
    Endpoint: 0x01, Direction: OUT
        0... .... = Direction: OUT (0)
        .... 0001 = Endpoint number: 1
    Device: 3
    URB bus id: 3
    Device setup request: not relevant ('-')
    Data: present (0)
    URB sec: 1530496805
    URB usec: 862298
    URB status: Operation now in progress (-EINPROGRESS) (-115)
    URB length [bytes]: 2
    Data length [bytes]: 2
    [bInterfaceClass: Unknown (0xffff)]
    Unused Setup Header
    Interval: 0
    Start frame: 0
    Copy of Transfer Flags: 0x00000000
    Number of ISO descriptors: 0
Leftover Capture Data: 1b05

0000  80 87 ab 41 fc 89 ff ff 53 03 01 03 03 00 2d 00   ...A....S.....-.
0010  25 87 39 5b 00 00 00 00 5a 28 0d 00 8d ff ff ff   %.9[....Z(......
0020  02 00 00 00 02 00 00 00 00 00 00 00 00 00 00 00   ................
0030  00 00 00 00 00 00 00 00 00 00 00 00 00 00 00 00   ................
0040  1b 05                                             ..

Frame 74: 66 bytes on wire (528 bits), 66 bytes captured (528 bits) on interface 0
    Interface id: 0 (unknown)
        Interface name: unknown
    Encapsulation type: USB packets with Linux header and padding (115)
    Arrival Time: Jul  1, 2018 22:00:06.013207000 EDT
    [Time shift for this packet: 0.000000000 seconds]
    Epoch Time: 1530496806.013207000 seconds
    [Time delta from previous captured frame: 0.150909000 seconds]
    [Time delta from previous displayed frame: 0.150909000 seconds]
    [Time since reference or first frame: 376.490956000 seconds]
    Frame Number: 74
    Frame Length: 66 bytes (528 bits)
    Capture Length: 66 bytes (528 bits)
    [Frame is marked: False]
    [Frame is ignored: False]
    [Protocols in frame: usb]
USB URB
    [Source: 3.3.2]
    [Destination: host]
    URB id: 0xffff89fc41ab8a80
    URB type: URB_COMPLETE ('C')
    URB transfer type: URB_BULK (0x03)
    Endpoint: 0x82, Direction: IN
        1... .... = Direction: IN (1)
        .... 0010 = Endpoint number: 2
    Device: 3
    URB bus id: 3
    Device setup request: not relevant ('-')
    Data: present (0)
    URB sec: 1530496806
    URB usec: 13207
    URB status: Remote I/O error (-EREMOTEIO) (-121)
    URB length [bytes]: 2
    Data length [bytes]: 2
    [bInterfaceClass: Unknown (0xffff)]
    Unused Setup Header
    Interval: 0
    Start frame: 0
    Copy of Transfer Flags: 0x00000201
    Number of ISO descriptors: 0
Leftover Capture Data: 3003

0000  80 8a ab 41 fc 89 ff ff 43 03 82 03 03 00 2d 00   ...A....C.....-.
0010  26 87 39 5b 00 00 00 00 97 33 00 00 87 ff ff ff   &.9[.....3......
0020  02 00 00 00 02 00 00 00 00 00 00 00 00 00 00 00   ................
0030  00 00 00 00 00 00 00 00 01 02 00 00 00 00 00 00   ................
0040  30 03                                             0.

Frame 75: 66 bytes on wire (528 bits), 66 bytes captured (528 bits) on interface 0
    Interface id: 0 (unknown)
        Interface name: unknown
    Encapsulation type: USB packets with Linux header and padding (115)
    Arrival Time: Jul  1, 2018 22:00:06.377530000 EDT
    [Time shift for this packet: 0.000000000 seconds]
    Epoch Time: 1530496806.377530000 seconds
    [Time delta from previous captured frame: 0.364323000 seconds]
    [Time delta from previous displayed frame: 0.364323000 seconds]
    [Time since reference or first frame: 376.855279000 seconds]
    Frame Number: 75
    Frame Length: 66 bytes (528 bits)
    Capture Length: 66 bytes (528 bits)
    [Frame is marked: False]
    [Frame is ignored: False]
    [Protocols in frame: usb]
USB URB
    [Source: host]
    [Destination: 3.3.1]
    URB id: 0xffff89fc41ab8300
    URB type: URB_SUBMIT ('S')
    URB transfer type: URB_BULK (0x03)
    Endpoint: 0x01, Direction: OUT
        0... .... = Direction: OUT (0)
        .... 0001 = Endpoint number: 1
    Device: 3
    URB bus id: 3
    Device setup request: not relevant ('-')
    Data: present (0)
    URB sec: 1530496806
    URB usec: 377530
    URB status: Operation now in progress (-EINPROGRESS) (-115)
    URB length [bytes]: 2
    Data length [bytes]: 2
    [bInterfaceClass: Unknown (0xffff)]
    Unused Setup Header
    Interval: 0
    Start frame: 0
    Copy of Transfer Flags: 0x00000000
    Number of ISO descriptors: 0
Leftover Capture Data: 1b05

0000  00 83 ab 41 fc 89 ff ff 53 03 01 03 03 00 2d 00   ...A....S.....-.
0010  26 87 39 5b 00 00 00 00 ba c2 05 00 8d ff ff ff   &.9[............
0020  02 00 00 00 02 00 00 00 00 00 00 00 00 00 00 00   ................
0030  00 00 00 00 00 00 00 00 00 00 00 00 00 00 00 00   ................
0040  1b 05                                             ..

Frame 76: 66 bytes on wire (528 bits), 66 bytes captured (528 bits) on interface 0
    Interface id: 0 (unknown)
        Interface name: unknown
    Encapsulation type: USB packets with Linux header and padding (115)
    Arrival Time: Jul  1, 2018 22:00:06.505204000 EDT
    [Time shift for this packet: 0.000000000 seconds]
    Epoch Time: 1530496806.505204000 seconds
    [Time delta from previous captured frame: 0.127674000 seconds]
    [Time delta from previous displayed frame: 0.127674000 seconds]
    [Time since reference or first frame: 376.982953000 seconds]
    Frame Number: 76
    Frame Length: 66 bytes (528 bits)
    Capture Length: 66 bytes (528 bits)
    [Frame is marked: False]
    [Frame is ignored: False]
    [Protocols in frame: usb]
USB URB
    [Source: 3.3.2]
    [Destination: host]
    URB id: 0xffff89fc41ab8180
    URB type: URB_COMPLETE ('C')
    URB transfer type: URB_BULK (0x03)
    Endpoint: 0x82, Direction: IN
        1... .... = Direction: IN (1)
        .... 0010 = Endpoint number: 2
    Device: 3
    URB bus id: 3
    Device setup request: not relevant ('-')
    Data: present (0)
    URB sec: 1530496806
    URB usec: 505204
    URB status: Remote I/O error (-EREMOTEIO) (-121)
    URB length [bytes]: 2
    Data length [bytes]: 2
    [bInterfaceClass: Unknown (0xffff)]
    Unused Setup Header
    Interval: 0
    Start frame: 0
    Copy of Transfer Flags: 0x00000201
    Number of ISO descriptors: 0
Leftover Capture Data: 3003

0000  80 81 ab 41 fc 89 ff ff 43 03 82 03 03 00 2d 00   ...A....C.....-.
0010  26 87 39 5b 00 00 00 00 74 b5 07 00 87 ff ff ff   &.9[....t.......
0020  02 00 00 00 02 00 00 00 00 00 00 00 00 00 00 00   ................
0030  00 00 00 00 00 00 00 00 01 02 00 00 00 00 00 00   ................
0040  30 03                                             0.

Frame 77: 70 bytes on wire (560 bits), 70 bytes captured (560 bits) on interface 0
    Interface id: 0 (unknown)
        Interface name: unknown
    Encapsulation type: USB packets with Linux header and padding (115)
    Arrival Time: Jul  1, 2018 22:00:06.832704000 EDT
    [Time shift for this packet: 0.000000000 seconds]
    Epoch Time: 1530496806.832704000 seconds
    [Time delta from previous captured frame: 0.327500000 seconds]
    [Time delta from previous displayed frame: 0.327500000 seconds]
    [Time since reference or first frame: 377.310453000 seconds]
    Frame Number: 77
    Frame Length: 70 bytes (560 bits)
    Capture Length: 70 bytes (560 bits)
    [Frame is marked: False]
    [Frame is ignored: False]
    [Protocols in frame: usb]
USB URB
    [Source: host]
    [Destination: 3.3.1]
    URB id: 0xffff89fd46e3f900
    URB type: URB_SUBMIT ('S')
    URB transfer type: URB_BULK (0x03)
    Endpoint: 0x01, Direction: OUT
        0... .... = Direction: OUT (0)
        .... 0001 = Endpoint number: 1
    Device: 3
    URB bus id: 3
    Device setup request: not relevant ('-')
    Data: present (0)
    URB sec: 1530496806
    URB usec: 832704
    URB status: Operation now in progress (-EINPROGRESS) (-115)
    URB length [bytes]: 6
    Data length [bytes]: 6
    [bInterfaceClass: Unknown (0xffff)]
    Unused Setup Header
    Interval: 0
    Start frame: 0
    Copy of Transfer Flags: 0x00000000
    Number of ISO descriptors: 0
Leftover Capture Data: 4c30034a3203

0000  00 f9 e3 46 fd 89 ff ff 53 03 01 03 03 00 2d 00   ...F....S.....-.
0010  26 87 39 5b 00 00 00 00 c0 b4 0c 00 8d ff ff ff   &.9[............
0020  06 00 00 00 06 00 00 00 00 00 00 00 00 00 00 00   ................
0030  00 00 00 00 00 00 00 00 00 00 00 00 00 00 00 00   ................
0040  4c 30 03 4a 32 03                                 L0.J2.

Frame 78: 99 bytes on wire (792 bits), 99 bytes captured (792 bits) on interface 0
    Interface id: 0 (unknown)
        Interface name: unknown
    Encapsulation type: USB packets with Linux header and padding (115)
    Arrival Time: Jul  1, 2018 22:00:07.060296000 EDT
    [Time shift for this packet: 0.000000000 seconds]
    Epoch Time: 1530496807.060296000 seconds
    [Time delta from previous captured frame: 0.227592000 seconds]
    [Time delta from previous displayed frame: 0.227592000 seconds]
    [Time since reference or first frame: 377.538045000 seconds]
    Frame Number: 78
    Frame Length: 99 bytes (792 bits)
    Capture Length: 99 bytes (792 bits)
    [Frame is marked: False]
    [Frame is ignored: False]
    [Protocols in frame: usb]
USB URB
    [Source: host]
    [Destination: 3.3.1]
    URB id: 0xffff89fd4d50dcc0
    URB type: URB_SUBMIT ('S')
    URB transfer type: URB_BULK (0x03)
    Endpoint: 0x01, Direction: OUT
        0... .... = Direction: OUT (0)
        .... 0001 = Endpoint number: 1
    Device: 3
    URB bus id: 3
    Device setup request: not relevant ('-')
    Data: present (0)
    URB sec: 1530496807
    URB usec: 60296
    URB status: Operation now in progress (-EINPROGRESS) (-115)
    URB length [bytes]: 35
    Data length [bytes]: 35
    [bInterfaceClass: Unknown (0xffff)]
    Unused Setup Header
    Interval: 0
    Start frame: 0
    Copy of Transfer Flags: 0x00000000
    Number of ISO descriptors: 0
Leftover Capture Data: 2131302c3203465831382c32034643302c312c3203464530...

0000  c0 dc 50 4d fd 89 ff ff 53 03 01 03 03 00 2d 00   ..PM....S.....-.
0010  27 87 39 5b 00 00 00 00 88 eb 00 00 8d ff ff ff   '.9[............
0020  23 00 00 00 23 00 00 00 00 00 00 00 00 00 00 00   #...#...........
0030  00 00 00 00 00 00 00 00 00 00 00 00 00 00 00 00   ................
0040  21 31 30 2c 32 03 46 58 31 38 2c 32 03 46 43 30   !10,2.FX18,2.FC0
0050  2c 31 2c 32 03 46 45 30 2c 32 03 46 46 30 2c 30   ,1,2.FE0,2.FF0,0
0060  2c 32 03                                          ,2.

Frame 79: 66 bytes on wire (528 bits), 66 bytes captured (528 bits) on interface 0
    Interface id: 0 (unknown)
        Interface name: unknown
    Encapsulation type: USB packets with Linux header and padding (115)
    Arrival Time: Jul  1, 2018 22:00:07.234387000 EDT
    [Time shift for this packet: 0.000000000 seconds]
    Epoch Time: 1530496807.234387000 seconds
    [Time delta from previous captured frame: 0.174091000 seconds]
    [Time delta from previous displayed frame: 0.174091000 seconds]
    [Time since reference or first frame: 377.712136000 seconds]
    Frame Number: 79
    Frame Length: 66 bytes (528 bits)
    Capture Length: 66 bytes (528 bits)
    [Frame is marked: False]
    [Frame is ignored: False]
    [Protocols in frame: usb]
USB URB
    [Source: host]
    [Destination: 3.3.1]
    URB id: 0xffff89fd4d50d6c0
    URB type: URB_SUBMIT ('S')
    URB transfer type: URB_BULK (0x03)
    Endpoint: 0x01, Direction: OUT
        0... .... = Direction: OUT (0)
        .... 0001 = Endpoint number: 1
    Device: 3
    URB bus id: 3
    Device setup request: not relevant ('-')
    Data: present (0)
    URB sec: 1530496807
    URB usec: 234387
    URB status: Operation now in progress (-EINPROGRESS) (-115)
    URB length [bytes]: 2
    Data length [bytes]: 2
    [bInterfaceClass: Unknown (0xffff)]
    Unused Setup Header
    Interval: 0
    Start frame: 0
    Copy of Transfer Flags: 0x00000000
    Number of ISO descriptors: 0
Leftover Capture Data: 1b05

0000  c0 d6 50 4d fd 89 ff ff 53 03 01 03 03 00 2d 00   ..PM....S.....-.
0010  27 87 39 5b 00 00 00 00 93 93 03 00 8d ff ff ff   '.9[............
0020  02 00 00 00 02 00 00 00 00 00 00 00 00 00 00 00   ................
0030  00 00 00 00 00 00 00 00 00 00 00 00 00 00 00 00   ................
0040  1b 05                                             ..

Frame 80: 66 bytes on wire (528 bits), 66 bytes captured (528 bits) on interface 0
    Interface id: 0 (unknown)
        Interface name: unknown
    Encapsulation type: USB packets with Linux header and padding (115)
    Arrival Time: Jul  1, 2018 22:00:07.325262000 EDT
    [Time shift for this packet: 0.000000000 seconds]
    Epoch Time: 1530496807.325262000 seconds
    [Time delta from previous captured frame: 0.090875000 seconds]
    [Time delta from previous displayed frame: 0.090875000 seconds]
    [Time since reference or first frame: 377.803011000 seconds]
    Frame Number: 80
    Frame Length: 66 bytes (528 bits)
    Capture Length: 66 bytes (528 bits)
    [Frame is marked: False]
    [Frame is ignored: False]
    [Protocols in frame: usb]
USB URB
    [Source: 3.3.2]
    [Destination: host]
    URB id: 0xffff89fc41ab8d80
    URB type: URB_COMPLETE ('C')
    URB transfer type: URB_BULK (0x03)
    Endpoint: 0x82, Direction: IN
        1... .... = Direction: IN (1)
        .... 0010 = Endpoint number: 2
    Device: 3
    URB bus id: 3
    Device setup request: not relevant ('-')
    Data: present (0)
    URB sec: 1530496807
    URB usec: 325262
    URB status: Remote I/O error (-EREMOTEIO) (-121)
    URB length [bytes]: 2
    Data length [bytes]: 2
    [bInterfaceClass: Unknown (0xffff)]
    Unused Setup Header
    Interval: 0
    Start frame: 0
    Copy of Transfer Flags: 0x00000201
    Number of ISO descriptors: 0
Leftover Capture Data: 3103

0000  80 8d ab 41 fc 89 ff ff 43 03 82 03 03 00 2d 00   ...A....C.....-.
0010  27 87 39 5b 00 00 00 00 8e f6 04 00 87 ff ff ff   '.9[............
0020  02 00 00 00 02 00 00 00 00 00 00 00 00 00 00 00   ................
0030  00 00 00 00 00 00 00 00 01 02 00 00 00 00 00 00   ................
0040  31 03                                             1.

Frame 81: 66 bytes on wire (528 bits), 66 bytes captured (528 bits) on interface 0
    Interface id: 0 (unknown)
        Interface name: unknown
    Encapsulation type: USB packets with Linux header and padding (115)
    Arrival Time: Jul  1, 2018 22:00:07.348293000 EDT
    [Time shift for this packet: 0.000000000 seconds]
    Epoch Time: 1530496807.348293000 seconds
    [Time delta from previous captured frame: 0.023031000 seconds]
    [Time delta from previous displayed frame: 0.023031000 seconds]
    [Time since reference or first frame: 377.826042000 seconds]
    Frame Number: 81
    Frame Length: 66 bytes (528 bits)
    Capture Length: 66 bytes (528 bits)
    [Frame is marked: False]
    [Frame is ignored: False]
    [Protocols in frame: usb]
USB URB
    [Source: host]
    [Destination: 3.3.1]
    URB id: 0xffff89fd4d50d6c0
    URB type: URB_SUBMIT ('S')
    URB transfer type: URB_BULK (0x03)
    Endpoint: 0x01, Direction: OUT
        0... .... = Direction: OUT (0)
        .... 0001 = Endpoint number: 1
    Device: 3
    URB bus id: 3
    Device setup request: not relevant ('-')
    Data: present (0)
    URB sec: 1530496807
    URB usec: 348293
    URB status: Operation now in progress (-EINPROGRESS) (-115)
    URB length [bytes]: 2
    Data length [bytes]: 2
    [bInterfaceClass: Unknown (0xffff)]
    Unused Setup Header
    Interval: 0
    Start frame: 0
    Copy of Transfer Flags: 0x00000000
    Number of ISO descriptors: 0
Leftover Capture Data: 1b05

0000  c0 d6 50 4d fd 89 ff ff 53 03 01 03 03 00 2d 00   ..PM....S.....-.
0010  27 87 39 5b 00 00 00 00 85 50 05 00 8d ff ff ff   '.9[.....P......
0020  02 00 00 00 02 00 00 00 00 00 00 00 00 00 00 00   ................
0030  00 00 00 00 00 00 00 00 00 00 00 00 00 00 00 00   ................
0040  1b 05                                             ..

Frame 82: 66 bytes on wire (528 bits), 66 bytes captured (528 bits) on interface 0
    Interface id: 0 (unknown)
        Interface name: unknown
    Encapsulation type: USB packets with Linux header and padding (115)
    Arrival Time: Jul  1, 2018 22:00:07.703000000 EDT
    [Time shift for this packet: 0.000000000 seconds]
    Epoch Time: 1530496807.703000000 seconds
    [Time delta from previous captured frame: 0.354707000 seconds]
    [Time delta from previous displayed frame: 0.354707000 seconds]
    [Time since reference or first frame: 378.180749000 seconds]
    Frame Number: 82
    Frame Length: 66 bytes (528 bits)
    Capture Length: 66 bytes (528 bits)
    [Frame is marked: False]
    [Frame is ignored: False]
    [Protocols in frame: usb]
USB URB
    [Source: 3.3.2]
    [Destination: host]
    URB id: 0xffff89fc41ab8d80
    URB type: URB_COMPLETE ('C')
    URB transfer type: URB_BULK (0x03)
    Endpoint: 0x82, Direction: IN
        1... .... = Direction: IN (1)
        .... 0010 = Endpoint number: 2
    Device: 3
    URB bus id: 3
    Device setup request: not relevant ('-')
    Data: present (0)
    URB sec: 1530496807
    URB usec: 703000
    URB status: Remote I/O error (-EREMOTEIO) (-121)
    URB length [bytes]: 2
    Data length [bytes]: 2
    [bInterfaceClass: Unknown (0xffff)]
    Unused Setup Header
    Interval: 0
    Start frame: 0
    Copy of Transfer Flags: 0x00000201
    Number of ISO descriptors: 0
Leftover Capture Data: 3003

0000  80 8d ab 41 fc 89 ff ff 43 03 82 03 03 00 2d 00   ...A....C.....-.
0010  27 87 39 5b 00 00 00 00 18 ba 0a 00 87 ff ff ff   '.9[............
0020  02 00 00 00 02 00 00 00 00 00 00 00 00 00 00 00   ................
0030  00 00 00 00 00 00 00 00 01 02 00 00 00 00 00 00   ................
0040  30 03                                             0.

Frame 83: 66 bytes on wire (528 bits), 66 bytes captured (528 bits) on interface 0
    Interface id: 0 (unknown)
        Interface name: unknown
    Encapsulation type: USB packets with Linux header and padding (115)
    Arrival Time: Jul  1, 2018 22:00:08.218354000 EDT
    [Time shift for this packet: 0.000000000 seconds]
    Epoch Time: 1530496808.218354000 seconds
    [Time delta from previous captured frame: 0.515354000 seconds]
    [Time delta from previous displayed frame: 0.515354000 seconds]
    [Time since reference or first frame: 378.696103000 seconds]
    Frame Number: 83
    Frame Length: 66 bytes (528 bits)
    Capture Length: 66 bytes (528 bits)
    [Frame is marked: False]
    [Frame is ignored: False]
    [Protocols in frame: usb]
USB URB
    [Source: host]
    [Destination: 3.3.1]
    URB id: 0xffff89fd4d50dcc0
    URB type: URB_SUBMIT ('S')
    URB transfer type: URB_BULK (0x03)
    Endpoint: 0x01, Direction: OUT
        0... .... = Direction: OUT (0)
        .... 0001 = Endpoint number: 1
    Device: 3
    URB bus id: 3
    Device setup request: not relevant ('-')
    Data: present (0)
    URB sec: 1530496808
    URB usec: 218354
    URB status: Operation now in progress (-EINPROGRESS) (-115)
    URB length [bytes]: 2
    Data length [bytes]: 2
    [bInterfaceClass: Unknown (0xffff)]
    Unused Setup Header
    Interval: 0
    Start frame: 0
    Copy of Transfer Flags: 0x00000000
    Number of ISO descriptors: 0
Leftover Capture Data: 1b05

0000  c0 dc 50 4d fd 89 ff ff 53 03 01 03 03 00 2d 00   ..PM....S.....-.
0010  28 87 39 5b 00 00 00 00 f2 54 03 00 8d ff ff ff   (.9[.....T......
0020  02 00 00 00 02 00 00 00 00 00 00 00 00 00 00 00   ................
0030  00 00 00 00 00 00 00 00 00 00 00 00 00 00 00 00   ................
0040  1b 05                                             ..

Frame 84: 66 bytes on wire (528 bits), 66 bytes captured (528 bits) on interface 0
    Interface id: 0 (unknown)
        Interface name: unknown
    Encapsulation type: USB packets with Linux header and padding (115)
    Arrival Time: Jul  1, 2018 22:00:08.309262000 EDT
    [Time shift for this packet: 0.000000000 seconds]
    Epoch Time: 1530496808.309262000 seconds
    [Time delta from previous captured frame: 0.090908000 seconds]
    [Time delta from previous displayed frame: 0.090908000 seconds]
    [Time since reference or first frame: 378.787011000 seconds]
    Frame Number: 84
    Frame Length: 66 bytes (528 bits)
    Capture Length: 66 bytes (528 bits)
    [Frame is marked: False]
    [Frame is ignored: False]
    [Protocols in frame: usb]
USB URB
    [Source: 3.3.2]
    [Destination: host]
    URB id: 0xffff89fd4d50de40
    URB type: URB_COMPLETE ('C')
    URB transfer type: URB_BULK (0x03)
    Endpoint: 0x82, Direction: IN
        1... .... = Direction: IN (1)
        .... 0010 = Endpoint number: 2
    Device: 3
    URB bus id: 3
    Device setup request: not relevant ('-')
    Data: present (0)
    URB sec: 1530496808
    URB usec: 309262
    URB status: Remote I/O error (-EREMOTEIO) (-121)
    URB length [bytes]: 2
    Data length [bytes]: 2
    [bInterfaceClass: Unknown (0xffff)]
    Unused Setup Header
    Interval: 0
    Start frame: 0
    Copy of Transfer Flags: 0x00000201
    Number of ISO descriptors: 0
Leftover Capture Data: 3003

0000  40 de 50 4d fd 89 ff ff 43 03 82 03 03 00 2d 00   @.PM....C.....-.
0010  28 87 39 5b 00 00 00 00 0e b8 04 00 87 ff ff ff   (.9[............
0020  02 00 00 00 02 00 00 00 00 00 00 00 00 00 00 00   ................
0030  00 00 00 00 00 00 00 00 01 02 00 00 00 00 00 00   ................
0040  30 03                                             0.

Frame 85: 74 bytes on wire (592 bits), 74 bytes captured (592 bits) on interface 0
    Interface id: 0 (unknown)
        Interface name: unknown
    Encapsulation type: USB packets with Linux header and padding (115)
    Arrival Time: Jul  1, 2018 22:00:08.452681000 EDT
    [Time shift for this packet: 0.000000000 seconds]
    Epoch Time: 1530496808.452681000 seconds
    [Time delta from previous captured frame: 0.143419000 seconds]
    [Time delta from previous displayed frame: 0.143419000 seconds]
    [Time since reference or first frame: 378.930430000 seconds]
    Frame Number: 85
    Frame Length: 74 bytes (592 bits)
    Capture Length: 74 bytes (592 bits)
    [Frame is marked: False]
    [Frame is ignored: False]
    [Protocols in frame: usb]
USB URB
    [Source: host]
    [Destination: 3.3.1]
    URB id: 0xffff89fd46e3f900
    URB type: URB_SUBMIT ('S')
    URB transfer type: URB_BULK (0x03)
    Endpoint: 0x01, Direction: OUT
        0... .... = Direction: OUT (0)
        .... 0001 = Endpoint number: 1
    Device: 3
    URB bus id: 3
    Device setup request: not relevant ('-')
    Data: present (0)
    URB sec: 1530496808
    URB usec: 452681
    URB status: Operation now in progress (-EINPROGRESS) (-115)
    URB length [bytes]: 10
    Data length [bytes]: 10
    [bInterfaceClass: Unknown (0xffff)]
    Unused Setup Header
    Interval: 0
    Start frame: 0
    Copy of Transfer Flags: 0x00000000
    Number of ISO descriptors: 0
Leftover Capture Data: 4d3235342c3132373003

0000  00 f9 e3 46 fd 89 ff ff 53 03 01 03 03 00 2d 00   ...F....S.....-.
0010  28 87 39 5b 00 00 00 00 49 e8 06 00 8d ff ff ff   (.9[....I.......
0020  0a 00 00 00 0a 00 00 00 00 00 00 00 00 00 00 00   ................
0030  00 00 00 00 00 00 00 00 00 00 00 00 00 00 00 00   ................
0040  4d 32 35 34 2c 31 32 37 30 03                     M254,1270.

Frame 86: 74 bytes on wire (592 bits), 74 bytes captured (592 bits) on interface 0
    Interface id: 0 (unknown)
        Interface name: unknown
    Encapsulation type: USB packets with Linux header and padding (115)
    Arrival Time: Jul  1, 2018 22:00:08.620013000 EDT
    [Time shift for this packet: 0.000000000 seconds]
    Epoch Time: 1530496808.620013000 seconds
    [Time delta from previous captured frame: 0.167332000 seconds]
    [Time delta from previous displayed frame: 0.167332000 seconds]
    [Time since reference or first frame: 379.097762000 seconds]
    Frame Number: 86
    Frame Length: 74 bytes (592 bits)
    Capture Length: 74 bytes (592 bits)
    [Frame is marked: False]
    [Frame is ignored: False]
    [Protocols in frame: usb]
USB URB
    [Source: host]
    [Destination: 3.3.1]
    URB id: 0xffff89fd4d50de40
    URB type: URB_SUBMIT ('S')
    URB transfer type: URB_BULK (0x03)
    Endpoint: 0x01, Direction: OUT
        0... .... = Direction: OUT (0)
        .... 0001 = Endpoint number: 1
    Device: 3
    URB bus id: 3
    Device setup request: not relevant ('-')
    Data: present (0)
    URB sec: 1530496808
    URB usec: 620013
    URB status: Operation now in progress (-EINPROGRESS) (-115)
    URB length [bytes]: 10
    Data length [bytes]: 10
    [bInterfaceClass: Unknown (0xffff)]
    Unused Setup Header
    Interval: 0
    Start frame: 0
    Copy of Transfer Flags: 0x00000000
    Number of ISO descriptors: 0
Leftover Capture Data: 424532e821903c3bab03

0000  40 de 50 4d fd 89 ff ff 53 03 01 03 03 00 2d 00   @.PM....S.....-.
0010  28 87 39 5b 00 00 00 00 ed 75 09 00 8d ff ff ff   (.9[.....u......
0020  0a 00 00 00 0a 00 00 00 00 00 00 00 00 00 00 00   ................
0030  00 00 00 00 00 00 00 00 00 00 00 00 00 00 00 00   ................
0040  42 45 32 e8 21 90 3c 3b ab 03                     BE2.!.<;..

Frame 87: 70 bytes on wire (560 bits), 70 bytes captured (560 bits) on interface 0
    Interface id: 0 (unknown)
        Interface name: unknown
    Encapsulation type: USB packets with Linux header and padding (115)
    Arrival Time: Jul  1, 2018 22:00:08.834122000 EDT
    [Time shift for this packet: 0.000000000 seconds]
    Epoch Time: 1530496808.834122000 seconds
    [Time delta from previous captured frame: 0.214109000 seconds]
    [Time delta from previous displayed frame: 0.214109000 seconds]
    [Time since reference or first frame: 379.311871000 seconds]
    Frame Number: 87
    Frame Length: 70 bytes (560 bits)
    Capture Length: 70 bytes (560 bits)
    [Frame is marked: False]
    [Frame is ignored: False]
    [Protocols in frame: usb]
USB URB
    [Source: host]
    [Destination: 3.3.1]
    URB id: 0xffff89fd46e3f900
    URB type: URB_SUBMIT ('S')
    URB transfer type: URB_BULK (0x03)
    Endpoint: 0x01, Direction: OUT
        0... .... = Direction: OUT (0)
        .... 0001 = Endpoint number: 1
    Device: 3
    URB bus id: 3
    Device setup request: not relevant ('-')
    Data: present (0)
    URB sec: 1530496808
    URB usec: 834122
    URB status: Operation now in progress (-EINPROGRESS) (-115)
    URB length [bytes]: 6
    Data length [bytes]: 6
    [bInterfaceClass: Unknown (0xffff)]
    Unused Setup Header
    Interval: 0
    Start frame: 0
    Copy of Transfer Flags: 0x00000000
    Number of ISO descriptors: 0
Leftover Capture Data: 424531909003

0000  00 f9 e3 46 fd 89 ff ff 53 03 01 03 03 00 2d 00   ...F....S.....-.
0010  28 87 39 5b 00 00 00 00 4a ba 0c 00 8d ff ff ff   (.9[....J.......
0020  06 00 00 00 06 00 00 00 00 00 00 00 00 00 00 00   ................
0030  00 00 00 00 00 00 00 00 00 00 00 00 00 00 00 00   ................
0040  42 45 31 90 90 03                                 BE1...

Frame 88: 83 bytes on wire (664 bits), 83 bytes captured (664 bits) on interface 0
    Interface id: 0 (unknown)
        Interface name: unknown
    Encapsulation type: USB packets with Linux header and padding (115)
    Arrival Time: Jul  1, 2018 22:00:08.988625000 EDT
    [Time shift for this packet: 0.000000000 seconds]
    Epoch Time: 1530496808.988625000 seconds
    [Time delta from previous captured frame: 0.154503000 seconds]
    [Time delta from previous displayed frame: 0.154503000 seconds]
    [Time since reference or first frame: 379.466374000 seconds]
    Frame Number: 88
    Frame Length: 83 bytes (664 bits)
    Capture Length: 83 bytes (664 bits)
    [Frame is marked: False]
    [Frame is ignored: False]
    [Protocols in frame: usb]
USB URB
    [Source: host]
    [Destination: 3.3.1]
    URB id: 0xffff89fd4d50dcc0
    URB type: URB_SUBMIT ('S')
    URB transfer type: URB_BULK (0x03)
    Endpoint: 0x01, Direction: OUT
        0... .... = Direction: OUT (0)
        .... 0001 = Endpoint number: 1
    Device: 3
    URB bus id: 3
    Device setup request: not relevant ('-')
    Data: present (0)
    URB sec: 1530496808
    URB usec: 988625
    URB status: Operation now in progress (-EINPROGRESS) (-115)
    URB length [bytes]: 19
    Data length [bytes]: 19
    [bInterfaceClass: Unknown (0xffff)]
    Unused Setup Header
    Interval: 0
    Start frame: 0
    Copy of Transfer Flags: 0x00000000
    Number of ISO descriptors: 0
Leftover Capture Data: 424532d6247b92dd89a844a19acca0b24a8903

0000  c0 dc 50 4d fd 89 ff ff 53 03 01 03 03 00 2d 00   ..PM....S.....-.
0010  28 87 39 5b 00 00 00 00 d1 15 0f 00 8d ff ff ff   (.9[............
0020  13 00 00 00 13 00 00 00 00 00 00 00 00 00 00 00   ................
0030  00 00 00 00 00 00 00 00 00 00 00 00 00 00 00 00   ................
0040  42 45 32 d6 24 7b 92 dd 89 a8 44 a1 9a cc a0 b2   BE2.${....D.....
0050  4a 89 03                                          J..

Frame 89: 74 bytes on wire (592 bits), 74 bytes captured (592 bits) on interface 0
    Interface id: 0 (unknown)
        Interface name: unknown
    Encapsulation type: USB packets with Linux header and padding (115)
    Arrival Time: Jul  1, 2018 22:00:09.142536000 EDT
    [Time shift for this packet: 0.000000000 seconds]
    Epoch Time: 1530496809.142536000 seconds
    [Time delta from previous captured frame: 0.153911000 seconds]
    [Time delta from previous displayed frame: 0.153911000 seconds]
    [Time since reference or first frame: 379.620285000 seconds]
    Frame Number: 89
    Frame Length: 74 bytes (592 bits)
    Capture Length: 74 bytes (592 bits)
    [Frame is marked: False]
    [Frame is ignored: False]
    [Protocols in frame: usb]
USB URB
    [Source: host]
    [Destination: 3.3.1]
    URB id: 0xffff89fd4d50dd80
    URB type: URB_SUBMIT ('S')
    URB transfer type: URB_BULK (0x03)
    Endpoint: 0x01, Direction: OUT
        0... .... = Direction: OUT (0)
        .... 0001 = Endpoint number: 1
    Device: 3
    URB bus id: 3
    Device setup request: not relevant ('-')
    Data: present (0)
    URB sec: 1530496809
    URB usec: 142536
    URB status: Operation now in progress (-EINPROGRESS) (-115)
    URB length [bytes]: 10
    Data length [bytes]: 10
    [bInterfaceClass: Unknown (0xffff)]
    Unused Setup Header
    Interval: 0
    Start frame: 0
    Copy of Transfer Flags: 0x00000000
    Number of ISO descriptors: 0
Leftover Capture Data: 4245319090909090f603

0000  80 dd 50 4d fd 89 ff ff 53 03 01 03 03 00 2d 00   ..PM....S.....-.
0010  29 87 39 5b 00 00 00 00 c8 2c 02 00 8d ff ff ff   ).9[.....,......
0020  0a 00 00 00 0a 00 00 00 00 00 00 00 00 00 00 00   ................
0030  00 00 00 00 00 00 00 00 00 00 00 00 00 00 00 00   ................
0040  42 45 31 90 90 90 90 90 f6 03                     BE1.......

Frame 90: 74 bytes on wire (592 bits), 74 bytes captured (592 bits) on interface 0
    Interface id: 0 (unknown)
        Interface name: unknown
    Encapsulation type: USB packets with Linux header and padding (115)
    Arrival Time: Jul  1, 2018 22:00:09.296688000 EDT
    [Time shift for this packet: 0.000000000 seconds]
    Epoch Time: 1530496809.296688000 seconds
    [Time delta from previous captured frame: 0.154152000 seconds]
    [Time delta from previous displayed frame: 0.154152000 seconds]
    [Time since reference or first frame: 379.774437000 seconds]
    Frame Number: 90
    Frame Length: 74 bytes (592 bits)
    Capture Length: 74 bytes (592 bits)
    [Frame is marked: False]
    [Frame is ignored: False]
    [Protocols in frame: usb]
USB URB
    [Source: host]
    [Destination: 3.3.1]
    URB id: 0xffff89fc41ab8600
    URB type: URB_SUBMIT ('S')
    URB transfer type: URB_BULK (0x03)
    Endpoint: 0x01, Direction: OUT
        0... .... = Direction: OUT (0)
        .... 0001 = Endpoint number: 1
    Device: 3
    URB bus id: 3
    Device setup request: not relevant ('-')
    Data: present (0)
    URB sec: 1530496809
    URB usec: 296688
    URB status: Operation now in progress (-EINPROGRESS) (-115)
    URB length [bytes]: 10
    Data length [bytes]: 10
    [bInterfaceClass: Unknown (0xffff)]
    Unused Setup Header
    Interval: 0
    Start frame: 0
    Copy of Transfer Flags: 0x00000000
    Number of ISO descriptors: 0
Leftover Capture Data: 42453270fd8f84558303

0000  00 86 ab 41 fc 89 ff ff 53 03 01 03 03 00 2d 00   ...A....S.....-.
0010  29 87 39 5b 00 00 00 00 f0 86 04 00 8d ff ff ff   ).9[............
0020  0a 00 00 00 0a 00 00 00 00 00 00 00 00 00 00 00   ................
0030  00 00 00 00 00 00 00 00 00 00 00 00 00 00 00 00   ................
0040  42 45 32 70 fd 8f 84 55 83 03                     BE2p...U..

Frame 91: 310 bytes on wire (2480 bits), 310 bytes captured (2480 bits) on interface 0
    Interface id: 0 (unknown)
        Interface name: unknown
    Encapsulation type: USB packets with Linux header and padding (115)
    Arrival Time: Jul  1, 2018 22:00:09.430594000 EDT
    [Time shift for this packet: 0.000000000 seconds]
    Epoch Time: 1530496809.430594000 seconds
    [Time delta from previous captured frame: 0.133906000 seconds]
    [Time delta from previous displayed frame: 0.133906000 seconds]
    [Time since reference or first frame: 379.908343000 seconds]
    Frame Number: 91
    Frame Length: 310 bytes (2480 bits)
    Capture Length: 310 bytes (2480 bits)
    [Frame is marked: False]
    [Frame is ignored: False]
    [Protocols in frame: usb]
USB URB
    [Source: host]
    [Destination: 3.3.1]
    URB id: 0xffff89fc41ab8180
    URB type: URB_SUBMIT ('S')
    URB transfer type: URB_BULK (0x03)
    Endpoint: 0x01, Direction: OUT
        0... .... = Direction: OUT (0)
        .... 0001 = Endpoint number: 1
    Device: 3
    URB bus id: 3
    Device setup request: not relevant ('-')
    Data: present (0)
    URB sec: 1530496809
    URB usec: 430594
    URB status: Operation now in progress (-EINPROGRESS) (-115)
    URB length [bytes]: 246
    Data length [bytes]: 246
    [bInterfaceClass: Unknown (0xffff)]
    Unused Setup Header
    Interval: 0
    Start frame: 0
    Copy of Transfer Flags: 0x00000000
    Number of ISO descriptors: 0
Leftover Capture Data: 4245319890939c949c959c959b969b969b969a979a989a98...

0000  80 81 ab 41 fc 89 ff ff 53 03 01 03 03 00 2d 00   ...A....S.....-.
0010  29 87 39 5b 00 00 00 00 02 92 06 00 8d ff ff ff   ).9[............
0020  f6 00 00 00 f6 00 00 00 00 00 00 00 00 00 00 00   ................
0030  00 00 00 00 00 00 00 00 00 00 00 00 00 00 00 00   ................
0040  42 45 31 98 90 93 9c 94 9c 95 9c 95 9b 96 9b 96   BE1.............
0050  9b 96 9a 97 9a 98 9a 98 99 98 99 99 98 99 98 9a   ................
0060  98 9a 97 9a 96 9b 96 9b 96 9b 95 9c 95 9c 94 9c   ................
0070  93 9c 93 9c 92 9d 92 9d 91 9d 90 9d 90 9d 8f 9d   ................
0080  8e 9c 8e 9c 8d 9c 8d 9c 8c 9c 8b 9b 8b 9b 8a 9b   ................
0090  8a 9a 8a 9a 89 9a 88 99 88 99 88 98 87 98 87 98   ................
00a0  86 97 86 96 86 96 85 96 85 95 85 95 84 94 84 93   ................
00b0  84 93 84 92 84 92 83 91 83 90 83 90 83 8f 83 8e   ................
00c0  83 8e 84 8d 84 8d 84 8c 84 8b 84 8b 85 8a 85 8a   ................
00d0  85 8a 86 89 86 88 86 88 87 88 87 87 88 87 88 86   ................
00e0  88 86 89 86 8a 85 8a 85 8a 85 8b 84 8b 84 8c 84   ................
00f0  8d 84 8d 84 8e 83 8e 83 8f 83 90 83 90 83 91 83   ................
0100  92 84 92 84 93 84 93 84 94 84 95 85 95 85 96 85   ................
0110  96 86 96 86 97 86 98 87 98 87 98 88 99 88 99 88   ................
0120  9a 89 9a 8a 9a 8a 9b 8a 9b 8b 9b 8b 9c 8c 9c 8d   ................
0130  9c 8d 9c 8e 9c 03                                 ......

Frame 92: 88 bytes on wire (704 bits), 88 bytes captured (704 bits) on interface 0
    Interface id: 0 (unknown)
        Interface name: unknown
    Encapsulation type: USB packets with Linux header and padding (115)
    Arrival Time: Jul  1, 2018 22:00:09.725332000 EDT
    [Time shift for this packet: 0.000000000 seconds]
    Epoch Time: 1530496809.725332000 seconds
    [Time delta from previous captured frame: 0.294738000 seconds]
    [Time delta from previous displayed frame: 0.294738000 seconds]
    [Time since reference or first frame: 380.203081000 seconds]
    Frame Number: 92
    Frame Length: 88 bytes (704 bits)
    Capture Length: 88 bytes (704 bits)
    [Frame is marked: False]
    [Frame is ignored: False]
    [Protocols in frame: usb]
USB URB
    [Source: host]
    [Destination: 3.3.1]
    URB id: 0xffff89fd4d50dd80
    URB type: URB_SUBMIT ('S')
    URB transfer type: URB_BULK (0x03)
    Endpoint: 0x01, Direction: OUT
        0... .... = Direction: OUT (0)
        .... 0001 = Endpoint number: 1
    Device: 3
    URB bus id: 3
    Device setup request: not relevant ('-')
    Data: present (0)
    URB sec: 1530496809
    URB usec: 725332
    URB status: Operation now in progress (-EINPROGRESS) (-115)
    URB length [bytes]: 24
    Data length [bytes]: 24
    [bInterfaceClass: Unknown (0xffff)]
    Unused Setup Header
    Interval: 0
    Start frame: 0
    Copy of Transfer Flags: 0x00000000
    Number of ISO descriptors: 0
Leftover Capture Data: 4245318e9d8f9d909d909d919d929d929c939c9090889003

0000  80 dd 50 4d fd 89 ff ff 53 03 01 03 03 00 2d 00   ..PM....S.....-.
0010  29 87 39 5b 00 00 00 00 54 11 0b 00 8d ff ff ff   ).9[....T.......
0020  18 00 00 00 18 00 00 00 00 00 00 00 00 00 00 00   ................
0030  00 00 00 00 00 00 00 00 00 00 00 00 00 00 00 00   ................
0040  42 45 31 8e 9d 8f 9d 90 9d 90 9d 91 9d 92 9d 92   BE1.............
0050  9c 93 9c 90 90 88 90 03                           ........

Frame 93: 71 bytes on wire (568 bits), 71 bytes captured (568 bits) on interface 0
    Interface id: 0 (unknown)
        Interface name: unknown
    Encapsulation type: USB packets with Linux header and padding (115)
    Arrival Time: Jul  1, 2018 22:00:09.899415000 EDT
    [Time shift for this packet: 0.000000000 seconds]
    Epoch Time: 1530496809.899415000 seconds
    [Time delta from previous captured frame: 0.174083000 seconds]
    [Time delta from previous displayed frame: 0.174083000 seconds]
    [Time since reference or first frame: 380.377164000 seconds]
    Frame Number: 93
    Frame Length: 71 bytes (568 bits)
    Capture Length: 71 bytes (568 bits)
    [Frame is marked: False]
    [Frame is ignored: False]
    [Protocols in frame: usb]
USB URB
    [Source: host]
    [Destination: 3.3.1]
    URB id: 0xffff89fd4d50dd80
    URB type: URB_SUBMIT ('S')
    URB transfer type: URB_BULK (0x03)
    Endpoint: 0x01, Direction: OUT
        0... .... = Direction: OUT (0)
        .... 0001 = Endpoint number: 1
    Device: 3
    URB bus id: 3
    Device setup request: not relevant ('-')
    Data: present (0)
    URB sec: 1530496809
    URB usec: 899415
    URB status: Operation now in progress (-EINPROGRESS) (-115)
    URB length [bytes]: 7
    Data length [bytes]: 7
    [bInterfaceClass: Unknown (0xffff)]
    Unused Setup Header
    Interval: 0
    Start frame: 0
    Copy of Transfer Flags: 0x00000000
    Number of ISO descriptors: 0
Leftover Capture Data: 424532f4d77a03

0000  80 dd 50 4d fd 89 ff ff 53 03 01 03 03 00 2d 00   ..PM....S.....-.
0010  29 87 39 5b 00 00 00 00 57 b9 0d 00 8d ff ff ff   ).9[....W.......
0020  07 00 00 00 07 00 00 00 00 00 00 00 00 00 00 00   ................
0030  00 00 00 00 00 00 00 00 00 00 00 00 00 00 00 00   ................
0040  42 45 32 f4 d7 7a 03                              BE2..z.

Frame 94: 70 bytes on wire (560 bits), 70 bytes captured (560 bits) on interface 0
    Interface id: 0 (unknown)
        Interface name: unknown
    Encapsulation type: USB packets with Linux header and padding (115)
    Arrival Time: Jul  1, 2018 22:00:10.013232000 EDT
    [Time shift for this packet: 0.000000000 seconds]
    Epoch Time: 1530496810.013232000 seconds
    [Time delta from previous captured frame: 0.113817000 seconds]
    [Time delta from previous displayed frame: 0.113817000 seconds]
    [Time since reference or first frame: 380.490981000 seconds]
    Frame Number: 94
    Frame Length: 70 bytes (560 bits)
    Capture Length: 70 bytes (560 bits)
    [Frame is marked: False]
    [Frame is ignored: False]
    [Protocols in frame: usb]
USB URB
    [Source: host]
    [Destination: 3.3.1]
    URB id: 0xffff89fd4d50dd80
    URB type: URB_SUBMIT ('S')
    URB transfer type: URB_BULK (0x03)
    Endpoint: 0x01, Direction: OUT
        0... .... = Direction: OUT (0)
        .... 0001 = Endpoint number: 1
    Device: 3
    URB bus id: 3
    Device setup request: not relevant ('-')
    Data: present (0)
    URB sec: 1530496810
    URB usec: 13232
    URB status: Operation now in progress (-EINPROGRESS) (-115)
    URB length [bytes]: 6
    Data length [bytes]: 6
    [bInterfaceClass: Unknown (0xffff)]
    Unused Setup Header
    Interval: 0
    Start frame: 0
    Copy of Transfer Flags: 0x00000000
    Number of ISO descriptors: 0
Leftover Capture Data: 424531909003

0000  80 dd 50 4d fd 89 ff ff 53 03 01 03 03 00 2d 00   ..PM....S.....-.
0010  2a 87 39 5b 00 00 00 00 b0 33 00 00 8d ff ff ff   *.9[.....3......
0020  06 00 00 00 06 00 00 00 00 00 00 00 00 00 00 00   ................
0030  00 00 00 00 00 00 00 00 00 00 00 00 00 00 00 00   ................
0040  42 45 31 90 90 03                                 BE1...

Frame 95: 66 bytes on wire (528 bits), 66 bytes captured (528 bits) on interface 0
    Interface id: 0 (unknown)
        Interface name: unknown
    Encapsulation type: USB packets with Linux header and padding (115)
    Arrival Time: Jul  1, 2018 22:00:10.187519000 EDT
    [Time shift for this packet: 0.000000000 seconds]
    Epoch Time: 1530496810.187519000 seconds
    [Time delta from previous captured frame: 0.174287000 seconds]
    [Time delta from previous displayed frame: 0.174287000 seconds]
    [Time since reference or first frame: 380.665268000 seconds]
    Frame Number: 95
    Frame Length: 66 bytes (528 bits)
    Capture Length: 66 bytes (528 bits)
    [Frame is marked: False]
    [Frame is ignored: False]
    [Protocols in frame: usb]
USB URB
    [Source: host]
    [Destination: 3.3.1]
    URB id: 0xffff89fc41ab8300
    URB type: URB_SUBMIT ('S')
    URB transfer type: URB_BULK (0x03)
    Endpoint: 0x01, Direction: OUT
        0... .... = Direction: OUT (0)
        .... 0001 = Endpoint number: 1
    Device: 3
    URB bus id: 3
    Device setup request: not relevant ('-')
    Data: present (0)
    URB sec: 1530496810
    URB usec: 187519
    URB status: Operation now in progress (-EINPROGRESS) (-115)
    URB length [bytes]: 2
    Data length [bytes]: 2
    [bInterfaceClass: Unknown (0xffff)]
    Unused Setup Header
    Interval: 0
    Start frame: 0
    Copy of Transfer Flags: 0x00000000
    Number of ISO descriptors: 0
Leftover Capture Data: 1b05

0000  00 83 ab 41 fc 89 ff ff 53 03 01 03 03 00 2d 00   ...A....S.....-.
0010  2a 87 39 5b 00 00 00 00 7f dc 02 00 8d ff ff ff   *.9[............
0020  02 00 00 00 02 00 00 00 00 00 00 00 00 00 00 00   ................
0030  00 00 00 00 00 00 00 00 00 00 00 00 00 00 00 00   ................
0040  1b 05                                             ..

Frame 96: 66 bytes on wire (528 bits), 66 bytes captured (528 bits) on interface 0
    Interface id: 0 (unknown)
        Interface name: unknown
    Encapsulation type: USB packets with Linux header and padding (115)
    Arrival Time: Jul  1, 2018 22:00:10.277285000 EDT
    [Time shift for this packet: 0.000000000 seconds]
    Epoch Time: 1530496810.277285000 seconds
    [Time delta from previous captured frame: 0.089766000 seconds]
    [Time delta from previous displayed frame: 0.089766000 seconds]
    [Time since reference or first frame: 380.755034000 seconds]
    Frame Number: 96
    Frame Length: 66 bytes (528 bits)
    Capture Length: 66 bytes (528 bits)
    [Frame is marked: False]
    [Frame is ignored: False]
    [Protocols in frame: usb]
USB URB
    [Source: 3.3.2]
    [Destination: host]
    URB id: 0xffff89fc41ab8d80
    URB type: URB_COMPLETE ('C')
    URB transfer type: URB_BULK (0x03)
    Endpoint: 0x82, Direction: IN
        1... .... = Direction: IN (1)
        .... 0010 = Endpoint number: 2
    Device: 3
    URB bus id: 3
    Device setup request: not relevant ('-')
    Data: present (0)
    URB sec: 1530496810
    URB usec: 277285
    URB status: Remote I/O error (-EREMOTEIO) (-121)
    URB length [bytes]: 2
    Data length [bytes]: 2
    [bInterfaceClass: Unknown (0xffff)]
    Unused Setup Header
    Interval: 0
    Start frame: 0
    Copy of Transfer Flags: 0x00000201
    Number of ISO descriptors: 0
Leftover Capture Data: 3103

0000  80 8d ab 41 fc 89 ff ff 43 03 82 03 03 00 2d 00   ...A....C.....-.
0010  2a 87 39 5b 00 00 00 00 25 3b 04 00 87 ff ff ff   *.9[....%;......
0020  02 00 00 00 02 00 00 00 00 00 00 00 00 00 00 00   ................
0030  00 00 00 00 00 00 00 00 01 02 00 00 00 00 00 00   ................
0040  31 03                                             1.

Frame 97: 66 bytes on wire (528 bits), 66 bytes captured (528 bits) on interface 0
    Interface id: 0 (unknown)
        Interface name: unknown
    Encapsulation type: USB packets with Linux header and padding (115)
    Arrival Time: Jul  1, 2018 22:00:10.321533000 EDT
    [Time shift for this packet: 0.000000000 seconds]
    Epoch Time: 1530496810.321533000 seconds
    [Time delta from previous captured frame: 0.044248000 seconds]
    [Time delta from previous displayed frame: 0.044248000 seconds]
    [Time since reference or first frame: 380.799282000 seconds]
    Frame Number: 97
    Frame Length: 66 bytes (528 bits)
    Capture Length: 66 bytes (528 bits)
    [Frame is marked: False]
    [Frame is ignored: False]
    [Protocols in frame: usb]
USB URB
    [Source: host]
    [Destination: 3.3.1]
    URB id: 0xffff89fc41ab8d80
    URB type: URB_SUBMIT ('S')
    URB transfer type: URB_BULK (0x03)
    Endpoint: 0x01, Direction: OUT
        0... .... = Direction: OUT (0)
        .... 0001 = Endpoint number: 1
    Device: 3
    URB bus id: 3
    Device setup request: not relevant ('-')
    Data: present (0)
    URB sec: 1530496810
    URB usec: 321533
    URB status: Operation now in progress (-EINPROGRESS) (-115)
    URB length [bytes]: 2
    Data length [bytes]: 2
    [bInterfaceClass: Unknown (0xffff)]
    Unused Setup Header
    Interval: 0
    Start frame: 0
    Copy of Transfer Flags: 0x00000000
    Number of ISO descriptors: 0
Leftover Capture Data: 1b05

0000  80 8d ab 41 fc 89 ff ff 53 03 01 03 03 00 2d 00   ...A....S.....-.
0010  2a 87 39 5b 00 00 00 00 fd e7 04 00 8d ff ff ff   *.9[............
0020  02 00 00 00 02 00 00 00 00 00 00 00 00 00 00 00   ................
0030  00 00 00 00 00 00 00 00 00 00 00 00 00 00 00 00   ................
0040  1b 05                                             ..

Frame 98: 66 bytes on wire (528 bits), 66 bytes captured (528 bits) on interface 0
    Interface id: 0 (unknown)
        Interface name: unknown
    Encapsulation type: USB packets with Linux header and padding (115)
    Arrival Time: Jul  1, 2018 22:00:10.696311000 EDT
    [Time shift for this packet: 0.000000000 seconds]
    Epoch Time: 1530496810.696311000 seconds
    [Time delta from previous captured frame: 0.374778000 seconds]
    [Time delta from previous displayed frame: 0.374778000 seconds]
    [Time since reference or first frame: 381.174060000 seconds]
    Frame Number: 98
    Frame Length: 66 bytes (528 bits)
    Capture Length: 66 bytes (528 bits)
    [Frame is marked: False]
    [Frame is ignored: False]
    [Protocols in frame: usb]
USB URB
    [Source: 3.3.2]
    [Destination: host]
    URB id: 0xffff89fd4d50dd80
    URB type: URB_COMPLETE ('C')
    URB transfer type: URB_BULK (0x03)
    Endpoint: 0x82, Direction: IN
        1... .... = Direction: IN (1)
        .... 0010 = Endpoint number: 2
    Device: 3
    URB bus id: 3
    Device setup request: not relevant ('-')
    Data: present (0)
    URB sec: 1530496810
    URB usec: 696311
    URB status: Remote I/O error (-EREMOTEIO) (-121)
    URB length [bytes]: 2
    Data length [bytes]: 2
    [bInterfaceClass: Unknown (0xffff)]
    Unused Setup Header
    Interval: 0
    Start frame: 0
    Copy of Transfer Flags: 0x00000201
    Number of ISO descriptors: 0
Leftover Capture Data: 3103

0000  80 dd 50 4d fd 89 ff ff 43 03 82 03 03 00 2d 00   ..PM....C.....-.
0010  2a 87 39 5b 00 00 00 00 f7 9f 0a 00 87 ff ff ff   *.9[............
0020  02 00 00 00 02 00 00 00 00 00 00 00 00 00 00 00   ................
0030  00 00 00 00 00 00 00 00 01 02 00 00 00 00 00 00   ................
0040  31 03                                             1.

Frame 99: 66 bytes on wire (528 bits), 66 bytes captured (528 bits) on interface 0
    Interface id: 0 (unknown)
        Interface name: unknown
    Encapsulation type: USB packets with Linux header and padding (115)
    Arrival Time: Jul  1, 2018 22:00:10.950589000 EDT
    [Time shift for this packet: 0.000000000 seconds]
    Epoch Time: 1530496810.950589000 seconds
    [Time delta from previous captured frame: 0.254278000 seconds]
    [Time delta from previous displayed frame: 0.254278000 seconds]
    [Time since reference or first frame: 381.428338000 seconds]
    Frame Number: 99
    Frame Length: 66 bytes (528 bits)
    Capture Length: 66 bytes (528 bits)
    [Frame is marked: False]
    [Frame is ignored: False]
    [Protocols in frame: usb]
USB URB
    [Source: host]
    [Destination: 3.3.1]
    URB id: 0xffff89fd4d50dcc0
    URB type: URB_SUBMIT ('S')
    URB transfer type: URB_BULK (0x03)
    Endpoint: 0x01, Direction: OUT
        0... .... = Direction: OUT (0)
        .... 0001 = Endpoint number: 1
    Device: 3
    URB bus id: 3
    Device setup request: not relevant ('-')
    Data: present (0)
    URB sec: 1530496810
    URB usec: 950589
    URB status: Operation now in progress (-EINPROGRESS) (-115)
    URB length [bytes]: 2
    Data length [bytes]: 2
    [bInterfaceClass: Unknown (0xffff)]
    Unused Setup Header
    Interval: 0
    Start frame: 0
    Copy of Transfer Flags: 0x00000000
    Number of ISO descriptors: 0
Leftover Capture Data: 1b05

0000  c0 dc 50 4d fd 89 ff ff 53 03 01 03 03 00 2d 00   ..PM....S.....-.
0010  2a 87 39 5b 00 00 00 00 3d 81 0e 00 8d ff ff ff   *.9[....=.......
0020  02 00 00 00 02 00 00 00 00 00 00 00 00 00 00 00   ................
0030  00 00 00 00 00 00 00 00 00 00 00 00 00 00 00 00   ................
0040  1b 05                                             ..

Frame 100: 66 bytes on wire (528 bits), 66 bytes captured (528 bits) on interface 0
    Interface id: 0 (unknown)
        Interface name: unknown
    Encapsulation type: USB packets with Linux header and padding (115)
    Arrival Time: Jul  1, 2018 22:00:11.097237000 EDT
    [Time shift for this packet: 0.000000000 seconds]
    Epoch Time: 1530496811.097237000 seconds
    [Time delta from previous captured frame: 0.146648000 seconds]
    [Time delta from previous displayed frame: 0.146648000 seconds]
    [Time since reference or first frame: 381.574986000 seconds]
    Frame Number: 100
    Frame Length: 66 bytes (528 bits)
    Capture Length: 66 bytes (528 bits)
    [Frame is marked: False]
    [Frame is ignored: False]
    [Protocols in frame: usb]
USB URB
    [Source: 3.3.2]
    [Destination: host]
    URB id: 0xffff89fd4d50de40
    URB type: URB_COMPLETE ('C')
    URB transfer type: URB_BULK (0x03)
    Endpoint: 0x82, Direction: IN
        1... .... = Direction: IN (1)
        .... 0010 = Endpoint number: 2
    Device: 3
    URB bus id: 3
    Device setup request: not relevant ('-')
    Data: present (0)
    URB sec: 1530496811
    URB usec: 97237
    URB status: Remote I/O error (-EREMOTEIO) (-121)
    URB length [bytes]: 2
    Data length [bytes]: 2
    [bInterfaceClass: Unknown (0xffff)]
    Unused Setup Header
    Interval: 0
    Start frame: 0
    Copy of Transfer Flags: 0x00000201
    Number of ISO descriptors: 0
Leftover Capture Data: 3103

0000  40 de 50 4d fd 89 ff ff 43 03 82 03 03 00 2d 00   @.PM....C.....-.
0010  2b 87 39 5b 00 00 00 00 d5 7b 01 00 87 ff ff ff   +.9[.....{......
0020  02 00 00 00 02 00 00 00 00 00 00 00 00 00 00 00   ................
0030  00 00 00 00 00 00 00 00 01 02 00 00 00 00 00 00   ................
0040  31 03                                             1.

Frame 101: 66 bytes on wire (528 bits), 66 bytes captured (528 bits) on interface 0
    Interface id: 0 (unknown)
        Interface name: unknown
    Encapsulation type: USB packets with Linux header and padding (115)
    Arrival Time: Jul  1, 2018 22:00:11.399241000 EDT
    [Time shift for this packet: 0.000000000 seconds]
    Epoch Time: 1530496811.399241000 seconds
    [Time delta from previous captured frame: 0.302004000 seconds]
    [Time delta from previous displayed frame: 0.302004000 seconds]
    [Time since reference or first frame: 381.876990000 seconds]
    Frame Number: 101
    Frame Length: 66 bytes (528 bits)
    Capture Length: 66 bytes (528 bits)
    [Frame is marked: False]
    [Frame is ignored: False]
    [Protocols in frame: usb]
USB URB
    [Source: host]
    [Destination: 3.3.1]
    URB id: 0xffff89fc41ab8d80
    URB type: URB_SUBMIT ('S')
    URB transfer type: URB_BULK (0x03)
    Endpoint: 0x01, Direction: OUT
        0... .... = Direction: OUT (0)
        .... 0001 = Endpoint number: 1
    Device: 3
    URB bus id: 3
    Device setup request: not relevant ('-')
    Data: present (0)
    URB sec: 1530496811
    URB usec: 399241
    URB status: Operation now in progress (-EINPROGRESS) (-115)
    URB length [bytes]: 2
    Data length [bytes]: 2
    [bInterfaceClass: Unknown (0xffff)]
    Unused Setup Header
    Interval: 0
    Start frame: 0
    Copy of Transfer Flags: 0x00000000
    Number of ISO descriptors: 0
Leftover Capture Data: 1b05

0000  80 8d ab 41 fc 89 ff ff 53 03 01 03 03 00 2d 00   ...A....S.....-.
0010  2b 87 39 5b 00 00 00 00 89 17 06 00 8d ff ff ff   +.9[............
0020  02 00 00 00 02 00 00 00 00 00 00 00 00 00 00 00   ................
0030  00 00 00 00 00 00 00 00 00 00 00 00 00 00 00 00   ................
0040  1b 05                                             ..

Frame 102: 66 bytes on wire (528 bits), 66 bytes captured (528 bits) on interface 0
    Interface id: 0 (unknown)
        Interface name: unknown
    Encapsulation type: USB packets with Linux header and padding (115)
    Arrival Time: Jul  1, 2018 22:00:11.507249000 EDT
    [Time shift for this packet: 0.000000000 seconds]
    Epoch Time: 1530496811.507249000 seconds
    [Time delta from previous captured frame: 0.108008000 seconds]
    [Time delta from previous displayed frame: 0.108008000 seconds]
    [Time since reference or first frame: 381.984998000 seconds]
    Frame Number: 102
    Frame Length: 66 bytes (528 bits)
    Capture Length: 66 bytes (528 bits)
    [Frame is marked: False]
    [Frame is ignored: False]
    [Protocols in frame: usb]
USB URB
    [Source: 3.3.2]
    [Destination: host]
    URB id: 0xffff89fd46e3f900
    URB type: URB_COMPLETE ('C')
    URB transfer type: URB_BULK (0x03)
    Endpoint: 0x82, Direction: IN
        1... .... = Direction: IN (1)
        .... 0010 = Endpoint number: 2
    Device: 3
    URB bus id: 3
    Device setup request: not relevant ('-')
    Data: present (0)
    URB sec: 1530496811
    URB usec: 507249
    URB status: Remote I/O error (-EREMOTEIO) (-121)
    URB length [bytes]: 2
    Data length [bytes]: 2
    [bInterfaceClass: Unknown (0xffff)]
    Unused Setup Header
    Interval: 0
    Start frame: 0
    Copy of Transfer Flags: 0x00000201
    Number of ISO descriptors: 0
Leftover Capture Data: 3103

0000  00 f9 e3 46 fd 89 ff ff 43 03 82 03 03 00 2d 00   ...F....C.....-.
0010  2b 87 39 5b 00 00 00 00 71 bd 07 00 87 ff ff ff   +.9[....q.......
0020  02 00 00 00 02 00 00 00 00 00 00 00 00 00 00 00   ................
0030  00 00 00 00 00 00 00 00 01 02 00 00 00 00 00 00   ................
0040  31 03                                             1.

Frame 103: 66 bytes on wire (528 bits), 66 bytes captured (528 bits) on interface 0
    Interface id: 0 (unknown)
        Interface name: unknown
    Encapsulation type: USB packets with Linux header and padding (115)
    Arrival Time: Jul  1, 2018 22:00:11.928500000 EDT
    [Time shift for this packet: 0.000000000 seconds]
    Epoch Time: 1530496811.928500000 seconds
    [Time delta from previous captured frame: 0.421251000 seconds]
    [Time delta from previous displayed frame: 0.421251000 seconds]
    [Time since reference or first frame: 382.406249000 seconds]
    Frame Number: 103
    Frame Length: 66 bytes (528 bits)
    Capture Length: 66 bytes (528 bits)
    [Frame is marked: False]
    [Frame is ignored: False]
    [Protocols in frame: usb]
USB URB
    [Source: host]
    [Destination: 3.3.1]
    URB id: 0xffff89fc41ab8a80
    URB type: URB_SUBMIT ('S')
    URB transfer type: URB_BULK (0x03)
    Endpoint: 0x01, Direction: OUT
        0... .... = Direction: OUT (0)
        .... 0001 = Endpoint number: 1
    Device: 3
    URB bus id: 3
    Device setup request: not relevant ('-')
    Data: present (0)
    URB sec: 1530496811
    URB usec: 928500
    URB status: Operation now in progress (-EINPROGRESS) (-115)
    URB length [bytes]: 2
    Data length [bytes]: 2
    [bInterfaceClass: Unknown (0xffff)]
    Unused Setup Header
    Interval: 0
    Start frame: 0
    Copy of Transfer Flags: 0x00000000
    Number of ISO descriptors: 0
Leftover Capture Data: 1b05

0000  80 8a ab 41 fc 89 ff ff 53 03 01 03 03 00 2d 00   ...A....S.....-.
0010  2b 87 39 5b 00 00 00 00 f4 2a 0e 00 8d ff ff ff   +.9[.....*......
0020  02 00 00 00 02 00 00 00 00 00 00 00 00 00 00 00   ................
0030  00 00 00 00 00 00 00 00 00 00 00 00 00 00 00 00   ................
0040  1b 05                                             ..

Frame 104: 66 bytes on wire (528 bits), 66 bytes captured (528 bits) on interface 0
    Interface id: 0 (unknown)
        Interface name: unknown
    Encapsulation type: USB packets with Linux header and padding (115)
    Arrival Time: Jul  1, 2018 22:00:12.081226000 EDT
    [Time shift for this packet: 0.000000000 seconds]
    Epoch Time: 1530496812.081226000 seconds
    [Time delta from previous captured frame: 0.152726000 seconds]
    [Time delta from previous displayed frame: 0.152726000 seconds]
    [Time since reference or first frame: 382.558975000 seconds]
    Frame Number: 104
    Frame Length: 66 bytes (528 bits)
    Capture Length: 66 bytes (528 bits)
    [Frame is marked: False]
    [Frame is ignored: False]
    [Protocols in frame: usb]
USB URB
    [Source: 3.3.2]
    [Destination: host]
    URB id: 0xffff89fd4d50d6c0
    URB type: URB_COMPLETE ('C')
    URB transfer type: URB_BULK (0x03)
    Endpoint: 0x82, Direction: IN
        1... .... = Direction: IN (1)
        .... 0010 = Endpoint number: 2
    Device: 3
    URB bus id: 3
    Device setup request: not relevant ('-')
    Data: present (0)
    URB sec: 1530496812
    URB usec: 81226
    URB status: Remote I/O error (-EREMOTEIO) (-121)
    URB length [bytes]: 2
    Data length [bytes]: 2
    [bInterfaceClass: Unknown (0xffff)]
    Unused Setup Header
    Interval: 0
    Start frame: 0
    Copy of Transfer Flags: 0x00000201
    Number of ISO descriptors: 0
Leftover Capture Data: 3103

0000  c0 d6 50 4d fd 89 ff ff 43 03 82 03 03 00 2d 00   ..PM....C.....-.
0010  2c 87 39 5b 00 00 00 00 4a 3d 01 00 87 ff ff ff   ,.9[....J=......
0020  02 00 00 00 02 00 00 00 00 00 00 00 00 00 00 00   ................
0030  00 00 00 00 00 00 00 00 01 02 00 00 00 00 00 00   ................
0040  31 03                                             1.

Frame 105: 66 bytes on wire (528 bits), 66 bytes captured (528 bits) on interface 0
    Interface id: 0 (unknown)
        Interface name: unknown
    Encapsulation type: USB packets with Linux header and padding (115)
    Arrival Time: Jul  1, 2018 22:00:12.417091000 EDT
    [Time shift for this packet: 0.000000000 seconds]
    Epoch Time: 1530496812.417091000 seconds
    [Time delta from previous captured frame: 0.335865000 seconds]
    [Time delta from previous displayed frame: 0.335865000 seconds]
    [Time since reference or first frame: 382.894840000 seconds]
    Frame Number: 105
    Frame Length: 66 bytes (528 bits)
    Capture Length: 66 bytes (528 bits)
    [Frame is marked: False]
    [Frame is ignored: False]
    [Protocols in frame: usb]
USB URB
    [Source: host]
    [Destination: 3.3.1]
    URB id: 0xffff89fd46e3f900
    URB type: URB_SUBMIT ('S')
    URB transfer type: URB_BULK (0x03)
    Endpoint: 0x01, Direction: OUT
        0... .... = Direction: OUT (0)
        .... 0001 = Endpoint number: 1
    Device: 3
    URB bus id: 3
    Device setup request: not relevant ('-')
    Data: present (0)
    URB sec: 1530496812
    URB usec: 417091
    URB status: Operation now in progress (-EINPROGRESS) (-115)
    URB length [bytes]: 2
    Data length [bytes]: 2
    [bInterfaceClass: Unknown (0xffff)]
    Unused Setup Header
    Interval: 0
    Start frame: 0
    Copy of Transfer Flags: 0x00000000
    Number of ISO descriptors: 0
Leftover Capture Data: 1b05

0000  00 f9 e3 46 fd 89 ff ff 53 03 01 03 03 00 2d 00   ...F....S.....-.
0010  2c 87 39 5b 00 00 00 00 43 5d 06 00 8d ff ff ff   ,.9[....C]......
0020  02 00 00 00 02 00 00 00 00 00 00 00 00 00 00 00   ................
0030  00 00 00 00 00 00 00 00 00 00 00 00 00 00 00 00   ................
0040  1b 05                                             ..

Frame 106: 66 bytes on wire (528 bits), 66 bytes captured (528 bits) on interface 0
    Interface id: 0 (unknown)
        Interface name: unknown
    Encapsulation type: USB packets with Linux header and padding (115)
    Arrival Time: Jul  1, 2018 22:00:12.573189000 EDT
    [Time shift for this packet: 0.000000000 seconds]
    Epoch Time: 1530496812.573189000 seconds
    [Time delta from previous captured frame: 0.156098000 seconds]
    [Time delta from previous displayed frame: 0.156098000 seconds]
    [Time since reference or first frame: 383.050938000 seconds]
    Frame Number: 106
    Frame Length: 66 bytes (528 bits)
    Capture Length: 66 bytes (528 bits)
    [Frame is marked: False]
    [Frame is ignored: False]
    [Protocols in frame: usb]
USB URB
    [Source: 3.3.2]
    [Destination: host]
    URB id: 0xffff89fc41ab8a80
    URB type: URB_COMPLETE ('C')
    URB transfer type: URB_BULK (0x03)
    Endpoint: 0x82, Direction: IN
        1... .... = Direction: IN (1)
        .... 0010 = Endpoint number: 2
    Device: 3
    URB bus id: 3
    Device setup request: not relevant ('-')
    Data: present (0)
    URB sec: 1530496812
    URB usec: 573189
    URB status: Remote I/O error (-EREMOTEIO) (-121)
    URB length [bytes]: 2
    Data length [bytes]: 2
    [bInterfaceClass: Unknown (0xffff)]
    Unused Setup Header
    Interval: 0
    Start frame: 0
    Copy of Transfer Flags: 0x00000201
    Number of ISO descriptors: 0
Leftover Capture Data: 3103

0000  80 8a ab 41 fc 89 ff ff 43 03 82 03 03 00 2d 00   ...A....C.....-.
0010  2c 87 39 5b 00 00 00 00 05 bf 08 00 87 ff ff ff   ,.9[............
0020  02 00 00 00 02 00 00 00 00 00 00 00 00 00 00 00   ................
0030  00 00 00 00 00 00 00 00 01 02 00 00 00 00 00 00   ................
0040  31 03                                             1.

Frame 107: 66 bytes on wire (528 bits), 66 bytes captured (528 bits) on interface 0
    Interface id: 0 (unknown)
        Interface name: unknown
    Encapsulation type: USB packets with Linux header and padding (115)
    Arrival Time: Jul  1, 2018 22:00:12.925975000 EDT
    [Time shift for this packet: 0.000000000 seconds]
    Epoch Time: 1530496812.925975000 seconds
    [Time delta from previous captured frame: 0.352786000 seconds]
    [Time delta from previous displayed frame: 0.352786000 seconds]
    [Time since reference or first frame: 383.403724000 seconds]
    Frame Number: 107
    Frame Length: 66 bytes (528 bits)
    Capture Length: 66 bytes (528 bits)
    [Frame is marked: False]
    [Frame is ignored: False]
    [Protocols in frame: usb]
USB URB
    [Source: host]
    [Destination: 3.3.1]
    URB id: 0xffff89fd4d50de40
    URB type: URB_SUBMIT ('S')
    URB transfer type: URB_BULK (0x03)
    Endpoint: 0x01, Direction: OUT
        0... .... = Direction: OUT (0)
        .... 0001 = Endpoint number: 1
    Device: 3
    URB bus id: 3
    Device setup request: not relevant ('-')
    Data: present (0)
    URB sec: 1530496812
    URB usec: 925975
    URB status: Operation now in progress (-EINPROGRESS) (-115)
    URB length [bytes]: 2
    Data length [bytes]: 2
    [bInterfaceClass: Unknown (0xffff)]
    Unused Setup Header
    Interval: 0
    Start frame: 0
    Copy of Transfer Flags: 0x00000000
    Number of ISO descriptors: 0
Leftover Capture Data: 1b05

0000  40 de 50 4d fd 89 ff ff 53 03 01 03 03 00 2d 00   @.PM....S.....-.
0010  2c 87 39 5b 00 00 00 00 17 21 0e 00 8d ff ff ff   ,.9[.....!......
0020  02 00 00 00 02 00 00 00 00 00 00 00 00 00 00 00   ................
0030  00 00 00 00 00 00 00 00 00 00 00 00 00 00 00 00   ................
0040  1b 05                                             ..

Frame 108: 66 bytes on wire (528 bits), 66 bytes captured (528 bits) on interface 0
    Interface id: 0 (unknown)
        Interface name: unknown
    Encapsulation type: USB packets with Linux header and padding (115)
    Arrival Time: Jul  1, 2018 22:00:13.065189000 EDT
    [Time shift for this packet: 0.000000000 seconds]
    Epoch Time: 1530496813.065189000 seconds
    [Time delta from previous captured frame: 0.139214000 seconds]
    [Time delta from previous displayed frame: 0.139214000 seconds]
    [Time since reference or first frame: 383.542938000 seconds]
    Frame Number: 108
    Frame Length: 66 bytes (528 bits)
    Capture Length: 66 bytes (528 bits)
    [Frame is marked: False]
    [Frame is ignored: False]
    [Protocols in frame: usb]
USB URB
    [Source: 3.3.2]
    [Destination: host]
    URB id: 0xffff89fc41ab8780
    URB type: URB_COMPLETE ('C')
    URB transfer type: URB_BULK (0x03)
    Endpoint: 0x82, Direction: IN
        1... .... = Direction: IN (1)
        .... 0010 = Endpoint number: 2
    Device: 3
    URB bus id: 3
    Device setup request: not relevant ('-')
    Data: present (0)
    URB sec: 1530496813
    URB usec: 65189
    URB status: Remote I/O error (-EREMOTEIO) (-121)
    URB length [bytes]: 2
    Data length [bytes]: 2
    [bInterfaceClass: Unknown (0xffff)]
    Unused Setup Header
    Interval: 0
    Start frame: 0
    Copy of Transfer Flags: 0x00000201
    Number of ISO descriptors: 0
Leftover Capture Data: 3103

0000  80 87 ab 41 fc 89 ff ff 43 03 82 03 03 00 2d 00   ...A....C.....-.
0010  2d 87 39 5b 00 00 00 00 a5 fe 00 00 87 ff ff ff   -.9[............
0020  02 00 00 00 02 00 00 00 00 00 00 00 00 00 00 00   ................
0030  00 00 00 00 00 00 00 00 01 02 00 00 00 00 00 00   ................
0040  31 03                                             1.

Frame 109: 66 bytes on wire (528 bits), 66 bytes captured (528 bits) on interface 0
    Interface id: 0 (unknown)
        Interface name: unknown
    Encapsulation type: USB packets with Linux header and padding (115)
    Arrival Time: Jul  1, 2018 22:00:13.454771000 EDT
    [Time shift for this packet: 0.000000000 seconds]
    Epoch Time: 1530496813.454771000 seconds
    [Time delta from previous captured frame: 0.389582000 seconds]
    [Time delta from previous displayed frame: 0.389582000 seconds]
    [Time since reference or first frame: 383.932520000 seconds]
    Frame Number: 109
    Frame Length: 66 bytes (528 bits)
    Capture Length: 66 bytes (528 bits)
    [Frame is marked: False]
    [Frame is ignored: False]
    [Protocols in frame: usb]
USB URB
    [Source: host]
    [Destination: 3.3.1]
    URB id: 0xffff89fd46e3fa80
    URB type: URB_SUBMIT ('S')
    URB transfer type: URB_BULK (0x03)
    Endpoint: 0x01, Direction: OUT
        0... .... = Direction: OUT (0)
        .... 0001 = Endpoint number: 1
    Device: 3
    URB bus id: 3
    Device setup request: not relevant ('-')
    Data: present (0)
    URB sec: 1530496813
    URB usec: 454771
    URB status: Operation now in progress (-EINPROGRESS) (-115)
    URB length [bytes]: 2
    Data length [bytes]: 2
    [bInterfaceClass: Unknown (0xffff)]
    Unused Setup Header
    Interval: 0
    Start frame: 0
    Copy of Transfer Flags: 0x00000000
    Number of ISO descriptors: 0
Leftover Capture Data: 1b05

0000  80 fa e3 46 fd 89 ff ff 53 03 01 03 03 00 2d 00   ...F....S.....-.
0010  2d 87 39 5b 00 00 00 00 73 f0 06 00 8d ff ff ff   -.9[....s.......
0020  02 00 00 00 02 00 00 00 00 00 00 00 00 00 00 00   ................
0030  00 00 00 00 00 00 00 00 00 00 00 00 00 00 00 00   ................
0040  1b 05                                             ..

Frame 110: 66 bytes on wire (528 bits), 66 bytes captured (528 bits) on interface 0
    Interface id: 0 (unknown)
        Interface name: unknown
    Encapsulation type: USB packets with Linux header and padding (115)
    Arrival Time: Jul  1, 2018 22:00:13.557220000 EDT
    [Time shift for this packet: 0.000000000 seconds]
    Epoch Time: 1530496813.557220000 seconds
    [Time delta from previous captured frame: 0.102449000 seconds]
    [Time delta from previous displayed frame: 0.102449000 seconds]
    [Time since reference or first frame: 384.034969000 seconds]
    Frame Number: 110
    Frame Length: 66 bytes (528 bits)
    Capture Length: 66 bytes (528 bits)
    [Frame is marked: False]
    [Frame is ignored: False]
    [Protocols in frame: usb]
USB URB
    [Source: 3.3.2]
    [Destination: host]
    URB id: 0xffff89fd46e3f900
    URB type: URB_COMPLETE ('C')
    URB transfer type: URB_BULK (0x03)
    Endpoint: 0x82, Direction: IN
        1... .... = Direction: IN (1)
        .... 0010 = Endpoint number: 2
    Device: 3
    URB bus id: 3
    Device setup request: not relevant ('-')
    Data: present (0)
    URB sec: 1530496813
    URB usec: 557220
    URB status: Remote I/O error (-EREMOTEIO) (-121)
    URB length [bytes]: 2
    Data length [bytes]: 2
    [bInterfaceClass: Unknown (0xffff)]
    Unused Setup Header
    Interval: 0
    Start frame: 0
    Copy of Transfer Flags: 0x00000201
    Number of ISO descriptors: 0
Leftover Capture Data: 3103

0000  00 f9 e3 46 fd 89 ff ff 43 03 82 03 03 00 2d 00   ...F....C.....-.
0010  2d 87 39 5b 00 00 00 00 a4 80 08 00 87 ff ff ff   -.9[............
0020  02 00 00 00 02 00 00 00 00 00 00 00 00 00 00 00   ................
0030  00 00 00 00 00 00 00 00 01 02 00 00 00 00 00 00   ................
0040  31 03                                             1.

Frame 111: 66 bytes on wire (528 bits), 66 bytes captured (528 bits) on interface 0
    Interface id: 0 (unknown)
        Interface name: unknown
    Encapsulation type: USB packets with Linux header and padding (115)
    Arrival Time: Jul  1, 2018 22:00:13.983743000 EDT
    [Time shift for this packet: 0.000000000 seconds]
    Epoch Time: 1530496813.983743000 seconds
    [Time delta from previous captured frame: 0.426523000 seconds]
    [Time delta from previous displayed frame: 0.426523000 seconds]
    [Time since reference or first frame: 384.461492000 seconds]
    Frame Number: 111
    Frame Length: 66 bytes (528 bits)
    Capture Length: 66 bytes (528 bits)
    [Frame is marked: False]
    [Frame is ignored: False]
    [Protocols in frame: usb]
USB URB
    [Source: host]
    [Destination: 3.3.1]
    URB id: 0xffff89fc41ab8780
    URB type: URB_SUBMIT ('S')
    URB transfer type: URB_BULK (0x03)
    Endpoint: 0x01, Direction: OUT
        0... .... = Direction: OUT (0)
        .... 0001 = Endpoint number: 1
    Device: 3
    URB bus id: 3
    Device setup request: not relevant ('-')
    Data: present (0)
    URB sec: 1530496813
    URB usec: 983743
    URB status: Operation now in progress (-EINPROGRESS) (-115)
    URB length [bytes]: 2
    Data length [bytes]: 2
    [bInterfaceClass: Unknown (0xffff)]
    Unused Setup Header
    Interval: 0
    Start frame: 0
    Copy of Transfer Flags: 0x00000000
    Number of ISO descriptors: 0
Leftover Capture Data: 1b05

0000  80 87 ab 41 fc 89 ff ff 53 03 01 03 03 00 2d 00   ...A....S.....-.
0010  2d 87 39 5b 00 00 00 00 bf 02 0f 00 8d ff ff ff   -.9[............
0020  02 00 00 00 02 00 00 00 00 00 00 00 00 00 00 00   ................
0030  00 00 00 00 00 00 00 00 00 00 00 00 00 00 00 00   ................
0040  1b 05                                             ..

Frame 112: 66 bytes on wire (528 bits), 66 bytes captured (528 bits) on interface 0
    Interface id: 0 (unknown)
        Interface name: unknown
    Encapsulation type: USB packets with Linux header and padding (115)
    Arrival Time: Jul  1, 2018 22:00:14.131243000 EDT
    [Time shift for this packet: 0.000000000 seconds]
    Epoch Time: 1530496814.131243000 seconds
    [Time delta from previous captured frame: 0.147500000 seconds]
    [Time delta from previous displayed frame: 0.147500000 seconds]
    [Time since reference or first frame: 384.608992000 seconds]
    Frame Number: 112
    Frame Length: 66 bytes (528 bits)
    Capture Length: 66 bytes (528 bits)
    [Frame is marked: False]
    [Frame is ignored: False]
    [Protocols in frame: usb]
USB URB
    [Source: 3.3.2]
    [Destination: host]
    URB id: 0xffff89fd46e3f900
    URB type: URB_COMPLETE ('C')
    URB transfer type: URB_BULK (0x03)
    Endpoint: 0x82, Direction: IN
        1... .... = Direction: IN (1)
        .... 0010 = Endpoint number: 2
    Device: 3
    URB bus id: 3
    Device setup request: not relevant ('-')
    Data: present (0)
    URB sec: 1530496814
    URB usec: 131243
    URB status: Remote I/O error (-EREMOTEIO) (-121)
    URB length [bytes]: 2
    Data length [bytes]: 2
    [bInterfaceClass: Unknown (0xffff)]
    Unused Setup Header
    Interval: 0
    Start frame: 0
    Copy of Transfer Flags: 0x00000201
    Number of ISO descriptors: 0
Leftover Capture Data: 3003

0000  00 f9 e3 46 fd 89 ff ff 43 03 82 03 03 00 2d 00   ...F....C.....-.
0010  2e 87 39 5b 00 00 00 00 ab 00 02 00 87 ff ff ff   ..9[............
0020  02 00 00 00 02 00 00 00 00 00 00 00 00 00 00 00   ................
0030  00 00 00 00 00 00 00 00 01 02 00 00 00 00 00 00   ................
0040  30 03                                             0.

Frame 113: 66 bytes on wire (528 bits), 66 bytes captured (528 bits) on interface 0
    Interface id: 0 (unknown)
        Interface name: unknown
    Encapsulation type: USB packets with Linux header and padding (115)
    Arrival Time: Jul  1, 2018 22:00:14.459074000 EDT
    [Time shift for this packet: 0.000000000 seconds]
    Epoch Time: 1530496814.459074000 seconds
    [Time delta from previous captured frame: 0.327831000 seconds]
    [Time delta from previous displayed frame: 0.327831000 seconds]
    [Time since reference or first frame: 384.936823000 seconds]
    Frame Number: 113
    Frame Length: 66 bytes (528 bits)
    Capture Length: 66 bytes (528 bits)
    [Frame is marked: False]
    [Frame is ignored: False]
    [Protocols in frame: usb]
USB URB
    [Source: host]
    [Destination: 3.3.1]
    URB id: 0xffff89fd4d50dcc0
    URB type: URB_SUBMIT ('S')
    URB transfer type: URB_BULK (0x03)
    Endpoint: 0x01, Direction: OUT
        0... .... = Direction: OUT (0)
        .... 0001 = Endpoint number: 1
    Device: 3
    URB bus id: 3
    Device setup request: not relevant ('-')
    Data: present (0)
    URB sec: 1530496814
    URB usec: 459074
    URB status: Operation now in progress (-EINPROGRESS) (-115)
    URB length [bytes]: 2
    Data length [bytes]: 2
    [bInterfaceClass: Unknown (0xffff)]
    Unused Setup Header
    Interval: 0
    Start frame: 0
    Copy of Transfer Flags: 0x00000000
    Number of ISO descriptors: 0
Leftover Capture Data: 1b05

0000  c0 dc 50 4d fd 89 ff ff 53 03 01 03 03 00 2d 00   ..PM....S.....-.
0010  2e 87 39 5b 00 00 00 00 42 01 07 00 8d ff ff ff   ..9[....B.......
0020  02 00 00 00 02 00 00 00 00 00 00 00 00 00 00 00   ................
0030  00 00 00 00 00 00 00 00 00 00 00 00 00 00 00 00   ................
0040  1b 05                                             ..

Frame 114: 66 bytes on wire (528 bits), 66 bytes captured (528 bits) on interface 0
    Interface id: 0 (unknown)
        Interface name: unknown
    Encapsulation type: USB packets with Linux header and padding (115)
    Arrival Time: Jul  1, 2018 22:00:14.541239000 EDT
    [Time shift for this packet: 0.000000000 seconds]
    Epoch Time: 1530496814.541239000 seconds
    [Time delta from previous captured frame: 0.082165000 seconds]
    [Time delta from previous displayed frame: 0.082165000 seconds]
    [Time since reference or first frame: 385.018988000 seconds]
    Frame Number: 114
    Frame Length: 66 bytes (528 bits)
    Capture Length: 66 bytes (528 bits)
    [Frame is marked: False]
    [Frame is ignored: False]
    [Protocols in frame: usb]
USB URB
    [Source: 3.3.2]
    [Destination: host]
    URB id: 0xffff89fd4d50dd80
    URB type: URB_COMPLETE ('C')
    URB transfer type: URB_BULK (0x03)
    Endpoint: 0x82, Direction: IN
        1... .... = Direction: IN (1)
        .... 0010 = Endpoint number: 2
    Device: 3
    URB bus id: 3
    Device setup request: not relevant ('-')
    Data: present (0)
    URB sec: 1530496814
    URB usec: 541239
    URB status: Remote I/O error (-EREMOTEIO) (-121)
    URB length [bytes]: 2
    Data length [bytes]: 2
    [bInterfaceClass: Unknown (0xffff)]
    Unused Setup Header
    Interval: 0
    Start frame: 0
    Copy of Transfer Flags: 0x00000201
    Number of ISO descriptors: 0
Leftover Capture Data: 3003

0000  80 dd 50 4d fd 89 ff ff 43 03 82 03 03 00 2d 00   ..PM....C.....-.
0010  2e 87 39 5b 00 00 00 00 37 42 08 00 87 ff ff ff   ..9[....7B......
0020  02 00 00 00 02 00 00 00 00 00 00 00 00 00 00 00   ................
0030  00 00 00 00 00 00 00 00 01 02 00 00 00 00 00 00   ................
0040  30 03                                             0.

Frame 115: 66 bytes on wire (528 bits), 66 bytes captured (528 bits) on interface 0
    Interface id: 0 (unknown)
        Interface name: unknown
    Encapsulation type: USB packets with Linux header and padding (115)
    Arrival Time: Jul  1, 2018 22:00:14.926218000 EDT
    [Time shift for this packet: 0.000000000 seconds]
    Epoch Time: 1530496814.926218000 seconds
    [Time delta from previous captured frame: 0.384979000 seconds]
    [Time delta from previous displayed frame: 0.384979000 seconds]
    [Time since reference or first frame: 385.403967000 seconds]
    Frame Number: 115
    Frame Length: 66 bytes (528 bits)
    Capture Length: 66 bytes (528 bits)
    [Frame is marked: False]
    [Frame is ignored: False]
    [Protocols in frame: usb]
USB URB
    [Source: host]
    [Destination: 3.3.1]
    URB id: 0xffff89fc41ab8e40
    URB type: URB_SUBMIT ('S')
    URB transfer type: URB_BULK (0x03)
    Endpoint: 0x01, Direction: OUT
        0... .... = Direction: OUT (0)
        .... 0001 = Endpoint number: 1
    Device: 3
    URB bus id: 3
    Device setup request: not relevant ('-')
    Data: present (0)
    URB sec: 1530496814
    URB usec: 926218
    URB status: Operation now in progress (-EINPROGRESS) (-115)
    URB length [bytes]: 2
    Data length [bytes]: 2
    [bInterfaceClass: Unknown (0xffff)]
    Unused Setup Header
    Interval: 0
    Start frame: 0
    Copy of Transfer Flags: 0x00000000
    Number of ISO descriptors: 0
Leftover Capture Data: 1b05

0000  40 8e ab 41 fc 89 ff ff 53 03 01 03 03 00 2d 00   @..A....S.....-.
0010  2e 87 39 5b 00 00 00 00 0a 22 0e 00 8d ff ff ff   ..9[....."......
0020  02 00 00 00 02 00 00 00 00 00 00 00 00 00 00 00   ................
0030  00 00 00 00 00 00 00 00 00 00 00 00 00 00 00 00   ................
0040  1b 05                                             ..

Frame 116: 66 bytes on wire (528 bits), 66 bytes captured (528 bits) on interface 0
    Interface id: 0 (unknown)
        Interface name: unknown
    Encapsulation type: USB packets with Linux header and padding (115)
    Arrival Time: Jul  1, 2018 22:00:15.033188000 EDT
    [Time shift for this packet: 0.000000000 seconds]
    Epoch Time: 1530496815.033188000 seconds
    [Time delta from previous captured frame: 0.106970000 seconds]
    [Time delta from previous displayed frame: 0.106970000 seconds]
    [Time since reference or first frame: 385.510937000 seconds]
    Frame Number: 116
    Frame Length: 66 bytes (528 bits)
    Capture Length: 66 bytes (528 bits)
    [Frame is marked: False]
    [Frame is ignored: False]
    [Protocols in frame: usb]
USB URB
    [Source: 3.3.2]
    [Destination: host]
    URB id: 0xffff89fc41ab8f00
    URB type: URB_COMPLETE ('C')
    URB transfer type: URB_BULK (0x03)
    Endpoint: 0x82, Direction: IN
        1... .... = Direction: IN (1)
        .... 0010 = Endpoint number: 2
    Device: 3
    URB bus id: 3
    Device setup request: not relevant ('-')
    Data: present (0)
    URB sec: 1530496815
    URB usec: 33188
    URB status: Remote I/O error (-EREMOTEIO) (-121)
    URB length [bytes]: 2
    Data length [bytes]: 2
    [bInterfaceClass: Unknown (0xffff)]
    Unused Setup Header
    Interval: 0
    Start frame: 0
    Copy of Transfer Flags: 0x00000201
    Number of ISO descriptors: 0
Leftover Capture Data: 3003

0000  00 8f ab 41 fc 89 ff ff 43 03 82 03 03 00 2d 00   ...A....C.....-.
0010  2f 87 39 5b 00 00 00 00 a4 81 00 00 87 ff ff ff   /.9[............
0020  02 00 00 00 02 00 00 00 00 00 00 00 00 00 00 00   ................
0030  00 00 00 00 00 00 00 00 01 02 00 00 00 00 00 00   ................
0040  30 03                                             0.

Frame 117: 91 bytes on wire (728 bits), 91 bytes captured (728 bits) on interface 0
    Interface id: 0 (unknown)
        Interface name: unknown
    Encapsulation type: USB packets with Linux header and padding (115)
    Arrival Time: Jul  1, 2018 22:00:15.401312000 EDT
    [Time shift for this packet: 0.000000000 seconds]
    Epoch Time: 1530496815.401312000 seconds
    [Time delta from previous captured frame: 0.368124000 seconds]
    [Time delta from previous displayed frame: 0.368124000 seconds]
    [Time since reference or first frame: 385.879061000 seconds]
    Frame Number: 117
    Frame Length: 91 bytes (728 bits)
    Capture Length: 91 bytes (728 bits)
    [Frame is marked: False]
    [Frame is ignored: False]
    [Protocols in frame: usb]
USB URB
    [Source: host]
    [Destination: 3.3.1]
    URB id: 0xffff89fc41ab8840
    URB type: URB_SUBMIT ('S')
    URB transfer type: URB_BULK (0x03)
    Endpoint: 0x01, Direction: OUT
        0... .... = Direction: OUT (0)
        .... 0001 = Endpoint number: 1
    Device: 3
    URB bus id: 3
    Device setup request: not relevant ('-')
    Data: present (0)
    URB sec: 1530496815
    URB usec: 401312
    URB status: Operation now in progress (-EINPROGRESS) (-115)
    URB length [bytes]: 27
    Data length [bytes]: 27
    [bInterfaceClass: Unknown (0xffff)]
    Unused Setup Header
    Interval: 0
    Start frame: 0
    Copy of Transfer Flags: 0x00000000
    Number of ISO descriptors: 0
Leftover Capture Data: 4c30035c302c30034d302c30034a3003464e300354423530...

0000  40 88 ab 41 fc 89 ff ff 53 03 01 03 03 00 2d 00   @..A....S.....-.
0010  2f 87 39 5b 00 00 00 00 a0 1f 06 00 8d ff ff ff   /.9[............
0020  1b 00 00 00 1b 00 00 00 00 00 00 00 00 00 00 00   ................
0030  00 00 00 00 00 00 00 00 00 00 00 00 00 00 00 00   ................
0040  4c 30 03 5c 30 2c 30 03 4d 30 2c 30 03 4a 30 03   L0.\0,0.M0,0.J0.
0050  46 4e 30 03 54 42 35 30 2c 30 03                  FN0.TB50,0.

Frame 118: 66 bytes on wire (528 bits), 66 bytes captured (528 bits) on interface 0
    Interface id: 0 (unknown)
        Interface name: unknown
    Encapsulation type: USB packets with Linux header and padding (115)
    Arrival Time: Jul  1, 2018 22:00:15.669204000 EDT
    [Time shift for this packet: 0.000000000 seconds]
    Epoch Time: 1530496815.669204000 seconds
    [Time delta from previous captured frame: 0.267892000 seconds]
    [Time delta from previous displayed frame: 0.267892000 seconds]
    [Time since reference or first frame: 386.146953000 seconds]
    Frame Number: 118
    Frame Length: 66 bytes (528 bits)
    Capture Length: 66 bytes (528 bits)
    [Frame is marked: False]
    [Frame is ignored: False]
    [Protocols in frame: usb]
USB URB
    [Source: host]
    [Destination: 3.3.1]
    URB id: 0xffff89fd46e3fa80
    URB type: URB_SUBMIT ('S')
    URB transfer type: URB_BULK (0x03)
    Endpoint: 0x01, Direction: OUT
        0... .... = Direction: OUT (0)
        .... 0001 = Endpoint number: 1
    Device: 3
    URB bus id: 3
    Device setup request: not relevant ('-')
    Data: present (0)
    URB sec: 1530496815
    URB usec: 669204
    URB status: Operation now in progress (-EINPROGRESS) (-115)
    URB length [bytes]: 2
    Data length [bytes]: 2
    [bInterfaceClass: Unknown (0xffff)]
    Unused Setup Header
    Interval: 0
    Start frame: 0
    Copy of Transfer Flags: 0x00000000
    Number of ISO descriptors: 0
Leftover Capture Data: 1b05

0000  80 fa e3 46 fd 89 ff ff 53 03 01 03 03 00 2d 00   ...F....S.....-.
0010  2f 87 39 5b 00 00 00 00 14 36 0a 00 8d ff ff ff   /.9[.....6......
0020  02 00 00 00 02 00 00 00 00 00 00 00 00 00 00 00   ................
0030  00 00 00 00 00 00 00 00 00 00 00 00 00 00 00 00   ................
0040  1b 05                                             ..

Frame 119: 66 bytes on wire (528 bits), 66 bytes captured (528 bits) on interface 0
    Interface id: 0 (unknown)
        Interface name: unknown
    Encapsulation type: USB packets with Linux header and padding (115)
    Arrival Time: Jul  1, 2018 22:00:15.771192000 EDT
    [Time shift for this packet: 0.000000000 seconds]
    Epoch Time: 1530496815.771192000 seconds
    [Time delta from previous captured frame: 0.101988000 seconds]
    [Time delta from previous displayed frame: 0.101988000 seconds]
    [Time since reference or first frame: 386.248941000 seconds]
    Frame Number: 119
    Frame Length: 66 bytes (528 bits)
    Capture Length: 66 bytes (528 bits)
    [Frame is marked: False]
    [Frame is ignored: False]
    [Protocols in frame: usb]
USB URB
    [Source: 3.3.2]
    [Destination: host]
    URB id: 0xffff89fd46e3f900
    URB type: URB_COMPLETE ('C')
    URB transfer type: URB_BULK (0x03)
    Endpoint: 0x82, Direction: IN
        1... .... = Direction: IN (1)
        .... 0010 = Endpoint number: 2
    Device: 3
    URB bus id: 3
    Device setup request: not relevant ('-')
    Data: present (0)
    URB sec: 1530496815
    URB usec: 771192
    URB status: Remote I/O error (-EREMOTEIO) (-121)
    URB length [bytes]: 2
    Data length [bytes]: 2
    [bInterfaceClass: Unknown (0xffff)]
    Unused Setup Header
    Interval: 0
    Start frame: 0
    Copy of Transfer Flags: 0x00000201
    Number of ISO descriptors: 0
Leftover Capture Data: 3103

0000  00 f9 e3 46 fd 89 ff ff 43 03 82 03 03 00 2d 00   ...F....C.....-.
0010  2f 87 39 5b 00 00 00 00 78 c4 0b 00 87 ff ff ff   /.9[....x.......
0020  02 00 00 00 02 00 00 00 00 00 00 00 00 00 00 00   ................
0030  00 00 00 00 00 00 00 00 01 02 00 00 00 00 00 00   ................
0040  31 03                                             1.

Frame 120: 66 bytes on wire (528 bits), 66 bytes captured (528 bits) on interface 0
    Interface id: 0 (unknown)
        Interface name: unknown
    Encapsulation type: USB packets with Linux header and padding (115)
    Arrival Time: Jul  1, 2018 22:00:16.153484000 EDT
    [Time shift for this packet: 0.000000000 seconds]
    Epoch Time: 1530496816.153484000 seconds
    [Time delta from previous captured frame: 0.382292000 seconds]
    [Time delta from previous displayed frame: 0.382292000 seconds]
    [Time since reference or first frame: 386.631233000 seconds]
    Frame Number: 120
    Frame Length: 66 bytes (528 bits)
    Capture Length: 66 bytes (528 bits)
    [Frame is marked: False]
    [Frame is ignored: False]
    [Protocols in frame: usb]
USB URB
    [Source: host]
    [Destination: 3.3.1]
    URB id: 0xffff89fc41ab8540
    URB type: URB_SUBMIT ('S')
    URB transfer type: URB_BULK (0x03)
    Endpoint: 0x01, Direction: OUT
        0... .... = Direction: OUT (0)
        .... 0001 = Endpoint number: 1
    Device: 3
    URB bus id: 3
    Device setup request: not relevant ('-')
    Data: present (0)
    URB sec: 1530496816
    URB usec: 153484
    URB status: Operation now in progress (-EINPROGRESS) (-115)
    URB length [bytes]: 2
    Data length [bytes]: 2
    [bInterfaceClass: Unknown (0xffff)]
    Unused Setup Header
    Interval: 0
    Start frame: 0
    Copy of Transfer Flags: 0x00000000
    Number of ISO descriptors: 0
Leftover Capture Data: 1b05

0000  40 85 ab 41 fc 89 ff ff 53 03 01 03 03 00 2d 00   @..A....S.....-.
0010  30 87 39 5b 00 00 00 00 8c 57 02 00 8d ff ff ff   0.9[.....W......
0020  02 00 00 00 02 00 00 00 00 00 00 00 00 00 00 00   ................
0030  00 00 00 00 00 00 00 00 00 00 00 00 00 00 00 00   ................
0040  1b 05                                             ..

Frame 121: 66 bytes on wire (528 bits), 66 bytes captured (528 bits) on interface 0
    Interface id: 0 (unknown)
        Interface name: unknown
    Encapsulation type: USB packets with Linux header and padding (115)
    Arrival Time: Jul  1, 2018 22:00:16.263210000 EDT
    [Time shift for this packet: 0.000000000 seconds]
    Epoch Time: 1530496816.263210000 seconds
    [Time delta from previous captured frame: 0.109726000 seconds]
    [Time delta from previous displayed frame: 0.109726000 seconds]
    [Time since reference or first frame: 386.740959000 seconds]
    Frame Number: 121
    Frame Length: 66 bytes (528 bits)
    Capture Length: 66 bytes (528 bits)
    [Frame is marked: False]
    [Frame is ignored: False]
    [Protocols in frame: usb]
USB URB
    [Source: 3.3.2]
    [Destination: host]
    URB id: 0xffff89fd4d50dd80
    URB type: URB_COMPLETE ('C')
    URB transfer type: URB_BULK (0x03)
    Endpoint: 0x82, Direction: IN
        1... .... = Direction: IN (1)
        .... 0010 = Endpoint number: 2
    Device: 3
    URB bus id: 3
    Device setup request: not relevant ('-')
    Data: present (0)
    URB sec: 1530496816
    URB usec: 263210
    URB status: Remote I/O error (-EREMOTEIO) (-121)
    URB length [bytes]: 2
    Data length [bytes]: 2
    [bInterfaceClass: Unknown (0xffff)]
    Unused Setup Header
    Interval: 0
    Start frame: 0
    Copy of Transfer Flags: 0x00000201
    Number of ISO descriptors: 0
Leftover Capture Data: 3103

0000  80 dd 50 4d fd 89 ff ff 43 03 82 03 03 00 2d 00   ..PM....C.....-.
0010  30 87 39 5b 00 00 00 00 2a 04 04 00 87 ff ff ff   0.9[....*.......
0020  02 00 00 00 02 00 00 00 00 00 00 00 00 00 00 00   ................
0030  00 00 00 00 00 00 00 00 01 02 00 00 00 00 00 00   ................
0040  31 03                                             1.

Frame 122: 66 bytes on wire (528 bits), 66 bytes captured (528 bits) on interface 0
    Interface id: 0 (unknown)
        Interface name: unknown
    Encapsulation type: USB packets with Linux header and padding (115)
    Arrival Time: Jul  1, 2018 22:00:16.682439000 EDT
    [Time shift for this packet: 0.000000000 seconds]
    Epoch Time: 1530496816.682439000 seconds
    [Time delta from previous captured frame: 0.419229000 seconds]
    [Time delta from previous displayed frame: 0.419229000 seconds]
    [Time since reference or first frame: 387.160188000 seconds]
    Frame Number: 122
    Frame Length: 66 bytes (528 bits)
    Capture Length: 66 bytes (528 bits)
    [Frame is marked: False]
    [Frame is ignored: False]
    [Protocols in frame: usb]
USB URB
    [Source: host]
    [Destination: 3.3.1]
    URB id: 0xffff89fc41ab8c00
    URB type: URB_SUBMIT ('S')
    URB transfer type: URB_BULK (0x03)
    Endpoint: 0x01, Direction: OUT
        0... .... = Direction: OUT (0)
        .... 0001 = Endpoint number: 1
    Device: 3
    URB bus id: 3
    Device setup request: not relevant ('-')
    Data: present (0)
    URB sec: 1530496816
    URB usec: 682439
    URB status: Operation now in progress (-EINPROGRESS) (-115)
    URB length [bytes]: 2
    Data length [bytes]: 2
    [bInterfaceClass: Unknown (0xffff)]
    Unused Setup Header
    Interval: 0
    Start frame: 0
    Copy of Transfer Flags: 0x00000000
    Number of ISO descriptors: 0
Leftover Capture Data: 1b05

0000  00 8c ab 41 fc 89 ff ff 53 03 01 03 03 00 2d 00   ...A....S.....-.
0010  30 87 39 5b 00 00 00 00 c7 69 0a 00 8d ff ff ff   0.9[.....i......
0020  02 00 00 00 02 00 00 00 00 00 00 00 00 00 00 00   ................
0030  00 00 00 00 00 00 00 00 00 00 00 00 00 00 00 00   ................
0040  1b 05                                             ..

Frame 123: 66 bytes on wire (528 bits), 66 bytes captured (528 bits) on interface 0
    Interface id: 0 (unknown)
        Interface name: unknown
    Encapsulation type: USB packets with Linux header and padding (115)
    Arrival Time: Jul  1, 2018 22:00:16.837231000 EDT
    [Time shift for this packet: 0.000000000 seconds]
    Epoch Time: 1530496816.837231000 seconds
    [Time delta from previous captured frame: 0.154792000 seconds]
    [Time delta from previous displayed frame: 0.154792000 seconds]
    [Time since reference or first frame: 387.314980000 seconds]
    Frame Number: 123
    Frame Length: 66 bytes (528 bits)
    Capture Length: 66 bytes (528 bits)
    [Frame is marked: False]
    [Frame is ignored: False]
    [Protocols in frame: usb]
USB URB
    [Source: 3.3.2]
    [Destination: host]
    URB id: 0xffff89fc41ab89c0
    URB type: URB_COMPLETE ('C')
    URB transfer type: URB_BULK (0x03)
    Endpoint: 0x82, Direction: IN
        1... .... = Direction: IN (1)
        .... 0010 = Endpoint number: 2
    Device: 3
    URB bus id: 3
    Device setup request: not relevant ('-')
    Data: present (0)
    URB sec: 1530496816
    URB usec: 837231
    URB status: Remote I/O error (-EREMOTEIO) (-121)
    URB length [bytes]: 2
    Data length [bytes]: 2
    [bInterfaceClass: Unknown (0xffff)]
    Unused Setup Header
    Interval: 0
    Start frame: 0
    Copy of Transfer Flags: 0x00000201
    Number of ISO descriptors: 0
Leftover Capture Data: 3003

0000  c0 89 ab 41 fc 89 ff ff 43 03 82 03 03 00 2d 00   ...A....C.....-.
0010  30 87 39 5b 00 00 00 00 6f c6 0c 00 87 ff ff ff   0.9[....o.......
0020  02 00 00 00 02 00 00 00 00 00 00 00 00 00 00 00   ................
0030  00 00 00 00 00 00 00 00 01 02 00 00 00 00 00 00   ................
0040  30 03                                             0.

Frame 124: 66 bytes on wire (528 bits), 66 bytes captured (528 bits) on interface 0
    Interface id: 0 (unknown)
        Interface name: unknown
    Encapsulation type: USB packets with Linux header and padding (115)
    Arrival Time: Jul  1, 2018 22:00:17.291490000 EDT
    [Time shift for this packet: 0.000000000 seconds]
    Epoch Time: 1530496817.291490000 seconds
    [Time delta from previous captured frame: 0.454259000 seconds]
    [Time delta from previous displayed frame: 0.454259000 seconds]
    [Time since reference or first frame: 387.769239000 seconds]
    Frame Number: 124
    Frame Length: 66 bytes (528 bits)
    Capture Length: 66 bytes (528 bits)
    [Frame is marked: False]
    [Frame is ignored: False]
    [Protocols in frame: usb]
USB URB
    [Source: host]
    [Destination: 3.3.1]
    URB id: 0xffff89fd4d50dcc0
    URB type: URB_SUBMIT ('S')
    URB transfer type: URB_BULK (0x03)
    Endpoint: 0x01, Direction: OUT
        0... .... = Direction: OUT (0)
        .... 0001 = Endpoint number: 1
    Device: 3
    URB bus id: 3
    Device setup request: not relevant ('-')
    Data: present (0)
    URB sec: 1530496817
    URB usec: 291490
    URB status: Operation now in progress (-EINPROGRESS) (-115)
    URB length [bytes]: 2
    Data length [bytes]: 2
    [bInterfaceClass: Unknown (0xffff)]
    Unused Setup Header
    Interval: 0
    Start frame: 0
    Copy of Transfer Flags: 0x00000000
    Number of ISO descriptors: 0
Leftover Capture Data: 1b05

0000  c0 dc 50 4d fd 89 ff ff 53 03 01 03 03 00 2d 00   ..PM....S.....-.
0010  31 87 39 5b 00 00 00 00 a2 72 04 00 8d ff ff ff   1.9[.....r......
0020  02 00 00 00 02 00 00 00 00 00 00 00 00 00 00 00   ................
0030  00 00 00 00 00 00 00 00 00 00 00 00 00 00 00 00   ................
0040  1b 05                                             ..

Frame 125: 66 bytes on wire (528 bits), 66 bytes captured (528 bits) on interface 0
    Interface id: 0 (unknown)
        Interface name: unknown
    Encapsulation type: USB packets with Linux header and padding (115)
    Arrival Time: Jul  1, 2018 22:00:17.411257000 EDT
    [Time shift for this packet: 0.000000000 seconds]
    Epoch Time: 1530496817.411257000 seconds
    [Time delta from previous captured frame: 0.119767000 seconds]
    [Time delta from previous displayed frame: 0.119767000 seconds]
    [Time since reference or first frame: 387.889006000 seconds]
    Frame Number: 125
    Frame Length: 66 bytes (528 bits)
    Capture Length: 66 bytes (528 bits)
    [Frame is marked: False]
    [Frame is ignored: False]
    [Protocols in frame: usb]
USB URB
    [Source: 3.3.2]
    [Destination: host]
    URB id: 0xffff89fc41ab8c00
    URB type: URB_COMPLETE ('C')
    URB transfer type: URB_BULK (0x03)
    Endpoint: 0x82, Direction: IN
        1... .... = Direction: IN (1)
        .... 0010 = Endpoint number: 2
    Device: 3
    URB bus id: 3
    Device setup request: not relevant ('-')
    Data: present (0)
    URB sec: 1530496817
    URB usec: 411257
    URB status: Remote I/O error (-EREMOTEIO) (-121)
    URB length [bytes]: 2
    Data length [bytes]: 2
    [bInterfaceClass: Unknown (0xffff)]
    Unused Setup Header
    Interval: 0
    Start frame: 0
    Copy of Transfer Flags: 0x00000201
    Number of ISO descriptors: 0
Leftover Capture Data: 3003

0000  00 8c ab 41 fc 89 ff ff 43 03 82 03 03 00 2d 00   ...A....C.....-.
0010  31 87 39 5b 00 00 00 00 79 46 06 00 87 ff ff ff   1.9[....yF......
0020  02 00 00 00 02 00 00 00 00 00 00 00 00 00 00 00   ................
0030  00 00 00 00 00 00 00 00 01 02 00 00 00 00 00 00   ................
0040  30 03                                             0.

Frame 126: 66 bytes on wire (528 bits), 66 bytes captured (528 bits) on interface 0
    Interface id: 0 (unknown)
        Interface name: unknown
    Encapsulation type: USB packets with Linux header and padding (115)
    Arrival Time: Jul  1, 2018 22:00:17.719653000 EDT
    [Time shift for this packet: 0.000000000 seconds]
    Epoch Time: 1530496817.719653000 seconds
    [Time delta from previous captured frame: 0.308396000 seconds]
    [Time delta from previous displayed frame: 0.308396000 seconds]
    [Time since reference or first frame: 388.197402000 seconds]
    Frame Number: 126
    Frame Length: 66 bytes (528 bits)
    Capture Length: 66 bytes (528 bits)
    [Frame is marked: False]
    [Frame is ignored: False]
    [Protocols in frame: usb]
USB URB
    [Source: host]
    [Destination: 3.3.1]
    URB id: 0xffff89fd46e3fa80
    URB type: URB_SUBMIT ('S')
    URB transfer type: URB_BULK (0x03)
    Endpoint: 0x01, Direction: OUT
        0... .... = Direction: OUT (0)
        .... 0001 = Endpoint number: 1
    Device: 3
    URB bus id: 3
    Device setup request: not relevant ('-')
    Data: present (0)
    URB sec: 1530496817
    URB usec: 719653
    URB status: Operation now in progress (-EINPROGRESS) (-115)
    URB length [bytes]: 2
    Data length [bytes]: 2
    [bInterfaceClass: Unknown (0xffff)]
    Unused Setup Header
    Interval: 0
    Start frame: 0
    Copy of Transfer Flags: 0x00000000
    Number of ISO descriptors: 0
Leftover Capture Data: 1b05

0000  80 fa e3 46 fd 89 ff ff 53 03 01 03 03 00 2d 00   ...F....S.....-.
0010  31 87 39 5b 00 00 00 00 25 fb 0a 00 8d ff ff ff   1.9[....%.......
0020  02 00 00 00 02 00 00 00 00 00 00 00 00 00 00 00   ................
0030  00 00 00 00 00 00 00 00 00 00 00 00 00 00 00 00   ................
0040  1b 05                                             ..

Frame 127: 66 bytes on wire (528 bits), 66 bytes captured (528 bits) on interface 0
    Interface id: 0 (unknown)
        Interface name: unknown
    Encapsulation type: USB packets with Linux header and padding (115)
    Arrival Time: Jul  1, 2018 22:00:17.821205000 EDT
    [Time shift for this packet: 0.000000000 seconds]
    Epoch Time: 1530496817.821205000 seconds
    [Time delta from previous captured frame: 0.101552000 seconds]
    [Time delta from previous displayed frame: 0.101552000 seconds]
    [Time since reference or first frame: 388.298954000 seconds]
    Frame Number: 127
    Frame Length: 66 bytes (528 bits)
    Capture Length: 66 bytes (528 bits)
    [Frame is marked: False]
    [Frame is ignored: False]
    [Protocols in frame: usb]
USB URB
    [Source: 3.3.2]
    [Destination: host]
    URB id: 0xffff89fd46e3f900
    URB type: URB_COMPLETE ('C')
    URB transfer type: URB_BULK (0x03)
    Endpoint: 0x82, Direction: IN
        1... .... = Direction: IN (1)
        .... 0010 = Endpoint number: 2
    Device: 3
    URB bus id: 3
    Device setup request: not relevant ('-')
    Data: present (0)
    URB sec: 1530496817
    URB usec: 821205
    URB status: Remote I/O error (-EREMOTEIO) (-121)
    URB length [bytes]: 2
    Data length [bytes]: 2
    [bInterfaceClass: Unknown (0xffff)]
    Unused Setup Header
    Interval: 0
    Start frame: 0
    Copy of Transfer Flags: 0x00000201
    Number of ISO descriptors: 0
Leftover Capture Data: 3003

0000  00 f9 e3 46 fd 89 ff ff 43 03 82 03 03 00 2d 00   ...F....C.....-.
0010  31 87 39 5b 00 00 00 00 d5 87 0c 00 87 ff ff ff   1.9[............
0020  02 00 00 00 02 00 00 00 00 00 00 00 00 00 00 00   ................
0030  00 00 00 00 00 00 00 00 01 02 00 00 00 00 00 00   ................
0040  30 03                                             0.

Frame 128: 66 bytes on wire (528 bits), 66 bytes captured (528 bits) on interface 0
    Interface id: 0 (unknown)
        Interface name: unknown
    Encapsulation type: USB packets with Linux header and padding (115)
    Arrival Time: Jul  1, 2018 22:00:18.328497000 EDT
    [Time shift for this packet: 0.000000000 seconds]
    Epoch Time: 1530496818.328497000 seconds
    [Time delta from previous captured frame: 0.507292000 seconds]
    [Time delta from previous displayed frame: 0.507292000 seconds]
    [Time since reference or first frame: 388.806246000 seconds]
    Frame Number: 128
    Frame Length: 66 bytes (528 bits)
    Capture Length: 66 bytes (528 bits)
    [Frame is marked: False]
    [Frame is ignored: False]
    [Protocols in frame: usb]
USB URB
    [Source: host]
    [Destination: 3.3.1]
    URB id: 0xffff89fd4d50dcc0
    URB type: URB_SUBMIT ('S')
    URB transfer type: URB_BULK (0x03)
    Endpoint: 0x01, Direction: OUT
        0... .... = Direction: OUT (0)
        .... 0001 = Endpoint number: 1
    Device: 3
    URB bus id: 3
    Device setup request: not relevant ('-')
    Data: present (0)
    URB sec: 1530496818
    URB usec: 328497
    URB status: Operation now in progress (-EINPROGRESS) (-115)
    URB length [bytes]: 2
    Data length [bytes]: 2
    [bInterfaceClass: Unknown (0xffff)]
    Unused Setup Header
    Interval: 0
    Start frame: 0
    Copy of Transfer Flags: 0x00000000
    Number of ISO descriptors: 0
Leftover Capture Data: 1b05

0000  c0 dc 50 4d fd 89 ff ff 53 03 01 03 03 00 2d 00   ..PM....S.....-.
0010  32 87 39 5b 00 00 00 00 31 03 05 00 8d ff ff ff   2.9[....1.......
0020  02 00 00 00 02 00 00 00 00 00 00 00 00 00 00 00   ................
0030  00 00 00 00 00 00 00 00 00 00 00 00 00 00 00 00   ................
0040  1b 05                                             ..

Frame 129: 66 bytes on wire (528 bits), 66 bytes captured (528 bits) on interface 0
    Interface id: 0 (unknown)
        Interface name: unknown
    Encapsulation type: USB packets with Linux header and padding (115)
    Arrival Time: Jul  1, 2018 22:00:18.477182000 EDT
    [Time shift for this packet: 0.000000000 seconds]
    Epoch Time: 1530496818.477182000 seconds
    [Time delta from previous captured frame: 0.148685000 seconds]
    [Time delta from previous displayed frame: 0.148685000 seconds]
    [Time since reference or first frame: 388.954931000 seconds]
    Frame Number: 129
    Frame Length: 66 bytes (528 bits)
    Capture Length: 66 bytes (528 bits)
    [Frame is marked: False]
    [Frame is ignored: False]
    [Protocols in frame: usb]
USB URB
    [Source: 3.3.2]
    [Destination: host]
    URB id: 0xffff89fc41ab8c00
    URB type: URB_COMPLETE ('C')
    URB transfer type: URB_BULK (0x03)
    Endpoint: 0x82, Direction: IN
        1... .... = Direction: IN (1)
        .... 0010 = Endpoint number: 2
    Device: 3
    URB bus id: 3
    Device setup request: not relevant ('-')
    Data: present (0)
    URB sec: 1530496818
    URB usec: 477182
    URB status: Remote I/O error (-EREMOTEIO) (-121)
    URB length [bytes]: 2
    Data length [bytes]: 2
    [bInterfaceClass: Unknown (0xffff)]
    Unused Setup Header
    Interval: 0
    Start frame: 0
    Copy of Transfer Flags: 0x00000201
    Number of ISO descriptors: 0
Leftover Capture Data: 3003

0000  00 8c ab 41 fc 89 ff ff 43 03 82 03 03 00 2d 00   ...A....C.....-.
0010  32 87 39 5b 00 00 00 00 fe 47 07 00 87 ff ff ff   2.9[.....G......
0020  02 00 00 00 02 00 00 00 00 00 00 00 00 00 00 00   ................
0030  00 00 00 00 00 00 00 00 01 02 00 00 00 00 00 00   ................
0040  30 03                                             0.

Frame 130: 66 bytes on wire (528 bits), 66 bytes captured (528 bits) on interface 0
    Interface id: 0 (unknown)
        Interface name: unknown
    Encapsulation type: USB packets with Linux header and padding (115)
    Arrival Time: Jul  1, 2018 22:00:18.777008000 EDT
    [Time shift for this packet: 0.000000000 seconds]
    Epoch Time: 1530496818.777008000 seconds
    [Time delta from previous captured frame: 0.299826000 seconds]
    [Time delta from previous displayed frame: 0.299826000 seconds]
    [Time since reference or first frame: 389.254757000 seconds]
    Frame Number: 130
    Frame Length: 66 bytes (528 bits)
    Capture Length: 66 bytes (528 bits)
    [Frame is marked: False]
    [Frame is ignored: False]
    [Protocols in frame: usb]
USB URB
    [Source: host]
    [Destination: 3.3.1]
    URB id: 0xffff89fd46e3fa80
    URB type: URB_SUBMIT ('S')
    URB transfer type: URB_BULK (0x03)
    Endpoint: 0x01, Direction: OUT
        0... .... = Direction: OUT (0)
        .... 0001 = Endpoint number: 1
    Device: 3
    URB bus id: 3
    Device setup request: not relevant ('-')
    Data: present (0)
    URB sec: 1530496818
    URB usec: 777008
    URB status: Operation now in progress (-EINPROGRESS) (-115)
    URB length [bytes]: 2
    Data length [bytes]: 2
    [bInterfaceClass: Unknown (0xffff)]
    Unused Setup Header
    Interval: 0
    Start frame: 0
    Copy of Transfer Flags: 0x00000000
    Number of ISO descriptors: 0
Leftover Capture Data: 1b05

0000  80 fa e3 46 fd 89 ff ff 53 03 01 03 03 00 2d 00   ...F....S.....-.
0010  32 87 39 5b 00 00 00 00 30 db 0b 00 8d ff ff ff   2.9[....0.......
0020  02 00 00 00 02 00 00 00 00 00 00 00 00 00 00 00   ................
0030  00 00 00 00 00 00 00 00 00 00 00 00 00 00 00 00   ................
0040  1b 05                                             ..

Frame 131: 66 bytes on wire (528 bits), 66 bytes captured (528 bits) on interface 0
    Interface id: 0 (unknown)
        Interface name: unknown
    Encapsulation type: USB packets with Linux header and padding (115)
    Arrival Time: Jul  1, 2018 22:00:18.887267000 EDT
    [Time shift for this packet: 0.000000000 seconds]
    Epoch Time: 1530496818.887267000 seconds
    [Time delta from previous captured frame: 0.110259000 seconds]
    [Time delta from previous displayed frame: 0.110259000 seconds]
    [Time since reference or first frame: 389.365016000 seconds]
    Frame Number: 131
    Frame Length: 66 bytes (528 bits)
    Capture Length: 66 bytes (528 bits)
    [Frame is marked: False]
    [Frame is ignored: False]
    [Protocols in frame: usb]
USB URB
    [Source: 3.3.2]
    [Destination: host]
    URB id: 0xffff89fd46e3f900
    URB type: URB_COMPLETE ('C')
    URB transfer type: URB_BULK (0x03)
    Endpoint: 0x82, Direction: IN
        1... .... = Direction: IN (1)
        .... 0010 = Endpoint number: 2
    Device: 3
    URB bus id: 3
    Device setup request: not relevant ('-')
    Data: present (0)
    URB sec: 1530496818
    URB usec: 887267
    URB status: Remote I/O error (-EREMOTEIO) (-121)
    URB length [bytes]: 2
    Data length [bytes]: 2
    [bInterfaceClass: Unknown (0xffff)]
    Unused Setup Header
    Interval: 0
    Start frame: 0
    Copy of Transfer Flags: 0x00000201
    Number of ISO descriptors: 0
Leftover Capture Data: 3003

0000  00 f9 e3 46 fd 89 ff ff 43 03 82 03 03 00 2d 00   ...F....C.....-.
0010  32 87 39 5b 00 00 00 00 e3 89 0d 00 87 ff ff ff   2.9[............
0020  02 00 00 00 02 00 00 00 00 00 00 00 00 00 00 00   ................
0030  00 00 00 00 00 00 00 00 01 02 00 00 00 00 00 00   ................
0040  30 03                                             0.

Frame 132: 66 bytes on wire (528 bits), 66 bytes captured (528 bits) on interface 0
    Interface id: 0 (unknown)
        Interface name: unknown
    Encapsulation type: USB packets with Linux header and padding (115)
    Arrival Time: Jul  1, 2018 22:00:19.285450000 EDT
    [Time shift for this packet: 0.000000000 seconds]
    Epoch Time: 1530496819.285450000 seconds
    [Time delta from previous captured frame: 0.398183000 seconds]
    [Time delta from previous displayed frame: 0.398183000 seconds]
    [Time since reference or first frame: 389.763199000 seconds]
    Frame Number: 132
    Frame Length: 66 bytes (528 bits)
    Capture Length: 66 bytes (528 bits)
    [Frame is marked: False]
    [Frame is ignored: False]
    [Protocols in frame: usb]
USB URB
    [Source: host]
    [Destination: 3.3.1]
    URB id: 0xffff89fd4d50de40
    URB type: URB_SUBMIT ('S')
    URB transfer type: URB_BULK (0x03)
    Endpoint: 0x01, Direction: OUT
        0... .... = Direction: OUT (0)
        .... 0001 = Endpoint number: 1
    Device: 3
    URB bus id: 3
    Device setup request: not relevant ('-')
    Data: present (0)
    URB sec: 1530496819
    URB usec: 285450
    URB status: Operation now in progress (-EINPROGRESS) (-115)
    URB length [bytes]: 2
    Data length [bytes]: 2
    [bInterfaceClass: Unknown (0xffff)]
    Unused Setup Header
    Interval: 0
    Start frame: 0
    Copy of Transfer Flags: 0x00000000
    Number of ISO descriptors: 0
Leftover Capture Data: 1b05

0000  40 de 50 4d fd 89 ff ff 53 03 01 03 03 00 2d 00   @.PM....S.....-.
0010  33 87 39 5b 00 00 00 00 0a 5b 04 00 8d ff ff ff   3.9[.....[......
0020  02 00 00 00 02 00 00 00 00 00 00 00 00 00 00 00   ................
0030  00 00 00 00 00 00 00 00 00 00 00 00 00 00 00 00   ................
0040  1b 05                                             ..

Frame 133: 66 bytes on wire (528 bits), 66 bytes captured (528 bits) on interface 0
    Interface id: 0 (unknown)
        Interface name: unknown
    Encapsulation type: USB packets with Linux header and padding (115)
    Arrival Time: Jul  1, 2018 22:00:19.379258000 EDT
    [Time shift for this packet: 0.000000000 seconds]
    Epoch Time: 1530496819.379258000 seconds
    [Time delta from previous captured frame: 0.093808000 seconds]
    [Time delta from previous displayed frame: 0.093808000 seconds]
    [Time since reference or first frame: 389.857007000 seconds]
    Frame Number: 133
    Frame Length: 66 bytes (528 bits)
    Capture Length: 66 bytes (528 bits)
    [Frame is marked: False]
    [Frame is ignored: False]
    [Protocols in frame: usb]
USB URB
    [Source: 3.3.2]
    [Destination: host]
    URB id: 0xffff89fd4d50dd80
    URB type: URB_COMPLETE ('C')
    URB transfer type: URB_BULK (0x03)
    Endpoint: 0x82, Direction: IN
        1... .... = Direction: IN (1)
        .... 0010 = Endpoint number: 2
    Device: 3
    URB bus id: 3
    Device setup request: not relevant ('-')
    Data: present (0)
    URB sec: 1530496819
    URB usec: 379258
    URB status: Remote I/O error (-EREMOTEIO) (-121)
    URB length [bytes]: 2
    Data length [bytes]: 2
    [bInterfaceClass: Unknown (0xffff)]
    Unused Setup Header
    Interval: 0
    Start frame: 0
    Copy of Transfer Flags: 0x00000201
    Number of ISO descriptors: 0
Leftover Capture Data: 3003

0000  80 dd 50 4d fd 89 ff ff 43 03 82 03 03 00 2d 00   ..PM....C.....-.
0010  33 87 39 5b 00 00 00 00 7a c9 05 00 87 ff ff ff   3.9[....z.......
0020  02 00 00 00 02 00 00 00 00 00 00 00 00 00 00 00   ................
0030  00 00 00 00 00 00 00 00 01 02 00 00 00 00 00 00   ................
0040  30 03                                             0.

Frame 134: 66 bytes on wire (528 bits), 66 bytes captured (528 bits) on interface 0
    Interface id: 0 (unknown)
        Interface name: unknown
    Encapsulation type: USB packets with Linux header and padding (115)
    Arrival Time: Jul  1, 2018 22:00:19.815715000 EDT
    [Time shift for this packet: 0.000000000 seconds]
    Epoch Time: 1530496819.815715000 seconds
    [Time delta from previous captured frame: 0.436457000 seconds]
    [Time delta from previous displayed frame: 0.436457000 seconds]
    [Time since reference or first frame: 390.293464000 seconds]
    Frame Number: 134
    Frame Length: 66 bytes (528 bits)
    Capture Length: 66 bytes (528 bits)
    [Frame is marked: False]
    [Frame is ignored: False]
    [Protocols in frame: usb]
USB URB
    [Source: host]
    [Destination: 3.3.1]
    URB id: 0xffff89fd46e3fa80
    URB type: URB_SUBMIT ('S')
    URB transfer type: URB_BULK (0x03)
    Endpoint: 0x01, Direction: OUT
        0... .... = Direction: OUT (0)
        .... 0001 = Endpoint number: 1
    Device: 3
    URB bus id: 3
    Device setup request: not relevant ('-')
    Data: present (0)
    URB sec: 1530496819
    URB usec: 815715
    URB status: Operation now in progress (-EINPROGRESS) (-115)
    URB length [bytes]: 2
    Data length [bytes]: 2
    [bInterfaceClass: Unknown (0xffff)]
    Unused Setup Header
    Interval: 0
    Start frame: 0
    Copy of Transfer Flags: 0x00000000
    Number of ISO descriptors: 0
Leftover Capture Data: 1b05

0000  80 fa e3 46 fd 89 ff ff 53 03 01 03 03 00 2d 00   ...F....S.....-.
0010  33 87 39 5b 00 00 00 00 63 72 0c 00 8d ff ff ff   3.9[....cr......
0020  02 00 00 00 02 00 00 00 00 00 00 00 00 00 00 00   ................
0030  00 00 00 00 00 00 00 00 00 00 00 00 00 00 00 00   ................
0040  1b 05                                             ..

Frame 135: 66 bytes on wire (528 bits), 66 bytes captured (528 bits) on interface 0
    Interface id: 0 (unknown)
        Interface name: unknown
    Encapsulation type: USB packets with Linux header and padding (115)
    Arrival Time: Jul  1, 2018 22:00:19.953193000 EDT
    [Time shift for this packet: 0.000000000 seconds]
    Epoch Time: 1530496819.953193000 seconds
    [Time delta from previous captured frame: 0.137478000 seconds]
    [Time delta from previous displayed frame: 0.137478000 seconds]
    [Time since reference or first frame: 390.430942000 seconds]
    Frame Number: 135
    Frame Length: 66 bytes (528 bits)
    Capture Length: 66 bytes (528 bits)
    [Frame is marked: False]
    [Frame is ignored: False]
    [Protocols in frame: usb]
USB URB
    [Source: 3.3.2]
    [Destination: host]
    URB id: 0xffff89fd46e3f900
    URB type: URB_COMPLETE ('C')
    URB transfer type: URB_BULK (0x03)
    Endpoint: 0x82, Direction: IN
        1... .... = Direction: IN (1)
        .... 0010 = Endpoint number: 2
    Device: 3
    URB bus id: 3
    Device setup request: not relevant ('-')
    Data: present (0)
    URB sec: 1530496819
    URB usec: 953193
    URB status: Remote I/O error (-EREMOTEIO) (-121)
    URB length [bytes]: 2
    Data length [bytes]: 2
    [bInterfaceClass: Unknown (0xffff)]
    Unused Setup Header
    Interval: 0
    Start frame: 0
    Copy of Transfer Flags: 0x00000201
    Number of ISO descriptors: 0
Leftover Capture Data: 3003

0000  00 f9 e3 46 fd 89 ff ff 43 03 82 03 03 00 2d 00   ...F....C.....-.
0010  33 87 39 5b 00 00 00 00 69 8b 0e 00 87 ff ff ff   3.9[....i.......
0020  02 00 00 00 02 00 00 00 00 00 00 00 00 00 00 00   ................
0030  00 00 00 00 00 00 00 00 01 02 00 00 00 00 00 00   ................
0040  30 03                                             0.

Frame 136: 66 bytes on wire (528 bits), 66 bytes captured (528 bits) on interface 0
    Interface id: 0 (unknown)
        Interface name: unknown
    Encapsulation type: USB packets with Linux header and padding (115)
    Arrival Time: Jul  1, 2018 22:00:20.365738000 EDT
    [Time shift for this packet: 0.000000000 seconds]
    Epoch Time: 1530496820.365738000 seconds
    [Time delta from previous captured frame: 0.412545000 seconds]
    [Time delta from previous displayed frame: 0.412545000 seconds]
    [Time since reference or first frame: 390.843487000 seconds]
    Frame Number: 136
    Frame Length: 66 bytes (528 bits)
    Capture Length: 66 bytes (528 bits)
    [Frame is marked: False]
    [Frame is ignored: False]
    [Protocols in frame: usb]
USB URB
    [Source: host]
    [Destination: 3.3.1]
    URB id: 0xffff89fc41ab8c00
    URB type: URB_SUBMIT ('S')
    URB transfer type: URB_BULK (0x03)
    Endpoint: 0x01, Direction: OUT
        0... .... = Direction: OUT (0)
        .... 0001 = Endpoint number: 1
    Device: 3
    URB bus id: 3
    Device setup request: not relevant ('-')
    Data: present (0)
    URB sec: 1530496820
    URB usec: 365738
    URB status: Operation now in progress (-EINPROGRESS) (-115)
    URB length [bytes]: 2
    Data length [bytes]: 2
    [bInterfaceClass: Unknown (0xffff)]
    Unused Setup Header
    Interval: 0
    Start frame: 0
    Copy of Transfer Flags: 0x00000000
    Number of ISO descriptors: 0
Leftover Capture Data: 1b05

0000  00 8c ab 41 fc 89 ff ff 53 03 01 03 03 00 2d 00   ...A....S.....-.
0010  34 87 39 5b 00 00 00 00 aa 94 05 00 8d ff ff ff   4.9[............
0020  02 00 00 00 02 00 00 00 00 00 00 00 00 00 00 00   ................
0030  00 00 00 00 00 00 00 00 00 00 00 00 00 00 00 00   ................
0040  1b 05                                             ..

Frame 137: 66 bytes on wire (528 bits), 66 bytes captured (528 bits) on interface 0
    Interface id: 0 (unknown)
        Interface name: unknown
    Encapsulation type: USB packets with Linux header and padding (115)
    Arrival Time: Jul  1, 2018 22:00:20.527252000 EDT
    [Time shift for this packet: 0.000000000 seconds]
    Epoch Time: 1530496820.527252000 seconds
    [Time delta from previous captured frame: 0.161514000 seconds]
    [Time delta from previous displayed frame: 0.161514000 seconds]
    [Time since reference or first frame: 391.005001000 seconds]
    Frame Number: 137
    Frame Length: 66 bytes (528 bits)
    Capture Length: 66 bytes (528 bits)
    [Frame is marked: False]
    [Frame is ignored: False]
    [Protocols in frame: usb]
USB URB
    [Source: 3.3.2]
    [Destination: host]
    URB id: 0xffff89fd46e3f900
    URB type: URB_COMPLETE ('C')
    URB transfer type: URB_BULK (0x03)
    Endpoint: 0x82, Direction: IN
        1... .... = Direction: IN (1)
        .... 0010 = Endpoint number: 2
    Device: 3
    URB bus id: 3
    Device setup request: not relevant ('-')
    Data: present (0)
    URB sec: 1530496820
    URB usec: 527252
    URB status: Remote I/O error (-EREMOTEIO) (-121)
    URB length [bytes]: 2
    Data length [bytes]: 2
    [bInterfaceClass: Unknown (0xffff)]
    Unused Setup Header
    Interval: 0
    Start frame: 0
    Copy of Transfer Flags: 0x00000201
    Number of ISO descriptors: 0
Leftover Capture Data: 3003

0000  00 f9 e3 46 fd 89 ff ff 43 03 82 03 03 00 2d 00   ...F....C.....-.
0010  34 87 39 5b 00 00 00 00 94 0b 08 00 87 ff ff ff   4.9[............
0020  02 00 00 00 02 00 00 00 00 00 00 00 00 00 00 00   ................
0030  00 00 00 00 00 00 00 00 01 02 00 00 00 00 00 00   ................
0040  30 03                                             0.

Frame 138: 66 bytes on wire (528 bits), 66 bytes captured (528 bits) on interface 0
    Interface id: 0 (unknown)
        Interface name: unknown
    Encapsulation type: USB packets with Linux header and padding (115)
    Arrival Time: Jul  1, 2018 22:00:20.897577000 EDT
    [Time shift for this packet: 0.000000000 seconds]
    Epoch Time: 1530496820.897577000 seconds
    [Time delta from previous captured frame: 0.370325000 seconds]
    [Time delta from previous displayed frame: 0.370325000 seconds]
    [Time since reference or first frame: 391.375326000 seconds]
    Frame Number: 138
    Frame Length: 66 bytes (528 bits)
    Capture Length: 66 bytes (528 bits)
    [Frame is marked: False]
    [Frame is ignored: False]
    [Protocols in frame: usb]
USB URB
    [Source: host]
    [Destination: 3.3.1]
    URB id: 0xffff89fc41ab83c0
    URB type: URB_SUBMIT ('S')
    URB transfer type: URB_BULK (0x03)
    Endpoint: 0x01, Direction: OUT
        0... .... = Direction: OUT (0)
        .... 0001 = Endpoint number: 1
    Device: 3
    URB bus id: 3
    Device setup request: not relevant ('-')
    Data: present (0)
    URB sec: 1530496820
    URB usec: 897577
    URB status: Operation now in progress (-EINPROGRESS) (-115)
    URB length [bytes]: 2
    Data length [bytes]: 2
    [bInterfaceClass: Unknown (0xffff)]
    Unused Setup Header
    Interval: 0
    Start frame: 0
    Copy of Transfer Flags: 0x00000000
    Number of ISO descriptors: 0
Leftover Capture Data: 1b05

0000  c0 83 ab 41 fc 89 ff ff 53 03 01 03 03 00 2d 00   ...A....S.....-.
0010  34 87 39 5b 00 00 00 00 29 b2 0d 00 8d ff ff ff   4.9[....).......
0020  02 00 00 00 02 00 00 00 00 00 00 00 00 00 00 00   ................
0030  00 00 00 00 00 00 00 00 00 00 00 00 00 00 00 00   ................
0040  1b 05                                             ..

Frame 139: 66 bytes on wire (528 bits), 66 bytes captured (528 bits) on interface 0
    Interface id: 0 (unknown)
        Interface name: unknown
    Encapsulation type: USB packets with Linux header and padding (115)
    Arrival Time: Jul  1, 2018 22:00:21.019276000 EDT
    [Time shift for this packet: 0.000000000 seconds]
    Epoch Time: 1530496821.019276000 seconds
    [Time delta from previous captured frame: 0.121699000 seconds]
    [Time delta from previous displayed frame: 0.121699000 seconds]
    [Time since reference or first frame: 391.497025000 seconds]
    Frame Number: 139
    Frame Length: 66 bytes (528 bits)
    Capture Length: 66 bytes (528 bits)
    [Frame is marked: False]
    [Frame is ignored: False]
    [Protocols in frame: usb]
USB URB
    [Source: 3.3.2]
    [Destination: host]
    URB id: 0xffff89fc41ab8c00
    URB type: URB_COMPLETE ('C')
    URB transfer type: URB_BULK (0x03)
    Endpoint: 0x82, Direction: IN
        1... .... = Direction: IN (1)
        .... 0010 = Endpoint number: 2
    Device: 3
    URB bus id: 3
    Device setup request: not relevant ('-')
    Data: present (0)
    URB sec: 1530496821
    URB usec: 19276
    URB status: Remote I/O error (-EREMOTEIO) (-121)
    URB length [bytes]: 2
    Data length [bytes]: 2
    [bInterfaceClass: Unknown (0xffff)]
    Unused Setup Header
    Interval: 0
    Start frame: 0
    Copy of Transfer Flags: 0x00000201
    Number of ISO descriptors: 0
Leftover Capture Data: 3003

0000  00 8c ab 41 fc 89 ff ff 43 03 82 03 03 00 2d 00   ...A....C.....-.
0010  35 87 39 5b 00 00 00 00 4c 4b 00 00 87 ff ff ff   5.9[....LK......
0020  02 00 00 00 02 00 00 00 00 00 00 00 00 00 00 00   ................
0030  00 00 00 00 00 00 00 00 01 02 00 00 00 00 00 00   ................
0040  30 03                                             0.

Frame 140: 66 bytes on wire (528 bits), 66 bytes captured (528 bits) on interface 0
    Interface id: 0 (unknown)
        Interface name: unknown
    Encapsulation type: USB packets with Linux header and padding (115)
    Arrival Time: Jul  1, 2018 22:00:21.388678000 EDT
    [Time shift for this packet: 0.000000000 seconds]
    Epoch Time: 1530496821.388678000 seconds
    [Time delta from previous captured frame: 0.369402000 seconds]
    [Time delta from previous displayed frame: 0.369402000 seconds]
    [Time since reference or first frame: 391.866427000 seconds]
    Frame Number: 140
    Frame Length: 66 bytes (528 bits)
    Capture Length: 66 bytes (528 bits)
    [Frame is marked: False]
    [Frame is ignored: False]
    [Protocols in frame: usb]
USB URB
    [Source: host]
    [Destination: 3.3.1]
    URB id: 0xffff89fd46e3fa80
    URB type: URB_SUBMIT ('S')
    URB transfer type: URB_BULK (0x03)
    Endpoint: 0x01, Direction: OUT
        0... .... = Direction: OUT (0)
        .... 0001 = Endpoint number: 1
    Device: 3
    URB bus id: 3
    Device setup request: not relevant ('-')
    Data: present (0)
    URB sec: 1530496821
    URB usec: 388678
    URB status: Operation now in progress (-EINPROGRESS) (-115)
    URB length [bytes]: 2
    Data length [bytes]: 2
    [bInterfaceClass: Unknown (0xffff)]
    Unused Setup Header
    Interval: 0
    Start frame: 0
    Copy of Transfer Flags: 0x00000000
    Number of ISO descriptors: 0
Leftover Capture Data: 1b05

0000  80 fa e3 46 fd 89 ff ff 53 03 01 03 03 00 2d 00   ...F....S.....-.
0010  35 87 39 5b 00 00 00 00 46 ee 05 00 8d ff ff ff   5.9[....F.......
0020  02 00 00 00 02 00 00 00 00 00 00 00 00 00 00 00   ................
0030  00 00 00 00 00 00 00 00 00 00 00 00 00 00 00 00   ................
0040  1b 05                                             ..

Frame 141: 66 bytes on wire (528 bits), 66 bytes captured (528 bits) on interface 0
    Interface id: 0 (unknown)
        Interface name: unknown
    Encapsulation type: USB packets with Linux header and padding (115)
    Arrival Time: Jul  1, 2018 22:00:21.511321000 EDT
    [Time shift for this packet: 0.000000000 seconds]
    Epoch Time: 1530496821.511321000 seconds
    [Time delta from previous captured frame: 0.122643000 seconds]
    [Time delta from previous displayed frame: 0.122643000 seconds]
    [Time since reference or first frame: 391.989070000 seconds]
    Frame Number: 141
    Frame Length: 66 bytes (528 bits)
    Capture Length: 66 bytes (528 bits)
    [Frame is marked: False]
    [Frame is ignored: False]
    [Protocols in frame: usb]
USB URB
    [Source: 3.3.2]
    [Destination: host]
    URB id: 0xffff89fc41ab8000
    URB type: URB_COMPLETE ('C')
    URB transfer type: URB_BULK (0x03)
    Endpoint: 0x82, Direction: IN
        1... .... = Direction: IN (1)
        .... 0010 = Endpoint number: 2
    Device: 3
    URB bus id: 3
    Device setup request: not relevant ('-')
    Data: present (0)
    URB sec: 1530496821
    URB usec: 511321
    URB status: Remote I/O error (-EREMOTEIO) (-121)
    URB length [bytes]: 2
    Data length [bytes]: 2
    [bInterfaceClass: Unknown (0xffff)]
    Unused Setup Header
    Interval: 0
    Start frame: 0
    Copy of Transfer Flags: 0x00000201
    Number of ISO descriptors: 0
Leftover Capture Data: 3003

0000  00 80 ab 41 fc 89 ff ff 43 03 82 03 03 00 2d 00   ...A....C.....-.
0010  35 87 39 5b 00 00 00 00 59 cd 07 00 87 ff ff ff   5.9[....Y.......
0020  02 00 00 00 02 00 00 00 00 00 00 00 00 00 00 00   ................
0030  00 00 00 00 00 00 00 00 01 02 00 00 00 00 00 00   ................
0040  30 03                                             0.

Frame 142: 66 bytes on wire (528 bits), 66 bytes captured (528 bits) on interface 0
    Interface id: 0 (unknown)
        Interface name: unknown
    Encapsulation type: USB packets with Linux header and padding (115)
    Arrival Time: Jul  1, 2018 22:00:21.899337000 EDT
    [Time shift for this packet: 0.000000000 seconds]
    Epoch Time: 1530496821.899337000 seconds
    [Time delta from previous captured frame: 0.388016000 seconds]
    [Time delta from previous displayed frame: 0.388016000 seconds]
    [Time since reference or first frame: 392.377086000 seconds]
    Frame Number: 142
    Frame Length: 66 bytes (528 bits)
    Capture Length: 66 bytes (528 bits)
    [Frame is marked: False]
    [Frame is ignored: False]
    [Protocols in frame: usb]
USB URB
    [Source: host]
    [Destination: 3.3.1]
    URB id: 0xffff89fd46e3f300
    URB type: URB_SUBMIT ('S')
    URB transfer type: URB_BULK (0x03)
    Endpoint: 0x01, Direction: OUT
        0... .... = Direction: OUT (0)
        .... 0001 = Endpoint number: 1
    Device: 3
    URB bus id: 3
    Device setup request: not relevant ('-')
    Data: present (0)
    URB sec: 1530496821
    URB usec: 899337
    URB status: Operation now in progress (-EINPROGRESS) (-115)
    URB length [bytes]: 2
    Data length [bytes]: 2
    [bInterfaceClass: Unknown (0xffff)]
    Unused Setup Header
    Interval: 0
    Start frame: 0
    Copy of Transfer Flags: 0x00000000
    Number of ISO descriptors: 0
Leftover Capture Data: 1b05

0000  00 f3 e3 46 fd 89 ff ff 53 03 01 03 03 00 2d 00   ...F....S.....-.
0010  35 87 39 5b 00 00 00 00 09 b9 0d 00 8d ff ff ff   5.9[............
0020  02 00 00 00 02 00 00 00 00 00 00 00 00 00 00 00   ................
0030  00 00 00 00 00 00 00 00 00 00 00 00 00 00 00 00   ................
0040  1b 05                                             ..

Frame 143: 66 bytes on wire (528 bits), 66 bytes captured (528 bits) on interface 0
    Interface id: 0 (unknown)
        Interface name: unknown
    Encapsulation type: USB packets with Linux header and padding (115)
    Arrival Time: Jul  1, 2018 22:00:22.003212000 EDT
    [Time shift for this packet: 0.000000000 seconds]
    Epoch Time: 1530496822.003212000 seconds
    [Time delta from previous captured frame: 0.103875000 seconds]
    [Time delta from previous displayed frame: 0.103875000 seconds]
    [Time since reference or first frame: 392.480961000 seconds]
    Frame Number: 143
    Frame Length: 66 bytes (528 bits)
    Capture Length: 66 bytes (528 bits)
    [Frame is marked: False]
    [Frame is ignored: False]
    [Protocols in frame: usb]
USB URB
    [Source: 3.3.2]
    [Destination: host]
    URB id: 0xffff89fd46e3f840
    URB type: URB_COMPLETE ('C')
    URB transfer type: URB_BULK (0x03)
    Endpoint: 0x82, Direction: IN
        1... .... = Direction: IN (1)
        .... 0010 = Endpoint number: 2
    Device: 3
    URB bus id: 3
    Device setup request: not relevant ('-')
    Data: present (0)
    URB sec: 1530496822
    URB usec: 3212
    URB status: Remote I/O error (-EREMOTEIO) (-121)
    URB length [bytes]: 2
    Data length [bytes]: 2
    [bInterfaceClass: Unknown (0xffff)]
    Unused Setup Header
    Interval: 0
    Start frame: 0
    Copy of Transfer Flags: 0x00000201
    Number of ISO descriptors: 0
Leftover Capture Data: 3003

0000  40 f8 e3 46 fd 89 ff ff 43 03 82 03 03 00 2d 00   @..F....C.....-.
0010  36 87 39 5b 00 00 00 00 8c 0c 00 00 87 ff ff ff   6.9[............
0020  02 00 00 00 02 00 00 00 00 00 00 00 00 00 00 00   ................
0030  00 00 00 00 00 00 00 00 01 02 00 00 00 00 00 00   ................
0040  30 03                                             0.

Frame 144: 66 bytes on wire (528 bits), 66 bytes captured (528 bits) on interface 0
    Interface id: 0 (unknown)
        Interface name: unknown
    Encapsulation type: USB packets with Linux header and padding (115)
    Arrival Time: Jul  1, 2018 22:00:22.410497000 EDT
    [Time shift for this packet: 0.000000000 seconds]
    Epoch Time: 1530496822.410497000 seconds
    [Time delta from previous captured frame: 0.407285000 seconds]
    [Time delta from previous displayed frame: 0.407285000 seconds]
    [Time since reference or first frame: 392.888246000 seconds]
    Frame Number: 144
    Frame Length: 66 bytes (528 bits)
    Capture Length: 66 bytes (528 bits)
    [Frame is marked: False]
    [Frame is ignored: False]
    [Protocols in frame: usb]
USB URB
    [Source: host]
    [Destination: 3.3.1]
    URB id: 0xffff89fc41ab8cc0
    URB type: URB_SUBMIT ('S')
    URB transfer type: URB_BULK (0x03)
    Endpoint: 0x01, Direction: OUT
        0... .... = Direction: OUT (0)
        .... 0001 = Endpoint number: 1
    Device: 3
    URB bus id: 3
    Device setup request: not relevant ('-')
    Data: present (0)
    URB sec: 1530496822
    URB usec: 410497
    URB status: Operation now in progress (-EINPROGRESS) (-115)
    URB length [bytes]: 2
    Data length [bytes]: 2
    [bInterfaceClass: Unknown (0xffff)]
    Unused Setup Header
    Interval: 0
    Start frame: 0
    Copy of Transfer Flags: 0x00000000
    Number of ISO descriptors: 0
Leftover Capture Data: 1b05

0000  c0 8c ab 41 fc 89 ff ff 53 03 01 03 03 00 2d 00   ...A....S.....-.
0010  36 87 39 5b 00 00 00 00 81 43 06 00 8d ff ff ff   6.9[.....C......
0020  02 00 00 00 02 00 00 00 00 00 00 00 00 00 00 00   ................
0030  00 00 00 00 00 00 00 00 00 00 00 00 00 00 00 00   ................
0040  1b 05                                             ..

Frame 145: 66 bytes on wire (528 bits), 66 bytes captured (528 bits) on interface 0
    Interface id: 0 (unknown)
        Interface name: unknown
    Encapsulation type: USB packets with Linux header and padding (115)
    Arrival Time: Jul  1, 2018 22:00:22.495231000 EDT
    [Time shift for this packet: 0.000000000 seconds]
    Epoch Time: 1530496822.495231000 seconds
    [Time delta from previous captured frame: 0.084734000 seconds]
    [Time delta from previous displayed frame: 0.084734000 seconds]
    [Time since reference or first frame: 392.972980000 seconds]
    Frame Number: 145
    Frame Length: 66 bytes (528 bits)
    Capture Length: 66 bytes (528 bits)
    [Frame is marked: False]
    [Frame is ignored: False]
    [Protocols in frame: usb]
USB URB
    [Source: 3.3.2]
    [Destination: host]
    URB id: 0xffff89fd46e3f840
    URB type: URB_COMPLETE ('C')
    URB transfer type: URB_BULK (0x03)
    Endpoint: 0x82, Direction: IN
        1... .... = Direction: IN (1)
        .... 0010 = Endpoint number: 2
    Device: 3
    URB bus id: 3
    Device setup request: not relevant ('-')
    Data: present (0)
    URB sec: 1530496822
    URB usec: 495231
    URB status: Remote I/O error (-EREMOTEIO) (-121)
    URB length [bytes]: 2
    Data length [bytes]: 2
    [bInterfaceClass: Unknown (0xffff)]
    Unused Setup Header
    Interval: 0
    Start frame: 0
    Copy of Transfer Flags: 0x00000201
    Number of ISO descriptors: 0
Leftover Capture Data: 3003

0000  40 f8 e3 46 fd 89 ff ff 43 03 82 03 03 00 2d 00   @..F....C.....-.
0010  36 87 39 5b 00 00 00 00 7f 8e 07 00 87 ff ff ff   6.9[............
0020  02 00 00 00 02 00 00 00 00 00 00 00 00 00 00 00   ................
0030  00 00 00 00 00 00 00 00 01 02 00 00 00 00 00 00   ................
0040  30 03                                             0.

Frame 146: 66 bytes on wire (528 bits), 66 bytes captured (528 bits) on interface 0
    Interface id: 0 (unknown)
        Interface name: unknown
    Encapsulation type: USB packets with Linux header and padding (115)
    Arrival Time: Jul  1, 2018 22:00:22.933653000 EDT
    [Time shift for this packet: 0.000000000 seconds]
    Epoch Time: 1530496822.933653000 seconds
    [Time delta from previous captured frame: 0.438422000 seconds]
    [Time delta from previous displayed frame: 0.438422000 seconds]
    [Time since reference or first frame: 393.411402000 seconds]
    Frame Number: 146
    Frame Length: 66 bytes (528 bits)
    Capture Length: 66 bytes (528 bits)
    [Frame is marked: False]
    [Frame is ignored: False]
    [Protocols in frame: usb]
USB URB
    [Source: host]
    [Destination: 3.3.1]
    URB id: 0xffff89fc41ab8480
    URB type: URB_SUBMIT ('S')
    URB transfer type: URB_BULK (0x03)
    Endpoint: 0x01, Direction: OUT
        0... .... = Direction: OUT (0)
        .... 0001 = Endpoint number: 1
    Device: 3
    URB bus id: 3
    Device setup request: not relevant ('-')
    Data: present (0)
    URB sec: 1530496822
    URB usec: 933653
    URB status: Operation now in progress (-EINPROGRESS) (-115)
    URB length [bytes]: 2
    Data length [bytes]: 2
    [bInterfaceClass: Unknown (0xffff)]
    Unused Setup Header
    Interval: 0
    Start frame: 0
    Copy of Transfer Flags: 0x00000000
    Number of ISO descriptors: 0
Leftover Capture Data: 1b05

0000  80 84 ab 41 fc 89 ff ff 53 03 01 03 03 00 2d 00   ...A....S.....-.
0010  36 87 39 5b 00 00 00 00 15 3f 0e 00 8d ff ff ff   6.9[.....?......
0020  02 00 00 00 02 00 00 00 00 00 00 00 00 00 00 00   ................
0030  00 00 00 00 00 00 00 00 00 00 00 00 00 00 00 00   ................
0040  1b 05                                             ..

Frame 147: 66 bytes on wire (528 bits), 66 bytes captured (528 bits) on interface 0
    Interface id: 0 (unknown)
        Interface name: unknown
    Encapsulation type: USB packets with Linux header and padding (115)
    Arrival Time: Jul  1, 2018 22:00:23.069326000 EDT
    [Time shift for this packet: 0.000000000 seconds]
    Epoch Time: 1530496823.069326000 seconds
    [Time delta from previous captured frame: 0.135673000 seconds]
    [Time delta from previous displayed frame: 0.135673000 seconds]
    [Time since reference or first frame: 393.547075000 seconds]
    Frame Number: 147
    Frame Length: 66 bytes (528 bits)
    Capture Length: 66 bytes (528 bits)
    [Frame is marked: False]
    [Frame is ignored: False]
    [Protocols in frame: usb]
USB URB
    [Source: 3.3.2]
    [Destination: host]
    URB id: 0xffff89fc92459c00
    URB type: URB_COMPLETE ('C')
    URB transfer type: URB_BULK (0x03)
    Endpoint: 0x82, Direction: IN
        1... .... = Direction: IN (1)
        .... 0010 = Endpoint number: 2
    Device: 3
    URB bus id: 3
    Device setup request: not relevant ('-')
    Data: present (0)
    URB sec: 1530496823
    URB usec: 69326
    URB status: Remote I/O error (-EREMOTEIO) (-121)
    URB length [bytes]: 2
    Data length [bytes]: 2
    [bInterfaceClass: Unknown (0xffff)]
    Unused Setup Header
    Interval: 0
    Start frame: 0
    Copy of Transfer Flags: 0x00000201
    Number of ISO descriptors: 0
Leftover Capture Data: 3003

0000  00 9c 45 92 fc 89 ff ff 43 03 82 03 03 00 2d 00   ..E.....C.....-.
0010  37 87 39 5b 00 00 00 00 ce 0e 01 00 87 ff ff ff   7.9[............
0020  02 00 00 00 02 00 00 00 00 00 00 00 00 00 00 00   ................
0030  00 00 00 00 00 00 00 00 01 02 00 00 00 00 00 00   ................
0040  30 03                                             0.

Frame 148: 66 bytes on wire (528 bits), 66 bytes captured (528 bits) on interface 0
    Interface id: 0 (unknown)
        Interface name: unknown
    Encapsulation type: USB packets with Linux header and padding (115)
    Arrival Time: Jul  1, 2018 22:00:23.425023000 EDT
    [Time shift for this packet: 0.000000000 seconds]
    Epoch Time: 1530496823.425023000 seconds
    [Time delta from previous captured frame: 0.355697000 seconds]
    [Time delta from previous displayed frame: 0.355697000 seconds]
    [Time since reference or first frame: 393.902772000 seconds]
    Frame Number: 148
    Frame Length: 66 bytes (528 bits)
    Capture Length: 66 bytes (528 bits)
    [Frame is marked: False]
    [Frame is ignored: False]
    [Protocols in frame: usb]
USB URB
    [Source: host]
    [Destination: 3.3.1]
    URB id: 0xffff89fc41ab8cc0
    URB type: URB_SUBMIT ('S')
    URB transfer type: URB_BULK (0x03)
    Endpoint: 0x01, Direction: OUT
        0... .... = Direction: OUT (0)
        .... 0001 = Endpoint number: 1
    Device: 3
    URB bus id: 3
    Device setup request: not relevant ('-')
    Data: present (0)
    URB sec: 1530496823
    URB usec: 425023
    URB status: Operation now in progress (-EINPROGRESS) (-115)
    URB length [bytes]: 2
    Data length [bytes]: 2
    [bInterfaceClass: Unknown (0xffff)]
    Unused Setup Header
    Interval: 0
    Start frame: 0
    Copy of Transfer Flags: 0x00000000
    Number of ISO descriptors: 0
Leftover Capture Data: 1b05

0000  c0 8c ab 41 fc 89 ff ff 53 03 01 03 03 00 2d 00   ...A....S.....-.
0010  37 87 39 5b 00 00 00 00 3f 7c 06 00 8d ff ff ff   7.9[....?|......
0020  02 00 00 00 02 00 00 00 00 00 00 00 00 00 00 00   ................
0030  00 00 00 00 00 00 00 00 00 00 00 00 00 00 00 00   ................
0040  1b 05                                             ..

Frame 149: 66 bytes on wire (528 bits), 66 bytes captured (528 bits) on interface 0
    Interface id: 0 (unknown)
        Interface name: unknown
    Encapsulation type: USB packets with Linux header and padding (115)
    Arrival Time: Jul  1, 2018 22:00:23.561289000 EDT
    [Time shift for this packet: 0.000000000 seconds]
    Epoch Time: 1530496823.561289000 seconds
    [Time delta from previous captured frame: 0.136266000 seconds]
    [Time delta from previous displayed frame: 0.136266000 seconds]
    [Time since reference or first frame: 394.039038000 seconds]
    Frame Number: 149
    Frame Length: 66 bytes (528 bits)
    Capture Length: 66 bytes (528 bits)
    [Frame is marked: False]
    [Frame is ignored: False]
    [Protocols in frame: usb]
USB URB
    [Source: 3.3.2]
    [Destination: host]
    URB id: 0xffff89fc41ab8480
    URB type: URB_COMPLETE ('C')
    URB transfer type: URB_BULK (0x03)
    Endpoint: 0x82, Direction: IN
        1... .... = Direction: IN (1)
        .... 0010 = Endpoint number: 2
    Device: 3
    URB bus id: 3
    Device setup request: not relevant ('-')
    Data: present (0)
    URB sec: 1530496823
    URB usec: 561289
    URB status: Remote I/O error (-EREMOTEIO) (-121)
    URB length [bytes]: 2
    Data length [bytes]: 2
    [bInterfaceClass: Unknown (0xffff)]
    Unused Setup Header
    Interval: 0
    Start frame: 0
    Copy of Transfer Flags: 0x00000201
    Number of ISO descriptors: 0
Leftover Capture Data: 3003

0000  80 84 ab 41 fc 89 ff ff 43 03 82 03 03 00 2d 00   ...A....C.....-.
0010  37 87 39 5b 00 00 00 00 89 90 08 00 87 ff ff ff   7.9[............
0020  02 00 00 00 02 00 00 00 00 00 00 00 00 00 00 00   ................
0030  00 00 00 00 00 00 00 00 01 02 00 00 00 00 00 00   ................
0040  30 03                                             0.

Frame 150: 66 bytes on wire (528 bits), 66 bytes captured (528 bits) on interface 0
    Interface id: 0 (unknown)
        Interface name: unknown
    Encapsulation type: USB packets with Linux header and padding (115)
    Arrival Time: Jul  1, 2018 22:00:23.936119000 EDT
    [Time shift for this packet: 0.000000000 seconds]
    Epoch Time: 1530496823.936119000 seconds
    [Time delta from previous captured frame: 0.374830000 seconds]
    [Time delta from previous displayed frame: 0.374830000 seconds]
    [Time since reference or first frame: 394.413868000 seconds]
    Frame Number: 150
    Frame Length: 66 bytes (528 bits)
    Capture Length: 66 bytes (528 bits)
    [Frame is marked: False]
    [Frame is ignored: False]
    [Protocols in frame: usb]
USB URB
    [Source: host]
    [Destination: 3.3.1]
    URB id: 0xffff89fd4d50dd80
    URB type: URB_SUBMIT ('S')
    URB transfer type: URB_BULK (0x03)
    Endpoint: 0x01, Direction: OUT
        0... .... = Direction: OUT (0)
        .... 0001 = Endpoint number: 1
    Device: 3
    URB bus id: 3
    Device setup request: not relevant ('-')
    Data: present (0)
    URB sec: 1530496823
    URB usec: 936119
    URB status: Operation now in progress (-EINPROGRESS) (-115)
    URB length [bytes]: 2
    Data length [bytes]: 2
    [bInterfaceClass: Unknown (0xffff)]
    Unused Setup Header
    Interval: 0
    Start frame: 0
    Copy of Transfer Flags: 0x00000000
    Number of ISO descriptors: 0
Leftover Capture Data: 1b05

0000  80 dd 50 4d fd 89 ff ff 53 03 01 03 03 00 2d 00   ..PM....S.....-.
0010  37 87 39 5b 00 00 00 00 b7 48 0e 00 8d ff ff ff   7.9[.....H......
0020  02 00 00 00 02 00 00 00 00 00 00 00 00 00 00 00   ................
0030  00 00 00 00 00 00 00 00 00 00 00 00 00 00 00 00   ................
0040  1b 05                                             ..

Frame 151: 66 bytes on wire (528 bits), 66 bytes captured (528 bits) on interface 0
    Interface id: 0 (unknown)
        Interface name: unknown
    Encapsulation type: USB packets with Linux header and padding (115)
    Arrival Time: Jul  1, 2018 22:00:24.053183000 EDT
    [Time shift for this packet: 0.000000000 seconds]
    Epoch Time: 1530496824.053183000 seconds
    [Time delta from previous captured frame: 0.117064000 seconds]
    [Time delta from previous displayed frame: 0.117064000 seconds]
    [Time since reference or first frame: 394.530932000 seconds]
    Frame Number: 151
    Frame Length: 66 bytes (528 bits)
    Capture Length: 66 bytes (528 bits)
    [Frame is marked: False]
    [Frame is ignored: False]
    [Protocols in frame: usb]
USB URB
    [Source: 3.3.2]
    [Destination: host]
    URB id: 0xffff89fc92459c00
    URB type: URB_COMPLETE ('C')
    URB transfer type: URB_BULK (0x03)
    Endpoint: 0x82, Direction: IN
        1... .... = Direction: IN (1)
        .... 0010 = Endpoint number: 2
    Device: 3
    URB bus id: 3
    Device setup request: not relevant ('-')
    Data: present (0)
    URB sec: 1530496824
    URB usec: 53183
    URB status: Remote I/O error (-EREMOTEIO) (-121)
    URB length [bytes]: 2
    Data length [bytes]: 2
    [bInterfaceClass: Unknown (0xffff)]
    Unused Setup Header
    Interval: 0
    Start frame: 0
    Copy of Transfer Flags: 0x00000201
    Number of ISO descriptors: 0
Leftover Capture Data: 3003

0000  00 9c 45 92 fc 89 ff ff 43 03 82 03 03 00 2d 00   ..E.....C.....-.
0010  38 87 39 5b 00 00 00 00 bf cf 00 00 87 ff ff ff   8.9[............
0020  02 00 00 00 02 00 00 00 00 00 00 00 00 00 00 00   ................
0030  00 00 00 00 00 00 00 00 01 02 00 00 00 00 00 00   ................
0040  30 03                                             0.

Frame 152: 66 bytes on wire (528 bits), 66 bytes captured (528 bits) on interface 0
    Interface id: 0 (unknown)
        Interface name: unknown
    Encapsulation type: USB packets with Linux header and padding (115)
    Arrival Time: Jul  1, 2018 22:00:24.726301000 EDT
    [Time shift for this packet: 0.000000000 seconds]
    Epoch Time: 1530496824.726301000 seconds
    [Time delta from previous captured frame: 0.673118000 seconds]
    [Time delta from previous displayed frame: 0.673118000 seconds]
    [Time since reference or first frame: 395.204050000 seconds]
    Frame Number: 152
    Frame Length: 66 bytes (528 bits)
    Capture Length: 66 bytes (528 bits)
    [Frame is marked: False]
    [Frame is ignored: False]
    [Protocols in frame: usb]
USB URB
    [Source: host]
    [Destination: 3.3.1]
    URB id: 0xffff89fc92459600
    URB type: URB_SUBMIT ('S')
    URB transfer type: URB_BULK (0x03)
    Endpoint: 0x01, Direction: OUT
        0... .... = Direction: OUT (0)
        .... 0001 = Endpoint number: 1
    Device: 3
    URB bus id: 3
    Device setup request: not relevant ('-')
    Data: present (0)
    URB sec: 1530496824
    URB usec: 726301
    URB status: Operation now in progress (-EINPROGRESS) (-115)
    URB length [bytes]: 2
    Data length [bytes]: 2
    [bInterfaceClass: Unknown (0xffff)]
    Unused Setup Header
    Interval: 0
    Start frame: 0
    Copy of Transfer Flags: 0x00000000
    Number of ISO descriptors: 0
Leftover Capture Data: 1b05

0000  00 96 45 92 fc 89 ff ff 53 03 01 03 03 00 2d 00   ..E.....S.....-.
0010  38 87 39 5b 00 00 00 00 1d 15 0b 00 8d ff ff ff   8.9[............
0020  02 00 00 00 02 00 00 00 00 00 00 00 00 00 00 00   ................
0030  00 00 00 00 00 00 00 00 00 00 00 00 00 00 00 00   ................
0040  1b 05                                             ..

Frame 153: 66 bytes on wire (528 bits), 66 bytes captured (528 bits) on interface 0
    Interface id: 0 (unknown)
        Interface name: unknown
    Encapsulation type: USB packets with Linux header and padding (115)
    Arrival Time: Jul  1, 2018 22:00:24.873187000 EDT
    [Time shift for this packet: 0.000000000 seconds]
    Epoch Time: 1530496824.873187000 seconds
    [Time delta from previous captured frame: 0.146886000 seconds]
    [Time delta from previous displayed frame: 0.146886000 seconds]
    [Time since reference or first frame: 395.350936000 seconds]
    Frame Number: 153
    Frame Length: 66 bytes (528 bits)
    Capture Length: 66 bytes (528 bits)
    [Frame is marked: False]
    [Frame is ignored: False]
    [Protocols in frame: usb]
USB URB
    [Source: 3.3.2]
    [Destination: host]
    URB id: 0xffff89fd4d50de40
    URB type: URB_COMPLETE ('C')
    URB transfer type: URB_BULK (0x03)
    Endpoint: 0x82, Direction: IN
        1... .... = Direction: IN (1)
        .... 0010 = Endpoint number: 2
    Device: 3
    URB bus id: 3
    Device setup request: not relevant ('-')
    Data: present (0)
    URB sec: 1530496824
    URB usec: 873187
    URB status: Remote I/O error (-EREMOTEIO) (-121)
    URB length [bytes]: 2
    Data length [bytes]: 2
    [bInterfaceClass: Unknown (0xffff)]
    Unused Setup Header
    Interval: 0
    Start frame: 0
    Copy of Transfer Flags: 0x00000201
    Number of ISO descriptors: 0
Leftover Capture Data: 3003

0000  40 de 50 4d fd 89 ff ff 43 03 82 03 03 00 2d 00   @.PM....C.....-.
0010  38 87 39 5b 00 00 00 00 e3 52 0d 00 87 ff ff ff   8.9[.....R......
0020  02 00 00 00 02 00 00 00 00 00 00 00 00 00 00 00   ................
0030  00 00 00 00 00 00 00 00 01 02 00 00 00 00 00 00   ................
0040  30 03                                             0.

Frame 154: 66 bytes on wire (528 bits), 66 bytes captured (528 bits) on interface 0
    Interface id: 0 (unknown)
        Interface name: unknown
    Encapsulation type: USB packets with Linux header and padding (115)
    Arrival Time: Jul  1, 2018 22:00:25.274722000 EDT
    [Time shift for this packet: 0.000000000 seconds]
    Epoch Time: 1530496825.274722000 seconds
    [Time delta from previous captured frame: 0.401535000 seconds]
    [Time delta from previous displayed frame: 0.401535000 seconds]
    [Time since reference or first frame: 395.752471000 seconds]
    Frame Number: 154
    Frame Length: 66 bytes (528 bits)
    Capture Length: 66 bytes (528 bits)
    [Frame is marked: False]
    [Frame is ignored: False]
    [Protocols in frame: usb]
USB URB
    [Source: host]
    [Destination: 3.3.1]
    URB id: 0xffff89fc41ab8840
    URB type: URB_SUBMIT ('S')
    URB transfer type: URB_BULK (0x03)
    Endpoint: 0x01, Direction: OUT
        0... .... = Direction: OUT (0)
        .... 0001 = Endpoint number: 1
    Device: 3
    URB bus id: 3
    Device setup request: not relevant ('-')
    Data: present (0)
    URB sec: 1530496825
    URB usec: 274722
    URB status: Operation now in progress (-EINPROGRESS) (-115)
    URB length [bytes]: 2
    Data length [bytes]: 2
    [bInterfaceClass: Unknown (0xffff)]
    Unused Setup Header
    Interval: 0
    Start frame: 0
    Copy of Transfer Flags: 0x00000000
    Number of ISO descriptors: 0
Leftover Capture Data: 1b05

0000  40 88 ab 41 fc 89 ff ff 53 03 01 03 03 00 2d 00   @..A....S.....-.
0010  39 87 39 5b 00 00 00 00 22 31 04 00 8d ff ff ff   9.9[...."1......
0020  02 00 00 00 02 00 00 00 00 00 00 00 00 00 00 00   ................
0030  00 00 00 00 00 00 00 00 00 00 00 00 00 00 00 00   ................
0040  1b 05                                             ..

Frame 155: 66 bytes on wire (528 bits), 66 bytes captured (528 bits) on interface 0
    Interface id: 0 (unknown)
        Interface name: unknown
    Encapsulation type: USB packets with Linux header and padding (115)
    Arrival Time: Jul  1, 2018 22:00:25.365186000 EDT
    [Time shift for this packet: 0.000000000 seconds]
    Epoch Time: 1530496825.365186000 seconds
    [Time delta from previous captured frame: 0.090464000 seconds]
    [Time delta from previous displayed frame: 0.090464000 seconds]
    [Time since reference or first frame: 395.842935000 seconds]
    Frame Number: 155
    Frame Length: 66 bytes (528 bits)
    Capture Length: 66 bytes (528 bits)
    [Frame is marked: False]
    [Frame is ignored: False]
    [Protocols in frame: usb]
USB URB
    [Source: 3.3.2]
    [Destination: host]
    URB id: 0xffff89fc41ab8540
    URB type: URB_COMPLETE ('C')
    URB transfer type: URB_BULK (0x03)
    Endpoint: 0x82, Direction: IN
        1... .... = Direction: IN (1)
        .... 0010 = Endpoint number: 2
    Device: 3
    URB bus id: 3
    Device setup request: not relevant ('-')
    Data: present (0)
    URB sec: 1530496825
    URB usec: 365186
    URB status: Remote I/O error (-EREMOTEIO) (-121)
    URB length [bytes]: 2
    Data length [bytes]: 2
    [bInterfaceClass: Unknown (0xffff)]
    Unused Setup Header
    Interval: 0
    Start frame: 0
    Copy of Transfer Flags: 0x00000201
    Number of ISO descriptors: 0
Leftover Capture Data: 3003

0000  40 85 ab 41 fc 89 ff ff 43 03 82 03 03 00 2d 00   @..A....C.....-.
0010  39 87 39 5b 00 00 00 00 82 92 05 00 87 ff ff ff   9.9[............
0020  02 00 00 00 02 00 00 00 00 00 00 00 00 00 00 00   ................
0030  00 00 00 00 00 00 00 00 01 02 00 00 00 00 00 00   ................
0040  30 03                                             0.

Frame 156: 66 bytes on wire (528 bits), 66 bytes captured (528 bits) on interface 0
    Interface id: 0 (unknown)
        Interface name: unknown
    Encapsulation type: USB packets with Linux header and padding (115)
    Arrival Time: Jul  1, 2018 22:00:25.623896000 EDT
    [Time shift for this packet: 0.000000000 seconds]
    Epoch Time: 1530496825.623896000 seconds
    [Time delta from previous captured frame: 0.258710000 seconds]
    [Time delta from previous displayed frame: 0.258710000 seconds]
    [Time since reference or first frame: 396.101645000 seconds]
    Frame Number: 156
    Frame Length: 66 bytes (528 bits)
    Capture Length: 66 bytes (528 bits)
    [Frame is marked: False]
    [Frame is ignored: False]
    [Protocols in frame: usb]
USB URB
    [Source: host]
    [Destination: 3.3.1]
    URB id: 0xffff89fc41ab8e40
    URB type: URB_SUBMIT ('S')
    URB transfer type: URB_BULK (0x03)
    Endpoint: 0x01, Direction: OUT
        0... .... = Direction: OUT (0)
        .... 0001 = Endpoint number: 1
    Device: 3
    URB bus id: 3
    Device setup request: not relevant ('-')
    Data: present (0)
    URB sec: 1530496825
    URB usec: 623896
    URB status: Operation now in progress (-EINPROGRESS) (-115)
    URB length [bytes]: 2
    Data length [bytes]: 2
    [bInterfaceClass: Unknown (0xffff)]
    Unused Setup Header
    Interval: 0
    Start frame: 0
    Copy of Transfer Flags: 0x00000000
    Number of ISO descriptors: 0
Leftover Capture Data: 1b05

0000  40 8e ab 41 fc 89 ff ff 53 03 01 03 03 00 2d 00   @..A....S.....-.
0010  39 87 39 5b 00 00 00 00 18 85 09 00 8d ff ff ff   9.9[............
0020  02 00 00 00 02 00 00 00 00 00 00 00 00 00 00 00   ................
0030  00 00 00 00 00 00 00 00 00 00 00 00 00 00 00 00   ................
0040  1b 05                                             ..

Frame 157: 66 bytes on wire (528 bits), 66 bytes captured (528 bits) on interface 0
    Interface id: 0 (unknown)
        Interface name: unknown
    Encapsulation type: USB packets with Linux header and padding (115)
    Arrival Time: Jul  1, 2018 22:00:25.775199000 EDT
    [Time shift for this packet: 0.000000000 seconds]
    Epoch Time: 1530496825.775199000 seconds
    [Time delta from previous captured frame: 0.151303000 seconds]
    [Time delta from previous displayed frame: 0.151303000 seconds]
    [Time since reference or first frame: 396.252948000 seconds]
    Frame Number: 157
    Frame Length: 66 bytes (528 bits)
    Capture Length: 66 bytes (528 bits)
    [Frame is marked: False]
    [Frame is ignored: False]
    [Protocols in frame: usb]
USB URB
    [Source: 3.3.2]
    [Destination: host]
    URB id: 0xffff89fc41ab8c00
    URB type: URB_COMPLETE ('C')
    URB transfer type: URB_BULK (0x03)
    Endpoint: 0x82, Direction: IN
        1... .... = Direction: IN (1)
        .... 0010 = Endpoint number: 2
    Device: 3
    URB bus id: 3
    Device setup request: not relevant ('-')
    Data: present (0)
    URB sec: 1530496825
    URB usec: 775199
    URB status: Remote I/O error (-EREMOTEIO) (-121)
    URB length [bytes]: 2
    Data length [bytes]: 2
    [bInterfaceClass: Unknown (0xffff)]
    Unused Setup Header
    Interval: 0
    Start frame: 0
    Copy of Transfer Flags: 0x00000201
    Number of ISO descriptors: 0
Leftover Capture Data: 3003

0000  00 8c ab 41 fc 89 ff ff 43 03 82 03 03 00 2d 00   ...A....C.....-.
0010  39 87 39 5b 00 00 00 00 1f d4 0b 00 87 ff ff ff   9.9[............
0020  02 00 00 00 02 00 00 00 00 00 00 00 00 00 00 00   ................
0030  00 00 00 00 00 00 00 00 01 02 00 00 00 00 00 00   ................
0040  30 03                                             0.

Frame 158: 66 bytes on wire (528 bits), 66 bytes captured (528 bits) on interface 0
    Interface id: 0 (unknown)
        Interface name: unknown
    Encapsulation type: USB packets with Linux header and padding (115)
    Arrival Time: Jul  1, 2018 22:00:26.154242000 EDT
    [Time shift for this packet: 0.000000000 seconds]
    Epoch Time: 1530496826.154242000 seconds
    [Time delta from previous captured frame: 0.379043000 seconds]
    [Time delta from previous displayed frame: 0.379043000 seconds]
    [Time since reference or first frame: 396.631991000 seconds]
    Frame Number: 158
    Frame Length: 66 bytes (528 bits)
    Capture Length: 66 bytes (528 bits)
    [Frame is marked: False]
    [Frame is ignored: False]
    [Protocols in frame: usb]
USB URB
    [Source: host]
    [Destination: 3.3.1]
    URB id: 0xffff89fc41ab8780
    URB type: URB_SUBMIT ('S')
    URB transfer type: URB_BULK (0x03)
    Endpoint: 0x01, Direction: OUT
        0... .... = Direction: OUT (0)
        .... 0001 = Endpoint number: 1
    Device: 3
    URB bus id: 3
    Device setup request: not relevant ('-')
    Data: present (0)
    URB sec: 1530496826
    URB usec: 154242
    URB status: Operation now in progress (-EINPROGRESS) (-115)
    URB length [bytes]: 2
    Data length [bytes]: 2
    [bInterfaceClass: Unknown (0xffff)]
    Unused Setup Header
    Interval: 0
    Start frame: 0
    Copy of Transfer Flags: 0x00000000
    Number of ISO descriptors: 0
Leftover Capture Data: 1b05

0000  80 87 ab 41 fc 89 ff ff 53 03 01 03 03 00 2d 00   ...A....S.....-.
0010  3a 87 39 5b 00 00 00 00 82 5a 02 00 8d ff ff ff   :.9[.....Z......
0020  02 00 00 00 02 00 00 00 00 00 00 00 00 00 00 00   ................
0030  00 00 00 00 00 00 00 00 00 00 00 00 00 00 00 00   ................
0040  1b 05                                             ..

Frame 159: 66 bytes on wire (528 bits), 66 bytes captured (528 bits) on interface 0
    Interface id: 0 (unknown)
        Interface name: unknown
    Encapsulation type: USB packets with Linux header and padding (115)
    Arrival Time: Jul  1, 2018 22:00:26.267218000 EDT
    [Time shift for this packet: 0.000000000 seconds]
    Epoch Time: 1530496826.267218000 seconds
    [Time delta from previous captured frame: 0.112976000 seconds]
    [Time delta from previous displayed frame: 0.112976000 seconds]
    [Time since reference or first frame: 396.744967000 seconds]
    Frame Number: 159
    Frame Length: 66 bytes (528 bits)
    Capture Length: 66 bytes (528 bits)
    [Frame is marked: False]
    [Frame is ignored: False]
    [Protocols in frame: usb]
USB URB
    [Source: 3.3.2]
    [Destination: host]
    URB id: 0xffff89fd46e3f300
    URB type: URB_COMPLETE ('C')
    URB transfer type: URB_BULK (0x03)
    Endpoint: 0x82, Direction: IN
        1... .... = Direction: IN (1)
        .... 0010 = Endpoint number: 2
    Device: 3
    URB bus id: 3
    Device setup request: not relevant ('-')
    Data: present (0)
    URB sec: 1530496826
    URB usec: 267218
    URB status: Remote I/O error (-EREMOTEIO) (-121)
    URB length [bytes]: 2
    Data length [bytes]: 2
    [bInterfaceClass: Unknown (0xffff)]
    Unused Setup Header
    Interval: 0
    Start frame: 0
    Copy of Transfer Flags: 0x00000201
    Number of ISO descriptors: 0
Leftover Capture Data: 3003

0000  00 f3 e3 46 fd 89 ff ff 43 03 82 03 03 00 2d 00   ...F....C.....-.
0010  3a 87 39 5b 00 00 00 00 d2 13 04 00 87 ff ff ff   :.9[............
0020  02 00 00 00 02 00 00 00 00 00 00 00 00 00 00 00   ................
0030  00 00 00 00 00 00 00 00 01 02 00 00 00 00 00 00   ................
0040  30 03                                             0.

Frame 160: 66 bytes on wire (528 bits), 66 bytes captured (528 bits) on interface 0
    Interface id: 0 (unknown)
        Interface name: unknown
    Encapsulation type: USB packets with Linux header and padding (115)
    Arrival Time: Jul  1, 2018 22:00:26.665065000 EDT
    [Time shift for this packet: 0.000000000 seconds]
    Epoch Time: 1530496826.665065000 seconds
    [Time delta from previous captured frame: 0.397847000 seconds]
    [Time delta from previous displayed frame: 0.397847000 seconds]
    [Time since reference or first frame: 397.142814000 seconds]
    Frame Number: 160
    Frame Length: 66 bytes (528 bits)
    Capture Length: 66 bytes (528 bits)
    [Frame is marked: False]
    [Frame is ignored: False]
    [Protocols in frame: usb]
USB URB
    [Source: host]
    [Destination: 3.3.1]
    URB id: 0xffff89fc41ab8a80
    URB type: URB_SUBMIT ('S')
    URB transfer type: URB_BULK (0x03)
    Endpoint: 0x01, Direction: OUT
        0... .... = Direction: OUT (0)
        .... 0001 = Endpoint number: 1
    Device: 3
    URB bus id: 3
    Device setup request: not relevant ('-')
    Data: present (0)
    URB sec: 1530496826
    URB usec: 665065
    URB status: Operation now in progress (-EINPROGRESS) (-115)
    URB length [bytes]: 2
    Data length [bytes]: 2
    [bInterfaceClass: Unknown (0xffff)]
    Unused Setup Header
    Interval: 0
    Start frame: 0
    Copy of Transfer Flags: 0x00000000
    Number of ISO descriptors: 0
Leftover Capture Data: 1b05

0000  80 8a ab 41 fc 89 ff ff 53 03 01 03 03 00 2d 00   ...A....S.....-.
0010  3a 87 39 5b 00 00 00 00 e9 25 0a 00 8d ff ff ff   :.9[.....%......
0020  02 00 00 00 02 00 00 00 00 00 00 00 00 00 00 00   ................
0030  00 00 00 00 00 00 00 00 00 00 00 00 00 00 00 00   ................
0040  1b 05                                             ..

Frame 161: 66 bytes on wire (528 bits), 66 bytes captured (528 bits) on interface 0
    Interface id: 0 (unknown)
        Interface name: unknown
    Encapsulation type: USB packets with Linux header and padding (115)
    Arrival Time: Jul  1, 2018 22:00:26.759254000 EDT
    [Time shift for this packet: 0.000000000 seconds]
    Epoch Time: 1530496826.759254000 seconds
    [Time delta from previous captured frame: 0.094189000 seconds]
    [Time delta from previous displayed frame: 0.094189000 seconds]
    [Time since reference or first frame: 397.237003000 seconds]
    Frame Number: 161
    Frame Length: 66 bytes (528 bits)
    Capture Length: 66 bytes (528 bits)
    [Frame is marked: False]
    [Frame is ignored: False]
    [Protocols in frame: usb]
USB URB
    [Source: 3.3.2]
    [Destination: host]
    URB id: 0xffff89fd46e3fa80
    URB type: URB_COMPLETE ('C')
    URB transfer type: URB_BULK (0x03)
    Endpoint: 0x82, Direction: IN
        1... .... = Direction: IN (1)
        .... 0010 = Endpoint number: 2
    Device: 3
    URB bus id: 3
    Device setup request: not relevant ('-')
    Data: present (0)
    URB sec: 1530496826
    URB usec: 759254
    URB status: Remote I/O error (-EREMOTEIO) (-121)
    URB length [bytes]: 2
    Data length [bytes]: 2
    [bInterfaceClass: Unknown (0xffff)]
    Unused Setup Header
    Interval: 0
    Start frame: 0
    Copy of Transfer Flags: 0x00000201
    Number of ISO descriptors: 0
Leftover Capture Data: 3003

0000  80 fa e3 46 fd 89 ff ff 43 03 82 03 03 00 2d 00   ...F....C.....-.
0010  3a 87 39 5b 00 00 00 00 d6 95 0b 00 87 ff ff ff   :.9[............
0020  02 00 00 00 02 00 00 00 00 00 00 00 00 00 00 00   ................
0030  00 00 00 00 00 00 00 00 01 02 00 00 00 00 00 00   ................
0040  30 03                                             0.

Frame 162: 66 bytes on wire (528 bits), 66 bytes captured (528 bits) on interface 0
    Interface id: 0 (unknown)
        Interface name: unknown
    Encapsulation type: USB packets with Linux header and padding (115)
    Arrival Time: Jul  1, 2018 22:00:27.175496000 EDT
    [Time shift for this packet: 0.000000000 seconds]
    Epoch Time: 1530496827.175496000 seconds
    [Time delta from previous captured frame: 0.416242000 seconds]
    [Time delta from previous displayed frame: 0.416242000 seconds]
    [Time since reference or first frame: 397.653245000 seconds]
    Frame Number: 162
    Frame Length: 66 bytes (528 bits)
    Capture Length: 66 bytes (528 bits)
    [Frame is marked: False]
    [Frame is ignored: False]
    [Protocols in frame: usb]
USB URB
    [Source: host]
    [Destination: 3.3.1]
    URB id: 0xffff89fd46e3fa80
    URB type: URB_SUBMIT ('S')
    URB transfer type: URB_BULK (0x03)
    Endpoint: 0x01, Direction: OUT
        0... .... = Direction: OUT (0)
        .... 0001 = Endpoint number: 1
    Device: 3
    URB bus id: 3
    Device setup request: not relevant ('-')
    Data: present (0)
    URB sec: 1530496827
    URB usec: 175496
    URB status: Operation now in progress (-EINPROGRESS) (-115)
    URB length [bytes]: 2
    Data length [bytes]: 2
    [bInterfaceClass: Unknown (0xffff)]
    Unused Setup Header
    Interval: 0
    Start frame: 0
    Copy of Transfer Flags: 0x00000000
    Number of ISO descriptors: 0
Leftover Capture Data: 1b05

0000  80 fa e3 46 fd 89 ff ff 53 03 01 03 03 00 2d 00   ...F....S.....-.
0010  3b 87 39 5b 00 00 00 00 88 ad 02 00 8d ff ff ff   ;.9[............
0020  02 00 00 00 02 00 00 00 00 00 00 00 00 00 00 00   ................
0030  00 00 00 00 00 00 00 00 00 00 00 00 00 00 00 00   ................
0040  1b 05                                             ..

Frame 163: 66 bytes on wire (528 bits), 66 bytes captured (528 bits) on interface 0
    Interface id: 0 (unknown)
        Interface name: unknown
    Encapsulation type: USB packets with Linux header and padding (115)
    Arrival Time: Jul  1, 2018 22:00:27.333198000 EDT
    [Time shift for this packet: 0.000000000 seconds]
    Epoch Time: 1530496827.333198000 seconds
    [Time delta from previous captured frame: 0.157702000 seconds]
    [Time delta from previous displayed frame: 0.157702000 seconds]
    [Time since reference or first frame: 397.810947000 seconds]
    Frame Number: 163
    Frame Length: 66 bytes (528 bits)
    Capture Length: 66 bytes (528 bits)
    [Frame is marked: False]
    [Frame is ignored: False]
    [Protocols in frame: usb]
USB URB
    [Source: 3.3.2]
    [Destination: host]
    URB id: 0xffff89fc41ab8d80
    URB type: URB_COMPLETE ('C')
    URB transfer type: URB_BULK (0x03)
    Endpoint: 0x82, Direction: IN
        1... .... = Direction: IN (1)
        .... 0010 = Endpoint number: 2
    Device: 3
    URB bus id: 3
    Device setup request: not relevant ('-')
    Data: present (0)
    URB sec: 1530496827
    URB usec: 333198
    URB status: Remote I/O error (-EREMOTEIO) (-121)
    URB length [bytes]: 2
    Data length [bytes]: 2
    [bInterfaceClass: Unknown (0xffff)]
    Unused Setup Header
    Interval: 0
    Start frame: 0
    Copy of Transfer Flags: 0x00000201
    Number of ISO descriptors: 0
Leftover Capture Data: 3003

0000  80 8d ab 41 fc 89 ff ff 43 03 82 03 03 00 2d 00   ...A....C.....-.
0010  3b 87 39 5b 00 00 00 00 8e 15 05 00 87 ff ff ff   ;.9[............
0020  02 00 00 00 02 00 00 00 00 00 00 00 00 00 00 00   ................
0030  00 00 00 00 00 00 00 00 01 02 00 00 00 00 00 00   ................
0040  30 03                                             0.

Frame 164: 66 bytes on wire (528 bits), 66 bytes captured (528 bits) on interface 0
    Interface id: 0 (unknown)
        Interface name: unknown
    Encapsulation type: USB packets with Linux header and padding (115)
    Arrival Time: Jul  1, 2018 22:00:27.685893000 EDT
    [Time shift for this packet: 0.000000000 seconds]
    Epoch Time: 1530496827.685893000 seconds
    [Time delta from previous captured frame: 0.352695000 seconds]
    [Time delta from previous displayed frame: 0.352695000 seconds]
    [Time since reference or first frame: 398.163642000 seconds]
    Frame Number: 164
    Frame Length: 66 bytes (528 bits)
    Capture Length: 66 bytes (528 bits)
    [Frame is marked: False]
    [Frame is ignored: False]
    [Protocols in frame: usb]
USB URB
    [Source: host]
    [Destination: 3.3.1]
    URB id: 0xffff89fd46e3fa80
    URB type: URB_SUBMIT ('S')
    URB transfer type: URB_BULK (0x03)
    Endpoint: 0x01, Direction: OUT
        0... .... = Direction: OUT (0)
        .... 0001 = Endpoint number: 1
    Device: 3
    URB bus id: 3
    Device setup request: not relevant ('-')
    Data: present (0)
    URB sec: 1530496827
    URB usec: 685893
    URB status: Operation now in progress (-EINPROGRESS) (-115)
    URB length [bytes]: 2
    Data length [bytes]: 2
    [bInterfaceClass: Unknown (0xffff)]
    Unused Setup Header
    Interval: 0
    Start frame: 0
    Copy of Transfer Flags: 0x00000000
    Number of ISO descriptors: 0
Leftover Capture Data: 1b05

0000  80 fa e3 46 fd 89 ff ff 53 03 01 03 03 00 2d 00   ...F....S.....-.
0010  3b 87 39 5b 00 00 00 00 45 77 0a 00 8d ff ff ff   ;.9[....Ew......
0020  02 00 00 00 02 00 00 00 00 00 00 00 00 00 00 00   ................
0030  00 00 00 00 00 00 00 00 00 00 00 00 00 00 00 00   ................
0040  1b 05                                             ..

Frame 165: 66 bytes on wire (528 bits), 66 bytes captured (528 bits) on interface 0
    Interface id: 0 (unknown)
        Interface name: unknown
    Encapsulation type: USB packets with Linux header and padding (115)
    Arrival Time: Jul  1, 2018 22:00:27.825334000 EDT
    [Time shift for this packet: 0.000000000 seconds]
    Epoch Time: 1530496827.825334000 seconds
    [Time delta from previous captured frame: 0.139441000 seconds]
    [Time delta from previous displayed frame: 0.139441000 seconds]
    [Time since reference or first frame: 398.303083000 seconds]
    Frame Number: 165
    Frame Length: 66 bytes (528 bits)
    Capture Length: 66 bytes (528 bits)
    [Frame is marked: False]
    [Frame is ignored: False]
    [Protocols in frame: usb]
USB URB
    [Source: 3.3.2]
    [Destination: host]
    URB id: 0xffff89fd4d50dcc0
    URB type: URB_COMPLETE ('C')
    URB transfer type: URB_BULK (0x03)
    Endpoint: 0x82, Direction: IN
        1... .... = Direction: IN (1)
        .... 0010 = Endpoint number: 2
    Device: 3
    URB bus id: 3
    Device setup request: not relevant ('-')
    Data: present (0)
    URB sec: 1530496827
    URB usec: 825334
    URB status: Remote I/O error (-EREMOTEIO) (-121)
    URB length [bytes]: 2
    Data length [bytes]: 2
    [bInterfaceClass: Unknown (0xffff)]
    Unused Setup Header
    Interval: 0
    Start frame: 0
    Copy of Transfer Flags: 0x00000201
    Number of ISO descriptors: 0
Leftover Capture Data: 3003

0000  c0 dc 50 4d fd 89 ff ff 43 03 82 03 03 00 2d 00   ..PM....C.....-.
0010  3b 87 39 5b 00 00 00 00 f6 97 0c 00 87 ff ff ff   ;.9[............
0020  02 00 00 00 02 00 00 00 00 00 00 00 00 00 00 00   ................
0030  00 00 00 00 00 00 00 00 01 02 00 00 00 00 00 00   ................
0040  30 03                                             0.

Frame 166: 66 bytes on wire (528 bits), 66 bytes captured (528 bits) on interface 0
    Interface id: 0 (unknown)
        Interface name: unknown
    Encapsulation type: USB packets with Linux header and padding (115)
    Arrival Time: Jul  1, 2018 22:00:28.195786000 EDT
    [Time shift for this packet: 0.000000000 seconds]
    Epoch Time: 1530496828.195786000 seconds
    [Time delta from previous captured frame: 0.370452000 seconds]
    [Time delta from previous displayed frame: 0.370452000 seconds]
    [Time since reference or first frame: 398.673535000 seconds]
    Frame Number: 166
    Frame Length: 66 bytes (528 bits)
    Capture Length: 66 bytes (528 bits)
    [Frame is marked: False]
    [Frame is ignored: False]
    [Protocols in frame: usb]
USB URB
    [Source: host]
    [Destination: 3.3.1]
    URB id: 0xffff89fd46e3f900
    URB type: URB_SUBMIT ('S')
    URB transfer type: URB_BULK (0x03)
    Endpoint: 0x01, Direction: OUT
        0... .... = Direction: OUT (0)
        .... 0001 = Endpoint number: 1
    Device: 3
    URB bus id: 3
    Device setup request: not relevant ('-')
    Data: present (0)
    URB sec: 1530496828
    URB usec: 195786
    URB status: Operation now in progress (-EINPROGRESS) (-115)
    URB length [bytes]: 2
    Data length [bytes]: 2
    [bInterfaceClass: Unknown (0xffff)]
    Unused Setup Header
    Interval: 0
    Start frame: 0
    Copy of Transfer Flags: 0x00000000
    Number of ISO descriptors: 0
Leftover Capture Data: 1b05

0000  00 f9 e3 46 fd 89 ff ff 53 03 01 03 03 00 2d 00   ...F....S.....-.
0010  3c 87 39 5b 00 00 00 00 ca fc 02 00 8d ff ff ff   <.9[............
0020  02 00 00 00 02 00 00 00 00 00 00 00 00 00 00 00   ................
0030  00 00 00 00 00 00 00 00 00 00 00 00 00 00 00 00   ................
0040  1b 05                                             ..

Frame 167: 66 bytes on wire (528 bits), 66 bytes captured (528 bits) on interface 0
    Interface id: 0 (unknown)
        Interface name: unknown
    Encapsulation type: USB packets with Linux header and padding (115)
    Arrival Time: Jul  1, 2018 22:00:28.317186000 EDT
    [Time shift for this packet: 0.000000000 seconds]
    Epoch Time: 1530496828.317186000 seconds
    [Time delta from previous captured frame: 0.121400000 seconds]
    [Time delta from previous displayed frame: 0.121400000 seconds]
    [Time since reference or first frame: 398.794935000 seconds]
    Frame Number: 167
    Frame Length: 66 bytes (528 bits)
    Capture Length: 66 bytes (528 bits)
    [Frame is marked: False]
    [Frame is ignored: False]
    [Protocols in frame: usb]
USB URB
    [Source: 3.3.2]
    [Destination: host]
    URB id: 0xffff89fd46e3fa80
    URB type: URB_COMPLETE ('C')
    URB transfer type: URB_BULK (0x03)
    Endpoint: 0x82, Direction: IN
        1... .... = Direction: IN (1)
        .... 0010 = Endpoint number: 2
    Device: 3
    URB bus id: 3
    Device setup request: not relevant ('-')
    Data: present (0)
    URB sec: 1530496828
    URB usec: 317186
    URB status: Remote I/O error (-EREMOTEIO) (-121)
    URB length [bytes]: 2
    Data length [bytes]: 2
    [bInterfaceClass: Unknown (0xffff)]
    Unused Setup Header
    Interval: 0
    Start frame: 0
    Copy of Transfer Flags: 0x00000201
    Number of ISO descriptors: 0
Leftover Capture Data: 3003

0000  80 fa e3 46 fd 89 ff ff 43 03 82 03 03 00 2d 00   ...F....C.....-.
0010  3c 87 39 5b 00 00 00 00 02 d7 04 00 87 ff ff ff   <.9[............
0020  02 00 00 00 02 00 00 00 00 00 00 00 00 00 00 00   ................
0030  00 00 00 00 00 00 00 00 01 02 00 00 00 00 00 00   ................
0040  30 03                                             0.

Frame 168: 66 bytes on wire (528 bits), 66 bytes captured (528 bits) on interface 0
    Interface id: 0 (unknown)
        Interface name: unknown
    Encapsulation type: USB packets with Linux header and padding (115)
    Arrival Time: Jul  1, 2018 22:00:28.686399000 EDT
    [Time shift for this packet: 0.000000000 seconds]
    Epoch Time: 1530496828.686399000 seconds
    [Time delta from previous captured frame: 0.369213000 seconds]
    [Time delta from previous displayed frame: 0.369213000 seconds]
    [Time since reference or first frame: 399.164148000 seconds]
    Frame Number: 168
    Frame Length: 66 bytes (528 bits)
    Capture Length: 66 bytes (528 bits)
    [Frame is marked: False]
    [Frame is ignored: False]
    [Protocols in frame: usb]
USB URB
    [Source: host]
    [Destination: 3.3.1]
    URB id: 0xffff89fc92459480
    URB type: URB_SUBMIT ('S')
    URB transfer type: URB_BULK (0x03)
    Endpoint: 0x01, Direction: OUT
        0... .... = Direction: OUT (0)
        .... 0001 = Endpoint number: 1
    Device: 3
    URB bus id: 3
    Device setup request: not relevant ('-')
    Data: present (0)
    URB sec: 1530496828
    URB usec: 686399
    URB status: Operation now in progress (-EINPROGRESS) (-115)
    URB length [bytes]: 2
    Data length [bytes]: 2
    [bInterfaceClass: Unknown (0xffff)]
    Unused Setup Header
    Interval: 0
    Start frame: 0
    Copy of Transfer Flags: 0x00000000
    Number of ISO descriptors: 0
Leftover Capture Data: 1b05

0000  80 94 45 92 fc 89 ff ff 53 03 01 03 03 00 2d 00   ..E.....S.....-.
0010  3c 87 39 5b 00 00 00 00 3f 79 0a 00 8d ff ff ff   <.9[....?y......
0020  02 00 00 00 02 00 00 00 00 00 00 00 00 00 00 00   ................
0030  00 00 00 00 00 00 00 00 00 00 00 00 00 00 00 00   ................
0040  1b 05                                             ..

Frame 169: 66 bytes on wire (528 bits), 66 bytes captured (528 bits) on interface 0
    Interface id: 0 (unknown)
        Interface name: unknown
    Encapsulation type: USB packets with Linux header and padding (115)
    Arrival Time: Jul  1, 2018 22:00:28.809319000 EDT
    [Time shift for this packet: 0.000000000 seconds]
    Epoch Time: 1530496828.809319000 seconds
    [Time delta from previous captured frame: 0.122920000 seconds]
    [Time delta from previous displayed frame: 0.122920000 seconds]
    [Time since reference or first frame: 399.287068000 seconds]
    Frame Number: 169
    Frame Length: 66 bytes (528 bits)
    Capture Length: 66 bytes (528 bits)
    [Frame is marked: False]
    [Frame is ignored: False]
    [Protocols in frame: usb]
USB URB
    [Source: 3.3.2]
    [Destination: host]
    URB id: 0xffff89fc924593c0
    URB type: URB_COMPLETE ('C')
    URB transfer type: URB_BULK (0x03)
    Endpoint: 0x82, Direction: IN
        1... .... = Direction: IN (1)
        .... 0010 = Endpoint number: 2
    Device: 3
    URB bus id: 3
    Device setup request: not relevant ('-')
    Data: present (0)
    URB sec: 1530496828
    URB usec: 809319
    URB status: Remote I/O error (-EREMOTEIO) (-121)
    URB length [bytes]: 2
    Data length [bytes]: 2
    [bInterfaceClass: Unknown (0xffff)]
    Unused Setup Header
    Interval: 0
    Start frame: 0
    Copy of Transfer Flags: 0x00000201
    Number of ISO descriptors: 0
Leftover Capture Data: 3003

0000  c0 93 45 92 fc 89 ff ff 43 03 82 03 03 00 2d 00   ..E.....C.....-.
0010  3c 87 39 5b 00 00 00 00 67 59 0c 00 87 ff ff ff   <.9[....gY......
0020  02 00 00 00 02 00 00 00 00 00 00 00 00 00 00 00   ................
0030  00 00 00 00 00 00 00 00 01 02 00 00 00 00 00 00   ................
0040  30 03                                             0.

Frame 170: 66 bytes on wire (528 bits), 66 bytes captured (528 bits) on interface 0
    Interface id: 0 (unknown)
        Interface name: unknown
    Encapsulation type: USB packets with Linux header and padding (115)
    Arrival Time: Jul  1, 2018 22:00:29.197137000 EDT
    [Time shift for this packet: 0.000000000 seconds]
    Epoch Time: 1530496829.197137000 seconds
    [Time delta from previous captured frame: 0.387818000 seconds]
    [Time delta from previous displayed frame: 0.387818000 seconds]
    [Time since reference or first frame: 399.674886000 seconds]
    Frame Number: 170
    Frame Length: 66 bytes (528 bits)
    Capture Length: 66 bytes (528 bits)
    [Frame is marked: False]
    [Frame is ignored: False]
    [Protocols in frame: usb]
USB URB
    [Source: host]
    [Destination: 3.3.1]
    URB id: 0xffff89fd46e3fd80
    URB type: URB_SUBMIT ('S')
    URB transfer type: URB_BULK (0x03)
    Endpoint: 0x01, Direction: OUT
        0... .... = Direction: OUT (0)
        .... 0001 = Endpoint number: 1
    Device: 3
    URB bus id: 3
    Device setup request: not relevant ('-')
    Data: present (0)
    URB sec: 1530496829
    URB usec: 197137
    URB status: Operation now in progress (-EINPROGRESS) (-115)
    URB length [bytes]: 2
    Data length [bytes]: 2
    [bInterfaceClass: Unknown (0xffff)]
    Unused Setup Header
    Interval: 0
    Start frame: 0
    Copy of Transfer Flags: 0x00000000
    Number of ISO descriptors: 0
Leftover Capture Data: 1b05

0000  80 fd e3 46 fd 89 ff ff 53 03 01 03 03 00 2d 00   ...F....S.....-.
0010  3d 87 39 5b 00 00 00 00 11 02 03 00 8d ff ff ff   =.9[............
0020  02 00 00 00 02 00 00 00 00 00 00 00 00 00 00 00   ................
0030  00 00 00 00 00 00 00 00 00 00 00 00 00 00 00 00   ................
0040  1b 05                                             ..

Frame 171: 66 bytes on wire (528 bits), 66 bytes captured (528 bits) on interface 0
    Interface id: 0 (unknown)
        Interface name: unknown
    Encapsulation type: USB packets with Linux header and padding (115)
    Arrival Time: Jul  1, 2018 22:00:29.301225000 EDT
    [Time shift for this packet: 0.000000000 seconds]
    Epoch Time: 1530496829.301225000 seconds
    [Time delta from previous captured frame: 0.104088000 seconds]
    [Time delta from previous displayed frame: 0.104088000 seconds]
    [Time since reference or first frame: 399.778974000 seconds]
    Frame Number: 171
    Frame Length: 66 bytes (528 bits)
    Capture Length: 66 bytes (528 bits)
    [Frame is marked: False]
    [Frame is ignored: False]
    [Protocols in frame: usb]
USB URB
    [Source: 3.3.2]
    [Destination: host]
    URB id: 0xffff89fd46e3f900
    URB type: URB_COMPLETE ('C')
    URB transfer type: URB_BULK (0x03)
    Endpoint: 0x82, Direction: IN
        1... .... = Direction: IN (1)
        .... 0010 = Endpoint number: 2
    Device: 3
    URB bus id: 3
    Device setup request: not relevant ('-')
    Data: present (0)
    URB sec: 1530496829
    URB usec: 301225
    URB status: Remote I/O error (-EREMOTEIO) (-121)
    URB length [bytes]: 2
    Data length [bytes]: 2
    [bInterfaceClass: Unknown (0xffff)]
    Unused Setup Header
    Interval: 0
    Start frame: 0
    Copy of Transfer Flags: 0x00000201
    Number of ISO descriptors: 0
Leftover Capture Data: 3003

0000  00 f9 e3 46 fd 89 ff ff 43 03 82 03 03 00 2d 00   ...F....C.....-.
0010  3d 87 39 5b 00 00 00 00 a9 98 04 00 87 ff ff ff   =.9[............
0020  02 00 00 00 02 00 00 00 00 00 00 00 00 00 00 00   ................
0030  00 00 00 00 00 00 00 00 01 02 00 00 00 00 00 00   ................
0040  30 03                                             0.

